Input URL,Title,Link,Published,Description,Source
https://news-medical.net,Scientists confirm neurobiochemical link between dopamine and cognitive flexibility,https://news-medical.net/news/20250328/Scientists-confirm-neurobiochemical-link-between-dopamine-and-cognitive-flexibility.aspx,"Fri, 28 Mar 2025 00:00:00 GMT","For the first time, scientists have confirmed a neurobiochemical link between dopamine and cognitive flexibility, according to new research published in the March issue of The Journal of Nuclear Medicine. PET imaging shows that the brain increases dopamine production when completing cognitively demanding tasks, and that the more dopamine released, the more efficiently the tasks are completed. Armed with this information, physicians may soon be able to develop more precise treatment strategies for neurological and psychiatric disorders.

Cognitive flexibility is the ability to adapt one's thinking and behavior appropriately to a changing environment and is considered an aspect of executive function. Cognitive flexibility differs among people and is reported to be impaired in several psychiatric and neurologic disorders, such as depression, posttraumatic stress disorder, addiction, anxiety disorder, schizophrenia, Parkinson's disease, and attention-deficit/hyperactivity disorder.

At the neurotransmitter level, the dopamine system has been linked to cognitive flexibility. A direct neurochemical response to cognitive flexibility, however, has yet to be shown. In our study, we sought to examine the release of dopamine in real-time by performing PET scans while individuals completed behavioral flexibility tasks."" Isabelle Miederer, PhD, associate professor in experimental nuclear medicine in the department of nuclear medicine at University Medical Center Mainz, Germany

Eighteen participants were scanned with the D 2/3 receptor ligand 18F-fallypride in a two-part block study design. In the first part, participants performed two tasks consecutively on a computer screen without rule switching while undergoing PET imaging. In the second part of the PET scan, participants had to switch flexibly between two task rules. Dopamine release was calculated using the linearized simplified reference region model which compares the two task blocks with each other.

PET imaging analysis showed a displacement of 18F-fallypride in the ventromedial prefrontal cortex during the task switching (higher cognitive demand) part of the study, which is assumed to be the release of dopamine. Results also showed that the greater dopamine release, the more efficient participants were in switching between tasks.

""The present findings emphasize the significance of dopamine in cognitive flexibility,"" said Mathias Schreckenberger, MD, head of the department of nuclear medicine at University Medical Center Mainz. ""They are consistent with the results of previous clinical studies indicating that dopamine deficiency in disorders such as Parkinson's disease may cause behavioral deficits in cognitive flexibility.""

""Looking forward, it is expected that the results of the study will contribute to a better understanding of the neurochemical mechanisms underlying cognitive flexibility and thus facilitate the development of treatment strategies to improve flexibility in neurological and psychiatric disorders,"" he continued.",news-medical
https://news-medical.net,Material from nasal lavage provides a basis for assessing COPD,https://news-medical.net/news/20250328/Protein-In-The-Nose-Provides-Information-About-COPD.aspx,"Fri, 28 Mar 2025 00:00:00 GMT","Early diagnosis of COPD, chronic obstructive pulmonary disease, increases the quality of life of the patient and the efficacy of available treatments. Researchers at Karolinska Institutet in Sweden have now shown that material from nasal lavage provides a basis for assessing COPD. The study, which has been published in the Journal of Allergy and Clinical Immunology, could lead to a simple diagnostic method for early assessment of COPD.

Chronic obstructive pulmonary disease (COPD) affects ten percent of the population and is the fourth most common cause of death in the world. The disease is mainly caused by smoke from biomass and the patient group is very heterogeneous in terms of symptoms and prognosis.



This means that the medical needs vary greatly, while today's examination methods are neither sufficient nor useful for assessing the large number of patients. Therefore, simple and safe methods that work at the individual level are needed.

Immune cells in the nose

Researchers at Karolinska Institutet and Karolinska University Hospital have now shown that elevated levels of the protein interleukin-26 (IL-26) in the nose of smokers with and without COPD can be used to assess patients with an early phase of the disease.



IL-26 is a so-called cytokine that is important for cell communication in the immune system. An interesting property of IL-26 is that this cytokine has a direct inhibitory effect on bacteria and viruses.



Cytokines can influence inflammation and immune responses, and IL-26 has previously been linked to various inflammatory diseases, including COPD. In COPD, the levels of IL-26 in the lower respiratory tract have been shown to be elevated.



In the current study, the researchers have focused on understanding how IL-26 is produced in the nose of smokers and what the levels say about the individual COPD patient.

We have discovered that IL-26 is produced in greater amounts in the nose of smokers with COPD compared to non-smokers, while smokers without COPD showed a tendency towards increased levels. This suggests that IL-26 may be an important factor in the inflammatory process underlying COPD."" Julia Arebro, study's first author, researcher at the Department of Clinical Science, Intervention and Technology, Karolinska Institutet, and physician at Karolinska University Hospital

A simple nasal lavage

The study included 50 research participants; active habitual smokers with and without COPD, as well as a control group of healthy non-smokers. Patients with other lung diseases were excluded from the study.



Among other things, the study participants underwent a simple nasal lavage so that the researchers could analyse the presence of IL-26 in the nose. The measured levels were found to reflect inflammation of the lower respiratory tract but also symptoms and other clinical findings in COPD.



""This opens up an easier way to characterize COPD patients without having to examine their lower airways with methods that are resource-intensive and involve medical risks,"" says Julia Arebro.

New treatment strategies

The study also shows that T cells, a type of white blood cell in the immune system, are involved in the production of IL-26 in the nose.



""Our results support that IL-26 contributes to the chronic inflammation that is typical for COPD. This may open up for new treatment strategies that target IL-26 to reduce inflammation and improve the quality of life for patients with COPD,"" says Anders Lindén, professor at the Institute of Environmental Medicine, Karolinska Institutet, and senior physician at Karolinska University Hospital who has led the research team behind the study.



The study was conducted in patients with mild to moderate COPD. In a next step, the researchers are planning a similar study on COPD, but in later stages. If future work confirms current results, the researchers believe that the method for easily estimating patients with COPD can be implemented within the next few years.



The study was funded by the Swedish Heart-Lung Foundation, the Swedish Research Council, Region Stockholm (ALF funding), the Swedish Society for Respiratory Medicine, and AstraZeneca.",news-medical
https://news-medical.net,Lipid accumulation in tumors linked to therapy resistance in breast cancer,https://news-medical.net/news/20250328/Lipid-accumulation-in-tumors-linked-to-therapy-resistance-in-breast-cancer.aspx,"Fri, 28 Mar 2025 00:00:00 GMT","A new study published in the journal Immunity reveals a mechanism that allows triple negative breast cancer (TNBC) to develop resistance to therapy. Researchers at Baylor College of Medicine showed that lipid accumulation in tumor cells and nearby immune cells promotes immune suppression, but disrupting lipid formulation reverses treatment resistance and the immunosuppressive microenvironment.

Standard-of-care treatment for TNBC includes chemotherapy and immunotherapy. However, some initially responsive tumors still develop recurrences. Researchers studied mouse models and found that TNBC cells that survived treatment accumulated lipid droplets containing Omega-6 fatty acids. Single-cell RNA sequencing revealed that neutrophils, a type of white blood cell, near the tumor cells also accumulated these lipids.

""We found the tumor cells give the lipid droplets to surrounding neutrophils. This shifted the function of the neutrophils from antitumor to tumor promotion,"" said first author Dr. Liqun Yu, postdoctoral fellow in the Zhang lab at Baylor.

""The prevailing perspective in our field has focused on the role of fatty acid metabolism in regulating the immune response and therapeutic response. We found in this study that not only can fatty acids serve as an energy source, but they also are precursors of immunosuppressive signals the cancer cells can use to fight against our immune system,"" said corresponding author Dr. Xiang H.-F. Zhang, director of the Lester and Sue Smith Breast Center and professor of molecular and cellular biology at Baylor.

Researchers found they could reverse therapy resistance and the immunosuppressive microenvironment by disrupting lipid droplet formation. Blocking dietary intake of Omega-6 fatty acids also resensitized the tumors to chemotherapy and immunotherapy treatments.

We can advise patients to consume a diet low in Omega-6 fatty acids, which is not significantly different from the general advice to lower red meat, fat and sodium intake. We also are exploring therapeutic options to block fatty acid accumulation and immunosuppressive signals between the cancer cells and the neutrophils."" Zhang, William T. Butler, M.D., Endowed Chair for Distinguished Faculty and co-leader of the Breast Cancer Program at the Dan L Duncan Comprehensive Cancer Center at Baylor

Other contributors to this work include Keziah Liebenberg, Yichao Shen, Fengshuo Liu, Zhan Xu, Xiaoxin Hao, Ling Wu, Weijie Zhang, Hilda L. Chan, Bo Wei, Philip L. Lorenzi, Yang Gao, Igor Bado, Luis Becerra-Dominguez, Charlotte Helena Rivas, Sergio Aguirre, Bradley C. Pingel, Yi-Hsuan Wu, Yunfeng Ding, Jun Liu, David G. Edwards and Livia S. Eberlin.

This work is supported by the U.S. Department of Defense, National Cancer Institute, Breast Cancer Research Foundation, McNair Medical Institute, National Institutes of Health and Cancer Prevention and Research Institute of Texas.",news-medical
https://news-medical.net,Study finds 24-hour fasting cycles enhance libido in male mice,https://news-medical.net/news/20250328/Study-finds-24-hour-fasting-cycles-enhance-libido-in-male-mice.aspx,"Fri, 28 Mar 2025 00:00:00 GMT","Long-term fasting in 24-hour cycles increases the sex drive of male mice by lowering the concentration of the neurotransmitter serotonin in the brain. This effect is linked to a diet-induced deficiency of the precursor substance tryptophan – an amino acid that must be obtained through food. Researchers from DZNE report on this in the journal Cell Metabolism, together with a Chinese team from Qingdao University and the University of Health and Rehabilitation Sciences. They suggest that similar mechanisms may exist in humans and view fasting as a potential approach for treating unwanted loss of sexual desire.

Fasting is a recurring subject of research because reduced food intake and thus calorie restriction has a variety of effects on the organism beyond the commonly observed weight loss. Dr. Dan Ehninger, research group leader at DZNE and lead author of the current study, and his team have also been working on this topic for quite some time.

""We are interested in the effects of fasting on aging. Using mice as a model, we investigate the underlying biological mechanisms. Our aim is to gain insights that may also be relevant to humans,"" says the Bonn-based scientist.

More offspring than expected

The research results now published are based on a fortuitous discovery, as Ehninger and his colleagues had originally set out to investigate something else. Their aim was to examine how fasting affects the offspring of male mice. However, one particular finding steered their research in a new direction: aged male mice – senior individuals by human standards – that had fasted for extended periods produced an unusually large number of offspring. Contrary to initial hypotheses, this phenomenon was not due to fasting effects on reproductive organs or the endocrine state of the animals. Age-related changes in the testes, reduced sperm quality and lower testosterone levels, for example, argued against high fertility. ""It was a bit of detective work to uncover the real cause,"" says Ehninger, whose research group collaborated on the current study with experts from Qingdao University and the University of Health and Rehabilitation Sciences led by Prof. Yu Zhou. ""Eventually, we realized: it is a matter of behavior. The fasting males had significantly more sexual contacts than mice that could eat freely. In other words, these animals had an unusually high frequency of mating and, as a result, an unusually high number of offspring for their age. Their mating behavior more than compensated for the age-related physiological limitations.""

Fasting in a 24-hour rhythm

Starting at two months of age, these male mice were subjected to a specific form of intermittent fasting. Their access to food followed a recurring 24-hour pattern: the animals were allowed to feed ad libitum for 24 hours, followed by 24 hours with access to water only. During the 22-month fasting regimen, the males were housed together without any contact with females. They were later introduced to three-month-old females that had been raised without dietary restrictions.

Effect takes time

Increased mating behavior was also observed in younger mice. These males had also started intermittent fasting at the age of two months, but had followed this diet for only six months before being introduced to females. They, too, were more sexually active than age-matched peers that had been fed ad libitum. However, the effect was absent in other experimental groups – both young and old – that fasted for only a few weeks.

""For intermittent fasting to increase sex drive, it takes some time,"" says Zhou. ""Based on our experiments, the minimum duration appears to be somewhere between six weeks and six months.""

A question of serotonin

In the course of investigating the causes, the attention eventually turned to neurotransmitters that influence sexual behavior. Some have a stimulating effect, while others act as inhibitors. Among the sexually active male mice, one factor stood out: serotonin – a chemical messenger generally associated with inhibitory effects – was present at unusually low levels.

These mice were, so to speak, sexually uninhibited, the usual regulatory restraint was diminished."" Dr. Dan Ehninger, research group leader at DZNE

Serotonin is primarily produced in the gastrointestinal tract, but also in the brain, where it acts as a neurotransmitter mediating communication between neurons. However, its synthesis depends on the amino acid tryptophan, which must be obtained through the diet or released through the breakdown of the body's own protein stores, such as those found in muscle tissue. Tryptophan is considered an essential amino acid, meaning that neither mice nor humans can synthesize it on their own. As a result, dietary intake plays a key role in regulating tryptophan levels in the body. It is, in fact, found in many common foods. ""The lack of serotonin was clearly a result of fasting,"" explains the DZNE researcher.

Is the fasting regimen relevant?

""All in all, the fasting mice consumed almost fifteen percent fewer calories than the animals in the control group. This also roughly applies to their intake of tryptophan,"" says Zhou. ""However, it is currently unclear whether the reduction in serotonin levels is linked to our specific feeding regimen or would also occur with other types of fasting. Future studies will need to clarify this."" As the scientist notes, it is also possible that the effect could occur under a general caloric restriction, where food is continuously available but in reduced amounts.

A potential approach for therapy

""Chemical messengers also play an important role in regulating sexual behavior in humans. This applies in particular to serotonin,"" says Ehninger. As he points out, this is evident, for example, in the use of SSRIs, a class of antidepressant drugs that increase serotonin levels. A potential side effect of this therapy is reduced libido. Conversely, lower serotonin levels are known to promote sexual desire. ""In view of this, I consider it very plausible that sexual desire in humans can be influenced by fasting – possibly not only in men, but also in women, since serotonin affects their libido as well."" According to Ehninger, there are actually only a few scientific studies on the effects of fasting on human libido. ""In my opinion, it would make sense to investigate this in more detail. I see potential for therapeutic application. A lack of sexual desire is not necessarily perceived as problematic – but some people suffer from it. This condition is known as 'hypoactive sexual desire disorder' and particularly affects older adults. Fasting could potentially serve as a useful addition to existing treatment options.""",news-medical
https://news-medical.net,Scientists develop lab model to study TDP-43 accumulation in neurodegeneration,https://news-medical.net/news/20250328/Scientists-develop-lab-model-to-study-TDP-43-accumulation-in-neurodegeneration.aspx,"Fri, 28 Mar 2025 00:00:00 GMT","Accumulation of a protein called TDP-43 is a key feature of ALS and frontotemporal dementia. In a newly published study, researchers report 'seeding' this accumulation through fragments of the culprit protein created in the lab. The findings provide further evidence for a prion-like paradigm wherein protein aggregation occurs in a templated fashion. This breakthrough provides the research field with a powerful way to model and study the mechanisms driving neurodegeneration.

TAR DNA-binding protein 43, better known as TDP-43, is a protein found in almost all human cells, where it plays essential roles in regulating gene expression, RNA processing, and cellular stress responses. Under normal conditions, TDP-43 helps maintain the health and function of neurons by controlling which genes are turned on or off and how their messages are translated into proteins.

However, TDP-43 is infamous for its role in several neurodegenerative diseases, including ALS and frontotemporal dementia, but also Alzheimer's disease.

From the nucleus to the cytoplasm

""TDP-43 pathology is considered a defining feature in nearly all ALS cases and about half of frontotemporal dementia cases,"" explains professor Sandrine Da Cruz, group leader at the VIB-KU Leuven Center for Brain & Disease Research. ""In the brains of these patients, TDP-43 somehow mislocalizes, accumulates in the cytoplasm where it forms insoluble inclusions, and is depleted from the nucleus.""

Despite its critical role, the exact processes driving TDP-43 dysfunction remain poorly understood—an urgent gap that researchers like Da Cruz are actively working to fill. The havoc and widespread neuronal death that ensues following TDP-43 mislocalization is most likely due to a combination of both disruption of TDP-43's normal activities within the nucleus as well as the toxic effect of the cytoplasmic inclusions.

""Part of the reason why the underlying mechanisms are still poorly understood is that we lack model systems that reliably recapitulate both the nuclear depletion of TDP-43 and its cytoplasmic aggregation,"" says Da Cruz.

Seeds for aggregation

Building on recent reports that autopsied brain material from patients with TDP-43 inclusions can induce accumulation of insoluble TDP-43 in cells and transgenic mouse models, Da Cruz and her team sought a way to reproduce this so-called aggregation 'seeding' in the lab.

In a study recently published in Neuron, Da Cruz's team describes how they produced amyloid-like fibrils from a fragment of TDP-43 and that these fibrils trigger TDP-43 pathology in human cells, including iPSC-derived neurons.

The fibril-induced inclusions recapitulate many of the key hallmarks seen in patients, explains PhD student Jens Rummens: ""The TDP-43 aggregates induced by the fibrils exhibited many of the modifications we also see in patient brains, including phosphorylation and ubiquitination. Strikingly, the aggregates were able to recruit endogenous TDP-43 from the nucleus to the cytoplasm.""

The similarities extended to other downstream effects, as the team identified signature gene activity patterns that were previously linked to both aggregation and nuclear loss of TDP-43. The aggregates themselves exhibited the same heterogeneity in morphology as typically seen in patients over time.

Tool for research

The new results strongly suggest that pathology in TDP-43 proteinopathies propagates in a self-templating and prion-like fashion, but many questions remain unanswered. How is TDP-43 'trapped in the aggregates? What do they consist of and how do they trigger toxicity? Which additional 'hits' are required? What are the effects of TDP-43 mutations? Of age?

So perhaps most importantly, the new study provides scientists with the actual tools to study the different triggers and complex interplay in a controlled system.

Da Cruz: ""We have developed a valuable model that displays both aspects of TDP-43 pathology—cytoplasmic aggregation and nuclear depletion. This will be a powerful asset to help researchers across the globe to further unravel TDP-43 induced disease mechanisms and enable us to screen potential drug candidates that modify disease progression.""",news-medical
