Input URL,Title,Link,Published,Description,Source
https://news.google.com/rss/search?q=entertainment+news,Lauren Graham Reveals Strangest Comments 'Gilmore Girls' Fans Have Made,,"Thu, 06 Feb 2025 16:43:00 GMT",Lauren Graham Reveals Strangest Comments 'Gilmore Girls' Fans Have Made,"{'href': 'https://kiisfm.iheart.com', 'title': 'On Air with Ryan Seacrest'}"
https://news.google.com/rss/search?q=entertainment+news,"Blackpink World Tour Announcement Brings MAJOR Backlash For YG Entertainment, Fans Accuse Label Of 'Sabotage'",,"Thu, 06 Feb 2025 14:28:39 GMT","Blackpink World Tour Announcement Brings MAJOR Backlash For YG Entertainment, Fans Accuse Label Of 'Sabotage'","{'href': 'https://www.timesnownews.com', 'title': 'Times Now'}"
https://news.google.com/rss/search?q=entertainment+news,6 Life Lessons We Learnt From The Movie ‘The Lunchbox’,,"Thu, 06 Feb 2025 12:50:25 GMT",6 Life Lessons We Learnt From The Movie ‘The Lunchbox’,"{'href': 'https://zeenews.india.com', 'title': 'Zee News'}"
https://news.google.com/rss/search?q=entertainment+news,7 Must-Watch Movies If You Like ‘Breaking Bad’,,"Thu, 06 Feb 2025 08:40:45 GMT",7 Must-Watch Movies If You Like ‘Breaking Bad’,"{'href': 'https://zeenews.india.com', 'title': 'Zee News'}"
https://news.google.com/rss/search?q=entertainment+news,"Indian Love Stories: Myths, History & Romance",,"Thu, 06 Feb 2025 09:11:30 GMT","Indian Love Stories: Myths, History & Romance","{'href': 'https://zeenews.india.com', 'title': 'Zee News'}"
https://news.google.com/rss/search?q=entertainment+news,7 Underrated Bollywood Pair We Forgot To Recognize,,"Thu, 06 Feb 2025 08:48:38 GMT",7 Underrated Bollywood Pair We Forgot To Recognize,"{'href': 'https://zeenews.india.com', 'title': 'Zee News'}"
https://news.google.com/rss/search?q=entertainment+news,Celebrate Galentine’s By Watching These Movies With Your Bestie,,"Thu, 06 Feb 2025 08:38:26 GMT",Celebrate Galentine’s By Watching These Movies With Your Bestie,"{'href': 'https://zeenews.india.com', 'title': 'Zee News'}"
https://news.google.com/rss/search?q=entertainment+news,Top 7 Absolute Thriller Movies To Watch On Disney Hotstar,,"Thu, 06 Feb 2025 10:09:26 GMT",Top 7 Absolute Thriller Movies To Watch On Disney Hotstar,"{'href': 'https://zeenews.india.com', 'title': 'Zee News'}"
https://news.google.com/rss/search?q=entertainment+news,7 Must-Watch Hindi Dubbed Malayalam Movies on OTT,,"Thu, 06 Feb 2025 11:05:51 GMT",7 Must-Watch Hindi Dubbed Malayalam Movies on OTT,"{'href': 'https://zeenews.india.com', 'title': 'Zee News'}"
https://news.google.com/rss/search?q=tennis+news,Tennis legend Martina Navratilova says she hates 'Democrats totally failed' on protecting women's sports,,"Thu, 06 Feb 2025 12:01:00 GMT",Tennis legend Martina Navratilova says she hates 'Democrats totally failed' on protecting women's sports,"{'href': 'https://www.foxnews.com', 'title': 'Fox News'}"
https://news.google.com/rss/search?q=tennis+news,Elena Rybakina defeats Ons Jabeur in dramatic Abu Dhabi clash,,"Thu, 06 Feb 2025 16:17:00 GMT",Elena Rybakina defeats Ons Jabeur in dramatic Abu Dhabi clash,"{'href': 'https://www.tennis.com', 'title': 'Tennis Magazine'}"
https://news.google.com/rss/search?q=tennis+news,Abu Dhabi Open: Elena Rybakina through as Heather Watson eliminated,,"Thu, 06 Feb 2025 18:12:37 GMT",Abu Dhabi Open: Elena Rybakina through as Heather Watson eliminated,"{'href': 'https://www.bbc.com', 'title': 'BBC.com'}"
https://news.google.com/rss/search?q=tennis+news,Australian Open champion Keys withdraws from Dubai with leg injury,,"Thu, 06 Feb 2025 14:40:44 GMT",Australian Open champion Keys withdraws from Dubai with leg injury,"{'href': 'https://www.wtatennis.com', 'title': 'WTA Tennis'}"
https://news.google.com/rss/search?q=tennis+news,Men's Tennis Set For Action-Packed Weekend,,"Thu, 06 Feb 2025 15:51:44 GMT",Men's Tennis Set For Action-Packed Weekend,"{'href': 'https://daytonflyers.com', 'title': 'University of Dayton Athletics'}"
https://news.google.com/rss/search?q=tennis+news,Men’s Tennis to Face UNCW in Home Opener,,"Thu, 06 Feb 2025 15:33:40 GMT",Men’s Tennis to Face UNCW in Home Opener,"{'href': 'https://goccusports.com', 'title': 'Coastal Carolina Official Athletic Site'}"
https://news.google.com/rss/search?q=tennis+news,NAIA Women’s Collegiate Tennis Team Rankings,,"Thu, 06 Feb 2025 15:44:39 GMT",NAIA Women’s Collegiate Tennis Team Rankings – February 6th,"{'href': 'https://wearecollegetennis.com', 'title': 'Intercollegiate Tennis Association'}"
https://news.google.com/rss/search?q=tennis+news,Bulldogs Picked Seventh in 2025 CIAA Preseason Women's Tennis Predicted Order of Finish,,"Thu, 06 Feb 2025 19:44:04 GMT",Bulldogs Picked Seventh in 2025 CIAA Preseason Women's Tennis Predicted Order of Finish,"{'href': 'https://bsubulldogs.com', 'title': 'BSU Bulldogs'}"
https://news.google.com/rss/search?q=tennis+news,2025 Hope College Women's Tennis Preview,,"Thu, 06 Feb 2025 19:00:49 GMT",2025 Hope College Women's Tennis Preview,"{'href': 'https://athletics.hope.edu', 'title': 'Hope College Athletics'}"
https://news.google.com/rss/search?q=tennis+news,Women's Tennis Faces Cardinals in Louisville,,"Thu, 06 Feb 2025 17:17:37 GMT",Women's Tennis Faces Cardinals in Louisville,"{'href': 'https://letsgopeay.com', 'title': 'Austin Peay'}"
https://news.google.com/rss/search?q=tennis+news,Men’s Tennis Faces Clemson on the Road,,"Thu, 06 Feb 2025 19:35:52 GMT",Men’s Tennis Faces Clemson on the Road,"{'href': 'https://gamecocksonline.com', 'title': 'South Carolina Gamecocks'}"
https://news.google.com/rss/search?q=tennis+news,Men's Tennis to Take On Virginia Tech and Charlotte,,"Thu, 06 Feb 2025 15:48:26 GMT",Men's Tennis to Take On Virginia Tech and Charlotte,"{'href': 'https://odusports.com', 'title': 'Old Dominion University'}"
https://news.google.com/rss/search?q=tennis+news,"Preview: at No. 3 Texas, vs. Florida",,"Thu, 06 Feb 2025 19:05:36 GMT","Preview: at No. 3 Texas, vs. Florida","{'href': 'https://gofrogs.com', 'title': 'TCU Athletics'}"
https://news.google.com/rss/search?q=tennis+news,Men's and Women's Tennis Travels to Army,,"Thu, 06 Feb 2025 17:06:55 GMT",Men's and Women's Tennis Travels to Army,"{'href': 'https://guhoyas.com', 'title': 'Georgetown University Athletics'}"
https://news.google.com/rss/search?q=tennis+news,Women's Tennis Selected Fifth in CIAA Predicted Order of Finish,,"Thu, 06 Feb 2025 17:25:51 GMT",Women's Tennis Selected Fifth in CIAA Predicted Order of Finish,"{'href': 'https://wssurams.com', 'title': 'Winston-Salem State'}"
https://news.google.com/rss/search?q=tennis+news,MT Hits the Road to Face Nebraska and No. 4 Ohio State,,"Thu, 06 Feb 2025 17:19:06 GMT",MT Hits the Road to Face Nebraska and No. 4 Ohio State,"{'href': 'https://baylorbears.com', 'title': 'BaylorBears.com'}"
https://news.google.com/rss/search?q=tennis+news,Men’s Tennis Hosts Two Matches this Weekend,,"Thu, 06 Feb 2025 19:26:30 GMT",Men’s Tennis Hosts Two Matches this Weekend,"{'href': 'http://www.ballstatesports.com', 'title': 'BallStateSports.com'}"
https://news.google.com/rss/search?q=tennis+news,Women’s Tennis Hits Road for Three Matches,,"Thu, 06 Feb 2025 18:54:42 GMT",Women’s Tennis Hits Road for Three Matches,"{'href': 'https://ekusports.com', 'title': 'EKU Sports'}"
https://news.google.com/rss/search?q=tennis+news,Women’s Tennis Central: #13 Tennessee at ITA National Indoor Team Championship,,"Thu, 06 Feb 2025 14:52:50 GMT",Women’s Tennis Central: #13 Tennessee at ITA National Indoor Team Championship,"{'href': 'https://utsports.com', 'title': 'University of Tennessee Athletics'}"
https://news.google.com/rss/search?q=tennis+news,ULM Tennis Preview: Stephen F. Austin,,"Thu, 06 Feb 2025 16:21:14 GMT",ULM Tennis Preview: Stephen F. Austin,"{'href': 'https://ulmwarhawks.com', 'title': 'ULM Warhawks'}"
https://news.google.com/rss/search?q=tennis+news,NAU Men's Tennis Prepares for String of Road Matches,,"Thu, 06 Feb 2025 18:38:18 GMT",NAU Men's Tennis Prepares for String of Road Matches,"{'href': 'https://nauathletics.com', 'title': 'Northern Arizona University Athletics'}"
https://news.google.com/rss/search?q=tennis+news,Men's Tennis Tabbed as 2025 GLVC East Division Favorites,,"Thu, 06 Feb 2025 16:15:49 GMT",Men's Tennis Tabbed as 2025 GLVC East Division Favorites,"{'href': 'https://athletics.uindy.edu', 'title': 'University of Indianapolis'}"
https://news.google.com/rss/search?q=tennis+news,MEN'S TENNIS HOSTS BACK-TO-BACK MATCHES,,"Thu, 06 Feb 2025 16:32:59 GMT",MEN'S TENNIS HOSTS BACK-TO-BACK MATCHES,"{'href': 'https://iuindyjags.com', 'title': 'IU Indy Athletics'}"
https://news.google.com/rss/search?q=tennis+news,KU tennis takes early momentum into upcoming matches,,"Thu, 06 Feb 2025 14:37:00 GMT",KU tennis takes early momentum into upcoming matches,"{'href': 'https://www2.ljworld.com', 'title': 'Lawrence Journal-World'}"
https://news.google.com/rss/search?q=tennis+news,Taylor Fritz Blames Australian Open's Tennis Balls for Injury,,"Thu, 06 Feb 2025 15:10:05 GMT",Taylor Fritz Blames Australian Open's Tennis Balls for Injury,"{'href': 'https://www.si.com', 'title': 'Sports Illustrated'}"
https://news.google.com/rss/search?q=tennis+news,Tennis welcomes Interim Head Coach,,"Thu, 06 Feb 2025 16:48:30 GMT",Tennis welcomes Interim Head Coach,"{'href': 'https://themacweekly.com', 'title': 'Macalester College The Mac Weekly'}"
https://news.google.com/rss/search?q=tennis+news,"World-famous singer Redfoo, part of music duo LMFAO, makes professional tennis debut; shares rally point in viral video",,"Thu, 06 Feb 2025 08:54:29 GMT","World-famous singer Redfoo, part of music duo LMFAO, makes professional tennis debut; shares rally point in viral video","{'href': 'https://www.hindustantimes.com', 'title': 'Hindustan Times'}"
https://news.google.com/rss/search?q=tennis+news,MTSU men’s tennis drops tight match to Vanderbilt,,"Thu, 06 Feb 2025 18:13:44 GMT",MTSU men’s tennis drops tight match to Vanderbilt,"{'href': 'https://mtsusidelines.com', 'title': 'Sidelines Online'}"
https://news.google.com/rss/search?q=tennis+news,UCF women’s tennis roars to a win over the FIU panthers,,"Thu, 06 Feb 2025 18:00:50 GMT",UCF women’s tennis roars to a win over the FIU panthers,"{'href': 'https://www.nicholsonstudentmedia.com', 'title': 'Nicholson Student Media'}"
https://news.google.com/rss/search?q=tennis+news,"Holger Rune builds his perfect tennis player, but no place for Novak Djokovic and Rafael Nadal",,"Thu, 06 Feb 2025 12:44:15 GMT","Holger Rune builds his perfect tennis player, but no place for Novak Djokovic and Rafael Nadal","{'href': 'https://www.tennis365.com', 'title': 'Tennis365'}"
https://news.google.com/rss/search?q=tennis+news,King Kyrgios to be replaced by David ‘The Wall’ Goffin at UTS Guadalajara,,"Thu, 06 Feb 2025 14:59:45 GMT",King Kyrgios to be replaced by David ‘The Wall’ Goffin at UTS Guadalajara,"{'href': 'https://www.tennismajors.com', 'title': 'Tennis Majors'}"
https://news.google.com/rss/search?q=tennis+news,"Baseline Vision: Revolutionizing Tennis Training, Performance Analysis and Umpiring",,"Thu, 06 Feb 2025 12:11:00 GMT","Baseline Vision: Revolutionizing Tennis Training, Performance Analysis and Umpiring","{'href': 'https://www.jpost.com', 'title': 'The Jerusalem Post'}"
https://news.google.com/rss/search?q=tennis+news,Tennis player Goncalo Oliveira suspended over positive meth test,,"Thu, 06 Feb 2025 13:33:54 GMT",Tennis player Goncalo Oliveira suspended over positive meth test,"{'href': 'https://www.msn.com', 'title': 'MSN'}"
https://news.google.com/rss/search?q=tennis+news,"Shrivalli, Maaya surge through to quarters",,"Thu, 06 Feb 2025 18:12:31 GMT","Shrivalli, Maaya surge through to quarters","{'href': 'https://www.hindustantimes.com', 'title': 'Hindustan Times'}"
https://news.google.com/rss/search?q=tennis+news,Carlos Alcaraz vs Andrea Vavassori LIVE Score Updates ATP 500 Rotterdarm Game,,"Thu, 06 Feb 2025 18:10:08 GMT",Carlos Alcaraz vs Andrea Vavassori LIVE Score Updates ATP 500 Rotterdarm Game,"{'href': 'https://www.vavel.com', 'title': 'VAVEL.com'}"
https://news.google.com/rss/search?q=tennis+news,Tennis comeback in the works as Eugenie Bouchard pictured training at Columbia University,,"Thu, 06 Feb 2025 16:37:00 GMT",Tennis comeback in the works as Eugenie Bouchard pictured training at Columbia University,"{'href': 'https://www.yardbarker.com', 'title': 'Yardbarker'}"
https://news.google.com/rss/search?q=tennis+news,Harris uses van life to fuel his tennis career,,"Thu, 06 Feb 2025 15:13:00 GMT",Harris uses van life to fuel his tennis career,"{'href': 'https://www.thehindu.com', 'title': 'The Hindu'}"
https://news.google.com/rss/search?q=tennis+news,"Eugenie Bouchard makes bold comparison between pickleball and tennis pros ahead of Pickleball Slam 3 ft. Andre Agassi, Steffi Graf, Andy Roddick",,"Thu, 06 Feb 2025 11:41:00 GMT","Eugenie Bouchard makes bold comparison between pickleball and tennis pros ahead of Pickleball Slam 3 ft. Andre Agassi, Steffi Graf, Andy Roddick","{'href': 'https://www.sportskeeda.com', 'title': 'Sportskeeda'}"
https://news.google.com/rss/search?q=tennis+news,From 'Party Rocking' to ITF Tour hustle: A pop star's tennis journey,,"Thu, 06 Feb 2025 12:05:57 GMT",From 'Party Rocking' to ITF Tour hustle: A pop star's tennis journey,"{'href': 'https://www.tennis365.com', 'title': 'Tennis365'}"
https://news.google.com/rss/search?q=tennis+news,Carlos Alcaraz proven right after calling out tennis bosses as Taylor Fritz reveals woes,,"Thu, 06 Feb 2025 13:43:00 GMT",Carlos Alcaraz proven right after calling out tennis bosses as Taylor Fritz reveals woes,"{'href': 'https://www.express.co.uk', 'title': 'Express'}"
https://news.google.com/rss/search?q=tennis+news,"Reigning Champion Rybakina, Red-Hot Krueger Reach Abu Dhabi Semifinals",,"Thu, 06 Feb 2025 17:30:24 GMT","Reigning Champion Rybakina, Red-Hot Krueger Reach Abu Dhabi Semifinals","{'href': 'https://www.tennisnow.com', 'title': 'Tennis Now'}"
https://news.google.com/rss/search?q=tennis+news,Nick Kyrgios’ junior coach reveals how many hours he trained a day as a young player,,"Thu, 06 Feb 2025 17:00:00 GMT",Nick Kyrgios’ junior coach reveals how many hours he trained a day as a young player,"{'href': 'https://www.thetennisgazette.com', 'title': 'The Tennis Gazette'}"
https://news.google.com/rss/search?q=tennis+news,Daniil Medvedev suggests what would have to happen for him to retire from tennis after shock defeat in Rotterdam,,"Thu, 06 Feb 2025 11:30:00 GMT",Daniil Medvedev suggests what would have to happen for him to retire from tennis after shock defeat in Rotterdam,"{'href': 'https://www.thetennisgazette.com', 'title': 'The Tennis Gazette'}"
https://news.google.com/rss/search?q=tennis+news,"Tsitsipas, Rublev Advance in Rotterdam; Rybakina Reaches Abu Dhabi Semifinals",,"Thu, 06 Feb 2025 18:32:10 GMT","Tsitsipas, Rublev Advance in Rotterdam; Rybakina Reaches Abu Dhabi Semifinals","{'href': 'https://tennisconnected.com', 'title': 'Tennis Connected'}"
https://news.google.com/rss/search?q=tennis+news,Petra Kvitova and Patrick Mouratoglou react as Simona Halep announces her retirement from tennis,,"Thu, 06 Feb 2025 14:00:00 GMT",Petra Kvitova and Patrick Mouratoglou react as Simona Halep announces her retirement from tennis,"{'href': 'https://www.thetennisgazette.com', 'title': 'The Tennis Gazette'}"
https://news.google.com/rss/search?q=tennis+news,Coco Gauff Donates $100K To UNCF To Help Fund Scholarships For HBCU Students Playing Tennis,,"Thu, 06 Feb 2025 13:06:14 GMT",Coco Gauff Donates $100K To UNCF To Help Fund Scholarships For HBCU Students Playing Tennis,"{'href': 'https://www.blackenterprise.com', 'title': 'Black Enterprise'}"
https://news.google.com/rss/search?q=tennis+news,ATP player who Andy Roddick has tipped for big things now undergoing 'scans' after suffering injury in Rotterdam,,"Thu, 06 Feb 2025 18:30:00 GMT",ATP player who Andy Roddick has tipped for big things now undergoing 'scans' after suffering injury in Rotterdam,"{'href': 'https://www.thetennisgazette.com', 'title': 'The Tennis Gazette'}"
