Input URL,Title,Link,Published,Description,Source
https://news.google.com/rss/search?q=sports+news,Disney to offer ESPN in ‘skinnier bundles’ after Venu Sports demise,,"Thu, 06 Feb 2025 17:41:32 GMT",Disney to offer ESPN in ‘skinnier bundles’ after Venu Sports demise,"{'href': 'https://www.sportspro.com', 'title': 'SportsPro'}"
https://news.google.com/rss/search?q=sports+news,Stadium to Screen: The Accelerating Shift to Streaming for Live Sports,,"Thu, 06 Feb 2025 12:00:00 GMT",Stadium to Screen: The Accelerating Shift to Streaming for Live Sports,"{'href': 'https://www.businesswire.com', 'title': 'Business Wire'}"
https://news.google.com/rss/search?q=sports+news,"Batting Around: Kyle Tucker to Cubs, Roki Sasaki to Dodgers among favorite MLB offseason moves",,"Thu, 06 Feb 2025 14:38:43 GMT","Batting Around: Kyle Tucker to Cubs, Roki Sasaki to Dodgers among favorite MLB offseason moves","{'href': 'https://www.cbssports.com', 'title': 'CBS Sports'}"
https://news.google.com/rss/search?q=sports+news,"Saudi Sports for All Federation Unveils Riyadh Marathon Route, Venues, and Sponsors for Inaugural SFA International Sporting Events",,"Thu, 06 Feb 2025 12:41:00 GMT","Saudi Sports for All Federation Unveils Riyadh Marathon Route, Venues, and Sponsors for Inaugural SFA International Sporting Events","{'href': 'https://www.businesswire.com', 'title': 'Business Wire'}"
https://news.google.com/rss/search?q=sports+news,Horizon Sports & Experiences (HS&E) Acquires Strategic,,"Thu, 06 Feb 2025 13:00:00 GMT",Horizon Sports & Experiences (HS&E) Acquires Strategic,"{'href': 'https://www.businesswire.com', 'title': 'Business Wire'}"
https://news.google.com/rss/search?q=sports+news,Chiefs well aware of Jalen Hurts' success against blitz; what makes Eagles' QB so good against it?,,"Thu, 06 Feb 2025 15:11:22 GMT",Chiefs well aware of Jalen Hurts' success against blitz; what makes Eagles' QB so good against it?,"{'href': 'https://www.cbssports.com', 'title': 'CBS Sports'}"
https://news.google.com/rss/search?q=sports+news,"Women's Sports Are Surging, And Advertisers Can't Afford to Miss Out on The Opportunity",,"Thu, 06 Feb 2025 15:34:00 GMT","Women's Sports Are Surging, And Advertisers Can't Afford to Miss Out on The Opportunity","{'href': 'https://www.prnewswire.com', 'title': 'PR Newswire'}"
https://news.google.com/rss/search?q=sports+news,KU tennis takes early momentum into upcoming matches,,"Thu, 06 Feb 2025 14:37:00 GMT",KU tennis takes early momentum into upcoming matches,"{'href': 'https://www2.ljworld.com', 'title': 'Lawrence Journal-World'}"
https://news.google.com/rss/search?q=sports+news,Riley Gaines feels ‘vindicated’ since Trump’s executive order on women’s sports,,"Thu, 06 Feb 2025 15:50:19 GMT",Riley Gaines feels ‘vindicated’ since Trump’s executive order on women’s sports,"{'href': 'https://gazette.com', 'title': 'Colorado Springs Gazette'}"
https://news.google.com/rss/search?q=sports+news,Sports takes the spotlight at latest Four Arts story time event,,"Thu, 06 Feb 2025 10:06:21 GMT",Sports takes the spotlight at latest Four Arts story time event,"{'href': 'https://www.palmbeachdailynews.com', 'title': 'Palm Beach Daily News'}"
https://news.google.com/rss/search?q=sports+news,Super Bowl 2025 odds for Eagles-Chiefs: Kansas City slight favorite as it goes for historic three-peat,,"Thu, 06 Feb 2025 15:00:00 GMT",Super Bowl 2025 odds for Eagles-Chiefs: Kansas City slight favorite as it goes for historic three-peat,"{'href': 'https://www.cbssports.com', 'title': 'CBS Sports'}"
https://news.google.com/rss/search?q=sports+news,"NFL Super Bowl 59 predictions, odds, line, props: Chiefs vs. Eagles football picks by expert on 86-54 roll",,"Thu, 06 Feb 2025 15:56:33 GMT","NFL Super Bowl 59 predictions, odds, line, props: Chiefs vs. Eagles football picks by expert on 86-54 roll","{'href': 'https://www.cbssports.com', 'title': 'CBS Sports'}"
https://news.google.com/rss/search?q=sports+news,2025 Fantasy Baseball Third Baseman Preview: Be careful of traps!,,"Thu, 06 Feb 2025 15:06:42 GMT",2025 Fantasy Baseball Third Baseman Preview: Be careful of traps!,"{'href': 'https://sports.yahoo.com', 'title': 'Yahoo Sports'}"
https://news.google.com/rss/search?q=sports+news,"Super Bowl 59, Chiefs vs. Eagles NFL bets: How to pick FanDuel Sportsbook Touchdown Jackpot promotion",,"Thu, 06 Feb 2025 16:01:05 GMT","Super Bowl 59, Chiefs vs. Eagles NFL bets: How to pick FanDuel Sportsbook Touchdown Jackpot promotion","{'href': 'https://www.cbssports.com', 'title': 'CBS Sports'}"
https://news.google.com/rss/search?q=sports+news,Fan hilariously breaks Butler-to-Warriors trade news to Heat,,"Thu, 06 Feb 2025 08:13:38 GMT",Fan hilariously breaks Butler-to-Warriors trade news to Heat,"{'href': 'https://sports.yahoo.com', 'title': 'Yahoo Sports'}"
https://news.google.com/rss/search?q=sports+news,Eagles superfan Dawn Staley says she can't attend Super Bowl 59 due to air travel restrictions involving President Trump's visit,,"Thu, 06 Feb 2025 14:45:46 GMT",Eagles superfan Dawn Staley says she can't attend Super Bowl 59 due to air travel restrictions involving President Trump's visit,"{'href': 'https://sports.yahoo.com', 'title': 'Yahoo Sports'}"
https://news.google.com/rss/search?q=sports+news,Super Bowl 2025: Steve Spagnuolo blitz design at Chiefs practice a 'what the f---' moment for Chris Jones,,"Thu, 06 Feb 2025 17:53:00 GMT",Super Bowl 2025: Steve Spagnuolo blitz design at Chiefs practice a 'what the f---' moment for Chris Jones,"{'href': 'https://www.cbssports.com', 'title': 'CBS Sports'}"
https://news.google.com/rss/search?q=sports+news,"Liverpool vs Tottenham Hotspur LIVE: League Cup team news, line-ups and more",,"Thu, 06 Feb 2025 18:00:14 GMT","Liverpool vs Tottenham Hotspur LIVE: League Cup team news, line-ups and more","{'href': 'https://sports.yahoo.com', 'title': 'Yahoo Sports'}"
https://news.google.com/rss/search?q=sports+news,"How to watch Brighton vs Chelsea live: FA Cup stream, TV, team news, prediction",,"Thu, 06 Feb 2025 15:35:52 GMT","How to watch Brighton vs Chelsea live: FA Cup stream, TV, team news, prediction","{'href': 'https://sports.yahoo.com', 'title': 'Yahoo Sports'}"
https://news.google.com/rss/search?q=sports+news,"Prisco's 2025 Super Bowl pick: In Patrick Mahomes, Chiefs we trust; QB leads game-winning drive vs. Eagles",,"Thu, 06 Feb 2025 13:00:00 GMT","Prisco's 2025 Super Bowl pick: In Patrick Mahomes, Chiefs we trust; QB leads game-winning drive vs. Eagles","{'href': 'https://www.cbssports.com', 'title': 'CBS Sports'}"
https://news.google.com/rss/search?q=sports+news,"2025 NFL Mock Draft: Raiders trade up to secure a QB, Colorado star lands in the Big Apple",,"Thu, 06 Feb 2025 15:10:59 GMT","2025 NFL Mock Draft: Raiders trade up to secure a QB, Colorado star lands in the Big Apple","{'href': 'https://www.cbssports.com', 'title': 'CBS Sports'}"
https://news.google.com/rss/search?q=sports+news,"2025 NFL Honors where to watch: Date, time, TV, live stream for award show as NFL MVP, Hall of Fame announced",,"Thu, 06 Feb 2025 14:31:52 GMT","2025 NFL Honors where to watch: Date, time, TV, live stream for award show as NFL MVP, Hall of Fame announced","{'href': 'https://www.cbssports.com', 'title': 'CBS Sports'}"
https://news.google.com/rss/search?q=sports+news,Eagles' Dallas Goedert has a rare talent he plans to unveil if Philadelphia upsets Chiefs in Super Bowl 59,,"Thu, 06 Feb 2025 13:23:00 GMT",Eagles' Dallas Goedert has a rare talent he plans to unveil if Philadelphia upsets Chiefs in Super Bowl 59,"{'href': 'https://www.cbssports.com', 'title': 'CBS Sports'}"
https://news.google.com/rss/search?q=healthcare+news,‘Really scary’: watchlist found of mostly Black federal health workers,,"Thu, 06 Feb 2025 18:20:00 GMT",‘Really scary’: watchlist found of mostly Black federal health workers,"{'href': 'https://www.theguardian.com', 'title': 'The Guardian US'}"
https://news.google.com/rss/search?q=healthcare+news,UFC heavyweight champ enters the ring for healthcare reform with new price transparency partnership,,"Thu, 06 Feb 2025 19:00:00 GMT",UFC heavyweight champ enters the ring for healthcare reform with new price transparency partnership,"{'href': 'https://www.foxnews.com', 'title': 'Fox News'}"
https://news.google.com/rss/search?q=healthcare+news,For-profit medicine: Gov. Shapiro’s budget seeks to rid health care of private money,,"Thu, 06 Feb 2025 10:30:00 GMT",For-profit medicine: Gov. Shapiro’s budget seeks to rid health care of private money,"{'href': 'https://www.post-gazette.com', 'title': 'Pittsburgh Post-Gazette'}"
https://news.google.com/rss/search?q=healthcare+news,Overstretched healthcare should welcome the rise of the AI body scan,,"Thu, 06 Feb 2025 12:33:12 GMT",Overstretched healthcare should welcome the rise of the AI body scan,"{'href': 'https://www.ft.com', 'title': 'Financial Times'}"
https://news.google.com/rss/search?q=healthcare+news,Partnering with Avelios: Healthcare for the Modern Age,,"Thu, 06 Feb 2025 08:00:00 GMT",Partnering with Avelios: Healthcare for the Modern Age,"{'href': 'https://www.sequoiacap.com', 'title': 'Sequoia Capital'}"
https://news.google.com/rss/search?q=healthcare+news,Elon Musk’s DOGE gains access to CMS,,"Thu, 06 Feb 2025 17:01:50 GMT",Elon Musk’s DOGE gains access to CMS,"{'href': 'https://www.healthcaredive.com', 'title': 'Healthcare Dive'}"
https://news.google.com/rss/search?q=healthcare+news,Best in KLAS 2025 sees industry progress and vendor momentum,,"Thu, 06 Feb 2025 15:36:39 GMT",Best in KLAS 2025 sees industry progress and vendor momentum,"{'href': 'https://www.healthcareitnews.com', 'title': 'Healthcare IT News'}"
https://news.google.com/rss/search?q=healthcare+news,US health department condemns private equity firms for role in declining healthcare access,,"Thu, 06 Feb 2025 11:02:00 GMT",US health department condemns private equity firms for role in declining healthcare access,"{'href': 'https://www.theguardian.com', 'title': 'The Guardian US'}"
https://news.google.com/rss/search?q=healthcare+news,Healthcare at SEMO: From Class to Practice,,"Thu, 06 Feb 2025 14:18:11 GMT",Healthcare at SEMO: From Class to Practice,"{'href': 'https://semo.edu', 'title': 'Southeast Missouri State University'}"
https://news.google.com/rss/search?q=healthcare+news,Executive Budget Recommendation News Coverage,,"Thu, 06 Feb 2025 19:15:05 GMT",Executive Budget Recommendation News Coverage,"{'href': 'https://www.mha.org', 'title': 'Michigan Health & Hospital Association'}"
https://news.google.com/rss/search?q=healthcare+news,How HOK Is Influencing the Future of Pediatric Healthcare Design,,"Thu, 06 Feb 2025 16:48:12 GMT",How HOK Is Influencing the Future of Pediatric Healthcare Design,"{'href': 'https://www.hok.com', 'title': 'HOK'}"
https://news.google.com/rss/search?q=healthcare+news,"[Latest] Global Healthcare Digital Twins Market Size/Share Worth USD 15,129.8 Million by 2033 at a 21.5% CAGR: Custom Market Insights (Analysis, Outlook, Leaders, Report, Trends, Forecast, Segmentation, Growth, Growth Rate, Value)",,"Thu, 06 Feb 2025 16:31:44 GMT","[Latest] Global Healthcare Digital Twins Market Size/Share Worth USD 15,129.8 Million by 2033 at a 21.5% CAGR: Custom Market Insights (Analysis, Outlook, Leaders, Report, Trends, Forecast, Segmentation, Growth, Growth Rate, Value)","{'href': 'https://www.globenewswire.com', 'title': 'GlobeNewswire'}"
https://news.google.com/rss/search?q=healthcare+news,Sen. Kevin Sparks targets healthcare shortage and grid reliability with new legislation,,"Thu, 06 Feb 2025 15:00:45 GMT",Sen. Kevin Sparks targets healthcare shortage and grid reliability with new legislation,"{'href': 'https://www.amarillo.com', 'title': 'Amarillo.com'}"
https://news.google.com/rss/search?q=healthcare+news,"At Least 24,400 Individuals Affected by 5 Healthcare Data Breaches",,"Thu, 06 Feb 2025 11:09:25 GMT","At Least 24,400 Individuals Affected by 5 Healthcare Data Breaches","{'href': 'https://www.hipaajournal.com', 'title': 'HIPAA Journal'}"
https://news.google.com/rss/search?q=healthcare+news,Teladoc acquires Catapult Health for $65 million,,"Thu, 06 Feb 2025 15:43:13 GMT",Teladoc acquires Catapult Health for $65 million,"{'href': 'https://www.healthcarefinancenews.com', 'title': 'Healthcare Finance News'}"
https://news.google.com/rss/search?q=healthcare+news,Building Healthy Habits: How the MSU Health Care Sports Medicine Mileage Club Keeps Kids Active and Engaged,,"Thu, 06 Feb 2025 17:01:58 GMT",Building Healthy Habits: How the MSU Health Care Sports Medicine Mileage Club Keeps Kids Active and Engaged,"{'href': 'https://healthcare.msu.edu', 'title': 'Michigan State University Health Care'}"
https://news.google.com/rss/search?q=healthcare+news,Innoviva to Participate in the Oppenheimer 35th Annual Healthcare Life Sciences Conference,,"Thu, 06 Feb 2025 12:00:00 GMT",Innoviva to Participate in the Oppenheimer 35th Annual Healthcare Life Sciences Conference,"{'href': 'https://www.businesswire.com', 'title': 'Business Wire'}"
https://news.google.com/rss/search?q=healthcare+news,Improving the patient experience can pay dividends you may not expect,,"Thu, 06 Feb 2025 17:27:20 GMT",Improving the patient experience can pay dividends you may not expect,"{'href': 'https://www.healthcareitnews.com', 'title': 'Healthcare IT News'}"
https://news.google.com/rss/search?q=healthcare+news,Energize Supports Four Global Healthcare Companies Collaborating on a Multi-buyer PPA for a Long-term Supply of Renewable Electricity,,"Thu, 06 Feb 2025 16:58:00 GMT",Energize Supports Four Global Healthcare Companies Collaborating on a Multi-buyer PPA for a Long-term Supply of Renewable Electricity,"{'href': 'https://www.businesswire.com', 'title': 'Business Wire'}"
https://news.google.com/rss/search?q=healthcare+news,Acadia Healthcare Announces Date for Fourth Quarter and Year-End 2024 Earnings Release,,"Thu, 06 Feb 2025 16:00:00 GMT",Acadia Healthcare Announces Date for Fourth Quarter and Year-End 2024 Earnings Release,"{'href': 'https://www.businesswire.com', 'title': 'Business Wire'}"
https://news.google.com/rss/search?q=healthcare+news,The Microgrid Knowledge Conference: Key Healthcare Session,,"Thu, 06 Feb 2025 19:09:29 GMT",The Microgrid Knowledge Conference: Key Healthcare Session,"{'href': 'https://www.hcinnovationgroup.com', 'title': 'Healthcare Innovation'}"
https://news.google.com/rss/search?q=healthcare+news,"Solum Global Inc. Announces U.S. Healthcare Collaboration and Licensing Agreement with AI Company Life2, Inc.",,"Thu, 06 Feb 2025 14:33:07 GMT","Solum Global Inc. Announces U.S. Healthcare Collaboration and Licensing Agreement with AI Company Life2, Inc.","{'href': 'https://www.globenewswire.com', 'title': 'GlobeNewswire'}"
https://news.google.com/rss/search?q=healthcare+news,Unpacking the Paradox of Health Care’s GDP Percentage,,"Thu, 06 Feb 2025 10:48:14 GMT",Unpacking the Paradox of Health Care’s GDP Percentage,"{'href': 'https://ldi.upenn.edu', 'title': 'Leonard Davis Institute'}"
https://news.google.com/rss/search?q=healthcare+news,Why Molina Healthcare (MOH) Stock Is Falling Today,,"Thu, 06 Feb 2025 18:04:53 GMT",Why Molina Healthcare (MOH) Stock Is Falling Today,"{'href': 'https://finance.yahoo.com', 'title': 'Yahoo Finance'}"
https://news.google.com/rss/search?q=healthcare+news,Why health systems should be ‘clear-eyed’ about business goals for AI tools,,"Thu, 06 Feb 2025 18:25:57 GMT",Why health systems should be ‘clear-eyed’ about business goals for AI tools,"{'href': 'https://www.healthcaredive.com', 'title': 'Healthcare Dive'}"
https://news.google.com/rss/search?q=healthcare+news,HIMSS CEO Hal Wolf previews what's on tap for HIMSS25,,"Thu, 06 Feb 2025 15:08:36 GMT",HIMSS CEO Hal Wolf previews what's on tap for HIMSS25,"{'href': 'https://www.healthcareitnews.com', 'title': 'Healthcare IT News'}"
https://news.google.com/rss/search?q=healthcare+news,HIMSS CEO Hal Wolf highlights what's new at HIMSS25,,"Thu, 06 Feb 2025 15:43:18 GMT",HIMSS CEO Hal Wolf highlights what's new at HIMSS25,"{'href': 'https://www.healthcarefinancenews.com', 'title': 'Healthcare Finance News'}"
https://news.google.com/rss/search?q=healthcare+news,Healthcare scholarships offered by Clarion Hospital Foundation,,"Thu, 06 Feb 2025 12:00:00 GMT",Healthcare scholarships offered by Clarion Hospital Foundation,"{'href': 'https://www.thecourierexpress.com', 'title': 'The Courier-Express'}"
https://news.google.com/rss/search?q=healthcare+news,"Tufts Institute, Kaiser Permanente Launch Food is Medicine Network",,"Thu, 06 Feb 2025 17:24:41 GMT","Tufts Institute, Kaiser Permanente Launch Food is Medicine Network","{'href': 'https://www.hcinnovationgroup.com', 'title': 'Healthcare Innovation'}"
https://news.google.com/rss/search?q=healthcare+news,Milford community news: Bridges Healthcare accepting scholarship applications,,"Thu, 06 Feb 2025 12:37:11 GMT",Milford community news: Bridges Healthcare accepting scholarship applications,"{'href': 'https://www.ctpost.com', 'title': 'CTPost'}"
https://news.google.com/rss/search?q=healthcare+news,Ligand to Present at the Oppenheimer 35th Annual Healthcare Life Sciences Conference,,"Thu, 06 Feb 2025 12:00:00 GMT",Ligand to Present at the Oppenheimer 35th Annual Healthcare Life Sciences Conference,"{'href': 'https://www.businesswire.com', 'title': 'Business Wire'}"
https://news.google.com/rss/search?q=healthcare+news,Alignment Healthcare to Announce Fourth Quarter and,,"Thu, 06 Feb 2025 13:01:03 GMT",Alignment Healthcare to Announce Fourth Quarter and,"{'href': 'https://www.globenewswire.com', 'title': 'GlobeNewswire'}"
https://news.google.com/rss/search?q=healthcare+news,Community Oncology Alliance Urges Curbs on Consolidation,,"Thu, 06 Feb 2025 16:33:54 GMT",Community Oncology Alliance Urges Curbs on Consolidation,"{'href': 'https://www.hcinnovationgroup.com', 'title': 'Healthcare Innovation'}"
https://news.google.com/rss/search?q=healthcare+news,Exclusive Access: Ligand Pharmaceuticals Leadership Reveals Strategy at Elite Healthcare Conference,,"Thu, 06 Feb 2025 12:00:00 GMT",Exclusive Access: Ligand Pharmaceuticals Leadership Reveals Strategy at Elite Healthcare Conference,"{'href': 'https://www.stocktitan.net', 'title': 'StockTitan'}"
https://news.google.com/rss/search?q=healthcare+news,"Philips at ECR 2025: AI-enabled, sustainable, streamlined",,"Thu, 06 Feb 2025 14:09:03 GMT","Philips at ECR 2025: AI-enabled, sustainable, streamlined","{'href': 'https://healthcare-in-europe.com', 'title': 'healthcare-in-europe.com'}"
https://news.google.com/rss/search?q=healthcare+news,HCA Healthcare can build free-standing St. Augustine emergency room,,"Thu, 06 Feb 2025 14:32:00 GMT",HCA Healthcare can build free-standing St. Augustine emergency room,"{'href': 'https://www.jaxdailyrecord.com', 'title': 'Jacksonville Daily Record'}"
https://news.google.com/rss/search?q=healthcare+news,Should You Invest in the iShares U.S. Healthcare ETF (IYH)?,,"Thu, 06 Feb 2025 11:20:08 GMT",Should You Invest in the iShares U.S. Healthcare ETF (IYH)?,"{'href': 'https://finance.yahoo.com', 'title': 'Yahoo Finance'}"
https://news.google.com/rss/search?q=healthcare+news,Arkstone Partners with Neslab to Revolutionize Healthcare in Peru,,"Thu, 06 Feb 2025 13:34:00 GMT",Arkstone Partners with Neslab to Revolutionize Healthcare in Peru,"{'href': 'https://www.prnewswire.com', 'title': 'PR Newswire'}"
https://news.google.com/rss/search?q=healthcare+news,Voyager to Present at Oppenheimer 25th Annual Healthcare Life Sciences Conference,,"Thu, 06 Feb 2025 12:02:17 GMT",Voyager to Present at Oppenheimer 25th Annual Healthcare Life Sciences Conference,"{'href': 'https://www.globenewswire.com', 'title': 'GlobeNewswire'}"
https://news.google.com/rss/search?q=healthcare+news,"VA Secretary Doug Collins prioritizes efficiency, healthcare flexibility for veterans",,"Thu, 06 Feb 2025 11:04:03 GMT","VA Secretary Doug Collins prioritizes efficiency, healthcare flexibility for veterans","{'href': 'https://www.foxnews.com', 'title': 'Fox News'}"
https://news.google.com/rss/search?q=healthcare+news,Healthcare Watch: Innoviva's Strategic Vision Takes Center Stage at Major Oppenheimer Conference,,"Thu, 06 Feb 2025 12:00:00 GMT",Healthcare Watch: Innoviva's Strategic Vision Takes Center Stage at Major Oppenheimer Conference,"{'href': 'https://www.stocktitan.net', 'title': 'StockTitan'}"
https://news.google.com/rss/search?q=healthcare+news,Cynerio Ranked Among Top 2 Vendors in 2025 Best in KLAS in Healthcare IoT Security,,"Thu, 06 Feb 2025 14:00:00 GMT",Cynerio Ranked Among Top 2 Vendors in 2025 Best in KLAS in Healthcare IoT Security,"{'href': 'https://www.prnewswire.com', 'title': 'PR Newswire'}"
https://news.google.com/rss/search?q=healthcare+news,Avelios nabs $31M led by Sequoia to fix the ailing world of healthcare IT,,"Thu, 06 Feb 2025 08:39:30 GMT",Avelios nabs $31M led by Sequoia to fix the ailing world of healthcare IT,"{'href': 'https://techcrunch.com', 'title': 'TechCrunch'}"
https://news.google.com/rss/search?q=healthcare+news,India’s Animal Healthcare Industry on a High-Growth,,"Thu, 06 Feb 2025 09:11:40 GMT",India’s Animal Healthcare Industry on a High-Growth,"{'href': 'https://www.globenewswire.com', 'title': 'GlobeNewswire'}"
https://news.google.com/rss/search?q=healthcare+news,Major Biotech Conferences Alert: NRx Pharmaceuticals Sets Stage for Key Industry Updates,,"Thu, 06 Feb 2025 13:03:00 GMT",Major Biotech Conferences Alert: NRx Pharmaceuticals Sets Stage for Key Industry Updates,"{'href': 'https://www.stocktitan.net', 'title': 'StockTitan'}"
https://news.google.com/rss/search?q=healthcare+news,Jacques Gilbert Joins Topcon Healthcare’s Executive Management Team,,"Thu, 06 Feb 2025 16:43:01 GMT",Jacques Gilbert Joins Topcon Healthcare’s Executive Management Team,"{'href': 'https://www.mpo-mag.com', 'title': 'MPO-mag'}"
https://news.google.com/rss/search?q=healthcare+news,Southern Illinois Healthcare implements visitor restrictions amid flu surge,,"Thu, 06 Feb 2025 19:06:41 GMT",Southern Illinois Healthcare implements visitor restrictions amid flu surge,"{'href': 'https://www.kbsi23.com', 'title': 'KBSI Fox 23 Cape Girardeau News | Paducah News'}"
https://news.google.com/rss/search?q=healthcare+news,Healthcare Deal Alert: Ares Management Powers GHX's $1B Tech Revolution in Medical Supply Chain,,"Thu, 06 Feb 2025 11:30:00 GMT",Healthcare Deal Alert: Ares Management Powers GHX's $1B Tech Revolution in Medical Supply Chain,"{'href': 'https://www.stocktitan.net', 'title': 'StockTitan'}"
https://news.google.com/rss/search?q=healthcare+news,"Israel attacking hospitals and blocking medical aid in the West Bank, warns MSF",,"Thu, 06 Feb 2025 14:54:00 GMT","Israel attacking hospitals and blocking medical aid in the West Bank, warns MSF","{'href': 'https://www.middleeasteye.net', 'title': 'Middle East Eye'}"
https://news.google.com/rss/search?q=healthcare+news,Southeast Missouri State University healthcare students gain real-world experience,,"Thu, 06 Feb 2025 14:36:42 GMT",Southeast Missouri State University healthcare students gain real-world experience,"{'href': 'https://www.kbsi23.com', 'title': 'KBSI Fox 23 Cape Girardeau News | Paducah News'}"
https://news.google.com/rss/search?q=entertainment+news,‘Wheel of Fortune’ fans outraged after host Ryan Seacrest ‘robbed’ player with brutal pronunciation ruling,,"Thu, 06 Feb 2025 16:59:00 GMT",‘Wheel of Fortune’ fans outraged after host Ryan Seacrest ‘robbed’ player with brutal pronunciation ruling,"{'href': 'https://www.foxnews.com', 'title': 'Fox News'}"
https://news.google.com/rss/search?q=entertainment+news,"'SNL50' Anniversary Special Will Feature Steve Martin, Bad Bunny, Chappelle, McCartney and More",,"Thu, 06 Feb 2025 19:12:00 GMT","'SNL50' Anniversary Special Will Feature Steve Martin, Bad Bunny, Chappelle, McCartney and More","{'href': 'https://www.usnews.com', 'title': 'U.S. News & World Report'}"
https://news.google.com/rss/search?q=entertainment+news,"Blake Lively, Justin Baldoni clash over intimate scenes fueling 'It Ends with Us' lawsuits",,"Thu, 06 Feb 2025 09:00:00 GMT","Blake Lively, Justin Baldoni clash over intimate scenes fueling 'It Ends with Us' lawsuits","{'href': 'https://www.foxnews.com', 'title': 'Fox News'}"
https://news.google.com/rss/search?q=entertainment+news,"Irv Gotti, famed music producer and Murder Inc. co-founder, dead at 54",,"Thu, 06 Feb 2025 13:50:10 GMT","Irv Gotti, famed music producer and Murder Inc. co-founder, dead at 54","{'href': 'https://www.nbcphiladelphia.com', 'title': 'NBC Philadelphia'}"
https://news.google.com/rss/search?q=entertainment+news,"Celebrity Videos, Red Carpet Videos, Movie Trailers",,"Thu, 06 Feb 2025 15:43:46 GMT","Celebrity Videos, Red Carpet Videos, Movie Trailers","{'href': 'https://www.eonline.com', 'title': 'E! NEWS'}"
https://news.google.com/rss/search?q=entertainment+news,The unraveling of the 'Emilia Pérez' Oscar campaign: How the controversy around Karla Sofía Gascón affects the Best Picture frontrunner,,"Thu, 06 Feb 2025 16:51:52 GMT",The unraveling of the 'Emilia Pérez' Oscar campaign: How the controversy around Karla Sofía Gascón affects the Best Picture frontrunner,"{'href': 'https://www.yahoo.com', 'title': 'Yahoo Entertainment'}"
https://news.google.com/rss/search?q=entertainment+news,Britney Spears Reportedly Spotted With New Boyfriend and Kids in Rare Outing,,"Thu, 06 Feb 2025 17:37:13 GMT",Britney Spears Reportedly Spotted With New Boyfriend and Kids in Rare Outing,"{'href': 'https://www.newsweek.com', 'title': 'Newsweek'}"
https://news.google.com/rss/search?q=entertainment+news,Where Is ‘Apple Cider Vinegar’ Subject Belle Gibson Now?,,"Thu, 06 Feb 2025 18:01:51 GMT",Where Is ‘Apple Cider Vinegar’ Subject Belle Gibson Now?,"{'href': 'https://www.wfmz.com', 'title': '69News WFMZ-TV'}"
