Input URL,Title,Link,Published,Description,Source
https://news.google.com/rss/search?q=science+news,"Extinct moa ate purple trufflelike fungi, fossil bird droppings reveal",,"Thu, 06 Feb 2025 14:01:03 GMT","Extinct moa ate purple trufflelike fungi, fossil bird droppings reveal","{'href': 'https://www.sciencenews.org', 'title': 'Science News Magazine'}"
https://news.google.com/rss/search?q=science+news,Test that aims to rule out autism using a hair strand is now available,,"Thu, 06 Feb 2025 15:00:00 GMT",Test that aims to rule out autism using a hair strand is now available,"{'href': 'https://www.nbcnews.com', 'title': 'NBC News'}"
https://news.google.com/rss/search?q=science+news,New lithium-sulfur battery design boosts lifespan and flexibility,,"Thu, 06 Feb 2025 09:00:00 GMT",New lithium-sulfur battery design boosts lifespan and flexibility,"{'href': 'https://www.advancedsciencenews.com', 'title': 'Advanced Science News'}"
https://news.google.com/rss/search?q=science+news,"How to cook the perfect boiled egg, according to science",,"Thu, 06 Feb 2025 17:06:26 GMT","How to cook the perfect boiled egg, according to science","{'href': 'https://www.delta-optimist.com', 'title': 'Delta Optimist'}"
https://news.google.com/rss/search?q=technology+news,Picotech Presents Miniature Multi-Beam Survey Equipment,,"Thu, 06 Feb 2025 18:56:48 GMT",Picotech Presents Miniature Multi-Beam Survey Equipment,"{'href': 'https://www.marinetechnologynews.com', 'title': 'Marine Technology News'}"
https://news.google.com/rss/search?q=technology+news,Robotic surgery technology arrives at Missoula Bone & Joint,,"Thu, 06 Feb 2025 11:11:00 GMT",Robotic surgery technology arrives at Missoula Bone & Joint,"{'href': 'https://www.montanarightnow.com', 'title': 'Montana Right Now'}"
https://news.google.com/rss/search?q=technology+news,Windward Unveils AI Solution for Critical Maritime Infrastructure Protection,,"Thu, 06 Feb 2025 15:56:18 GMT",Windward Unveils AI Solution for Critical Maritime Infrastructure Protection,"{'href': 'https://www.marinetechnologynews.com', 'title': 'Marine Technology News'}"
https://news.google.com/rss/search?q=technology+news,IMO Adopts Revised Action Plan to Combat Marine Plastic Litter,,"Thu, 06 Feb 2025 18:36:48 GMT",IMO Adopts Revised Action Plan to Combat Marine Plastic Litter,"{'href': 'https://www.marinetechnologynews.com', 'title': 'Marine Technology News'}"
https://news.google.com/rss/search?q=technology+news,Baker Hughes Launches All-Electric Subsea Production System,,"Thu, 06 Feb 2025 13:16:17 GMT",Baker Hughes Launches All-Electric Subsea Production System,"{'href': 'https://www.marinetechnologynews.com', 'title': 'Marine Technology News'}"
https://news.google.com/rss/search?q=technology+news,News briefs: United Way of Racine County accepting grant applications to increase equity in accessing technology,,"Thu, 06 Feb 2025 14:10:10 GMT",News briefs: United Way of Racine County accepting grant applications to increase equity in accessing technology,"{'href': 'https://racinecountyeye.com', 'title': 'Racine County Eye'}"
https://news.google.com/rss/search?q=technology+news,Fugro Acquires EOMAP,,"Thu, 06 Feb 2025 13:42:40 GMT",Fugro Acquires EOMAP,"{'href': 'https://www.geoweeknews.com', 'title': 'Geo Week News'}"
https://news.google.com/rss/search?q=technology+news,Kongsberg Maritime Unveils Range of T&I Solutions for Floating Wind,,"Thu, 06 Feb 2025 10:31:16 GMT",Kongsberg Maritime Unveils Range of T&I Solutions for Floating Wind,"{'href': 'https://www.marinetechnologynews.com', 'title': 'Marine Technology News'}"
https://news.google.com/rss/search?q=technology+news,President Trump has made an appointment that has Big Tech panicked,,"Thu, 06 Feb 2025 14:00:00 GMT",President Trump has made an appointment that has Big Tech panicked,"{'href': 'https://www.foxnews.com', 'title': 'Fox News'}"
https://news.google.com/rss/search?q=technology+news,Thailand Lobbies for Chip Investments as Trump's Trade War With China Kicks Off,,"Thu, 06 Feb 2025 08:54:00 GMT",Thailand Lobbies for Chip Investments as Trump's Trade War With China Kicks Off,"{'href': 'https://www.usnews.com', 'title': 'U.S. News & World Report'}"
https://news.google.com/rss/search?q=technology+news,Tether brings USDT stablecoin to UAE real estate market with Reelly Tech,,"Thu, 06 Feb 2025 14:55:11 GMT",Tether brings USDT stablecoin to UAE real estate market with Reelly Tech,"{'href': 'https://cointelegraph.com', 'title': 'Cointelegraph'}"
https://news.google.com/rss/search?q=technology+news,Ban on China's DeepSeek starts in America with the State that an 'angry' Elon Musk moved two of his bigge,,"Thu, 06 Feb 2025 10:48:00 GMT",Ban on China's DeepSeek starts in America with the State that an 'angry' Elon Musk moved two of his bigge,"{'href': 'https://timesofindia.indiatimes.com', 'title': 'The Times of India'}"
https://news.google.com/rss/search?q=cryptocurrency+news,"Trump's social media company pushing into bitcoin, energy ETFs",,"Thu, 06 Feb 2025 15:35:56 GMT","Trump's social media company pushing into bitcoin, energy ETFs","{'href': 'https://www.axios.com', 'title': 'Axios'}"
https://news.google.com/rss/search?q=cryptocurrency+news,4 Solid Bitcoin-Centric Stocks to Buy Ahead of Next Rally,,"Thu, 06 Feb 2025 13:26:00 GMT",4 Solid Bitcoin-Centric Stocks to Buy Ahead of Next Rally,"{'href': 'https://finance.yahoo.com', 'title': 'Yahoo Finance'}"
https://news.google.com/rss/search?q=cryptocurrency+news,"Trump Media files to trademark investment products targeting bitcoin, US industries",,"Thu, 06 Feb 2025 18:10:29 GMT","Trump Media files to trademark investment products targeting bitcoin, US industries","{'href': 'https://www.reuters.com', 'title': 'Reuters'}"
https://news.google.com/rss/search?q=cryptocurrency+news,Understanding Cryptocurrency in the Modern Economy,,"Thu, 06 Feb 2025 14:58:30 GMT",Understanding Cryptocurrency in the Modern Economy,"{'href': 'https://www.riverbender.com', 'title': 'RiverBender.com'}"
https://news.google.com/rss/search?q=cryptocurrency+news,"MicroStrategy Rebrands, Posts Major Loss, Pauses Bitcoin Buying Spree",,"Thu, 06 Feb 2025 15:06:00 GMT","MicroStrategy Rebrands, Posts Major Loss, Pauses Bitcoin Buying Spree","{'href': 'https://www.investors.com', 'title': ""Investor's Business Daily""}"
https://news.google.com/rss/search?q=cryptocurrency+news,Trump’s bitcoin play sparks $10 trillion prediction,,"Thu, 06 Feb 2025 17:04:51 GMT",Trump’s bitcoin play sparks $10 trillion prediction,"{'href': 'https://blockchaintechnology-news.com', 'title': 'The Block'}"
https://news.google.com/rss/search?q=cryptocurrency+news,U.S. authorities say Canadian stole US$65M from cryptocurrency platforms,,"Thu, 06 Feb 2025 09:57:37 GMT",U.S. authorities say Canadian stole US$65M from cryptocurrency platforms,"{'href': 'https://globalnews.ca', 'title': 'Global News Toronto'}"
https://news.google.com/rss/search?q=cryptocurrency+news,"Industry leaders break down regulatory shifts in AI, cryptocurrency",,"Thu, 06 Feb 2025 12:20:00 GMT","Industry leaders break down regulatory shifts in AI, cryptocurrency","{'href': 'https://www.bizjournals.com', 'title': 'The Business Journals'}"
https://news.google.com/rss/search?q=cryptocurrency+news,The Case for Accepting MicroStrategy’s (MSTR) Billion Dollar Bitcoin Gamble,,"Thu, 06 Feb 2025 10:30:21 GMT",The Case for Accepting MicroStrategy’s (MSTR) Billion Dollar Bitcoin Gamble,"{'href': 'https://finance.yahoo.com', 'title': 'Yahoo Finance'}"
https://news.google.com/rss/search?q=cryptocurrency+news,ECB hopes Trump's crypto plan will speed up digital euro,,"Thu, 06 Feb 2025 16:57:39 GMT",ECB hopes Trump's crypto plan will speed up digital euro,"{'href': 'https://www.reuters.com', 'title': 'Reuters'}"
https://news.google.com/rss/search?q=cryptocurrency+news,"Bitcoin treasury adoption grows in LATAM, mirroring US strategic BTC reserve plan",,"Thu, 06 Feb 2025 19:19:54 GMT","Bitcoin treasury adoption grows in LATAM, mirroring US strategic BTC reserve plan","{'href': 'https://cointelegraph.com', 'title': 'Cointelegraph'}"
https://news.google.com/rss/search?q=cryptocurrency+news,Grayscale Bitcoin Mini Trust ETF AUM crosses $4B,,"Thu, 06 Feb 2025 19:05:15 GMT",Grayscale Bitcoin Mini Trust ETF AUM crosses $4B,"{'href': 'https://cointelegraph.com', 'title': 'Cointelegraph'}"
https://news.google.com/rss/search?q=cryptocurrency+news,"Cryptocurrencies Price Prediction: XRP, Bitcoin & Cryptos",,"Thu, 06 Feb 2025 19:30:26 GMT","Cryptocurrencies Price Prediction: XRP, Bitcoin & Cryptos – American Wrap 06 February","{'href': 'https://www.fxstreet.com', 'title': 'FXStreet'}"
https://news.google.com/rss/search?q=cryptocurrency+news,Trump Media files for ‘Truth․Fi Bitcoin Plus ETF’,,"Thu, 06 Feb 2025 18:04:27 GMT",Trump Media files for ‘Truth․Fi Bitcoin Plus ETF’,"{'href': 'https://cointelegraph.com', 'title': 'Cointelegraph'}"
https://news.google.com/rss/search?q=cryptocurrency+news,"Trump Media Files for Bitcoin Plus ETF and Made in America ETF, Will it Include XRP and Solana?",,"Thu, 06 Feb 2025 18:05:32 GMT","Trump Media Files for Bitcoin Plus ETF and Made in America ETF, Will it Include XRP and Solana?","{'href': 'https://bravenewcoin.com', 'title': 'Brave New Coin Insights'}"
https://news.google.com/rss/search?q=cryptocurrency+news,The intersection of cryptocurrency and renewable investments,,"Thu, 06 Feb 2025 13:13:03 GMT",The intersection of cryptocurrency and renewable investments,"{'href': 'https://www.energylivenews.com', 'title': 'Energy Live News - Energy Made Easy'}"
https://news.google.com/rss/search?q=cryptocurrency+news,Bitcoin price rises after Trump's son hints at investment,,"Thu, 06 Feb 2025 10:29:22 GMT",Bitcoin price rises after Trump's son hints at investment,"{'href': 'https://uk.finance.yahoo.com', 'title': 'Yahoo Finance UK'}"
https://news.google.com/rss/search?q=cryptocurrency+news,Bitcoin Hovers Near $98K Amid Market Volatility and Rising Dominance,,"Thu, 06 Feb 2025 16:50:49 GMT",Bitcoin Hovers Near $98K Amid Market Volatility and Rising Dominance,"{'href': 'https://news.bitcoin.com', 'title': 'Bitcoin.com News'}"
https://news.google.com/rss/search?q=cryptocurrency+news,"Trump Media and the launch of the ""Bitcoin Plus"" ETF",,"Thu, 06 Feb 2025 15:42:50 GMT","Trump Media and the launch of the ""Bitcoin Plus"" ETF","{'href': 'https://en.cryptonomist.ch', 'title': 'The Cryptonomist'}"
https://news.google.com/rss/search?q=cryptocurrency+news,"Bitcoin, taxation and the Czech Republic: a crucial topic",,"Thu, 06 Feb 2025 16:18:06 GMT","Bitcoin, taxation and the Czech Republic: a crucial topic","{'href': 'https://en.cryptonomist.ch', 'title': 'The Cryptonomist'}"
https://news.google.com/rss/search?q=cryptocurrency+news,Trump’s Social Media Firm Begins Journey To Launch A Bitcoin ETF,,"Thu, 06 Feb 2025 15:53:11 GMT",Trump’s Social Media Firm Begins Journey To Launch A Bitcoin ETF - Details | Bitcoinist.com,"{'href': 'https://bitcoinist.com', 'title': 'Bitcoinist'}"
https://news.google.com/rss/search?q=cryptocurrency+news,Bitcoin strengthens as crypto falls,,"Thu, 06 Feb 2025 10:14:55 GMT",Bitcoin strengthens as crypto falls,"{'href': 'https://www.fxstreet.com', 'title': 'FXStreet'}"
https://news.google.com/rss/search?q=cryptocurrency+news,PoliFi as the Cryptocurrency Sector's Potential Key Use Case,,"Thu, 06 Feb 2025 19:29:46 GMT",PoliFi as the Cryptocurrency Sector's Potential Key Use Case,"{'href': 'https://blockchain.news', 'title': 'Blockchain.News'}"
https://news.google.com/rss/search?q=cryptocurrency+news,Bitcoin creator Satoshi Nakamoto may be wealthier than Bill Gates,,"Thu, 06 Feb 2025 12:46:03 GMT",Bitcoin creator Satoshi Nakamoto may be wealthier than Bill Gates,"{'href': 'https://cointelegraph.com', 'title': 'Cointelegraph'}"
https://news.google.com/rss/search?q=cryptocurrency+news,"Bitcoin 'Won't Look Back' After Revisiting, Top Analyst Predicts",,"Thu, 06 Feb 2025 16:27:02 GMT","Bitcoin 'Won't Look Back' After Revisiting, Top Analyst Predicts","{'href': 'https://u.today', 'title': 'U.Today'}"
https://news.google.com/rss/search?q=cryptocurrency+news,Livid Judge in Court Case Gains Attention for Cryptocurrency Implications,,"Thu, 06 Feb 2025 15:45:02 GMT",Livid Judge in Court Case Gains Attention for Cryptocurrency Implications,"{'href': 'https://blockchain.news', 'title': 'Blockchain.News'}"
https://news.google.com/rss/search?q=cryptocurrency+news,SEC's Lead Crypto Prosecutor Reassigned as Regulatory Shift Takes Hold,,"Thu, 06 Feb 2025 18:30:08 GMT",SEC's Lead Crypto Prosecutor Reassigned as Regulatory Shift Takes Hold,"{'href': 'https://news.bitcoin.com', 'title': 'Bitcoin.com News'}"
https://news.google.com/rss/search?q=cryptocurrency+news,Poverty-Fighting Cryptocurrency Aims For Historic $250M Debut,,"Thu, 06 Feb 2025 09:27:52 GMT",Poverty-Fighting Cryptocurrency Aims For Historic $250M Debut,"{'href': 'https://cryptocoin.news', 'title': 'CryptoCoin.News'}"
https://news.google.com/rss/search?q=cryptocurrency+news,What’s next for Tampa’s hurricane-battered Beer Can Island? Cryptocurrency.,,"Thu, 06 Feb 2025 19:11:57 GMT",What’s next for Tampa’s hurricane-battered Beer Can Island? Cryptocurrency.,"{'href': 'https://www.tampabay.com', 'title': 'Tampa Bay Times'}"
https://news.google.com/rss/search?q=cryptocurrency+news,Ethereum’s Pectra Upgrade Inches Closer: Core Developer Announces Key Dates for Testnet Forks,,"Thu, 06 Feb 2025 17:50:01 GMT",Ethereum’s Pectra Upgrade Inches Closer: Core Developer Announces Key Dates for Testnet Forks,"{'href': 'https://news.bitcoin.com', 'title': 'Bitcoin.com News'}"
https://news.google.com/rss/search?q=cryptocurrency+news,"Bitcoin reserves and sovereign wealth funds in the US, explained",,"Thu, 06 Feb 2025 17:07:15 GMT","Bitcoin reserves and sovereign wealth funds in the US, explained","{'href': 'https://cointelegraph.com', 'title': 'Cointelegraph'}"
https://news.google.com/rss/search?q=cryptocurrency+news,Analysis of Recent Cryptocurrency Rug Pull Incident,,"Thu, 06 Feb 2025 18:14:55 GMT",Analysis of Recent Cryptocurrency Rug Pull Incident,"{'href': 'https://blockchain.news', 'title': 'Blockchain.News'}"
https://news.google.com/rss/search?q=cryptocurrency+news,AltcoinGordon's Analysis on Cryptocurrency Market Trends,,"Thu, 06 Feb 2025 16:35:24 GMT",AltcoinGordon's Analysis on Cryptocurrency Market Trends,"{'href': 'https://blockchain.news', 'title': 'Blockchain.News'}"
https://news.google.com/rss/search?q=cryptocurrency+news,Solana (SOL) Scores Major Blockchain Record: Has 'Ethereum Killer' Finally Arrived?,,"Thu, 06 Feb 2025 15:29:38 GMT",Solana (SOL) Scores Major Blockchain Record: Has 'Ethereum Killer' Finally Arrived?,"{'href': 'https://u.today', 'title': 'U.Today'}"
https://news.google.com/rss/search?q=cryptocurrency+news,4 reasons why Bitcoin remains bullish with BTC price above $98K,,"Thu, 06 Feb 2025 13:06:24 GMT",4 reasons why Bitcoin remains bullish with BTC price above $98K,"{'href': 'https://cointelegraph.com', 'title': 'Cointelegraph'}"
https://news.google.com/rss/search?q=cryptocurrency+news,Analysis of 10000X Growth Potential in Cryptocurrency Markets,,"Thu, 06 Feb 2025 14:59:23 GMT",Analysis of 10000X Growth Potential in Cryptocurrency Markets,"{'href': 'https://blockchain.news', 'title': 'Blockchain.News'}"
https://news.google.com/rss/search?q=cryptocurrency+news,Crypto Daybook Americas: Bitcoin Bull Postings Lift Spirits,,"Thu, 06 Feb 2025 12:00:00 GMT",Crypto Daybook Americas: Bitcoin Bull Postings Lift Spirits,"{'href': 'https://www.tradingview.com', 'title': 'TradingView'}"
https://news.google.com/rss/search?q=cryptocurrency+news,Trump Media Joins Bitcoin ETF Race—First-Ever POTUS ETF Issuer to Disrupt Wall Street,,"Thu, 06 Feb 2025 16:20:32 GMT",Trump Media Joins Bitcoin ETF Race—First-Ever POTUS ETF Issuer to Disrupt Wall Street,"{'href': 'https://news.bitcoin.com', 'title': 'Bitcoin.com News'}"
https://news.google.com/rss/search?q=cryptocurrency+news,"Trump's media company files trademarks for Made in America ETF, Bitcoin Plus ETF and more investment products",,"Thu, 06 Feb 2025 15:58:05 GMT","Trump's media company files trademarks for Made in America ETF, Bitcoin Plus ETF and more investment products","{'href': 'https://www.theblock.co', 'title': 'The Block'}"
https://news.google.com/rss/search?q=cryptocurrency+news,Alleged Trump Russia-Ukraine Peace Plan Leak: Impact on Cryptocurrency Markets,,"Thu, 06 Feb 2025 16:00:08 GMT",Alleged Trump Russia-Ukraine Peace Plan Leak: Impact on Cryptocurrency Markets,"{'href': 'https://blockchain.news', 'title': 'Blockchain.News'}"
https://news.google.com/rss/search?q=cryptocurrency+news,Vitalik Buterin Advocates for the Use of Light Clients in Cryptocurrency Wallets,,"Thu, 06 Feb 2025 19:09:59 GMT",Vitalik Buterin Advocates for the Use of Light Clients in Cryptocurrency Wallets,"{'href': 'https://blockchain.news', 'title': 'Blockchain.News'}"
https://news.google.com/rss/search?q=cryptocurrency+news,"Bitcoin To Hit $500,000 Before Trump Leaves Office as Institutional Investment Grows and Volatility Drops, Says Standard Chartered",,"Thu, 06 Feb 2025 09:05:36 GMT","Bitcoin To Hit $500,000 Before Trump Leaves Office as Institutional Investment Grows and Volatility Drops, Says Standard Chartered","{'href': 'https://coinmarketcap.com', 'title': 'CoinMarketCap'}"
https://news.google.com/rss/search?q=cryptocurrency+news,Crypto Remittances Fail to Gain Momentum in El Salvador,,"Thu, 06 Feb 2025 09:30:20 GMT",Crypto Remittances Fail to Gain Momentum in El Salvador,"{'href': 'https://news.bitcoin.com', 'title': 'Bitcoin.com News'}"
https://news.google.com/rss/search?q=cryptocurrency+news,Ripple (XRP) or Bitcoin: This Investor Weighs Whether to Buy One or Both,,"Thu, 06 Feb 2025 17:19:30 GMT",Ripple (XRP) or Bitcoin: This Investor Weighs Whether to Buy One or Both,"{'href': 'https://www.tipranks.com', 'title': 'TipRanks'}"
https://news.google.com/rss/search?q=cryptocurrency+news,Bitcoin and the “abundant” demand at $98K: the RSI breakout ignites the debate among analysts,,"Thu, 06 Feb 2025 15:26:28 GMT",Bitcoin and the “abundant” demand at $98K: the RSI breakout ignites the debate among analysts,"{'href': 'https://en.cryptonomist.ch', 'title': 'The Cryptonomist'}"
https://news.google.com/rss/search?q=cryptocurrency+news,Trading Dynamics and Risks in Cryptocurrency Markets Highlighted by @AltcoinGordon,,"Thu, 06 Feb 2025 11:08:36 GMT",Trading Dynamics and Risks in Cryptocurrency Markets Highlighted by @AltcoinGordon,"{'href': 'https://blockchain.news', 'title': 'Blockchain.News'}"
https://news.google.com/rss/search?q=cryptocurrency+news,Analysis of the Current Cryptocurrency Market Conditions,,"Thu, 06 Feb 2025 11:13:36 GMT",Analysis of the Current Cryptocurrency Market Conditions,"{'href': 'https://blockchain.news', 'title': 'Blockchain.News'}"
https://news.google.com/rss/search?q=cryptocurrency+news,Bitcoin enjoys 'plenty' of demand at $98K as analyst eyes RSI breakout,,"Thu, 06 Feb 2025 14:00:54 GMT",Bitcoin enjoys 'plenty' of demand at $98K as analyst eyes RSI breakout,"{'href': 'https://cointelegraph.com', 'title': 'Cointelegraph'}"
https://news.google.com/rss/search?q=cryptocurrency+news,Strategy: the rebranding of MicroStrategy and the adoption of the Bitcoin logo,,"Thu, 06 Feb 2025 09:29:32 GMT",Strategy: the rebranding of MicroStrategy and the adoption of the Bitcoin logo,"{'href': 'https://en.cryptonomist.ch', 'title': 'The Cryptonomist'}"
https://news.google.com/rss/search?q=cryptocurrency+news,"Alleged cryptocurrency scheme in Arran-Elderslie costs victim $35,000",,"Thu, 06 Feb 2025 15:56:23 GMT","Alleged cryptocurrency scheme in Arran-Elderslie costs victim $35,000","{'href': 'https://www.owensoundsuntimes.com', 'title': 'Owen Sound Sun Times'}"
https://news.google.com/rss/search?q=sports+news,Chicago Bears owner and matriarch Virginia Halas McCaskey dies at 102,,"Thu, 06 Feb 2025 19:23:25 GMT",Chicago Bears owner and matriarch Virginia Halas McCaskey dies at 102,"{'href': 'https://sports.yahoo.com', 'title': 'Yahoo Sports'}"
https://news.google.com/rss/search?q=sports+news,Trump signs order banning transgender women from female sports,,"Thu, 06 Feb 2025 14:32:11 GMT",Trump signs order banning transgender women from female sports,"{'href': 'https://www.bbc.com', 'title': 'BBC.com'}"
https://news.google.com/rss/search?q=sports+news,"NBA trade deadline rumors: Latest on Kevin Durant's future, Warriors want Nikola Vucevic?",,"Thu, 06 Feb 2025 19:33:22 GMT","NBA trade deadline rumors: Latest on Kevin Durant's future, Warriors want Nikola Vucevic?","{'href': 'https://www.usatoday.com', 'title': 'USA TODAY'}"
https://news.google.com/rss/search?q=sports+news,Virginia lawmakers fumble bill to curb high school sports recruitment,,"Thu, 06 Feb 2025 11:12:46 GMT",Virginia lawmakers fumble bill to curb high school sports recruitment,"{'href': 'https://wtop.com', 'title': 'WTOP'}"
https://news.google.com/rss/search?q=sports+news,Trump signs executive order banning trans women from women’s sports,,"Thu, 06 Feb 2025 14:22:00 GMT",Trump signs executive order banning trans women from women’s sports,"{'href': 'https://www.nbcnews.com', 'title': 'NBC News'}"
https://news.google.com/rss/search?q=sports+news,"Super Bowl, NFL news, live updates: Will Lamar Jackson or Josh Allen take home NFL MVP?",,"Thu, 06 Feb 2025 17:56:00 GMT","Super Bowl, NFL news, live updates: Will Lamar Jackson or Josh Allen take home NFL MVP?","{'href': 'https://sports.yahoo.com', 'title': 'Yahoo Sports'}"
https://news.google.com/rss/search?q=sports+news,The Premier League say there are no plans to host games in the US,,"Thu, 06 Feb 2025 17:31:05 GMT",The Premier League say there are no plans to host games in the US - Paper Talk,"{'href': 'https://www.skysports.com', 'title': 'Sky Sports'}"
https://news.google.com/rss/search?q=sports+news,Trump signs executive order aimed at banning transgender athletes from women’s sports,,"Thu, 06 Feb 2025 18:56:26 GMT",Trump signs executive order aimed at banning transgender athletes from women’s sports,"{'href': 'https://www.jurist.org', 'title': 'JURIST'}"
https://news.google.com/rss/search?q=sports+news,Don't give a hoot about sports? The Superb Owl might be for you,,"Thu, 06 Feb 2025 15:49:51 GMT",Don't give a hoot about sports? The Superb Owl might be for you,"{'href': 'https://www.wgbh.org', 'title': 'GBH News'}"
https://news.google.com/rss/search?q=sports+news,"CBS Sports hands out major NFL awards ahead of NFL Honors, plus ranking each of the 58 Super Bowls",,"Thu, 06 Feb 2025 18:03:51 GMT","CBS Sports hands out major NFL awards ahead of NFL Honors, plus ranking each of the 58 Super Bowls","{'href': 'https://www.cbssports.com', 'title': 'CBS Sports'}"
https://news.google.com/rss/search?q=sports+news,Tennessee Volunteer sports heroes come in all sizes,,"Thu, 06 Feb 2025 14:42:08 GMT",Tennessee Volunteer sports heroes come in all sizes,"{'href': 'https://www.knoxnews.com', 'title': 'Knoxville News Sentinel'}"
https://news.google.com/rss/search?q=sports+news,NBA trade deadline live updates: Jimmy Butler to the Warriors; Wizards trade Jonas Valančiūnas to Kings; Bucks land Kyle Kuzma,,"Thu, 06 Feb 2025 19:42:10 GMT",NBA trade deadline live updates: Jimmy Butler to the Warriors; Wizards trade Jonas Valančiūnas to Kings; Bucks land Kyle Kuzma,"{'href': 'https://sports.yahoo.com', 'title': 'Yahoo Sports'}"
https://news.google.com/rss/search?q=sports+news,Trump signs order that seeks to ban transgender athletes from women's sports,,"Thu, 06 Feb 2025 15:53:22 GMT",Trump signs order that seeks to ban transgender athletes from women's sports,"{'href': 'https://www.wgbh.org', 'title': 'GBH News'}"
https://news.google.com/rss/search?q=sports+news,"Monumental shift: Power conferences, not NCAA, to control policing athlete compensation",,"Thu, 06 Feb 2025 17:20:45 GMT","Monumental shift: Power conferences, not NCAA, to control policing athlete compensation","{'href': 'https://sports.yahoo.com', 'title': 'Yahoo Sports'}"
https://news.google.com/rss/search?q=sports+news,"Juric on team news, lack of transfer activity and Burnley",,"Thu, 06 Feb 2025 14:06:20 GMT","Juric on team news, lack of transfer activity and Burnley","{'href': 'https://sports.yahoo.com', 'title': 'Yahoo Sports'}"
https://news.google.com/rss/search?q=sports+news,"Super Bowl 2025: If you like old-school football, you should be rooting for the Eagles",,"Thu, 06 Feb 2025 18:12:26 GMT","Super Bowl 2025: If you like old-school football, you should be rooting for the Eagles","{'href': 'https://sports.yahoo.com', 'title': 'Yahoo Sports'}"
https://news.google.com/rss/search?q=sports+news,Trump expected to sign order trying to ban trans women from preferred sports teams,,"Thu, 06 Feb 2025 18:33:12 GMT",Trump expected to sign order trying to ban trans women from preferred sports teams,"{'href': 'https://www.usatoday.com', 'title': 'USA TODAY'}"
https://news.google.com/rss/search?q=sports+news,2025 Super Bowl squares strategy: How to win at football squares and Chiefs vs. Eagles grid numbers to target,,"Thu, 06 Feb 2025 18:26:24 GMT",2025 Super Bowl squares strategy: How to win at football squares and Chiefs vs. Eagles grid numbers to target,"{'href': 'https://www.cbssports.com', 'title': 'CBS Sports'}"
https://news.google.com/rss/search?q=sports+news,Illinois lawmaker wants to tie public financing for sports stadiums to team performance,,"Thu, 06 Feb 2025 17:08:44 GMT",Illinois lawmaker wants to tie public financing for sports stadiums to team performance,"{'href': 'https://www.cbsnews.com', 'title': 'CBS News'}"
