Input URL,Title,Link,Published,Description,Source
https://news.google.com/rss/search?q=tennis+news,Australian Open: Novak Djokovic quits semi-final due to torn muscle in left leg after one set versus Alexander Zverev,,"Fri, 24 Jan 2025 15:05:33 GMT",Australian Open: Novak Djokovic quits semi-final due to torn muscle in left leg after one set versus Alexander Zverev,"{'href': 'https://www.skysports.com', 'title': 'Sky Sports'}"
https://news.google.com/rss/search?q=tennis+news,Nicole Cameron steps down as Cheyenne East tennis coach,,"Fri, 24 Jan 2025 12:00:00 GMT",Nicole Cameron steps down as Cheyenne East tennis coach,"{'href': 'https://www.wyomingnews.com', 'title': 'Wyoming Tribune'}"
https://news.google.com/rss/search?q=tennis+news,Tennis world salutes insane world No. 1,,"Fri, 24 Jan 2025 12:11:15 GMT",Tennis world salutes insane world No. 1,"{'href': 'https://www.news.com.au', 'title': 'news.com.au'}"
https://news.google.com/rss/search?q=tennis+news,Novak Djokovic Announces Decision On Tennis Future After Australian Open Injury,,"Fri, 24 Jan 2025 15:55:20 GMT",Novak Djokovic Announces Decision On Tennis Future After Australian Open Injury,"{'href': 'https://www.yardbarker.com', 'title': 'Yardbarker'}"
https://news.google.com/rss/search?q=tennis+news,"Sinner sinks Shelton, advances to third major final at Australian Open",,"Fri, 24 Jan 2025 11:37:30 GMT","Sinner sinks Shelton, advances to third major final at Australian Open","{'href': 'https://www.atptour.com', 'title': 'ATP Tour'}"
https://news.google.com/rss/search?q=tennis+news,In pics: women's wheelchair doubles final at Australian Open tennis tournament,,"Fri, 24 Jan 2025 11:35:01 GMT",In pics: women's wheelchair doubles final at Australian Open tennis tournament,"{'href': 'https://english.news.cn', 'title': 'Xinhua'}"
https://news.google.com/rss/search?q=tennis+news,Novak Djokovic's earnings revealed after tennis icon pulled out of Alexander Zverev Australian Open match,,"Fri, 24 Jan 2025 14:22:22 GMT",Novak Djokovic's earnings revealed after tennis icon pulled out of Alexander Zverev Australian Open match,"{'href': 'https://www.gbnews.com', 'title': 'GB News'}"
https://news.google.com/rss/search?q=tennis+news,Australian Open: Henry Patten targets second men's doubles Slam title,,"Fri, 24 Jan 2025 11:14:31 GMT",Australian Open: Henry Patten targets second men's doubles Slam title,"{'href': 'https://www.bbc.com', 'title': 'BBC.com'}"
https://news.google.com/rss/search?q=tennis+news,Desire Burns Bright But Uncertainty Abounds For Novak Djokovic,,"Fri, 24 Jan 2025 13:31:57 GMT",Desire Burns Bright But Uncertainty Abounds For Novak Djokovic,"{'href': 'https://sports.ndtv.com', 'title': 'NDTV Sports'}"
https://news.google.com/rss/search?q=tennis+news,Andy Murray and Novak Djokovic to discuss future of coaching partnership,,"Fri, 24 Jan 2025 16:02:00 GMT",Andy Murray and Novak Djokovic to discuss future of coaching partnership,"{'href': 'https://www.theguardian.com', 'title': 'The Guardian'}"
https://news.google.com/rss/search?q=tennis+news,"Australian Open: Injured Novak Djokovic booed after withdrawing, setting up final between Alexander Zverev and defending champion Jannik Sinner",,"Fri, 24 Jan 2025 14:03:21 GMT","Australian Open: Injured Novak Djokovic booed after withdrawing, setting up final between Alexander Zverev and defending champion Jannik Sinner","{'href': 'https://sports.yahoo.com', 'title': 'Yahoo Sports'}"
https://news.google.com/rss/search?q=tennis+news,Sinner tops Shelton to return to Aussie Open final,,"Fri, 24 Jan 2025 11:32:00 GMT",Sinner tops Shelton to return to Aussie Open final,"{'href': 'https://www.espn.com', 'title': 'ESPN'}"
https://news.google.com/rss/search?q=tennis+news,"81 mins that broke Djoker as great reveals injury truth, Open future and reacts to angry fans",,"Fri, 24 Jan 2025 09:26:09 GMT","81 mins that broke Djoker as great reveals injury truth, Open future and reacts to angry fans","{'href': 'https://www.foxsports.com.au', 'title': 'Fox Sports'}"
https://news.google.com/rss/search?q=tennis+news,"Tennis Tracker: Djokovic retires hurt as Zverev heads to final, Sinner leading Shelton",,"Fri, 24 Jan 2025 10:19:18 GMT","Tennis Tracker: Djokovic retires hurt as Zverev heads to final, Sinner leading Shelton","{'href': 'https://www.flashscore.com', 'title': 'Flashscore.com'}"
https://news.google.com/rss/search?q=tennis+news,Australian Open: Sinner crushes Shelton to set up final against Zverev,,"Fri, 24 Jan 2025 16:52:11 GMT",Australian Open: Sinner crushes Shelton to set up final against Zverev,"{'href': 'https://www.hindustantimes.com', 'title': 'Hindustan Times'}"
https://news.google.com/rss/search?q=tennis+news,"Tennis-Djokovic injury rocks Australian Open, Zverev and Si",,"Fri, 24 Jan 2025 13:45:40 GMT","Tennis-Djokovic injury rocks Australian Open, Zverev and Si","{'href': 'https://www.hindustantimes.com', 'title': 'Hindustan Times'}"
https://news.google.com/rss/search?q=tennis+news,Novak Djokovic confirms this could be his last Australian Open,,"Fri, 24 Jan 2025 14:07:07 GMT",Novak Djokovic confirms this could be his last Australian Open,"{'href': 'https://www.skysports.com', 'title': 'Sky Sports'}"
