Input URL,Title,Link,Published,Description,Source
https://news.google.com/rss/search?q=tennis+news,How players in the worst tennis matchups and head-to-heads live with being a pigeon,,"Wed, 22 Jan 2025 18:10:55 GMT",How players in the worst tennis matchups and head-to-heads live with being a pigeon,"{'href': 'https://www.nytimes.com', 'title': 'The Athletic'}"
https://news.google.com/rss/search?q=tennis+news,The Australian Open’s animated tennis players: A YouTube sensation and the future of sports media,,"Wed, 22 Jan 2025 12:27:03 GMT",The Australian Open’s animated tennis players: A YouTube sensation and the future of sports media - The Athletic,"{'href': 'https://www.nytimes.com', 'title': 'The New York Times'}"
https://news.google.com/rss/search?q=tennis+news,Loan Lestir Named SEC Freshman of the Week,,"Wed, 22 Jan 2025 19:11:50 GMT",Loan Lestir Named SEC Freshman of the Week,"{'href': 'https://olemisssports.com', 'title': 'Ole Miss Athletics'}"
https://news.google.com/rss/search?q=tennis+news,Australian Open SF Preview: Can Djokovic continue his quest for 25 or will Zverev achieve a first?,,"Wed, 22 Jan 2025 11:38:14 GMT",Australian Open SF Preview: Can Djokovic continue his quest for 25 or will Zverev achieve a first?,"{'href': 'https://www.atptour.com', 'title': 'ATP Tour'}"
https://news.google.com/rss/search?q=tennis+news,Britez Risso Collects First SEC Player of the Week Honors,,"Wed, 22 Jan 2025 19:00:26 GMT",Britez Risso Collects First SEC Player of the Week Honors,"{'href': 'https://utsports.com', 'title': 'University of Tennessee Athletics'}"
https://news.google.com/rss/search?q=tennis+news,Australian Open: Jannik Sinner dominates Alex de Minaur to set up meeting with Ben Shelton in Melbourne,,"Wed, 22 Jan 2025 12:56:15 GMT",Australian Open: Jannik Sinner dominates Alex de Minaur to set up meeting with Ben Shelton in Melbourne,"{'href': 'https://www.skysports.com', 'title': 'Sky Sports'}"
https://news.google.com/rss/search?q=tennis+news,"2025 Australian Open women's semifinal odds, predictions: Sabalenka vs. Badosa picks from proven tennis expert",,"Wed, 22 Jan 2025 16:43:01 GMT","2025 Australian Open women's semifinal odds, predictions: Sabalenka vs. Badosa picks from proven tennis expert","{'href': 'https://www.cbssports.com', 'title': 'CBS Sports'}"
https://news.google.com/rss/search?q=tennis+news,No. 22 NC State men’s tennis drops ranked match against No. 21 Harvard,,"Wed, 22 Jan 2025 19:22:00 GMT",No. 22 NC State men’s tennis drops ranked match against No. 21 Harvard,"{'href': 'https://www.technicianonline.com', 'title': 'N.C. State University Technician Online'}"
https://news.google.com/rss/search?q=tennis+news,'That was some ridiculous tennis',,"Wed, 22 Jan 2025 18:10:46 GMT",'That was some ridiculous tennis' - Shelton after beating Sonego to reach semis,"{'href': 'https://www.marca.com', 'title': 'Marca English'}"
https://news.google.com/rss/search?q=tennis+news,"Sinner continues De Minaur dominance, eases into Australian Open SFs",,"Wed, 22 Jan 2025 12:56:15 GMT","Sinner continues De Minaur dominance, eases into Australian Open SFs","{'href': 'https://www.atptour.com', 'title': 'ATP Tour'}"
https://news.google.com/rss/search?q=tennis+news,APTOPIX Australian Open Tennis,,"Wed, 22 Jan 2025 16:27:00 GMT",APTOPIX Australian Open Tennis,"{'href': 'https://tucson.com', 'title': 'Arizona Daily Star'}"
https://news.google.com/rss/search?q=tennis+news,Zverev a step closer to 'dream' with victory over Paul,,"Wed, 22 Jan 2025 18:54:52 GMT",Zverev a step closer to 'dream' with victory over Paul,"{'href': 'https://ausopen.com', 'title': 'Australian Open'}"
https://news.google.com/rss/search?q=tennis+news,Women’s tennis suffers narrow loss to Mizzou,,"Wed, 22 Jan 2025 19:02:20 GMT",Women’s tennis suffers narrow loss to Mizzou,"{'href': 'https://northernstar.info', 'title': 'Northern Star Online'}"
https://news.google.com/rss/search?q=tennis+news,Australian Open LIVE: Star 'threatened' by opponent as Sinner amazed by Djokovic,,"Wed, 22 Jan 2025 18:59:00 GMT",Australian Open LIVE: Star 'threatened' by opponent as Sinner amazed by Djokovic,"{'href': 'https://www.express.co.uk', 'title': 'Express'}"
https://news.google.com/rss/search?q=tennis+news,Cameron Jackson laying the groundwork for UJ women's tennis program,,"Wed, 22 Jan 2025 13:01:05 GMT",Cameron Jackson laying the groundwork for UJ women's tennis program,"{'href': 'https://www.jamestownsun.com', 'title': 'Jamestown Sun'}"
https://news.google.com/rss/search?q=tennis+news,Iga Swiatek says what she thinks of Madison Keys' tennis as she admits what she needs to be 'ready' for in Australian Open semi-final,,"Wed, 22 Jan 2025 12:00:00 GMT",Iga Swiatek says what she thinks of Madison Keys' tennis as she admits what she needs to be 'ready' for in Australian Open semi-final,"{'href': 'https://www.thetennisgazette.com', 'title': 'The Tennis Gazette'}"
https://news.google.com/rss/search?q=tennis+news,Australian Open 2025 results: Jannik Sinner thrashes Alex de Minaur after Ben Shelton beats Lorenzo Sonego,,"Wed, 22 Jan 2025 09:52:50 GMT",Australian Open 2025 results: Jannik Sinner thrashes Alex de Minaur after Ben Shelton beats Lorenzo Sonego,"{'href': 'https://www.bbc.com', 'title': 'BBC.com'}"
https://news.google.com/rss/search?q=tennis+news,Ben Shelton slams ‘embarrassing and disrespectful’ interviews by Australian Open broadcasters,,"Wed, 22 Jan 2025 19:11:07 GMT",Ben Shelton slams ‘embarrassing and disrespectful’ interviews by Australian Open broadcasters - The Athletic,"{'href': 'https://www.nytimes.com', 'title': 'The Athletic'}"
https://news.google.com/rss/search?q=tennis+news,Ben Shelton sounds off on 'disrespectful' treatment of players by media at Australian Open,,"Wed, 22 Jan 2025 18:12:04 GMT",Ben Shelton sounds off on 'disrespectful' treatment of players by media at Australian Open,"{'href': 'https://www.cbssports.com', 'title': 'CBS Sports'}"
https://news.google.com/rss/search?q=tennis+news,Students ready for tennis,,"Wed, 22 Jan 2025 18:18:00 GMT",Students ready for tennis,"{'href': 'https://www.portasouthjetty.com', 'title': 'South Jetty'}"
https://news.google.com/rss/search?q=tennis+news,Australian Open 2025: Double bounce in Iga Swiatek's win over Emma Navarro reignites debate about video technology,,"Wed, 22 Jan 2025 08:16:06 GMT",Australian Open 2025: Double bounce in Iga Swiatek's win over Emma Navarro reignites debate about video technology,"{'href': 'https://www.bbc.com', 'title': 'BBC.com'}"
https://news.google.com/rss/search?q=tennis+news,"“If there was a better option, tennis would use it”",,"Wed, 22 Jan 2025 09:22:46 GMT","“If there was a better option, tennis would use it” – Swiatek on video review","{'href': 'https://www.tennismajors.com', 'title': 'Tennis Majors'}"
https://news.google.com/rss/search?q=tennis+news,Novak Djokovic sparks injury fears as tennis icon misses training ahead of Australian Open semi-final clash,,"Wed, 22 Jan 2025 15:21:06 GMT",Novak Djokovic sparks injury fears as tennis icon misses training ahead of Australian Open semi-final clash,"{'href': 'https://www.gbnews.com', 'title': 'GB News'}"
https://news.google.com/rss/search?q=tennis+news,"Tennis Betting: 2025 Australian Open Semifinal Picks for Sabalenka vs. Badosa, Swiatek vs. Keys",,"Wed, 22 Jan 2025 18:20:00 GMT","Tennis Betting: 2025 Australian Open Semifinal Picks for Sabalenka vs. Badosa, Swiatek vs. Keys","{'href': 'https://www.rotowire.com', 'title': 'RotoWire'}"
https://news.google.com/rss/search?q=tennis+news,"He was the No. 1 American player, beat Federer and Nadal, but retired due to anxiety issues",,"Wed, 22 Jan 2025 18:40:36 GMT","He was the No. 1 American player, beat Federer and Nadal, but retired due to anxiety issues","{'href': 'https://bolavip.com', 'title': 'Bolavip US'}"
https://news.google.com/rss/search?q=tennis+news,Sabalenka digs deep to drive to semis,,"Wed, 22 Jan 2025 14:11:45 GMT",Sabalenka digs deep to drive to semis,"{'href': 'https://ausopen.com', 'title': 'Australian Open'}"
https://news.google.com/rss/search?q=tennis+news,Australian Open 2025: Ben Shelton criticises on-court interviews,,"Wed, 22 Jan 2025 14:33:48 GMT",Australian Open 2025: Ben Shelton criticises on-court interviews,"{'href': 'https://www.bbc.com', 'title': 'BBC.com'}"
https://news.google.com/rss/search?q=tennis+news,Tennis-De Minaur counts positives but says defeat by Sinner feels like a slap,,"Wed, 22 Jan 2025 13:30:31 GMT",Tennis-De Minaur counts positives but says defeat by Sinner feels like a slap,"{'href': 'https://www.msn.com', 'title': 'MSN'}"
https://news.google.com/rss/search?q=tennis+news,Australian Open: Emma Raducanu's conqueror Iga Swiatek continues Melbourne romp to reach semi-finals,,"Wed, 22 Jan 2025 09:33:45 GMT",Australian Open: Emma Raducanu's conqueror Iga Swiatek continues Melbourne romp to reach semi-finals,"{'href': 'https://www.skysports.com', 'title': 'Sky Sports'}"
https://news.google.com/rss/search?q=tennis+news,Sinner sweeps past De Minaur to thwart home hopes of Australian Open joy,,"Wed, 22 Jan 2025 12:20:00 GMT",Sinner sweeps past De Minaur to thwart home hopes of Australian Open joy,"{'href': 'https://www.theguardian.com', 'title': 'The Guardian'}"
https://news.google.com/rss/search?q=tennis+news,Shelton slams 'disrespectful' Aussie Open media,,"Wed, 22 Jan 2025 11:23:00 GMT",Shelton slams 'disrespectful' Aussie Open media,"{'href': 'https://www.espn.com', 'title': 'ESPN'}"
https://news.google.com/rss/search?q=tennis+news,Australian Open: Ben Shelton blasts TV interviewers after reaching semi-finals,,"Wed, 22 Jan 2025 11:47:00 GMT",Australian Open: Ben Shelton blasts TV interviewers after reaching semi-finals,"{'href': 'https://www.independent.co.uk', 'title': 'The Independent'}"
https://news.google.com/rss/search?q=tennis+news,Ben Shelton blasts 'embarrassing and disrespectful' interviewers at Aus Open,,"Wed, 22 Jan 2025 10:52:00 GMT",Ben Shelton blasts 'embarrassing and disrespectful' interviewers at Aus Open,"{'href': 'https://www.express.co.uk', 'title': 'Express'}"
https://news.google.com/rss/search?q=tennis+news,‘He’s mocking me’: Reigning champ’s post-match jab at great leaves crowd in stitches,,"Wed, 22 Jan 2025 12:15:38 GMT",‘He’s mocking me’: Reigning champ’s post-match jab at great leaves crowd in stitches,"{'href': 'https://www.foxsports.com.au', 'title': 'Fox Sports'}"
https://news.google.com/rss/search?q=tennis+news,Tennis legends accuse Alcaraz of mocking Djokovic in epic Aus Open quarter-final: 'Acting like he's got some injury',,"Wed, 22 Jan 2025 09:47:11 GMT",Tennis legends accuse Alcaraz of mocking Djokovic in epic Aus Open quarter-final: 'Acting like he's got some injury',"{'href': 'https://www.firstpost.com', 'title': 'Firstpost'}"
https://news.google.com/rss/search?q=tennis+news,De Minaur feels like he's been 'slapped across the face' after heavy defeat to Sinner,,"Wed, 22 Jan 2025 14:49:35 GMT",De Minaur feels like he's been 'slapped across the face' after heavy defeat to Sinner,"{'href': 'https://www.flashscore.com', 'title': 'Flashscore.com'}"
