Input URL,Title,Link,Published,Description,Source
https://news.google.com/rss/search?q=sports+news,"Man City transfer news, rumours and gossip: Live updates and latest on deals, signings, loans and contracts",,"Wed, 22 Jan 2025 14:48:06 GMT","Man City transfer news, rumours and gossip: Live updates and latest on deals, signings, loans and contracts","{'href': 'https://www.skysports.com', 'title': 'Sky Sports'}"
https://news.google.com/rss/search?q=sports+news,"2025 NFC, AFC Championship Games: Anytime TD picks, first touchdown scorer props, SGP by top model",,"Wed, 22 Jan 2025 15:38:05 GMT","2025 NFC, AFC Championship Games: Anytime TD picks, first touchdown scorer props, SGP by top model","{'href': 'https://www.cbssports.com', 'title': 'CBS Sports'}"
https://news.google.com/rss/search?q=sports+news,Where to watch South Carolina vs. LSU: Dawn Staley's Gamecocks host undefeated Tigers in top-five SEC showdown,,"Wed, 22 Jan 2025 15:33:00 GMT",Where to watch South Carolina vs. LSU: Dawn Staley's Gamecocks host undefeated Tigers in top-five SEC showdown,"{'href': 'https://www.cbssports.com', 'title': 'CBS Sports'}"
https://news.google.com/rss/search?q=sports+news,"PSG vs. Manchester City: Where to watch UEFA Champions League live stream online, TV, prediction and odds",,"Wed, 22 Jan 2025 18:04:00 GMT","PSG vs. Manchester City: Where to watch UEFA Champions League live stream online, TV, prediction and odds","{'href': 'https://www.cbssports.com', 'title': 'CBS Sports'}"
https://news.google.com/rss/search?q=healthcare+news,Gov. Braun signs 9 healthcare-related executive orders,,"Wed, 22 Jan 2025 17:51:47 GMT",Gov. Braun signs 9 healthcare-related executive orders,"{'href': 'https://fox59.com', 'title': 'FOX 59 Indianapolis'}"
https://news.google.com/rss/search?q=healthcare+news,"Trump Reverses Some Biden Drug Pricing Initiatives, Potentially Impacting Medicare Costs",,"Wed, 22 Jan 2025 16:51:43 GMT","Trump Reverses Some Biden Drug Pricing Initiatives, Potentially Impacting Medicare Costs","{'href': 'https://www.ajmc.com', 'title': 'AJMC.com Managed Markets Network'}"
https://news.google.com/rss/search?q=healthcare+news,"Project Stargate: A $500 Billion Venture Between Oracle, Open AI, Nvidia And Softbank That Could Revolutionize Healthcare",,"Wed, 22 Jan 2025 13:00:00 GMT","Project Stargate: A $500 Billion Venture Between Oracle, Open AI, Nvidia And Softbank That Could Revolutionize Healthcare","{'href': 'https://www.forbes.com', 'title': 'Forbes'}"
https://news.google.com/rss/search?q=healthcare+news,"Exclusive: Global health funds push for more private money, fearing government retreat",,"Wed, 22 Jan 2025 14:52:38 GMT","Exclusive: Global health funds push for more private money, fearing government retreat","{'href': 'https://www.reuters.com', 'title': 'Reuters'}"
https://news.google.com/rss/search?q=healthcare+news,Trump’s federal hiring freeze raises fears about VA medical care,,"Wed, 22 Jan 2025 15:29:01 GMT",Trump’s federal hiring freeze raises fears about VA medical care,"{'href': 'https://www.militarytimes.com', 'title': 'Military Times'}"
https://news.google.com/rss/search?q=healthcare+news,Annual Mini Medical School Highlights Healthcare Career Paths for Students,,"Wed, 22 Jan 2025 12:00:00 GMT",Annual Mini Medical School Highlights Healthcare Career Paths for Students,"{'href': 'https://www.midwestern.edu', 'title': 'Midwestern University News and Events'}"
https://news.google.com/rss/search?q=healthcare+news,Americans mixed on potential Trump healthcare priorities: KFF poll,,"Wed, 22 Jan 2025 15:58:55 GMT",Americans mixed on potential Trump healthcare priorities: KFF poll,"{'href': 'https://www.healthcaredive.com', 'title': 'Healthcare Dive'}"
https://news.google.com/rss/search?q=healthcare+news,Healthcare ranks as third-most targeted ransomware victim,,"Wed, 22 Jan 2025 17:57:37 GMT",Healthcare ranks as third-most targeted ransomware victim,"{'href': 'https://www.techtarget.com', 'title': 'TechTarget'}"
https://news.google.com/rss/search?q=healthcare+news,"Governor Braun new executive orders include focus on healthcare, pro-life enforcement",,"Wed, 22 Jan 2025 17:25:05 GMT","Governor Braun new executive orders include focus on healthcare, pro-life enforcement","{'href': 'https://www.wrtv.com', 'title': 'WRTV Indianapolis'}"
https://news.google.com/rss/search?q=healthcare+news,AI models show numerous applications and benefits for radiology,,"Wed, 22 Jan 2025 16:18:09 GMT",AI models show numerous applications and benefits for radiology,"{'href': 'https://www.healthcareitnews.com', 'title': 'Healthcare IT News'}"
https://news.google.com/rss/search?q=healthcare+news,Lawmakers propose huge tax increase for single-payer health care in Washington state,,"Wed, 22 Jan 2025 13:00:00 GMT",Lawmakers propose huge tax increase for single-payer health care in Washington state | Opinion,"{'href': 'https://www.thenewstribune.com', 'title': 'Tacoma News Tribune'}"
https://news.google.com/rss/search?q=healthcare+news,Workers at Genesis HealthCare Ratify First Contract With UFCW Local 152,,"Wed, 22 Jan 2025 13:00:00 GMT",Workers at Genesis HealthCare Ratify First Contract With UFCW Local 152,"{'href': 'https://www.businesswire.com', 'title': 'Business Wire'}"
https://news.google.com/rss/search?q=healthcare+news,Healthcare reform to 'Make America Healthy Again',,"Wed, 22 Jan 2025 15:29:07 GMT",Healthcare reform to 'Make America Healthy Again',"{'href': 'https://wset.com', 'title': 'WSET'}"
https://news.google.com/rss/search?q=healthcare+news,US Family Health Plan Brighton Marine receives three Press Ganey Human Experience Pinnacle of Excellence Awards,,"Wed, 22 Jan 2025 13:25:00 GMT",US Family Health Plan Brighton Marine receives three Press Ganey Human Experience Pinnacle of Excellence Awards,"{'href': 'https://www.businesswire.com', 'title': 'Business Wire'}"
https://news.google.com/rss/search?q=healthcare+news,Healthcare wearables devices can detect IBD flare-ups,,"Wed, 22 Jan 2025 14:50:19 GMT",Healthcare wearables devices can detect IBD flare-ups,"{'href': 'https://www.techtarget.com', 'title': 'TechTarget'}"
https://news.google.com/rss/search?q=healthcare+news,Franciscan Health acquires partial ownership in Unity Health care centers in Lafayette,,"Wed, 22 Jan 2025 17:31:38 GMT",Franciscan Health acquires partial ownership in Unity Health care centers in Lafayette,"{'href': 'https://www.jconline.com', 'title': 'Journal & Courier'}"
https://news.google.com/rss/search?q=healthcare+news,Account Compromise and Phishing Top Healthcare Security Incidents,,"Wed, 22 Jan 2025 11:10:00 GMT",Account Compromise and Phishing Top Healthcare Security Incidents,"{'href': 'https://www.infosecurity-magazine.com', 'title': 'Infosecurity Magazine'}"
https://news.google.com/rss/search?q=healthcare+news,Metro Atlanta family giving back to Children's Healthcare with blanket drive,,"Wed, 22 Jan 2025 13:00:20 GMT",Metro Atlanta family giving back to Children's Healthcare with blanket drive,"{'href': 'https://www.fox5atlanta.com', 'title': 'FOX 5 Atlanta'}"
https://news.google.com/rss/search?q=healthcare+news,Jackson Study Reveals Vast Underestimation of Healthcare and Long-Term Care Costs in Retirement Planning,,"Wed, 22 Jan 2025 14:05:00 GMT",Jackson Study Reveals Vast Underestimation of Healthcare and Long-Term Care Costs in Retirement Planning,"{'href': 'https://www.businesswire.com', 'title': 'Business Wire'}"
https://news.google.com/rss/search?q=healthcare+news,How Hartford HealthCare approaches hospice care,,"Wed, 22 Jan 2025 15:19:45 GMT",How Hartford HealthCare approaches hospice care,"{'href': 'https://www.wtnh.com', 'title': 'WTNH.com'}"
https://news.google.com/rss/search?q=healthcare+news,HHS provides $590 million to Moderna amid vaccine controversy,,"Wed, 22 Jan 2025 16:34:54 GMT",HHS provides $590 million to Moderna amid vaccine controversy,"{'href': 'https://www.healthcarefinancenews.com', 'title': 'Healthcare Finance News'}"
https://news.google.com/rss/search?q=healthcare+news,CIO gives top priorities for 2025,,"Wed, 22 Jan 2025 15:49:15 GMT",CIO gives top priorities for 2025,"{'href': 'https://www.healthcarefinancenews.com', 'title': 'Healthcare Finance News'}"
https://news.google.com/rss/search?q=healthcare+news,CIO Spotlight: Michael Mainiero of Catholic Health Long Island,,"Wed, 22 Jan 2025 15:09:43 GMT",CIO Spotlight: Michael Mainiero of Catholic Health Long Island,"{'href': 'https://www.healthcareitnews.com', 'title': 'Healthcare IT News'}"
https://news.google.com/rss/search?q=healthcare+news,Rakovina Therapeutics Comments on $500 Billion AI,,"Wed, 22 Jan 2025 12:33:01 GMT",Rakovina Therapeutics Comments on $500 Billion AI,"{'href': 'https://www.globenewswire.com', 'title': 'GlobeNewswire'}"
https://news.google.com/rss/search?q=healthcare+news,Kansas healthcare professionals work to address nursing shortage,,"Wed, 22 Jan 2025 15:26:00 GMT",Kansas healthcare professionals work to address nursing shortage,"{'href': 'https://www.kansan.com', 'title': 'The University Daily Kansan'}"
https://news.google.com/rss/search?q=healthcare+news,DOJ sues Walgreens for dispensing alleged illegal prescriptions,,"Wed, 22 Jan 2025 15:49:15 GMT",DOJ sues Walgreens for dispensing alleged illegal prescriptions,"{'href': 'https://www.healthcarefinancenews.com', 'title': 'Healthcare Finance News'}"
https://news.google.com/rss/search?q=healthcare+news,Everett small business owner struggles with health insurance rate hike,,"Wed, 22 Jan 2025 13:30:00 GMT",Everett small business owner struggles with health insurance rate hike,"{'href': 'https://www.heraldnet.com', 'title': 'The Daily Herald'}"
https://news.google.com/rss/search?q=healthcare+news,Experienced nurse opens college in Mount Prospect to train next generation of health care workers,,"Wed, 22 Jan 2025 18:43:12 GMT",Experienced nurse opens college in Mount Prospect to train next generation of health care workers,"{'href': 'https://www.dailyherald.com', 'title': 'Daily Herald'}"
https://news.google.com/rss/search?q=healthcare+news,Black Kite Research Finds Certain Ransomware Groups Disproportionately Target Healthcare Organizations,,"Wed, 22 Jan 2025 14:13:00 GMT",Black Kite Research Finds Certain Ransomware Groups Disproportionately Target Healthcare Organizations,"{'href': 'https://finance.yahoo.com', 'title': 'Yahoo Finance'}"
https://news.google.com/rss/search?q=healthcare+news,Tempus launches AI healthcare data consolidation app,,"Wed, 22 Jan 2025 16:37:55 GMT",Tempus launches AI healthcare data consolidation app,"{'href': 'https://www.medicaldevice-network.com', 'title': 'Medical Device Network'}"
https://news.google.com/rss/search?q=healthcare+news,How Home Health Agencies Can Adapt To TEAM and HHVBP Models,,"Wed, 22 Jan 2025 17:23:52 GMT",How Home Health Agencies Can Adapt To TEAM and HHVBP Models,"{'href': 'https://homehealthcarenews.com', 'title': 'Home Health Care News'}"
https://news.google.com/rss/search?q=healthcare+news,Syria at a crossroads: SEMA’s vision for rebuilding healthcare and supporting older people,,"Wed, 22 Jan 2025 11:23:45 GMT",Syria at a crossroads: SEMA’s vision for rebuilding healthcare and supporting older people,"{'href': 'https://www.helpage.org', 'title': 'HelpAge International'}"
https://news.google.com/rss/search?q=healthcare+news,United Healthcare Settles Proton Beam Cancer Care Coverage Suits,,"Wed, 22 Jan 2025 13:39:00 GMT",United Healthcare Settles Proton Beam Cancer Care Coverage Suits,"{'href': 'https://news.bloomberglaw.com', 'title': 'Bloomberg Law'}"
https://news.google.com/rss/search?q=healthcare+news,Family giving back to Children's Healthcare of Atlanta,,"Wed, 22 Jan 2025 12:53:33 GMT",Family giving back to Children's Healthcare of Atlanta,"{'href': 'https://www.yahoo.com', 'title': 'Yahoo! Voices'}"
https://news.google.com/rss/search?q=healthcare+news,Frederick to increase healthcare benefits to police officers with career-ending injuries,,"Wed, 22 Jan 2025 12:30:00 GMT",Frederick to increase healthcare benefits to police officers with career-ending injuries,"{'href': 'https://www.fredericknewspost.com', 'title': 'Frederick News Post'}"
https://news.google.com/rss/search?q=healthcare+news,What To Know About Trump’s Executive Orders on US Health Care,,"Wed, 22 Jan 2025 19:00:00 GMT",What To Know About Trump’s Executive Orders on US Health Care,"{'href': 'https://kffhealthnews.org', 'title': 'Kaiser Health News'}"
https://news.google.com/rss/search?q=healthcare+news,Trump’s executive order rollback on drug price cuts alarms seniors,,"Wed, 22 Jan 2025 11:43:00 GMT",Trump’s executive order rollback on drug price cuts alarms seniors,"{'href': 'https://www.wtsp.com', 'title': 'WTSP.com'}"
https://news.google.com/rss/search?q=healthcare+news,Sonnet BioTherapeutics CEO to Present at Webull Healthcare Investment Webinar,,"Wed, 22 Jan 2025 13:35:00 GMT",Sonnet BioTherapeutics CEO to Present at Webull Healthcare Investment Webinar,"{'href': 'https://www.stocktitan.net', 'title': 'StockTitan'}"
https://news.google.com/rss/search?q=healthcare+news,Maken alleges corruption in govt healthcare projects,,"Wed, 22 Jan 2025 18:29:00 GMT",Maken alleges corruption in govt healthcare projects,"{'href': 'https://timesofindia.indiatimes.com', 'title': 'The Times of India'}"
https://news.google.com/rss/search?q=healthcare+news,Indiana's La-Z-Boy Healthcare names new president,,"Wed, 22 Jan 2025 11:42:00 GMT",Indiana's La-Z-Boy Healthcare names new president - Louisville Business First,"{'href': 'https://www.bizjournals.com', 'title': 'The Business Journals'}"
https://news.google.com/rss/search?q=healthcare+news,Youth Bureau Health Care Academy launched to empower young women in health care,,"Wed, 22 Jan 2025 15:44:13 GMT",Youth Bureau Health Care Academy launched to empower young women in health care,"{'href': 'https://westchester.news12.com', 'title': 'News 12 Westchester'}"
https://news.google.com/rss/search?q=entertainment+news,Conductor Raphaël Pichon Makes Delayed New York Debut at Age 40,,"Wed, 22 Jan 2025 16:03:00 GMT",Conductor Raphaël Pichon Makes Delayed New York Debut at Age 40,"{'href': 'https://www.usnews.com', 'title': 'U.S. News & World Report'}"
https://news.google.com/rss/search?q=entertainment+news,"Jacob Robinson Breaking News, Latest Photos, and Recent Articles",,"Wed, 22 Jan 2025 18:57:35 GMT","Jacob Robinson Breaking News, Latest Photos, and Recent Articles","{'href': 'https://www.justjared.com', 'title': 'Just Jared'}"
https://news.google.com/rss/search?q=entertainment+news,"United Airlines details 6 big inflight entertainment updates, including all-new Control Tower map",,"Wed, 22 Jan 2025 13:33:57 GMT","United Airlines details 6 big inflight entertainment updates, including all-new Control Tower map","{'href': 'https://thepointsguy.com', 'title': 'The Points Guy'}"
https://news.google.com/rss/search?q=entertainment+news,‘Mob Wives’ star Natalie DiDonato reported missing: police,,"Wed, 22 Jan 2025 17:17:00 GMT",‘Mob Wives’ star Natalie DiDonato reported missing: police,"{'href': 'https://www.foxnews.com', 'title': 'Fox News'}"
https://news.google.com/rss/search?q=entertainment+news,Taylor Swift and Morgan Wallen Lead the 2025 IHeartRadio Music Award Nominations,,"Wed, 22 Jan 2025 13:25:00 GMT",Taylor Swift and Morgan Wallen Lead the 2025 IHeartRadio Music Award Nominations,"{'href': 'https://www.usnews.com', 'title': 'U.S. News & World Report'}"
https://news.google.com/rss/search?q=entertainment+news,"Allie Trimm Breaking News, Latest Photos, and Recent Articles",,"Wed, 22 Jan 2025 17:56:19 GMT","Allie Trimm Breaking News, Latest Photos, and Recent Articles","{'href': 'https://www.justjared.com', 'title': 'Just Jared'}"
https://news.google.com/rss/search?q=entertainment+news,"George Clinton, the Doobie Brothers, Mike Love and More Get Into Songwriters Hall of Fame",,"Wed, 22 Jan 2025 14:21:51 GMT","George Clinton, the Doobie Brothers, Mike Love and More Get Into Songwriters Hall of Fame","{'href': 'https://www.usnews.com', 'title': 'U.S. News & World Report'}"
https://news.google.com/rss/search?q=entertainment+news,We Hear You. Barbra Streisand and Elton John Are Among Nominees for Audio Book Awards,,"Wed, 22 Jan 2025 13:41:27 GMT",We Hear You. Barbra Streisand and Elton John Are Among Nominees for Audio Book Awards,"{'href': 'https://www.usnews.com', 'title': 'U.S. News & World Report'}"
https://news.google.com/rss/search?q=entertainment+news,"La Dolce Villa Breaking News, Latest Photos, and Recent Articles",,"Wed, 22 Jan 2025 18:03:19 GMT","La Dolce Villa Breaking News, Latest Photos, and Recent Articles","{'href': 'https://www.justjared.com', 'title': 'Just Jared'}"
https://news.google.com/rss/search?q=entertainment+news,Drew Barrymore Reveals Sweet Nickname For Famous Costar,,"Wed, 22 Jan 2025 18:22:00 GMT",Drew Barrymore Reveals Sweet Nickname For Famous Costar,"{'href': 'https://kiisfm.iheart.com', 'title': 'On Air with Ryan Seacrest'}"
https://news.google.com/rss/search?q=entertainment+news,Billy Ray Cyrus breaks his silence after 'disaster' Trump inauguration performance,,"Wed, 22 Jan 2025 19:25:34 GMT",Billy Ray Cyrus breaks his silence after 'disaster' Trump inauguration performance,"{'href': 'https://www.the-express.com', 'title': 'Daily Express US'}"
https://news.google.com/rss/search?q=entertainment+news,'Wheel Of Fortune' Contestant Throws Ryan Seacrest To The Ground Mid-Show,,"Wed, 22 Jan 2025 14:48:00 GMT",'Wheel Of Fortune' Contestant Throws Ryan Seacrest To The Ground Mid-Show,"{'href': 'https://real1039.iheart.com', 'title': 'iHeart'}"
https://news.google.com/rss/search?q=entertainment+news,"Meghan Markle, Prince Harry's neighbors slam 'desperate' attempt to ditch 'tiaras in pursuit of Tupperware'",,"Wed, 22 Jan 2025 09:00:00 GMT","Meghan Markle, Prince Harry's neighbors slam 'desperate' attempt to ditch 'tiaras in pursuit of Tupperware'","{'href': 'https://www.foxnews.com', 'title': 'Fox News'}"
https://news.google.com/rss/search?q=entertainment+news,"Vicky Kaushal and Akshaye Khanna starrer Chhaavaa trailer unveiled, Saif Ali Khan gives auto rickshaw dri",,"Wed, 22 Jan 2025 13:30:00 GMT","Vicky Kaushal and Akshaye Khanna starrer Chhaavaa trailer unveiled, Saif Ali Khan gives auto rickshaw dri","{'href': 'https://timesofindia.indiatimes.com', 'title': 'TOI Etimes'}"
https://news.google.com/rss/search?q=entertainment+news,RHOBH's Garcelle Calls Out Kyle's 'Shady' Response to 'Lesbian' Comment,,"Wed, 22 Jan 2025 10:06:46 GMT",RHOBH's Garcelle Calls Out Kyle's 'Shady' Response to 'Lesbian' Comment,"{'href': 'https://www.usmagazine.com', 'title': 'Us Weekly'}"
https://news.google.com/rss/search?q=entertainment+news,Sting forced to cancel event and postpone tour dates just hours before taking to the stage,,"Wed, 22 Jan 2025 15:51:02 GMT",Sting forced to cancel event and postpone tour dates just hours before taking to the stage,"{'href': 'https://www.the-express.com', 'title': 'Daily Express US'}"
https://news.google.com/rss/search?q=entertainment+news,7 Iconic Hannah Montana Lines That Are Still Relatable,,"Wed, 22 Jan 2025 10:58:18 GMT",7 Iconic Hannah Montana Lines That Are Still Relatable,"{'href': 'https://zeenews.india.com', 'title': 'Zee News'}"
https://news.google.com/rss/search?q=entertainment+news,6 Anime Characters Who Can Beat Goku,,"Wed, 22 Jan 2025 10:15:57 GMT",6 Anime Characters Who Can Beat Goku,"{'href': 'https://zeenews.india.com', 'title': 'Zee News'}"
https://news.google.com/rss/search?q=entertainment+news,My Fault: London OTT Release Date: When and Where to Watch Romantic Drama Online,,"Wed, 22 Jan 2025 10:35:25 GMT",My Fault: London OTT Release Date: When and Where to Watch Romantic Drama Online,"{'href': 'https://www.gadgets360.com', 'title': 'Gadgets 360'}"
https://news.google.com/rss/search?q=entertainment+news,7 Must-Watch Indian Suspense Thriller Shows,,"Wed, 22 Jan 2025 08:06:43 GMT",7 Must-Watch Indian Suspense Thriller Shows,"{'href': 'https://zeenews.india.com', 'title': 'Zee News'}"
https://news.google.com/rss/search?q=tennis+news,American tennis star Ben Shelton puts Australian Open TV interviewers on blast over treatment of players,,"Wed, 22 Jan 2025 16:30:00 GMT",American tennis star Ben Shelton puts Australian Open TV interviewers on blast over treatment of players,"{'href': 'https://www.foxnews.com', 'title': 'Fox News'}"
https://news.google.com/rss/search?q=tennis+news,"Tennis Mailbag: 2025 Australian Open Brings Rivalries, Drama and More Upsets",,"Wed, 22 Jan 2025 15:29:50 GMT","Tennis Mailbag: 2025 Australian Open Brings Rivalries, Drama and More Upsets","{'href': 'https://www.si.com', 'title': 'Sports Illustrated'}"
https://news.google.com/rss/search?q=tennis+news,Alex de Minaur knocked out of home slam as Jannik Sinner's title defence shapes up,,"Wed, 22 Jan 2025 11:28:09 GMT",Alex de Minaur knocked out of home slam as Jannik Sinner's title defence shapes up,"{'href': 'https://www.nine.com.au', 'title': 'Nine'}"
https://news.google.com/rss/search?q=tennis+news,'I don't want to leave like this': De Minaur's exit sours best Aus Open,,"Wed, 22 Jan 2025 13:30:00 GMT",'I don't want to leave like this': De Minaur's exit sours best Aus Open,"{'href': 'https://www.abc.net.au', 'title': 'ABC News'}"
https://news.google.com/rss/search?q=tennis+news,Alex de Minaur delivers brutal response to fan after tennis star suffers Australian Open heartache,,"Wed, 22 Jan 2025 15:36:21 GMT",Alex de Minaur delivers brutal response to fan after tennis star suffers Australian Open heartache,"{'href': 'https://www.dailymail.co.uk', 'title': 'Daily Mail'}"
https://news.google.com/rss/search?q=tennis+news,‘Leave me alone’,,"Wed, 22 Jan 2025 11:57:54 GMT",‘Leave me alone’ – Madison Keys slaps Australian Open ban on Frances Tiafoe...,"{'href': 'https://talksport.com', 'title': 'talkSPORT'}"
https://news.google.com/rss/search?q=tennis+news,Ukrainian tennis player Lyudmyla Kichenok explains refusal to shake Mladenovic's hand due to threats,,"Wed, 22 Jan 2025 12:33:57 GMT",Ukrainian tennis player Lyudmyla Kichenok explains refusal to shake Mladenovic's hand due to threats,"{'href': 'https://www.pravda.com.ua', 'title': 'Ukrainska Pravda'}"
https://news.google.com/rss/search?q=tennis+news,Novak Djokovic and Carlos Alcaraz’s generational tennis rivalry and a Australian Open fever dream,,"Wed, 22 Jan 2025 11:53:14 GMT",Novak Djokovic and Carlos Alcaraz’s generational tennis rivalry and a Australian Open fever dream - The Athletic,"{'href': 'https://www.nytimes.com', 'title': 'The Athletic'}"
https://news.google.com/rss/search?q=tennis+news,Georgia Southern’s Williams & Arkansas State’s Grigoreva Named Sun Belt Tennis Players of the Week,,"Wed, 22 Jan 2025 19:06:31 GMT",Georgia Southern’s Williams & Arkansas State’s Grigoreva Named Sun Belt Tennis Players of the Week,"{'href': 'https://sunbeltsports.org', 'title': 'Sun Belt Conference'}"
https://news.google.com/rss/search?q=tennis+news,Hana Abdelhamid Earns Big Sky Tennis Player of the Week Honor,,"Wed, 22 Jan 2025 18:32:23 GMT",Hana Abdelhamid Earns Big Sky Tennis Player of the Week Honor,"{'href': 'https://goviks.com', 'title': 'Portland State Vikings'}"
https://news.google.com/rss/search?q=tennis+news,Women’s Tennis Sweeps CUSA Athlete of the Week Awards,,"Wed, 22 Jan 2025 18:45:11 GMT",Women’s Tennis Sweeps CUSA Athlete of the Week Awards,"{'href': 'https://fiusports.com', 'title': 'FIU Athletics'}"
https://news.google.com/rss/search?q=tennis+news,Division I Men’s Collegiate Tennis Team Rankings,,"Wed, 22 Jan 2025 15:50:54 GMT",Division I Men’s Collegiate Tennis Team Rankings – January 22,"{'href': 'https://wearecollegetennis.com', 'title': 'Intercollegiate Tennis Association'}"
https://news.google.com/rss/search?q=tennis+news,Denver Women’s Tennis Travels to Texas for ITA Kickoff Weekend,,"Wed, 22 Jan 2025 17:27:40 GMT",Denver Women’s Tennis Travels to Texas for ITA Kickoff Weekend,"{'href': 'https://denverpioneers.com', 'title': 'University of Denver Athletics'}"
https://news.google.com/rss/search?q=tennis+news,Sinner dominates De Minaur to reach Australian Open semifinals,,"Wed, 22 Jan 2025 12:22:30 GMT",Sinner dominates De Minaur to reach Australian Open semifinals,"{'href': 'https://www.aljazeera.com', 'title': 'Al Jazeera English'}"
https://news.google.com/rss/search?q=tennis+news,Aaron James Williams Named Sun Belt Men's Tennis Player of the Week,,"Wed, 22 Jan 2025 19:33:50 GMT",Aaron James Williams Named Sun Belt Men's Tennis Player of the Week,"{'href': 'https://gseagles.com', 'title': 'Georgia Southern Athletics'}"
https://news.google.com/rss/search?q=tennis+news,MEN’S TENNIS SWEEPS #HLTENNIS WEEKLY AWARDS,,"Wed, 22 Jan 2025 18:04:36 GMT",MEN’S TENNIS SWEEPS #HLTENNIS WEEKLY AWARDS,"{'href': 'https://iuindyjags.com', 'title': 'IU Indy Athletics'}"
https://news.google.com/rss/search?q=tennis+news,Women's Tennis Moves up to 23rd in Latest ITA Rankings,,"Wed, 22 Jan 2025 17:09:40 GMT",Women's Tennis Moves up to 23rd in Latest ITA Rankings,"{'href': 'https://ucfknights.com', 'title': 'UCF Athletics'}"
https://news.google.com/rss/search?q=tennis+news,Tennis star slams broadcasters for 'embarrassing' Australian Open interviews,,"Wed, 22 Jan 2025 13:53:25 GMT",Tennis star slams broadcasters for 'embarrassing' Australian Open interviews,"{'href': 'https://www.sportingnews.com', 'title': 'Sporting News'}"
https://news.google.com/rss/search?q=tennis+news,Ben Shelton Calls Out Tennis Announcers at Australian Open,,"Wed, 22 Jan 2025 15:41:25 GMT",Ben Shelton Calls Out Tennis Announcers at Australian Open,"{'href': 'https://www.si.com', 'title': 'Sports Illustrated'}"
