Input URL,Title,Link,Published,Description,Source
https://bitcoinmagazine.com,Human Rights Foundation Donates 1 Billion Satoshis To Fund Bitcoin Development,https://bitcoinmagazine.com/news/human-rights-foundation-donates-1-billion-satoshis-to-fund-bitcoin-development,"Tue, 01 Apr 2025 08:59:12 GMT","The Human Rights Foundation (HRF) has announced a new round of grants from its Bitcoin Development Fund, distributing 1 billion satoshis (10 BTC) to over 20 projects worldwide. The grants aim to support open-source Bitcoin development, mining decentralization, privacy tools, and educational initiatives for individuals living under authoritarian regimes, with a focus on Latin America, Africa, and Asia.

The latest cohort includes diverse projects advancing Bitcoin’s role as a financial and human rights empowerment tool.

NetBlocks, a digital rights watchdog organization, monitors and reports on internet shutdowns in real-time. Authoritarian regimes often use these shutdowns to suppress protests, throttle dissent, and restrict access to financial tools. HRF’s support will enhance NetBlocks’ monitoring, documentation, and research capabilities to reinforce internet and financial fredom.

TollGate, a project developed by ISP c03rad0r, transforms ordinary WiFi routers into decentralized internet service providers using Bitcoin and ecash. This peer-to-peer networking tool allows users to bypass centralized ISPs, offering an alternative to state-controlled internet access. With HRF funding, TollGate will continue advancing its mission of building a censorship-resistant internet that empowers individuals to communicate freely.

Vinteum is a nonprofit Bitcoin research and development center based in Latin America. It focuses on training and funding developers to contribute to the Bitcoin protocol and ecosystem. With support from HRF, Vinteum plans to expand its developer education programs, sponsor contributors, and strengthen Latin America’s Bitcoin development community, helping the region build financial alternatives to fragile fiat systems.

BTCPay Server is an open-source, self-hosted Bitcoin payment processor that allows individuals and organizations to accept Bitcoin without relying on third parties. This is especially critical in regimes where payment processors are weaponized to silence NGOs and activists. HRF’s grant will help scale BTCPay’s reach, improve usability, and increase global access to censorship-resistant payments.

Africa Bitcoin Institute (ABI), supported by Rwandan activist Anaïse Kanimba, bridges the gap between Bitcoin adoption and policy in Africa. ABI conducts research and provides policy recommendations to promote financial autonomy. With HRF’s backing, ABI will will promote financial autonomy and solidify Bitcoin’s role as a pillar of economic freedom

Bitcoin Core Graphical User Interface (GUI) – Running a full Bitcoin node is a cornerstone of financial sovereignty, but the technical interface can be a barrier. Bitcoin-core/gui-qml, a project supported by developer Go Qu, modernizes the Bitcoin Core interface to make it more intuitive, especially for mobile users in developing regions. HRF funding will support ongoing development to lower the barrier to entry for node runners globally.

Rkrux is a Bitcoin Core contributor focused on code review, bug testing, and improving documentation. His contributions help maintain Bitcoin’s resilience. HRF’s grant will allow Rkrux to continue his work, ensuring that the Bitcoin network remains robust, secure, and censorship-resistant for users around the world.

Elsat is a developer contributing to the Nostr ecosystem, including projects like Damus, Nostrability, and Zap.store. These tools offer decentralized messaging, improved app interoperability, and peer-to-peer software monetization. HRF’s grant will support ongoing development aimed at strengthening free expression and financial independence for users under authoritarian regimes.

Relay Wizard, created by developer J the Code Monkey, simplifies the process of setting up Nostr relays. These relays are essential to decentralized communication on the Nostr protocol. The tool allows non-technical users to operate their own servers, contributing to a more resilient, censorship-resistant communication infrastructure. HRF’s grant will advance development and deployment of this tool.

Waye is a support initiative co-founded by Bitcoin Core developer Amiti Uttarwar and operational architect Anna Sides. It provides psycho-social support for open-source developers building freedom tech. By addressing burnout and isolation among contributors, Waye strengthens the ecosystem’s human foundation. HRF funding will help Waye expand its reach, especially to developers from the Global South.

Hashpool is a self-hosted mining pool developed by vnprc that supports decentralization in Bitcoin mining. Rather than relying on centralized entities, miners are rewarded with ecash tokens, enabling instant, private payouts. HRF’s support will further Hashpool’s development and promote a more distributed and censorship-resistant mining landscape.

Cashu KVAC is a protocol upgrade for Cashu, a Chaumian ecash system that enables extremely strong financial privacy. Developed by lollerfirst, this improvement enhances privacy by reducing data storage and hiding transaction amounts. HRF’s grant will support further development, reinforcing financial privacy protections for vulnerable users.

Self-Custody Research: Brandon Black (Rearden) is conducting research into the challenges of self-custody for Bitcoin users in authoritarian regimes. His findings will inform new tools and education that make secure, private Bitcoin usage more accessible. HRF’s grant will fund this research and the development of educational resources.

Stable Channels is a project by Tony Klausing that introduces fiat-pegged balances to the Lightning Network, helping users avoid Bitcoin’s volatility while maintaining full custody. With HRF support, the project will expand its integrations and user outreach, enabling individuals to transact freely without relying on centralized stablecoin issuers.

Bitsacco, developed by okjodom, is a Fedimint-based platform that modernizes Kenya’s SACCO (Savings and Credit Cooperative Organization) model using Bitcoin and Fedimints. It allows community-based financial groups to operate independently of banks. HRF’s grant will fund Bitsacco’s development, training, and local deployment.

The Core, founded by Kenyan educator Felix Mukungu, provides practical Bitcoin education through workshops, meetups, and digital content. It focuses on self-custody, Lightning usage, and node operation. HRF’s support will allow The Core to expand its reach across Kenya and beyond.

Bitcoin Babies, founded by Naomi Wambui, addresses infant malnutrition and financial illiteracy through a unique program combining nutrition support and Bitcoin education. Mothers receive weekly Bitcoin stipends and training to achieve long-term financial security. HRF funding will scale the program’s reach to more families in need.

East Asia Bitcoin Developer Apprenticeship Program: Led by Calvin Kim, this program trains Korean and Japanese developers in open-source Bitcoin development. Apprentices gain hands-on experience and contribute to major projects. HRF’s support will expand access and mentorship opportunities, helping bridge the regional talent gap and supporting defectors from authoritarian governments.

Bitcoin Week at TalentLand 2025: At TalentLand, Latin America’s largest tech conference, Bitcoin Week will introduce thousands of attendees to Bitcoin through workshops and hackathons. Organized by Super Testnet and the Bitcoin and Lightning Guadalajara community, the initiative highlights Bitcoin’s role in financial empowerment. HRF’s grant will help expand the program.

Base58’s Bitcoin Live Action Role Play (LARP), created by Lisa Neigut and David Rodriguez, offers an immersive learning experience where participants simulate the Bitcoin network. By acting out transactions and node operations, learners gain a deeper understanding of Bitcoin. HRF’s support will fund facilitator training and global expansion, particularly in underserved regions.

BTCenEspañol is a leading source of Spanish-language Bitcoin education. With a goal of reaching over one million learners and training 100 instructors, the platform is expanding across South America. HRF’s grant will support teacher training, course development, and outreach in authoritarian-affected regions.

Increasing Nonprofit Adoption of Bitcoin: Researcher Daniel Batten is studying how nonprofits can use Bitcoin to overcome financial censorship. His project provides data-driven insights and practical guidance for NGOs operating in hostile environments. With HRF’s funding, the initiative will support NGOs adopting Bitcoin in regions where traditional banking is compromised.

Bitcoin for Good, led by activist Hadiya Masieh, offers hands-on training to nonprofits on how to accept Bitcoin. The goal is to enable NGOs to bypass financial restrictions and maintain independence. HRF’s grant will fund workshops, technical assistance, and organizational integration support.

Since its launch in 2020, HRF’s Bitcoin Development Fund has distributed more than $7.8 million in BTC to 284 projects in 62 countries. The next round of grants will be announced at the 17th annual Oslo Freedom Forum, taking place May 26–28, 2025, in Oslo, Norway.

The HRF is a nonpartisan, nonprofit 501(c)(3) organization that promotes and protects human rights globally, with a focus on closed societies. The HRF continues to raise support for the Bitcoin Development Fund, and interested donors can find more info on how to donate here. Applications for grant support by the HRF can be submitted here.",bitcoinmagazine
https://bitcoinmagazine.com,China’s Legalization of Bitcoin Mining Threatens Global Hashrate Distribution,https://bitcoinmagazine.com/news/chinas-legalization-of-bitcoin-mining-threatens-global-hashrate-distribution,"Tue, 01 Apr 2025 13:44:11 GMT","China’s Communist Party announced today in a surprise move that it would be reversing its stance on Bitcoin mining, legalizing mining for Chinese entities and individuals. In 2021, the Chinese government banned Bitcoin mining, citing risks of capital flight, environmental challenges, and competition to their nation’s digital currencies.

The announcement came during growing tensions between the United States government and the world’s largest Bitcoin miner manufacturer, Chinese based Bitmain. Allegedly, Bitmain skirted US sanctions on providing companies such as Huawei with AI chips. Latley, US based Bitcoin miners have been facing seizures by customs of Bitmain miners without much explanation, as reported on by Blockspace.

The move comes at a time when mining profitability is squeezing many US based mining firms. Before the Chinese mining ban, some speculated that China housed up to 75% of the global Bitcoin hashrate. Some speculate that it still has up to 20% of the global hashrate despite the ban. China’s Re-legalization of Bitcoin mining poses the possibility of an explosion in network hashrate, threatening the viability of many American firms.

Today China dominates global Bitcoin miner manufacturing with the three largest manufacturers: Bitmain, Micro BT, and Canaan, based in the communist nation. With rising tensions in trade wars, combined with the legalization of Chinese mining, many are fearful that China will restrict exports of Bitcoin mining machines to the west, meaning that the United States would be at a serious disadvantage. Luxor estimates that the United States currently has roughly 36% of the world’s hashrate with 17% of it estimated to be located in Texas.

China has been facing many economic headwinds due to the fall out of their restrictive Covid- 19 response, the deflation of their real estate bubble and the general global economic downturn and may be looking at Bitcoin as a way to help jump start their faltering economy.

Many are speculating whether this move may mean that China will be changing its tune in regards to Bitcoin in general, seeking to try and outpace the United States in stockpiling the digital currency.

If the Chinese government were to restrict exports of Chinese made Bitcoin miners, it could put the United States years behind the land of the dragon. While TSMC (The world’s largest manufacturer of semiconductors) has been building chip manufacturing plants in the United States, it will likely take some time for the other manufacturers based in the US to catch up with Bitmain, leading to a likely dominance of Bitcoin network hashrate by China.

There are some hopes though for preventing complete network centralization. “TSMC, based in Taiwan, could stop providing ASIC chips to Chinese manufacturers,” said Jason Les, CEO of Riot Platforms. “This would hurt Bitcoin’s decentralization and could escalate tensions with China.” he explained. In recent yrars, China has been floating the idea of invading Taiwan. If China were to invade the island nation, that would only raise tensions with the west who has been on and off on whether they would provide military protections to Taiwan in the case of military conflict.

Chinese premier Xi Xinping has reportedly been meeting with Kim Jong Un in recent months, learning about the North Korean Bitcoin strategy.

This is a guest post by Bitcoin Bugle. Opinions expressed are entirely their own and do not necessarily reflect those of BTC Inc or Bitcoin Magazine.",bitcoinmagazine
https://bitcoinmagazine.com,Leaked Pete Hegseth Group Chat Messages Suggest Trump Considering Nationalizing Michael Saylor’s Company Strategy,https://bitcoinmagazine.com/news/leaked-pete-hegseth-group-chat-messages-suggest-trump-considering-nationalizing-michael-saylors-company-strategy,"Tue, 01 Apr 2025 13:37:09 GMT","On Monday, the Atlantic released a series of unredacted messages from a Signal chat including various Trump administration officials discussing the administration’s desire to nationalize Strategy (formally Microstrategy) as a way to bolster the United States Bitcoin Strategic Reserve in a “budget neutral” manner.

Below are the text messages that Hegseth sent to the group of 18 senior Trump officials on March 31, according to screenshots released by The Atlantic on Monday.

TEAM UPDATE:

1000et: Strategy has been amassing Bitcoin for us. Saylor is prepared to run damage control from potential fallout.

1030et: Not sure how this move will negatively impact the price of the president’s Solana Meme Coin.

1045: Discussing strategies with social media influencers to spin narrative away from this being an executive order 6102 like event.

1055: President is concerned David Bailey will uninvite him from the Bitcoin conference if he makes this move.

1100: Jason Lowery advises to do it. Says it plays perfectly into his Softwar thesis.

1130: Brian Armstrong is also asking for Coinbase to be nationalized as well. It seems like he gets off on complying however he can.

1145: POTUS is advising to hold off until more research can be done on potential implications to his meme coin prices. MORE TO FOLLOW. We are currently clean on OPSEC. Godspeed to our crypto bags.

The messages were leaked to the Atlantic by an unnamed PODCONF official who was mistakenly added to the group chat and is concerned the events could undermine Bitcoin’s “Number Go Up.”

Why defense secretary Pete Hegseth is involved: Bitcoin seems to be a growing part of the Trump Administration’s national security policy. Financial sovereignty is a substantial part of national defense. Some speculate that Donald Trump is very proud of the way that Hegseth handled the bombing of Yemen last week.

Why it matters: Many Bitcoin users have been critical of Strategy, due to its close proximity to Langley, VA as well its choice to custody funds with Coinbase, who also custody funds for the United States government. The leaked Signal group chat log suggests that Strategy may have been operating as a front for the US government to amass a large portion of Bitcoin. A common saying in the Bitcoin community is “Not your keys, not your coins,” pointing to how the digital currency could be arbitrarily confiscated by governments if held by 3rd parties.

What Hegseth is saying: It appears Hegseth understands this will likely be an unpopular move both in the business world and the Bitcoin ecosystem. When a government nationalizes a company in order to take control of their assets, it can cause uncertainty in the business world. It seems that the Trump administration is working with a series of media personalities and influencers to try and craft a narrative in an effort to manage any tensions or fallout that could result from this move.

How this could impact Bitcoin Price: Analysts we have talked with are ambivalent on how the nationalization of Strategy could impact the price of Bitcoin. In the short term it may cause fear and uncertainty leading to a sell off, but many believe that it’s good for price in the long term as once again, it would be a vote of confidence in the digital currency from the world’s most powerful government.

Will this leak unwind the plan: The leak may have foiled the Trump Administration’s plans, yet it is unsure if they were planning on doing this versus just exploring the possibility. In 1962 the Joint Chiefs of Staff presented a plan to President Kennedy called Operation Northwoods in which acts of terrorism carried out by US intelligence agencies would be committed on US soil in an attempt to manufacture consent for the invasion of Cuba. From Hegseth’s messages, the president appeared hesitant as the move may have negative impacts on the price of his cryptocurrency holdings.

This story is continuing to break. Please check back for more updates as the story continues to develop.

This is a guest post by Bitcoin Bugle. Opinions expressed are entirely their own and do not necessarily reflect those of BTC Inc or Bitcoin Magazine.",bitcoinmagazine
https://bitcoinmagazine.com,Swan Bitcoin HR Department To Provide Crisis Counseling For Those Negatively Impacted By Maxi Madness,https://bitcoinmagazine.com/news/swan-bitcoin-hr-department-to-provide-crisis-counseling-for-those-negatively-impacted-by-maxi-madness,"Tue, 01 Apr 2025 13:29:50 GMT","Last week rumours circulated that Swan’s HR department advised their C Suite to take a mental health day following the shocking ‘Maxi Madness’ results of X (Previously Twitter). Bitcoin Bugle’s annual popularity tournament took a strange turn when 16 seed wildcard Teddy Bitcoins defeated Bitcoin fan favorite, Adam Back.

During the seven rounds of polling, Bitcoin maximalists followed in horror as Twitter villain and rumored felon Teddy Bitcoin overtook the prestigious news agency’s race with a wild voter turnout that put to shame Biden’s 2020 successful US elections sweep.

In the PODCONF sponsored showdown, Teddy Bitcoin beat legendary Bitcoin maximalists including Greg Zaj, Hodl Magoo, Adam Back, the lovely Lyn Alden and defending champion Yellow, concluding the ‘Maxi’ championship by defeating Strategy CEO Michael Saylor by a large margin.The final poll drew over 90 thousand votes, a record in the championship’s history.

At first drawing enthusiasm and sportsmanship, the tournament took a dark turn after Teddy beat championed memer Yellow in the 4rd round. The social media platform increasingly roared with ‘rees’ and accusations as Bitcoin purists searched for who to blame. Online commentators accused PODCONF, the auditor of the contest, with corruption and mismanagement. Many of these conspiracy theorists spread unsubstantiated claims on the fairness of the voting system.

Swanning to the Rescue

Swan Bitcoin, a Bitcoin brokerage service with strong brand recognition thanks to its ‘Bitcoin Maxi’ identity politics, had many employees upset by these events. Swan’s C Suite was seen protesting Teddy Bitcoin in numerous online posts, calling him a scammer, before simmering down during the alleged mental health day.

Text for image: Swan co-founder tweeted in support of inventor of proof-of-work Adam Beck competing agiainst his fellow $MSTR enthusiets Teddy Bitcoin

Ashley Marchetta, Swan’s head of Culture and People answered our request for comment: “Identity is central not only to Swan Bitcoin’s marketing and sales strategy but to our culture as a Bitcoin company. Teddy Bitcoin’s win in Maxi Madness was a clear attack on our business’ and customer’s core identity. Being a Bitcoin Maxi isn’t just about being ‘Bitcoin only’ but about ambition and keeping things clean. In our team’s view, The Bugle has slandered Bitcoin Maximalism by letting shitcoiners like Jason Williams and Teddy Bitcoins into this prestigious Maxi only tournament. These outcomes created immense mental damage to our community. We know this has been tough on the ecosystem, and are now providing community crisis counseling.” Marchetta added that they would be tasking Swan’s HR department with offering their counseling services to the broader community to help reaffirm their identities as Bitcoin maxis.

Is this good use of the firm’s resources? Many expect this move will help gain favor for Swan in the Bitcoin community which has seen a rise of Antiswanitism over the last year.

If you’re feeling distressed following Maxi Madness, please email: [email protected].

This is a guest post by Bitcoin Bugle. Opinions expressed are entirely their own and do not necessarily reflect those of BTC Inc or Bitcoin Magazine.",bitcoinmagazine
https://cryptobriefing.com,Digital Sovereignty Alliance strengthens industry advocacy at DC Blockchain Summit 2025 as Silver Sponsor,https://cryptobriefing.com/digital-sovereignty-alliance-at-blockchain-summit/,"Tue, 01 Apr 2025 14:02:49 GMT",,cryptobriefing
