Input URL,Title,Link,Published,Description,Source
https://decrypt.co,LBank Q1 Report Highlights $4B Trading Volume and 20% Surge in Traffic,https://decrypt.co/312654/lbank-q1-report-highlights-4b-trading-volume-and-20-surge-in-traffic,"Tue, 01 Apr 2025 11:05:02 GMT","Decrypt’s Art, Fashion, and Entertainment Hub. Discover SCENE

Sinagpore, Sinagpore, April 1st, 2025, Chainwire

LBank (lbank.com), a leading global cryptocurrency exchange, has released its Q1 2025 Performance Report, showcasing record-breaking trading volume, robust product growth, and major security enhancements as it solidifies its position as a global leader in digital asset trading.

LBank’s proactive approach to Fastest Altcoin Listings, Top1 in Meme Liquidity, and Pre-market Guarantee has reinforced its competitive edge. The exchange’s daily trading volume surpassed $4 billion, reflecting a 17.47% increase from the previous quarter. Meanwhile, monthly visits surged by 20%, reaching 14.9 million in Q1 2025, further cementing LBank’s position as a major force in the digital asset ecosystem.

In Q1 2025, LBank accelerated its rapid-listing strategy, adding 366 high-potential assets across memecoins, Layer 2, and DeFi sectors. Notably, about 51% of these listings were memecoins, with many achieving returns exceeding 10x. LBank’s dominance in the memecoin sector was further recognized by crypto media outlet CoinGape, which named it the “Top Choice for Meme Investment.”

Beyond asset listings, LBank introduced innovative trading mechanisms to enhance user protection and profitability. Its exclusive pre-market guarantee, the first price protection mechanism among centralized exchanges, covers 90% of assets and delivers standout performers, including $PAIN, $KAITO, and $IP, with returns peaking at 206x. Meanwhile, Launchpool projects MVHQ and RealtyX soar by 633% and 718%, respectively, empowering users to access high-potential opportunities with reduced risk.

LBank’s advanced security system prevented over 1,800 incidents in Q1, blocking potential losses exceeding $200 million. To enhance user safety, LBank launched a $100 million Futures Risk Protection Fund. Additionally, LBank forms a strategic compliance partnership with Elliptic, strengthening regulatory alignment and security protocols to uphold a transparent and compliant trading ecosystem.

LBank expanded its global presence through high-profile offline events and strategic marketing initiatives. In Hong Kong, the exchange hosted “AI in the Skyline,” a flagship industry event that attracted significant attention. Looking ahead, LBank has announced “1001 Crypto Nights” on April 30 at Dubai’s Bohemia Beach Club, an event designed to bring together top projects and global Web3 enthusiasts. These initiatives highlight LBank’s dedication to fostering community engagement and driving worldwide crypto adoption.

With a strong emphasis on product innovation and user-centric strategies, LBank is set to deliver enhanced trading solutions, expanded market access, and continued industry leadership. As market dynamics evolve, LBank remains a trusted partner, empowering users to navigate volatility with confidence and seize emerging opportunities.

About LBank

Founded in 2015, LBank is a leading global cryptocurrency exchange, serving over 15 million registered users in more than 210 countries and regions. With a daily trading volume of more than $3 billion and support for over 800 cryptocurrencies, LBank is committed to delivering a comprehensive and user-friendly trading experience. Through innovative trading solutions, LBank has helped users achieve average returns of over 130% on newly listed assets.

As a pioneer in the Meme coin market, LBank has listed over 240 mainstream Meme coins and 40 Meme gems, with several achieving gains of over 500%. As the industry leader in first-time Meme coin listings, LBank has become the go-to platform for Meme coin investors.

Users can follow LBank for Updates

Website: https://www.lbank.com/

Twitter: https://twitter.com/LBank_Exchange

Telegram: https://t.me/LBank_en

Instagram: https://www.instagram.com/lbank_exchange

LinkedIn: https://www.linkedin.com/company/lbank

Contact

PR & Communications Team

LBank

press@lbank.com



Disclaimer: Press release sponsored by our commercial partners.",decrypt
https://decrypt.co,Bitunix Launches the World's First K-Line Ultra App with TradingView Integration,https://decrypt.co/312621/bitunix-launches-the-worlds-first-k-line-ultra-app-with-tradingview-integration,"Tue, 01 Apr 2025 10:53:57 GMT","Decrypt’s Art, Fashion, and Entertainment Hub. Discover SCENE

Kingstown, St. Vincent and the Grenadines, April 1st, 2025, Chainwire

Bitunix exchange has announced that it has launched the Ultra version of the K-line (candlesticks) on its mobile app integrated with TradingView. This advanced charting system transforms the mobile trading experience for cryptocurrency traders, allowing them to enjoy a smooth candlestick experience.

Bitunix is the first exchange in the industry to integrate TradingView professional-grade features on its app, making this an Industry-Leading feature integration. This launch marks a significant milestone for the crypto exchange on a journey that began nearly four years ago.

Users can set stop-loss and take-profit levels, place limit orders, and interact with charts in real time, easily syncing with the web platform. The app offers a smooth trading experience with easy-to-use charts that allow swiping, zooming, and dragging. Traders can customize their view with various chart styles, technical indicators, and drawing tools. Plus, a refined slider feature makes order placement even more precise and user-friendly.

Traders can activate the Ultra Version K-line by navigating to the settings in the Bitunix app and selecting the Ultra Version K-line option.

Commenting on the launch and integration of this version, KX Wu, COO of Bitunix, said that this is a unique feature that no one has offered before. ""We are the first to offer this version to our users. This has come as a result of the fact that we are always looking to introduce new features for our traders. Now everything will be easier for them with our TradingView Integrated K-Line Ultra App Version,"" he said.

All TradingView Functions Now Available on Bitunix Mobile App

With the Ultra Version K-Line offering improved tools, better customization options, and an improved interface, users can analyze the market more effectively and execute trades with greater ease. Here are some of the key upgrades and features:

Chart Customization: Traders can change colors, styles, and chart settings.

Traders can change colors, styles, and chart settings. Advanced Tools: Traders can adjust candlestick shapes and use technical indicators.

Live Trading Data: See transaction history, opening costs, and active orders.

See transaction history, opening costs, and active orders. Clearer Interface: A bigger layout makes charts easier to read and use for traders.

A bigger layout makes charts easier to read and use for traders. Drag-and-Drop Trading: Ability to move stop-loss, take-profit, and limit orders directly on the chart.

Ability to move stop-loss, take-profit, and limit orders directly on the chart. More Time Frames & Drawing Tools: Traders can use trendlines, Fibonacci retracements, and other tools for deeper analysis.

Setting a New Industry Standard for Mobile Trading

Candlestick charts, or K-lines, are critical tools for cryptocurrency traders, enabling market analysis and strategic decision-making. Historically, mobile apps have struggled to match the sophistication of web-based charting tools. This version redefines mobile crypto trading by delivering a professional, web-level experience on mobile devices.

Bitunix continues to prioritize user experience, following the latest insights from the industry. According to a report on the importance of user experience in crypto trading apps, by Blockchain Magazine, improving the trading platform’s usability is crucial for attracting and retaining users in an increasingly competitive market hence the launch of the K-Line Ultra.

Breaking Records Since 2021

Since its launch in 2021, Bitunix has continuously improved its platform. Version 1 introduced spot and futures trading, followed by Version 2 in 2022, which added third-party fiat payment integration.

In 2023, Bitunix expanded with a P2P market, and in 2024, it introduced Convert and Copy Trading features along with a Multi-asset margin function. It also launched an advanced multi-window trading interface, where users can open up to 16 windows on one screen at the same time, becoming the only exchange in the world to have this feature. Looking ahead, 2025 will see the launch of Earn products and COIN-M futures trading, further elevating user experience.

In 2024, the platform demonstrated its Proof of Reserve, showcasing its commitment to security and transparency, and secured a $5 million insurance fund for its users. This led to Bitunix being ranked among the top 15 exchanges on CoinMarketCap and CoinGecko, a testament to its rapid growth and reliability. Recently Bitunix was also ranked among the top 10 crypto exchanges on CoinGlass.

During these years, Bitunix has created partnerships with industry leaders like Moonpay, Volet, Coinify, and Alchemy Pay, making purchasing crypto securely and easier. Additionally, Hacken, Certified, and Salus security audits have reinforced its commitment to user safety.

Bitunix participated at Blockchain Life 2024 conference in Dubai, was a Silver Sponsor at Token2049 Singapore, Golden Sponsor at ETH Riyadh 2024, and Title Sponsor at Web3 Amsterdam. The exchange will also participate in Paris Blockchain Week and Token2049 Dubai in 2025, among other key conferences.

The launch of the Ultra Version K-line is the culmination of all the efforts that the Bitunix team has made to make trading as easy as possible for traders. As the world's fastest-growing crypto exchange, Bitunix has been committed to continuous improvements and remains dedicated to ongoing innovation and user-driven improvements.

About Bitunix

Bitunix is a global crypto derivatives exchange founded in 2021, committed to offering simple, secure, transparent, and cost-effective trading services to its users. Bitunix specializes in both spot trading and perpetual futures, with over 700 trading pairs and leverage of up to 125x.

With features such as top-tier liquidity, 24/7 customer support, and a strong commitment to regulatory compliance, Bitunix remains at the forefront of providing a reliable trading experience for the global crypto community. Bitunix has attracted more than 2,000,000 users from over 100 countries, facilitating a daily trading volume exceeding $5 billion on its platform.

Website | Telegram | X | LinkedIn

Contact

COO

KX Wu

Bitunix

kx.wu@bitunix.io



Disclaimer: Press release sponsored by our commercial partners.",decrypt
https://decrypt.co,SEED Opens A New Chapter for GameFi Narrative After Hitting Top 1 NFT Collection on Sui,https://decrypt.co/312591/seed-opens-a-new-chapter-for-gamefi-narrative-after-hitting-top-1-nft-collection-on-sui,"Tue, 01 Apr 2025 08:37:05 GMT","Decrypt’s Art, Fashion, and Entertainment Hub. Discover SCENE

Panama, Panama, April 1st, 2025, Chainwire

Backed by strong investment, record-breaking NFT sales, and a 60-million user base, SEED is setting the new trend for the GameFi narrative. As traditional Play-to-Earn fades, SEED brings back the NFT Gaming, combining opportunities for sustainable rewards with a real playing experience. With a bold vision and long-term strategy, SEED aims to pioneer the first sustainable Web3 gaming ecosystem on Sui and set a blueprint for the future of Web3 gaming.

Strong Metrics Ahead of Listing

SEED has gained the community’s attention with notable milestones, starting with investment secured from the Sui Foundation. Building on this traction, their NFT collection recently claimed the top 1 on Sui, proving the strong demand and real value of SEED’s in-game assets. Meanwhile, $SLOVE reached Top 2 trending on DexScreener, amassing 25K+ holders in just 3 days. With support from Mysten Labs, SEED is proving that Web3 gaming is more than a trend.

SEED officially lists on April 1, 2025, at 10:00 AM (UTC) on leading exchanges like KuCoin, BingX, MEXC, and Cetus. With staking rewards and strategic token burns, including the burn of 37.5 million $SEED from the Mon Box launch, SEED is set up for long-term growth and a potential price increase of 200% or more.

The Comeback of NFT Gaming

SEED Go is the team's next big step in Play-to-Earn - a location-based game that brings Web3 gaming into the real world. By combining Play-to-Earn with real-world exploration, SEED Go is set to make Web3 gaming more interactive, immersive, and rewarding than before. Instead of playing on-screen only, players will walk to the nearest tree on the SEED map and send their SEED Mon on a hunt for $SLOVE, $SEED, and hidden treasures.

Launched on Mar 26, SEED Go has already drawn 50,000+ players, increasing every single day, into the hunt with earning potential from $5 - $50 per day. SEED Mon NFTs have already generated $2M+ in sales, fueling the demand for its in-game economy.

Looking Ahead: Expanding Gameplay and Real-World Integration

After TGE, the team's priority is to onboard more users, keep them engaged, and make sure they stay for the long run. They're also rolling out Adventure Mode and Mon Battle. Adventure Mode is where players hunt SEED Mons in the real world using their Mons. Comparable to Pokémon Go, but for blockchain gaming. Meanwhile, Mon Battle offers strategic combat against Mons for glory and rewards. And beyond all that, SEED is building a Real World Network - RWA Layer 1, integrating real-world assets, to take Web3 gaming beyond the screen.

Instead of chasing short-term hype, SEED is committed to building lasting value, real engagement, and an immersive gaming experience through its dual-token model and well-designed economy. SEED holders will continuously benefit from all DApps within the SEED ecosystem.

With a clear vision for the future, SEED aims to not only lead the charge in GameFi innovation but also lay the foundation for a new era of sustainable, real-world-integrated gaming that may shape the industry for years to come.

About SEED

From a Telegram Miniapp with over 60M users, SEED is evolving into the top RPG in Web3 gaming, inspired by the success of games like Pokémon Go and Axie Infinity. With the Sui Foundation’s backing, SEED is transforming from a Telegram Miniapp into the first 100M-user Web3 gaming ecosystem on the Sui blockchain.

Contact

COO

Alex Zhang

SEED

alex@seeddao.org

Disclaimer: Press release sponsored by our commercial partners.",decrypt
https://decrypt.co,SHRAPNEL Partners with the Chinese Government to Launch the First Licensed Web3 Game on the Nation’s Official RWA Chain,https://decrypt.co/312576/shrapnel-partners-with-the-chinese-government-to-launch-the-first-licensed-web3-game-on-the-nations-official-rwa-chain,"Tue, 01 Apr 2025 04:53:18 GMT","Decrypt’s Art, Fashion, and Entertainment Hub. Discover SCENE

Tortola, British Virgin Islands, April 1st, 2025, Chainwire

SHRAPNEL, the award-winning first-person shooter, is set to become China’s first licensed web3 game built on the nation’s official RWA Trusted Copyright Chain, where digital assets and IP rights are officially certified by government administrative bodies to enable true digital ownership for all citizens. This historic agreement aligns with China’s push into blockchain-based gaming and opens up new opportunities in the country’s multi-billion-dollar gaming market.

The launch expected this year includes:

A dedicated game launcher tailored for the Chinese market.

A marketplace built on China’s official RWA Copyright Chain, providing a suite of blockchain tools to help manage the tokenization of real-world assets in a compliant manner.

Exclusive tokenized Shrapnel in-game IP cosmetic items available only to Chinese players.

The creation of the RWA Copyright Chain shows China’s eagerness to digitize Real World Assets (RWAs), starting with the tokenization of Shrapnel IP. By putting legal records of its gaming assets on-chain, Shrapnel aims to pioneer with the Chinese government a new way of owning and trading digital assets that is fair and transparent.

As the official newspaper of the Chinese Government, People’s Daily and SHRAPNEL also reached a preliminary agreement on a monumental partnership via its digital subsidiary Lingjing Game Labs. This partnership involves the government-compliant distribution of SHRAPNEL’s localized web3 game in China, digital asset minting, issuance, free trading, and localized operations. As a government initiative, Lingjing aims to build platforms in cultural digital certification, game digital asset transformation, and game monitoring in China. (Source: People's Daily)

Recently, the SHRAPNEL team participated in a forum on ""Web3 Gaming and International Digital Copyright Collaboration"" held in Beijing with attendees including Wang Yefei, the Chairman of the Capital Copyright Association.

Refer to the official publication by the Chinese government detailing our collaborative meeting here.（Note: The government website is accessible between 9:00 AM and 5:00 PM Beijing Time. The SHRAPNEL team has also hosted the contents of the government website here to be viewed 24/7. ）

“This cooperation provides a compliant solution for overseas high-quality content to enter the Chinese market. Copyright is a global consensus. Based on this consensus, they build a blockchain digital asset system, ensure cross-border copyright circulation, and show the practical value of global promotion. Especially in the field of RWA (real-world assets), they provide a Chinese model for combining digital assets and the real economy.”

“This milestone unlocks massive potential for both SHRAPNEL and web3 gaming in China,"" said Ken Rosman, CEO of Neon Machine. ""It also sets a strong precedent for how decentralized paradigms and a nation’s government can work together to drive growth on a global scale. This is just the beginning.""

Further details about the launch and the whitepaper for the China RWA Copyright Chain will be revealed in the near future.

Gamers can follow SHRAPNEL updates at www.shrapnel.com.

About SHRAPNEL

SHRAPNEL is an intensely competitive extraction shooter developed by BAFTA and Emmy Award-winning game industry veterans at NEON. SHRAPNEL features high-stakes skill-based play, a suite of creator tools, and a community marketplace. At last, players will truly own the game.

Contact

Shrapnel

press-request@shrapnel.com

Disclaimer: Press release sponsored by our commercial partners.",decrypt
https://decrypt.co,Hot Air Rises Again as Fartcoin Outpaces Dogecoin in April Fool's Meme Rebound,https://decrypt.co/312701/fartcoin-outpaces-dogecoin-april-fools-day,"Tue, 01 Apr 2025 16:31:05 GMT","Decrypt’s Art, Fashion, and Entertainment Hub. Discover SCENE

Flatulence-themed Solana meme coin Fartcoin is on the rise again, jumping nearly 22% in the last 24 hours to $0.53 and outpacing the gains of top meme coins like Dogecoin (DOGE) and President Trump’s official Solana token (TRUMP) in the same timeframe.

The token, whose proponents use the tagline “hot air rises” when promoting its glide higher, has reclaimed a $500 million market cap after crashing to approximately $200 million in early March.

However, FARTCOIN still remains about 78% off its all-time high of $2.48 from February.

By comparison, DOGE and TRUMP have gained just 4% and 2% in the last 24 hours, respectively.

Fartcoin’s place as the top meme coin leader on April Fool’s Day may be a coincidence, but the token’s rebound of more than 108% in the last month comes amid an apparent sentiment shift among Solana meme coin traders as they hope for another potential run for the token.

“Fartcoin's outperformance today is on tens of millions of dollars in liquidity and over $10 million volume in the past 24 hours. Nothing else like this is happening in the meme coin space,” posted pseudonymous crypto personality Artchick on X (formerly Twitter) on Monday. She added that Fartcoin could be “a Trojan horse for the entire meme coin sector.”

The token’s mindshare is growing, as well, based both on X activity and on-chain data.

The name for Fartcoin was dreamed up by an AI chatbot, and data related to its mindshare is being tracked alongside other AI agent tokens via analytics platform Cookie.fun. Fartcoin currently maintains the largest mindshare among AI tokens at 13.39%, and has also posted the largest mindshare gain in the last three days, jumping 4.5% over that time.

Will the Fartcoin bounce help propel a potential meme coin comeback? It may be too early to tell, but Pump.fun token launchpad co-founder Alon Cohen told Decrypt in late March that he believes meme coins are here to stay.

“A crypto user today is as likely to be trading meme coins as they were one or two months ago,” said Cohen.

The meme category has jumped by more than 5% in the last 24 hours while Bitcoin and Ethereum have gained approximately 2% and 4% respectively, according to data from CoinGecko.

Edited by Andrew Hayward",decrypt
https://decrypt.co,"UK Police Recover $671,000 in Stolen Crypto Under Proceeds of Crime Act",https://decrypt.co/312687/uk-police-stolen-crypto-proceeds-of-crime-act,"Tue, 01 Apr 2025 15:59:26 GMT","Decrypt’s Art, Fashion, and Entertainment Hub. Discover SCENE

UK police recovered approximately $671,000 (£520,000) in crypto that was fraudulently obtained from an 80-year-old man, in what lawyers involved with the retrieval are describing as a British first under the Proceeds of Crime Act 2002.

Working in collaboration with legal firms Edmonds Marshall McMahon and 5SAH, as well as professional services company Grant Thornton, police were able to trace the misappropriated crypto via wallet addresses supplied by the victim, known only as Mr A.

They made legal use of the Proceeds of Crime Act 2002, which in October 2023 was amended to include a new, crypto-related section, enabling victims of cryptocurrency fraud to apply for the release of funds from wallets on which freezing orders have been placed.

Mr A had sent upwards of 9.1 BTC to fraudsters posing as exchange operators, with authorities able to establish that the Bitcoin had been converted into USDT by the perpetrators and sent on to an account with an “overseas exchange.”

Based on this information, a UK court ordered the repatriation of the defrauded crypto under the terms of the amended Proceeds of Crime Act.

Speaking to Decrypt, Ashley Fairbrother—a partner at London-based Edmonds Marshall McMahon—explained that it was the manner in which the assets were recovered that makes the case “groundbreaking” from a British legal perspective.

“Recent legislation under the Proceeds of Crime Act, specifically section 303Z51, empowers the Police to issue crypto wallet freezing orders,” he said. “Once in place, this allows victims to apply for the recovery of stolen assets once such orders are in place.”

At least $7.7 million (£6 million) in misbegotten crypto has now been retrieved by British police using the new crypto freezing orders, according to data from the HM Courts & Tribunals Service.

Fairbrother also explained that the process of retrieval operates within a civil regime but in criminal courts, which is unusual for the UK and which also means it requires lawyers with “very particular expertise” to execute properly.

In his view, the “legislation is a significant step forward—an innovative legal framework that streamlines the asset recovery process, provided there is constructive cooperation between the Police and victims.”

However, this is where challenges can arise, given that police forces in the UK can be uncertain about how much support to provide to victims beyond specific criminal investigations.

“But if the Police are willing to collaborate closely with victims and their legal representatives, as was the case here, this new legislation could be the silver bullet to addressing cross-border crypto fraud on a much larger scale in this country,” Fairbrother added.

In fact, Fairbrother states that Edmonds Marshall McMahon expects the retrieval of misappropriated crypto to become more routine in the UK.

He said, “given the unique nature of blockchain public distributed ledgers, it can actually be easier to recover crypto assets compared to traditional fiat asset recovery.”

Yet “significant” legislative work may be needed in order to facilitate more cooperation between the police and victims, while Fairbrother also suggests that forces would benefit from “the creation of dedicated cyber pursuit teams.”

Despite these challenges, Fairbrother is optimistic that this recent case marks the opening of a new phase in crypto law enforcement in the UK.

He said, “With more resources and a dedicated team in place, along with clear guidance, this could be a major catalyst for improving recovery efforts and making it a more routine part of the process.”

Edited by Stacy Elliott.",decrypt
