Input URL,Title,Link,Published,Description,Source
https://blockonomi.com,Coinbase Shares Fall 31% in Q1 as Crypto Market Faces Economic Headwinds,https://blockonomi.com/coinbase-shares-fall-31-in-q1-as-crypto-market-faces-economic-headwinds/,"Tue, 01 Apr 2025 09:44:09 GMT","TLDR

Coinbase shares have fallen approximately 31%, marking their worst performance since the FTX collapse in late 2022

Bitcoin has dropped over 10% this quarter while Ethereum has plummeted about 45%

The crypto downturn correlates with economic concerns, including Trump’s trade war and recession fears

Crypto-linked stocks are experiencing sharper declines than Bitcoin itself due to higher volatility

Gold has emerged as the preferred hedge against risk, seeing its best quarterly return since 1986

Coinbase (COIN) shares have plunged about 31% this quarter, marking their steepest decline since the FTX exchange collapsed in late 2022. The drop extends a four-day losing streak that has seen the stock close at $172.23, down 1% in Monday’s session.

This downturn isn’t isolated to Coinbase. Nearly every major crypto-linked stock has tumbled alongside it. Bitcoin miners have been hit especially hard, with Core Scientific (CORZ) dropping 48% and Riot Platforms (RIOT) falling over 30%.

Bitcoin itself has retreated more than 10% during the quarter. This marks one of its weakest performances despite still showing a 16% gain over the past year. Ethereum has fared even worse, crashing approximately 45% year-to-date to around $1,800.

The crypto market’s struggles come amid growing economic concerns. President Donald Trump’s escalating global trade war has sparked fears about its impact on the U.S. economy. These worries intensified after recent economic data deepened recession concerns.

Investors have rapidly fled from risky assets. Cryptocurrency and related stocks, known for their volatility, have been among the first casualties. This pattern mirrors broader market trends, with the S&P 500 heading toward its worst quarter since mid-2022.

Coinbase faces extra pressure due to its revenue model. The exchange earns from trading volumes across multiple tokens. This includes altcoins like Ethereum that have sold off even faster than Bitcoin.

“Many people in the community understand that this is not driven by fundamental reasons,” said Oppenheimer analyst Owen Lau. “This is mainly driven by the macro reasons because of the tariffs, potential trade war, people worried about a recession coming in.”

Crypto-linked stocks carry higher risk than Bitcoin itself. An investment in a company adds the threat of bankruptcy, making these stocks prone to sell off even faster during economic uncertainty.

Post-Inauguration Reality Check

The current market climate presents a stark contrast to early 2025. Optimism ran high after Trump’s election, with Bitcoin hitting a record above $109,000 on Inauguration Day in January. The price has since fallen to around $82,000.

Gold has emerged as the main hedge against current risks. The precious metal has seen its best quarterly return since 1986, reaching new all-time highs. This challenges the narrative of Bitcoin as “digital gold.”

Trump’s actions on crypto have disappointed some industry optimists. Bitcoin dropped earlier this month after he created a strategic reserve of the token. The plan did not authorize using taxpayer money to expand it, falling short of the industry’s wildest hopes.

Most crypto-linked stocks have given up their post-election gains. Michael Saylor’s Strategy (MSTR) stands as one of the few still in the green since November 5.

Technical indicators for Coinbase paint a concerning picture. The stock has retreated within a descending broadening formation since last November. The 50-day moving average appears poised to cross below the 200-day moving average, forming a bearish “death cross” pattern.

Major support levels to watch include $146, near last year’s September swing low. If selling continues below this point, the stock could drop to around $115. Resistance levels to monitor include $206, near the March countertrend peak.

Analysts warn more challenges may lie ahead. President Trump’s “Liberation Day” approaches on April 2, when aggressive tariffs are set to take effect. These could further pressure risk assets like cryptocurrencies.

Despite these market struggles, the crypto industry continues gaining influence in Washington. It’s moving closer to integration with traditional finance. However, this progress hasn’t translated into a market rebound yet.

“What we saw a couple months ago, I don’t know how much crazier it can get than that,” said Connor Loewen, a cryptocurrency analyst at 3iQ, referring to the previous investor enthusiasm. “I think we’re going to have to be looking for new catalysts.”",blockonomi
https://blockonomi.com,Coinbase CEO Advocates for Interest-Bearing Provisions in US Stablecoin Legislation,https://blockonomi.com/coinbase-ceo-advocates-for-interest-bearing-provisions-in-us-stablecoin-legislation/,"Tue, 01 Apr 2025 09:35:18 GMT","TLDR

Coinbase CEO Brian Armstrong advocates for legislation allowing stablecoin holders to earn “onchain interest”

Current stablecoin bills (STABLE Act and GENIUS Act) do not permit interest-bearing stablecoins

Armstrong argues consumers could earn around 4% yield compared to 0.41% average savings account interest

Enabling onchain interest could promote dollar dominance globally and benefit the US economy

Stablecoin issuers already hold reserves in US Treasuries but typically keep interest rather than distributing it to holders

Coinbase CEO Brian Armstrong is calling for changes to proposed stablecoin laws that would allow holders to earn interest directly from their digital assets, similar to traditional bank accounts.

In a March 31 post on social media platform X, Armstrong argued that stablecoin issuers should be “allowed to, and incentivized to, share interest with consumers.” He believes this approach would be “consistent with a free market approach.”

Currently, two competing pieces of federal stablecoin legislation are working through the US legislative process. These are the Stablecoin Transparency and Accountability for a Better Ledger Economy (STABLE) Act and the Guiding and Establishing National Innovation for US Stablecoins (GENIUS) Act.

Neither bill currently allows for interest-bearing stablecoins. The STABLE Act includes language that explicitly prohibits “payment stablecoin” issuers from paying yield to holders.

Similarly, the GENIUS Act, which recently passed the Senate Banking Committee with an 18-6 vote, has been amended to exclude interest-bearing instruments from its definition of a “payment stablecoin.”

Armstrong pointed out that while stablecoins have found market fit by “digitizing the dollar and other fiat currencies,” adding onchain interest would allow “the average person, and the US economy, to reap the full benefits.”

He highlighted the gap between potential yields and what consumers typically receive. According to Armstrong, if legislative changes allowed stablecoin issuers to pay interest to holders, US consumers could earn a yield of around 4% on their holdings.

This rate would far outstrip the 2024 average interest yield on consumer savings accounts, which Armstrong cited as 0.41%. With inflation near 3%, many Americans are actually losing purchasing power with traditional savings accounts.

Why Stablecoin Interest Matters

Stablecoin issuers already hold US Dollar reserves in low-risk investments such as short-term US Treasuries. But unlike banks, they typically retain the interest earned rather than distributing it to stablecoin holders.

Armstrong defines onchain interest as “the ability of a stablecoin to function as a form of payment and directly deliver interest earned on reserve assets to the stablecoin holder, effectively an interest-bearing checking account.”

The Coinbase CEO argues that onchain interest could benefit the broader US economy by incentivizing global use of US dollar stablecoins. This could extend “dollar dominance in an increasingly digital global economy,” according to Armstrong.

He also suggested that the potential for higher yields than traditional savings accounts would result in “more yield in consumers’ hands means more spending, saving, investing — fueling economic growth in all local economies where stablecoins are held.”

Armstrong warned that without onchain interest, “the U.S. misses out on billions more USD users and trillions in potential cash flows.”

The push for interest-bearing stablecoins has gained support from others in the crypto industry. Bitwise Chief Investment Officer Matt Hougan expressed support for Armstrong’s position, questioning opposition to yield-bearing stablecoins.

Hougan responded to arguments that suggested stablecoin issuers offering interest could affect bank deposits and their ability to offer mortgages. He countered that “free markets will develop a new way for customers to get loans to buy houses.”

Armstrong framed the issue as one of fairness. He stated, “Consumers deserve a bigger piece of the pie. Opening the door for onchain interest will force us all to up our game for the ultimate benefit of consumers, and will keep this innovation onshore.”

Some regulatory experts have noted that yield-bearing stablecoins could face more complex regulation due to similarities with securities. This is likely why current legislation has avoided including provisions for interest-bearing features.

Representative Bryan Steil commented on the current state of the STABLE Act, telling Eleanor Terrett, host of the Crypto in America podcast, that the two pieces of legislation are positioned to “mirror up” following a few more draft rounds in the House and Senate.

“At the end of the day, I think there’s recognition that we want to work with our Senate colleagues to get this across the line,” Steil said about the path forward for stablecoin legislation.

Armstrong sees the current moment as a unique opportunity to modernize the financial system. With what he described as a “pro-crypto administration and Congress actively working on stablecoin regulation,” he believes now is the time to act.

According to Armstrong, lawmakers have a choice: “We can either modernize the system to benefit consumers — or protect an outdated one that enriches middlemen.”

The Coinbase CEO particularly emphasized the potential global impact of interest-bearing stablecoins. He noted that billions of people in underbanked regions could gain access to US dollars or alternatives to volatile local currencies.

Armstrong suggested that allowing interest-bearing stablecoins would help onboard a new wave of global users into “an instant, transparent, and accessible financial system with just an internet connection.”

“No branch visits, no excessive overdraft or remittance fees. It’s equal financial access for everyone, powered by crypto rails,” Armstrong wrote in his post.",blockonomi
https://blockonomi.com,"Strategy Acquires 22,048 Bitcoin for $1.92 Billion, Expands Holdings to 528,185 BTC",https://blockonomi.com/strategy-acquires-22048-bitcoin-for-1-92-billion-expands-holdings-to-528185-btc/,"Tue, 01 Apr 2025 09:26:15 GMT","TLDR

Strategy (formerly MicroStrategy) purchased 22,048 Bitcoin worth $1.92 billion at an average price of $86,969 per BTC

The company now holds 528,185 BTC (2.55% of Bitcoin’s circulating supply) valued at $35.63 billion

The purchase was financed through a combination of stock offerings and preferred stock programs

Bitcoin price dropped to around $82,000 after the purchase, putting Strategy’s latest investment temporarily in the red

Market uncertainty is growing ahead of US President Trump’s April 2 tariff announcement

Strategy, the company formerly known as MicroStrategy, has added 22,048 Bitcoin to its holdings in a massive purchase worth approximately $1.92 billion. The acquisition was completed between March 24 and March 30, according to a filing with the U.S. Securities and Exchange Commission on March 31.

The company paid an average price of $86,969 per Bitcoin, including fees and expenses. This purchase brings Strategy’s total Bitcoin holdings to 528,185 BTC, representing about 2.55% of Bitcoin’s circulating supply.

The timing of the purchase coincided with Bitcoin moving upward, followed by a reversal that sent the price down to around $82,000. This drop means Strategy’s latest Bitcoin buy is currently down by over $100 million from its purchase price.

Strategy funded this large acquisition through several capital-raising methods. The company used proceeds from its at-the-market common stock offering, its ATM preferred stock program (STRK), and a new $711.2 million public offering of 10% Series A Perpetual Strife Preferred Stock (STRF).

The company’s Common ATM raised $1.20 billion during the reporting period. The STRK ATM contributed an additional $18.52 million to the funding pool.

The STRF offering closed on March 25 at $85.00 per share. This shows strong investor interest in equity tied to Strategy’s Bitcoin-focused treasury model.

Strategy’s total investment in Bitcoin now stands at $35.63 billion. The company has paid an average price of $67,458 per BTC across all its purchases.

This latest addition continues Strategy’s aggressive Bitcoin buying pattern in 2025. The company made a $243 million purchase in early January and a $1.99 billion purchase in February.

Bitcoin Holdings Strategy

Strategy CEO Michael Saylor has outlined an ambitious vision for the company’s Bitcoin holdings. He has described Bitcoin as a long-term asset with potential values ranging from $3 million to $49 million per coin in various scenarios.

To support its ongoing Bitcoin acquisition goals, Strategy shareholders have approved expanding the company’s Class A common stock. The authorization increases shares from 330 million to 10.3 billion.

$MSTR has acquired 22,048 BTC for ~$1.92 billion at ~$86,969 per bitcoin and has achieved BTC Yield of 11.0% YTD 2025. As of 3/30/2025, @Strategy holds 528,185 $BTC acquired for ~$35.63 billion at ~$67,458 per bitcoin. $STRK $STRF https://t.co/1sfyBIglnt — Michael Saylor⚡️ (@saylor) March 31, 2025

The company has also introduced its 21/21 Plan. This strategy aims to raise $21 billion through equity and another $21 billion through fixed-income instruments over time.

Strategy is currently showing an unrealized profit of over $7.7 billion on its Bitcoin holdings. This represents a gain of more than 21% based on current market prices.

Despite these gains, Strategy may face tax obligations on its unrealized profits. Under the Inflation Reduction Act of 2022, the company could be subject to a 15% “corporate alternative minimum tax” on its adjusted earnings.

The Bitcoin market is currently facing uncertainty ahead of US President Donald Trump’s April 2 tariff announcement. This announcement is expected to detail reciprocal trade tariffs targeting top US trading partners.

Some market observers believe the recent sell-off is not the end of the bull run. Andrei Grachev, managing partner of DWF Labs, called it “a healthy reset” and noted that “markets overreact to tariffs and macro headlines, but long-term fundamentals haven’t changed.”

Bitcoin is attempting to stabilize above the $80,000 level after dropping toward $76,000 for the first time since November 2024. Recent analysis from CryptoQuant suggests potential for price recovery based on trading volume patterns.

The Binance vs. Other Exchanges BTC Spot Volume Delta indicator has turned positive again. This indicates that Binance’s trading volume is consistently outpacing competitors, which has historically been associated with bullish market sentiment.",blockonomi
https://blockonomi.com,zkLend Hacker Loses $5.4M to Tornado Cash Phishing Site,https://blockonomi.com/zklend-hacker-loses-5-4m-to-tornado-cash-phishing-site/,"Tue, 01 Apr 2025 09:16:19 GMT","TLDR

zkLend protocol was exploited for $9.6 million in February 2025

Hacker lost 2,930 ETH ($5.4 million) by accidentally sending funds to a fake Tornado Cash phishing site

The original exploit used flash loans to inflate the lending accumulator and exploit rounding errors

zkLend had offered the hacker a 10% bounty to return funds, then later offered $500,000 for information leading to recovery

This incident is part of a larger trend of crypto security breaches, with $1.64 billion stolen in Q1 2025

The hacker who stole $9.6 million from decentralized lending protocol zkLend in February has fallen victim to a phishing scam, losing most of the stolen funds in an ironic turn of events.

According to on-chain messages sent to zkLend through Etherscan on March 31, the hacker lost 2,930 Ether (ETH) worth about $5.4 million. The funds were sent to a fake website that was pretending to be Tornado Cash, a popular crypto mixing service.

“I tried to move funds to a Tornado, but I used a phishing website, and all the funds have been lost. I am devastated,” the hacker wrote in their message to zkLend. “I am terribly sorry for all the havoc and losses caused.”

On-chain data shows the hacker made several transfers of 100 ETH at a time to an address named “Tornado.Cash: Router.” They finished with three smaller deposits of 10 ETH each before realizing their mistake.

Another user had attempted to warn the hacker about their error, telling them “don’t celebrate” because the funds were sent to a scam Tornado Cash URL. “It is so devastating. Everything gone with one wrong website,” the hacker replied.

The original exploit of zkLend took place on February 11, 2025. The attacker used a combination of small deposits and flash loans to artificially inflate the protocol’s lending accumulator.

Flash loans allow users to borrow and repay funds within a single transaction block. In this case, the hacker used them to manipulate zkLend’s system and exploit rounding errors.

From Thief to Victim: A Crypto Reversal

After the initial attack, the hacker bridged the stolen funds to the Ethereum network. They later tried to launder the money through Railgun but failed when protocol policies returned the funds to the original address.

zkLend responded to the hack by offering terms to the attacker. The protocol proposed that the hacker could keep 10% of the funds as a bounty if they returned the rest, along with a promise not to pursue legal action.

zkLend Security Incident Post Mortem. To our users, Starting on 11th of February, zkLend suffered an attack resulting in the loss of around $9.6 million USD in funds. We would like to thank our users and partners for their patience and trust in this difficult time. In addition… — zkLend (@zkLend) February 14, 2025

When the February 14 deadline passed without a response, zkLend changed tactics. On February 19, the protocol announced a $500,000 bounty for information leading to the hacker’s arrest and the recovery of funds.

After learning about the hacker’s loss to the phishing scam, zkLend asked them to “Return all the funds left in your wallets” to the protocol’s address. However, blockchain records show another 25 ETH was then sent to a different wallet listed as “Chainflip1.”

The zkLend incident is part of a larger pattern of security issues in the cryptocurrency sector. According to blockchain security firm CertiK, losses to crypto scams, exploits, and hacks totaled over $33 million in March 2025 alone.

February 2025 was even worse, with crypto-related crimes resulting in nearly $1.53 billion in losses. The largest portion came from a $1.4 billion attack on Bybit by North Korea’s Lazarus Group on February 21, which now holds the record for the largest crypto hack ever.

This massive hack doubled the previous record of $650 million stolen in the Ronin bridge hack of March 2022, showing how the scale of crypto attacks continues to grow.

According to Immunefi’s Q1 2025 report, the first three months of 2025 saw the worst quarter for crypto security breaches in history. Hackers stole a total of $1.64 billion during this period, with the zkLend hack being the fifth-largest exploit.

The report found that decentralized finance (DeFi) protocols lost $106.8 million across 38 different incidents. Ethereum and BNB Chain were the most frequently targeted networks for these attacks.

While DeFi platforms experienced multiple smaller attacks, centralized finance platforms saw just two incidents. However, those two breaches resulted in a much larger total of $1.5 billion in losses.

Security experts point to this case as a reminder of the dangers that exist even for those who exploit vulnerabilities themselves. The hacker’s mistake highlights the need for caution when interacting with any crypto services, as convincing phishing sites can fool even technically skilled individuals.

The irony of a hacker losing stolen funds to another scam has not been lost on the crypto community. This case serves as a stark reminder of the risks inherent in the cryptocurrency ecosystem, affecting everyone from regular users to malicious actors.",blockonomi
