Input URL,Title,Link,Published,Description,Source
https://news.google.com/rss/search?q=entertainment+news,'The Shining' Star Shelley Duvall Passes Away At 75,https://www.independentnews.com/lifestyles/entertainment/the-shining-star-shelley-duvall-passes-away-at-75/video_70b8a99f-11e4-55ef-8002-3e9676f09156.html,"Thu, 11 Jul 2024 16:59:45 GMT",'The Shining' Star Shelley Duvall Passes Away At 75,"{'href': 'https://www.independentnews.com', 'title': 'Livermore Independent'}"
https://news.google.com/rss/search?q=entertainment+news,Disney's 'Mickey Mouse Club' star Kerri Russell alleges girls who looked 'sexually active' got cut from show,https://www.foxnews.com/entertainment/disneys-mickey-mouse-club-star-kerri-russell-alleges-girls-looked-sexually-active-got-cut-from-show,"Thu, 11 Jul 2024 17:49:00 GMT",Disney's 'Mickey Mouse Club' star Kerri Russell alleges girls who looked 'sexually active' got cut from show,"{'href': 'https://www.foxnews.com', 'title': 'Fox News'}"
https://news.google.com/rss/search?q=entertainment+news,Frenzies Official Announcement Trailer,https://www.wfmz.com/entertainment/frenzies-official-announcement-trailer/video_7e0d3e15-f979-5fce-b798-74354ca3a912.html,"Thu, 11 Jul 2024 16:40:46 GMT",Frenzies Official Announcement Trailer,"{'href': 'https://www.wfmz.com', 'title': '69News WFMZ-TV'}"
https://news.google.com/rss/search?q=entertainment+news,'Kingdom of the Planet of the Apes' to invade San Diego Comic Con,https://hometownnewsnow.com/entertainment-news/4eea855db1c8eed8834f313086b3e29f,"Thu, 11 Jul 2024 14:04:31 GMT",'Kingdom of the Planet of the Apes' to invade San Diego Comic Con,"{'href': 'https://hometownnewsnow.com', 'title': 'Hometown News Now'}"
https://news.google.com/rss/search?q=entertainment+news,'Varsity Blues' mom Felicity Huffman makes TV return but may never hit ‘peak celebrity status' again: expert,https://www.foxnews.com/entertainment/varsity-blues-mom-felicity-huffman-makes-tv-return-may-never-hit-peak-celebrity-status-again-expert,"Thu, 11 Jul 2024 08:30:00 GMT",'Varsity Blues' mom Felicity Huffman makes TV return but may never hit ‘peak celebrity status' again: expert,"{'href': 'https://www.foxnews.com', 'title': 'Fox News'}"
https://news.google.com/rss/search?q=entertainment+news,"Shelley Duvall, 'Nashville' and 'The Shining' star, dies at 75",https://hometownnewsnow.com/entertainment-news/88a14e49b68481dc75fd7840e509287b,"Thu, 11 Jul 2024 16:53:04 GMT","Shelley Duvall, 'Nashville' and 'The Shining' star, dies at 75","{'href': 'https://hometownnewsnow.com', 'title': 'Hometown News Now'}"
https://news.google.com/rss/search?q=entertainment+news,"Shelley Duvall, The Shining and Nashville star, passes away at 75",https://www.hindustantimes.com/entertainment/others/shelley-duvall-the-shining-and-nashville-star-passes-away-at-75-101720717739491.html,"Thu, 11 Jul 2024 17:16:50 GMT","Shelley Duvall, The Shining and Nashville star, passes away at 75","{'href': 'https://www.hindustantimes.com', 'title': 'Hindustan Times'}"
https://news.google.com/rss/search?q=entertainment+news,"""Pretty girls should always smile"": Teaser drops for Demi Moore's horror pic 'The Substance'",https://hometownnewsnow.com/entertainment-news/fd3d93838b2774c5afb49f8c7872574e,"Thu, 11 Jul 2024 14:32:48 GMT","""Pretty girls should always smile"": Teaser drops for Demi Moore's horror pic 'The Substance'","{'href': 'https://hometownnewsnow.com', 'title': 'Hometown News Now'}"
https://news.google.com/rss/search?q=entertainment+news,PHOTOS: Matthew McConaughey's Eye Swells Shut From 'Nasty' Nature Incident,https://star941fm.iheart.com/content/2024-07-11-photos-matthew-mcconaugheys-eye-swells-shut-from-nasty-nature-incident/,"Thu, 11 Jul 2024 15:37:00 GMT",PHOTOS: Matthew McConaughey's Eye Swells Shut From 'Nasty' Nature Incident,"{'href': 'https://star941fm.iheart.com', 'title': 'iHeart'}"
https://news.google.com/rss/search?q=entertainment+news,Kris Jenner Unveils 'Very Sad' Health Update Following Emotional Surgery,https://1047kissfm.iheart.com/content/2024-07-11-kris-jenner-unveils-very-sad-health-update-following-emotional-surgery/,"Thu, 11 Jul 2024 14:56:00 GMT",Kris Jenner Unveils 'Very Sad' Health Update Following Emotional Surgery,"{'href': 'https://1047kissfm.iheart.com', 'title': 'iHeart'}"
https://news.google.com/rss/search?q=entertainment+news,Queen presents children with books during primary school visit,https://www.wfmz.com/entertainment/queen-presents-children-with-books-during-primary-school-visit/video_af54cf5d-a782-5df0-9fa5-9dfb536d78b8.html,"Thu, 11 Jul 2024 17:06:35 GMT",Queen presents children with books during primary school visit,"{'href': 'https://www.wfmz.com', 'title': '69News WFMZ-TV'}"
https://news.google.com/rss/search?q=entertainment+news,Blake Lively Eagerly Reveals The 'Best Compliment' She's Ever Received,https://sunny1065.iheart.com/content/2024-07-11-blake-lively-eagerly-reveals-the-best-compliment-shes-ever-received/,"Thu, 11 Jul 2024 15:59:00 GMT",Blake Lively Eagerly Reveals The 'Best Compliment' She's Ever Received,"{'href': 'https://sunny1065.iheart.com', 'title': 'iHeart'}"
https://news.google.com/rss/search?q=entertainment+news,What's Really Inside Fort Knox?,https://www.wfmz.com/entertainment/whats-really-inside-fort-knox/video_ee8cd122-bbcb-5a13-bc64-34e7a82f37d4.html,"Thu, 11 Jul 2024 09:09:32 GMT",What's Really Inside Fort Knox?,"{'href': 'https://www.wfmz.com', 'title': '69News WFMZ-TV'}"
https://news.google.com/rss/search?q=entertainment+news,Entertainment News : LGD Gaming Malaysia emerge as Honor of Kings Invitational Season 2 champions,https://www.gosugamers.net/entertainment/news/72112-lgd-gaming-malaysia-emerge-as-honor-of-kings-invitational-season-2-champions,"Thu, 11 Jul 2024 08:50:34 GMT",Entertainment News : LGD Gaming Malaysia emerge as Honor of Kings Invitational Season 2 champions,"{'href': 'https://www.gosugamers.net', 'title': 'GosuGamers'}"
https://news.google.com/rss/search?q=entertainment+news,"Priyanka Chopra-Nick Jonas reaches India, Kim Kardashian rumoured to attend Anant-Radhika's wedding, Yo Y",https://timesofindia.indiatimes.com/entertainment/hindi/bollywood/news/priyanka-chopra-nick-jonas-reaches-india-kim-kardashian-rumoured-to-attend-anant-radhikas-wedding-yo-yo-honey-singh-finds-love-again-top-5-entertainment-news-of-the-day/articleshow/111664702.cms,"Thu, 11 Jul 2024 13:30:00 GMT","Priyanka Chopra-Nick Jonas reaches India, Kim Kardashian rumoured to attend Anant-Radhika's wedding, Yo Y","{'href': 'https://timesofindia.indiatimes.com', 'title': 'TOI Etimes'}"
https://news.google.com/rss/search?q=entertainment+news,"Alexandra Daddario confirms pregnancy, shows off baby bump on Instagram",https://www.financialexpress.com/life/entertainment-alexandra-daddario-confirms-pregnancy-shows-off-baby-bump-on-instagram-3550474/,"Thu, 11 Jul 2024 08:05:03 GMT","Alexandra Daddario confirms pregnancy, shows off baby bump on Instagram","{'href': 'https://www.financialexpress.com', 'title': 'The Financial Express'}"
https://news.google.com/rss/search?q=tennis+news,Year in Review: Men's Tennis,https://gostanford.com/news/2024/07/11/year-in-review-mens-tennis-2024,"Thu, 11 Jul 2024 18:16:35 GMT",Year in Review: Men's Tennis,"{'href': 'https://gostanford.com', 'title': 'Stanford Athletics'}"
https://news.google.com/rss/search?q=tennis+news,‘Even Jordan doesn’t have his face on a sneaker’: How Stan Smith became both a tennis and fashion icon,https://www.cnn.com/2024/07/11/sport/stan-smith-tennis-fashion-icon-wimbledon-spt-intl/index.html,"Thu, 11 Jul 2024 12:03:00 GMT",‘Even Jordan doesn’t have his face on a sneaker’: How Stan Smith became both a tennis and fashion icon,"{'href': 'https://www.cnn.com', 'title': 'CNN'}"
https://news.google.com/rss/search?q=tennis+news,Federer and Zendaya battle in a tennis match in an “On” commercial,https://tennistonic.com/tennis-news/739136/federer-and-zendaya-battle-in-a-tennis-match-in-an-on-commercial/,"Thu, 11 Jul 2024 15:40:26 GMT",Federer and Zendaya battle in a tennis match in an “On” commercial,"{'href': 'https://tennistonic.com', 'title': 'Tennis Tonic'}"
https://news.google.com/rss/search?q=tennis+news,Maple Leafs Star William Nylander Pictured Alongside Fellow Swede and Junior Tennis Player William Rejchtman Vinciguerra at Prestigious Wimbledon Tournament,https://thehockeynews.com/nhl/toronto-maple-leafs/latest-news/maple-leafs-star-william-nylander-pictured-alongside-fellow-swede-and-junior-tennis-player-william-rejchtman-vinciguerra-at-prestigious-wimbledon-tournament,"Thu, 11 Jul 2024 12:00:00 GMT",Maple Leafs Star William Nylander Pictured Alongside Fellow Swede and Junior Tennis Player William Rejchtman Vinciguerra at Prestigious Wimbledon Tournament,"{'href': 'https://thehockeynews.com', 'title': 'The Hockey News'}"
https://news.google.com/rss/search?q=tennis+news,Do not bet against greatness: Amritraj on Djokovic,https://www.hindustantimes.com/sports/tennis/do-not-bet-against-greatness-amritraj-on-djokovic-101720716489905.html,"Thu, 11 Jul 2024 16:48:09 GMT",Do not bet against greatness: Amritraj on Djokovic,"{'href': 'https://www.hindustantimes.com', 'title': 'Hindustan Times'}"
https://news.google.com/rss/search?q=tennis+news,Rafael Nadal arrives in Bastad his son and wife,https://tennistonic.com/tennis-news/739161/rafael-nadal-arrives-in-bastad-his-son-and-wife/,"Thu, 11 Jul 2024 15:46:20 GMT",Rafael Nadal arrives in Bastad his son and wife,"{'href': 'https://tennistonic.com', 'title': 'Tennis Tonic'}"
https://news.google.com/rss/search?q=tennis+news,Jasmine Paolini reaches her second consecutive Grand Slam final by beating Donna Vekic at Wimbledon,https://apnews.com/article/wimbledon-7-11-2024-results-women-semifinals-b805a32c483f43af841c7467c1ab9587,"Thu, 11 Jul 2024 15:34:00 GMT",Jasmine Paolini reaches her second consecutive Grand Slam final by beating Donna Vekic at Wimbledon,"{'href': 'https://apnews.com', 'title': 'The Associated Press'}"
https://news.google.com/rss/search?q=tennis+news,Paolini battles past Vekic to reach Wimbledon final,https://www.tennismajors.com/wimbledon-news/paolini-battles-past-vekic-in-longest-womens-semi-final-in-wimbledon-history-772995.html,"Thu, 11 Jul 2024 16:18:59 GMT",Paolini battles past Vekic to reach Wimbledon final,"{'href': 'https://www.tennismajors.com', 'title': 'Tennis Majors'}"
https://news.google.com/rss/search?q=tennis+news,The People vs Novak Djokovic: Why fans love to hate the tennis GOAT,https://www.hindustantimes.com/sports/tennis/the-people-vs-novak-djokovic-why-fans-love-to-hate-the-tennis-goat-101720705165926.html,"Thu, 11 Jul 2024 13:43:21 GMT",The People vs Novak Djokovic: Why fans love to hate the tennis GOAT,"{'href': 'https://www.hindustantimes.com', 'title': 'Hindustan Times'}"
https://news.google.com/rss/search?q=tennis+news,‘Elena Has the Best Serve in Women’s Tennis Since Serena’,https://www.essentiallysports.com/wta-tennis-news-elena-has-the-best-serve-in-womens-tennis-since-serena-wimbledon-fans-drop-ultimate-verdict-on-rybakinas-dominant-game/,"Thu, 11 Jul 2024 18:00:00 GMT",‘Elena Has the Best Serve in Women’s Tennis Since Serena’ - Wimbledon Fans Drop Ultimate Verdict on Rybakina’s Dominant Game,"{'href': 'https://www.essentiallysports.com', 'title': 'EssentiallySports'}"
https://news.google.com/rss/search?q=tennis+news,Zendaya Challenges Roger Federer to an Air Tennis Match for Sneaker Brand On,https://www.adweek.com/brand-marketing/zendaya-challenges-roger-federer-to-an-air-tennis-match-for-sneaker-brand-on/,"Thu, 11 Jul 2024 10:00:00 GMT",Zendaya Challenges Roger Federer to an Air Tennis Match for Sneaker Brand On,"{'href': 'https://www.adweek.com', 'title': 'Adweek'}"
https://news.google.com/rss/search?q=tennis+news,Paolini outlasts Vekic in record-breaking Wimbledon semifinal,https://www.wtatennis.com/news/4056243/paolini-outlasts-vekic-in-record-breaking-wimbledon-semifinal,"Thu, 11 Jul 2024 15:42:37 GMT",Paolini outlasts Vekic in record-breaking Wimbledon semifinal,"{'href': 'https://www.wtatennis.com', 'title': 'WTA Tennis'}"
https://news.google.com/rss/search?q=tennis+news,LIVE UPDATES. Jasmine Paolini topples Vekic in the semifinal,https://tennistonic.com/tennis-news/739178/live-updates-jasmine-paolini-topples-vekic-in-the-semifinal/,"Thu, 11 Jul 2024 15:40:26 GMT",LIVE UPDATES. Jasmine Paolini topples Vekic in the semifinal,"{'href': 'https://tennistonic.com', 'title': 'Tennis Tonic'}"
https://news.google.com/rss/search?q=tennis+news,"Record-breaking Paolini beats Vekic, to play Krejcikova in final",https://www.hindustantimes.com/sports/tennis/recordbreaking-paolini-beats-vekic-to-play-krejcikova-in-final-101720723214834.html,"Thu, 11 Jul 2024 18:40:14 GMT","Record-breaking Paolini beats Vekic, to play Krejcikova in final","{'href': 'https://www.hindustantimes.com', 'title': 'Hindustan Times'}"
https://news.google.com/rss/search?q=tennis+news,Why Aamir Khan stopped playing tennis: 5 celebrities who swapped sports for stardom,https://www.hindustantimes.com/htcity/cinema/why-aamir-khan-stopped-playing-tennis-5-celebrities-who-swapped-sports-for-stardom-101720684484158.html,"Thu, 11 Jul 2024 12:12:15 GMT",Why Aamir Khan stopped playing tennis: 5 celebrities who swapped sports for stardom,"{'href': 'https://www.hindustantimes.com', 'title': 'Hindustan Times'}"
https://news.google.com/rss/search?q=tennis+news,Jasmine Paolini reaches Wimbledon final after longest ever semi vs heartbroken Donna Vekic,https://www.express.co.uk/sport/tennis/1922067/jasmine-paolini-Donna-Vekic-wimbledon-final,"Thu, 11 Jul 2024 15:37:00 GMT",Jasmine Paolini reaches Wimbledon final after longest ever semi vs heartbroken Donna Vekic,"{'href': 'https://www.express.co.uk', 'title': 'Express'}"
https://news.google.com/rss/search?q=tennis+news,Belgian tennis star receiving sickening death and rape threats from losing punters,https://www.express.co.uk/sport/tennis/1922035/gambling-abuse-amelie-van-impe,"Thu, 11 Jul 2024 15:01:00 GMT",Belgian tennis star receiving sickening death and rape threats from losing punters,"{'href': 'https://www.express.co.uk', 'title': 'Express'}"
https://news.google.com/rss/search?q=tennis+news,Novak Djokovic shows true colours with message to Alex de Minaur at Wimbledon,https://www.express.co.uk/sport/tennis/1921707/novak-djokovic-alex-de-minaur-wimbledon,"Thu, 11 Jul 2024 07:37:00 GMT",Novak Djokovic shows true colours with message to Alex de Minaur at Wimbledon,"{'href': 'https://www.express.co.uk', 'title': 'Express'}"
https://news.google.com/rss/search?q=tennis+news,Coach of Novak Djokovic's opponent gets distracted by rogue Wimbledon spectator,https://www.express.co.uk/sport/tennis/1921987/novak-djokovic-wimbledon-lorenzo-musetti,"Thu, 11 Jul 2024 13:44:00 GMT",Coach of Novak Djokovic's opponent gets distracted by rogue Wimbledon spectator,"{'href': 'https://www.express.co.uk', 'title': 'Express'}"
https://news.google.com/rss/search?q=tennis+news,'He is like Darth Vader': John McEnroe gives damning verdict on tennis’ GOAT,https://www.msn.com/en-nz/news/other/he-is-like-darth-vader-john-mcenroe-gives-damning-verdict-on-tennis-goat/ss-BB1pNU6h,"Thu, 11 Jul 2024 16:03:15 GMT",'He is like Darth Vader': John McEnroe gives damning verdict on tennis’ GOAT,"{'href': 'https://www.msn.com', 'title': 'MSN'}"
https://news.google.com/rss/search?q=tennis+news,"Daniil Medvedev vs Carlos Alcaraz, Wimbledon 2024 semi-final: H2H, live streaming and telecast",https://www.hindustantimes.com/sports/tennis/daniil-medvedev-vs-carlos-alcaraz-wimbledon-2024-semi-final-h2h-live-streaming-and-telecast-all-you-need-to-know-101720695503973.html,"Thu, 11 Jul 2024 11:32:13 GMT","Daniil Medvedev vs Carlos Alcaraz, Wimbledon 2024 semi-final: H2H, live streaming and telecast - All you need to know","{'href': 'https://www.hindustantimes.com', 'title': 'Hindustan Times'}"
https://news.google.com/rss/search?q=tennis+news,Nick Kyrgios predicts Wimbledon winner as Aussie to practice with Novak Djokovic again,https://www.express.co.uk/sport/tennis/1921790/Nick-Kyrgios-Wimbledon-Novak-Djokovic,"Thu, 11 Jul 2024 09:31:00 GMT",Nick Kyrgios predicts Wimbledon winner as Aussie to practice with Novak Djokovic again,"{'href': 'https://www.express.co.uk', 'title': 'Express'}"
https://news.google.com/rss/search?q=tennis+news,Warwick tennis club backs Marcus Willis Wimbledon bid,https://www.bbc.co.uk/news/articles/c729qxrvjyzo,"Thu, 11 Jul 2024 14:05:56 GMT",Warwick tennis club backs Marcus Willis Wimbledon bid,"{'href': 'https://www.bbc.co.uk', 'title': 'BBC'}"
https://news.google.com/rss/search?q=tennis+news,Donna Vekic in floods of tears as Wimbledon star crumbles during semi-final clash,https://www.express.co.uk/sport/tennis/1922053/donna-vekic-wimbledon-jasmine-paolini,"Thu, 11 Jul 2024 15:15:00 GMT",Donna Vekic in floods of tears as Wimbledon star crumbles during semi-final clash,"{'href': 'https://www.express.co.uk', 'title': 'Express'}"
https://news.google.com/rss/search?q=tennis+news,Alex de Minaur lets the cat out of the bag as he answers the question every fan wants to know about Nick Kyrgi,https://www.dailymail.co.uk/sport/tennis/article-13622935/Alex-Minaur-Nick-Kyrgios.html,"Thu, 11 Jul 2024 10:28:26 GMT",Alex de Minaur lets the cat out of the bag as he answers the question every fan wants to know about Nick Kyrgi,"{'href': 'https://www.dailymail.co.uk', 'title': 'Daily Mail'}"
https://news.google.com/rss/search?q=tennis+news,Novak Djokovic's wife rolls her eyes after hearing husband in Wimbledon interview,https://www.express.co.uk/sport/tennis/1921813/novak-djokovic-jelena-djokovic-wimbledon,"Thu, 11 Jul 2024 09:59:00 GMT",Novak Djokovic's wife rolls her eyes after hearing husband in Wimbledon interview,"{'href': 'https://www.express.co.uk', 'title': 'Express'}"
https://news.google.com/rss/search?q=tennis+news,Roy Keane shares true thoughts on Andy Murray retirement,https://www.express.co.uk/sport/tennis/1921801/roy-keane-andy-murray-man-utd-wimbledon,"Thu, 11 Jul 2024 11:07:00 GMT",Roy Keane shares true thoughts on Andy Murray retirement - 'It isn't sad at all',"{'href': 'https://www.express.co.uk', 'title': 'Express'}"
