Input URL,Title,Link,Published,Description,Source
https://news.google.com/rss/search?q=sports+news,From convict to cabinet: South Africa’s new sports minister promotes gangland motorsport,https://www.iowapublicradio.org/news-from-npr/2024-07-11/from-convict-to-cabinet-south-africas-new-sports-minister-promotes-gangland-motorsport,"Thu, 11 Jul 2024 09:14:00 GMT",From convict to cabinet: South Africa’s new sports minister promotes gangland motorsport,"{'href': 'https://www.iowapublicradio.org', 'title': 'Iowa Public Radio'}"
https://news.google.com/rss/search?q=sports+news,Why Derrick White made more sense for Team USA than Jaylen Brown after Kawhi Leonard's withdrawal,https://www.cbssports.com/nba/news/why-derrick-white-made-more-sense-for-team-usa-than-jaylen-brown-after-kawhi-leonards-withdrawal/,"Thu, 11 Jul 2024 12:26:38 GMT",Why Derrick White made more sense for Team USA than Jaylen Brown after Kawhi Leonard's withdrawal,"{'href': 'https://www.cbssports.com', 'title': 'CBS Sports'}"
https://news.google.com/rss/search?q=sports+news,Ex-MLB infielder Sean Burroughs' cause of death revealed,https://www.foxnews.com/sports/ex-mlb-infielder-sean-burroughs-cause-death-revealed,"Thu, 11 Jul 2024 15:51:00 GMT",Ex-MLB infielder Sean Burroughs' cause of death revealed,"{'href': 'https://www.foxnews.com', 'title': 'Fox News'}"
https://news.google.com/rss/search?q=sports+news,"Bronny James struggles to score in latest Lakers Summer League game, but shines on defense",https://www.foxnews.com/sports/bronny-james-struggles-score-latest-lakers-summer-league-game-shines-defense,"Thu, 11 Jul 2024 13:32:00 GMT","Bronny James struggles to score in latest Lakers Summer League game, but shines on defense","{'href': 'https://www.foxnews.com', 'title': 'Fox News'}"
https://news.google.com/rss/search?q=healthcare+news,"Steward Health Care under federal investigation for fraud and corruption, sources tell CBS News",https://www.cbsnews.com/news/steward-health-care-federal-investigation-fraud-corruption-hospitals/,"Thu, 11 Jul 2024 15:49:00 GMT","Steward Health Care under federal investigation for fraud and corruption, sources tell CBS News","{'href': 'https://www.cbsnews.com', 'title': 'CBS News'}"
https://news.google.com/rss/search?q=healthcare+news,"Desperate Zimbabweans cross Zambia border for cheaper healthcare, medicines",https://www.aljazeera.com/features/2024/7/11/desperate-zimbabweans-cross-zambia-border-for-cheaper-healthcare,"Thu, 11 Jul 2024 08:30:58 GMT","Desperate Zimbabweans cross Zambia border for cheaper healthcare, medicines","{'href': 'https://www.aljazeera.com', 'title': 'Al Jazeera English'}"
https://news.google.com/rss/search?q=healthcare+news,Can California’s health care providers help solve the state’s homelessness crisis?,https://calmatters.org/housing/homelessness/2024/07/calaim-bakersfield-housing/,"Thu, 11 Jul 2024 12:30:00 GMT",Can California’s health care providers help solve the state’s homelessness crisis?,"{'href': 'https://calmatters.org', 'title': 'CalMatters'}"
https://news.google.com/rss/search?q=healthcare+news,Health-Care Companies Are Sending Your Data to Big Tech,https://www.bloomberg.com/news/articles/2024-07-11/do-health-care-companies-share-my-data-analysis-finds-they-do,"Thu, 11 Jul 2024 10:00:00 GMT",Health-Care Companies Are Sending Your Data to Big Tech,"{'href': 'https://www.bloomberg.com', 'title': 'Bloomberg'}"
https://news.google.com/rss/search?q=healthcare+news,Regard Raises $61M to close the Clinical Insights Gap in Healthcare with leading AI solution,https://www.prnewswire.com/news-releases/regard-raises-61m-to-close-the-clinical-insights-gap-in-healthcare-with-leading-ai-solution-302194821.html,"Thu, 11 Jul 2024 13:30:00 GMT",Regard Raises $61M to close the Clinical Insights Gap in Healthcare with leading AI solution,"{'href': 'https://www.prnewswire.com', 'title': 'PR Newswire'}"
https://news.google.com/rss/search?q=healthcare+news,Pennant’s $80 Million Acquisition of Signature Healthcare at Home,https://hospicenews.com/2024/07/11/pennants-80-million-acquisition-of-signature-healthcare-at-home/,"Thu, 11 Jul 2024 18:26:36 GMT",Pennant’s $80 Million Acquisition of Signature Healthcare at Home,"{'href': 'https://hospicenews.com', 'title': 'Hospice News'}"
https://news.google.com/rss/search?q=healthcare+news,ONC says stakeholders can 'pick up and run' with new regs,https://www.healthcareitnews.com/news/onc-says-stakeholders-can-pick-and-run-new-regs,"Thu, 11 Jul 2024 14:55:43 GMT",ONC says stakeholders can 'pick up and run' with new regs,"{'href': 'https://www.healthcareitnews.com', 'title': 'Healthcare IT News'}"
https://news.google.com/rss/search?q=healthcare+news,Geisinger to spend $880M on medical center expansion,https://www.healthcaredive.com/news/geisinger-880m-medical-center-expansion-pennsylvania/721008/,"Thu, 11 Jul 2024 14:54:48 GMT",Geisinger to spend $880M on medical center expansion,"{'href': 'https://www.healthcaredive.com', 'title': 'Healthcare Dive'}"
https://news.google.com/rss/search?q=healthcare+news,Why has Medicare’s Innovation Center failed?,https://thehill.com/opinion/healthcare/4763854-why-has-medicares-innovation-center-failed/,"Thu, 11 Jul 2024 16:30:00 GMT",Why has Medicare’s Innovation Center failed?,"{'href': 'https://thehill.com', 'title': 'The Hill'}"
https://news.google.com/rss/search?q=healthcare+news,"HCA Florida Healthcare Welcomes Dr. Christopher McCann to its Treasure Coast Facilities, Expanding its Gynecologic Oncology Program",https://southfloridahospitalnews.com/hca-florida-healthcare-welcomes-dr-christopher-mccann-to-its-treasure-coast-facilities-expanding-its-gynecologic-oncology-program/,"Thu, 11 Jul 2024 13:12:53 GMT","HCA Florida Healthcare Welcomes Dr. Christopher McCann to its Treasure Coast Facilities, Expanding its Gynecologic Oncology Program","{'href': 'https://southfloridahospitalnews.com', 'title': 'South Florida Hospital News'}"
https://news.google.com/rss/search?q=healthcare+news,Vizzia Technologies strengthens our RTLS offering for healthcare,https://www.assaabloy.com/group/en/news-media/stories/news/vizzia-technologies-strengthens-our-rtls-offering-for-healthcare,"Thu, 11 Jul 2024 13:15:51 GMT",Vizzia Technologies strengthens our RTLS offering for healthcare,"{'href': 'https://www.assaabloy.com', 'title': 'Assa Abloy'}"
https://news.google.com/rss/search?q=healthcare+news,Employers say they’ll double down on healthcare benefits despite rising costs,https://www.hrdive.com/news/employers-double-down-on-healthcare-benefits-despite-rising-costs/721109/,"Thu, 11 Jul 2024 16:28:43 GMT",Employers say they’ll double down on healthcare benefits despite rising costs,"{'href': 'https://www.hrdive.com', 'title': 'HR Dive'}"
https://news.google.com/rss/search?q=healthcare+news,Sanford Health and Marshfield Clinic in talks to merge,https://www.healthcaredive.com/news/sanford-health-marshfield-clinic-merger/721073/,"Thu, 11 Jul 2024 14:59:48 GMT",Sanford Health and Marshfield Clinic in talks to merge,"{'href': 'https://www.healthcaredive.com', 'title': 'Healthcare Dive'}"
https://news.google.com/rss/search?q=healthcare+news,"Revolutionizing Healthcare: The Global Telemedicine Market's Rapid Expansion; As Per New Report Published by TNR, The Niche Research",https://finance.yahoo.com/news/revolutionizing-healthcare-global-telemedicine-markets-151400880.html,"Thu, 11 Jul 2024 15:14:00 GMT","Revolutionizing Healthcare: The Global Telemedicine Market's Rapid Expansion; As Per New Report Published by TNR, The Niche Research","{'href': 'https://finance.yahoo.com', 'title': 'Yahoo Finance'}"
https://news.google.com/rss/search?q=healthcare+news,"ONC proposed rule targets interoperability for public health, payers",https://www.healthcaredive.com/news/onc-proposed-rule-interoperability-public-health-payers-cybersecurity/721042/,"Thu, 11 Jul 2024 15:04:48 GMT","ONC proposed rule targets interoperability for public health, payers","{'href': 'https://www.healthcaredive.com', 'title': 'Healthcare Dive'}"
https://news.google.com/rss/search?q=healthcare+news,"Regard secures $61M to research LLMs, expand clinical insights platform",https://www.mobihealthnews.com/news/regard-secures-61m-research-llms-expand-clinical-insights-platform,"Thu, 11 Jul 2024 15:11:50 GMT","Regard secures $61M to research LLMs, expand clinical insights platform","{'href': 'https://www.mobihealthnews.com', 'title': 'Mobihealth News'}"
https://news.google.com/rss/search?q=healthcare+news,Is Tenet Healthcare (THC) Stock Undervalued Right Now?,https://finance.yahoo.com/news/tenet-healthcare-thc-stock-undervalued-134016490.html,"Thu, 11 Jul 2024 13:40:16 GMT",Is Tenet Healthcare (THC) Stock Undervalued Right Now?,"{'href': 'https://finance.yahoo.com', 'title': 'Yahoo Finance'}"
https://news.google.com/rss/search?q=healthcare+news,Medicus Healthcare Solutions Releases White Paper Addressing the Radiologist Shortage in U.S. Healthcare,https://www.prnewswire.com/news-releases/medicus-healthcare-solutions-releases-white-paper-addressing-the-radiologist-shortage-in-us-healthcare-302195007.html,"Thu, 11 Jul 2024 15:41:00 GMT",Medicus Healthcare Solutions Releases White Paper Addressing the Radiologist Shortage in U.S. Healthcare,"{'href': 'https://www.prnewswire.com', 'title': 'PR Newswire'}"
https://news.google.com/rss/search?q=healthcare+news,Possible Bearish Signals With HCA Healthcare Insiders Disposing Stock,https://simplywall.st/stocks/us/healthcare/nyse-hca/hca-healthcare/news/possible-bearish-signals-with-hca-healthcare-insiders-dispos,"Thu, 11 Jul 2024 17:48:57 GMT",Possible Bearish Signals With HCA Healthcare Insiders Disposing Stock,"{'href': 'https://simplywall.st', 'title': 'Simply Wall St'}"
https://news.google.com/rss/search?q=healthcare+news,"Weave Launches Healthcare Heroes Program, Recognizing Providers Driving Positive Change in Local Communities",https://www.businesswire.com/news/home/20240711018516/en/Weave-Launches-Healthcare-Heroes-Program-Recognizing-Providers-Driving-Positive-Change-in-Local-Communities,"Thu, 11 Jul 2024 15:00:00 GMT","Weave Launches Healthcare Heroes Program, Recognizing Providers Driving Positive Change in Local Communities","{'href': 'https://www.businesswire.com', 'title': 'Business Wire'}"
https://news.google.com/rss/search?q=healthcare+news,"Sanford Health, Marshfield Clinic Announce Plans to Merge",https://www.hcinnovationgroup.com/finance-revenue-cycle/mergers-acquisitions/news/55125361/sanford-health-marshfield-clinic-announce-plans-to-merge,"Thu, 11 Jul 2024 14:29:59 GMT","Sanford Health, Marshfield Clinic Announce Plans to Merge","{'href': 'https://www.hcinnovationgroup.com', 'title': 'Healthcare Innovation'}"
https://news.google.com/rss/search?q=healthcare+news,Affordable pharmacy comes to Hurricane: Family Healthcare unveils discount pharmaceuticals,https://www.stgeorgeutah.com/news/archive/2024/07/11/spc-familyhealthcare-24-avm-affordable-pharmacy-comes-to-hurricane-family-healthcare-unveils-discount-pharmaceuticals/,"Thu, 11 Jul 2024 14:58:42 GMT",Affordable pharmacy comes to Hurricane: Family Healthcare unveils discount pharmaceuticals,"{'href': 'https://www.stgeorgeutah.com', 'title': 'St. George News'}"
https://news.google.com/rss/search?q=healthcare+news,"Steward Health Care under federal investigation for fraud, corruption",https://www.cbsnews.com/video/steward-health-care-under-federal-investigation-for-fraud-corruption/,"Thu, 11 Jul 2024 16:41:00 GMT","Steward Health Care under federal investigation for fraud, corruption","{'href': 'https://www.cbsnews.com', 'title': 'CBS News'}"
https://news.google.com/rss/search?q=healthcare+news,Improving AFib patient experiences,https://www.healthcareitnews.com/video/improving-afib-patient-experiences,"Thu, 11 Jul 2024 10:00:00 GMT",Improving AFib patient experiences,"{'href': 'https://www.healthcareitnews.com', 'title': 'Healthcare IT News'}"
https://news.google.com/rss/search?q=healthcare+news,"Vālenz® Health Signs Definitive Acquisition Agreement with Healthcare Bluebook™ to Create an Industry-Leading Integrated Health Cost, Quality and Utilization Data Platform",https://www.prnewswire.com/news-releases/vlenz-health-signs-definitive-acquisition-agreement-with-healthcare-bluebook-to-create-an-industry-leading-integrated-health-cost-quality-and-utilization-data-platform-302194798.html,"Thu, 11 Jul 2024 13:00:00 GMT","Vālenz® Health Signs Definitive Acquisition Agreement with Healthcare Bluebook™ to Create an Industry-Leading Integrated Health Cost, Quality and Utilization Data Platform","{'href': 'https://www.prnewswire.com', 'title': 'PR Newswire'}"
https://news.google.com/rss/search?q=healthcare+news,FTC reportedly to sue three largest pharmacy benefit managers,https://www.healthcarefinancenews.com/news/ftc-reportedly-sue-three-largest-pharmacy-benefit-managers,"Thu, 11 Jul 2024 14:49:16 GMT",FTC reportedly to sue three largest pharmacy benefit managers,"{'href': 'https://www.healthcarefinancenews.com', 'title': 'Healthcare Finance News'}"
https://news.google.com/rss/search?q=healthcare+news,mpathic Receives SBIR Award to Address Racial Bias in Healthcare AI,https://www.prnewswire.com/news-releases/mpathic-receives-sbir-award-to-address-racial-bias-in-healthcare-ai-302195167.html,"Thu, 11 Jul 2024 17:54:00 GMT",mpathic Receives SBIR Award to Address Racial Bias in Healthcare AI,"{'href': 'https://www.prnewswire.com', 'title': 'PR Newswire'}"
https://news.google.com/rss/search?q=healthcare+news,"Coalition of 26,000 WNY government workers switches health insurance carrier from Highmark to Univera",https://buffalonews.com/news/local/business/health-care/highmark-blue-cross-blue-shield-univera-labor-management-healthcare-fund/article_a46cf7b2-3eec-11ef-b792-ab33713645fd.html,"Thu, 11 Jul 2024 14:05:00 GMT","Coalition of 26,000 WNY government workers switches health insurance carrier from Highmark to Univera","{'href': 'https://buffalonews.com', 'title': 'Buffalo News'}"
https://news.google.com/rss/search?q=healthcare+news,Ohio National Guard to give free healthcare services,https://www.wdtn.com/as-seen-on-2-news/free-healthcare-event-happening-soon/,"Thu, 11 Jul 2024 09:22:20 GMT",Ohio National Guard to give free healthcare services,"{'href': 'https://www.wdtn.com', 'title': 'WDTN.com'}"
https://news.google.com/rss/search?q=healthcare+news,The reckoning for racially biased pulse oximeters is coming due,https://www.healthcareitnews.com/news/reckoning-racially-biased-pulse-oximeters-coming-due,"Thu, 11 Jul 2024 15:04:43 GMT",The reckoning for racially biased pulse oximeters is coming due,"{'href': 'https://www.healthcareitnews.com', 'title': 'Healthcare IT News'}"
https://news.google.com/rss/search?q=healthcare+news,AGFA HealthCare and Corista Announce North America Launch of its Integrated Solution for Digital Transformation in Pathology,https://markets.businessinsider.com/news/stocks/agfa-healthcare-and-corista-announce-north-america-launch-of-its-integrated-solution-for-digital-transformation-in-pathology-1033548011,"Thu, 11 Jul 2024 17:08:52 GMT",AGFA HealthCare and Corista Announce North America Launch of its Integrated Solution for Digital Transformation in Pathology,"{'href': 'https://markets.businessinsider.com', 'title': 'Markets Insider'}"
https://news.google.com/rss/search?q=healthcare+news,Learning to speak the language of AI in healthcare,https://www.qmul.ac.uk/media/news/2024/se/learning-to-speak-the-language-of-ai-in-healthcare.html,"Thu, 11 Jul 2024 14:14:05 GMT",Learning to speak the language of AI in healthcare,"{'href': 'https://www.qmul.ac.uk', 'title': 'QMUL'}"
https://news.google.com/rss/search?q=healthcare+news,"New exhibit opens at Museum Center, highlights local patients, healthcare professionals",https://local12.com/news/local/new-exhibit-opens-at-museum-center-highlights-local-patients-healthcare-professionals-cincinnati-advancing-health-heart-lungs-immune-brain-muscles,"Thu, 11 Jul 2024 18:08:27 GMT","New exhibit opens at Museum Center, highlights local patients, healthcare professionals","{'href': 'https://local12.com', 'title': 'WKRC TV Cincinnati'}"
https://news.google.com/rss/search?q=healthcare+news,Diagnosis for 7.11.24: Checking the pulse of Florida health care news and policy,https://floridapolitics.com/archives/683473-diagnosis-for-7-11-24-checking-the-pulse-of-florida-health-care-news-and-policy/,"Thu, 11 Jul 2024 08:01:31 GMT",Diagnosis for 7.11.24: Checking the pulse of Florida health care news and policy,"{'href': 'https://floridapolitics.com', 'title': 'Florida Politics'}"
https://news.google.com/rss/search?q=healthcare+news,"LevelBlue Report Finds Healthcare Leaders View Cybersecurity as an Afterthought, But Dynamic Computing Advancements Spark Change",https://www.businesswire.com/news/home/20240711975035/en/LevelBlue-Report-Finds-Healthcare-Leaders-View-Cybersecurity-as-an-Afterthought-But-Dynamic-Computing-Advancements-Spark-Change,"Thu, 11 Jul 2024 12:00:00 GMT","LevelBlue Report Finds Healthcare Leaders View Cybersecurity as an Afterthought, But Dynamic Computing Advancements Spark Change","{'href': 'https://www.businesswire.com', 'title': 'Business Wire'}"
https://news.google.com/rss/search?q=healthcare+news,Defining Genetic Discrimination: Toward Equity in Healthcare and Research,https://healthenews.mcgill.ca/defining-genetic-discrimination-toward-equity-in-healthcare-and-research/,"Thu, 11 Jul 2024 16:26:19 GMT",Defining Genetic Discrimination: Toward Equity in Healthcare and Research,"{'href': 'https://healthenews.mcgill.ca', 'title': 'Health e-News'}"
https://news.google.com/rss/search?q=healthcare+news,J.P. Morgan Life Sciences Private Capital Hires Joseph Siletto to Target Investments in Healthcare Transformation,https://finance.yahoo.com/news/j-p-morgan-life-sciences-140000788.html,"Thu, 11 Jul 2024 14:00:00 GMT",J.P. Morgan Life Sciences Private Capital Hires Joseph Siletto to Target Investments in Healthcare Transformation,"{'href': 'https://finance.yahoo.com', 'title': 'Yahoo Finance'}"
https://news.google.com/rss/search?q=healthcare+news,"Lilly, DaVita, Illumina among top healthcare Quant picks ahead of Q2 earnings",https://seekingalpha.com/news/4123344-lilly-davita-illumina-among-top-healthcare-quant-picks-for-q2,"Thu, 11 Jul 2024 15:17:00 GMT","Lilly, DaVita, Illumina among top healthcare Quant picks ahead of Q2 earnings","{'href': 'https://seekingalpha.com', 'title': 'Seeking Alpha'}"
https://news.google.com/rss/search?q=healthcare+news,Healthcare District officials provide update report,https://www.ivpressonline.com/news/healthcare-district-officials-provide-update-report/article_9557cb14-3f21-11ef-b3c9-d728113c1243.html,"Thu, 11 Jul 2024 07:00:00 GMT",Healthcare District officials provide update report,"{'href': 'https://www.ivpressonline.com', 'title': 'Imperial Valley Press'}"
https://news.google.com/rss/search?q=healthcare+news,Strengthening the patient by strengthening the caretaker,https://www.healthcarefinancenews.com/video/strengthening-patient-strengthening-caretaker,"Thu, 11 Jul 2024 11:19:20 GMT",Strengthening the patient by strengthening the caretaker,"{'href': 'https://www.healthcarefinancenews.com', 'title': 'Healthcare Finance News'}"
https://news.google.com/rss/search?q=healthcare+news,5 Health Conditions That May Run in Your Family,https://hartfordhealthcare.org/about-us/news-press/news-detail?articleId=57180&publicid=395,"Thu, 11 Jul 2024 10:05:30 GMT",5 Health Conditions That May Run in Your Family,"{'href': 'https://hartfordhealthcare.org', 'title': 'Hartford HealthCare'}"
https://news.google.com/rss/search?q=healthcare+news,Earned Wealth Announces $200 Million Capital Commitment to Redefine Financial Services for Healthcare Professionals,https://www.businesswire.com/news/home/20240711405630/en/Earned-Wealth-Announces-200-Million-Capital-Commitment-to-Redefine-Financial-Services-for-Healthcare-Professionals,"Thu, 11 Jul 2024 12:01:00 GMT",Earned Wealth Announces $200 Million Capital Commitment to Redefine Financial Services for Healthcare Professionals,"{'href': 'https://www.businesswire.com', 'title': 'Business Wire'}"
https://news.google.com/rss/search?q=healthcare+news,Provident Strengthens Healthcare Lending Team with the Addition of Vik Venkataraman as Senior Relationship Manager,https://www.businesswire.com/news/home/20240711627381/en/Provident-Strengthens-Healthcare-Lending-Team-with-the-Addition-of-Vik-Venkataraman-as-Senior-Relationship-Manager,"Thu, 11 Jul 2024 18:18:00 GMT",Provident Strengthens Healthcare Lending Team with the Addition of Vik Venkataraman as Senior Relationship Manager,"{'href': 'https://www.businesswire.com', 'title': 'Business Wire'}"
https://news.google.com/rss/search?q=healthcare+news,Milliman Concludes Review of EO Care’s Methodology to Estimate Cost Impacts of Its Cannabinoid-based Healthcare Treatment Program,https://www.businesswire.com/news/home/20240711851880/en/Milliman-Concludes-Review-of-EO-Care%E2%80%99s-Methodology-to-Estimate-Cost-Impacts-of-Its-Cannabinoid-based-Healthcare-Treatment-Program,"Thu, 11 Jul 2024 18:25:00 GMT",Milliman Concludes Review of EO Care’s Methodology to Estimate Cost Impacts of Its Cannabinoid-based Healthcare Treatment Program,"{'href': 'https://www.businesswire.com', 'title': 'Business Wire'}"
https://news.google.com/rss/search?q=healthcare+news,Hopkins County Health Care Foundation Announces the 2025 Gala Chairs,https://frontporchnewstexas.com/2024/07/11/hopkins-county-health-care-foundation-announces-the-2025-gala-chairs/,"Thu, 11 Jul 2024 15:32:19 GMT",Hopkins County Health Care Foundation Announces the 2025 Gala Chairs,"{'href': 'https://frontporchnewstexas.com', 'title': 'frontporchnewstexas.com'}"
https://news.google.com/rss/search?q=healthcare+news,"Washington County, EOM Healthcare Group officials commemorate sale of Samaritan",https://www.gmtoday.com/business/county-eom-healthcare-group-officials-commemorate-sale-of-samaritan/article_9677f5e7-3194-526c-b32b-52228f3838e1.html,"Thu, 11 Jul 2024 11:59:00 GMT","Washington County, EOM Healthcare Group officials commemorate sale of Samaritan","{'href': 'https://www.gmtoday.com', 'title': 'Greater Milwaukee Today | GMToday.com'}"
https://news.google.com/rss/search?q=healthcare+news,Alignment Healthcare to Announce Second Quarter 2024,https://www.globenewswire.com/news-release/2024/07/11/2911758/0/en/Alignment-Healthcare-to-Announce-Second-Quarter-2024-Financial-Results-and-Host-Conference-Call-Thursday-Aug-1-2024.html,"Thu, 11 Jul 2024 12:04:16 GMT",Alignment Healthcare to Announce Second Quarter 2024,"{'href': 'https://www.globenewswire.com', 'title': 'GlobeNewswire'}"
https://news.google.com/rss/search?q=entertainment+news,JoAnna Garcia Swisher Says Sweet Magnolias Season 4 Is for the ‘Fans’,https://www.usmagazine.com/entertainment/news/joanna-garcia-swisher-says-sweet-magnolias-season-4-is-for-the-fans/,"Thu, 11 Jul 2024 12:02:16 GMT",JoAnna Garcia Swisher Says Sweet Magnolias Season 4 Is for the ‘Fans’,"{'href': 'https://www.usmagazine.com', 'title': 'Us Weekly'}"
https://news.google.com/rss/search?q=entertainment+news,‘Jackass' star Steve-O shares he's getting D-cup breast implants as a ‘nuclear move' of a joke,https://www.nbcphiladelphia.com/entertainment/entertainment-news/jackass-star-steve-o-shares-hes-getting-d-cup-breast-implants-as-a-nuclear-move-of-a-joke/3909190/,"Thu, 11 Jul 2024 17:42:01 GMT",‘Jackass' star Steve-O shares he's getting D-cup breast implants as a ‘nuclear move' of a joke,"{'href': 'https://www.nbcphiladelphia.com', 'title': 'NBC Philadelphia'}"
https://news.google.com/rss/search?q=entertainment+news,Meg Ryan and Dennis Quaid's son Jack Quaid responds after mom defends him from ‘nepo baby' label,https://www.nbcsandiego.com/entertainment/entertainment-news/meg-ryan-and-dennis-quaids-son-jack-quaid-responds-after-mom-defends-him-from-nepo-baby-label/3563461/,"Thu, 11 Jul 2024 17:46:29 GMT",Meg Ryan and Dennis Quaid's son Jack Quaid responds after mom defends him from ‘nepo baby' label,"{'href': 'https://www.nbcsandiego.com', 'title': 'NBC San Diego'}"
https://news.google.com/rss/search?q=entertainment+news,"Ryan Reynolds, Shawn Levy on how Hugh Jackman's voice memo ""unlocked"" 'Deadpool & Wolverine'",https://hometownnewsnow.com/entertainment-news/2017166ebf8ea54edfefab9fd50bd6a8,"Thu, 11 Jul 2024 17:42:52 GMT","Ryan Reynolds, Shawn Levy on how Hugh Jackman's voice memo ""unlocked"" 'Deadpool & Wolverine'","{'href': 'https://hometownnewsnow.com', 'title': 'Hometown News Now'}"
https://news.google.com/rss/search?q=entertainment+news,"Expelled, now excelling: Teen kicked out of school for singing at bars gets added to huge SC music festival",https://www.wcnc.com/article/news/entertainment-news/bailey-marie-expelled-school-performing-music-festival-field-stream/275-de9b9e11-f38f-4cc0-bbc7-95c256a2307c,"Thu, 11 Jul 2024 12:38:00 GMT","Expelled, now excelling: Teen kicked out of school for singing at bars gets added to huge SC music festival","{'href': 'https://www.wcnc.com', 'title': 'WCNC.com'}"
https://news.google.com/rss/search?q=entertainment+news,"Shelley Duvall, star of 'The Shining,' 'Nashville,' dies at 75",https://www.citizentribune.com/entertainment/national/shelley-duvall-star-of-the-shining-nashville-dies-at-75/article_f1d810b8-4c23-5b8d-90f5-d96a8f018a71.html,"Thu, 11 Jul 2024 15:51:23 GMT","Shelley Duvall, star of 'The Shining,' 'Nashville,' dies at 75","{'href': 'https://www.citizentribune.com', 'title': 'Citizentribune'}"
https://news.google.com/rss/search?q=entertainment+news,Olivia Munn and John Mulaney are now married,https://www.wyff4.com/article/olivia-munn-john-mulaney-married/61560211,"Thu, 11 Jul 2024 14:59:00 GMT",Olivia Munn and John Mulaney are now married,"{'href': 'https://www.wyff4.com', 'title': 'WYFF4 Greenville'}"
