Input URL,Title,Link,Published,Description,Source
https://news.google.com/rss/search?q=cryptocurrency+news,Bitcoin as a US strategic reserve: Does it make sense?,https://indianexpress.com/article/explained/explained-economics/bitcoin-us-strategic-reserve-9875735/,"Sat, 08 Mar 2025 11:36:44 GMT","

Written by Nik Martin

Bitcoin is often touted as an alternative to the US dollar, the world’s reserve currency, as only a limited number of coins will ever be produced. Proponents argue that bitcoin’s fixed supply makes it an inflation-proof value store outside the global financial system. Bitcoin is often compared to gold for a similar reason.

While central banks worldwide keep large reserves of the dollar and gold, until now, only one country — El Salvador — has created a strategic reserve of cryptocurrencies, although several governments do hold them, mostly seized from criminal activities or to circumvent international sanctions.

On Thursday (March 6), US President Donald Trump signed an executive order to create a strategic reserve of bitcoin, having previously said he wants the United States to be a leader in digital money.

Crypto advocates have responded euphorically to the plans, while skeptics argue it will expose US taxpayers to the huge price volatility of digital currencies.

As Trump welcomes the top crypto movers and shakers to the White House for a summit on Friday, DW explores what the president has in mind.

Under Trump’s order, the federal government will retain the nearly 200,000 bitcoin seized in criminal and civil proceedings, according to Trump’s “crypto czar” David Sacks.

“The US will not sell any bitcoin deposited into the Reserve. It will be kept as a store of value. The Reserve is like a digital Fort Knox for the cryptocurrency often called ‘digital gold,’” Sacks wrote on X, referring to the location in Kentucky where most of the US gold reserves are kept.

The executive order calls for a “full accounting” of the government’s bitcoin holdings, which Sacks said have never been fully audited.

Sacks added that over the last decade, Washington had sold off about 195,000 bitcoin for $366 million, which he said would be worth about $17 billion if still held.

Sacks said the order allows for the Treasury and Commerce Departments “to develop budget-neutral strategies for acquiring additional bitcoin.”

On Sunday, Trump named the five cryptocurrencies to be held in the reserves, namely bitcoin, ether, XRP, solana and cardano.

“A US Crypto Reserve will elevate this critical industry after years of corrupt attacks by the Biden Administration,” Trump wrote on his Truth Social platform. “I will make sure the US is the Crypto Capital of the World.”

Trump, who was once anti-crypto, is now a growing fan of alternative currencies and first mooted the idea of a strategic stockpile at the Bitcoin 2024 Conference in Nashville, Tennessee, in July.

US agencies hold 198.109 bitcoins, worth around $18.1 billion (€16.7 billion) as of Thursday, according to a tally by Arkham Intelligence.

Most of the holdings are the seized proceeds of crime, including drug trafficking, money laundering, and hacking. The government also holds millions of dollars of seized ethereum, tether and other smaller digital coins.

A strategic reserve is a stockpile of vital resources kept by governments or large organisations to provide a safety net during hard times.

Examples include the US Strategic Petroleum Reserve, which helps ensure a regular supply of oil during crises, food reserves, including stockpiles of grain, to protect against hunger, and the stockpiling of vaccines by the US and European Union during the COVID-19 pandemic.

Countries also maintain monetary reserves, like foreign currencies or gold, to stabilize their economies and facilitate trade. The US government, for example, holds around 8,133 metric tonnes of gold, most of it at the United States Bullion Depository at Fort Knox, Kentucky.

Increasingly, reserves of critical minerals needed for technology, the energy transition and defense are also being established.

Proponents say a crypto strategic reserve could help financial stability by diversifying US national reserves beyond traditional assets like gold and foreign currencies.

Such a stockpile would also help legitimise cryptocurrencies, encouraging more financial institutions to hold them. The likes of bitcoin are still viewed by many institutional investors with suspicion due to their price volatility and decentralisation.

But some analysts think the value of the stockpile could vanish in a market crash.

Others worried that if the government were to buy Bitcoin near its all-time high price of $109,000, it would be a costly endeavour, at a time when Trump is seeking billions of dollars in public sector cuts.

But Sacks insisted the use of the seized crypto assets “means it will not cost taxpayers a dime.”

Other critics accused Trump of favoritism toward a highly speculative investment, without providing clear strategic benefits for the nation.

Many of Trump’s backers are big crypto investors. Trump, himself, has a meme coin named after him.

Some observers pointed to the contradiction between creating a government stockpile of an asset that is deemed anti-establishment. Bitcoin was originally designed as a way to bypass government and central bank control.

Others were worried that if more governments began stockpiling the likes of bitcoin, they could potentially start to manipulate the crypto market, just as they do with gold and currencies.

The gold price last month reached a record high of $2,956, much of it down to large purchases by Poland, Turkey, India and China.

Trump now faces significant legal and political hurdles before the stockpile becomes a reality as the idea still lacks congressional support and as large amounts of the crypto seized by US authorities once had legitimate owners.

A lioness in India's Gir Somnath district is in quarantine after killing a farmer and dragging his body across district borders. Officials are investigating the unusual behavior in an area known for human-animal conflicts. The decision to quarantine follows protocol and pending medical tests.

This No Is Already Registered.

Thanks For Registered Mobile No.","{'href': 'https://indianexpress.com', 'title': 'The Indian Express'}"
https://news.google.com/rss/search?q=cryptocurrency+news,"The future of Ethereum scaling lies in hardware, not software",https://cointelegraph.com/news/the-future-of-ethereum-scaling,"Sat, 08 Mar 2025 15:01:53 GMT","

 Ethereum’s future scaling relies on hardware acceleration, not just software solutions, to overcome bottlenecks and remain competitive. 

Opinion by: Leo Fan, co-founder of Cysic

Running Ethereum today is like trying to play a modern game on a 1980s laptop — the outdated hardware would struggle to load, lag endlessly, and likely crash under the weight of new demands. Designed for a simpler blockchain era, Ethereum’s infrastructure can no longer keep up, processing just 10 to 62 transactions per second, far below the thousands needed for mainstream adoption. 

Meanwhile, with sub-second block times and near-zero fees, Solana enjoys growing mainstream popularity, which is evident in surging wallet downloads amid the TRUMP launch. Ethereum remains hindered by high gas fees and congestion, pushing users and developers to faster alternatives. 

Without addressing its scaling bottlenecks, Ethereum risks falling behind. While Ethereum’s layer-2 (L2) rollups have alleviated network congestion, they ultimately serve as stopgap measures that provide temporary relief. Software-first approaches are experiencing teething issues in interoperability and scalability, raising questions about Ethereum’s long-term sustainability and relevance. 

Many L2s are designed to fit the native network and cannot support real-time applications such as decentralized gaming or cross-border payments. Ethereum needs a fundamental shift if it wants to maintain its leadership in the blockchain space. The solution lies not in incremental software updates but in hardware acceleration. 

Vitalik Buterin’s Verge milestone envisions Ethereum achieving complete node verification on consumer-grade devices, a critical step toward the blockchain’s broader goals of accessibility and decentralization. Buterin has emphasized shifting from patchwork solutions to building a well-rounded computational infrastructure to realize this vision. Purpose-built hardware, such as application-specific integrated circuits (ASICs), is key: It enhances transaction processing speeds, reduces latency, and optimizes energy use. It lays the groundwork for sustainable Ethereum scaling, ensuring the network grows without compromising its core principles.

Recent: Is Ethereum bottoming out at last? Analysts weigh in

Ethereum’s Pectra upgrade also does not fully resolve its fundamental scaling challenges, highlighting the urgency for enhanced scalability and stability. The key optimizations introduced — account abstraction and enhanced validator operations — seek to refine Ethereum’s efficiency and user experience but do not significantly increase transaction throughput or reduce network latency. 

Ethereum risks falling behind without specialized hardware, weakening its position as a settlement layer for the blockchain community. Investing in hardware-native solutions will allow Ethereum to scale effectively while upholding its commitment to decentralization and supporting a growing user base.

The effect of hardware scaling solutions extends far beyond Ethereum itself. TradFi players are exploring blockchain-based cross-border payments, which demand real-time processing. With scalability issues inherited from the home layer, L2s alone cannot scale effectively to cater to the sheer TradFi demand. Cross-border transactions hit $190.1 trillion in 2023 and are only expected to grow in 2025, indicating one thing: Hardware acceleration is indispensable in incentivizing institutional adoption of blockchain. 

Beyond finance, hardware optimization enhances blockchain utility across industries, accelerating mainstream adoption. A noteworthy example is healthcare, where accelerated blockchain infrastructure could improve the security and privacy of patient data. For gaming industries that rely on dynamic interactions, blockchain networks can help deliver real-time responses to user actions. 

Blockchain isn’t operating in isolation; it competes with computationally intensive industries, such as AI, the buzzword of 2024. The rise of AI has reshaped industries, but it is also becoming a fierce competitor to blockchain for electricity and equipment. Data centers like Hut 8 and Coin Scientific are prioritizing AI workloads, which can generate up to 25 times more revenue than Bitcoin (BTC) mining. These moves highlight the growing pressure on blockchain networks to optimize resource efficiency or risk being sidelined in the race for computational dominance. 

Critics claim that Ethereum is “dying a slow death.” Once the home of decentralized finance (DeFi) innovation, Ethereum’s scalability issues hinder its ability to compete with DeFAI. Ethereum must embrace purpose-built hardware to address its inefficient infrastructure, enable faster transactions, and reduce energy consumption. This way, Ethereum stands a chance to future-proof against AI developments and maintain its competitive edge for mainstream adoption. 

Ethereum has relied heavily on L2s to scale, but they remain temporary solutions that fail to meet the network’s fundamental operational demands. Hardware solutions are now non-negotiable for Ethereum to retain its position as a leader in blockchain innovation. From enabling seamless TradFi integrations to supporting real-time interactions in gaming and healthcare, purpose-built hardware resolves the root inefficiencies of Ethereum’s infrastructure. Without decisive investment in hardware acceleration, Ethereum risks stagnating while competitors rise. 

Ethereum doesn’t need another short-term patch. It requires a lasting solution. The next wave of blockchain adoption demands an infrastructure that can support it, which means investing in hardware now.

Opinion by: Leo Fan, co-founder of Cysic. 

This article is for general information purposes and is not intended to be and should not be taken as legal or investment advice. The views, thoughts, and opinions expressed here are the author’s alone and do not necessarily reflect or represent the views and opinions of Cointelegraph.","{'href': 'https://cointelegraph.com', 'title': 'Cointelegraph'}"
https://news.google.com/rss/search?q=cryptocurrency+news,Crypto Market Dips After Trump’s White House Summit,https://coinpedia.org/news/crypto-market-slumps-after-white-house-summit-bitcoin-drops-altcoins-plunge/,"Sat, 08 Mar 2025 09:26:00 GMT","

Search keywords to find relevant posts.

Search keywords to find relevant events.

Search keywords to find relevant professional.

Search keywords to find relevant companies.

Search keywords to find relevant Currencies.



Search keywords to find relevant markets.

Log in to access your notifications and stay updated. If you’re not a member yet, Sign Up to get started!

Nidhi is a Certified Digital Marketing Executive and Passionate crypto Journalist covering the world of alternative currencies. She shares the latest and trending news on Cryptocurrency and Blockchain.

The White House Crypto Summit, despite high expectations fueled by Trump's pro-crypto stance, didn't deliver the anticipated major announcements.

Following the summit, major altcoins like XRP, ADA, and SOL experienced steeper declines than Bitcoin.

The summit highlighted plans for a U.S. strategic crypto reserve funded by seized Bitcoin, and a commitment to hold rather than sell seized bitcoin.

The White House Crypto Summit, hosted by President Donald Trump       Donald Trump   Donald Trump is an American former president politician, businessman, and media personality, who served as the 45th president of the U.S. between 2017 to 2021. Trump earned a Bachelor of science in economics from the University of Pennsylvania in 1968. Trump won the 2016 presidential election as the Republican Party nominee against Democratic Party nominee Hillary Clinton while losing the popular vote. As president, Trump ordered a travel ban on citizens from several Muslim-majority countries, diverted military funding toward building a wall on the U.S.–Mexico border, and implemented a family separation policy. Trump has remained a prominent figure in the Republican Party and is considered a likely candidate for the 2024 presidential election   President       wrapped up without the groundbreaking announcements like many had anticipated, including more clarity on the U.S. strategic crypto reserve. Instead of the market-boosting policies traders had anticipated, the summit delivered cautious steps toward regulation.

As expectations fell flat, the crypto market reacted swiftly. Bitcoin held relatively steady, but major altcoins like XRP, ADA, and SOL took a hit. Investors who had been gearing up for a bullish surge were left disappointed.

Altcoins suffered bigger losses than Bitcoin after the summit. Many traders were optimistic about Trump’s pro-crypto stance and hoped for a major policy shift, such as a government-backed crypto reserve featuring leading altcoins. Instead, the summit focused on plans for stablecoin legislation by August and a commitment to easing regulations.

While this was seen as a positive step, it wasn’t the major market-moving news many had anticipated.

One of the key takeaways was Trump’s executive order to create a US strategic reserve of Bitcoin and other digital assets. Crypto Czar David Sacks explained that the reserve would be funded using Bitcoin seized by the federal government through criminal or civil forfeiture.

However, this announcement disappointed some investors who had hoped for a broader plan to buy additional Bitcoin. The market reacted quickly, with Bitcoin’s price dropping to 86,394 dollars following the news.

The lack of a major crypto reserve initiative led to a wave of sell-offs in altcoins:

The White House summit, led by David Sacks, was highly anticipated after Trump’s promise to establish a crypto reserve that would include Bitcoin, Ethereum, XRP, Solana, and Cardano.

Earlier in the week, Trump’s posts on Truth Social triggered a massive rally, with some major cryptocurrencies surging up to 60 percent. However, on Friday, Sacks clarified that Trump’s mention of those five assets was just an example and not a firm commitment. This cooled expectations and contributed to the market downturn.

Despite the market’s negative reaction, the US government’s decision to hold onto its Bitcoin holdings could set an important precedent for other countries. This move may encourage global institutional adoption of cryptocurrency in the long run.

Trump also criticized previous government decisions to sell off seized Bitcoin, arguing that the US should never sell its holdings. At the summit, industry leaders praised Trump’s more open approach to crypto, seeing it as a shift from years of regulatory crackdowns focused on security and consumer protection.

While the short-term market reaction was negative, Trump’s evolving crypto policies could shape the future of the industry in the US and beyond.

Stay ahead with breaking news, expert analysis, and real-time updates on the latest trends in Bitcoin, altcoins, DeFi, NFTs, and more.





Search keywords to find relevant posts.

Search keywords to find relevant events.

Search keywords to find relevant professionals.

Search keywords to find relevant companies.

Search keywords to find relevant market currencies.

Search keywords to find relevant market exchanges.","{'href': 'https://coinpedia.org', 'title': 'Coinpedia Fintech News'}"
https://news.google.com/rss/search?q=cryptocurrency+news,Eleanor Terrett Highlights a Significant Week in Cryptocurrency Markets,https://blockchain.news/flashnews/eleanor-terrett-highlights-a-significant-week-in-cryptocurrency-markets,"Sat, 08 Mar 2025 16:59:55 GMT","

According to Eleanor Terrett, the past week has been notably significant for the cryptocurrency markets, as indicated by her tweet. The tweet suggests a period of high activity or notable events, though specific details were not provided.

British-born Fox Business journalist and producer, JMU graduate breaking news with a global perspective.

Welcome to your premier source for the latest in AI, cryptocurrency, blockchain, and AI search tools—driving tomorrow's innovations today.


                        Disclaimer: Blockchain.news provides content for informational purposes only. In no event shall blockchain.news be responsible for any direct, indirect, incidental, or consequential damages arising from the use of, or inability to use, the information provided. This includes, but is not limited to, any loss or damage resulting from decisions made based on the content. Readers should conduct their own research and consult professionals before making financial decisions.
                    ","{'href': 'https://blockchain.news', 'title': 'Blockchain.News'}"
https://news.google.com/rss/search?q=cryptocurrency+news,AltcoinGordon Shares Cryptocurrency Market Insights,https://blockchain.news/flashnews/altcoingordon-shares-cryptocurrency-market-insights,"Sat, 08 Mar 2025 19:32:55 GMT","

According to AltcoinGordon, the tweet suggests a moment of reflection or analysis on the current state of the cryptocurrency market, possibly hinting at upcoming trends or shifts. The attached image or link might provide further insights or data relevant to traders.

From $0 to Crypto multi millionaire in 3 years

Welcome to your premier source for the latest in AI, cryptocurrency, blockchain, and AI search tools—driving tomorrow's innovations today.


                        Disclaimer: Blockchain.news provides content for informational purposes only. In no event shall blockchain.news be responsible for any direct, indirect, incidental, or consequential damages arising from the use of, or inability to use, the information provided. This includes, but is not limited to, any loss or damage resulting from decisions made based on the content. Readers should conduct their own research and consult professionals before making financial decisions.
                    ","{'href': 'https://blockchain.news', 'title': 'Blockchain.News'}"
https://news.google.com/rss/search?q=cryptocurrency+news,Trump turned crypto from ‘oppressed industry’ to ‘centerpiece’ of US strategy,https://cointelegraph.com/news/trump-crypto-summit-us-bitcoin-policy-shift,"Sat, 08 Mar 2025 13:50:29 GMT","

 The White House Crypto Summit marked a “truly historic day at the White House,” according to Crypto.com CEO Kris Marszalek. 

US President Donald Trump has placed cryptocurrency at the center of his economic strategy, marking a major policy shift for the US blockchain industry, according to Crypto.com CEO Kris Marszalek.

Trump hosted a White House Crypto Summit on March 7, signaling that he intends to make crypto policy a national priority and make the US a global hub for blockchain innovation. 

The summit marked a “truly historic day at the White House,” Marszalek said in a March 8 X post.

Source: Kris|Crypto.com

Marszalek credited Trump with reversing policies like Operation Chokepoint 2.0, which allegedly led to crypto and tech firms being denied banking services under the Biden administration.

The difficulties of finding banking partners may indeed be a thing of the past for crypto firms after the US Office of the Comptroller of the Currency (OCC) eased its stance on how banks can engage with crypto just hours after Trump vowed to end the prolonged crackdown restricting crypto firms’ access to banking services

Related: US Bitcoin reserve marks ‘real step’ toward global financial integration

The crypto summit also comes as two major bills await congressional approval: the Stablecoin bill and the Market Structure bill, aiming to help lift the regulatory uncertainty around the US crypto industry.

Marszalek said ongoing dialogue with key regulators, such as the Commodity Futures Trading Commission (CFTC) and the Securities and Exchange Commission (SEC), could see “landmark legislation” pass. He added:

The CEO’s comments come a day after Trump signed an executive order on March 7, which outlined a plan to establish a Bitcoin reserve using cryptocurrency forfeited in government criminal cases rather than actively acquiring Bitcoin (BTC) through market purchases, Cointelegraph reported.

While no direct BTC purchases were announced, the bill added that the US Treasury and Commerce secretaries could make “budget-neutral strategies” to buy more Bitcoin for the reserve, “provided that those strategies impose no incremental costs on American taxpayers.”

Some analysts see the US Bitcoin reserve plan as the first “real step” for Bitcoin’s integration into the global financial system.

“The US has taken its first real step toward integrating Bitcoin into the fabric of global finance, acknowledging its role as a foundational asset for a more stable and sound monetary system,” Joe Burnett, head of market research at Unchained, told Cointelegraph.

Related: FDIC resists transparency on Operation Chokepoint 2.0 — Coinbase CLO

While Trump has previously highlighted his intentions to bolster crypto innovation in the US, issuing regulatory frameworks takes time and setting the “right regulatory tone” will be crucial for the administration, according to Anastasija Plotnikova, co-founder and CEO of Fideum — a regulatory and blockchain infrastructure firm focused on institutions.

Magazine: Meet lawyer Max Burwick — ‘The ambulance chaser of crypto’","{'href': 'https://cointelegraph.com', 'title': 'Cointelegraph'}"
https://news.google.com/rss/search?q=cryptocurrency+news,AltcoinGordon Predicts a Significant Q2 for Cryptocurrency Markets,https://blockchain.news/flashnews/altcoingordon-predicts-a-significant-q2-for-cryptocurrency-markets,"Sat, 08 Mar 2025 13:59:43 GMT","

According to AltcoinGordon, the second quarter is expected to be highly eventful for the cryptocurrency markets, suggesting significant movements or developments that traders should watch closely.

From $0 to Crypto multi millionaire in 3 years

Welcome to your premier source for the latest in AI, cryptocurrency, blockchain, and AI search tools—driving tomorrow's innovations today.


                        Disclaimer: Blockchain.news provides content for informational purposes only. In no event shall blockchain.news be responsible for any direct, indirect, incidental, or consequential damages arising from the use of, or inability to use, the information provided. This includes, but is not limited to, any loss or damage resulting from decisions made based on the content. Readers should conduct their own research and consult professionals before making financial decisions.
                    ","{'href': 'https://blockchain.news', 'title': 'Blockchain.News'}"
