Input URL,Title,Link,Published,Description,Source
https://news.google.com/rss/search?q=world+news,Syria church leaders condemn 'massacres targeting innocent civilians',https://www.hindustantimes.com/world-news/syria-church-leaders-condemn-massacres-targeting-innocent-civilians-101741462347587.html,"Sat, 08 Mar 2025 19:32:27 GMT","

Subscribe Now! Get features like

 The leaders of Syria's three main Christian churches issued a joint statement Saturday condemning ""massacres targeting innocent civilians"", following reports of mass killings of Alawite civilians by the security forces. 

 Britain-based war monitor, the Syrian Observatory for Human Rights, said ""532 Alawite civilians were killed in the coastal regions of Syria and the Latakia mountains by security forces and allied groups"". 

 ""In recent days, Syria has witnessed a dangerous escalation of violence, brutality, and killings, resulting in attacks on innocent civilians, including women and children,"" the joint statement said. 

 It was signed by the patriarchs of the Greek Orthodox, Syriac Orthodox and Melkite Greek Catholic Churches. 

 The reported killings on the Mediterranean coast the heartland of the Alawite religious minority was gripped by fighting between the country's new security forces and gunmen loyal to toppled president Bashar al-Assad. 

 Though the majority of Syria's Christians fled during the civil war that erupted in 2011, the city of Latakia, which has been hard hit by the latest violence, is home to a small Christian community. 

 ""The Christian churches, while strongly condemning any act that threatens civil peace, denounce and condemn the massacres targeting innocent civilians, and call for an immediate end to these horrific acts, which stand in stark opposition to all human and moral values,"" the statement said. 

 ""The churches also call for the swift creation of conditions conducive to achieving national reconciliation among the Syrian people."" 

 They urged a ""transition to a state that... lays the foundation for a society based on equal citizenship and genuine partnership, free from the logic of vengeance and exclusion"". 

 The spiritual leader of Syria's Druze minority, Sheikh Hikmat al-Hajri, also called for an end to the violence. 

 ""The flames that burn under sectarian slogans will burn all of Syria and its people,"" he said in a statement. 

 Assad, himself an Alawite who sought to present himself as a protector of Syria's minorities, was ousted on December 8 in a lightning offensive led by the Islamist group Hayat Tahrir al-Sham. 

 The group's leader Ahmed al-Sharaa has since been appointed Syria's interim president. 

 The new authorities have repeatedly promised an inclusive transition that protects the rights of religious minorities. 

 The Alawite heartland has nonetheless been gripped by fear of reprisals for the Assad family's brutal rule. 

 jos-jsa/kir

This article was generated from an automated news agency feed without modifications to text.



","{'href': 'https://www.hindustantimes.com', 'title': 'Hindustan Times'}"
https://news.google.com/rss/search?q=world+news,Security forces taken hostage by Colombian guerillas released: AFP,https://www.hindustantimes.com/world-news/security-forces-taken-hostage-by-colombian-guerillas-released-afp-101741460042780.html,"Sat, 08 Mar 2025 18:54:02 GMT","

Subscribe Now! Get features like

 Twenty-eight police officers and one soldier held hostage in southwest Colombia were released Saturday, according to an AFP team on the ground. 

 Around noon on Saturday, residents of the community of La Hacienda in the department of Cauca told the detainees that they were free to go. 

 The men, held since Thursday, collected their riot gear and left along a dirt road, escorted by local residents, AFP saw. 

 They headed toward the nearby town of El Plateado, where a commission from the state Ombudsman's Office was waiting for them. 

 The soldiers were detained Thursday after a day of clashes between residents and security forces, part of a government military operation aimed at ending drug-related violence in a region with one of the highest concentrations of coca crops in Colombia. 

 The government said the officers were being held by a dissident FARC guerrilla group. 

 As he left La Hacienda, Major Nilson Bedoya, the soldier in the group, said that throughout the ordeal he couldn't help but think of his family. 

 ""My family, my wife, my son, who are waiting for me at home,"" he said in an agitated voice, as he carried his gear on his shoulder. 

 Earlier Saturday, Defense Minister Pedro Sanchez in an interview with W Radio threatened to use ""the legitimate force of the state"" to have the troops released. 

 Sanchez and other representatives of the government of leftist President Gustavo Petro will meet Saturday with residents of the departmental capital, Popayan, to listen to the locals. 

 Officials said that on Thursday, guerillas and members of the public confronted and overwhelmed security services who were trying to reestablish state control in two municipalities. 

 Government images showed gangs pelting a flaming armored vehicle with rocks, and riot police detonating smoke grenades amid a running gun battle. 

 Petro blamed a FARC renegade faction known as the Central General Staff , accusing it of ""using the civilian population"" to attack troops. 

 The kidnappings were a major embarrassment and a stern challenge for Colombia's government, which is struggling with its worst unrest in a decade involving spasms of violence in several parts of the country. 

 Since October, Bogota has been trying to retake control of parts of Cauca from the EMC. 

 Petro's government is proposing an ambitious crop substitution program to combat the drug trafficking economy, a strategy that locals have denounced as a campaign of ""forced eradication"" of coca crops. 

 ""We will continue to work for these lands so that people can have a better future,"" said Bedoya, the soldier. ""The peasants were sold the idea that we are their enemies, but we are their best allies,"" he added. 

 bur-lv/llu/cls/ial/md/st 

This article was generated from an automated news agency feed without modifications to text.



","{'href': 'https://www.hindustantimes.com', 'title': 'Hindustan Times'}"
https://news.google.com/rss/search?q=world+news,The household item turning runners into world record holders,https://www.nbcnews.com/sports/track-field/household-item-turning-runners-world-record-holders-rcna194810,"Sat, 08 Mar 2025 12:01:00 GMT","



Profile

Sections

Local

tv

Featured

More From NBC

Follow NBC News

 news Alerts

There are no new alerts at this time

When Grant Fisher stepped off the track at Boston University on Feb. 14, it wasn’t entirely a shock that the American distance runner had just broken the world record for the indoor 5,000 meters. 

For one thing, he was in great shape. Only six days earlier, Fisher, 27, who was coming off a breakout season in which he earned two silver medals at the Paris Olympics, had also broken the world record at 3,000 meters in New York City. Larger trends were also at play: He was running on one of the fastest tracks in the world, wearing Nike spikes whose carbon plates and advanced foams helped return energy with every stride. 

Yet in Boston, when Fisher was asked about the factors that had led to his pair of world records, he acknowledged one so surprisingly simple that it’s probably in your kitchen. 

He’d recently begun taking baking soda.  

“I think it makes an impact, and if that impact is 1%, that would be massive,” Fisher told reporters. “It’s probably more like 0.1%, if there is one. And if it is just mental, then I’ll take that, too.”

Fisher is among the many professional runners in recent years to embrace baking soda — known within the sport by its scientific name, sodium bicarbonate, or simply “bicarb” — as a legal means of running faster times than ever. The use of a bicarbonate “system” sold by Maurten, a Swedish company, has become so widespread that at track and field’s world championships in 2023, two-thirds of all medalists from 800 to 10,000 meters were using it. At the Olympics last summer, more than two-thirds of all running medalists were using it — “and in some cases, all the finalists were using it,” the company told NBC News. 

In an eight-day span in February, seven of the sport’s world records in races ranging from the 1,500 meters to the road half-marathon were smashed. The rapid-fire rewriting of professional running’s record book can be traced to many reasons, from high-tech advancements leading to faster shoes and tracks, quicker recovery and better coaching. 

The combination has convinced Chris Woods, the head track coach at Mississippi State University, that not only “a lot of world records are in jeopardy here in the very near future” but that even times that once appeared unthinkable could now be possible, such as the record of 4:07 in the women’s mile.

“In my lifetime, in your lifetime, I do believe we’ll see a woman break 4 minutes,” Woods said.

But increasingly, runners such as Marco Arop, the 2023 world champion at 800 meters from Canada, whom Woods coaches, are also turning to “bicarb” for an edge.

Intense periods of exercise create a build-up of hydrogen ions in muscles, leading to acidity that can increase fatigue and create the “burning” sensation felt during hard exercise. As a base, sodium bicarbonate acts as a “buffer” that counters the acidity. Taking sodium bicarbonate doesn’t run afoul of World Anti-Doping Agency rules; in fact, even World Athletics, track and field’s global governing body, has described it as an “established performance supplement.” 

The benefits of “bicarb” have been known for decades, said Steve Magness, a coach and former elite runner who has written multiple books about performance. But athletes have been wary of it for just as long for an often unpleasant reason: The odds of a performance boost had to be weighed against the risk of race-wrecking gastrointestinal distress. 

“It didn’t work very well because there was a high percentage of people that just couldn’t even line up for the race or the time trial because it just tore apart your stomach,” Magness said.  

Fisher had heard so many “horror stories” of nausea, vomiting or diarrhea from using bicarbonate that he waited until this winter, after the all-important Olympics cycle, to test out a “bicarb” mixture in training. His stomach handled it fine, he said. And that may have been because in recent years, bicarb has hit a turning point.  

Maurten, the Swedish company, has found a way to encase small tablets of bicarbonate into a gooey, soup-like hydrogel that guides them through the stomach and into the intestine, where the bicarbonate is dissolved and absorbed with less potential nausea, vomiting or diarrhea, according to the company. Side effects of taking sodium include water retention and weight gain, and regularly increasing sodium intake may lead to an increase in blood pressure, the company says. 

Maurten’s credibility was boosted when famed marathon runner Eliud Kipchoge used its products to set multiple world records. Other Maurten users include Keely Hodgkinson, the Olympic champion at 800 meters.   

Beyond the hydrogel, however, bicarb may have become more palatable for elite runners recently for another reason. Just as the Paris Olympics began, a study in the European Journal of Applied Physiology upended a long-held belief that sodium bicarbonate was most effective as a buffer in shorter competitions, lasting up to around 10 minutes.  

When researchers at Edge Hill University in the United Kingdom gave Maurten’s bicarbonate product to male cyclists during a much longer, 40-kilometer time trial — nearly the length of a marathon — they measured a 1.4% boost in the cyclists’ performance, with minimal stomach issues. In practice, it meant cyclists using the bicarbonate were nearly 1 minute faster over about an hour of riding, said Eli Spencer Shannon, a Ph.D. candidate who led the study.

“I would classify that as small but meaningful,” Shannon said. 

The findings, Shannon said, should spark more research. Bicarb isn’t “one size fits all,” he said, because each person’s stomach distress can vary and because baking soda’s effectiveness as a buffer depends on how hard an athlete can push; harder exercise produces more hydrogen ions in the muscle that the bicarbonate can then remove. 

Still, Shannon was surprised by some of his study’s findings, such as that the riders using bicarbonate also were able to go faster without a change in their heart rate or the maximum amount of oxygen they were able to use during exercise, known as VO₂. 

“What that’s saying is that you’re able to sort of work harder but have less cardiovascular strain and have a better performance improvement in comparison to a placebo, which was really interesting,” Shannon said. “That suggests increased [muscle] contractility, which has never been seen, at this duration and at this intensity.”

Not all of track’s recent world-record holders incorporate baking soda as a new tool in their training. American Yared Nuguse, who broke the indoor mile record on Feb. 8, only for Norwegian rival Jakob Ingebrigtsen to reset it five days later, has said he doesn’t use bicarbonate because of its taste. But some of the world’s fastest have taken note. 

Two days before last summer’s Olympic semifinal in the men’s 800 meters, Arop, a former basketball player who became the world champion at 800 meters for Canada, turned to Woods in France with less a question than a statement. He was set on trying bicarb. The 800 meters was in the middle of one of the fastest years in the sport’s history, and Arop knew several of his competitors had used it with success.

“This is the pinnacle of our sport, and I don’t think he wanted to leave anything to chance,” Woods said. “And if there was a way to give a 1% advantage, that’s what he was going to do. That’s what he believed. And the results we were pretty happy with.” 

Woods didn’t know much about bicarb until Arop raised the topic in France, but he said he now believes there are scientific benefits. 

“Is there a mental component to it? I would say absolutely,” he said. “But I don’t think this is a placebo.”

Arop went on to earn the silver medal in the fourth-fastest time in 800 meters history, edged from the gold by just one one-hundredth of a second by Kenya’s Emmanuel Wanyonyi — who also was using Maurten’s bicarbonate in Paris, according to the company. The 800-meter world record, set in 2012, could be the next to go down, with Wanyonyi just two-tenths of a second behind. After the race, Arop said he believed his last-minute addition of sodium bicarbonate had “definitely played a factor” in his personal-best time. 

“Everybody else is using it, and it’s been working wonders,” Arop said in August.

Not everybody uses it. Bicarbonate is just one factor of many that have sparked what Woods called “the golden era of track and field when it comes to running fast times,” a boom he likened to the NBA in the 1980s, when the talent of Larry Bird and Magic Johnson, coupled with better technology and rules changes, boosted its popularity. 

A “shoe war,” as Magness said, has broken out in a race to develop shoes that return the most energy using bulky yet light foams and carbon-fiber plates. Under athletes’ feet, the physics of indoor tracks are also fueling faster times. The indoor track at Boston University, in particular, has become a destination because its wide, banked corners help runners ricochet around turns, and its above-ground frame made of wood and plywood can return energy like a mini-trampoline more than an outdoor track, where a rubber surface is poured over a concrete base. 

When Magness was running two decades ago, an information gap left him to wonder how East African competitors were training. Social media and the internet have opened access to other training methods and better coaching that don’t burn out young runners and created a bigger pool of strong runners, Magness said. Those young athletes are watching peers run faster than ever and believing confidently they can, too. 

They are powered by cutting-edge advancements Roger Bannister could only have dreamed of when he was chasing the first sub-4-minute mile — along with a basic household item, too.

“What the last couple years have done is kind of shift that mindset of, like, here’s the past and here’s what we were able to do,” Magness said. “But now the game has changed.”

Andrew Greif is a freelance sports journalist. 

© 2025 NBCUniversal Media, LLC","{'href': 'https://www.nbcnews.com', 'title': 'NBC News'}"
https://news.google.com/rss/search?q=world+news,Chinese humanoid robot lands world's first front flip,https://www.foxnews.com/tech/chinese-humanoid-robot-lands-worlds-first-front-flip,"Sat, 08 Mar 2025 11:00:00 GMT","


        This material may not be published, broadcast, rewritten, or redistributed. ©2025 FOX News Network, LLC. All rights reserved. Quotes displayed in real-time or delayed by at least 15 minutes. Market data provided by Factset. Powered and implemented by FactSet Digital Solutions. Legal Statement. Mutual Fund and ETF data provided by Refinitiv Lipper.
      

Among robots, a front flip is significantly more difficult than a backflip.

Chinese robotics company Zhongqing Robotics, also known as EngineAI, has officially entered the humanoid robotics scene by releasing a video showcasing what it claims is the world's first humanoid robot front flip. 

Robot backflips are becoming commonplace, but a front flip is significantly more difficult than a backflip, as any gymnast can attest.

PM01 humanoid robot performing a front flip. (EngineAI)

The challenge for robots attempting a front flip lies in maintaining balance and control throughout the rotation. 

GET EXPERT SECURITY ALERTS, MUST-KNOW TECH TIPS, AND THE LATEST DIGITAL TRENDS — STRAIGHT TO YOUR INBOX. SIGN UP FOR KURT’S THE CYBERGUY REPORT NOW.

Unlike humans, robots rely on precise sensor data and motor control to execute complex movements. During a front flip, the robot must rapidly shift its weight, adjust its center of gravity and coordinate the movements of its limbs to ensure a smooth and controlled landing. 

EngineAI has overcome a significant challenge in robotics by programming its PM01 to gather enough force to spin in the forward direction while calculating the correct angular velocity and torque.

PM01 humanoid robot performing a front flip. (EngineAI)

HUMANOID ROBOTS BUST DANCE MOVES ALONGSIDE HUMANS

Of course, this is a robot, and it has no fear, no hesitation and no sense of self-preservation. Its designers can put any range of powerful electric motors and joints into its anatomy, and it's been coded and instructed to flip, so it flips.

WHAT IS ARTIFICIAL INTELLIGENCE (AI)?

PM01 humanoid robot performing a front flip. (EngineAI)

CHINA LAUNCHES FACILITY TO TRAIN 100 PLUS HUMANOID ROBOTS SIMULTANEOUSLY

It is still an impressive feat because the field of robotics, particularly humanoid, general-purpose robots, is advancing at an incredible rate. Ten years ago, this kind of stuff simply did not exist. Now, you can buy your very own open-source PM01 robot for 13,700, according to EngineAI's website.

Its specs aren't bad, with five degrees of freedom in each arm and six per leg, totaling 23 degrees of freedom in body movement. The robot also features 221 lb-ft of torque (300 Nm), which seems like quite a punch when the little guy is only 4.5 ft tall and weighs 88 lb. EngineAI's general-purpose humanoid robot nails a front flip and walks off like a champ with one of the most human-like gaits seen to date, which is also quite impressive.

GET FOX BUSINESS ON THE GO BY CLICKING HERE

PM01 humanoid robot. (EngineAI)

CHINA’S NEWEST HUMANOID ROBOT IS READY TO SERVE LIKE NEVER BEFORE

The EngineAI PM01 is a new-generation open-source humanoid robot designed with elegant aesthetics and dynamic mechanical performance. It possesses a collaborative ecosystem, equipped with Intel N97 + NVIDIA Jetson Orin dual chips, offering motion control training codes and X86 & Orin deployment codes.

The EngineAI PM01 features natural gait walking powered by end-to-end neural network technology for authentic human-like movement. It has an interactive core display, which delivers a multidimensional smart interaction experience. It has exceptional mobility, with full-body degrees of freedom. The robot features distinctive family-style star ring lights and customizable movements through simulation learning and continuous evolution.

HOW TO STOP ANNOYING ROBOCALLS

PM01 humanoid robot. (EngineAI)

The EngineAI PM01 has a depth camera, the Intel RealSense D435i, a multi-array microphone for clear and bright sound quality, and an interactive core display for a seamless user experience. The robot is designed with high flexibility at the waist, 320° of rotation capability, and hollow joint wiring for a lightweight design with high durability and reliability. Each leg contains 6 degrees of freedom, with three hip joints, one knee joint, and two ankle joints.

It also features surround-sound 3D speakers that mimic human voice direction. Its high-capacity quick-release battery provides 10,000mAh for long-lasting power and rapid swapping. The PM01 is powered by a high-performance dual-chip architecture with Intel N97 + NVIDIA Jetson Orin. Each arm has 5 degrees of freedom: 2 shoulder joints, one upper arm joint, one elbow joint, and one forearm joint.

The core motion module is capable of a maximum joint torque of 300 N·m, a peak torque density of 203 N·m/kg, and exceptional mobility with a walking speed of 2 m/s, along with a natural human-like gait.

SUBSCRIBE TO KURT’S YOUTUBE CHANNEL FOR QUICK VIDEO TIPS ON HOW TO WORK ALL OF YOUR TECH DEVICES

PM01 humanoid robot. (EngineAI)

So, what does all this mean? Well, it's clear that robotics is advancing at an incredible pace. EngineAI's front-flipping robot is a testament to the ingenuity and innovation in the field. It makes you wonder what amazing feats robots will be performing in another ten years.

How important do you think realistic movement is for the acceptance and integration of humanoid robots into everyday life? Let us know by writing us at Cyberguy.com/Contact

CLICK HERE TO GET THE FOX NEWS APP

For more of my tech tips and security alerts, subscribe to my free CyberGuy Report Newsletter by heading to Cyberguy.com/Newsletter

Ask Kurt a question or let us know what stories you'd like us to cover.

Follow Kurt on his social channels:

Answers to the most asked CyberGuy questions:

New from Kurt:

Copyright 2025 CyberGuy.com. All rights reserved.

Kurt ""CyberGuy"" Knutsson is an award-winning tech journalist who has a deep love of technology, gear and gadgets that make life better with his contributions for Fox News & FOX Business beginning mornings on ""FOX & Friends."" Got a tech question? Get Kurt’s free CyberGuy Newsletter, share your voice, a story idea or comment at CyberGuy.com.

Get a daily look at what’s developing in science and technology throughout the world.

Subscribed

You've successfully subscribed to this newsletter!


        This material may not be published, broadcast, rewritten, or redistributed. ©2025 FOX News Network, LLC. All rights reserved. Quotes displayed in real-time or delayed by at least 15 minutes. Market data provided by
        Factset. Powered and implemented by
        FactSet Digital Solutions.
        Legal Statement. Mutual Fund and ETF data provided by
        Refinitiv Lipper.
      ","{'href': 'https://www.foxnews.com', 'title': 'Fox News'}"
