Input URL,Title,Link,Published,Description,Source
https://news.google.com/rss/search?q=tennis+news,Carlos Alcaraz has a big flaw,https://www.tennis365.com/atp-tour/carlos-alcaraz-mcenroe-novak-djokovic-most-popular,"Sat, 08 Mar 2025 17:42:19 GMT","

Patrick McEnroe has hailed Carlos Alcaraz as the shining star of men’s tennis, but he believes he has a wild side to his game that may need to be tamed.

McEnroe, who reached a career high ranking of No 28 and is the younger brother of Grand Slam legend John McEnroe, believes four-time Grand Slam champion Alcaraz may learn to dilute the fiery side of his game that occasionally costs him in the heat of battle on court.

At the age of 21, Alcaraz has already won two Wimbledon titles, as well as lifting the French Open and US Open titles, but he had a rawness to his game that is natural for a player of his tender years.

His defeat against Botic van de Zandschulp at last year’s US Open and his loss against Novak Djokovic a the Australian Open in January were examples of Alcaraz’s frustration getting the better of him, with McEnroe assessing how the youngster could improve his game as he spoke to Tennis365 in his role as joint-President of the International Tennis Hall of Fame.

“Alcaraz is electric and he is electrifying when he gets on a court and the only issue would be that he has, at times, hit his way out of a match by going for too much,” McEnroe told Tennis365 in an exclusive interview.

“He is so fun to watch because he can hit every shot, but that talent can hurt him when he is not having his best day.

“We have seen it a few times and last year’s US Open comes to mind as being a moment when he didn’t have answers when he was not hitting the winners he expects.

“That was the case against Djokovic at the Australian Open as well. He was clearly unnerved by Djokovic appearing to be injured and then getting back up and playing at such a high level again by the end.

“So he may need to reel it in sometimes because we can all see what he is capable of and he has shown that by winning four Grand Slams at the age of 21.

“If he does reel it in, then he might become more effective and consistent, but he may not be as much fun to watch. We all like to watch him and let’s not forget what he has already achieved.

“He has won four majors on all the different surfaces in tennis so I would not want to nitpick his game too much.”

The 11 men to win multiple Indian Wells titles: ft Novak Djokovic, Roger Federer, Rafael Nadal

Carlos Alcaraz sets sights on Roger Federer, Novak Djokovic Indian Wells feat

McEnroe went on to suggest Alcaraz is in a league of his own in the popularity stakes among tennis fans, as he continues to steal the headlines away from world No 1 Jannik Sinner and 24-time Grand Slam king Djokovic.

“He’s the most popular player in tennis right now. He’s not the world No 1, but he is an attraction and people want to see him,” he added.

“The way he plays the game, people look at him and say ‘wow’, I didn’t even know that shot was possible. People love to watch Alcaraz and we are lucky to have him in our sport.”

The International Tennis Hall of Fame (ITHF) officially opened its Letters to Greatness booth at an event hosted by ITHF Presidents, Patrick McEnroe and Kim Clijsters.

McEnroe and Clijsters were joined by ITHF CEO, Dan Faber and upcoming 2025 Inductees, Bob and Mike Bryan, to kick off the event by recording their own Letters to Greatness – congratulatory messages to Maria Sharapova and the Bryan Brothers ahead of their formal induction into the International Tennis Hall of Fame later this summer.

The Letters to Greatness booth will remain open throughout the remainder of the BNP Paribas Open, where tennis fans will have the chance to record or pen their own personal messages to the Class of 2025.

READ NEXT: Novak Djokovic’s ‘greatest strength’ revealed by Patrick McEnroe in Tennis365 interview


                Djokovic has been sent a stark warning ahead of his Indian Wells campaign.             


                ""I think that the sooner he returns, the better.""            


                Alexander Zverev's miserable run of form continued as he crashed out of the Indian Wells Masters.            


                Exclusive - Patrick McEnroe speaks to Tennis365 about Novak Djokovic's legacy as the ultimate king of all sports.            

© Planet Sport Limited 2025 • All Rights Reserved","{'href': 'https://www.tennis365.com', 'title': 'Tennis365'}"
https://news.google.com/rss/search?q=tennis+news,Danielle Collins launches her first line of tennis merchandise: “Play tennis. Cash checks. Repeat.”,https://en.as.com/other_sports/danielle-collins-launches-her-first-line-of-tennis-merchandise-play-tennis-cash-checks-repeat-n/,"Sat, 08 Mar 2025 19:26:16 GMT","

The American tennis star has launched her own line of merchandise.

Danielle Collins continues to make headlines after her outspoken comments regarding the financial side of the sport. 

The American star’s staff were spotted at Indian Wells wearing what was later confirmed to be a new line of merchandise released by Collins.

During the match against compatriot Hailey Baptiste, members of Collins' entourage could be seen in bright orange t-shirts with the slogan ‘Play tennis. Cash checks. Repeat.’ on them.

Danielle Collins' box wearing the new merch 👀""Play tennis. Cash checks. Repeat."" pic.twitter.com/JXEg3m2VJz

This stunt comes after Collins' much-publicised comments on the modern world of sport, where she stated that her fans’ support had funded her upcoming “five-star vacation” thanks to the “big fat paycheck” she was to receive.

The world number 14 has since been quoted by tennis.com as saying, “I obviously made some bold statements and got a lot of conversation going around women’s tennis and just women being able to talk about money… For years, I’ve had so many fans reach out to me, saying, ‘Danielle, when are you going to do a merchandise drop? I finally got to thinking about it like, ‘Yeah, let’s f—ing go! We’re doing this, and now’s the time.’” 

In an Instagram post, Collins confirmed that part of proceeds will go to a women’s equity fund; the merchandise can be bought via a link on her social media page.

“Female athletes deal with a whole set of unique challenges that are different from what male athletes deal with,” she added. “That’s not political; that’s just a fact. I don’t think we’re in a society where it’s embraced for us to stick up for ourselves, or wear our hearts on our sleeves, or play with emotions. I still think that it’s frowned upon if we display feelings of being upset, or having a moment of passion on court. I think a lot of those expectations that are placed on us are super unhealthy and unfair.”

As well as the stunt, Collins also revealed that she would be gifting Serbian tennis legend Novak Djokovic some of her products: “We were able to play around with the design choices and messaging to come up with something that was really true to me and my personality. I haven’t seen Novak this tournament (Indian Wells) yet but I will definitely be gifting him some merch.”

A post shared by Danielle Collins (@danimalcollins)

On the controversy, Djokovic recently said that he ""loved her response"", adding that “I loved everything she said on the court and off the court. Big fan of Danielle Collins after that. I was before, but now, big fan. I love it. I don’t think I would be that polite, but then I know exactly the feeling. So, I think she was funny, smart.”

Get your game on! Whether you’re into NFL touchdowns, NBA buzzer-beaters, world-class soccer goals, or MLB home runs, our app has it all. Dive into live coverage, expert insights, breaking news, exclusive videos, and more – plus, stay updated on the latest in current affairs and entertainment. Download now for all-access coverage, right at your fingertips – anytime, anywhere.

Complete your personal details to comment

Your opinion will be published with first and last names","{'href': 'https://en.as.com', 'title': 'AS USA'}"
https://news.google.com/rss/search?q=tennis+news,12 and under Tennis (TAUT),https://lodinews.com/local-events?_evDiscoveryPath=/event%2F36862852a-12-and-under-tennis-taut-,"Sat, 08 Mar 2025 19:07:04 GMT","

Plentiful sunshine. High 67F. Winds SSE at 5 to 10 mph..
                                

Clear skies. Low 38F. Winds light and variable.

 Updated: March 8, 2025 @ 10:48 am

Your browser is out of date and potentially vulnerable to security risks.We recommend switching to one of the following browsers:","{'href': 'https://lodinews.com', 'title': 'Lodi News-Sentinel'}"
https://news.google.com/rss/search?q=world+news,Syria church leaders condemn 'massacres targeting innocent civilians',https://news.google.com/rss/articles/CBMiygFBVV95cUxPcVpUTXVpdjM2OWlXSkFMV3RWQzBFYzNEcGw0UEFwY1l4SjA4V21RQ1AxR2h5YjAyTFJ4Y0pBcmJYUURyVm9GVl8wSUZpOUFJdzlnLWZocWNuZ2tJMFd2b01lRmhqVjV1U3M3QWNBOXBNZU1WUGtlaDZ5Z2RCOHZhR19hVnVqOWV0ajJGa1pETkkwZzJlVHRoMUxkSTdhRmhleDA1YTRwZmhrOWhRN2R3d2lTT0hnRWczR1JmRUxjNmZOQ1VBWTV6cm9B0gHPAUFVX3lxTE1QSFVPX2NpeXREWmRzYTVHZ050eERjbXlBMlR5a25KOVRWNWdYSmJVZzktNzdtckk2eFBKYzM5dmFaTEctUlVJQ2hMZkhZSXdyYVVKdTJ5NE14dThvLUR0TGZVQTdhVVZGNVluM0drMjFmNjM2V0dJbVdpTWUzQ2FYZWdHNDF6eHVQc0RUS2lJTVZYMkRpUE00THQ2dmk5NEd5Ry1PZ0c1bmExcXlmcFlZU2VrdlJaSFdXM3hEbVU5SkczdF8xUlpMVHM2S2stWQ?oc=5,"Sat, 08 Mar 2025 19:32:27 GMT", ,"{'href': 'https://www.hindustantimes.com', 'title': 'Hindustan Times'}"
https://news.google.com/rss/search?q=world+news,Security forces taken hostage by Colombian guerillas released: AFP,https://news.google.com/rss/articles/CBMixwFBVV95cUxNRFU4NmEyckdRTFdxbWtvQmZpeWxwZTc4MWVWekFpaEhDc2dRUlJEdEJVRjRUZTFIZDN4d0djOUNTTWQ2LUphYjNndFZaUVB5bDNBS3cySHlaTndQQk5vcE5CNGpPRkJGejNJSFUzUDBuTGhwV0NhT1RxVGRYMXRzV2F2TEFIdWl4U2Itcm05UkVza2x2d0pGS0hvWUNtdlc0YXV5Mmo5YUZEbkhUczJURlN2RlhDUVR2OTlWQ0g2RmNKVEpJT2JF0gHMAUFVX3lxTE96cEd0SkU5UElvdGNXN2dDUTBsZ2RIVGZZYnBlNHBMaTJlSTlvem14RjNldzU2enY2SjZTWlI4WmU4blo0Q1FBMzNNVVktdElqVTdXZENsaWtWYTJfaURGWkRrVTdCS0ZHS0p6VHhhdkRGbXBQVG9TRk5OMWJYZnhlbHoxNHFqUFpSc3JYNGh4WnR1QUVQYml3Z1kxRVFadk1LV3lYUzZqT1FLcWJqVW5ncDBsem50YzRnNzhSRTV6aVRHWm9fZlR4eWZTNw?oc=5,"Sat, 08 Mar 2025 18:54:02 GMT", ,"{'href': 'https://www.hindustantimes.com', 'title': 'Hindustan Times'}"
https://news.google.com/rss/search?q=world+news,The household item turning runners into world record holders,https://news.google.com/rss/articles/CBMiqAFBVV95cUxPT2F4el8tRTBWUzBDR2VYSnNCQXI4V0VCaWVwTVk5S3dMZXdwM0VxdjNybWx1clFDc3F4V0xISjhOd3VaT3VuUjB2Wkc2Q3JKVHdMMkhfU0JULV9jZkV1bDhtOU1WLXEwYmFKd2xmSEV1dnZpdk5OekpIUndSWmtkUTdMRFc5N3h3cU5lQ0dFQUFmeHpXakpEVEJwUUg2eVpsb2E4azJFZjfSAVZBVV95cUxPM05qVlZLeVN3LUtNNnBhMDRlcV8tM0ZGQVl0UUE1SWt5VkZIY2FtRmpBbnFqRUtOdXB6bHhDeFhZY1UwdXM0Y2hfanlINHpLX1hzZVFYdw?oc=5,"Sat, 08 Mar 2025 12:01:00 GMT", ,"{'href': 'https://www.nbcnews.com', 'title': 'NBC News'}"
https://news.google.com/rss/search?q=world+news,Chinese humanoid robot lands world's first front flip,https://news.google.com/rss/articles/CBMiiAFBVV95cUxQUXh6UU80blFFaVZ2ci0zVjZvLVpYTlFNTXpCSmNPTHgyd3NiaWFTRFNZOG1vWTFsQlNPRGJfWDRfZzN5MlZmYmViYTF2WEZfZ1FvWDVkUmljeHZQN3FQZUtmM1I4czdZU2NmOWU1X25id3hwOUpPSnhTWXQ4dXVHOFNmTHhLTlF40gGOAUFVX3lxTE5WZWw4ZlJ4MHBNanFYYk9rV1BhSEtWdDNDcWQ4SDd2NkpoMFNiTENwMkRTR2VMZWRCTVdUUlpDbWZUNnJXOERxeWd4a05zYnFMTFN2a1lmU1NGbDRqaFlNSFd3aHdxMUxiQVRTOEY5ekZYVG01Yzc0ZjlfS0l6MGZOLUsyUTJ6QWZDNGVrMFE?oc=5,"Sat, 08 Mar 2025 11:00:00 GMT", ,"{'href': 'https://www.foxnews.com', 'title': 'Fox News'}"
https://news.google.com/rss/search?q=world+news,Trump will lead task force preparing for 2026 World Cup,https://news.google.com/rss/articles/CBMilgFBVV95cUxNaS00OXdoWHd6WU56bVliX0NKYmgxd2RSZUw3Q0VGY3N0dWZrRHotUTFMUlQ0dDZBR2N0dmIxVFNwUFZfaWFBR0hkQ2M2c3lZT0xyODdRdml5UzV1TGxwc0V4T1ZHLUd6OTZ2RWRZWllTeFBzX29TVEI4VVRTQV9fMjRGQURfLU9WZUlJSHJDMmlZbTVLcnc?oc=5,"Sat, 08 Mar 2025 15:30:00 GMT", ,"{'href': 'https://apnews.com', 'title': 'The Associated Press'}"
https://news.google.com/rss/search?q=world+news,"Ukraine Trump: What US, Russia and Europe are thinking ahead of fresh Ukraine talks",https://news.google.com/rss/articles/CBMiWkFVX3lxTE94XzNhd3BvNUFyYmhlbXFsMlNPVXBUcGM5ZnNoZ2ExSU45Y0JHNmFvR212RWZDeUxzWVRoZkRNWFVxSnRZYzFzLTJRNTdWRTQyb29obFFacThKd9IBX0FVX3lxTFBpZUhrek13UHpWOVRvLU1hY09MQkhSdzI2ZUdsdVZYVVpNRjFwdjFkNEh3eENvM3NMeHVMNXFuUkNFZC1Gb19iX3Rpa09nVEVZN3NOVThXYmo4Vlp2UGRv?oc=5,"Sat, 08 Mar 2025 15:47:01 GMT", ,"{'href': 'https://www.bbc.com', 'title': 'BBC.com'}"
https://news.google.com/rss/search?q=world+news,Video. Latest news bulletin,https://news.google.com/rss/articles/CBMihgFBVV95cUxNNkNjV016WDNuc3VVVlptTy05Nk9xbUFMYlp0Ti16ei01Y0xZSWNMaVVqeV9DQVkzazlJWFE1RG5Fek5HdDNrVmx6SGdhLVpQRWcwWlVXX3VDX2g4b1FzckpicXFXZTloVVplcjEwejJlVUhlNXVlblV5d0tsTXBUQmx0VkpkZw?oc=5,"Sat, 08 Mar 2025 11:03:46 GMT", ,"{'href': 'https://www.euronews.com', 'title': 'Euronews'}"
https://news.google.com/rss/search?q=world+news,"Israel Opposed Direct US-Hamas Talks, Netanyahu Confidante ""Lashed Out"" At Envoy",https://news.google.com/rss/articles/CBMixgFBVV95cUxORV9IVmdkTGVDZXFLQ3ZfejZfUlJ1Q3MteHh5R0FxTmNZLUJlOW1ZSm1XWUZMbjEzRjNXTEtpM2l5T0xTb2VHVGdmSFliR0ljajVlMkZwczlSUXgwcUpzQ3k0dlM1bHBFTlVXNk9zMWlERTNlZHg2UXNJeVJZckhoZTc2S0twZUZpcXNlUm9WUVhkU0RPWUg5MXZFOWxQR3V4WjFDcG4xRVZQUVUtdVJoNE5WZ3ZGanhUbnAzWEZFV0t6anAtZmfSAc4BQVVfeXFMT3l5X2JiNFp2T2hlVXNjakpydDVGSU5pTDZkT1IxSWZVQWM0M3lKZnE4aTA0S04xWXlTRmhxRGxuYlpmR3FMUktrWkJPTjdpVWZLcnNoU1lGRmwzNkRJd1N2WEU5dFl6VGlVZk45cnN0cjNHNmRmTW1NTnFFS0xLazVGWmh0QmM4YmtmU0UwbFp3UnFqYW5faDJmUzM5NWhnUjEzbTFLNmtuVEJXbVpPSU5fdDBWWnYxa09ZeVlrejZJTG5XdDNxX2RrVkt2YWc?oc=5,"Sat, 08 Mar 2025 08:09:49 GMT", ,"{'href': 'https://www.ndtv.com', 'title': 'NDTV'}"
https://news.google.com/rss/search?q=world+news,Donald Trump's resort vandalised over Gaza remark,https://news.google.com/rss/articles/CBMisAFBVV95cUxQR3VISHVrcnh2bk91empqd0pfRVBIV1JEQVJUZ0V0amptRGF1czBHM1BfMXZQbXRKa1RFTV94N08teEcyVFlIMG1zLVFPc3l3QXpsRTlrQVFWRURMVWdQN2xHazZGa2tWaVhfWTRWQW9YZUhzemlYR1M1RXduLTdLVkthU2syU2I0VVpEbWlxTUlsNWlZQjhfa012MDdGdHdTLUhzbHNlOWRoS3dOS21VTtIBtgFBVV95cUxQc3hFQWpMcklVM1hINGhZN0M4QXpNNnZIMC1hbWh1YjZZbW1xdXc1bXRCamRENDV5OWZrcmZ6MW9hdS1WTU1JbUNQY09rZHJxQm44OW5XTExZTjJpWC1URTZsOHd4eTNuNVFRbEM2MUFKTnd4VHp4R1pBX2ZkM0ZGdEtKLUMySXpkcWhNc25ncklMWkRRM2wtbU1DM0ZiOHRsQjhNMmdQZ2MzWG5NbWtUZ0FyQXRHdw?oc=5,"Sat, 08 Mar 2025 16:58:49 GMT", ,"{'href': 'https://www.hindustantimes.com', 'title': 'Hindustan Times'}"
https://news.google.com/rss/search?q=world+news,People march in cities around the world on International Women's Day,https://news.google.com/rss/articles/CBMirAFBVV95cUxPWEpvek9feWN3ZGtDVDVsREVqRDM2eVZZOUZCRFpXLWx5WUFGYWhnSEJOLWRpaU14aDc5UGlGSHdNS3E5M3R6M1VsWnNYMWNTQVR2TkxRelFBTzktUFlBdkNwQXZOUXRoQmJJSXcyemVqZWdMZ0t2cWpNbG10b0RieWhNS09nTm84dnZEWmhOLVpFUDM0WHg0YWd1T09Lb0toVlRiRHVKOUp4TmMz?oc=5,"Sat, 08 Mar 2025 17:33:39 GMT", ,"{'href': 'https://www.euronews.com', 'title': 'Euronews'}"
https://news.google.com/rss/search?q=world+news,Fifa World Cup 2026: Donald Trump says co-host tensions will make tournament 'more exciting',https://news.google.com/rss/articles/CBMiZ0FVX3lxTE9GU3BZTmVJUDFtajRlQXNpYjlZVFZkdkRQWXQ5S0d6RVBDSGtNbFIzWlVYa25DdVNHSHFsQWlDUGpCTTdYT2l1bGpDYWFOaWdrXzl1eGtVVTAwLXBfZTJaZExpYzhfdnPSAWxBVV95cUxOc1ZSU0tYOHhicVBiVU5fOS10SUdtOVBKOG5mWVhxOUV6eUdpc0I5MWVRR091VWlzbERyS3g2cThWdENXaXNmcjV6LVduSmJvaWxCUFo2dWQ1ZGxfTVJHQ0oxOEtjQ3ZQZ1ZjVGQ?oc=5,"Sat, 08 Mar 2025 09:20:57 GMT", ,"{'href': 'https://www.bbc.com', 'title': 'BBC.com'}"
https://news.google.com/rss/search?q=world+news,Women will overthrow Iran's Islamic republic: Nobel laureate,https://news.google.com/rss/articles/CBMivwFBVV95cUxNQ25fVWttTDJNNkN3RVg3bV8tN0xmTVNvNmVvOTd5bTVkdVZJMVFaNjdSQWhzeGJHU3dkelRqb0FXdGx6Q1NQSGt0MUdTWWYwZ0VQRWZ1Zk1rMW02cGFNMV9jb2NoWm05QmRXTDZOcnRSczYtWnNQOUZlOUQyZVBkd09zSEVvZV9MTEtzUEFyUkRyLVRQZWR0OXRCVXFRUDlZUnVkcHFlZE0wR0gzVVd6SUxiNjVkakF5dTNtOFdaa9IBxAFBVV95cUxPQUt3aDRpdlJHYXhXYTlNSEs1cE9TaW5VR2RXNGtGUmlhUkU1UFU3RVBlUFhhOGtkajlGRW13QVJKZWlnU1c2VGlJTVJTc0lkQUZ2TEVmYUhIT0h6SFFOa3Bqekd6eGtqMHZQSTF2NXNpQVFrcGE2WE12OHdsSVd1VE9fQkd4MlJuMG8zT2NhT3hwSHBmS0NQTmNqaTAwVnJ3RzVnNTVScFdFR0FRSHQ3Sm1CNkJpSjg5Ml83aHlwSGlJaEFP?oc=5,"Sat, 08 Mar 2025 14:41:57 GMT", ,"{'href': 'https://www.hindustantimes.com', 'title': 'Hindustan Times'}"
https://news.google.com/rss/search?q=world+news,"Trump suspending US intelligence sharing is ‘suffocating’ Ukraine’s hope, says Ben Wallace",https://news.google.com/rss/articles/CBMiywFBVV95cUxQVjBwT1dxcU1tcUZkeFZoYXNrcVlyRUJMNUJ1NjlHMDRIWTFYU1ZXYWFZcmh1REUxNGJHaXd5UkhpTUE3TFdGeEFsZU9jOGFSeTdIWDFLTVd2cXR0ZFptZ0tmV1JLNzlhSVljTUk3Z1htX1JpLUxzVmpsTnJiQmFIQ1c5U1NtX2JvdlZqckw0akZhbnd4QWdMRDZnLUFhbGRRNXJsX01KRlVtUUd4MG5MZ2NyOXZMaHNjSHMxTFo2QlRSWmtvTktNQjdtUQ?oc=5,"Sat, 08 Mar 2025 15:47:02 GMT", ,"{'href': 'https://www.theguardian.com', 'title': 'The Guardian'}"
https://news.google.com/rss/search?q=world+news,International Women's Day around the world,https://news.google.com/rss/articles/CBMikwFBVV95cUxPVHZMZ0ZJRDNkQ2QtYXRZUzJMajFZVm92UWcwcHlRQkQ2U3hGQzBON1FmRVdNRXBocE45aFJ1eEpFenZzSFdCWDBGdktIYlROY0xFaDUxcFdDekFWMGdmZjF0YlIzRXNsSDBYVlVZeHFWa0JmS2NHNEJJcHAwa2VJSFU0cVBhTEZybVN5b05uRWxmcEE?oc=5,"Sat, 08 Mar 2025 16:55:09 GMT", ,"{'href': 'https://news.sky.com', 'title': 'Sky News'}"
https://news.google.com/rss/search?q=world+news,"Over 300 Assad Loyalists ""Massacred"" By Syrian Forces This Week",https://news.google.com/rss/articles/CBMivAFBVV95cUxONEx3SDN6cWkxN0JWT0dtczE2SVMyV2ZSTm9qQlM4MG40eFZSejVqSVN1U0ZQWUtWY2wxQm9LRTVzVWJmcEluWUJRNDc3d0E1elZhSUc2OS1ILVgyUzRJYUF0VFVoeV9iRUlpdUdLUm9iWGFseWFkLXBKUkNRUExBdHFySmxLWlE3bFNvOUVIaUdXa2RzQTFrVzVURXNWMjVTSTdVRVhpcWF5QjI5cENxUmNQempub2lxNEI1MtIBxAFBVV95cUxNb0xjZU5MeVI0ZF9WSkJuTnR1TDQxb1I3bFdHbjNmT2ZFbmpSUExrUkY1RDhRamluSU1zY2llSFVjQTRWLUJyNS1zdHpiUjZlQ2kwakVaU3ZpU2FKd0xKWk5fcVFlT2N6Z3hVWjJ1OURwSGZsUS1MdF9xbUJqcnkwYWRtcDEwcXZGd0IydGpGSkQxbkgxMlZObENGLVV3d0tJOENzU0IwajNtQUw3X1BLYzlINmtYeVNJZzBaMmFxUk51QzFu?oc=5,"Sat, 08 Mar 2025 09:05:38 GMT", ,"{'href': 'https://www.ndtv.com', 'title': 'NDTV'}"
https://news.google.com/rss/search?q=world+news,"Pope responding well to pneumonia treatment, Vatican says",https://news.google.com/rss/articles/CBMiuwFBVV95cUxPSGd5RGhFbEkwRVBBUFhLYjhIQXY5aEhVdWhIZ3hvX3dBWWVGS1BOWlBVMDZKc0t6cEw2bmZ0V2FHWjZnVU9Qd05PME1TSUJjem93YlJuRDFCM2EyUFJXVFJZVE9zSEJ5dzBIdHBYdkNZeG5mV0hHMnY1dmNoRkNocXNscUlLbjJvTlBjalRSR19ER2xjSGs5ZFdmaDdZTzVyOWtXSnpkUEFEMUtWX050cDR3ajRnS282M0J30gHAAUFVX3lxTE9neXlUVEpNTlljRjZsNlFrTGxhb3lzNHRFZFNMVGpTT3hHaVpZbVo0VlFvZV9oSDBQUlM3dTRpMlpQd25uYjlpTHZsZ1d2VGRZdTBJVWtzOW1LUGhCUTE3LVlBUjJOZU90cEl3NXE1bGtMam5fS0NkUEdTcW5DYUxnWjFOTXVmVHB1LXF5RUNwcDRibFlTQVJfZWJsT3FFejQwY2NvUWpJU1Rqek5zelFvSlRxY2FlOUN4eGNPUkktbA?oc=5,"Sat, 08 Mar 2025 18:52:01 GMT", ,"{'href': 'https://www.hindustantimes.com', 'title': 'Hindustan Times'}"
https://news.google.com/rss/search?q=world+news,Russia's ruling party officials face backlash for gifting meat grinders to mothers of dead soldiers,https://news.google.com/rss/articles/CBMi4AFBVV95cUxQR2dLT2tLMFYtNGFHaFBLU2VvaTJjaVZuY2t3TGhnR2FGUGpnUG4zSnhXeWcxXzVURlU3bkw0YU1wM0RuaFJSeHgzN3ZqcDR4WGlJZTJhQURlRlVhZ3FqaVR5ZzNXeU1iWGp2UTU2d3RraF9fcGFhYVJfOS13VXNvOEQ1aW50bTBlYmhiazJTNDR5elBxYm5xeXVsWlR2OFZET1VrLVJVT2djdTFNVFphNDJJTkFEQUZfNWVyQ2JNa0xSOGd1ZHowVzYycjRyanRGMEN6MmE5WTlnZC0ya1J6TdIB5gFBVV95cUxPZ0NDa3BqVU0zUEMxeVluSTJqTzVCQnB6MHNoVkVkbVZFaDMzeUJDV1lNN25iT2pIdFJTZVFmMzUwVHE1MWdlMGw3QjloMHo2aEpTUFk5VHVUa2g1cThwZWl4SXJtYmV3dnJKUDZvVS1HM1pjVmkyTTJkR0FnVi1mMlNGZVRlZEp0YmtMeldzM2tmbThrOF9XOXgwUkVFcmJ5cldZYkpGaF9TdU9sQm1zck5TSXhpOWZ2SDlTX3g3bzlsWEpfSUdSNlo4UVF0ejJ4cUdFNzZzMnpqdWhsbzJ1Q0JEM0NvQQ?oc=5,"Sat, 08 Mar 2025 16:19:23 GMT", ,"{'href': 'https://www.hindustantimes.com', 'title': 'Hindustan Times'}"
https://news.google.com/rss/search?q=world+news,Russians ignore Putin's call for more babies as population declines,https://news.google.com/rss/articles/CBMizAFBVV95cUxNRzBYTm9UdHMxTTZ6T3BkTDZOcnRSYUlnZjYxTWRnWHh5aktCdW1CX3VmTTA1djBQanJQRnczc01heE5rWi1DLVlLZnQ3YUpsY3lkRXVCUUk2OF9iMXB4a24tbWlVb05qNVFhYXJpUWV6cVNHTXRIM0E0MGk3bWxnRENuWFhGeUZiTUZWQ3dqX0VRNVpVSk5uSTNXUk5NUUVYNFJ1T0dteTRCZzRpYlFweTlGc3Z6a0VmalduZEhQc2VnSEJiRlJKQTVGRWPSAdIBQVVfeXFMTVlLeFpraWFlb3pLbXA3aGV4YVAxbDVaUk9OVW43djNQV0pxWlNTcmlrWTlXTnNMVkhIaU5nTW5CZlRxUWo2ZndLZ0Z1SnZYNW13aDZlMnlaSmtXTXR5VE1YNDNja1BXUkdHQWtXeUhMLURXc1RxTVhhUU1nZTdFY1VvR1p3OUFNU1VVM0NOOGJWRi1raU5fLXA0VHg1N01VS2FVTTVSSHJQandfMmFFSlllNDlfTUpzU09nM2pUdFJRWngwLVNsdkFQX0R5SFNpcTl3?oc=5,"Sat, 08 Mar 2025 09:25:40 GMT", ,"{'href': 'https://www.business-standard.com', 'title': 'Business Standard'}"
https://news.google.com/rss/search?q=world+news,"Pope Francis health: Pontiff showing ‘gradual, slight improvement’, says Vatican",https://news.google.com/rss/articles/CBMi3gFBVV95cUxNVlJXdll3UzRObEs5WnJSc3VzTFlxX0k3Z2stbjBzMGlYQ3VOMzhaNEFFZXFueHFyTFo1LVBlQ0VWNEotQk5BMHhLUHpkdjAxSHFpajUyMHBpTGpIUWd6MTNfU0dhRnk0RkhONWVtUEg5VTlkc3JXeFRzeGphUXh4MHVGdHFNa2FRakxTNjhDU3BOT28teXVtbWo1T2NxNzN3MklSZHkzdWtDSnZLSjZobG5VSjIyWlhBTDUzUjNLNVIyMzZrUWxkLUVldXY4NmZ4aWpYS0dLb2lkYkp3MlHSAeMBQVVfeXFMTWxBcVIzbC1FZU5kbVFXWjVrMFE0Q1FkbEhZMks4aU1vNEk1RG1Lc01PY1U2Tks5cXVCdXlIN04yZXQ0eXZSUkY2a2NFYy1acVpSczNEd3FxVWlUSlItVHpLZjMyc3BTNmpwOU5HNDhNMFpUVnVpVnI2MFRqazNlY1ZoOXJqcXdNV21wYzkwTHg0d2gwbVN1bDdPWi1SNUt0b3ZvVm1RakIyX2FLc0h2d1NzaS1ONGZkVlV1R3dwbHdUOHRHRXdxRmEwUGpVV2tHOEtpVHVZUU1KQVlQUWxZTTR1aTg?oc=5,"Sat, 08 Mar 2025 19:20:57 GMT", ,"{'href': 'https://www.hindustantimes.com', 'title': 'Hindustan Times'}"
https://news.google.com/rss/search?q=world+news,"Taliban defends women's rights under Islamic law, rejects Western criticism",https://news.google.com/rss/articles/CBMi0gFBVV95cUxPZ3VEU2N3RnMyWk1WR2Y2aThxWllXUkdNSG52dWNfeHBfUjItVXZldkU0S0p3QzE2VE40NVI2UkdEdV9vd3VTdHNISGRxRWxuY2trQjZ6RjRDaHZpQnp0WVFkbEdGQXVJZWFJc0d3cENzeXdZNGJHb2Yza3FUNGZWUHZpdkdOMTlQT19wSkw5U2JiWHVWVl9RVzUxQWtvZzk4UER5VGJTUGVZTFJMZnlOLXY3U1dicElUa1FlSVpsaEVPUDg1R2tMdC1uNjUwQUpEbGfSAdcBQVVfeXFMUEdsQXhpbTZNZEdHZ1VSNUt6RXpIXzdYX0FTUkR3bVlYZGVTekNwRHdqVjBsZ3RFVThCSFpubDRWZlROcFlzdUg1bnJsQzlfSnZLZDBRdFNIWFNyQUlJclEtX1MxX0hvV0lHSnM4a0xsQjMxcnZRN2xEc0tUVFJRR1FJWTJPeDRCZTN3VGc2b2xnYkppdmV0WHUzU0dldUw1UVRsNERDSllQTHpqU1dTcndPaW90WXBpNGpIOVM4SE5hYkt0WTAyQVV6MWVTWWxQbWJ4bEJBYXM?oc=5,"Sat, 08 Mar 2025 14:43:18 GMT", ,"{'href': 'https://www.hindustantimes.com', 'title': 'Hindustan Times'}"
https://news.google.com/rss/search?q=world+news,"Angry At Being Removed From WhatsApp Group, Man Shoots Admin In Pakistan",https://news.google.com/rss/articles/CBMisAFBVV95cUxOaE9SOC14cjNLeF9sYmpnam1zOXRfRnZ4eG1ra0ExMEFGdUtKZmotelhTTGxKRExNd1JNN3JpOEhGbEttWG9jM3BkdjFEUXlZOG1oYWtCWnVFbEstQmtQQTl4OU00dFpubTR6YjRjeks3THdCNmJ0Rk9VTGhUZU5CYkpXX2IwMFowOVpaQVdySllKazRhWDdldjg2LVVJbUo1NlV0cnVDZk1XUlZJNFdkaNIBuAFBVV95cUxOODhFSHpiVFMxb1ppemtXMkpaZkNuVENOemF3RGY3dlBmVk1jcGpoS1dTYUlXVllYZnBJaFdLZHFkd19tblJBdk11MTdXeFlpRVpwRHhwZ0FKN0tfT0puMW5iNmZWNVFrSThCbkcyRFlxTnA4ZjI5UFBoZWV1NTFqY2V0UDJsNFJkQm1ydnZud0FhZXVkbnRKRDRaa1lQX2t4c2s5MmhiYjZSMng5dFBkcWdETnhPdm1P?oc=5,"Sat, 08 Mar 2025 14:09:53 GMT", ,"{'href': 'https://www.ndtv.com', 'title': 'NDTV'}"
https://news.google.com/rss/search?q=world+news,Porn Star Whitney Wright Faces Outrage After Visiting Taliban-Controlled Afghanistan,https://news.google.com/rss/articles/CBMiwwFBVV95cUxPaXpoUjlTQ2hNLVJpRFY1dkRWakNaRGNlX2I2VlhhbWhEVXhVVFNTTmNHVHNWT2MtZDNjWnVJQ2dCTnp3SW5XS3phNzNTNlhpaXRYUHJnMlpXVFlOZUJSLU13QnVkd0EzM3lES0dtY0tvNTlsY1dfRWp1MzZ4QTVpVmFnSFpfQ284SUVKM2EzUGdPWWRGVTZsMjBnWTM5bGFielYtV05mQm5OUVU2dmNiNGdyZmJSX3pRU3BDd0RmRW5NcmPSAcsBQVVfeXFMT1ZlekZlWmlmbWd3RHkxWXpiVU16SDBhTnhocGdlNml2elRJVDkxNTEzOUI4bXRHblJuQk9LenhMR3BQRDhlUThJckRadW8xMXdEa082dDZrRDFxVVhLTVpta19zSXd3TllFc1ZfT0tiYnlkd0xnSHIyaFVqVEVkR0NZdFBjZ0xnY2w3ckxueW9NXzQwRGY2ZzNVZVNsTFFhSVoyWnZOa1FobkhCWi1OTFlPbHgtVzlYRDdpRDdFb2ZKY2cwMFJvcmJVVGc?oc=5,"Sat, 08 Mar 2025 08:09:01 GMT", ,"{'href': 'https://www.ndtv.com', 'title': 'NDTV'}"
https://news.google.com/rss/search?q=world+news,Putin party gives meat grinders to mothers of dead troops,https://news.google.com/rss/articles/CBMivAFBVV95cUxNTDRWYlNfemFQbEFnVzVqMzBjd2x2UjFCRXE2OVZ2T3lZZkJFZndqTnRDcjJfMkQ5OHlCUmRYMEVDbGR0SFF5XzZIcWY0NE9jdEQ5VnVyVExQTXg0dU1wanpBVWljRFcxT0VNb2N2Tk94QmNNWWRKZEYxb21JVTNlTWJINV9yM1RlU0V6TEVPZGZiWGxhNWFPOTQ4N1hZbjBVX05oWXZEaUZib29pUXNxbk84d1VGdGNHN19jatIBwgFBVV95cUxQc29kdHhmY05GZUgtX1VVZkpyLWtPSFhlc0ZmWFRVY1JZbFoyZU1oMzZyOTJNUDNYNnlncFhzdUJiQ1VrbXFNVk00b0pBaTFJSEZjeVZZM1poVGVwMzJsTkxwSHlfSnpuemRoYnpnTmxTQmlwdm02cXJrTlFJMkRDSF9ZelRIUGI3TnF6aEp0bll6Y1FJdUd5MFNLOTlsSVpMUGdJelU3OGJvcmpOZmQ4cHk5TTBwaXBGOGx6M3JFbF9yUQ?oc=5,"Sat, 08 Mar 2025 14:50:03 GMT", ,"{'href': 'https://www.hindustantimes.com', 'title': 'Hindustan Times'}"
https://news.google.com/rss/search?q=world+news,Two Russian regions block Telegram app over security fears,https://news.google.com/rss/articles/CBMivgFBVV95cUxNeHo0RDU4U2ppWU1CVk1qeC1LOWxHQ01PZ1lMSUd4cGRkYWxxdjVSNEhkbXExVHNES1NsX3lLTmJKdVNaY3FnUjB4YXFFVmNnUHA4U1o3NjVUVTk5X2xieldmYXBlVm56c0Uyd09NemlobkRWRTRYNUp2aDBKdGVyNkpmX2hCNDVpS2xJS1pRc0pQTXFsd3VxcXVVR0lvY2lrbk43LUtlSTdsUGVaN2hWcFEtU1hsUkdhc2dqaWZR0gHDAUFVX3lxTE9fRnRqenVsaFdzR3dab3dZclRiYmVxLXNOX205eXJLNHJTd1NiWldsdGM1WDhoZ3p0UDY0cDJSSXlGQnAtYXh6dHhOeFRhYTJpSC04a2R5S0J2UHBScWNvV1FNcDFleWplUUFrZUg3QXJpTWltWWRaM0Zqd1RuU3FCcTJ6UXJwd0Q4d201NVZzNjBlU3FrSVlJUzFDZWNhZ0RYZzNLTWpNS0JsNkY1WnRac1RMOEswaWo3YkVQd1MtNXotMA?oc=5,"Sat, 08 Mar 2025 13:47:23 GMT", ,"{'href': 'https://www.hindustantimes.com', 'title': 'Hindustan Times'}"
