Input URL,Title,Link,Published,Description,Source
https://news.google.com/rss/search?q=entertainment+news,"Deets about Shraddha Kapoor and Rahul Mody's relationship, Anil Kapoor on being replaced in No Entry 2, S",https://timesofindia.indiatimes.com/entertainment/hindi/bollywood/news/deets-about-shraddha-kapoor-and-rahul-modys-relationship-anil-kapoor-on-being-replaced-in-no-entry-2-salman-khans-first-look-from-sikandar-sets-top-5-entertainment-news-of-the-day/articleshow/111116113.cms,"Wed, 19 Jun 2024 13:30:00 GMT","Deets about Shraddha Kapoor and Rahul Mody's relationship, Anil Kapoor on being replaced in No Entry 2, S","{'href': 'https://timesofindia.indiatimes.com', 'title': 'TOI Etimes'}"
https://news.google.com/rss/search?q=entertainment+news,Halle Berry carries Olympic flame in France,https://www.castanetkamloops.net/edition/news-story-493144-8-.htm,"Wed, 19 Jun 2024 18:00:29 GMT",Halle Berry carries Olympic flame in France - Entertainment News,"{'href': 'https://www.castanetkamloops.net', 'title': 'Castanet Kamloops'}"
https://news.google.com/rss/search?q=entertainment+news,Shraddha Kapoor makes her relationship with Rahul Mody Insta official,https://www.wionews.com/entertainment/bollywood/news-shraddha-kapoor-makes-her-relationship-with-rahul-mody-insta-official-733118,"Wed, 19 Jun 2024 08:20:09 GMT",Shraddha Kapoor makes her relationship with Rahul Mody Insta official,"{'href': 'https://www.wionews.com', 'title': 'WION'}"
https://news.google.com/rss/search?q=entertainment+news,Travis Kelce's favourite date-night meal with Taylor Swift revealed,https://www.castanet.net/news/Entertainment/493114/Travis-Kelce-s-favourite-date-night-meal-with-Taylor-Swift-revealed,"Wed, 19 Jun 2024 13:34:00 GMT",Travis Kelce's favourite date-night meal with Taylor Swift revealed - Entertainment News,"{'href': 'https://www.castanet.net', 'title': 'Castanet.net'}"
https://news.google.com/rss/search?q=entertainment+news,"Denzel Washington to go on hiatus, Entertainment News",https://www.asiaone.com/entertainment/denzel-washington-go-hiatus-0,"Wed, 19 Jun 2024 08:08:39 GMT","Denzel Washington to go on hiatus, Entertainment News","{'href': 'https://www.asiaone.com', 'title': 'AsiaOne'}"
https://news.google.com/rss/search?q=tennis+news,Andy Murray vs Jordan Thompson LIVE: Queen’s tennis latest as Brit pulls out of tournament with injury,https://www.independent.co.uk/sport/tennis/queens-live-scores-tennis-andy-murray-b2565222.html,"Wed, 19 Jun 2024 18:18:53 GMT",Andy Murray vs Jordan Thompson LIVE: Queen’s tennis latest as Brit pulls out of tournament with injury,"{'href': 'https://www.independent.co.uk', 'title': 'The Independent'}"
https://news.google.com/rss/search?q=tennis+news,Andy Murray retires injured in likely final Queen's appearance,https://www.bbc.com/sport/tennis/articles/crgg77n8w1ro,"Wed, 19 Jun 2024 16:21:41 GMT",Andy Murray retires injured in likely final Queen's appearance,"{'href': 'https://www.bbc.com', 'title': 'BBC.com'}"
https://news.google.com/rss/search?q=tennis+news,Andy Murray retires after calling physio at Queen's Club to spark major Wimbledon concerns,https://www.express.co.uk/sport/tennis/1913156/Andy-Murray-Queens-Club-Wimbledon-retirement,"Wed, 19 Jun 2024 16:15:00 GMT",Andy Murray retires after calling physio at Queen's Club to spark major Wimbledon concerns,"{'href': 'https://www.express.co.uk', 'title': 'Express'}"
https://news.google.com/rss/search?q=tennis+news,Zhang Zhizhen upsets Daniil Medvedev in Halle,https://www.atptour.com/en/news/medvedev-zhang-halle-2024-wednesday,"Wed, 19 Jun 2024 17:01:20 GMT",Zhang Zhizhen upsets Daniil Medvedev in Halle,"{'href': 'https://www.atptour.com', 'title': 'ATP Tour'}"
https://news.google.com/rss/search?q=tennis+news,New S.F. parks plan has united two mortal enemies,https://www.sfchronicle.com/opinion/openforum/article/tennis-pickleball-sf-parks-19521272.php,"Wed, 19 Jun 2024 11:11:08 GMT",New S.F. parks plan has united two mortal enemies – tennis players and pickleballers,"{'href': 'https://www.sfchronicle.com', 'title': 'San Francisco Chronicle'}"
https://news.google.com/rss/search?q=tennis+news,"Sabalenka, Vondrousova, Zheng matches postponed in Berlin due to rain",https://www.wtatennis.com/news/4041405/sabalenka-vondrousova-matches-postponed-in-berlin-due-to-rain,"Wed, 19 Jun 2024 15:16:54 GMT","Sabalenka, Vondrousova, Zheng matches postponed in Berlin due to rain","{'href': 'https://www.wtatennis.com', 'title': 'WTA Tennis'}"
https://news.google.com/rss/search?q=tennis+news,Buck Em' Rewind: Women's Tennis,https://utamavs.com/news/2024/6/19/buck-em-rewind-womens-tennis.aspx,"Wed, 19 Jun 2024 14:21:37 GMT",Buck Em' Rewind: Women's Tennis - University of Texas Arlington Athletics,"{'href': 'https://utamavs.com', 'title': 'UT Arlington Athletics'}"
https://news.google.com/rss/search?q=tennis+news,"Fearnley, Pinnington Awarded Wild Cards into Wimbledon",https://gofrogs.com/news/2024/6/19/mens-tennis-fearnley-pinnington-awarded-wild-cards-into-wimbledon.aspx,"Wed, 19 Jun 2024 14:48:30 GMT","Fearnley, Pinnington Awarded Wild Cards into Wimbledon","{'href': 'https://gofrogs.com', 'title': 'TCU Athletics'}"
https://news.google.com/rss/search?q=tennis+news,DC residents try to beat the heat by playing early morning tennis,https://www.nbcwashington.com/news/local/dc-residents-try-to-beat-the-heat-by-playing-early-morning-tennis/3645086/,"Wed, 19 Jun 2024 13:00:27 GMT",DC residents try to beat the heat by playing early morning tennis,"{'href': 'https://www.nbcwashington.com', 'title': 'NBC Washington'}"
https://news.google.com/rss/search?q=tennis+news,Former Greenwood tennis star Kinnear still involved in the sport,https://dailyjournal.net/2024/06/19/former-greenwood-tennis-star-kinnear-still-involved-in-the-sport/,"Wed, 19 Jun 2024 18:13:00 GMT",Former Greenwood tennis star Kinnear still involved in the sport,"{'href': 'https://dailyjournal.net', 'title': 'Daily Journal'}"
https://news.google.com/rss/search?q=tennis+news,Tennis-Medvedev makes early exit in Halle,https://wtaq.com/2024/06/19/tennis-medvedev-makes-early-exit-in-halle/,"Wed, 19 Jun 2024 18:24:32 GMT",Tennis-Medvedev makes early exit in Halle,"{'href': 'https://wtaq.com', 'title': 'WTAQ'}"
https://news.google.com/rss/search?q=tennis+news,Team of the Week,https://itemlive.com/2024/06/19/team-of-the-week-st-johns-prep-tennis/,"Wed, 19 Jun 2024 16:57:18 GMT",Team of the Week - St. John's Prep tennis,"{'href': 'https://itemlive.com', 'title': 'Daily Item'}"
https://news.google.com/rss/search?q=tennis+news,Court Clash: Pickleball courts gain ground over tennis courts in recent recreation trends,"https://www.piercecountyjournal.news/stories/court-clash-pickleball-courts-gain-ground-over-tennis-courts-in-recent-recreation-trends,95017","Wed, 19 Jun 2024 18:16:00 GMT",Court Clash: Pickleball courts gain ground over tennis courts in recent recreation trends,"{'href': 'https://www.piercecountyjournal.news', 'title': 'Pierce County Journal'}"
https://news.google.com/rss/search?q=tennis+news,Andy Murray injured at Queen’s to cast doubts on Wimbledon swansong,https://www.theguardian.com/sport/article/2024/jun/19/andy-murray-injured--queens-tennis-doubts-wimbledon-swansong,"Wed, 19 Jun 2024 18:26:00 GMT",Andy Murray injured at Queen’s to cast doubts on Wimbledon swansong,"{'href': 'https://www.theguardian.com', 'title': 'The Guardian'}"
https://news.google.com/rss/search?q=tennis+news,Tierra Del Sol tennis courts will be closed for fence replacement,https://www.villages-news.com/2024/06/19/tierra-del-sol-tennis-courts-will-be-closed-for-fence-replacement/,"Wed, 19 Jun 2024 17:00:22 GMT",Tierra Del Sol tennis courts will be closed for fence replacement,"{'href': 'https://www.villages-news.com', 'title': 'Villages-News'}"
https://news.google.com/rss/search?q=tennis+news,6 Madison Boys Tennis Players Receive Post Season Honors,https://www.tapinto.net/towns/madison/sections/sports/articles/6-madison-boys-tennis-players-receive-post-season-honors,"Wed, 19 Jun 2024 16:58:00 GMT",6 Madison Boys Tennis Players Receive Post Season Honors,"{'href': 'https://www.tapinto.net', 'title': 'TAPinto.net'}"
https://news.google.com/rss/search?q=tennis+news,MATCH POINT: Elisabetta Cocciaretto stuns Sloane Stephens in Birmingham,https://www.tennis.com/news/videos/match-point-elisabetta-cocciaretto-stuns-sloane-stephens-in-birmingham,"Wed, 19 Jun 2024 14:55:06 GMT",MATCH POINT: Elisabetta Cocciaretto stuns Sloane Stephens in Birmingham,"{'href': 'https://www.tennis.com', 'title': 'Tennis Magazine'}"
https://news.google.com/rss/search?q=tennis+news,Andy Murray: Three-time Grand Slam champion retires injured at Queen's against Jordan Thompson,https://www.skysports.com/tennis/news/12040/13155604/andy-murray-three-time-grand-slam-champion-retires-injured-at-queens-against-jordan-thompson,"Wed, 19 Jun 2024 17:15:00 GMT",Andy Murray: Three-time Grand Slam champion retires injured at Queen's against Jordan Thompson,"{'href': 'https://www.skysports.com', 'title': 'Sky Sports'}"
https://news.google.com/rss/search?q=tennis+news,Tennis news: Alex de Minaur in shock development as Wimbledon preparations take massive hit,https://au.sports.yahoo.com/alex-de-minaur-in-shock-development-as-wimbledon-tennis-preparations-take-massive-hit-211926186.html,"Wed, 19 Jun 2024 13:35:15 GMT",Tennis news: Alex de Minaur in shock development as Wimbledon preparations take massive hit,"{'href': 'https://au.sports.yahoo.com', 'title': 'Yahoo Sport Australia'}"
https://news.google.com/rss/search?q=tennis+news,Andy Murray a major doubt for final Wimbledon after retiring at Queen's,https://www.independent.co.uk/sport/tennis/andy-murray-retires-queens-wimbledon-b2565455.html,"Wed, 19 Jun 2024 18:14:14 GMT",Andy Murray a major doubt for final Wimbledon after retiring at Queen's,"{'href': 'https://www.independent.co.uk', 'title': 'The Independent'}"
https://news.google.com/rss/search?q=tennis+news,Wheelchair Update: Shaw Builds Momentum ahead of Paralympics,https://www.tenniscanada.com/news/wheelchair-update-shaw-builds-momentum-with-paralympics-in-sight/,"Wed, 19 Jun 2024 16:32:31 GMT",Wheelchair Update: Shaw Builds Momentum ahead of Paralympics,"{'href': 'https://www.tenniscanada.com', 'title': 'Tennis Canada'}"
https://news.google.com/rss/search?q=tennis+news,Britain Tennis Queens Club,https://kdhnews.com/living/health/britain-tennis-queens-club/image_4a4d3e2d-4d2a-5bf1-9aa1-8bdf2eb93114.html,"Wed, 19 Jun 2024 16:35:04 GMT",Britain Tennis Queens Club | Health | kdhnews.com,"{'href': 'https://kdhnews.com', 'title': 'The Killeen Daily Herald'}"
https://news.google.com/rss/search?q=tennis+news,Emma Raducanu: Former US Open champion receives Wimbledon wild card along with Naomi Osaka and Caroline ...,https://www.skysports.com/tennis/news/12110/13155301/emma-raducanu-former-us-open-champion-receives-wimbledon-wild-card-along-with-naomi-osaka-and-caroline-wozniacki,"Wed, 19 Jun 2024 09:45:00 GMT",Emma Raducanu: Former US Open champion receives Wimbledon wild card along with Naomi Osaka and Caroline ...,"{'href': 'https://www.skysports.com', 'title': 'Sky Sports'}"
https://news.google.com/rss/search?q=tennis+news,"Where to watch Queen's Club 2024: TV channel, live stream, prize money for Wimbledon warm-up tennis event",https://www.sportingnews.com/uk/tennis/news/watch-queens-club-2024-tv-channel-live-stream-prize-money-tennis/dd92a72916e41f1f5e78a1a4,"Wed, 19 Jun 2024 18:05:18 GMT","Where to watch Queen's Club 2024: TV channel, live stream, prize money for Wimbledon warm-up tennis event","{'href': 'https://www.sportingnews.com', 'title': 'Sporting News'}"
https://news.google.com/rss/search?q=tennis+news,Zhang Zhizhen vs Daniil Medvedev,https://www.skysports.com/tennis/video/33733/13155655/zhang-zhizhen-v-daniil-medvedev-halle-open-highlights,"Wed, 19 Jun 2024 17:44:23 GMT",Zhang Zhizhen vs Daniil Medvedev | Halle Open highlights,"{'href': 'https://www.skysports.com', 'title': 'Sky Sports'}"
https://news.google.com/rss/search?q=tennis+news,Qinwen Zheng praises Naomi Osaka after Berlin victory,https://tennistonic.com/tennis-news/726523/qinwen-zheng-praises-naomi-osaka-after-berlin-victory/,"Wed, 19 Jun 2024 08:27:36 GMT",Qinwen Zheng praises Naomi Osaka after Berlin victory,"{'href': 'https://tennistonic.com', 'title': 'Tennis Tonic'}"
https://news.google.com/rss/search?q=tennis+news,Andy Murray interviewed by... himself?! Hilarious impression leaves Andy laughing!,https://www.skysports.com/tennis/video/37771/13155466/andy-murray-interviewed-by-himself-hilarious-impression-leaves-andy-laughing,"Wed, 19 Jun 2024 13:23:34 GMT",Andy Murray interviewed by... himself?! Hilarious impression leaves Andy laughing!,"{'href': 'https://www.skysports.com', 'title': 'Sky Sports'}"
https://news.google.com/rss/search?q=tennis+news,"All About Roger Federer's Wife, Mirka Federer",https://www.today.com/news/sports/roger-federer-wife-mirka-rcna157179,"Wed, 19 Jun 2024 12:49:01 GMT","All About Roger Federer's Wife, Mirka Federer","{'href': 'https://www.today.com', 'title': 'TODAY'}"
https://news.google.com/rss/search?q=tennis+news,Zhang Zhizhen Stuns Medvedev at Halle,https://www.tennisnow.com/News/2024/June/Zhang-Zhizhen-Stuns-Medvedev-at-Halle.aspx,"Wed, 19 Jun 2024 17:19:33 GMT",Zhang Zhizhen Stuns Medvedev at Halle,"{'href': 'https://www.tennisnow.com', 'title': 'Tennis Now'}"
https://news.google.com/rss/search?q=tennis+news,Andy Murray gives update after injury scare casts doubt over final Wimbledon,https://www.independent.co.uk/sport/tennis/andy-murray-injury-update-wimbledon-queens-retires-b2565498.html,"Wed, 19 Jun 2024 18:17:19 GMT",Andy Murray gives update after injury scare casts doubt over final Wimbledon,"{'href': 'https://www.independent.co.uk', 'title': 'The Independent'}"
https://news.google.com/rss/search?q=tennis+news,Jannik Sinner shows true colours ahead of Wimbledon with poignant message,https://www.express.co.uk/sport/tennis/1913041/Jannik-Sinner-true-colours-Wimbledon-message,"Wed, 19 Jun 2024 13:26:00 GMT",Jannik Sinner shows true colours ahead of Wimbledon with poignant message,"{'href': 'https://www.express.co.uk', 'title': 'Express'}"
https://news.google.com/rss/search?q=tennis+news,Johanna Konta makes surprising Emma Raducanu assumption after Wimbledon wildcard news,https://www.express.co.uk/sport/tennis/1913140/Emma-Raducanu-Wimbledon-wildcard-Johanna-Konta,"Wed, 19 Jun 2024 15:46:00 GMT",Johanna Konta makes surprising Emma Raducanu assumption after Wimbledon wildcard news,"{'href': 'https://www.express.co.uk', 'title': 'Express'}"
https://news.google.com/rss/search?q=tennis+news,"Facing Barrage, Eubanks Topples Defending Champion Bublik in Halle","https://www.tennisnow.com/News/2024/June/Facing-Barrage,-Eubanks-Topples-Defending-Champion.aspx","Wed, 19 Jun 2024 16:34:17 GMT","Facing Barrage, Eubanks Topples Defending Champion Bublik in Halle","{'href': 'https://www.tennisnow.com', 'title': 'Tennis Now'}"
https://news.google.com/rss/search?q=tennis+news,RAGE. Rublev smashes his racket after losing to Giron in Halle,https://tennistonic.com/tennis-news/726517/rage-rublev-smashes-his-racket-after-losing-to-giron-in-halle/,"Wed, 19 Jun 2024 08:21:07 GMT",RAGE. Rublev smashes his racket after losing to Giron in Halle,"{'href': 'https://tennistonic.com', 'title': 'Tennis Tonic'}"
https://news.google.com/rss/search?q=tennis+news,"Osaka, Raducanu, Kerber, Wozniacki Lead Wimbledon Wild Cards","https://www.tennisnow.com/News/2024/June/Osaka,-Raducanu,-Kerber,-Wozniacki-Lead-Wimbledon.aspx","Wed, 19 Jun 2024 14:30:49 GMT","Osaka, Raducanu, Kerber, Wozniacki Lead Wimbledon Wild Cards","{'href': 'https://www.tennisnow.com', 'title': 'Tennis Now'}"
https://news.google.com/rss/search?q=tennis+news,Carlos Alcaraz Believes Dethroning Novak Djokovic Alongside Jannik Sinner Is 'Good for Tennis',https://www.essentiallysports.com/atp-tennis-news-carlos-alcaraz-believes-dethroning-novak-djokovic-alongside-jannik-sinner-is-good-for-tennis/,"Wed, 19 Jun 2024 10:49:00 GMT",Carlos Alcaraz Believes Dethroning Novak Djokovic Alongside Jannik Sinner Is 'Good for Tennis',"{'href': 'https://www.essentiallysports.com', 'title': 'EssentiallySports'}"
https://news.google.com/rss/search?q=tennis+news,Andy Murray unable to make Wimbledon call after admitting 'I wish I didn't go on',https://www.express.co.uk/sport/tennis/1913176/Andy-Murray-Wimbledon-Queens-Club-injury-retirement,"Wed, 19 Jun 2024 17:38:00 GMT",Andy Murray unable to make Wimbledon call after admitting 'I wish I didn't go on',"{'href': 'https://www.express.co.uk', 'title': 'Express'}"
https://news.google.com/rss/search?q=tennis+news,Naomi Osaka among four Grand Slam winners granted Wimbledon wildcard,https://timesofindia.indiatimes.com/sports/tennis/wimbledon/naomi-osaka-among-four-grand-slam-winners-granted-wimbledon-wildcard/articleshow/111115636.cms,"Wed, 19 Jun 2024 12:08:00 GMT",Naomi Osaka among four Grand Slam winners granted Wimbledon wildcard,"{'href': 'https://timesofindia.indiatimes.com', 'title': 'The Times of India'}"
https://news.google.com/rss/search?q=tennis+news,Andy Murray's wife Kim makes rare appearance as tennis star reaches incredible milestone,https://www.hellomagazine.com/celebrities/694046/andy-murray-wife-kim-rare-appearance-tennis-star-reaches-milestone/,"Wed, 19 Jun 2024 11:14:34 GMT",Andy Murray's wife Kim makes rare appearance as tennis star reaches incredible milestone,"{'href': 'https://www.hellomagazine.com', 'title': 'HELLO!'}"
https://news.google.com/rss/search?q=tennis+news,Alexander Zverev's Girlfriend Pokes Fun at His Multi-Talented Brother Taking Up Extra Duties in Peak Tennis Season,https://www.essentiallysports.com/atp-tennis-news-alexander-zverevs-girlfriend-pokes-fun-at-his-multi-talented-brother-taking-up-extra-duties-in-peak-tennis-season/,"Wed, 19 Jun 2024 12:02:00 GMT",Alexander Zverev's Girlfriend Pokes Fun at His Multi-Talented Brother Taking Up Extra Duties in Peak Tennis Season,"{'href': 'https://www.essentiallysports.com', 'title': 'EssentiallySports'}"
https://news.google.com/rss/search?q=tennis+news,Carlos Alcaraz can achieve a notable milestone at Wimbledon,https://www.tennisworldusa.org/tennis/news/Inside_Tennis/145720/carlos-alcaraz-can-achieve-a-notable-milestone-at-wimbledon/,"Wed, 19 Jun 2024 18:30:00 GMT",Carlos Alcaraz can achieve a notable milestone at Wimbledon,"{'href': 'https://www.tennisworldusa.org', 'title': 'Tennis World USA'}"
https://news.google.com/rss/search?q=tennis+news,Emma Raducanu and Naomi Osaka lead Wimbledon wild cards,https://www.independent.co.uk/sport/tennis/emma-raducanu-naomi-osaka-wimbledon-wildcards-b2565208.html,"Wed, 19 Jun 2024 11:24:57 GMT",Emma Raducanu and Naomi Osaka lead Wimbledon wild cards,"{'href': 'https://www.independent.co.uk', 'title': 'The Independent'}"
https://news.google.com/rss/search?q=tennis+news,LIVE RANKINGS. Zhu down prior to facing Tomljanovic in Birmingham,https://tennistonic.com/tennis-news/726613/live-rankings-zhu-down-prior-to-facing-tomljanovic-in-birmingham/,"Wed, 19 Jun 2024 07:49:07 GMT",LIVE RANKINGS. Zhu down prior to facing Tomljanovic in Birmingham,"{'href': 'https://tennistonic.com', 'title': 'Tennis Tonic'}"
https://news.google.com/rss/search?q=tennis+news,Emma Raducanu one of four grand slam champions to get Wimbledon wildcards,https://www.theguardian.com/sport/article/2024/jun/19/emma-raducanu-wimbledon-2024-wild-card-tennis-return,"Wed, 19 Jun 2024 14:17:00 GMT",Emma Raducanu one of four grand slam champions to get Wimbledon wildcards,"{'href': 'https://www.theguardian.com', 'title': 'The Guardian'}"
https://news.google.com/rss/search?q=tennis+news,Andy Murray a Wimbledon doubt after injury forces him to retire at Queen's,https://timesofindia.indiatimes.com/sports/tennis/top-stories/andy-murray-a-wimbledon-doubt-after-injury-forces-him-to-retire-at-queens/articleshow/111120587.cms,"Wed, 19 Jun 2024 18:05:00 GMT",Andy Murray a Wimbledon doubt after injury forces him to retire at Queen's,"{'href': 'https://timesofindia.indiatimes.com', 'title': 'The Times of India'}"
https://news.google.com/rss/search?q=tennis+news,Novak Djokovic Injury: Serbian Star Finds Solace As He Defies Odds To Confirm Olympic Participation Amidst Adversity,https://www.essentiallysports.com/atp-tennis-news-novak-djokovic-injury-serbian-star-finds-solace-as-he-defies-odds-to-confirm-olympic-participation-amidst-adversity/,"Wed, 19 Jun 2024 10:28:00 GMT",Novak Djokovic Injury: Serbian Star Finds Solace As He Defies Odds To Confirm Olympic Participation Amidst Adversity,"{'href': 'https://www.essentiallysports.com', 'title': 'EssentiallySports'}"
https://news.google.com/rss/search?q=tennis+news,Emma Raducanu granted Wimbledon wildcard but Simona Halep and Dominic Thiem ignored,https://www.express.co.uk/sport/tennis/1912906/Wimbledon-wildcards-Emma-Raducanu-Halep-Thiem-Osaka,"Wed, 19 Jun 2024 09:40:00 GMT",Emma Raducanu granted Wimbledon wildcard but Simona Halep and Dominic Thiem ignored,"{'href': 'https://www.express.co.uk', 'title': 'Express'}"
https://news.google.com/rss/search?q=tennis+news,Roger Federer's 'Kiss' to Console Devastated Rafael Nadal During His Farewell Leaves Tennis Fans Starstruck,https://www.essentiallysports.com/atp-tennis-news-roger-federers-kiss-to-console-devastated-rafael-nadal-during-his-farewell-leaves-tennis-fans-starstruck-i-may-die/,"Wed, 19 Jun 2024 11:38:00 GMT",Roger Federer's 'Kiss' to Console Devastated Rafael Nadal During His Farewell Leaves Tennis Fans Starstruck – 'I May ...,"{'href': 'https://www.essentiallysports.com', 'title': 'EssentiallySports'}"
