Input URL,Title,Link,Published,Description,Source
https://news.google.com/rss/search?q=tennis+news,Daniil Medvedev almost rewrites his tennis resume with a hilarious blunder,https://lobandsmash.com/posts/daniil-medvedev-almost-rewrites-tennis-resume-with-hilarious-blunder-01j0dvcfvk8j,"Sat, 15 Jun 2024 13:00:05 GMT",Daniil Medvedev almost rewrites his tennis resume with a hilarious blunder,"{'href': 'https://lobandsmash.com', 'title': 'Lob and Smash'}"
https://news.google.com/rss/search?q=tennis+news,Korda Dethrones Griekspoor to reach 's-Hertogenbosch Final,https://www.tennisnow.com/News/2024/June/Korda-Dethrones-Griekspoor-to-reach-s-Hertogenbos.aspx,"Sat, 15 Jun 2024 14:26:15 GMT",Korda Dethrones Griekspoor to reach 's-Hertogenbosch Final,"{'href': 'https://www.tennisnow.com', 'title': 'Tennis Now'}"
https://news.google.com/rss/search?q=tennis+news,WEIRD. Andreescu caught taking out the grass from her shoes with the hotel key,https://tennistonic.com/tennis-news/724503/weird-andreescu-caught-taking-out-the-grass-from-her-shoes-with-the-hotel-key/,"Sat, 15 Jun 2024 16:33:28 GMT",WEIRD. Andreescu caught taking out the grass from her shoes with the hotel key,"{'href': 'https://tennistonic.com', 'title': 'Tennis Tonic'}"
https://news.google.com/rss/search?q=tennis+news,Jannik Sinner will play singles and doubles with Musetti at the Olympics,https://tennistonic.com/tennis-news/724482/jannik-sinner-will-play-singles-and-doubles-with-musetti-at-the-olympics/,"Sat, 15 Jun 2024 16:32:56 GMT",Jannik Sinner will play singles and doubles with Musetti at the Olympics,"{'href': 'https://tennistonic.com', 'title': 'Tennis Tonic'}"
https://news.google.com/rss/search?q=tennis+news,Stuttgart Open: Jack Draper beats Brandon Nakashima & faces Matteo Berrettini in the final,https://www.bbc.com/sport/tennis/articles/cv22z6mr377o,"Sat, 15 Jun 2024 13:05:42 GMT",Stuttgart Open: Jack Draper beats Brandon Nakashima & faces Matteo Berrettini in the final,"{'href': 'https://www.bbc.com', 'title': 'BBC.com'}"
https://news.google.com/rss/search?q=tennis+news,Why Did Jack Draper Fall Out of Love With Tennis? Re-Visiting the 'Dark Place' That Forced Him to Consider Retirement,https://www.essentiallysports.com/atp-tennis-news-why-did-jack-draper-fall-out-of-love-with-tennis-re-visiting-the-dark-place-that-forced-him-to-consider-retirement/,"Sat, 15 Jun 2024 09:31:00 GMT",Why Did Jack Draper Fall Out of Love With Tennis? Re-Visiting the 'Dark Place' That Forced Him to Consider Retirement,"{'href': 'https://www.essentiallysports.com', 'title': 'EssentiallySports'}"
https://news.google.com/rss/search?q=tennis+news,"WTA BIRMINGHAM DRAW. Ostapenko, Krejcikova, Cirstea, Boulter lead the pack",https://tennistonic.com/tennis-news/724493/wta-birmingham-draw-ostapenko-krejcikova-cirstea-boulter-lead-the-pack/,"Sat, 15 Jun 2024 16:11:24 GMT","WTA BIRMINGHAM DRAW. Ostapenko, Krejcikova, Cirstea, Boulter lead the pack","{'href': 'https://tennistonic.com', 'title': 'Tennis Tonic'}"
https://news.google.com/rss/search?q=tennis+news,Carlos Alcaraz's Nike Deal: Spanish Phenom Usurps Roger Federer and Rafael Nadal to Emerge as Tennis' Biggest ...,https://www.essentiallysports.com/atp-tennis-news-carlos-alcarazs-nike-deal-spanish-phenom-usurps-roger-federer-and-rafael-nadal-to-emerge-as-tennis-biggest-name/,"Sat, 15 Jun 2024 11:37:00 GMT",Carlos Alcaraz's Nike Deal: Spanish Phenom Usurps Roger Federer and Rafael Nadal to Emerge as Tennis' Biggest ...,"{'href': 'https://www.essentiallysports.com', 'title': 'EssentiallySports'}"
https://news.google.com/rss/search?q=tennis+news,Jack Draper vs Brandon Nakashima,https://www.skysports.com/tennis/video/33733/13153491/jack-draper-vs-brandon-nakashima,"Sat, 15 Jun 2024 12:04:35 GMT",Jack Draper vs Brandon Nakashima | Stuttgart Open highlights,"{'href': 'https://www.skysports.com', 'title': 'Sky Sports'}"
https://news.google.com/rss/search?q=tennis+news,"Paris Olympics: As Coco Gauff, Danielle Collins, and Others Gear Up, Russian Counterparts Face Dire Situation in ...",https://www.essentiallysports.com/atp-wta-tennis-news-paris-olympics-as-coco-gauff-danielle-collins-and-others-gear-up-russian-counterparts-face-dire-situation-in-absurd-withdrawal-spree/,"Sat, 15 Jun 2024 18:15:00 GMT","Paris Olympics: As Coco Gauff, Danielle Collins, and Others Gear Up, Russian Counterparts Face Dire Situation in ...","{'href': 'https://www.essentiallysports.com', 'title': 'EssentiallySports'}"
https://news.google.com/rss/search?q=tennis+news,Matteo Berrettini reveals why his tennis is so dominant on grass-courts,https://www.tennisworldusa.org/tennis/news/Tennis_Interviews/145553/matteo-berrettini-reveals-why-his-tennis-is-so-dominant-on-grasscourts/,"Sat, 15 Jun 2024 11:00:00 GMT",Matteo Berrettini reveals why his tennis is so dominant on grass-courts,"{'href': 'https://www.tennisworldusa.org', 'title': 'Tennis World USA'}"
https://news.google.com/rss/search?q=tennis+news,Andreescu Charges into 's-Hertogenbosch Final,https://www.tennisnow.com/News/2024/June/Andreescu-Charges-into-s-Hertogenbosch-Final.aspx,"Sat, 15 Jun 2024 15:49:45 GMT",Andreescu Charges into 's-Hertogenbosch Final,"{'href': 'https://www.tennisnow.com', 'title': 'Tennis Now'}"
https://news.google.com/rss/search?q=tennis+news,Matteo Berrettini Heartily Reflects on Idol Roger Federer's Emotional Tennis Advice During a Heart-Shattering Night in ...,https://www.essentiallysports.com/atp-tennis-news-matteo-berrettini-heartily-reflects-on-idol-roger-federer-s-emotional-tennis-advice-during-a-heart-shattering-night-in-london/,"Sat, 15 Jun 2024 07:16:00 GMT",Matteo Berrettini Heartily Reflects on Idol Roger Federer's Emotional Tennis Advice During a Heart-Shattering Night in ...,"{'href': 'https://www.essentiallysports.com', 'title': 'EssentiallySports'}"
https://news.google.com/rss/search?q=tennis+news,Rafael Nadal's uncle calls out Alexander Zverev anger with brutal assessment of German,https://www.express.co.uk/sport/tennis/1911559/Rafael-Nadal-uncle-Alexander-Zverev-assessment,"Sat, 15 Jun 2024 09:54:00 GMT",Rafael Nadal's uncle calls out Alexander Zverev anger with brutal assessment of German,"{'href': 'https://www.express.co.uk', 'title': 'Express'}"
