Input URL,Title,Link,Published,Description,Source
https://news.google.com/rss/search?q=sports+news,"The 2024 Southwest Florida High School Sports Awards winners for Lee, Hendry and Collier",https://www.naplesnews.com/story/sports/high-school/2024/06/15/the-2024-southwest-florida-high-school-sports-awards-winners-for-lee-hendry-and-collier/74000311007/,"Sat, 15 Jun 2024 09:04:21 GMT","The 2024 Southwest Florida High School Sports Awards winners for Lee, Hendry and Collier","{'href': 'https://www.naplesnews.com', 'title': 'Naples Daily News'}"
https://news.google.com/rss/search?q=sports+news,Popularity of the sport of cricket grows across New York,https://spectrumlocalnews.com/nys/central-ny/sports/2024/06/15/cricket-upstate-new-york-world-cup-icc-t20,"Sat, 15 Jun 2024 16:49:00 GMT",Popularity of the sport of cricket grows across New York,"{'href': 'https://spectrumlocalnews.com', 'title': 'Spectrum News'}"
https://news.google.com/rss/search?q=sports+news,Wingrove homers twice as Mussels split with Flying Tigers,https://www.capecoralbreeze.com/sports/local-sports/2024/06/15/wingrove-homers-twice-as-mussels-split-with-flying-tigers/,"Sat, 15 Jun 2024 14:53:06 GMT",Wingrove homers twice as Mussels split with Flying Tigers,"{'href': 'https://www.capecoralbreeze.com', 'title': 'Cape Coral Breeze'}"
https://news.google.com/rss/search?q=sports+news,The City of Champions Professional Rodeo- Permit Section,https://www.prorodeo.com/schedule/2024/the-city-of-champions-professional-rodeo--permit-section/14877,"Sat, 15 Jun 2024 14:00:27 GMT",The City of Champions Professional Rodeo- Permit Section,"{'href': 'https://www.prorodeo.com', 'title': 'Professional Rodeo Cowboys Association'}"
https://news.google.com/rss/search?q=sports+news,Credit Unions of Maui to host charity golf tournament,https://www.mauinews.com/sports/local-sports/2024/06/credit-unions-of-maui-to-host-charity-golf-tournament/,"Sat, 15 Jun 2024 16:44:30 GMT",Credit Unions of Maui to host charity golf tournament,"{'href': 'https://www.mauinews.com', 'title': 'Maui News'}"
https://news.google.com/rss/search?q=sports+news,Verlander Scratched for Astros' Game Against Tigers Because of Neck Discomfort,https://www.usnews.com/news/sports/articles/2024-06-15/verlander-scratched-for-astros-game-against-tigers-because-of-neck-discomfort,"Sat, 15 Jun 2024 17:59:00 GMT",Verlander Scratched for Astros' Game Against Tigers Because of Neck Discomfort,"{'href': 'https://www.usnews.com', 'title': 'U.S. News & World Report'}"
https://news.google.com/rss/search?q=sports+news,Olympic Spots Are on the Line for Patrick Cantlay and Corey Conners at the US Open,https://www.usnews.com/news/sports/articles/2024-06-15/olympic-spots-are-on-the-line-for-patrick-cantlay-and-corey-conners-at-the-us-open,"Sat, 15 Jun 2024 15:26:00 GMT",Olympic Spots Are on the Line for Patrick Cantlay and Corey Conners at the US Open,"{'href': 'https://www.usnews.com', 'title': 'U.S. News & World Report'}"
https://news.google.com/rss/search?q=sports+news,Roughriders split with Governors at home,https://www.thedickinsonpress.com/sports/prep/roughriders-split-with-governors-at-home,"Sat, 15 Jun 2024 15:04:59 GMT",Roughriders split with Governors at home,"{'href': 'https://www.thedickinsonpress.com', 'title': 'Dickinson Press'}"
https://news.google.com/rss/search?q=sports+news,"Philadelphia Union vs Inter Miami live stream: MLS prediction, TV channel, how to watch online, time, news",https://www.cbssports.com/soccer/news/philadelphia-union-vs-inter-miami-live-stream-mls-prediction-tv-channel-how-to-watch-online-time-news/,"Sat, 15 Jun 2024 15:10:32 GMT","Philadelphia Union vs Inter Miami live stream: MLS prediction, TV channel, how to watch online, time, news","{'href': 'https://www.cbssports.com', 'title': 'CBS Sports'}"
https://news.google.com/rss/search?q=sports+news,Norway in state finals,https://www.ironmountaindailynews.com/news/local-news/2024/06/norway-in-state-finals/,"Sat, 15 Jun 2024 07:03:02 GMT","Norway in state finals | News, Sports, Jobs - The Daily News","{'href': 'https://www.ironmountaindailynews.com', 'title': 'Iron Mountain Daily News'}"
https://news.google.com/rss/search?q=sports+news,"Fantasy Football Rankings 2024: NFL sleepers, breakouts, busts by the model that predicted Deebo's rough year",https://www.cbssports.com/fantasy/football/news/fantasy-football-rankings-2024-nfl-sleepers-breakouts-busts-by-the-model-that-predicted-deebos-rough-year/,"Sat, 15 Jun 2024 18:06:23 GMT","Fantasy Football Rankings 2024: NFL sleepers, breakouts, busts by the model that predicted Deebo's rough year","{'href': 'https://www.cbssports.com', 'title': 'CBS Sports'}"
https://news.google.com/rss/search?q=sports+news,Guardians sock Blue Jays 3-1,https://www.timesleaderonline.com/sports/national-sports/2024/06/guardians-sock-blue-jays-3-1/,"Sat, 15 Jun 2024 07:23:26 GMT","Guardians sock Blue Jays 3-1 | News, Sports, Jobs","{'href': 'https://www.timesleaderonline.com', 'title': 'Martins Ferry Times Leader'}"
https://news.google.com/rss/search?q=sports+news,News Press All-Area Player of the Year Kennedy Hight's legacy defined by determination,https://www.stwnewspress.com/sports/news-press-all-area-player-of-the-year-kennedy-hights-legacy-defined-by-determination/article_6a7eb184-2a89-11ef-8537-cb552b9ef284.html,"Sat, 15 Jun 2024 15:00:00 GMT",News Press All-Area Player of the Year Kennedy Hight's legacy defined by determination,"{'href': 'https://www.stwnewspress.com', 'title': 'Stillwater News Press'}"
https://news.google.com/rss/search?q=sports+news,Top 8-man stars participating in all-star football game,https://www.enidnews.com/sports/top-8-man-stars-participating-in-all-star-football-game/article_50e04e3a-2a8f-11ef-8a27-0b545be3a298.html,"Sat, 15 Jun 2024 10:00:00 GMT",Top 8-man stars participating in all-star football game,"{'href': 'https://www.enidnews.com', 'title': 'Enid News & Eagle'}"
https://news.google.com/rss/search?q=sports+news,WSU's Walburn preparing for Olympic trials,https://www.lmtribune.com/sports/wsu-s-walburn-preparing-for-olympic-trials/article_7ed6372f-e722-58f7-9db7-9d48bd88de96.html,"Sat, 15 Jun 2024 07:00:00 GMT",WSU's Walburn preparing for Olympic trials | Sports news | Lewiston Tribune | lmtribune.com,"{'href': 'https://www.lmtribune.com', 'title': 'Lewiston Morning Tribune'}"
https://news.google.com/rss/search?q=sports+news,Chelsea given permission to speak to Aston Villa's Jhon Duran,https://www.skysports.com/football/transfer-paper-talk,"Sat, 15 Jun 2024 16:43:58 GMT",Chelsea given permission to speak to Aston Villa's Jhon Duran - Paper Talk,"{'href': 'https://www.skysports.com', 'title': 'Sky Sports'}"
https://news.google.com/rss/search?q=sports+news,"Where to watch Serbia vs. England: UEFA Euro 2024 Group C live stream online, TV, prediction and odds",https://www.cbssports.com/soccer/news/where-to-watch-serbia-vs-england-uefa-euro-2024-group-c-live-stream-online-tv-prediction-and-odds/,"Sat, 15 Jun 2024 14:23:00 GMT","Where to watch Serbia vs. England: UEFA Euro 2024 Group C live stream online, TV, prediction and odds","{'href': 'https://www.cbssports.com', 'title': 'CBS Sports'}"
https://news.google.com/rss/search?q=sports+news,Luka Doncic leaves door open for NBA Finals redemption by setting tone for Mavericks in dominant Game 4,https://www.cbssports.com/nba/news/luka-doncic-leaves-door-open-for-nba-finals-redemption-by-setting-tone-for-mavericks-in-dominant-game-4/,"Sat, 15 Jun 2024 13:10:00 GMT",Luka Doncic leaves door open for NBA Finals redemption by setting tone for Mavericks in dominant Game 4,"{'href': 'https://www.cbssports.com', 'title': 'CBS Sports'}"
https://news.google.com/rss/search?q=sports+news,"DiJonai Carrington powering Connecticut Sun defense using faith, purpose to plow through pressure-filled start",https://www.cbssports.com/wnba/news/dijonai-carrington-powering-connecticut-sun-defense-using-faith-purpose-to-plow-through-pressure-filled-start/,"Sat, 15 Jun 2024 15:18:55 GMT","DiJonai Carrington powering Connecticut Sun defense using faith, purpose to plow through pressure-filled start","{'href': 'https://www.cbssports.com', 'title': 'CBS Sports'}"
https://news.google.com/rss/search?q=healthcare+news,Navigating Oregon’s PCP Shortage: Take Charge of Your Healthcare,https://tigardlife.com/health/navigating-oregons-pcp-shortage-take-charge-of-your-healthcare/,"Sat, 15 Jun 2024 18:01:12 GMT",Navigating Oregon’s PCP Shortage: Take Charge of Your Healthcare,"{'href': 'https://tigardlife.com', 'title': 'Tigard Life'}"
https://news.google.com/rss/search?q=healthcare+news,AMPH: 3 Small-Cap Healthcare Stocks Wall Street Loves,https://stocknews.com/news/amph-cprx-eq-3-small-cap-healthcare-stocks-wall-street-loves/,"Sat, 15 Jun 2024 13:10:11 GMT",AMPH: 3 Small-Cap Healthcare Stocks Wall Street Loves,"{'href': 'https://stocknews.com', 'title': 'StockNews.com'}"
https://news.google.com/rss/search?q=healthcare+news,Feeding the Needy is Part of Providing Community Healthcare » Holtville Tribune,https://holtvilletribune.com/2024/06/15/feeding-the-needy-is-part-of-providing-community-healthcare/,"Sat, 15 Jun 2024 08:56:52 GMT",Feeding the Needy is Part of Providing Community Healthcare » Holtville Tribune,"{'href': 'https://holtvilletribune.com', 'title': 'Holtville Tribune'}"
https://news.google.com/rss/search?q=healthcare+news,A Personal Experience with Healthcare Insurance,https://californiaglobe.com/fr/a-personal-experience-with-healthcare-insurance/,"Sat, 15 Jun 2024 15:07:27 GMT",A Personal Experience with Healthcare Insurance – California Globe,"{'href': 'https://californiaglobe.com', 'title': 'California Globe'}"
https://news.google.com/rss/search?q=entertainment+news,"Celebrities make a beeline for 'RoboVerse VR Expo', interact with humanoids",https://www.onmanorama.com/entertainment/entertainment-news/2024/06/15/celebrities-make-beeline-for-roboverse-vr-expo-interact-with-humanoids.html,"Sat, 15 Jun 2024 12:24:09 GMT","Celebrities make a beeline for 'RoboVerse VR Expo', interact with humanoids | Entertainment News | English Manorama","{'href': 'https://www.onmanorama.com', 'title': 'Onmanorama'}"
https://news.google.com/rss/search?q=entertainment+news,Top 20 Pixar Fan Theories,https://www.wfmz.com/entertainment/top-20-pixar-fan-theories/video_094a3382-d34b-54fd-9533-0352e53191ed.html,"Sat, 15 Jun 2024 10:21:50 GMT",Top 20 Pixar Fan Theories | Entertainment News | wfmz.com,"{'href': 'https://www.wfmz.com', 'title': '69News WFMZ-TV'}"
https://news.google.com/rss/search?q=entertainment+news,PHOTOS: Kate Middleton Makes First Public Appearance Since Cancer Diagnosis,https://985thecat.iheart.com/content/2024-06-15-photos-kate-middleton-makes-first-public-appearance-since-cancer-diagnosis/,"Sat, 15 Jun 2024 15:14:00 GMT",PHOTOS: Kate Middleton Makes First Public Appearance Since Cancer Diagnosis | 98.5 The Cat,"{'href': 'https://985thecat.iheart.com', 'title': 'iHeart'}"
https://news.google.com/rss/search?q=entertainment+news,`Heartbroken` Badshah apologises to fans as Dallas concert stops midway,https://www.wionews.com/entertainment/heartbroken-badshah-apologises-to-fans-as-dallas-concert-stops-midway-732072,"Sat, 15 Jun 2024 14:13:44 GMT",`Heartbroken` Badshah apologises to fans as Dallas concert stops midway,"{'href': 'https://www.wionews.com', 'title': 'WION'}"
https://news.google.com/rss/search?q=entertainment+news,Taylor cheers Travis' Super Bowl ring.,https://www.wfmz.com/entertainment/taylor-cheers-travis-super-bowl-ring/video_0b7cdc83-23d2-597b-bb37-00bd423b1dbf.html,"Sat, 15 Jun 2024 13:54:14 GMT",Taylor cheers Travis' Super Bowl ring. | Entertainment News | wfmz.com,"{'href': 'https://www.wfmz.com', 'title': '69News WFMZ-TV'}"
https://news.google.com/rss/search?q=entertainment+news,Contemporary Chinese cinema under the spotlight at Shanghai festival,https://www.wionews.com/entertainment/contemporary-chinese-cinema-under-the-spotlight-at-shanghai-festival-732016,"Sat, 15 Jun 2024 10:24:16 GMT",Contemporary Chinese cinema under the spotlight at Shanghai festival,"{'href': 'https://www.wionews.com', 'title': 'WION'}"
https://news.google.com/rss/search?q=entertainment+news,Kate Middleton makes first public appearance since cancer diagnosis,https://www.wionews.com/entertainment/kate-middleton-spotted-for-first-time-in-public-since-cancer-diagnosis-732005,"Sat, 15 Jun 2024 10:08:45 GMT",Kate Middleton makes first public appearance since cancer diagnosis,"{'href': 'https://www.wionews.com', 'title': 'WION'}"
https://news.google.com/rss/search?q=entertainment+news,"Kate Middleton, King Charles attend Trooping the Colour amid cancer battles",https://www.foxnews.com/entertainment/kate-middleton-king-charles-attend-trooping-colour-amid-cancer-battles,"Sat, 15 Jun 2024 08:00:00 GMT","Kate Middleton, King Charles attend Trooping the Colour amid cancer battles","{'href': 'https://www.foxnews.com', 'title': 'Fox News'}"
https://news.google.com/rss/search?q=entertainment+news,"Swara Bhasker condemns assault on Kangana Ranaut, Mahesh Bhatt discusses relationship with Parveen Babi,",https://timesofindia.indiatimes.com/entertainment/hindi/bollywood/news/swara-bhasker-condemns-assault-on-kangana-ranaut-mahesh-bhatt-discusses-relationship-with-parveen-babi-deets-about-sonakshi-sinha-and-zaheer-iqbals-wedding-top-5-entertainment-news-of-the-day/articleshow/111022301.cms,"Sat, 15 Jun 2024 13:30:00 GMT","Swara Bhasker condemns assault on Kangana Ranaut, Mahesh Bhatt discusses relationship with Parveen Babi,","{'href': 'https://timesofindia.indiatimes.com', 'title': 'TOI Etimes'}"
https://news.google.com/rss/search?q=tennis+news,Nottingham Open: Emma Raducanu to face Katie Boulter in semi-finals,https://www.bbc.com/sport/tennis/articles/cmjjpy4714jo,"Sat, 15 Jun 2024 11:39:00 GMT",Nottingham Open: Emma Raducanu to face Katie Boulter in semi-finals,"{'href': 'https://www.bbc.com', 'title': 'BBC.com'}"
https://news.google.com/rss/search?q=tennis+news,Carlos Alcaraz faces tough draw at Queen's Club,https://www.atptour.com/en/news/alcaraz-queens-club-2024-draw,"Sat, 15 Jun 2024 16:05:33 GMT",Carlos Alcaraz faces tough draw at Queen's Club,"{'href': 'https://www.atptour.com', 'title': 'ATP Tour'}"
https://news.google.com/rss/search?q=tennis+news,UTSA Midwest to host sixth annual junior wheelchair tennis camp,https://sports.yahoo.com/utsa-midwest-host-sixth-annual-143400680.html,"Sat, 15 Jun 2024 14:34:00 GMT",UTSA Midwest to host sixth annual junior wheelchair tennis camp,"{'href': 'https://sports.yahoo.com', 'title': 'Yahoo Sports'}"
https://news.google.com/rss/search?q=tennis+news,Bianca Andreescu wins Libema Open semifinal in straight sets,https://www.cbc.ca/sports/tennis/andreescu-semifinal-libema-open-tennis-june-15-1.7236304,"Sat, 15 Jun 2024 16:51:12 GMT",Bianca Andreescu wins Libema Open semifinal in straight sets,"{'href': 'https://www.cbc.ca', 'title': 'CBC Sports'}"
https://news.google.com/rss/search?q=tennis+news,Tax-paying tennis regulars slam NYC coaches of rich and famous who hog public courts,https://nypost.com/2024/06/15/us-news/nyc-tennis-regulars-slam-coaches-of-rich-and-famous-hogging-public-courts/,"Sat, 15 Jun 2024 12:30:00 GMT",Tax-paying tennis regulars slam NYC coaches of rich and famous who hog public courts,"{'href': 'https://nypost.com', 'title': 'New York Post'}"
https://news.google.com/rss/search?q=tennis+news,Sebastian Korda sinks reigning Den Bosch champ Tallon Griekspoor for first grass final,https://www.tennis.com/news/articles/sebastian-korda-sinks-reigning-den-bosch-champ-tallon-griekspoor-for-first-grass-final,"Sat, 15 Jun 2024 12:33:12 GMT",Sebastian Korda sinks reigning Den Bosch champ Tallon Griekspoor for first grass final,"{'href': 'https://www.tennis.com', 'title': 'Tennis Magazine'}"
https://news.google.com/rss/search?q=tennis+news,‘The Interview’: Serena Williams’s Next Challenge,https://www.nytimes.com/2024/06/15/magazine/serena-williams-interview.html,"Sat, 15 Jun 2024 09:15:09 GMT",‘The Interview’: Serena Williams’s Next Challenge,"{'href': 'https://www.nytimes.com', 'title': 'The New York Times'}"
https://news.google.com/rss/search?q=tennis+news,USTA to Extend Pro Wild Cards to ITA National Summer Championships Singles Finalists,https://wearecollegetennis.com/2024/06/15/pro-wild-cards-to-ita-national-summer-championships/,"Sat, 15 Jun 2024 15:00:56 GMT",USTA to Extend Pro Wild Cards to ITA National Summer Championships Singles Finalists,"{'href': 'https://wearecollegetennis.com', 'title': 'Intercollegiate Tennis Association'}"
https://news.google.com/rss/search?q=tennis+news,MATCH POINT: Alex de Minaur defeats Ugo Humbert; 's-Hertogenbosch SF,https://www.tennis.com/news/videos/match-point-alex-de-minaur-defeats-ugo-humbert-s-hertogenbosch-sf,"Sat, 15 Jun 2024 13:51:48 GMT",MATCH POINT: Alex de Minaur defeats Ugo Humbert; 's-Hertogenbosch SF,"{'href': 'https://www.tennis.com', 'title': 'Tennis Magazine'}"
https://news.google.com/rss/search?q=tennis+news,Pro pickleballer: Tennis skills translate to athletic outlet in pro pickleball for Dalton grad,https://www.dailycitizen.news/sports/local_sports/pro-pickleballer-tennis-skills-translate-to-athletic-outlet-in-pro-pickleball-for-dalton-grad/article_14d428e2-24e2-11ef-9026-5bdea05fca28.html,"Sat, 15 Jun 2024 15:24:00 GMT",Pro pickleballer: Tennis skills translate to athletic outlet in pro pickleball for Dalton grad,"{'href': 'https://www.dailycitizen.news', 'title': 'Daily Citizen'}"
https://news.google.com/rss/search?q=tennis+news,OT announces 2024 All-County Tennis Teams,https://www.owensborotimes.com/sports/2024/06/ot-announces-2024-all-county-tennis-teams/,"Sat, 15 Jun 2024 16:02:12 GMT",OT announces 2024 All-County Tennis Teams,"{'href': 'https://www.owensborotimes.com', 'title': 'The Owensboro Times'}"
https://news.google.com/rss/search?q=tennis+news,Girls tennis gets it done: Tripathi's win propels Wilmington into state semifinals,https://homenewshere.com/wilmington_town_crier/sports/article_9e05a260-28e5-11ef-bcbf-878af4a93ee1.html,"Sat, 15 Jun 2024 15:00:00 GMT",Girls tennis gets it done: Tripathi's win propels Wilmington into state semifinals,"{'href': 'https://homenewshere.com', 'title': 'Woburn Daily Times'}"
https://news.google.com/rss/search?q=tennis+news,"We pick, you vote: Who is the MVP of Section III boys tennis? (poll)",https://www.syracuse.com/highschoolsports/2024/06/we-pick-you-vote-who-is-the-mvp-of-section-iii-boys-tennis-poll.html,"Sat, 15 Jun 2024 13:30:00 GMT","We pick, you vote: Who is the MVP of Section III boys tennis? (poll)","{'href': 'https://www.syracuse.com', 'title': 'syracuse.com'}"
https://news.google.com/rss/search?q=tennis+news,Redmen nearly upset Hanover in postseason opener: Girls tennis edged out of tourney,https://homenewshere.com/tewksbury_town_crier/sports/article_44b2c1f8-28e9-11ef-a5ea-d3f437ca1f7e.html,"Sat, 15 Jun 2024 15:00:00 GMT",Redmen nearly upset Hanover in postseason opener: Girls tennis edged out of tourney,"{'href': 'https://homenewshere.com', 'title': 'Woburn Daily Times'}"
https://news.google.com/rss/search?q=tennis+news,Carlos Alcaraz signs massive contract extension with Nike,https://tennistonic.com/tennis-news/724439/carlos-alcaraz-signs-massive-contract-extension-with-nike/,"Sat, 15 Jun 2024 12:40:29 GMT",Carlos Alcaraz signs massive contract extension with Nike,"{'href': 'https://tennistonic.com', 'title': 'Tennis Tonic'}"
https://news.google.com/rss/search?q=tennis+news,Daily Item Boys Tennis all-stars,https://www.dailyitem.com/daily-item-boys-tennis-all-stars/article_37efc7cc-2808-11ef-83f9-07992f111955.html,"Sat, 15 Jun 2024 15:35:00 GMT",Daily Item Boys Tennis all-stars,"{'href': 'https://www.dailyitem.com', 'title': 'Sunbury Daily Item'}"
https://news.google.com/rss/search?q=tennis+news,Rafael Nadal honors Ruud’s sister Charlotte at his academy,https://tennistonic.com/tennis-news/724434/rafael-nadal-honors-ruuds-sister-charlotte-at-his-academy/,"Sat, 15 Jun 2024 12:07:30 GMT",Rafael Nadal honors Ruud’s sister Charlotte at his academy,"{'href': 'https://tennistonic.com', 'title': 'Tennis Tonic'}"
https://news.google.com/rss/search?q=tennis+news,Carlos Alcaraz talks about winning the Olympics,https://tennistonic.com/tennis-news/724487/carlos-alcaraz-talks-about-winning-the-olympics/,"Sat, 15 Jun 2024 16:33:28 GMT",Carlos Alcaraz talks about winning the Olympics,"{'href': 'https://tennistonic.com', 'title': 'Tennis Tonic'}"
https://news.google.com/rss/search?q=tennis+news,Sabalenka trains on grass preparing for Wimbledon,https://tennistonic.com/tennis-news/724430/sabalenka-trains-on-grass-preparing-for-wimbledon/,"Sat, 15 Jun 2024 11:50:42 GMT",Sabalenka trains on grass preparing for Wimbledon,"{'href': 'https://tennistonic.com', 'title': 'Tennis Tonic'}"
https://news.google.com/rss/search?q=tennis+news,West Orange resident Luis Crespo leads Montclair Kimberley Academy tennis team to banner season,https://essexnewsdaily.com/sports/sports-westorange/west-orange-resident-luis-crespo-leads-montclair-kimberley-academy-tennis-team-to-banner-season,"Sat, 15 Jun 2024 16:29:47 GMT",West Orange resident Luis Crespo leads Montclair Kimberley Academy tennis team to banner season,"{'href': 'https://essexnewsdaily.com', 'title': 'Essex News Daily'}"
https://news.google.com/rss/search?q=tennis+news,VIDEO. Novak Djokovic shows off his progress after the knee operation,https://tennistonic.com/tennis-news/724525/video-novak-djokovic-shows-off-his-progress-after-the-knee-operation/,"Sat, 15 Jun 2024 16:32:55 GMT",VIDEO. Novak Djokovic shows off his progress after the knee operation,"{'href': 'https://tennistonic.com', 'title': 'Tennis Tonic'}"
https://news.google.com/rss/search?q=tennis+news,The Rome Major will not feature Bea Gonzalez!,https://tennistonic.com/tennis-news/724288/the-rome-major-will-not-feature-bea-gonzalez/,"Sat, 15 Jun 2024 09:15:29 GMT",The Rome Major will not feature Bea Gonzalez!,"{'href': 'https://tennistonic.com', 'title': 'Tennis Tonic'}"
https://news.google.com/rss/search?q=tennis+news,Roger Federer's son 'getting serious' about tennis and makes Wimbledon request,https://www.express.co.uk/sport/tennis/1911671/Roger-Federer-son-tennis-Wimbledon,"Sat, 15 Jun 2024 16:00:00 GMT",Roger Federer's son 'getting serious' about tennis and makes Wimbledon request,"{'href': 'https://www.express.co.uk', 'title': 'Express'}"
https://news.google.com/rss/search?q=tennis+news,McFarlin Tennis Center celebrates 50th Anniversary with proclamation from Mayor Ron Nirenberg,https://www.ksat.com/video/sports/2024/06/15/mcfarlin-tennis-center-celebrates-50th-anniversary-with-proclamation-from-mayor-ron-nirenberg/,"Sat, 15 Jun 2024 08:39:38 GMT",McFarlin Tennis Center celebrates 50th Anniversary with proclamation from Mayor Ron Nirenberg,"{'href': 'https://www.ksat.com', 'title': 'KSAT San Antonio'}"
https://news.google.com/rss/search?q=tennis+news,Andreescu surges into 's-Hertogenbosch final,https://www.wtatennis.com/news/4039141/andreescu-surges-into-s-hertogenbosch-final,"Sat, 15 Jun 2024 12:31:14 GMT",Andreescu surges into 's-Hertogenbosch final,"{'href': 'https://www.wtatennis.com', 'title': 'WTA Tennis'}"
https://news.google.com/rss/search?q=tennis+news,Tsitsipas personal trainer unhappy with Stefanos’ work ethics leaves his camp,https://tennistonic.com/tennis-news/724443/tsitsipas-personal-trainer-unhappy-with-stefanos-work-ethics-leaves-his-camp/,"Sat, 15 Jun 2024 12:47:23 GMT",Tsitsipas personal trainer unhappy with Stefanos’ work ethics leaves his camp,"{'href': 'https://tennistonic.com', 'title': 'Tennis Tonic'}"
https://news.google.com/rss/search?q=tennis+news,A1 Padel ranks Gonza Alfonso as the top player.,https://tennistonic.com/tennis-news/724466/a1-padel-ranks-gonza-alfonso-as-the-top-player/,"Sat, 15 Jun 2024 13:26:51 GMT",A1 Padel ranks Gonza Alfonso as the top player.,"{'href': 'https://tennistonic.com', 'title': 'Tennis Tonic'}"
https://news.google.com/rss/search?q=tennis+news,"ATP500. Jannik Sinner, Zverev, Medvedev, Rublev lead the draw",https://tennistonic.com/tennis-news/724473/atp500-jannik-sinner-zverev-medvedev-rublev-lead-the-draw/,"Sat, 15 Jun 2024 14:16:54 GMT","ATP500. Jannik Sinner, Zverev, Medvedev, Rublev lead the draw","{'href': 'https://tennistonic.com', 'title': 'Tennis Tonic'}"
https://news.google.com/rss/search?q=tennis+news,Berrettini Blasts into Third Stuttgart Final,https://www.tennisnow.com/News/2024/June/Berrettini-Blasts-into-Third-Stuttgart-Final.aspx,"Sat, 15 Jun 2024 14:16:49 GMT",Berrettini Blasts into Third Stuttgart Final,"{'href': 'https://www.tennisnow.com', 'title': 'Tennis Now'}"
https://news.google.com/rss/search?q=tennis+news,"ATP QUEENS DRAW. Alcaraz, De Minaur, Dimitrov, Fritz are the leaders",https://tennistonic.com/tennis-news/724478/atp-queens-draw-alcaraz-de-minaur-dimitrov-fritz-are-the-leaders/,"Sat, 15 Jun 2024 15:33:24 GMT","ATP QUEENS DRAW. Alcaraz, De Minaur, Dimitrov, Fritz are the leaders","{'href': 'https://tennistonic.com', 'title': 'Tennis Tonic'}"
https://news.google.com/rss/search?q=tennis+news,"WTA500 Berlin. Gauff, Sabalenka, Rybakina, Pegula lead the draw",https://tennistonic.com/tennis-news/724494/wta500-berlin-gauff-sabalenka-rybakina-pegula-lead-the-draw/,"Sat, 15 Jun 2024 15:39:18 GMT","WTA500 Berlin. Gauff, Sabalenka, Rybakina, Pegula lead the draw","{'href': 'https://tennistonic.com', 'title': 'Tennis Tonic'}"
https://news.google.com/rss/search?q=tennis+news,Matteo Berrettini sets Jack Draper clash in Stuttgart final?,https://www.atptour.com/en/news/berrettini-musetti-draper-nakashima-stuttgart-2024-sf,"Sat, 15 Jun 2024 13:37:35 GMT",Matteo Berrettini sets Jack Draper clash in Stuttgart final?,"{'href': 'https://www.atptour.com', 'title': 'ATP Tour'}"
