Input URL,Title,Link,Published,Description,Source
https://livescience.com,Great potoo: The 'tree stump' bird with a haunting growl and can see with its eyes closed,https://www.livescience.com/animals/birds/great-potoo-the-tree-stump-bird-with-a-haunting-growl-and-can-see-with-its-eyes-closed,"Sat, 22 Mar 2025 13:00:00 GMT","Great potoos have giant eyes that protrude from the sides of their heads, providing excellent vision in low-light conditions.

Name: Great potoo (Nyctibius grandis)

Where it lives: Central and South America

What it eats: Large insects, bats and small birds

Why it's awesome: The great potoo is a master of disguise. Its mottled gray-brown feathers and ability to remain perfectly still often cause it to be mistaken for a tree branch or stump, helping it evade detection by predators.

Native to the forests and tropical lowlands of Central and South America, this nocturnal bird can grow to 24 inches (60 centimeters) tall and has a wingspan of more than 28 inches (70 cm). Its grey, brown and white plumage helps it blend seamlessly with the bark of the trees it lands on, making it nearly undetectable by other animals.

By day, great potoos remain silent and still in the trees. But at night, they become active hunters. Their large, owl-like eyes, which protrude from the sides of their heads, provide excellent vision in low-light conditions. Equipped with a large, flattened beak and mouth, these birds are well-adapted to snatching prey such as flying insects and bats out of the air.

Great potoos also have slits in their eyelids, which enable them to see when their eyes are closed. These ""notches"" help the birds to sense light and movement through their shut eyelids, so they can detect predators and prey even when resting.

Sign up for the Live Science daily newsletter now Get the world’s most fascinating discoveries delivered straight to your inbox. Contact me with news and offers from other Future brands Receive email from us on behalf of our trusted partners or sponsors

Great potoos are also unusual thanks to their distinctive calls. Throughout the night, they emit a loud, moaning growl. This ghostly call has earned the bird a mythical status in local folklore , with some communities in South America believing the sounds to be children calling for lost parents. These calls are used for communication and to defend their territories.

Potoos are monogamous birds, forming lifelong pairs that share the responsibilities of incubation and care for their young. Female great potoos lay a single egg in a natural depression on a tree branch, so they rely on their camouflage and sight to protect themselves and their offspring.

The incubation period for great potoo eggs is approximately 30 days, with both parents sharing the responsibility of incubating the egg. Due to their elusive nature, not much is known about their lifespan – but they are believed to live for around 12 to 14 years, like other bird species.",livescience
https://scientificamerican.com,"Scientific American Volume 332, Issue 4",https://scientificamerican.com/issue/sa/2025/04-01/,"Tue, 01 Apr 2025 00:00:00 GMT","For Two Decades Now, The iconic Twin Voyager Spacecraft Have Been Quietly Overurning Everything We Thought We Knew About the Boundary Bethany Our Solar System and Interstellar Space",scientificamerican
https://scientificamerican.com,"Killer Sudoku: March 22, 2025",https://scientificamerican.com/game/killer-sudoku-2025-03-22/,"Sat, 22 Mar 2025 00:00:00 GMT","Can You Crack Killer Sudoku's Mathematical Twist?

The Objective of Sudoku is to Fill Each Row, Column and Sub-Grid with Exactly One of Each Number from 1-9. In Killer Sudoku, The Digits in Each Inner Shape (Marked by Dots) must add up to the number in the top corner of that box. No digit can be repeated within an Inner Shape, Row, Column or Sub-Grid. For more, Select ""How to Play"" in the Game's Dropdown Menu. Use the ""Play Together"" option in the navigation bar to invite a friend to play this puzzle with you and Enter Numbers at the same time.

We’d Love to Hear From You! Email us at games@sciam.com to share your experience.",scientificamerican
https://scientificamerican.com,Science Crossword: Blacked Out,https://scientificamerican.com/game/science-crossword-blacked-out-2025-04/,"Tue, 22 Apr 2025 00:00:00 GMT","This crossword is inspired by the April 2025 issue of Scientific American. Read it here.

We’d love to hear from you! E-mail us at games@sciam.com to share your experience.",scientificamerican
https://theconversation.com,"In the failure of the ceasefire between Israel and Hamas, children are already the greatest victims",https://theconversation.com/no-fracasso-do-cessar-fogo-entre-israel-e-hamas-criancas-ja-sao-as-maiores-vitimas-252874,"Sat, 22 Mar 2025 00:31:45 GMT","After a few weeks of ceasefire in Gaza, Israel resumed the violent offensive, reaching hundreds of civilians again. On the first day of resumption of air attacks, more than 400 people died. Among them, at least 174 were children. According to Defense for Children International, it was one of the days with the highest child mortality rates in the history of Gaza. The offensives continued to terrestrial attacks on the following days, which have so far left more than 500 Palestinians killed, more than half of the victims women and children. A few weeks earlier, in late February, the bodies of two Israeli children, Ariel and Kfir Bibas, were returned to Israel, along with their mother's body, Shiri Bibas, and their deaths were confirmed. The three were kidnapped by Hamas on October 7, 2023. At the time, Ariel was four years old and Kfir, nine months.

Reflection

Now, before following this article, I suggest that you stop a little and think of some child you know. Children, nephews, godchildren, children of friends, a child you saw pass on the street today. Just think of a child who is somehow part of your life. When we are in direct contact with a child, we can easily access the conception that children should be protected. They should have access to affectionate and responsible caregivers, housing, health, education. It is easy to conceive of the idea that every child, as well as those we know in our daily lives, should be entitled to play and experience the world, without the risk of being raped, without fear of dying or having their assassinated caregivers, family and friends.

I proposed this reflection because, for some reason, the level of understanding and empathy we have with our children is often not so simple to access when we talk about children from another social or cultural group. Children victims of climbing violence in Gaza and Israel are as child as the ones you know, value and protect. From this perspective, I put the question here - how is there any attempt to justify what is happening in the Middle East?

Total Vulnerability

In situations of violent conflict, children are particularly vulnerable and exposed to risks, including direct violence, murder, separation or loss of caregivers and family members, expulsion from their homes, malnutrition, diseases, psychological and sexual violence, among many others. Although there are laws related to International Humanitarian Law and the Convention on the Law of Children who provide for the protection of children and adolescents in these contexts, the risks and violence faced by them has been increasingly worse. According to UNICEF, 2024 marked one of the worst years in the history of the organization for children in conflict zones. The report points to Palestine as one of the locations in which this violence intensified over the past year. In March of the same year, the United Nations stated that more children have died in Gaza since 2023 than in conflicts around the world in the previous four years.

Since the beginning of Israeli offensive in the Gaza Strip following October 7, 2023, it is estimated that around 18,000 Palestinian children have been murdered. The probability of this number is higher is quite high, as due to the countless collapse and the lack of search capacity, many bodies of victims are still missing, buried in rubble. Violence against children in Gaza goes beyond the scary amount of children's deaths.

Exodos

Over the past 17 months, thousands of children have necessarily displaced from their homes, living in precarious and dangerous conditions. The fact of moving multiple times, still generates the feeling that there is no safe place to take refuge. Winter in Gaza are quite intense, which has left all its inhabitants, especially children, vulnerable and exposed to cold. Under military offensive, bombing and travel, children are without access to education or basic health conditions.

This is the case of Mays, 14 years old. His family moved out of his house fleeing the heavy bombing, keeping in mind that leaving they could find a safer place, and began to live in a shelter. But it was in this shelter that Mays lost his two sisters, hit in a bombing. Last year she reported to UNICEF that the laughter of the sisters is the last thing that remembers that night. Mays also had leg injuries, which had to have implanted pins, and had partial paralysis on his face. Her mother said that every time she is in a closed place, she has panic seizures and needs to be taken out immediately. Mays also told UNICEF about the lack of water: ""Sometimes the truck comes, and each one gets a small amount to drink. Otherwise we have to drink the water we use to wash.""

Psychological violence is another very impactful factor in the lives of children and adolescents in Gaza. Fear, mourning, trauma are present daily, affecting mental and physical health from early childhood. According to a report published by War Child in December 2024, 49% of children expressed a desire to die and 96% feel that death is imminent.

Sama Tubail, 8, no longer has a hair on her head. Doctors diagnosed Sama's hair loss as a result of a nervous shock, intensified after the bombing of his neighbor's house in Rafah and the disruption of his entire routine since the military attacks began. During an interview with CNN, Sama stated that she is sad because she wants to comb her hair again. Turning to her mother, Om-Mohammed, she said ""Mom, I'm tired, I want to die. Why does my hair not grow? I want to die and have my hair back in paradise, God willing.""

Children also live the risks related to the lack of structure and basic goods. With blocked borders and lack of sufficient humanitarian aid, the continuous increase in hunger and malnutrition has consecutively increasing the number of malnourished children, generating many deaths from a result. In January 2025, the UN estimated that more than 60,000 children would need treatment for malnutrition in Gaza.

Without available hospitals and medical equipment, diseases have represented another major factor of violence. Thousands of children hit in military attacks or affected by a disease cannot access a health center and even when they can, the place often does not have the necessary structure to treat them. The collapse of the health system, the constant mass displacements and the lack of basic structures also generate the spread of diseases such as the polio outbreak that occurred in 2024.

Landing statistics

To these huge violence and insecurities, the loss of mothers, fathers and family members is added. In February 2024, over a year ago, UNICEF estimated that about 17,000 children in Gaza were unaccompanied or separated from their caregivers.

On the Israeli side there were many losses as well. Children were violently murdered during the October 7 attacks. This was the case of Liel and Yannai Hetzroni, twin brothers, who were only 12 years old and were killed in the Kibutz Beeri. Also twins Shahar and Arbel Siman Tov were murdered at Kibbutz Nir Oz, along with his 2 -year -old brother Omer and his parents, Tamar and Yonatan. Mila Cohen, just 9 months old, was murdered with a shot in her mother, Sandra, also at Kibibutz Beeri.

To these sad stories were added the children Bibas, Ariel and Kfir, who were kidnapped and taken to Gaza Living on October 7, 2023, along with his mother, Shiri. For over a year, the whereabouts of the three was uncertain, and the demand for their return mobilized Israeli society and thousands of people around the world. A few weeks ago, the death of children and mother was confirmed after Hamas sends their bodies as part of the ceasefire agreement involving the return of hostages and the return of the victims' bodies. The confirmation of the death of Shiri and children paralyzed Israel.

In addition to these terrible cases, many other Israeli children have lost their fathers, mothers, siblings, sisters and friends since October 7, 2023. Many have survived, including Hamas captivity, but have to deal with the trauma of living the attacks.

The situations of Palestinian and Israeli children are clearly different. Bringing cases on both sides do not have the connotation of comparing or normalizing what is happening in Gaza, the severity of context and the depth of human rights violation. The intention is exactly, emphasizing the lack of purpose of the perpetration of the cycle of violence. This cycle has been going on for many decades, and has been producing nothing more than generation after generating traumatized, bereaved and growing fear on the other side. As children and babies on all sides are deliberately murdered, the speech that perpetration and intensification of the use of violence serves to protect someone completely loses the purpose. Who is being protected?

To violate children, in addition to representing a deep attack on human rights, is also to perpetuate the cycle of violence. The surviving children become adults who carry all marks of losses. How to cultivate a possibility of a possible future peace agreement between people who live these violent contexts, lose so much and are so traumatized?

What was already proven and has been even clearer in the last 17 months is that there is no safe space for anyone in this alleged conflict. The policy of persisting in violence and further intensifying military onslaughts only have the possibility of generating more losses and more insecurities, for all involved in this conflict. Everything we have been following in the last year and a half, including breaking the ceasefire, is not just undermining a possibility of decreasing violence in the present, but is generating a whole generation of people deeply traumatized and undermining any possibility of future resolution.",theconversation
