Input URL,Title,Link,Published,Description,Source
https://scientificamerican.com,"Scientific American Volume 332, Issue 4",https://scientificamerican.com/issue/sa/2025/04-01/,"Tue, 01 Apr 2025 00:00:00 GMT","For Two Decades Now, The iconic Twin Voyager Spacecraft Have Been Quietly Overurning Everything We Thought We Knew About the Boundary Bethany Our Solar System and Interstellar Space",scientificamerican
https://scientificamerican.com,"Killer Sudoku: March 22, 2025",https://scientificamerican.com/game/killer-sudoku-2025-03-22/,"Sat, 22 Mar 2025 00:00:00 GMT","Can You Crack Killer Sudoku's Mathematical Twist?

The Objective of Sudoku is to Fill Each Row, Column and Sub-Grid with Exactly One of Each Number from 1-9. In Killer Sudoku, The Digits in Each Inner Shape (Marked by Dots) must add up to the number in the top corner of that box. No digit can be repeated within an Inner Shape, Row, Column or Sub-Grid. For more, Select ""How to Play"" in the Game's Dropdown Menu. Use the ""Play Together"" option in the navigation bar to invite a friend to play this puzzle with you and Enter Numbers at the same time.

We’d Love to Hear From You! Email us at games@sciam.com to share your experience.",scientificamerican
https://scientificamerican.com,Science Crossword: Blacked Out,https://scientificamerican.com/game/science-crossword-blacked-out-2025-04/,"Tue, 22 Apr 2025 00:00:00 GMT","This crossword is inspired by the April 2025 issue of Scientific American. Read it here.

We’d love to hear from you! E-mail us at games@sciam.com to share your experience.",scientificamerican
https://livescience.com,Science news this week: 'Stranded' astronauts return and mystery human ancestor,https://www.livescience.com/archaeology/science-news-this-week-stranded-astronauts-return-and-mystery-human-ancestor,"Sat, 22 Mar 2025 04:01:00 GMT","This week's science news was largely dominated by the return of two NASA astronauts from the International Space Station, whose planned eight-day mission ended up lasting 286 days.

Astronauts Butch Wilmore and Suni Williams lifted off from Florida's Cape Canaveral Space Force Station on June 5, 2024, but not long into the mission helium leaks , along with a number of other issues, were discovered on their Boeing Starliner spacecraft.

Starliner had already suffered years of delays, and although it was later suggested the pair would have been fine to return home on the suspect vessel , the risk to their safety was considered too great. As such, it wasn't until 5:57 p.m. ET on Tuesday (March 18) that the astronauts finally splashed down near the coast of Florida , after hitching a lift aboard a SpaceX Dragon capsule.

While much of the attention on them focused on the duo being ""stranded"" in space, it's not a sentiment the pair shared. In a conversation with CNN's Anderson Cooper, they explained how mission extensions are sometimes just part of the job .

""We come prepared, we come committed. That is what your human spaceflight program is: It prepares for any and all contingencies that we can conceive of, and we prepare for those,"" Wilmore told Cooper. ""We don't feel abandoned. We don't feel stuck. We don't feel stranded.""

Related: NASA astronauts Suni Williams and Butch Wilmore were carried away on stretchers after return from space. Here's why that's normal.

Mystery ancestors

A new study details how human ancestors mixed with a mystery population 300,000 years ago. (Image credit: Alamy)

In a study published Tuesday, researchers presented a new method of modeling genomic data, called ""cobraa,"" that has enabled them to trace the evolution of modern humans ( Homo sapiens ).

Sign up for the Live Science daily newsletter now Get the world’s most fascinating discoveries delivered straight to your inbox. Contact me with news and offers from other Future brands Receive email from us on behalf of our trusted partners or sponsors

They found that the ancestors of all modern humans split off from a mystery population 1.5 million years ago and then reconnected with them 300,000 years ago. This unknown population contributed 20% of our DNA and may have boosted humans' brain function.

""The fact that we can reconstruct events from hundreds of thousands or millions of years ago just by looking at DNA today is astonishing, and it tells us that our history is far richer and more complex than we imagined,"" study co-author Aylwyn Scally , a geneticist at the University of Cambridge, said in a statement .

Discover more archaeology news

— Mechanical Dog: A 'good boy' from ancient Egypt that has a red tongue and 'barks'

— European hunter-gatherers boated to North Africa during Stone Age, ancient DNA suggests

— 'Not enough survives to read the king's name': Tomb discovered of unknown ancient Egyptian pharaoh

Life's Little Mysteries

The oldest lake on Earth is 25 million years old. (Image credit: Tatyana Andreyeva via Shutterstock)

Just like the mountains, lakes on Earth can be ancient, or more than 1 million years old. There are only 20 ancient lakes on the planet, but which is the oldest ?

Largest-ever space map

The Dark Energy Spectroscopic Instrument maps the night sky from the Nicholas U. Mayall 4-meter Telescope in Arizona. (Image credit: KPNO/NOIRLab/NSF/AURA/B. Tafreshi)

Astronomers studying the largest-ever map of the cosmos have found hints that our best understanding of the universe is due a major rewrite. The analysis, which looked at nearly 15 million galaxies and quasars spanning 11 billion years of cosmic time, found that dark energy — the presumed-to-be constant force driving the accelerating expansion of our universe — could be weakening.

Or at least this is what the data, collected by the Dark Energy Spectroscopic Instrument (DESI), suggest when combined with information taken from star explosions, the cosmic microwave background and weak gravitational lensing. If the findings hold up, it means that one of the most mysterious forces controlling the fate of our universe is even weirder than first thought — and that something is very wrong with our current model of the cosmos .

Discover more astronomy news

— James Webb telescope spots 'rogue' planet with a cake-like atmosphere barrelling through space without a star

— Scientists find evidence of 'supernova graveyard' at the bottom of the sea — and possibly on the surface of the moon

— 'I was astonished': Ancient galaxy discovered by James Webb telescope contains the oldest oxygen scientists have ever seen

Also in science news this week

Also in science news this week

— Google's AI 'co-scientist' cracked 10-year superbug problem in just 2 days

— AI analysis of 100 hours of real conversations — and the brain activity underpinning them — reveals how humans understand language

— Scientists create new map showing ice-free Antarctica in more detail than ever before

— Iguanas sailed one-fifth of the way around the world on rafts 34 million years ago

— Punishing AI doesn't stop it from lying and cheating — it just makes it hide better, study shows

Science spotlight

Scientists have developed new blood tests that can detect early chemical signatures of cancer. For diseases like pancreatic cancer, that could lead to earlier diagnosis and a better prognosis. (Image credit: CSA Images via Getty Images)

Around four years ago, now 77-year-old John Gormly went for what was supposed to be a routine blood test. But the results were life-changing.

The test suggested Gormly had colon cancer, which a colonoscopy later confirmed was Stage 2, meaning the cancer had spread through the wall of the colon but not to his lymph nodes.

""I thought [my doctor] was wrong,"" Gormly, CEO of a construction company near Newport Beach, California, told Live Science. ""I go, 'Nah, I don't feel anything.' But there it was. It was real; the colonoscopy showed it.""

Gormly was one of the first patients to take a newly approved test called Shield, which its makers say can detect colon cancer from a blood sample . After his diagnosis, Gormly had surgery to remove the tumor and was back at work within 10 days.

""Liquid biopsies"" like the one that detected early cancer for Gormly are now coming to market. Could they lead to earlier diagnosis and treatment?

Something for the weekend

Something for the weekend

If you're looking for something a little longer to read over the weekend, here are some of the best long reads, book excerpts and interviews published this week.

— March 29 solar eclipse: Where and when to see the rare sunrise solar eclipse from North America (Skywatching)

— Dolphins: Facts about the intelligent marine mammals that use tools to hunt (Fact file)

— 'Heat is the final boss. Heat is a different beast': The planetary peril no one will be able to avoid (Book extract)

— 'We have to fight for a better end': Author John Green on how threats to USAID derail the worldwide effort to end tuberculosis (Interview)

Science in motion

Marine mystery of octopus riding shark - YouTube Watch On

An octopus has been spotted catching a ride from an unlikely marine friend: a superfast shark. Researchers captured a video showing the orange-hued octopus clinging to the back of a large shortfin mako shark (Isurus oxyrinchus) as it swims. This ""sharktopus"" was spotted in the Hauraki Gulf off the northern coast of New Zealand's North Island during a December 2023 research trip.

Follow Live Science on social media",livescience
https://livescience.com,Scientists break down cheap plastic using the air — and turn it into something far more valuable,https://www.livescience.com/chemistry/scientists-break-down-cheap-plastic-using-the-air-and-turn-it-into-something-far-more-valuable,"Sat, 22 Mar 2025 17:06:00 GMT","Scientists have developed a new method to break down plastic waste, using moisture from the air.

By exposing a common type of plastic to an inexpensive catalyst and leaving it exposed to ambient air, researchers broke down 94% of the material in just four hours.

The plastic transformed into terephthalic acid (TPA), a highly valuable building block for polyesters. Because TPA can be upcycled into more valuable materials, the process offers a safer and cheaper alternative to current plastic recycling methods. The researchers published their findings Feb. 3 in the journal Green Chemistry .

""The U.S. is the number one plastic polluter per capita, and we only recycle 5% of those plastics,"" co-corresponding author Yosi Kratish , a research assistant professor of chemistry at Northwestern University, said in a statement . ""What's particularly exciting about our research is that we harnessed moisture from air to break down the plastics, achieving an exceptionally clean and selective process. By recovering the monomers, which are the basic building blocks of PET [polyethylene terephthalate], we can recycle or even upcycle them into more valuable materials.""

Plastic waste is an increasingly important issue. Over half of the plastic ever made has been produced since 2000, and annual production is projected to double by 2050, according to the European Environment Agency .

To date, only 9% of the plastics ever produced have been recycled. The remainder, with lifetimes often lasting generations, can have serious environmental and health impacts. For example, they wash out to sea to form floating blobs of trash, harm wildlife , and break down into microplastics that can enter the human brain and other parts of our bodies .

Related: Will we ever be able to stop using plastic?

Sign up for the Live Science daily newsletter now Get the world’s most fascinating discoveries delivered straight to your inbox. Contact me with news and offers from other Future brands Receive email from us on behalf of our trusted partners or sponsors

To find a new method to break down some of this waste, the researchers applied a molybdenum catalyst — a silver, ductile metal — and activated carbon to PET, the most common type of polyester plastic. The researchers then heated the mixture. After a short time, this broke the polyethylene's chemical bonds.

Then, when the team exposed the material to air, the mixture transformed into TPA, a valuable polyester precursor; and acetaldehyde, an industrial chemical that is also valuable and is easy to lift from the mixture.

When they tested the method on mixed plastics, the researchers found that it had an effect only on the polyester materials. That meant they didn't have to presort the plastics. It worked on plastic bottles, T-shirts and colored plastics, breaking them down into pure, colorless TPA.

""It worked perfectly,"" Kratish said. ""When we added extra water, it stopped working because it was too much water. It's a fine balance. But it turns out the amount of water in air was just the right amount.""

The team's next steps will be to adapt the process to large-scale industrial applications.",livescience
https://livescience.com,High-school student accidentally discovers black hole 'light echo' twice as wide as the Milky Way,https://www.livescience.com/space/black-holes/high-school-student-accidentally-discovers-black-hole-light-echo-twice-as-wide-as-the-milky-way,"Sat, 22 Mar 2025 15:30:00 GMT","A color image of the newly discovered black hole light echo candidate, which may be one of the biggest ever found.

ANAHEIM, Calif. — Long after the black hole in the center of a galaxy sputters out, you can still see its ghost lingering in surrounding gas clouds aglow with leftover radiation, like wisps of smoke emanating from an already extinguished flame. Astronomers call these cosmic ghosts ""light echoes"" — and that's what high-school junior Julian Shapiro found while scanning the cosmos for supernova remnants.

""There are these outer regions of gas being ionized by a supermassive black hole, which results in this echo,"" Shapiro said at a March 20 presentation here at the 2025 American Physical Society (APS) Global Physics Summit.

Shapiro, 17, is a student at The Dalton School in New York City. But in between classes and scoping out potential colleges, he's also an independent astronomer who presents at global conferences like this week's APS meeting.

Originally, Shapiro began sifting through the DECaPS2 survey — an inventory of the southern galactic plane from the Dark Energy Camera at the Cerro Tololo Inter-American Observatory in Chile — to find the debris of exploding stars in supernova remnants and planetary nebulas .

But after zeroing in on one such object, he found its structure didn't match the wispy filaments characteristic of a supernova remnant, nor did it show evidence of a supernova at its center. ""It was a real surprise to stumble upon this,"" Shapiro told Live Science.

Related: High school students who came up with 'impossible' proof of Pythagorean theorem discover 9 more solutions to the problem

The object, which he believes to be a light echo, stands in a field of potential supermassive black holes. Using measurements from the Southern African Large Telescope , he found high contents of oxygen and ionized sulfur sprinkled into the region — both indicators of shocked material. All of these signs suggest that the object is the afterglow of a now-dormant black hole, which once spewed radiation that ionized the surrounding gas, causing it to emit light even after the black hole quieted down.

Sign up for the Live Science daily newsletter now Get the world’s most fascinating discoveries delivered straight to your inbox. Contact me with news and offers from other Future brands Receive email from us on behalf of our trusted partners or sponsors

An epic echo

Shapiro currently pegs the light echo at about 150,000 to 250,000 light-years in diameter — about 1.5 to two times the width of the entire Milky Way galaxy. And if his estimates hold up, he thinks it could be a viable candidate for the largest light echo ever discovered.

""This object covers a large area in the sky, which makes it a bit easier to get in-depth images of,"" Shapiro said.

According to Sasha Plavin , a black hole researcher at Harvard University who was not involved in the research, echoes like the one Shapiro discovered can help us learn more about how black holes behave in the hearts of galaxies.

""I really like how carefully [Shapiro] looked into these images,"" Plavin told Live Science. ""These galactic events are always of interest, and I think these echoes are a great way of studying them.""

Plavin is also interested in seeing how this new light echo measures up to others — whether it occurred faster or slower than existing examples . ""Putting this discovery in a wider context could be useful in the future,"" he said.

As Shapiro continues studying the light echo, he hopes to learn more about its composition with measurements of its different regions. But in the meantime, he's excited to continue contributing to black hole science — even if he came across it by accident.

""My involvement in this area of research came as a bit of a surprise to me,"" he said. ""But I hope this object, in particular, helps expand the knowledge of galaxy activities that we don't have too great of an understanding of.""",livescience
https://livescience.com,Scientists discover smallest galaxy ever seen: 'It's like having a perfectly functional human being that's the size of a grain of rice',https://www.livescience.com/space/cosmology/scientists-discover-smallest-galaxy-ever-seen-its-like-having-a-perfectly-functional-human-being-thats-the-size-of-a-grain-of-rice,"Sat, 22 Mar 2025 11:00:00 GMT","Astronomers have discovered a collection of tiny galaxies located roughly 3 million light-years away that includes the smallest and faintest galaxy ever seen.

This galaxy, designated Andromeda XXXV, and its compatriots orbiting our neighbor galaxy, Andromeda, could change how we think about cosmic evolution.

That's because dwarf galaxies this small should have been destroyed in the hotter and denser conditions of the early universe. Yet somehow, this tiny galaxy survived without being fried.

Related: 'The early universe is nothing like we expected': James Webb telescope reveals 'new understanding' of how galaxies formed at cosmic dawn

""These are fully functional galaxies, but they're about a millionth of the size of the Milky Way,"" team member and University of Michigan professor Eric Bell said in a statement. ""It's like having a perfectly functional human being that's the size of a grain of rice.""

Meet Andromeda XXXV

Dwarf galaxies themselves are nothing new to scientists. Our own galaxy, the Milky Way, is orbited by dozens of these satellite galaxies caught in the grip of its more immense galaxies.

There is, however, a great deal about dwarf galaxies that scientists don't know. This is because, being smaller, they are much dimmer than major galaxies, making them harder to spot and tougher to study at large distances.

Sign up for the Live Science daily newsletter now Get the world’s most fascinating discoveries delivered straight to your inbox. Contact me with news and offers from other Future brands Receive email from us on behalf of our trusted partners or sponsors

While astronomers have been able to determine many dwarf galaxies in orbit around the Milky Way, identifying dwarf galaxies around our bright galactic neighbors has been incredibly difficult. This means that the dwarf galaxies of the Milky Way have been our only source of information about small satellite galaxies.

This task is somewhat less challenging around the closest major galaxy to the Milky Way, Andromeda. Other dwarf galaxies have been spotted around Andromeda before, but these have been large and bright, thus simply confirming the information that astronomers had gathered about dwarf galaxies around the Milky Way.

A map showing the Andromeda galaxy and its satellites. The newly discovered Andromeda XXXV companion galaxy is highlighted in bold red text. (Image credit: M. Arias et al. Astrophys. J. Lett. (2025))

To discover these paradigm-shifting smaller and dimmer dwarf galaxies, team leader Marcos Arias, an astronomer at the University of Michigan, and his colleagues scoured various massive astronomical datasets. The team was also able to obtain time with the Hubble Space Telescope to aid their search.

This revealed that not only is Andromeda XXXV a satellite galaxy, but it is also small enough to change theories of how galaxies evolve.

""It was really surprising,"" Bell said. ""It's the faintest thing you find around, so it's just kind of a neat system. But it's also unexpected in a lot of different ways.""

A cosmic murder mystery

One of the key aspects of galactic evolution is how long their star-forming periods last. This seemed to be the main difference between the Milky Way's dwarf galaxies and the smaller satellite galaxies of Andromeda.

""Most of the Milky Way satellites have very ancient star populations. They stopped forming stars about 10 billion years ago,"" Arias explained. ""What we're seeing is that similar satellites in Andromeda can form stars up to a few billion years ago — around 6 billion years.""

Star formation requires a steady supply of gas and dust to collapse and birth stellar bodies. When that gas is gone, star formation halts, and the galaxy ""dies.""



Thus, Bell described the situation around these small galaxies as a ""murder mystery."" Did star formation end when dwarf galaxies' gas supplies petered out on their own, or when these gases were gravitationally stripped away by a large galactic host?

In the case of the Milky Way, it appears that the gas for star formation petered out on its own; however, for the smaller galaxies around Andromeda, it appears they were ""killed"" by their parent galaxy.



""It's a little dark, but it's either did they fall or did they get pushed? These galaxies appear to have been pushed,"" Bell said. ""With that, we've learned something qualitatively new about galaxy formation from them.""

Not only is Andromeda XXXV the dimmest and smallest known satellite galaxy in the Andromeda system, it's about 3 million light-years away, making it very hard to spot. The ellipse within the inset shows where this companion galaxy was discovered. (Image credit: CFHT/MegaCam/Principal investigator: Alan W. McConnachie; Image Processing: Marcos Arias)

What is even more curious is the extended period of star formation experienced by Andromeda XXXV. To understand why, it is necessary to travel back in time to the the birth of the first galaxies.

Why isn't Andromeda XXXV a 'deep fried' galaxy?

The earliest epoch of the universe was marked by incredibly hot and dense conditions. This inflationary period, begun by the Big Bang, continued, and the universe dispersed and cooled. This allowed the first atoms of hydrogen to take shape, birthing the first stars, which gathered in the first galaxies.

These stars and galaxies blasted out energy as did the first feeding black holes reheating the cosmos. This signaled the death of very small galaxies, and scientists theorize this heat ""cooked off"" the gas needed for star formation in such collections of stars.

Yet, somehow, Andromeda XXXV survived!

A timeline of the universe showing when the first galaxies formed (Image credit: NASA, ESA, and A. Feild (STScI))

""We thought they were basically all going to be fried because the entire universe turned into a vat of boiling oil,"" Bell said. ""We thought that it would completely lose its gas, but apparently that doesn't happen, because this thing is about 20,000 solar masses and yet it was forming stars just fine for a few extra billion years.""

Just how Andromeda XXXV resisted being fried is still a mystery.



""I don't have an answer,"" Bell said. ""It is also still true that the universe did heat up; we're just learning the consequences are more complicated than we thought.""

NASA and other space agencies are planning missions that could discover further dwarf galaxies around other large galaxies and help solve this mystery. But there's a good chance that the solution will open up new questions just as the discovery of Andromeda XXXV has.

""We still have a lot to discover,"" Arias said. ""There are so many things that we still need to learn — even about what's near to us — in terms of galaxy formation, evolution, and structure before we can reverse engineer the history of the universe and understand how we came to be where we are today.""

The team's research was published March 11 in The Astrophysical Journal Letters.

Originally posted on Space.com.",livescience
