"Input URL","Title","Link","Published","Description","Source","Category"
"https://news.google.com/rss/search?q=altcoins","Token Launch Frenzy Holds Back Altcoin Season—45 New Launches Dilute Liquidity","https://beincrypto.com/token-launch-frenzy-delaying-altcoin-season/","Sun, 20 Apr 2025 14:00:00 GMT","

We use cookies to improve your experience.            



The arrival of an altcoin season is often tied to Bitcoin's performance. As money flows out of BTC and into altcoins, this triggers a rise in altcoin prices. 

However, this cycle is delayed by factors beyond Bitcoin. One such factor is the recent surge in token generation events (TGEs).

In the past four and a half months, 45 new tokens have launched, with most failing to provide decent returns. Many tokens launched in 2025 failed to sustain growth post-listing, raising the question of whether this trend is driven by bearish macroeconomic conditions or the lack of fundamental value in these tokens. This is turning altcoins into speculative assets driven by momentum.

Talking to BeInCrypto, Vincent Liu, CIO of Kronos Research, shed light on this question.

“Relentless token launches, especially meme coins, diluted liquidity and fragmented investor attention. Simultaneously, macro headwinds like rising interest rates and a global shift to risk-off sentiment throttled speculative capital. Tokens lacking utility, clear roadmaps, or sustainable ecosystems were quickly repriced in line with growing investor skepticism,” Liu explained.

One of the few successful launches with strong ROI has been Solayer (LAYER). Since its February launch, LAYER has posted an 88% rise and is currently trading just under $2.00.

The altcoin season index currently stands at 16, indicating Bitcoin's dominance. Rapid token launches and post-listing failures are contributing to the delay. 

However, Liu noted that niche categories like AI-linked tokens continue to show strong demand despite the broader market conditions.

“While a full-fledged altcoin season hasn't materialized, niche categories like AI-integrated meme coins and emerging tech narratives have shown signs of strength. Many token launches still suffer from inflated valuations and weak fundamentals, diluting capital and stalling broader momentum. Yet AI-linked narratives continue to attract attention not just from crypto natives, but also from traditional finance. Altcoin season isn't gone, it's simply evolving,” Liu said.

Despite the delay, the potential for an altcoin season remains. However, 75% of the top 50 altcoins would need to outperform Bitcoin to signal a true shift, which is not the case at the moment.

Arthur Cheong, founder and CEO of DeFiance Capital, recently raised concerns over TGEs. He highlighted the risk of projects and market makers working together to inflate token prices artificially. This can distort market behavior and undermine investor confidence.

“You don't know whether the price is a result of organic demand and supply or simply due to projects and market makers colluding to fix the price for other objectives. Absolutely bizarre that CEXs are turning a blind eye to this and altcoin markets are becoming more and more like a lemon market where confidence gets lesser,” Cheong tweeted.

Responding to this, Vincent Liu suggested that there needs to be reforms in the way that token launches are approached.  

“…the issue of artificially inflated token prices before launch presents a growing concern. While these short-term surges might attract initial attention, they often undermine long-term investor confidence. To mitigate this, the industry must champion greater transparency around partner agreements, listing criteria, and pre-launch disclosures. Clear communication about a project's structure, roadmap, and market cap expectations is essential to building a sustainable and trustworthy ecosystem,” Liu said.

Liu believes addressing this problem requires collaboration from market makers, centralized exchanges (CEXs), and investors. 

“By conducting thorough research into the fundamentals of new projects, investors can protect themselves from significant losses and identify valuable tokens in the long run,” Liu concluded.

Disclaimer

In line with the Trust Project guidelines, this price analysis article is for informational purposes only and should not be considered financial or investment advice. BeInCrypto is committed to accurate, unbiased reporting, but market conditions are subject to change without notice. Always conduct your own research and consult with a professional before making any financial decisions. Please note that our Terms and Conditions, Privacy Policy, and Disclaimers have been updated.

Want to know more?
Join our Telegram Group and get trading signals, a free trading course and daily communication with crypto fans!

Join Our Telegram


 Stay up to date on crypto
          ","{'href': 'https://beincrypto.com', 'title': 'BeInCrypto'}","cryptocurrency"
"https://news.google.com/rss/search?q=blockchain","The hidden bias in financial AI—can blockchain finally solve it?","https://crypto.news/hidden-bias-in-financial-ai-can-blockchain-solve-it/","Sun, 20 Apr 2025 09:08:00 GMT","


        Share    


            Disclosure: The views and opinions expressed here belong solely to the author and do not represent the views and opinions of crypto.news' editorial.        

Artificial intelligence has become a powerful force in the finance ecosystem, offering faster, data-driven insights that promise to improve investments, lending, and risk management. From AI advisors that personalize financial strategies for both companies and individuals to highly advanced trading systems that make data-driven decisions in microseconds, the financial AI sector has a lot of room to grow. 

But there's one major problem: bias. 

Despite offering speed, precision, and what seems like objectivity, financial AI systems carry the same bias that the industry has been trying to eliminate for decades. For example, according to Lehigh University, OpenAI's GPT-4 Turbo large language models—simulating an AI mortgage advisor or decision system—required certain demographics of applicants to have 120 credit points higher than white applicants to receive the same approval despite having the same income, credit history, and debt levels.

This bias doesn't just affect the traditional financial markets but also the decentralized finance and crypto ecosystems. Take AI-powered market forecasting platforms, for example. Since their data is based on price history, news sentiment, or social trends, these platforms could sometimes overreact to market anomalies—crypto is full of black swan events like the Terra collapse, FTX crash, or large penalties from the regulators.

Consequently, these prediction tools can become over-aggressive or even overweight social trends and chatter, leading to poor signals and predictions.

The limitations and opaque nature of many AI systems prevent them from becoming fully transparent and accountable. Some even call them black boxes since AI models usually have little to no transparency.

Notably, the decisions made by AI tools within the crypto space are not usually explainable—this makes it hard for users to understand how decisions are made. The absence of standardized auditing protocols for AI systems would also result in inconsistent assessments and potential oversight of critical issues.​

Integrating blockchain technology with Explainable AI, or XAI for short, can tackle this issue by providing the immutability and transparency that come with decentralized ledgers—potentially improving the auditing methods as well since the auditors will have complete access to the platform's data and underlying algorithms.

XAI models are already getting increased attention since they ensure the decision-making process is fair and ethical in addition to being efficient. Blockchain technology can complement XAI's fairness by creating immutable records of AI decision-making processes, ensuring that every action is traceable and verifiable. This will promote trust and accountability.

Blockchains operate in a trustless manner. This doesn't mean the technology cannot be trusted, but it suggests that third parties or central authorities won't be needed to confirm any decisions. Decentralization removes the need for a centralized entity to oversee the processes, thanks to the smart contracts that function autonomously. 

When a model changes or outputs a decision, the lack of logs and version control can cause trust issues with most of the AI platforms. Blockchain technology timestamps the records and data on an immutable ledger. 

FICO, a credit scoring company, has used blockchain to log AI model decisions, so regulators can trace how decisions like credit approvals were made. The company received the “Tech of the Future—Blockchain and Tokenisation” award at the Banking Tech Awards in London last year.

Blockchains and decentralized finance protocols have the opportunity to bake fairness, transparency, and accountability into AI models—something traditional financial companies have been struggling with.

Combining XAI with on-chain verification can transform how decisions are made and trusted in the web3 ecosystem. For example, using XAI to explain the voting of decentralized autonomous organizations could help users have a better understanding of the consequences of their choices. A more advanced utility would be using XAI for risk assessment in lending DeFi protocols.

Mixing XAI with blockchain technology could also be a powerful on-chain surveillance and manipulation detection tool. AI is good at analyzing patterns of sandwich attacks, MEV exploitation, or wash trading. This could help in finding market anomalies.

Some web3 projects are already trying to enhance AI transparency. SingularityNET, for instance, focuses on making AI processes auditable. Another platform called Ocean Protocol tracks the origins of the data, ensuring trustworthiness and traceability.

At this point, it's just the beginning of the integration of blockchain and AI. Researchers are now exploring hybrid models that combine blockchain's integrity, XAI's clarity, and bias-detection tools into systems that can monitor and potentially correct themselves.

But technology alone won't fix this. It will also need attention from regulators, scrutiny from users, and humility from the developers building these systems. If the 2008 financial crisis taught us anything, it's that blind trust in complex and centralized tools is dangerous.

Most notably, smart doesn't always mean fair. As the era of mainstream AI surfaces, users must also look for transparency in addition to efficiency.

Jawad Ashraf is a technology innovation-focused entrepreneur with 30 years of experience. Led the technical transformation of the Entertainer Dubai, leading to a $100M exit. He has founded multiple businesses and has successfully exited each one. Jawad has deep experience in mobile gaming and VR, AR and blockchain technologies. He is an award-winning speaker on web3 adoption and AI. Ashraf has positioned Vanar Blockchain as a trailblazer in carbon-neutral, high-speed, and low-cost Layer 1 blockchain technology designed for AI, Payfi and entertainment applications. Vanar is poised to pioneer mainstream adoption in the web3 landscape.


        Read more about    


        Rexas Finance Presale
    


        Deep Dives    



                    Most Bitcoin businesses in El Salvador quietly vanish from the market                




                    The hidden bias in financial AI—can blockchain finally solve it? | Opinion                




                    AI flattens creativity. Blockchain is how we save it | Opinion                




                    Q&A: how MESA could reshape Solana's tokenomics and governance                




                    “We're at war, and our values are at stake” — A veteran calls Ethereum's cultural drift a threat                




                    The key to boosting growth in the tokenized credit market: Funding cross-border payments | Opinion                




                    Why XRP could rally 100% even in a crypto crash                




                    Project 11 challenges everyone to crack the Bitcoin key using a quantum computer. The reward is 1 BTC                




                    Elon Musk's child proposal to Tiffany Fong — and the events leading up to it                




                    Q&A with Figment: Inside the new TSX Solana staking ETF (SOLQ)                



                Related News            



                    Here's why AI tokens FET, AIC, Render, WLD, TAI are soaring                




                    AI flattens creativity. Blockchain is how we save it | Opinion                




                    The key to boosting growth in the tokenized credit market: Funding cross-border payments | Opinion                



            Get crypto market analysis and curated news delivered right to your inbox every week.        


            You have successfully joined our subscriber list.        

","{'href': 'https://crypto.news', 'title': 'Crypto News'}","cryptocurrency"
"https://news.google.com/rss/search?q=blockchain","Fuse partners with Check Point to deploy blockchain firewall for real-time threats","https://www.intelligentcio.com/me/2025/04/20/fuse-partners-with-check-point-to-deploy-blockchain-firewall-for-real-time-threats/","Sun, 20 Apr 2025 06:35:07 GMT","

Intelligent CIO Middle East

Providing Unparalleled Technology Intelligence

Layer 2 payments blockchain Fuse announced that it has partnered with Check Point Software, to develop and deploy a real-time threat prevention security layer protecting its entire blockchain.

Fuse's commitment to integrate a best-in-class web3 security layer has been driven by a desire to lead by example and to prevent hacks and other incidents that are a constant threat across the omnichain landscape. The partnership will furnish Fuse with an advanced blockchain security layer that can identify and mitigate threats before they have had a chance to develop, moving blockchain defence from detection to real-time prevention

Through working closely with Check Point, Fuse will foster a safer ecosystem for all users and developers, accelerating its goal of mainstreaming crypto payments for B2B and B2C applications. Check Point's technology can prevent malicious transactions in real-time, leveraging advanced AI-powered threat engines that draw from more than 30 years of global cyber intelligence

The collaboration with Check Point extends beyond smart contract-level audits. With real-time threat detection coming soon, the integration will offer comprehensive protection across the entire network, reinforcing Fuse's commitment to safeguarding user funds and trust, while establishing new standards for blockchain security infrastructure

Fuse CEO Mark Smargon said: “Prevention is always better than a cure, particularly with crypto networks that serve as the backbone for global payments. With Check Point providing a dedicated security layer, we are confident that we can not only deter hackers, who are becoming increasingly sophisticated, but pioneer a cybersecurity model that will become the gold standard for protecting web3 protocols.”

“We are proud to partner with Fuse and bring Check Point's real-time threat prevention to Web3. By applying our threat intelligence, we are setting a new standard for blockchain security, protecting users, wallets, and dApps.” says Dan Danay, Head of Web 3.0 Security at Check Point Software Technologies.

“Just as robust cybersecurity powered the rise of Web 2.0;Xiereal-time prevention will be key to Web3's mainstream adoption.”

Fuse recently launched Ember Nodes with support from partners including Collider Ventures, Tectona, Spark, TRGC, and Blockchain Founders Fund. It attracted broad community support, giving users an opportunity to acquire nodes and participate in network governance and validation. 

Just as it pioneered network firewall technology for Web 2.0, Check Point is now supporting the evolution of Web 3.0 by tackling its most critical barrier, security. The Check Point partnership will support Fuse in its quest to become the preeminent web3 network for stablecoin payments. In the process, it will champion better blockchain security for all users across its ecosystem.

Fuse is a layer 2 blockchain that offers fast, cheap, and borderless payments with stablecoins and DeFi building blocks. It enables businesses to build, integrate, and use blockchain technology to enhance mobile, e-commerce, loyalty, and branded stablecoins.



Signup to the newsletter and never miss out on the latest news.


				A Lynchpin Media Brand
			


Privacy Policy


Browse our latest issue

View Magazine Archive","{'href': 'https://www.intelligentcio.com', 'title': 'Intelligent CIO'}","cryptocurrency"
"https://news.google.com/rss/search?q=blockchain","Crypto Market Insights from KookCapitalLLC's Easter Tweet","https://blockchain.news/flashnews/crypto-market-insights-from-kookcapitalllc-s-easter-tweet","Sun, 20 Apr 2025 10:57:57 GMT","

According to KookCapitalLLC, the Easter holiday brings a unique trading environment, often characterized by decreased market activity and lower liquidity. Traders should be cautious of potential volatility due to reduced participation, which can impact price dynamics. As the crypto market remains unpredictable, it is crucial for traders to monitor any sudden price movements especially during holiday periods.

Retired crypto hunter seeking 1000x gems through BullX strategies

Welcome to your premier source for the latest in AI, cryptocurrency, blockchain, and AI search tools—driving tomorrow's innovations today.


                        Disclaimer: Blockchain.news provides content for informational purposes only. In no event shall blockchain.news be responsible for any direct, indirect, incidental, or consequential damages arising from the use of, or inability to use, the information provided. This includes, but is not limited to, any loss or damage resulting from decisions made based on the content. Readers should conduct their own research and consult professionals before making financial decisions.
                    ","{'href': 'https://blockchain.news', 'title': 'Blockchain News'}","cryptocurrency"
