"Input URL","Title","Link","Published","Description","Source","Category"
"https://news.google.com/rss/search?q=atp+tennis","ATP World Tour BMW Open by American Express Results","https://www.sfchronicle.com/sports/article/atp-world-tour-bmw-open-by-american-express-20285138.php","Sun, 20 Apr 2025 11:21:26 GMT","

Andre Goransson, Sweden, and Sem Verbeek, Netherlands, def. Kevin Krawietz and Tim Putz (1), Germany, 6-4, 6-4.

Advertisement

Article continues below this ad

About

Contact

Services

Account","{'href': 'https://www.sfchronicle.com', 'title': 'San Francisco Chronicle'}","tennis"
"https://news.google.com/rss/search?q=atp+tennis","Novak Djokovic brings key team member with him for Madrid Masters","https://www.tennis365.com/atp-tour/novak-djokovic-next-tournament-madrid-open-andy-murray","Sun, 20 Apr 2025 08:30:36 GMT","

Novak Djokovic has arrived in Spain ahead of his first appearance at the Madrid Open since 2022 and he has confirmed his intentions to challenge for the title by bringing Andy Murray with him in his coaching box.

Djokovic's partnership with his old rival Murray has been one of the most compelling tennis storylines of the year, with the three-time Grand Slam champion a surprise pick to work with the 24-time major winner at the Australian Open in January.

It was unclear whether their partnership would continue after that experience in Melbourne, where Djokovic reached the semi-finals before he was forced to pull out with an injury in his semi-final against Alexander Zverev, but they worked together again at the Indian Wells and Miami Masters tournaments last month.

Djokovic then admitted he ‘didn't know where Murray was' as he played his first clay court tournament in Monte Carlo, with some question marks over whether the Serbian would play in the Spanish capital after he slipped to a defeat against Alejandro Tabilo in his opening match.

Djokovic described that loss and his performance as ‘horrible', with some observers suggesting he may skip the Madrid Masters as he looks to build towards his primary target in the clay court season, which is the French Open at Roland Garros at the end of May.

Novak Djokovic eyeing up huge rankings breakthrough as he prepares for rare appearance

Richard Gasquet reveals what Novak Djokovic, Rafael Nadal, Roger Federer are really like

“I was hoping it was not going to happen, but it was quite a high probability I'm going to play this way,” said Djokovic after his loss in Monte Carlo.

“I don't know. Just horrible. Horrible feeling to play this way, and just sorry for all the people that have to witness this.

“I expected myself at least to have put a decent performance. Not like this. It was horrible. I did not have high expectations, really.

“I knew I'm gonna have a tough opponent and I knew I'm gonna probably play pretty bad. But this bad, I didn't expect.”

Djokovic's downbeat press conference has not encouraged him to skip the Madrid Open, with his eagerness to play more tournaments in 2025 emphasised by his decision to bring Murray with him to Madrid.

Novak, welcome back to Madrid: the home of tennis @DjokerNole | @atptour | #MMOPEN pic.twitter.com/WVornaDmwV

— #MMOPEN (@MutuaMadridOpen) April 19, 2025



Djokovic and Murray practised at the Madrid venue on Saturday night, with the three-time Madrid Open champion looking in focused mood as he prepares for a draw where he will be the No 4 seed.

The case to win a 100th career title is clearly driving on Djokovic, with his near miss as he made it through to the Miami Open final last month before losing against Jakub Mensic.

“Ever since I won my 99th, which was the Olympic Games in Paris, I've been playing with the prospect of winning the special hundred titles,” said Djokovic in Miami.

“I played finals of Shanghai. I was close there. Semi-finals of Australia. Then been trying to find that necessary and much-needed level of tennis that will put me in a position to fight for a trophy, a big trophy.

“Clearly it is something I want to do, but I know it won't be easy.”

READ NEXT: The 7 men with the highest ATP win percentage on clay: Rafael Nadal No 1, Novak Djokovic with 80.3%


                ""It just seems like 2025 is his last opportunity to win a slam.""            


                Four male players have a win rate of over 80% on clay.            


                Novak Djokovic tends to skip the Madrid Open, but he looks set to play in the Spanish capital this year.            


                The Frenchman also named two top stars who were ""not nice.""            

© Planet Sport Limited 2025 • All Rights Reserved","{'href': 'https://www.tennis365.com', 'title': 'Tennis365'}","tennis"
"https://news.google.com/rss/search?q=atp+tennis","Zverev surges past Shelton, completes Munich hat-trick","https://www.atptour.com/en/news/zverev-shelton-munich-2025-final","Sun, 20 Apr 2025 12:58:15 GMT","

Alexander Zverev celebrated his 28th birthday in style on Sunday at the BMW Open by Bitpanda, where he soared to a record-equalling third Munich title.

The home favourite produced an assured performance to defeat second seed Ben Shelton 6-2, 6-4 and claim his 24th tour-level trophy. Zverev was imperious on serve throughout the championship match, in which he did not face a break point, according to Infosys ATP Stats.

“It's extremely special, I always love winning tournaments in Germany,” said Zverev, who earned his first title of the season. “It's probably the most special thing I can do. It's definitely a great birthday present, let's put it that way.”

BIRTHDAY BOY COMPLETES THE HATTRICK 🏆🏆🏆@AlexZverev marks his 28th with a dominant 6-2 6-4 display against Shelton to seal another home-soil triumph! 🇩🇪@BMWOpen500 | #BMWOpen pic.twitter.com/l71bkWMmJa

Having also won back-to-back titles in Munich in 2017-18, Zverev equalled countryman Philipp Kohlschreiber's tournament-record tally of three titles. The 28-year-old also ensured that the tournament's first edition as an ATP 500 event concluded with a German champion, marking Zverev's sixth crown on home soil.

Since reaching his third major final at the Australian Open in January, Zverev went 6-6 on the ATP Tour entering Munich, including opening-round defeats in Indian Wells and Monte-Carlo, where he was the top seed. Yet the German has turned his form around with a confident week in Munich.



Shelton appeared nervy on serve in the opening set, highlighted by two untimely double faults, which came facing break point in the first and seventh games. In contrast, Zverev exuded confidence behind his first delivery, from which he dropped just three of 19 points, according to Infosys ATP Stats.

Supported by a boisterous capacity crowd in Munich, which included Bayern Munich football star Thomas Muller, Zverev continued to command the baseline with ease in the second set. He opened with another break and did not look back en route to winning his ninth ATP Tour title on clay.

“I definitely knew I had to play my best tennis today, Ben has been playing extremely well this week,” added Zverev. “The conditions suit him extremely well, it's very hot and very fast. They suit me as well, to be fair. I enjoyed my birthday so far.”







By improving to 2-0 in his Lexus ATP Head2Head series with Shelton, Zverev secured his sixth ATP 500 title. The No. 3 in the PIF ATP Rankings also has the opportunity to reclaim the World No. 2 spot from Carlos Alcaraz if the Spaniard falls to Holger Rune in the Barcelona final.
Zverev's ATP 500 Titles





 Tournament 
 Years


 Washington
 2017, 2018


 Acapulco 
 2021


 Vienna
 2021


 Hamburg 
 2023


 Munich 
 2025



With his run to a fourth ATP Tour final, Shelton is up to No. 13 in the PIF ATP Live Rankings, just one shy of his career high. The 22-year-old became the first American to reach a clay final above ATP 250 level since Andre Agassi won the 2002 Masters 1000 in Rome, but was unable to contain Zverev, who was relentless throughout Sunday's 71-minute clash.
“I feel really blessed to play in front of you all on Easter Sunday, it's really special for me,” said Shelton during the trophy presentation. “Happy Birthday Sascha, I didn't know that [it was your birthday]. If I did, I would have said it was a birthday gift… I was trying as hard as I could to return your serves today, but I couldn't make it work.”
 




Read More News
View All News 
















View Related Videos
View All Videos 
























By improving to 2-0 in his Lexus ATP Head2Head series with Shelton, Zverev secured his sixth ATP 500 title. The No. 3 in the PIF ATP Rankings also has the opportunity to reclaim the World No. 2 spot from Carlos Alcaraz if the Spaniard falls to Holger Rune in the Barcelona final.

Zverev's ATP 500 Titles




With his run to a fourth ATP Tour final, Shelton is up to No. 13 in the PIF ATP Live Rankings, just one shy of his career high. The 22-year-old became the first American to reach a clay final above ATP 250 level since Andre Agassi won the 2002 Masters 1000 in Rome, but was unable to contain Zverev, who was relentless throughout Sunday's 71-minute clash.

“I feel really blessed to play in front of you all on Easter Sunday, it's really special for me,” said Shelton during the trophy presentation. “Happy Birthday Sascha, I didn't know that [it was your birthday]. If I did, I would have said it was a birthday gift… I was trying as hard as I could to return your serves today, but I couldn't make it work.”

 

© Copyright 1994 - 2024 ATP Tour, Inc. All Rights Reserved. No part of this site may be reproduced, stored in a retrieval system or transmitted in any way or by any means (including photocopying, recording or storing it in any medium by electronic means), without the written permission of ATP Tour, Inc.. Terms & Conditions | Privacy  | Community Social Media Policy | Modern Slavery Statement | Feedback  | Cookies  | Your Privacy Choices  ","{'href': 'https://www.atptour.com', 'title': 'ATP Tour'}","tennis"
"https://news.google.com/rss/search?q=atp+tennis","Highlights: Zverev defeats Shelton for third Munich title","https://www.atptour.com/en/video/highlights-zverev-defeats-shelton-for-third-munich-title","Sun, 20 Apr 2025 13:26:40 GMT","

No matching videos found. Please use different search term.

© Copyright 1994 - 2024 ATP Tour, Inc. All Rights Reserved. No part of this site may be reproduced, stored in a retrieval system or transmitted in any way or by any means (including photocopying, recording or storing it in any medium by electronic means), without the written permission of ATP Tour, Inc.. Terms & Conditions | Privacy  | Community Social Media Policy | Modern Slavery Statement | Feedback  | Cookies  | Your Privacy Choices  ","{'href': 'https://www.atptour.com', 'title': 'ATP Tour'}","tennis"
"https://news.google.com/rss/search?q=wimbledon+tennis","I beat Serena at Wimbledon but now I'm world No. 257 with no major win since","https://talksport.com/tennis/2939999/serena-williams-last-wimbledon-loss-harmony-tan-grand-slams/","Sun, 20 Apr 2025 13:26:41 GMT","





Serena Williams didn't get her fairy-tale ending at Wimbledon. 

The 23-time Grand Slam champion lost in the first round at SW19 in 2022 to a player ranked outside the top 100 in what would be her last match at Wimbledon. 

Williams is considerd by many to be the most succesful female tennis player of all-time.

She enjoyed a highly successful career with 39 major titles across singles, doubles, and mixed doubles.

Along with four Olympic gold medals, the now-retired 43-year-old is widely regarded as the best women's tennis player of all time.

Williams' grip on tennis during her plays days also extended to Wimbledon, the grass-court Grand Slam where she won seven singles titles. 

However, in 2022, during her final year on tour before retirement, Williams was humbly eliminated in the first round to Harmony Tan, a little-known Frenchwoman.

Tan is a Paris native with Cambodian and Vietnamese parents. Her win was a full-circle moment as she said she often watched Williams growing up.

The 27-year-old turned professional when she was just 14 and this was her first match against Williams.

It was the first-time she'd ever played someone as accomplished as the 73-time WTA title winner, and she did the unthinkable.

“I'm really surprised today,” Tan said of her win in the on-court interview at the time.

Williams, who was ranked 1,204th in the world at the time of her loss, ended her career later that year.

It was expected Tan, who was 24 a the time, would kick on after that career-win and enjoy a steady rise in tennis.

That was not the case, however, despite breaking into the top 100 with her win against Williams.

In fact, Tan would never get a victory at another Grand Slam again.

The 27-year-old's career now sees her play in more ITF competitions than Grand Slams.

Being ranked world No. 257, she does not have enough ranking points to play at most WTA events.

While Tan has won three ITF titles, the Frenchwoman has not won a single tour-level title  in her career and has failed to qualify for a Grand Slam in three years.

Her last major match was a 2022 first-round loss to Bianca Andreescu at the US Open.

Tan's career prize money has also taken a significant dip. In 2022 at the time of her Wimbledon win over Williams, she earned $624,000.

While in 2023, Tan earned just $91,406 and in 2024 this was $132,985.

So far in 2025, the former world No.90 has won $5,679.

Tan's career demonstrates the brutal reality of tennis, from riding the highs of Grand Slam wins to playing ITF tournaments in front of half a dozen people.

Tennis has no protections for the revenue of players and while rankings can be protected for injuries, once a player's career starts to tail off, their income suffers a similar fate.

© 2025 talkSPORT Limited
Registered in England No. 2806093. Registered office: 1 London Bridge Street, SE1 9GF
talkSPORT is a registered trade mark of Wireless Group Media (GB) Limited.
This service is provided on talkSPORT Limited's Terms of Use in accordance with our Privacy & Cookie Policy.","{'href': 'https://talksport.com', 'title': 'talkSPORT'}","tennis"
"https://news.google.com/rss/search?q=wimbledon+tennis","Wimbledon star met boyfriend in coffee shop after crashing out of tournament","https://www.express.co.uk/sport/tennis/2041883/Wimbledon-star-boyfriend-Danielle-Collins","Sun, 20 Apr 2025 05:00:00 GMT","



Danielle Collins has opened up about her romantic encounter with her partner in a London coffee shop following an early exit from Wimbledon. The world No. 32 enjoyed her best run at SW19 last year, reaching the second week. But one of her past disappointing losses had a silver lining when her love life took a positive turn, and she's still going strong with her beau.

The American recently reached the quarter-final in Charleston, where she was the defending champion after lifting the trophy in 2024. During her title run last year, her boyfriend Bryan Kipp was spotted cheering her on from the stands and came to the court for her victory photoshoot.

In a candid chat with the Tennis Channel, Collins shared that her partner Bryan had made the journey to North Carolina to support her and recounted their serendipitous meeting.

""He's had a really busy work week,"" she said. ""We have been going out for a while now. We met at a coffee shop in London so that was pretty exciting. I didn't think I would meet someone at a coffee shop.

""Who would have thought? Just after the tournament, Wimbledon. He didn't know anything about tennis, and he didn't know I was a tennis player, which was really nice.

""He was actually a bigger fan of golf and so he said, 'Well I really like golf. I don't really know much about tennis'. And I was like, 'Yes! That's so exciting'.



""It's fun to kind of be around someone that has interests in other things and that's not as familiar with the sport because you get to learn and grow with them and help them.""

Collins planned to retire at the end of the 2024 season and went on an incredible farewell run, winning the WTA 1000 in Miami before her Charleston title sweep.

The world No. 32 had been looking forward to spending time with her loved ones in retirement. But she made a U-turn on her decision late last year.

We use your sign-up to provide content in ways you've consented to and to improve our understanding of you. This may include adverts from us and 3rd parties based on our understanding. You can unsubscribe at any time. Read our Privacy Policy

""We haven't had a lot of time on the court for me to like teach him because we just don't find enough time cause we're doing golf and he's also at my matches a lot and he's working,"" Collins continued.

""But in the future, I'm hoping we'll play like the husband-wife doubles like the USTA, you play for the 'Gold Ball'.

""I explained to him that this is a big deal in the tennis world so hopefully that doesn't tear us apart. He is very competitive. He was a football player at Columbia. Very smart. Engineer major. So, I'm more kind of like the jock in the relationship, and he's definitely more of the cerebral one.""

TODAY'S PAPER

 Sunday, 20th April 2025See today's front and back pages, download the newspaper, order back issues and use the historic Daily Express newspaper archive.

CONNECT WITH US



Would you like to receive news notifications from Daily Express?","{'href': 'https://www.express.co.uk', 'title': 'Daily Express'}","tennis"
"https://news.google.com/rss/search?q=site:atptour.com","Andre Ilagan (USA) Vs Christian Langmo (USA)","https://www.atptour.com/en/atp-challenger-tour/challenger-tv/challenger-tv-search-results/2025-7490-qs027-gwangju-andre-ilagan-vs-christian-langmo/2025/7490/all","Sun, 20 Apr 2025 03:33:14 GMT","







{{item.CourtName}}

© Copyright 1994 - 2024 ATP Tour, Inc. All Rights Reserved. No part of this site may be reproduced, stored in a retrieval system or transmitted in any way or by any means (including photocopying, recording or storing it in any medium by electronic means), without the written permission of ATP Tour, Inc.. Terms & Conditions | Privacy  | Community Social Media Policy | Modern Slavery Statement | Feedback  | Cookies  | Your Privacy Choices  ","{'href': 'https://www.atptour.com', 'title': 'ATP Tour'}","tennis"
"https://news.google.com/rss/search?q=site:atptour.com","Zverev surges past Shelton, completes Munich hat-trick","https://www.atptour.com/en/news/zverev-shelton-munich-2025-final","Sun, 20 Apr 2025 12:58:15 GMT","

Alexander Zverev celebrated his 28th birthday in style on Sunday at the BMW Open by Bitpanda, where he soared to a record-equalling third Munich title.

The home favourite produced an assured performance to defeat second seed Ben Shelton 6-2, 6-4 and claim his 24th tour-level trophy. Zverev was imperious on serve throughout the championship match, in which he did not face a break point, according to Infosys ATP Stats.

“It's extremely special, I always love winning tournaments in Germany,” said Zverev, who earned his first title of the season. “It's probably the most special thing I can do. It's definitely a great birthday present, let's put it that way.”

BIRTHDAY BOY COMPLETES THE HATTRICK 🏆🏆🏆@AlexZverev marks his 28th with a dominant 6-2 6-4 display against Shelton to seal another home-soil triumph! 🇩🇪@BMWOpen500 | #BMWOpen pic.twitter.com/l71bkWMmJa

Having also won back-to-back titles in Munich in 2017-18, Zverev equalled countryman Philipp Kohlschreiber's tournament-record tally of three titles. The 28-year-old also ensured that the tournament's first edition as an ATP 500 event concluded with a German champion, marking Zverev's sixth crown on home soil.

Since reaching his third major final at the Australian Open in January, Zverev went 6-6 on the ATP Tour entering Munich, including opening-round defeats in Indian Wells and Monte-Carlo, where he was the top seed. Yet the German has turned his form around with a confident week in Munich.



Shelton appeared nervy on serve in the opening set, highlighted by two untimely double faults, which came facing break point in the first and seventh games. In contrast, Zverev exuded confidence behind his first delivery, from which he dropped just three of 19 points, according to Infosys ATP Stats.

Supported by a boisterous capacity crowd in Munich, which included Bayern Munich football star Thomas Muller, Zverev continued to command the baseline with ease in the second set. He opened with another break and did not look back en route to winning his ninth ATP Tour title on clay.

“I definitely knew I had to play my best tennis today, Ben has been playing extremely well this week,” added Zverev. “The conditions suit him extremely well, it's very hot and very fast. They suit me as well, to be fair. I enjoyed my birthday so far.”







By improving to 2-0 in his Lexus ATP Head2Head series with Shelton, Zverev secured his sixth ATP 500 title. The No. 3 in the PIF ATP Rankings also has the opportunity to reclaim the World No. 2 spot from Carlos Alcaraz if the Spaniard falls to Holger Rune in the Barcelona final.
Zverev's ATP 500 Titles





 Tournament 
 Years


 Washington
 2017, 2018


 Acapulco 
 2021


 Vienna
 2021


 Hamburg 
 2023


 Munich 
 2025



With his run to a fourth ATP Tour final, Shelton is up to No. 13 in the PIF ATP Live Rankings, just one shy of his career high. The 22-year-old became the first American to reach a clay final above ATP 250 level since Andre Agassi won the 2002 Masters 1000 in Rome, but was unable to contain Zverev, who was relentless throughout Sunday's 71-minute clash.
“I feel really blessed to play in front of you all on Easter Sunday, it's really special for me,” said Shelton during the trophy presentation. “Happy Birthday Sascha, I didn't know that [it was your birthday]. If I did, I would have said it was a birthday gift… I was trying as hard as I could to return your serves today, but I couldn't make it work.”
 




Read More News
View All News 
















View Related Videos
View All Videos 
























By improving to 2-0 in his Lexus ATP Head2Head series with Shelton, Zverev secured his sixth ATP 500 title. The No. 3 in the PIF ATP Rankings also has the opportunity to reclaim the World No. 2 spot from Carlos Alcaraz if the Spaniard falls to Holger Rune in the Barcelona final.

Zverev's ATP 500 Titles




With his run to a fourth ATP Tour final, Shelton is up to No. 13 in the PIF ATP Live Rankings, just one shy of his career high. The 22-year-old became the first American to reach a clay final above ATP 250 level since Andre Agassi won the 2002 Masters 1000 in Rome, but was unable to contain Zverev, who was relentless throughout Sunday's 71-minute clash.

“I feel really blessed to play in front of you all on Easter Sunday, it's really special for me,” said Shelton during the trophy presentation. “Happy Birthday Sascha, I didn't know that [it was your birthday]. If I did, I would have said it was a birthday gift… I was trying as hard as I could to return your serves today, but I couldn't make it work.”

 

© Copyright 1994 - 2024 ATP Tour, Inc. All Rights Reserved. No part of this site may be reproduced, stored in a retrieval system or transmitted in any way or by any means (including photocopying, recording or storing it in any medium by electronic means), without the written permission of ATP Tour, Inc.. Terms & Conditions | Privacy  | Community Social Media Policy | Modern Slavery Statement | Feedback  | Cookies  | Your Privacy Choices  ","{'href': 'https://www.atptour.com', 'title': 'ATP Tour'}","tennis"
