"Input URL","Title","Link","Published","Description","Source","Category"
"https://news.google.com/rss/search?q=world+news+site:theglobeandmail.com","Bank of Canada holds steady, Hudson's Bay to auction off artifacts and U.S. puts drug tariffs on the table: Must-read business and investing stories","https://www.theglobeandmail.com/business/article-bank-of-canada-hudsons-bay-auction-drug-tariffs-april-20/","Sun, 20 Apr 2025 13:00:00 GMT","

An employee does a quality control check on an assembly line of generic drugs at Pharmascience manufacturing facility in Montreal on December 8, 2022.Christinne Muschi/The Globe and Mail

Getting caught up on a week that got away? Here's your weekly digest of the Globe's most essential business and investing stories, with insights and analysis from the pros, stock tips, portfolio strategies and more.

An employee checks packaged generic drugs before boxing them on an assembly line at Pharmascience manufacturing facility in Montreal, Quebec December 8, 2022.   (Christinne Muschi /The Globe and Mail)Christinne Muschi/The Globe and Mail

The Trump administration opened an investigation into the entire pharmaceutical supply chain this week, a move that threatens to widen potential tariffs on prescription drugs. The U.S. Department of Commerce filed notice Monday that it would examine U.S. imports of pharmaceuticals and pharmaceutical ingredients. The notice's inclusion of pharmaceutical ingredients means that the more than $7-billion worth of Canadian pharmaceutical exports to the U.S. could be hit by tariffs. Chris Hannay and Irene Galea report that generic companies are likely to be hit hard, and Canada is home to some major generic drugmakers, including Apotex and Pharmascience. Meanwhile, on the other hand, the White House and Florida's state government are promoting the importation of Canadian medication as a way to lower drug costs. 

Bank of Canada Governor Tiff Macklem participates in a news conference in Ottawa, on Wednesday, April 16, 2025.Justin Tang/The Canadian Press

The Bank of Canada decided to hit pause on its almost year-long monetary policy-easing campaign this week, leaving its benchmark interest rate unchanged at 2.75 per cent. This move follows seven consecutive cuts, as Mark Rendell reports, which have lowered mortgage rates and other Canadian borrowing costs considerably since last summer. Governor Tiff Macklem said the central bank decided to give itself time to assess the fallout from Trump's erratic and destabilizing trade war and it needs to “proceed carefully.” The Bank of Canada also decided to forgo its usual forecast in its quarterly Monetary Policy Report, but outlined two possible scenarios. The downside scenario sees Canada entering a recession this year and inflation rising above 3 per cent. Mr. Macklem also added that he and his team are “prepared to act decisively if incoming information points clearly in one direction.” The next rate decision is scheduled for June 4.

As Canadians continue to cancel trips to the United States, one of the big beneficiaries appears to be restaurants here at home. Jason Kirby reports that the number of reservations at Canadian restaurants has grown more than 20 per cent so far in April compared to last year. It seems that Canadian travellers are saving money from the boycott and choosing to spend more at local restaurants – a bright spot in an otherwise gloomy consumer economy. Take a closer look at the numbers in this week's Decoder series.

 

A shopper walks past an empty sales area at the flagship downtown Hudson's Bay store, in Vancouver, on March 24.DARRYL DYCK/The Canadian Press

As Hudson's Bay Co. continues to liquidate its operation, many employees are raising the alarm about long-term disability payments. Susan Krashinsky Robertson reports that the payments, which are paid out of the company's cash and are uninsured, are leaving people at risk of losing their benefits. According to a law firm representing some employees, Hudson's Bay's benefit policy provides long-term disability payments through an “administrative services only” [ASO] arrangement, which is not insured – meaning, if the retailer is unable to come up with a plan to keep some of its stores afloat, or if a new owner steps in, those benefits could disappear. The retailer also announced it intends to auction off historically significant artifacts it still owns, including its 1670 charter that played a pivotal role in the history of Canada.

Ashley Chapman, the chief operating officer with Chapmans' Ice Cream is photographed in the company's dry warehouse in Markdale, Ont. on April 15, 2025. Because of the tariff issue, Chapman's has been stockpiling items such as sugar cones; containers and plastic wrappers.Fred Lum/The Globe and Mail

Many Canadian business owners across the country have been purchasing heaps of excess inventory from both the United States and elsewhere around the globe in preparation for U.S. tariffs on Canada, among other global trade partners, and for Canada's counterlevies. But with U.S. President Donald Trump regularly shifting course on tariffs – and Canada largely spared in the latest round of sweeping levies announced on April 2, which ranged from 10 to more than 100 per cent – the strategy involves significant risk. Mariya Postelnyak spoke to businesses that are in prepper mode, and how they've embraced stockpiling as a buffer against potential disruption in the trade of supplies and finished goods.



d. Bank of Canada Governor Tiff Macklem. In an era dominated by U.S. President Donald Trump's capricious moods, even experts are in the dark. Mr. Macklem was frank about the overwhelming lack of visibility as he announced the Bank of Canada's decision to hold its policy rate steady at 2.75 per cent.

Get the rest of the questions from the weekly business and investing news quiz here, and prepare for the week ahead with The Globe's investing calendar.

Report an editorial error

Report a technical issue

Editorial code of conduct

Authors and topics you follow will be added to your personal news feed in Following.

© Copyright 2025 The Globe and Mail Inc. All rights reserved.

Andrew Saunders, President and CEO","{'href': 'https://www.theglobeandmail.com', 'title': 'The Globe and Mail'}","world"
"https://news.google.com/rss/search?q=world+news+site:dw.com","Nigeria: Death toll rises sharply in attacks in Benue state","https://www.dw.com/en/nigeria-death-toll-rises-sharply-in-attacks-in-benue-state/a-72290647","Sun, 20 Apr 2025 00:08:08 GMT","

At least 56 people were killed in attacks in Nigeria's central Benue state, sharply revising a previous toll of 17.

The death toll in attacks in Benue state in central Nigeria has risen to 56. 

Benue state Governor Hyacinth Alia cited the figure Saturday while visiting two villages that were attacked by gunmen on Thursday night 17 April, 2025, into Friday.

Police had earlier said 17 people were killed.

The governor said there was the possibility of the figure increasing because the search was still ongoing. 

This is the latest flare-up of intercommunal violence to hit central Nigeria, known as the Middle Belt, in recent weeks.

In a separate incident earlier in the week, 11 people were killed by armed attackers in the Otukpo area of Benue. 

In nearby north central Plateau state, two attacks in under two weeks left more than 100 people dead. Homes were razed and looted, according to Amnesty International, and hundreds of people were displaced.

Governor Alia blamed the attacks in Benue State's Ukum and Logo local government areas on ""suspected herdsmen.""

Clashes between the nomadic cattle herders and settled farmers over land use have become increasingly common in central Nigeria.

The attacks often take on a religious dimension; farmers are often Christian and the herders mostly Muslim Fulani. 

Overgrazing, drought, and desertification, which are worsened by climate change, have made large areas of Nigeria's north unproductive.

This drives the herders to seek grazing lands in the country's more fertile south. 

The resulting land disputes often descend into deadly violence, especially in rural areas where law enforcement is largely absent.

Amnesty International has sharply criticized the Nigerian government of President Bola Tinubu for failing to stem the violence and leaving communities ""at the mercy of rampaging gunmen.""

Edited by: Louis Oelofse","{'href': 'https://www.dw.com', 'title': 'DW'}","world"
"https://news.google.com/rss/search?q=world+news+site:dw.com","US deportations to El Salvador test legal limits","https://www.dw.com/en/us-deportations-to-el-salvador-test-legal-limits/a-72289913","Sun, 20 Apr 2025 10:19:06 GMT","

As court disputes heat up over the Trump administration's deportations of alleged criminal migrants to El Salvador, legal experts tell DW what's at stake for both detainees and the rule of law.

Ever since Donald Trump took office in January, migrants entering the United States have increasingly feared the threat of deportation. Now this threat has taken on a new dimension: the possibility of ending up in a high-security prison in El Salvador.

Since March, Trump's government has deported a total of 271 Salvadoran and Venezuelan migrants from the US to the CECOT megaprison in El Salvador. Washington claims that the deportees belong to criminal organizations, but has provided no evidence.

Instead, relatives and human rights organizations warn that innocent people with no criminal records have been deported. The most symbolic case is that of the Salvadoran Kilmar Abrego Garcia, who Washington has acknowledged was deported because of a ""procedural error.""

US media reported that Abrego Garcia entered the country illegally in 2011 as a teenager fleeing gang violence. Although his asylum application was rejected in 2019, he was granted a work permit and protection from deportation due to the threat of persecution. Nevertheless, the 29-year-old father of three was arrested in mid-March and deported shortly afterwards.

Washington now claims that Abrego Garcia is a member of the notorious MS-13 gang. His lawyers deny this.

Both Trump and Salvadoran President Nayib Bukele have refused to return Abrego Garcia to the US. Trump has also ignored a corresponding order from the US Supreme Court.

Instead, the US president is publicly toying with the idea of having US citizens imprisoned in CECOT.

CECOT, which translates as ""Center for the Containment of Terrorism,"" is the largest high-security prison in Latin America. It opened in January 2023 and has space for 40,000 inmates.

To view this video please enable JavaScript, and consider upgrading to a web browser that supports HTML5 video

Ana Maria Mendez Dardon, director for Central America at the Washington Office on Latin America says that the identity and whereabouts of those deported from the US since March are currently unknown. It is therefore unclear whether they are actually being held in CECOT or in another Salvadoran prison.

""Without knowing their identity, it is difficult to verify whether they really have a criminal record. That's why eight US congressmen sent a letter to Secretary of State Rubio in the midst of this serious human rights crisis, asking him to inform Congress about the details of the agreement"" between the US and El Salvador, Dardon told DW.

""The agreement has not been made public, which is a serious violation of the principles of transparency and accountability,"" Irene Cuellar, researcher on Central America for Amnesty International, told DW. ""However, press reports indicate that the US is transferring $6 million to the Salvadoran government for one year for the detention of these people.""

She described what she called an ""enforced disappearance"" of the deportees because they have been granted neither contact with their families nor access to legal counsel.

In her opinion, the pact ""opens the door to normalizing institutional violence as an instrument of migration management and foreign policy."" Furthermore, ""it directly attacks the fundamental pillars of any democracy: The presumption of innocence, due process and the absolute prohibition of arbitrary detention.""

Deporting people from the US to then hold them in a Central American prison ""is completely illegal and unprecedented,"" said Salvadoran lawyer Leonor Arteaga Rubio, program director at the Due Process of Law Foundation.

""In a democracy, the court should order the immediate release of these people. But in El Salvador there is no independence of powers. The court does what Bukele wants,"" she said, adding that ""no democracy should support such a model, let alone emulate it.""

To view this video please enable JavaScript, and consider upgrading to a web browser that supports HTML5 video

Still, Arteaga Rubio predicts that the agreement will hold. Both Trump and Bukele want to send the message ""that anyone who is considered an enemy of Trump can be sent to Bukele's prison, which functions like a black hole, a new Guantanamo from which there is no way out,"" she said. In El Salvador, no judge could put a stop to this, she added. ""The law in this prison is Bukele's, with Trump's full support.""

It remains uncertain how the legal tug-of-war over Kilmar Abrego Garcia will end. The Trump administration has refused to take steps to repatriate the Salvadoran and continues to accuse the 29-year-old of being a criminal gang member without providing any evidence.

""Why is the government of El Salvador continuing to imprison a man where they have no evidence that he's committed any crime and they have not been provided any evidence from the United States that he has committed any crime?"" Democratic senator Chris Van Hollen, who is from Abrego Garcia's home state of Maryland, asked reporters after a meeting with the prisoner in El Salvador.

With US media casting doubt on the alleged criminal past of other migrants who have been deported to CECOT, Van Hollen accused the Trump administration of lying, and criticized their disregard of judicial orders.

There is a risk that neither Salvadoran nor US courts will decide the fate of the deportees, which could depend instead on the ""political will"" of the authorities involved, said Roberto Lopez Salazar, coordinator of the Observatory of Human Rights at the Jose Simeon Canas Central American University in El Salvador. Lopez Salazar believes that international pressure is needed to ensure that the case does not remain in a state of legal limbo or end in impunity.

Irene Cuellar took her concerns a step further: ""As long as there are no real political or legal consequences, there is a growing risk that this model of migration control policy will be exported to other countries.""

This article was originally written in German.","{'href': 'https://www.dw.com', 'title': 'DW'}","world"
