Input URL,Title,Link,Published,Description,Source
https://news.google.com/rss/search?q=tennis+news,Alexander Zverev 'Robbed' Against Carlos Alcaraz as Tennis Fans Condemn Brute Injustice at French Open,https://www.essentiallysports.com/atp-tennis-news-alexander-zverev-robbed-against-carlos-alcaraz-as-tennis-fans-condemn-brute-injustice-at-french-open/,"Sun, 09 Jun 2024 17:29:00 GMT",Alexander Zverev 'Robbed' Against Carlos Alcaraz as Tennis Fans Condemn Brute Injustice at French Open,"{'href': 'https://www.essentiallysports.com', 'title': 'EssentiallySports'}"
https://news.google.com/rss/search?q=tennis+news,Most Grand Slam titles by active tennis players; Iga Swiatek jumps to 4th place,https://www.indiatvnews.com/web-stories/sports/most-grand-slam-titles-by-active-tennis-players-iga-swiatek-jumps-to-4th-place-2024-06-09-936012,"Sun, 09 Jun 2024 10:01:29 GMT",Most Grand Slam titles by active tennis players; Iga Swiatek jumps to 4th place,"{'href': 'https://www.indiatvnews.com', 'title': 'India TV News'}"
https://news.google.com/rss/search?q=tennis+news,Boris Becker praises “perfect” Swiatek making an important comparison,https://tennistonic.com/tennis-news/721653/boris-becker-praises-perfect-swiatek-making-an-important-comparison/,"Sun, 09 Jun 2024 07:50:20 GMT",Boris Becker praises “perfect” Swiatek making an important comparison,"{'href': 'https://tennistonic.com', 'title': 'Tennis Tonic'}"
https://news.google.com/rss/search?q=tennis+news,French Open news: Alexander Zverev accused of cheating as Alcaraz shows class to Sinner,https://www.express.co.uk/sport/tennis/1908308/French-Open-news-LIVE-Alexander-Zverev-Coco-Gauff-Carlos-Alcaraz-Jannik-Sinner,"Sun, 09 Jun 2024 07:13:00 GMT",French Open news: Alexander Zverev accused of cheating as Alcaraz shows class to Sinner,"{'href': 'https://www.express.co.uk', 'title': 'Express'}"
https://news.google.com/rss/search?q=tennis+news,Carlos Alcaraz wins French Open as he comes from behind to beat Alexander Zverev in epic,https://www.express.co.uk/sport/tennis/1909113/Carlos-Alcaraz-Alexander-Zverev-French-Open-Roland-Garros,"Sun, 09 Jun 2024 17:31:00 GMT",Carlos Alcaraz wins French Open as he comes from behind to beat Alexander Zverev in epic,"{'href': 'https://www.express.co.uk', 'title': 'Express'}"
https://news.google.com/rss/search?q=tennis+news,Mirra Andreeva cracks up tennis fans with Andy Murray post after French Open loss,https://www.express.co.uk/sport/tennis/1909059/Mirra-Andreeva-Andy-Murray-French-Open,"Sun, 09 Jun 2024 12:13:00 GMT",Mirra Andreeva cracks up tennis fans with Andy Murray post after French Open loss,"{'href': 'https://www.express.co.uk', 'title': 'Express'}"
https://news.google.com/rss/search?q=tennis+news,Participation in the Asia Pacific Padel Tour record set in Bali,https://tennistonic.com/tennis-news/721730/participation-in-the-asia-pacific-padel-tour-record-set-in-bali/,"Sun, 09 Jun 2024 13:07:01 GMT",Participation in the Asia Pacific Padel Tour record set in Bali,"{'href': 'https://tennistonic.com', 'title': 'Tennis Tonic'}"
https://news.google.com/rss/search?q=tennis+news,French Open: Director Amelie Mauresmo Explains The Strategy To Fill Empty Seats In Stadium,https://www.outlookindia.com/sports/tennis/french-open-2024-director-amelie-mauresmo-explains-the-strategy-to-fill-empty-seats-in-stadium-at-roland-garros,"Sun, 09 Jun 2024 13:48:34 GMT",French Open: Director Amelie Mauresmo Explains The Strategy To Fill Empty Seats In Stadium,"{'href': 'https://www.outlookindia.com', 'title': 'Outlook India'}"
https://news.google.com/rss/search?q=tennis+news,Who are Alexander Zverev's parents? Former pros Alexander Zverev Sr. and Irina Zvereva coached their tennis playing ...,https://www.tennis365.com/news/who-are-alexander-zverevs-parents-former-pros-alexander-zverev-sr-irina-zvereva-coached-sons,"Sun, 09 Jun 2024 08:00:08 GMT",Who are Alexander Zverev's parents? Former pros Alexander Zverev Sr. and Irina Zvereva coached their tennis playing ...,"{'href': 'https://www.tennis365.com', 'title': 'Tennis365'}"
https://news.google.com/rss/search?q=tennis+news,"« We didn't know how she was going to react,» Maciej Ryszczuk built Iga Swiatek's body to support her mind",https://www.tennismajors.com/wta-tour-news/we-didnt-know-how-she-was-going-to-react-maciej-ryszczuk-built-iga-swiateks-body-to-support-her-mind-766878.html,"Sun, 09 Jun 2024 09:06:15 GMT","« We didn't know how she was going to react,» Maciej Ryszczuk built Iga Swiatek's body to support her mind","{'href': 'https://www.tennismajors.com', 'title': 'Tennis Majors'}"
https://news.google.com/rss/search?q=tennis+news,Did Alexander Zverev Ditch Spanish Tennis Legend for His Father? Here's Everything to Know of His Infamous ...,https://www.essentiallysports.com/atp-tennis-news-did-alexander-zverev-ditch-spanish-tennis-legend-for-his-father-heres-everything-to-know-of-his-infamous-coaching-changes/,"Sun, 09 Jun 2024 07:37:00 GMT",Did Alexander Zverev Ditch Spanish Tennis Legend for His Father? Here's Everything to Know of His Infamous ...,"{'href': 'https://www.essentiallysports.com', 'title': 'EssentiallySports'}"
https://news.google.com/rss/search?q=tennis+news,Serena Williams' ex-coach nailed Iga Swiatek French Open prediction,https://www.express.co.uk/sport/tennis/1909073/Iga-Swiatek-French-Open-Serena-Williams-coach-Rennae-Stubbs,"Sun, 09 Jun 2024 13:16:00 GMT",Serena Williams' ex-coach nailed Iga Swiatek French Open prediction,"{'href': 'https://www.express.co.uk', 'title': 'Express'}"
https://news.google.com/rss/search?q=tennis+news,Why Emma Raducanu has plausibly split with boyfriend Carlo Agostinelli,https://tennistonic.com/tennis-news/721738/why-emma-raducanu-has-plausibly-split-with-boyfriend-carlo-agostinelli/,"Sun, 09 Jun 2024 10:55:40 GMT",Why Emma Raducanu has plausibly split with boyfriend Carlo Agostinelli,"{'href': 'https://tennistonic.com', 'title': 'Tennis Tonic'}"
https://news.google.com/rss/search?q=tennis+news,'No miracle solutions' to sparse French Open crowds: Amelie Mauresmo,https://timesofindia.indiatimes.com/sports/tennis/french-open/no-miracle-solutions-to-sparse-french-open-crowds-amelie-mauresmo/articleshow/110846896.cms,"Sun, 09 Jun 2024 14:14:00 GMT",'No miracle solutions' to sparse French Open crowds: Amelie Mauresmo,"{'href': 'https://timesofindia.indiatimes.com', 'title': 'The Times of India'}"
https://news.google.com/rss/search?q=tennis+news,French Open chief addresses claims Grand Slam is sexist and responds to Novak Djokovic,https://www.express.co.uk/sport/tennis/1909087/French-Open-Novak-Djokovic-tennis-news,"Sun, 09 Jun 2024 14:07:00 GMT",French Open chief addresses claims Grand Slam is sexist and responds to Novak Djokovic,"{'href': 'https://www.express.co.uk', 'title': 'Express'}"
https://news.google.com/rss/search?q=tennis+news,'Last-minute' pair Gauff and Siniakova win French Open doubles title,https://www.wtatennis.com/news/4035455/-last-minute-pair-gauff-and-siniakova-win-french-open-doubles-title,"Sun, 09 Jun 2024 11:41:49 GMT",'Last-minute' pair Gauff and Siniakova win French Open doubles title,"{'href': 'https://www.wtatennis.com', 'title': 'WTA Tennis'}"
