Input URL,Title,Link,Published,Description,Source
https://news-medical.net,FGFR2 identified as key driver in KRAS-mutated pancreatic cancer progression,https://news-medical.net/news/20250402/FGFR2-identified-as-key-driver-in-KRAS-mutated-pancreatic-cancer-progression.aspx,"Wed, 02 Apr 2025 00:00:00 GMT","Bottom line: Precancerous pancreatic lesions and some pancreatic ductal adenocarcinoma (PDAC) tumors harboring KRAS mutations had higher-than-normal expression of the FGFR2 protein, and FGFR2 inactivation delayed KRAS-mutated PDAC development in mice.

Journal in which the study was published: Cancer Research, a journal of the American Association for Cancer Research

Author: Claudia Tonelli, PhD, a research investigator in the laboratory of AACR Past President David A. Tuveson, MD, PhD, FAACR, at Cold Spring Harbor Laboratory

Background: PDAC is the most common type of pancreatic cancer, a highly lethal malignancy that is often preceded by precancerous lesions. These lesions are relatively common, but only a small portion will progress to PDAC, Tonelli explained.

While mutations in the KRAS protein are known to drive pancreatic cancer, these do not appear to be sufficient to promote the transition from precancerous lesions to cancer, Tonelli noted. ""Understanding the additional pathways that promote progression from a precancerous pancreatic lesion to a malignant tumor could help identify more viable treatment strategies as well as cancer interception approaches to stop PDAC from developing in the first place,"" she added.

How the study was conducted: By analyzing murine and human pancreatic tissue specimens, Tonelli and colleagues found that, compared with normal tissue, FGFR2 expression was higher in KRAS-mutated precancerous lesions and some KRAS-mutated PDAC. Notably, FGFR2 expression in murine precancerous lesions correlated with an increase in mutant KRAS signaling.

""We know that precancerous pancreatic lesions often carry KRAS mutations,"" said Tonelli. ""Our observation that FGFR2 expression was associated with increased KRAS signaling suggests that FGFR2 may play a key role in driving the progression of KRAS-mutated precancerous lesions to malignancy.""

Results: Consistent with this hypothesis, the researchers found significantly fewer precancerous lesions and delayed PDAC tumors formation in KRAS-mutated mice in which the FGFR2 gene had been deleted compared with those with an intact FGFR2 gene. In addition, the combined inhibition of FGFR2 and another signaling protein, EGFR, significantly reduced the formation of precancerous lesions in mice carrying mutated KRAS.

Author's comments: According to Tonelli, the findings suggest that targeting FGFR2 could potentially benefit patients at high risk of their precancerous lesions progressing to PDAC. While FGFR inhibitors are clinically available, Tonelli cautioned that their effectiveness in intercepting PDAC would first need to be tested in clinical trials before they could be used for this purpose.

""Our study provides critical insights into pancreatic cancer development and could guide the development of strategies for the interception and prevention of pancreatic malignancies,"" she summarized.

Study limitations: A limitation of the study is that it did not directly examine whether FGFR2 inactivation in precancerous lesions would also block or delay subsequent PDAC. This could be addressed in future studies by performing long-term FGFR2 inhibition, or alternatively by genetic experiments, Tonelli noted.",news-medical
https://news-medical.net,Blood pressure trajectories during early pregnancy can stratify future hypertension risk,https://news-medical.net/news/20250402/Blood-pressure-trajectories-during-early-pregnancy-can-stratify-future-hypertension-risk.aspx,"Wed, 02 Apr 2025 00:00:00 GMT","NIH-supported study reveals new risk group for future high blood pressure, heart disease.

What

Blood pressure patterns observed in the first half of pregnancy, even among women without hypertensive disorders of pregnancy (HDP), can identify women at greater risk of developing hypertension up to 14 years after giving birth. The new findings are from a large observational study supported by the National Institutes of Health (NIH).

High blood pressure is a risk factor for heart disease, the leading cause of death. This study identified a new, previously undefined risk group of postpartum women who are not currently recognized as being at high risk for future hypertension and cardiovascular disease because they did not develop HDP during pregnancy. HDP includes serious complications such as preeclampsia and gestational hypertension during pregnancy and are known to increase the risk of heart disease later in life. When the history of HDP was combined with women's early pregnancy blood pressure patterns, these data together provide a new and improved tool for risk assessment.

The study followed 174,774 women who received prenatal care at Kaiser Permanente Northern California between 2009 and 2019. None of these women had hypertension, kidney, liver, or heart disease, or a history of preeclampsia before pregnancy. Researchers tracked their health records up to 14 years after delivery to identify new cases of hypertension.

The research found that women who showed certain blood pressure patterns during the first 20 weeks of pregnancy were more likely to develop hypertension later in life. Six distinct risk groups of blood pressure trajectory were identified, ranging from ultra-low to elevated-stable patterns. Women with elevated-stable blood pressure patterns were at the highest risk.

This study shows that blood pressure trajectories during early pregnancy can stratify this risk, even for women without HDP. By identifying women at higher risk, healthcare providers can offer targeted surveillance and early interventions, potentially preventing future heart problems.

Detailed results:

The study showed that these blood pressure patterns could differentiate risk levels among women with and without HDP.

Among groups of women who did not develop HDP, those with higher risk blood pressure patterns — including elevated-stable patterns — during early pregnancy were still 11 times more likely to develop hypertension years later than those women with less risky blood pressure patterns.

Researchers suggest that this previously unrecognized risk group may warrant closer monitoring after pregnancy. Additionally, they suggest that early pregnancy blood pressure trajectories may improve predictions of cardiovascular disease risk in women. The findings appeared in the journal Hypertension.

The study was supported by the National Heart, Lung, and Blood Institute (NHLBI), part of the NIH, through R01 HL145808 and R01 HL145808-02S1.",news-medical
https://news-medical.net,Older adults experience less muscle soreness after exercise,https://news-medical.net/news/20250402/Older-adults-experience-less-muscle-soreness-after-exercise.aspx,"Wed, 02 Apr 2025 00:00:00 GMT","Older Adults Experience Less Muscle Soreness Following Exercise According to Research which Overturns The Widespread Belief that aging muscles are less resilient.

The Study Entitled ""Advancing Age is not Associated With Greater Exercise-Induced Muscle Damage"" is published in the Journal of Ageing and Physical Activity (Japa).

Younger adults were categorized as between 18 to 25 and older adults More than 35 years old.

The Research Co-Autthored by Lancaster University Provides a understanding Analysis of How Ageing Affects Muscle Function, Soreness, and Biochemical Markers of Muscle Damage after Exercise. By Pooling Data from 36 Studies, Researchers Found That Older Adults Do Not Experience Greater Muscle Function Loss after Exercise Compared with Younger Individuals.

One striking Discovery was that muscle soreness was consistently lower in older adults, with discounts of around 34% at 48 hours and 62% at 72 hours compared with younger individuals. Creatine Kinase Levels, An Indicator of Muscle Damage, Were Approximately 28% Lower in Older Adults at 24 Hours Post-Exercise.

The Findings Suggest That, Despite Physiological Changes With Age, Muscle Resilience Remains Relatively Stable, Allowing Older Individuals to Continue Engaging in Regular Physical Activity Without Increased concern for prolonged weakness or loss of fun.

Interestingly, Sex Appeared To Play A Role in Muscle Function Recovery, with Males Showing Slightly Greater Decreases in Muscle Function after Exercise Than Females. There was no observed impact of upper- or low-body or exercise type (resistance training or endurance training) on ​​muscle damers

These findings are meaningful to be their challenge the widespread belief that ageing muscles recover more sweetly or are more prone to exert-induced damage. This misconception often discourage older adults from engaging in regular physical activity due to fears of prolonged soreness or weakness. ""Dr. Lawrence Hayes, Senior Author from Lancaster Medical School

If Older Individuals Experience Less Muscle Damage Symptoms Than Previously Thought, Recovery Strategies, Training Programms, and Post-Excise Care Could be Adjuded Accordly. For Example, Older Adults May Not Require significantly prolonged Recovery Periods Compared With Younger Individuals, Putentiallly Allowing for More Frequent or Intense Training Sessions, Leading to Better Long-Term Health Outcomes.

Overall, this study reinforces the importance of staying active throughout life and dispels myths that ageing Equates to Frailty or Impaired Recovery. These Findings Could Contribute to Greater Participation in Fitness Activities Among Older Adults, Improving Overall Health, Mobility, and Quality of Life in Ageing Populations.

Dr. Hayes Said: ""This Means Exercise has no age limit so move to live along and healthier. Aim for 150 minutes of Activity Each Week, Add Strength Training Twice Per Week, and Most Importerly, Find A Workout You Love. When you are, you are more like.""

The other authors include Dr. John Fernandes from Cardiff Metropolitan University, Dr Laura Wilson from London Sport Institute, Middlesex University, Ms Amelia Dingley from Brunel University, Mr Andrew Hearn from Hartpury University, Dr Kelsie Johnson and Professor Craig Liverpool John Moores University, Dr Kirsty Hicks from Washington Spirit Professional Soccer Team/Northumbria University.",news-medical
https://news-medical.net,Transformative potential of AI to enhance coronary heart disease detection,https://news-medical.net/news/20250402/Transformative-potential-of-AI-to-enhance-coronary-heart-disease-detection.aspx,"Wed, 02 Apr 2025 00:00:00 GMT","Announcing a new article publication for Cardiovascular Innovations and Applications journal. Coronary heart disease (CHD), the most common cause of mortality globally, poses a formidable challenge to modern healthcare systems. Artificial intelligence (AI) is playing an increasingly important role in multiple diagnostic applications of CHD, by facilitating early intervention and personalized treatment.

This article describes the state of the art and provides clinicians with updated insights into the transformative potential of AI to enhance CHD detection. AI can be used to increase diagnostic and prognostic accuracy. However, its reliance on homogeneous numerical data might potentially lead to misdiagnoses and unnecessary radiation exposure in diagnosing CHD. Multimodal data fusion brings new potential for accurate diagnosis and personalized medicine. Unmet challenges and future research directions in ethical, regulatory, and technical aspects are discussed and the article aims to bridge the gap between AI advancements and practical applications in clinical settings, to achieve a future in which AI empowers CHD diagnosis in the context of a modern healthcare ecosystem.",news-medical
https://news-medical.net,Breakthrough research reveals gut-eye connection in vision loss,https://news-medical.net/news/20250402/Breakthrough-research-reveals-gut-eye-connection-in-vision-loss.aspx,"Wed, 02 Apr 2025 00:00:00 GMT","Inherited retinal degeneration (IRD) encompasses various disorders characterized by progressive loss of retinal photoreceptor cells, ultimately leading to vision loss and blindness. Among the numerous genetic factors implicated in IRD, mutations in the CRB1 gene stand out as significant contributors to severe forms of retinal degeneration, including retinitis pigmentosa (RP) and Leber congenital amaurosis (LCA). Recent research has unveiled a novel mechanism linking CRB1 mutations to retinal degeneration through bacterial translocation from the gut to the eye, opening up promising therapeutic avenues.

The CRB1 gene encodes a transmembrane protein crucial for maintaining the integrity of epithelial barriers in both the retina and the colon. In the retina, CRB1 plays a vital role in the structure and function of photoreceptor cells and the blood-retinal barrier (BRB). Recent studies have shown that CRB1 is also expressed in colonic enterocytes, where it maintains the integrity of adherens junctions (AJ) and the colonic epithelial barrier. Mutations in CRB1 disrupt these barriers, creating a ""leaky gut"" and ""leaky retina"" phenomenon that allows gut bacteria to translocate to the retina.

This bacterial translocation triggers inflammatory responses and retinal damage in CRB1-mutated eyes. Research using the naturally occurring retinal degeneration 8 (Rd8) mouse model, which carries a nonsense mutation in CRB1, has demonstrated that retinal lesions contain bacterial species originating from the gut. These findings establish a clear connection between CRB1 mutations, barrier dysfunction, and retinal inflammation.

The therapeutic potential of targeting this bacterial translocation has been explored through both antibiotic treatment and gene therapy approaches. Systemic antibiotic treatment of newborn Rd8 mice effectively prevented retinal damage by reducing bacterial translocation. Similarly, gene therapy using adeno-associated virus (AAV) vectors to restore CRB1 expression in enterocytes improved intestinal barrier function and reduced retinal inflammation.

These findings suggest that combining antibacterial therapy with gene correction could offer a promising treatment strategy for CRB1-associated retinal degeneration. The research highlights the importance of considering both local retinal treatment and systemic approaches addressing gut barrier function.

The discovery of this gut-eye axis in CRB1-related retinal degeneration has broader implications for understanding other ocular diseases where gut microbiota may play a role. Future research should explore whether similar mechanisms operate in human patients with CRB1 mutations and investigate the potential for probiotics, prebiotics, or other microbiome-modulating therapies to complement traditional gene therapy approaches.

In conclusion, this research represents a significant advancement in our understanding of CRB1-associated retinal degeneration and offers new therapeutic directions that could potentially slow or prevent vision loss in these currently untreatable conditions.",news-medical
https://news-medical.net,Fat cells trigger liver stress through secreted lipids,https://news-medical.net/news/20250402/Fat-cells-trigger-liver-stress-through-secreted-lipids.aspx,"Wed, 02 Apr 2025 00:00:00 GMT","The endoplasmic reticulum (ER) is the portion of the cell responsible for manufacturing and folding proteins. Proteins are essential for a wide range of cellular functions-as enzymes, transporters, hormones, antibodies, receptors, and more. They must be folded into the correct three-dimensional shape to function properly. If the ER is unable to manufacture or fold proteins correctly, the cell develops ER stress, which activates the unfolded protein response (UPR)-a protective mechanism aimed at restoring cellular function.

While UPR begins as an adaptive response, it can become maladaptive-ultimately causing cell death-if ER stress persists for too long.

Recently, a team of Chinese researchers led by Prof. WANG Likun from the Institute of Biophysics of the Chinese Academy of Sciences has provided new insights into metabolic disease mechanisms and potential therapeutic strategies by identifying a novel intercellular signaling mechanism between adipocytes (fat cells) and hepatocytes (liver cells). The study reveals how ER-stressed adipocytes remotely regulate UPR activation in hepatocytes through the secretion of ceramide (Cer), a fat molecule that plays a major role in cell structure, signaling, and stress response.

These findings were published in the Journal of Cell Biology on March 26.

In the study, the researchers first confirmed that ER-stressed adipocytes secrete bioactive signaling molecules capable of activating the UPR pathway in hepatocytes across tissues. Using lipidomics analysis and functional validation, they identified Cer as the key effector molecule responsible for this process.

Further investigation revealed that the UPR pathway in adipocytes does not directly regulate Cer secretion. Instead, ER stress promotes the extracellular hydrolysis of sphingomyelin (SM)-a type of lipid-into Cer through the secretion of acid sphingomyelinase (ASM), highlighting an indirect regulatory pathway.

By investigating how lipid-soluble Cer is transported between cells, the researchers demonstrated that high-density lipoprotein (HDL) serves as the primary carrier for Cer transport. Upon reaching hepatocytes, Cer alters membrane fluidity, influencing membrane protein function, and contributing to UPR activation.

Notably, the researchers also found that exogenous supplementation of SM effectively reversed the Cer-induced changes in membrane fluidity and UPR activation-underscoring the critical role of lipid metabolic balance in cellular homeostasis. The ability to suppress UPR activation suggests that maladaptive responses to ER stress may be reversible.

Expanding on these findings, the researchers discovered that this Cer-based intercellular UPR signaling mechanism has broader applicability, offering a new theoretical framework for understanding multi-tissue coordinated stress responses.

By systematically mapping the molecular pathway of UPR signal transmission between adipose and liver tissues, this study reveals a previously unrecognized form of organ crosstalk in metabolic diseases. These discoveries pave the way for lipid metabolism-targeted therapeutic strategies aimed at restoring cellular balance and mitigating metabolic disorders.",news-medical
