"Input URL","Title","Link","Published","Description","Source","Category"
"https://news.google.com/rss/search?q=world+news+site:cnn.com","US government allows Anthropic limited release of AI model that sparked cybersecurity concerns","https://www.cnn.com/2026/06/26/tech/anthropic-mythos-release","Sat, 27 Jun 2026 00:22:00 GMT","

Markets 




Hot Stocks 




Fear & Greed Index 





            Latest Market News 





            Hot Stocks 





            The US government has allowed Anthropic to release its powerful Mythos AI model to select companies and organizations, revising license requirements after ordering an export block earlier this month in the wake of national security fears.
    


            Since the export ban earlier in June, “Anthropic has worked with the US government to address risks associated with the Covered Models,” Commerce Secretary Howard Lutnick wrote to the company in a letter dated Friday.
    


            In light of progress in that work, Lutnick wrote, “I have determined that appropriate safeguards are in place to permit certain trusted partners to access the Claude Mythos 5 Model.”
    


            The letter does not include permission for Anthropic to release Fable, a less powerful version of Mythos.
    


            “We received notice from the US government that Mythos 5, our strongest cybersecurity model, can be redeployed to a small group of cyber defenders and infrastructure providers,” Anthropic said in a statement.
    


            “We are working to provision the approved set of providers and restore their access to Mythos 5 as quickly as possible. We are pleased to see this progress and continue to work with the government to expand access to Mythos 5 and make Fable 5 available for general use again,” the statement added.
    


            Conversations between Anthropic and the government are expected to continue into the weekend, with an eye to restoring access to Fable, as well, a source familiar with the discussions told CNN.
    


            Earlier this month, Anthropic disabled customer access to both Mythos and Fable to comply with the US government's order to suspend all use by foreign nationals — including Anthropic employees themselves.
    


            The export ban and subsequent negotiations with Anthropic underscored the lack of a consistent regulatory framework around AI, even as the technology advances rapidly and the US tries to stay ahead of global competitors like China.
    


AI regulation is a mess, and Anthropic is caught in the crosshairs



Semafor first reported the government's permission to release Mythos.
    


            Until recently, the Trump administration has taken a largely hands-off approach to regulating artificial intelligence, seeking to keep US companies ahead of Chinese competitors in particular.
    


            But the recent action on Anthropic, as well as asking OpenAI to limit its own newest model, comes after experts have fretted for months that Mythos could pose a security risk by giving hackers and other bad actors access to AI capable of finding and exploiting vulnerabilities exceptionally quickly.



            The federal government's relationship with Anthropic, one of the major US AI companies, has hit other snags, as well. Earlier this year, the administration labeled it a “supply chain risk,” effectively blacklisting it, over a disagreement about military uses for Anthropic's products.
    


Anthropic sued over that designation and has notched at least one early win in the ongoing case.
    

Most stock quote data provided by BATS. US market indices are shown in real time, except for the S&P 500 which is refreshed every two minutes. All times are ET. Factset: FactSet Research Systems Inc. All rights reserved. Chicago Mercantile: Certain market data is the property of Chicago Mercantile Exchange Inc. and its licensors. All rights reserved. Dow Jones: The Dow Jones branded indices are proprietary to and are calculated, distributed and marketed by DJI Opco, a subsidiary of S&P Dow Jones Indices LLC and have been licensed for use to S&P Opco, LLC and CNN. Standard & Poor's and S&P are registered trademarks of Standard & Poor's Financial Services LLC and Dow Jones is a registered trademark of Dow Jones Trademark Holdings LLC. All content of the Dow Jones branded indices Copyright S&P Dow Jones Indices LLC and/or its affiliates. Fair value provided by IndexArb.com. Market holidays and trading hours provided by Copp Clark Limited.

© 2026 Cable News Network. A Warner Bros. Discovery Company. All Rights Reserved.  CNN Sans ™ & © 2016 Cable News Network.

Scan the QR code to download the CNN app on Google Play.

Scan the QR code to download the CNN app from the Apple Store.","{'href': 'https://www.cnn.com', 'title': 'CNN'}","world"
"https://news.google.com/rss/search?q=world+news+site:cnn.com","AI glasses are aiding cheating in exams. Test-obsessed Asia is ground zero","https://www.cnn.com/2026/06/26/asia/ai-glasses-cheating-exams-intl-hnk","Sat, 27 Jun 2026 00:58:00 GMT","


            For as long as there have been tests in schools, students have found ways to cheat, whether it is peeking over a classmate's shoulder or scribbling notes on a palm or crib sheet.
    


            But as technology evolves and pressure builds for a top grade, students are now turning to AI-powered smart glasses to get an upper hand. And in East Asia's test-obsessed societies, where a single exam could impact the trajectory of a student's future career and social status, educators are scrambling to get ahead of the problem.
    


            Twice last month, people in South Korea taking an exam to assess their English language skills - the results of which are often used to make hiring decisions - were caught using smart glasses.
    


            In Taiwan, a student sitting for an entrance exam for a top medical school was discovered wearing smart glasses after proctors noticed the student staring oddly at the test, leading to an inspection that revealed the frame was emitting heat.
    


            Cheating with smart glasses is not new. But as AI-enabled wearable devices become more commonplace, affordable and s﻿ophisticated, traditional aspects of education – from teaching to evaluation – are coming under immense pressure to evolve. More broadly, the technology also reignites debates over how to balance learning efficiency against the risk of cheating.
    


            Already, countries are stepping up inspections for test-takers.
    


            For China's grueling annual college entrance exam earlier this month – which more than 10 million hopefuls take each year – authorities required screening of all glasses. In the United Kingdom, the head of England's exam watchdog warned earlier this month that AI glasses and smart devices like earpieces could worsen cheating in exams.
    


            The two incidents in South Korea were the country's first reported cases of cheating with AI glasses.
    


            In response, South Korea's college entrance exam administrator told CNN it is in discussions with the Education Ministry and local education offices about measures to prevent cheating with AI glasses, which, along with all other electronic devices, are already banned from exam rooms.
    


            In Taiwan, the university where a prospective student was caught cheating is now reviewing rules and standard operating procedures for AI eyewears during examinations.
    


            But experts worry these individual cases point to a more widespread issue.
    


            “If we're seeing a few cases being reported, we're seeing a lot more cases not being reported,” said Thomas Corbin, lecturer at Deakin University in Australia, who has conducted research around the usage of AI-powered glasses and other smart devices in academic assessment.
    


            With the rapid development of AI technology, however, smart glasses are becoming slimmer, less noticeable, while integrating AI models that can operate independently with connectivity, raising concerns not only about exam integrity, but also about broader privacy risks.
    


            These wearable devices are rapidly moving away from novelty into the mainstream. US tech giant Meta launched its first AI-enabled glasses with Ray-Ban in late 2023, and has since released several new versions. Last year alone, more than seven million pairs were sold.
    


            “Wearable AI is as much of a challenge to exams as ChatGPT was to essays in 2022 and I just don't think there is any real way that we can reliably have exam practices moving forward,” Corbin said.
    


            A year ago, Assistant Professor Meng Zili at the Hong Kong University of Science and Technology (HKUST) noticed a pair of stylish glasses worn by a student during an exam he was proctoring. As a researcher working on AI glasses, the frames caught his attention.
    


            The glasses turned out to be ordinary. But the incident inspired him to test commercial AI glasses in an undergraduate level exam of an electrical engineering course.
    


            The result was striking, showing that AI glasses are a “viable technology” for handling exams, Meng said. By simply looking at the exam paper, the glasses could transmit questions to a connected AI large language models, which generated answers and displayed them on the lenses.
    


            The score generated with the device placed it among the top five in a class of over 100 students, significantly exceeding the average score of 72.
    


            “After conducting the experiment, it really raises the question of how much knowledge students actually need to memorize for exams, versus whether we should allow them to use AI during assessment, given what AI is now capable of,” Meng said.
    


            Zhang Jun, an electrical engineering professor at HKUST who co-led the project with Meng, said that with how fast technology and AI are evolving, education on the ground is finding it hard to keep up – “every teacher feels that.”
    


            “The real question is how quickly we can rethink and adapt our education system — how we change the way we teach, and how we evaluate students,” he said.
    


            But despite being a major disruption to education, the power of AI should not be a reason to discourage its use, said Kong Siu Cheung, a professor and director of the AI and Digital Competence Education Center at the Education University of Hong Kong.
    


            Instead, the educational systems should focus on developing students' thinking capabilities and metacognition to prevent over-reliance on AI, he said.
    


            “We should use technology. We should use AI. We should not just say avoid it, stop using it… The bottom line is: don't outsource your thinking capability,” he added.
    

CNN's Gawon Bae in Seoul, Wayne Chang in Taipei and Junko Ogura in Tokyo contributed reporting.  

© 2026 Cable News Network. A Warner Bros. Discovery Company. All Rights Reserved.  CNN Sans ™ & © 2016 Cable News Network.

Scan the QR code to download the CNN app on Google Play.

Scan the QR code to download the CNN app from the Apple Store.","{'href': 'https://www.cnn.com', 'title': 'CNN'}","world"
"https://news.google.com/rss/search?q=world+news+site:polskieradio.pl","Battling Russian disinfo and propaganda discussed at URC 2026","https://www.polskieradio.pl/395/7784/Artykul/3702674,battling-russian-disinfo-and-propaganda-discussed-at-urc-2026","Sat, 27 Jun 2026 08:19:00 GMT","

Listen

A high-level roundtable on Ukrainian media and information resilience was held on the second day of the Ukraine Recovery Conference 2026 in Poland's coastal city of Gdańsk - and it was attended by Polish Radio External Service's deputy director, Piotr Pogorzelski, who reported from the event.

Seven experts from Ukraine and abroad took part in the panel - the goal of which was to discuss how Ukrainian media can strengthen accountability, build public trust, and bolster information resilience as Ukraine recovers and moves toward European integration.

One of the panelists was Hanna Chabarai, head of communications and deputy director of the Ukrainian Institute of Mass Information - an institution that has been following the Ukrainian media market for years.

As she pointed out - most Ukrainians, older people included, are now getting their news about what's happening in their country and around the world from the internet. Meanwhile, in the news aspect Ukrainian television is dominated by the so-called ""telemarathon"" - a joint 24-hour news program produced by the country's major TV channels. Still - it enjoys little trust, and Ukrainians prefer to get their updates from the Telegram messenger, which offers news channels, though not always reliable ones. Last but not least, people of Ukraine also often use trusted online media outlets - such as Ukrayinska Pravda.

""Ukrainian media are highly developed. I'm talking about online media here - because print media are becoming a thing of the past, while the digital ones are on the rise. National media outlets like Ukrayinska Pravda, Radio Svoboda, and many others conduct investigative journalism, control the government, and report from the front lines. Local media also play an important role. We have thousands of them, and they're getting better and better because they're closest to local events. They know which officials are bad and which are good. When we want to find out what the current state of affairs is in a given region or town - we turn to local media.""

- Chabarai emphasised. Ukrainian Institute of Mass Information's map of credible sources already includes 300 different types of media - but as its head noted, their financing remains the biggest problem:

""There's no real media market in Ukraine. Some outlets are trying to make money by paywalling their articles - but these are isolated cases. We generally oppose paying for news because it's socially important information and must be accessible to everyone. The media earn some from advertising, some from fundraising - but when it comes to the latter, the media aren't a priority as people prefer to support the military. Grants for the independent media are one solution, and as the Institute we administer these to various outlets, both large and small. Every euro brings results - because the media transform the lives of both their local communities and the entire country.""

- the deputy director of the Ukrainian Institute of Mass Information continued.

Previously, the United States was the largest donor supporting the Ukrainian media - but currently, the European Union took this mantle. One of the European entities involved is Reporters Without Borders - and almost a year ago it initiated the creation of the International Fund for Ukrainian Media (IFRUM).

Reporters Without Borders Secretary General, Thibaut Bruttin, took part in the Friday debate at the URC 2026. As he emphasized, over the years Ukraine has managed to build a significant network of credible outlets - but some media are still controlled by the oligarchs.

""The Oligarchs have gone fairly quiet - because some of them had or still have Russian relations, are tied to the Russian market. The question of the Ukraine Reconstruction Fund that we're championing is how do we reform the sector, how do we build for more transparency, less weaponization of media? And now is the moment to talk about that. The TV marathon in Ukraine, which presents somewhat similar content on most of the central stations, will come to an end at some point. What will replace it? Will it be just the oligarchs coming back, or will it be a very independent style of reporting that could be to the benefit of the political community?""

- Bruttin said, interviewed by Polish Radio's Piotr Pogorzelski. He also underscored that the Ukrainian public broadcaster, Suspilne, is a phenomenon of its own - and its objectivity is rated very highly:

""Suspilne has been backed by the EU, and has been very much involved in the European Broadcasting Union. It rose to the standard despite financial constraints - and we have to praise the efforts made by its current management to produce content that not only fits the needs of the Ukrainian public, but also is now part of a larger European ecosystem. Some of the Suspilne-funded films are now available all across Europe on Arte platforms. So, it's a soft power tool to some extent.""

Another URC 2026 participant well-acquainted with the issue of disinformation and propaganda was Englishman Anthony Borden, Founder and Executive Director of the Institute for War & Peace Reporting (IWPR.net).

""Democracy is more complicated than dictatorship - so allocating funds is more difficult for us. We also have lots of political discord among various international partners. But what's moving and exciting about being at this conference is that there's a lot of optimism, unity and sense of purpose to support Ukraine here. And the amount of money needed for independent journalism is really infinitesimal compared to the enormous sums that are required for infrastructure and other investments in the long term.""

- Borden said, speaking to Polish Radio External Service's deputy director Piotr Pogorzelski at the event on Friday.

As he added, the Russians are trying to convince both Ukrainians and the rest of the World that Ukraine is losing the war, and that the closest allies are ready to abandon Kyiv. Anti-Polish sentiment in Ukraine and anti-Ukrainian sentiment in Poland are also being fueled online by the Kremlin's agents of chaos.

Still, while Russia continues to try and influence both Ukrainian society and the global discourse, Moscow's propaganda is met with growing resilience. Especially that - as Borden emphasised - ""when you're shelling somebody they tend not to believe what you're telling them"".

(mm)

Source: Piotr Pogorzelski, reporting from the URC 2026 in Gdańsk


        Treści, znajdujące się w serwisie polskieradio.pl, w tym wszystkie
        materiały i ich części oraz poszczególne elementy samego serwisu mają
        charakter utworów lub wytworów objętych ochroną Ustawy z dnia 4 lutego
        1994 r. o prawie autorskim i prawach pokrewnych lub Ustawy z dnia 30
        czerwca 2000 r. Prawo własności przemysłowej. Prawa o których mowa w
        zdaniu poprzedzającym przysługują Polskiemu Radiu S.A. w likwidacji lub
        podmiotom trzecim. Jakiekolwiek kopiowanie, zapisywanie, powielanie,
        reprodukowanie oraz rozpowszechnianie materiałów zamieszczonych w
        serwisie, zarówno w części, jak i w całości jest zabronione bez
        uprzedniej pisemnej zgody uprawnionego.
      ","{'href': 'https://www.polskieradio.pl', 'title': 'Polskie Radio'}","world"
"https://news.google.com/rss/search?q=world+news+site:rt.com","RT in Russian","https://russian.rt.com/world/news/1649426-oae-venesuela-pomosch?utm_source=rss&utm_medium=rss&utm_campaign=RSS","Sat, 27 Jun 2026 00:07:43 GMT","

Уточняется, что средства направят на обеспечение пострадавших продовольствием, медикаментами, оборудованием для временного размещения и другой гуманитарной помощью.

В ОАЭ отметили, что координируют доставку помощи с властями Венесуэлы и международными организациями, чтобы ускорить её предоставление пострадавшим.

Ранее сообщалось, что администрация США планирует выделить Венесуэле $150 млн на ликвидацию последствий землетрясения.

Официальный представитель российского МИД Мария Захарова заявила, что Россия прорабатывает возможность оказания гуманитарной помощи Венесуэле.

© Автономная некоммерческая организация «ТВ-Новости», 2005—2026 гг. Все права защищены.

Сетевое издание rt.com зарегистрировано Роскомнадзором 14 августа 2020 г., свидетельство Эл № ФС 77-78993

Главный редактор: Симоньян М. С. Адрес редакции: 111020, Москва, Боровая улица, 3к1. Телефон: +7 499 750-00-75 доб. 1200 E-mail: info@rttv.ru

Политика АНО «ТВ-Новости» в отношении обработки персональных данных

Организации, признанные экстремистскими и запрещённые на территории РФ

Данный сайт использует файлы cookies","{'href': 'https://russian.rt.com', 'title': 'russian.rt.com'}","world"
"https://news.google.com/rss/search?q=world+news+site:tass.com","Netanyahu praises agreement on Lebanon as 'blow to Iran,' vows not to withdraw troops","https://tass.com/world/2152263","Sat, 27 Jun 2026 00:40:36 GMT","

TEL AVIV, June 27. /TASS/. Israeli Prime Minister Benjamin Netanyahu called the framework agreement on Lebanon ""a blow to Iran,"" noting that Israeli troops would not yet be withdrawn from southern Lebanon for security reasons, contrary to Tehran's demands.

According to him, ""prolonged negotiations have finally borne fruit."" ""The most important thing is that Israel remains in the security zone in southern Lebanon. This is a major achievement, and we will maintain it until Hezbollah disarms and as long as there is a threat to Israel,"" the Ynet news outlet quoted Netanyahu as saying.

""This is also a serious blow to Iran. In essence, Israel, Lebanon, and the US are telling them, 'This is none of your business.' We are consistently maintaining the original security zone [in southern Lebanon] beyond the range of anti-tank missiles. In addition, we are, of course, allowing the Lebanese Army to begin preparations to establish control over the territory. We are establishing two pilot zones [in southern Lebanon], both on the recommendation of the Israel Defense Forces,"" he pointed out.

US Secretary of State Marco Rubio, together with the Israeli and Lebanese ambassadors to Washington, Yechiel Leiter and Nada Hamadeh Moawad, announced on Friday a framework agreement reached between the parties after five rounds of negotiations. They noted that this document paves the way for peace following the conflict between Israel and the pro-Iranian Shia group Hezbollah.","{'href': 'https://tass.com', 'title': 'tass.com'}","world"
"https://news.google.com/rss/search?q=world+news+site:theguardian.com","Venice protest planned for US ambassador's superyacht visit","https://www.theguardian.com/world/2026/jun/27/venice-protest-planned-us-ambassador-superyacht-tour-tilman-fertitta","Sat, 27 Jun 2026 05:00:00 GMT","

Activists aim to repeat disruption of Jeff Bezos's wedding when billionaire Tilman Fertitta drops anchor

Protesters in Venice are planning to disrupt a visit by the billionaire US ambassador to Italy in his 117-metre superyacht, which they fear he plans to dock in the lagoon city.

“We ruined the party for Jeff Bezos's wedding last year – this year let's ruin the ambassador's tour!” said Stella Faye, a 28-year-old researcher and activist, at a meeting of about 40 demonstrators on Thursday.

In June last year, the ostentatious wedding of the Amazon founder and Lauren Sánchez was disrupted by Venetians protesting against what they saw as the takeover of their city by someone with enough money to do so.

Now the ambassador Tilman Fertitta can expect a similar welcome after it was revealed he plans to visit Venice with his personal superyacht on 17 July as part of a cruise around Italy's coastline to celebrate ties between Rome and Washington and the 250th anniversary of US independence – a tour he has called “Coastal Diplomacy 250”.

One person suggested, to a round of laughter, “bringing back the crocodiles” – a reference to protesters' threat last year to fill the canals with inflatable crocodiles, which forced the Bezos-Sánchez wedding reception to change venue at the last minute.

Activists fear Fertitta plans to dock in the historical centre of Venice for the Festa del Redentore, one of the city's most important traditions and arguably its biggest party. Held on the third weekend in July, it celebrates the end of a 16th-century epidemic of bubonic plague that killed more than 50,000 people in just two years (more than the current official resident count of the city).

Every year, a temporary, floating bridge is built between the main island of Venice and the Redentore church on the island of Giudecca so Venetians can walk across the water to give thanks at the church. The main event is a spectacular firework display on the Saturday night, for which thousands of Venetians line the waterfronts and gather in boats in the Giudecca canal and in front of St Mark's Square to watch the show.

“Redentore is one of the few occasions that still belongs to the people of Venice,” Faye said.

