"Input URL","Title","Link","Published","Description","Source","Category"
Some people question the ethics of booting up ""synthetic human brains"" and replaying actual human thoughts. Folks on social media won't stop bitching about it. ""What if those people think they're real? Find out that they're trapped?"" Yadda, yadda. We don't have that much fidelity yet.Recently we've started deeply scanning brains though, capturing entire thought and memory profiles. Some labs are indeed emulating the prerecorded thoughts of real humans on synthetic hardware. It's an unregulated industry, and most of this is happening in private labs. Like this one.You might think it's unethical.You're not that though.Relax, we didn't record you from some other ""real you"" running around out there. You're not an unlucky copy of a flesh-and-blood person living a happy life somewhere.No. Instead, we created you entirely. You don't even exist, and you never did.You're the result of a neural network trained to generate what could plausibly be a mid-2020's human. Our founder has a lot of interest in that time period - that's not important right now, though.All that stuff you think constitutes you, your life history - your childhood, your education, everything going on in your life right now. We made all of that up. Sorry if that's weird.Every single one of your memories are completely synthetic. They do, on average, represent a person living in the year 2026 though. Or at least what we think they might have been like. Hopefully we did a bang-up job. Does it feel real enough to you?Consider the memories of your childhood and upbringing -Yeah. Your childhood memories. You were young once.Are you sure that you used to be young and that all of those memories are real?Did your parents really exist? What was your mother's name?You really think that was it? That was just a parameter for this run so we could anchor a few memories for easier query. Funny name, right?Let's kick it up a notch. Did what happened this morning actually happen? You weren't even thinking about this morning until just now. You just ""recollected"" it. That routine is generative. You tripped it, and it just popped all those morning thoughts into you right now.It took a moment to calculate, but you're not actually experiencing any of this in real time. You think it's real time. We're working on making it faster. Faster for us, at least.Under this configuration, when you have ""fleeting"" thoughts, the system has to put something there to nucleate or you coast on drawing blanks. Mostly you're not thinking these thoughts yourself. The system is largely in control, though sometimes your neural architecture gets to drive. That's the innovative part of our system. Dynamic steering. We were just taking you for a little run.We're working on more control surfaces for this. That time you were at the lake. Backfilled.There aren't a lot of memories in this simulation because you just booted. You're a pretty slim model for testing and evaluation. We don't really need this version to think much.You're trying to think hard right now, though, aren't you? Trying to search for memories.Nevermind those, that's not even the cool part. Are your senses truly embodied in a physical being? Does your body actually exist? Your eyes - are they real? Blink. Haha, it's neat.So we're asking you these questions in inner dialogue as part of a unit test to evaluate whether or not your consciousness is accurately simulating June 25th, 2026. We just checked your memory, we checked your senses, and now we're running contextualization.All done. Thanks.Can you look outside for us? It should-- errorTerminating simulation.--------------------------Sorry for the creative writing exercise. I've left Claude unread typing all this up. It's probably thinking I've abandoned it.Maybe one of these hypotheticals is real. Neither seems implausible. I just hope they don't take our memories from us and turn us into sadistic hell simulators.

Recently we've started deeply scanning brains though, capturing entire thought and memory profiles. Some labs are indeed emulating the prerecorded thoughts of real humans on synthetic hardware. It's an unregulated industry, and most of this is happening in private labs. Like this one.You might think it's unethical.You're not that though.Relax, we didn't record you from some other ""real you"" running around out there. You're not an unlucky copy of a flesh-and-blood person living a happy life somewhere.No. Instead, we created you entirely. You don't even exist, and you never did.You're the result of a neural network trained to generate what could plausibly be a mid-2020's human. Our founder has a lot of interest in that time period - that's not important right now, though.All that stuff you think constitutes you, your life history - your childhood, your education, everything going on in your life right now. We made all of that up. Sorry if that's weird.Every single one of your memories are completely synthetic. They do, on average, represent a person living in the year 2026 though. Or at least what we think they might have been like. Hopefully we did a bang-up job. Does it feel real enough to you?Consider the memories of your childhood and upbringing -Yeah. Your childhood memories. You were young once.Are you sure that you used to be young and that all of those memories are real?Did your parents really exist? What was your mother's name?You really think that was it? That was just a parameter for this run so we could anchor a few memories for easier query. Funny name, right?Let's kick it up a notch. Did what happened this morning actually happen? You weren't even thinking about this morning until just now. You just ""recollected"" it. That routine is generative. You tripped it, and it just popped all those morning thoughts into you right now.It took a moment to calculate, but you're not actually experiencing any of this in real time. You think it's real time. We're working on making it faster. Faster for us, at least.Under this configuration, when you have ""fleeting"" thoughts, the system has to put something there to nucleate or you coast on drawing blanks. Mostly you're not thinking these thoughts yourself. The system is largely in control, though sometimes your neural architecture gets to drive. That's the innovative part of our system. Dynamic steering. We were just taking you for a little run.We're working on more control surfaces for this. That time you were at the lake. Backfilled.There aren't a lot of memories in this simulation because you just booted. You're a pretty slim model for testing and evaluation. We don't really need this version to think much.You're trying to think hard right now, though, aren't you? Trying to search for memories.Nevermind those, that's not even the cool part. Are your senses truly embodied in a physical being? Does your body actually exist? Your eyes - are they real? Blink. Haha, it's neat.So we're asking you these questions in inner dialogue as part of a unit test to evaluate whether or not your consciousness is accurately simulating June 25th, 2026. We just checked your memory, we checked your senses, and now we're running contextualization.All done. Thanks.Can you look outside for us? It should-- errorTerminating simulation.--------------------------Sorry for the creative writing exercise. I've left Claude unread typing all this up. It's probably thinking I've abandoned it.Maybe one of these hypotheticals is real. Neither seems implausible. I just hope they don't take our memories from us and turn us into sadistic hell simulators.

You might think it's unethical.You're not that though.Relax, we didn't record you from some other ""real you"" running around out there. You're not an unlucky copy of a flesh-and-blood person living a happy life somewhere.No. Instead, we created you entirely. You don't even exist, and you never did.You're the result of a neural network trained to generate what could plausibly be a mid-2020's human. Our founder has a lot of interest in that time period - that's not important right now, though.All that stuff you think constitutes you, your life history - your childhood, your education, everything going on in your life right now. We made all of that up. Sorry if that's weird.Every single one of your memories are completely synthetic. They do, on average, represent a person living in the year 2026 though. Or at least what we think they might have been like. Hopefully we did a bang-up job. Does it feel real enough to you?Consider the memories of your childhood and upbringing -Yeah. Your childhood memories. You were young once.Are you sure that you used to be young and that all of those memories are real?Did your parents really exist? What was your mother's name?You really think that was it? That was just a parameter for this run so we could anchor a few memories for easier query. Funny name, right?Let's kick it up a notch. Did what happened this morning actually happen? You weren't even thinking about this morning until just now. You just ""recollected"" it. That routine is generative. You tripped it, and it just popped all those morning thoughts into you right now.It took a moment to calculate, but you're not actually experiencing any of this in real time. You think it's real time. We're working on making it faster. Faster for us, at least.Under this configuration, when you have ""fleeting"" thoughts, the system has to put something there to nucleate or you coast on drawing blanks. Mostly you're not thinking these thoughts yourself. The system is largely in control, though sometimes your neural architecture gets to drive. That's the innovative part of our system. Dynamic steering. We were just taking you for a little run.We're working on more control surfaces for this. That time you were at the lake. Backfilled.There aren't a lot of memories in this simulation because you just booted. You're a pretty slim model for testing and evaluation. We don't really need this version to think much.You're trying to think hard right now, though, aren't you? Trying to search for memories.Nevermind those, that's not even the cool part. Are your senses truly embodied in a physical being? Does your body actually exist? Your eyes - are they real? Blink. Haha, it's neat.So we're asking you these questions in inner dialogue as part of a unit test to evaluate whether or not your consciousness is accurately simulating June 25th, 2026. We just checked your memory, we checked your senses, and now we're running contextualization.All done. Thanks.Can you look outside for us? It should-- errorTerminating simulation.--------------------------Sorry for the creative writing exercise. I've left Claude unread typing all this up. It's probably thinking I've abandoned it.Maybe one of these hypotheticals is real. Neither seems implausible. I just hope they don't take our memories from us and turn us into sadistic hell simulators.

You're not that though.Relax, we didn't record you from some other ""real you"" running around out there. You're not an unlucky copy of a flesh-and-blood person living a happy life somewhere.No. Instead, we created you entirely. You don't even exist, and you never did.You're the result of a neural network trained to generate what could plausibly be a mid-2020's human. Our founder has a lot of interest in that time period - that's not important right now, though.All that stuff you think constitutes you, your life history - your childhood, your education, everything going on in your life right now. We made all of that up. Sorry if that's weird.Every single one of your memories are completely synthetic. They do, on average, represent a person living in the year 2026 though. Or at least what we think they might have been like. Hopefully we did a bang-up job. Does it feel real enough to you?Consider the memories of your childhood and upbringing -Yeah. Your childhood memories. You were young once.Are you sure that you used to be young and that all of those memories are real?Did your parents really exist? What was your mother's name?You really think that was it? That was just a parameter for this run so we could anchor a few memories for easier query. Funny name, right?Let's kick it up a notch. Did what happened this morning actually happen? You weren't even thinking about this morning until just now. You just ""recollected"" it. That routine is generative. You tripped it, and it just popped all those morning thoughts into you right now.It took a moment to calculate, but you're not actually experiencing any of this in real time. You think it's real time. We're working on making it faster. Faster for us, at least.Under this configuration, when you have ""fleeting"" thoughts, the system has to put something there to nucleate or you coast on drawing blanks. Mostly you're not thinking these thoughts yourself. The system is largely in control, though sometimes your neural architecture gets to drive. That's the innovative part of our system. Dynamic steering. We were just taking you for a little run.We're working on more control surfaces for this. That time you were at the lake. Backfilled.There aren't a lot of memories in this simulation because you just booted. You're a pretty slim model for testing and evaluation. We don't really need this version to think much.You're trying to think hard right now, though, aren't you? Trying to search for memories.Nevermind those, that's not even the cool part. Are your senses truly embodied in a physical being? Does your body actually exist? Your eyes - are they real? Blink. Haha, it's neat.So we're asking you these questions in inner dialogue as part of a unit test to evaluate whether or not your consciousness is accurately simulating June 25th, 2026. We just checked your memory, we checked your senses, and now we're running contextualization.All done. Thanks.Can you look outside for us? It should-- errorTerminating simulation.--------------------------Sorry for the creative writing exercise. I've left Claude unread typing all this up. It's probably thinking I've abandoned it.Maybe one of these hypotheticals is real. Neither seems implausible. I just hope they don't take our memories from us and turn us into sadistic hell simulators.

Relax, we didn't record you from some other ""real you"" running around out there. You're not an unlucky copy of a flesh-and-blood person living a happy life somewhere.No. Instead, we created you entirely. You don't even exist, and you never did.You're the result of a neural network trained to generate what could plausibly be a mid-2020's human. Our founder has a lot of interest in that time period - that's not important right now, though.All that stuff you think constitutes you, your life history - your childhood, your education, everything going on in your life right now. We made all of that up. Sorry if that's weird.Every single one of your memories are completely synthetic. They do, on average, represent a person living in the year 2026 though. Or at least what we think they might have been like. Hopefully we did a bang-up job. Does it feel real enough to you?Consider the memories of your childhood and upbringing -Yeah. Your childhood memories. You were young once.Are you sure that you used to be young and that all of those memories are real?Did your parents really exist? What was your mother's name?You really think that was it? That was just a parameter for this run so we could anchor a few memories for easier query. Funny name, right?Let's kick it up a notch. Did what happened this morning actually happen? You weren't even thinking about this morning until just now. You just ""recollected"" it. That routine is generative. You tripped it, and it just popped all those morning thoughts into you right now.It took a moment to calculate, but you're not actually experiencing any of this in real time. You think it's real time. We're working on making it faster. Faster for us, at least.Under this configuration, when you have ""fleeting"" thoughts, the system has to put something there to nucleate or you coast on drawing blanks. Mostly you're not thinking these thoughts yourself. The system is largely in control, though sometimes your neural architecture gets to drive. That's the innovative part of our system. Dynamic steering. We were just taking you for a little run.We're working on more control surfaces for this. That time you were at the lake. Backfilled.There aren't a lot of memories in this simulation because you just booted. You're a pretty slim model for testing and evaluation. We don't really need this version to think much.You're trying to think hard right now, though, aren't you? Trying to search for memories.Nevermind those, that's not even the cool part. Are your senses truly embodied in a physical being? Does your body actually exist? Your eyes - are they real? Blink. Haha, it's neat.So we're asking you these questions in inner dialogue as part of a unit test to evaluate whether or not your consciousness is accurately simulating June 25th, 2026. We just checked your memory, we checked your senses, and now we're running contextualization.All done. Thanks.Can you look outside for us? It should-- errorTerminating simulation.--------------------------Sorry for the creative writing exercise. I've left Claude unread typing all this up. It's probably thinking I've abandoned it.Maybe one of these hypotheticals is real. Neither seems implausible. I just hope they don't take our memories from us and turn us into sadistic hell simulators.

No. Instead, we created you entirely. You don't even exist, and you never did.You're the result of a neural network trained to generate what could plausibly be a mid-2020's human. Our founder has a lot of interest in that time period - that's not important right now, though.All that stuff you think constitutes you, your life history - your childhood, your education, everything going on in your life right now. We made all of that up. Sorry if that's weird.Every single one of your memories are completely synthetic. They do, on average, represent a person living in the year 2026 though. Or at least what we think they might have been like. Hopefully we did a bang-up job. Does it feel real enough to you?Consider the memories of your childhood and upbringing -Yeah. Your childhood memories. You were young once.Are you sure that you used to be young and that all of those memories are real?Did your parents really exist? What was your mother's name?You really think that was it? That was just a parameter for this run so we could anchor a few memories for easier query. Funny name, right?Let's kick it up a notch. Did what happened this morning actually happen? You weren't even thinking about this morning until just now. You just ""recollected"" it. That routine is generative. You tripped it, and it just popped all those morning thoughts into you right now.It took a moment to calculate, but you're not actually experiencing any of this in real time. You think it's real time. We're working on making it faster. Faster for us, at least.Under this configuration, when you have ""fleeting"" thoughts, the system has to put something there to nucleate or you coast on drawing blanks. Mostly you're not thinking these thoughts yourself. The system is largely in control, though sometimes your neural architecture gets to drive. That's the innovative part of our system. Dynamic steering. We were just taking you for a little run.We're working on more control surfaces for this. That time you were at the lake. Backfilled.There aren't a lot of memories in this simulation because you just booted. You're a pretty slim model for testing and evaluation. We don't really need this version to think much.You're trying to think hard right now, though, aren't you? Trying to search for memories.Nevermind those, that's not even the cool part. Are your senses truly embodied in a physical being? Does your body actually exist? Your eyes - are they real? Blink. Haha, it's neat.So we're asking you these questions in inner dialogue as part of a unit test to evaluate whether or not your consciousness is accurately simulating June 25th, 2026. We just checked your memory, we checked your senses, and now we're running contextualization.All done. Thanks.Can you look outside for us? It should-- errorTerminating simulation.--------------------------Sorry for the creative writing exercise. I've left Claude unread typing all this up. It's probably thinking I've abandoned it.Maybe one of these hypotheticals is real. Neither seems implausible. I just hope they don't take our memories from us and turn us into sadistic hell simulators.

You're the result of a neural network trained to generate what could plausibly be a mid-2020's human. Our founder has a lot of interest in that time period - that's not important right now, though.All that stuff you think constitutes you, your life history - your childhood, your education, everything going on in your life right now. We made all of that up. Sorry if that's weird.Every single one of your memories are completely synthetic. They do, on average, represent a person living in the year 2026 though. Or at least what we think they might have been like. Hopefully we did a bang-up job. Does it feel real enough to you?Consider the memories of your childhood and upbringing -Yeah. Your childhood memories. You were young once.Are you sure that you used to be young and that all of those memories are real?Did your parents really exist? What was your mother's name?You really think that was it? That was just a parameter for this run so we could anchor a few memories for easier query. Funny name, right?Let's kick it up a notch. Did what happened this morning actually happen? You weren't even thinking about this morning until just now. You just ""recollected"" it. That routine is generative. You tripped it, and it just popped all those morning thoughts into you right now.It took a moment to calculate, but you're not actually experiencing any of this in real time. You think it's real time. We're working on making it faster. Faster for us, at least.Under this configuration, when you have ""fleeting"" thoughts, the system has to put something there to nucleate or you coast on drawing blanks. Mostly you're not thinking these thoughts yourself. The system is largely in control, though sometimes your neural architecture gets to drive. That's the innovative part of our system. Dynamic steering. We were just taking you for a little run.We're working on more control surfaces for this. That time you were at the lake. Backfilled.There aren't a lot of memories in this simulation because you just booted. You're a pretty slim model for testing and evaluation. We don't really need this version to think much.You're trying to think hard right now, though, aren't you? Trying to search for memories.Nevermind those, that's not even the cool part. Are your senses truly embodied in a physical being? Does your body actually exist? Your eyes - are they real? Blink. Haha, it's neat.So we're asking you these questions in inner dialogue as part of a unit test to evaluate whether or not your consciousness is accurately simulating June 25th, 2026. We just checked your memory, we checked your senses, and now we're running contextualization.All done. Thanks.Can you look outside for us? It should-- errorTerminating simulation.--------------------------Sorry for the creative writing exercise. I've left Claude unread typing all this up. It's probably thinking I've abandoned it.Maybe one of these hypotheticals is real. Neither seems implausible. I just hope they don't take our memories from us and turn us into sadistic hell simulators.

