Input URL,Title,Link,Published,Description,Source
https://webmd.com,Migraine and Women’s History Month,https://blogs.webmd.com/migraine/20250324/migraine-and-womens-history-month,"Mon, 24 Mar 2025 00:00:00 GMT","I’ve been invited to speak at a few women’s history events over the years. I always choose to talk about a lesser-known woman from history. Women like the Black woman who designed Jackie Kennedy’s iconic wedding dress – Ann Cole Lowe. Or Susan Ahn Cuddy, known as the first Korean immigrant to settle in Los Angeles and the first Asian American woman to join the U.S. Navy. Like Cuddy and Lowe, countless others were trailblazers who changed history, but may never be a household name.

I’ve thought a lot about the unknown women in the migraine community. I know they’re there. I’m intrigued by who the powers-that-be opt to include in history lessons versus those who remain in obscurity. The journalist in me has never been satisfied not knowing who was at the forefront. I want to know who’s behind the scenes, the hidden stories.

What I do know is that women are often more impacted by chronic migraine.

Migraine is three times more likely to impact women than men.

Migraine affects 30% of women over a lifetime.

The frequency, duration, and intensity of migraines in women tend to be greater.

1 in 5 U.S. women have had a migraine vs. 1 in 10 men.

I hope efforts are made to unearth those women who were integral to migraine research. Until then, here are a few women from my Women’s Migraine Hall of Fame.",webmd
https://webmd.com,My Biggest Surprises When Dealing with Eczema,https://blogs.webmd.com/atopic-dermatitis/20250324/my-biggest-surprises-when-dealing-with-eczema,"Mon, 24 Mar 2025 00:00:00 GMT","I always saw my eczema as a weakness, but I now realize that while eczema has taken a lot from me, it has allowed me to appreciate my empathic side. For years I’ve endured the stares of strangers and sometimes even peers, but in doing so, I’ve also become more attuned to the struggles of others. So when I walk past someone with a visible ailment, I see them, not just their condition but their resilience, daily battles, and quiet strength.

I truly believe there’s an unspoken connection among those of us with visible conditions. It’s a silent acknowledgment that only we know what it’s like to be judged for something beyond our control within the first few seconds. This vow of silent acknowledgment allows us to move forward despite the odds. My empathy for others allowed me to build one of my greatest strengths.

Another surprise with eczema is that it didn’t just disrupt my days, but it stole my nights too. I never realized how deeply it would impact my sleep until I found myself trapped in an exhausting cycle of relentlessly itching nights. I would scratch until my skin bled and became discolored, waking up to a sea of flakes, raw patches, and an overwhelming sense of fatigue.",webmd
https://news-medical.net,Waist circumference identified as a stronger cancer risk marker in men,https://news-medical.net/news/20250324/Waist-circumference-identified-as-a-stronger-cancer-risk-marker-in-men.aspx,"Mon, 24 Mar 2025 00:00:00 GMT","Body size and excess weight, conventionally assessed using body mass index (BMI), are well-established risk factors for many types of cancer. However, new research to be presented at this year's European Congress on Obesity (ECO 2025, Malaga, Spain, 11-14 May) and published in The Journal of the National Cancer Institute shows that waist circumference (WC) is a stronger risk marker than BMI for developing obesity-related cancers in men, but not women. The study was conducted by Dr Ming Sun, Dr Josef Fritz and Dr Tanja Stocks, Lund University, Malmö, Sweden, and colleagues.

The study analysed data from 339,190 individuals collected from various Swedish populations who had undergone health assessments with BMI and WC assessments from 1981-2019 (61% objectively measured, 39% self-reported, mean age 51.4 years). Cancer diagnoses were obtained from the Swedish Cancer Register.

Established obesity-related cancers were defined as those for which the International Agency for Research on Cancer (IARC) has concluded there is sufficient evidence linking them to obesity, including cancers of the esophagus (adenocarcinoma), gastric (cardia), colon, rectum, liver/intrahepatic bile ducts, gallbladder, pancreas, breast (postmenopausal), endometrium, ovary, renal cell carcinoma, meningioma, thyroid, and multiple myeloma.

The authors calculated relative risks associated with obesity-related cancers for WC and BMI, taking into account multiple factors that could influence the results, such as age, smoking habits, and sociodemographic factors including education level, income, birth country and marital status.

Because WC is harder to measure accurately and consistently than BMI, its values tend to vary more. To ensure a fair comparison, the researchers adjusted for measurement errors in both WC and BMI. This adjustment makes the calculated relative risks of WC and BMI more directly comparable. Finally, because WC and BMI are measured on different scales (1 standard deviation [SD] = 3.7 and 4.3 kg/m² for BMI for males and females respectively, and 10.8 and 11.8 cm for WC for males and females respectively), calculating relative risks per 1-SD increase ensures that the increments for WC and BMI represent comparable magnitudes, allowing for a direct comparison of their associated relative risks.

During a median follow-up of 14 years, 18,185 established obesity-related cancers were recorded. In men, a WC increase of approximately 11 cm (e.g., comparing a WC of 100.8 cm versus 90 cm) was associated with a 25% higher risk of developing obesity-related cancers. By comparison, a BMI increase of 3.7 kg/m² (e.g., comparing BMI of 27.7 kg/m² versus 24 kg/m²) corresponded to a 19% increased risk. Additionally, after accounting for BMI, high WC still remained a risk factor for obesity-related cancer in men. This suggests that the elevated risk associated with abdominal adiposity is specific, and not explained by high body size alone, as measured by BMI.

Among women, the associations were weaker and similar for both WC and BMI. For example, both an increase of about 12 cm in waist circumference (e.g., comparing WC of 91.8 cm vs. 80.0 cm) and an increase of 4.3 kg/m² in BMI (e.g., BMI of 28.3 kg/m² vs. 24 kg/m²) were both associated with a 13% higher risk of developing obesity-related cancers.

The authors explain: ""BMI is a measure of body size, but does not provide information on fat distribution, whereas waist circumference is a proxy more closely related to abdominal adiposity. This distinction is crucial because visceral fat, which accumulates around the abdominal organs, is more metabolically active and has been implicated in adverse health outcomes, including insulin resistance, inflammation, and abnormal blood fat levels. Consequently, individuals with similar BMIs may have distinct cancer risks due to differences in fat distribution.""

On the difference between men and women, they reflect: ""A plausible explanation is that men are more likely to store fat viscerally, while women generally accumulate more subcutaneous and peripheral fat. Consequently, waist circumference is a more accurate measure of visceral fat in men than in women. This may make waist circumference a stronger risk factor of cancer in men, and explain why waist circumference adds risk information beyond that conveyed by b in men, but not women.""

They suggest: ""Including hip circumference into risk models may provide further insights into this sex difference and enhance the association between WC and cancer, particularly for women – this is because, especially in women, the combination of waist circumference and hip circumference give a better estimation of visceral fat than waist circumference alone.""

They go on to explain that research has indicated that adiposity, especially central adiposity, leads to higher concentrations of circulating insulin in men than in women. This may also partly explain why WC is more strongly associated with cancer risk in men. They say: ""The divergence in how waist circumference and BMI relate to cancer risk between men and women underscores the complexity of the impact of adiposity on cancer development. It suggests that considering biological and physiological differences between the sexes might be helpful when assessing cancer risk. Further research is needed to explore these sex differences.""

They conclude: ""Our study provides evidence that waist circumference is a stronger risk factor than BMI for obesity-related cancers in men, but not in women. Additionally, waist circumference appears to provide additional risk information beyond that conveyed by BMI in men. The weaker contribution of WC beyond that of BMI in women may result from sex-specific interactions with adiposity measures, such as with sex hormones, on obesity-related cancer risk, or differences in how waist circumference and BMI reflect body fat in men vs. women. Future research incorporating more precise measures of adiposity, along with comprehensive data on potential confounding factors, could further elucidate the relationship between body fat distribution and cancer risk.""",news-medical
https://news-medical.net,Simple urine test may spare kidney cancer patients from invasive scans,https://news-medical.net/news/20250324/Simple-urine-test-may-spare-kidney-cancer-patients-from-invasive-scans.aspx,"Mon, 24 Mar 2025 00:00:00 GMT","A simple urine test could accurately show the recurrence of kidney cancer at an early stage, potentially sparing patients invasive scans and enabling faster access to treatment, new research has shown.

The findings are presented today [Monday 24 March 2025] at the European Association of Urology (EAU) Congress in Madrid and have been accepted for publication in European Urology Oncology.

The test analyses the distinctive profiles of certain types of sugar molecules, called glycosaminoglycans which are found in urine. These profiles are known as the GAGome.

The international AURORAX-0087A (AUR87A) study is assessing whether a GAGome test can accurately detect the return of clear cell renal cell carcinoma (ccRCC) following surgery. This is the most common form of kidney cancer and accounts for up to 90% of cases. There are around 400,000 patients diagnosed with ccRCC worldwide each year.

Around one-fifth of ccRCC patients who have surgery to remove their cancer will see it return within five years – the majority within the first two years. Currently, the only way to monitor patients is through a scan – usually a CT scan – every 6 to 12 months, with the frequency depending on their level of risk.

The study's initial cohort involved 134 patients treated at 23 hospitals across the UK, EU, USA and Canada. The patients were all diagnosed with ccRCC which had not spread beyond the kidney, and which was treated with surgery. Most had their kidney completely removed. All patients continued to have CT scans as standard monitoring after surgery, alongside a urine test every 3 months. Each urine sample was analysed using mass spectrometry to produce a score out of 100, called the GAGome score.

After up to 18 months of follow up, 15% of patients had seen their cancer return. The GAGome test was extremely sensitive in picking up recurrence, correctly identifying 90% of patients whose cancer had returned, while correctly ruling out just over half of those who remained cancer-free. These results were based on a GAGome score threshold optimised at 12/100. A score above 12 was counted as positive, and 12 or below as negative.

A positive result in the study yielded a 26% chance the patient actually had a recurrence. More importantly, a negative GAGome score resulted in a highly reliable 97% chance that the patient did not have a recurrence. The higher the GAGome score, the more likely the positive result correctly identified recurrence.

This level of accuracy is similar to CT scans and offers advantages to using scans alone, according to lead researcher on the study, Saeed Dabestani, Associate Professor at Lund University and Consultant Urologist at Kristianstad Central Hospital, Sweden.

CT scans often pick up small lesions that aren't large enough to biopsy, and we currently don't know whether they are a sign of the cancer returning or not. Our only option is to do more frequent scans to monitor more closely, which is unpleasant for patients and often brings little benefit. If you have a urine test that can accurately show whether the cancer has actually returned then you can better assess risk levels and reduce the frequency of the scans required. Based on the results we have so far, it's likely that we could safely halve the number of scans that patients have to undergo."" Saeed Dabestani, Associate Professor at Lund University and Consultant Urologist at Kristianstad Central Hospital, Sweden

Dr. Carmen Mir Maresma, Consultant Uro-Oncologist from University Hospitals La Ribera in Valencia, Spain, and member of the EAU Scientific Congress Office said: ""Developing biomarkers for kidney cancer is a major challenge and this study provides a stepping stone towards that goal. The results are really interesting, in that the test showed a high negative predictive value. If the test comes back negative, you can be more or less sure there is no cancer recurrence, but if it's positive, then we need to look further. The test is also based on a suite of biomarkers, rather than just one molecule, which provides a more robust basis for making decisions on treatment.

""We don't know yet whether finding recurrence sooner will save patients' lives – more research is needed to determine that. There are also changes in post-operative treatment underway, with some countries licensing the immunotherapy pembrolizumab for kidney cancer. More research will also be needed to understand how this biomarker interacts with that therapy.""

The international team involved in the AUR87A study is nearing final recruitment of the second cohort of patients, the results from which will be used to validate the findings from the first cohort. These results are expected towards the end of this year.

The GAGome test used in the AUR87A study is under development by Swedish diagnostics company, Elypta, for whom Dabestani also acts as a medical adviser. The test has not yet been approved for clinical use in diagnostic procedures and further research will be required to confirm its effectiveness in clinical practice.",news-medical
https://news-medical.net,Epstein-Barr virus triggers inflammatory cell death in ulcerative colitis,https://news-medical.net/news/20250324/Epstein-Barr-virus-triggers-inflammatory-cell-death-in-ulcerative-colitis.aspx,"Mon, 24 Mar 2025 00:00:00 GMT","Ulcerative colitis (UC) is a chronic, relapsing disease that causes painful inflammation and ulcers in the colon. While its exact causes remain elusive, mounting evidence suggests that viral infections, particularly Epstein-Barr virus (EBV), may worsen disease severity. Elevated EBV DNA and RNA levels have been detected in the colonic tissues of UC patients, correlating with more aggressive symptoms, higher risks of surgery, and poorer treatment responses. However, the precise mechanisms linking EBV to UC progression have remained a mystery. Given these challenges, scientists have been eager to unravel how EBV contributes to UC and explore new therapeutic strategies.



In a pivotal study (DOI: 10.1093/pcmedi/pbaf002) published on January 21, 2025, in Precision Clinical Medicine, researchers from West China Hospital, Sichuan University, investigated the role of EBV in UC. By analyzing tissue samples from UC patients and conducting experiments in mouse models infected with murine gamma-herpesvirus 68 (MHV-68)—a close relative of EBV—the team uncovered a critical connection between EBV infection and macrophage-driven inflammation. Their results highlight a previously unknown mechanism that amplifies UC symptoms.



The study revealed that EBV infection dramatically increases the levels of pyroptosis-related proteins, including Gasdermin D, NLRP3, interleukin-1β (IL-1β), and interleukin-18 (IL-18), in the colon. Macrophages infected with EBV exhibited excessive inflammatory responses, leading to severe intestinal damage and compromised gut integrity. Notably, the researchers identified glycolysis as a central driver of this process—fueling the inflammation that worsens UC. Importantly, when the team blocked glycolysis using the metabolic inhibitor 2-deoxy-D-glucose (2-DG), macrophage pyroptosis was significantly reduced, leading to decreased inflammation in the colitis-afflicted mice. These findings establish a direct link between EBV, metabolic dysregulation, and immune activation in UC.



Dr. Hu Zhang, the study's corresponding author, underscored the importance of these discoveries: ""Our research provides compelling evidence that EBV actively contributes to UC severity by triggering inflammatory cell death in macrophages. More significantly, we have identified glycolysis as a potential target for intervention. By disrupting this metabolic pathway, we may be able to curb EBV-driven inflammation and improve treatment outcomes for UC patients.""



These findings could revolutionize UC treatment strategies. Current therapies primarily rely on immunosuppressants, which, while effective at controlling inflammation, may leave patients more vulnerable to viral infections like EBV. The study suggests that targeting glycolysis could offer a new therapeutic avenue—one that specifically combats EBV-induced inflammation while preserving immune function. Additionally, antiviral treatments that directly suppress EBV replication could be explored as adjunct therapies for UC patients with confirmed EBV infections. The next step will be clinical trials to translate these promising findings into real-world treatment strategies.



This research not only uncovers a hidden viral trigger in UC but also paves the way for innovative, precision-based therapies—offering new hope to patients struggling with the relentless burden of inflammatory bowel disease.

Source: Chinese Academy of Sciences Journal reference: Ma, C., et al. (2025). Epstein-Barr virus Infection Exacerbates Ulcerative Colitis by Driving Macrophage Pyroptosis via the Upregulation of Glycolysis. Precision Clinical Medicine. doi.org/10.1093/pcmedi/pbaf002.",news-medical
https://news-medical.net,Researchers develop tool to enhance NK cells against cancer,https://news-medical.net/news/20250324/Researchers-develop-tool-to-enhance-NK-cells-against-cancer.aspx,"Mon, 24 Mar 2025 00:00:00 GMT","A team of researchers from the Hospital del Mar Research Institute, the Universitat Autònoma de Barcelona and the Pompeu Fabra University has developed a new tool that allows modifying these NK cells to make them immune to the tumor’s defense mechanism.

Among other functions, the NK cells (Natural Killers, a type of lymphocyte forming part of the immune system) have the capacity to detect and eliminate cancer cells. But in some cases they cannot overcome the tumor's defense mechanism and the cancer grows. Now, a study published in Nature Immunology, with the involvement of the Hospital del Mar Research Institute, the Universitat Autònoma de Barcelona and the Pompeu Fabra University, proposes a new approach to strengthen NK cells in their fight agaist tumor cells.

The study, which included the collaboration of researchers from the Karolinska Institutet in Sweden, the German firm Miltenyi, and the Dutch firm Glycostem Therapeutics, was developed under the context of a European network. It also included the involvement of researchers from the Hospital Clínic-IDIBAPS, and from the CIBER Cancer Unit (CIBERONC), the CIBER Hepatic and Digestive Disorders Unit (CIBERehd), and the CIBER Infectious Diseases Unit (CIBERinfec). To strengthen the capacity of NK lymphocytes to eliminate tumors researchers used CRISPR/Cas9, a genetic editing tool, to eliminate a gene from these cells and make them resistant to two molecules that produce tumor cells.



The goal of the study was to confirm whether modified NK cells had the capacity to overcome the negative effects of the TGF-β and Activin A molecules in preclinical models of HER2 positive breast cancer tumor cells and metastatic colorectal cancer cells. The majority of solid tumors contain an abundance of both molecules to protect themselves against attacks from the immune system. The results, both in vitro and in mice models, demonstrate that the genetically modified NK cells are capable of reaching the tumors, penetrating and destroying them, i.e., break their protective barrier. ""When we compare genetically modified cells with non-modified cells, the first have a greater capacity to control the growth of in vivo tumors, both alone and when combined with other treatments and therapies being used, such as for example specific HER2 antibodies"", explains Dr. Aura Muntasell, researcher from the Immunity and Infection Research Group of the Hospital del Mar Research Institute and lecturer in the Department of Cell Biology, Physiology and Immunology of the Universitat Autònoma de Barcelona.

Modifying the SMAD4 gene

To achieve these effects, researchers deactivated a specific gene, the SMAD4, involved in the signalling of TGF-β and Activin A. ""To achieve this disactivation, the NK cells were transitorally exposed to the CRISPR/cas9 system, programmed with a guide so that they could head specifically towards the SMAD4, edit it and disappear"", explains Marc Güell, ICREA research lecturer and head of the Synbio Lab of the Pompeu Fabra University (UPF).



""By eliminating the SMAD4 we make these cells resistant to the TGF-β's inhibition but we continue to make use of the rest of the molecule's signaling to have them acquire a greater capacity to reach tumors and penetrate them"", adds Dr.. Muntasell. The study now published allows demonstrating the safety and efficiency of this approach. In collaboration with other institutions, it was also possible to verify that using it with other treatments under development that are based on the NK cells enables boosting its effect. ""This strategy is also applicable to NK cells generated through different protocols, including those expressing chimeric antigen receptors (CAR), which allows recognizing specific antigens found in cancer cells. In addition, it is promising for several clinical indications, since the TGF-β suppresses the immune response in multiple types of cancer"", points out Dr.. Anna Rea, first author of the article on the research conducted in her PhD thesis project at the UPF.



So far, treatments based on NK lymphocytes have been successful in hematological tumors, but have not achieved the same level of effectiveness in solid tumors. ""These genetically modified NK cells offer a great treatment opportunity for patients with solid tumors that are currently resistant to immunotherapy"", explains Dr. Clara Montagut, researcher at the Hospital de Mar Research Institute and head of the Digestive Oncology section in the Hospital del Mar Medical Oncology Service.



Dr. Muntasell and Dr. Montagut are precisely the two researchers leading a project that has received one of the independent research grants from the Instituto de Salud Carlos III. The grant will go towards developing a phase I clinical trial, the first of its kind, to prove the safety and tolerability of CRISP/Cas9-modified NK cells in combination with other treatments, in patients with refractory colon and rectal cancer.",news-medical
