Input URL,Title,Link,Published,Description,Source
https://news-medical.net,Depression prevention program shows unequal effectiveness among youth,https://news-medical.net/news/20250324/Depression-prevention-program-shows-unequal-effectiveness-among-youth.aspx,"Mon, 24 Mar 2025 00:00:00 GMT","A depression prevention program that has helped white youth wasn't effective for Black youth, raising concerns about the need for more research to help racially diverse groups, according to new research published by the American Psychological Association.

""I was very surprised that we couldn't help Black youth as much as white youth, and we don't know why there was such a profound difference in the outcomes."" said lead researcher Patrick Pössel, Dr. rer. soc., a professor of counseling psychology at the University of Louisville.

Pössel and some colleagues in Germany developed the LARS&LISA depression prevention program about 25 years ago, which was implemented successfully in schools in Germany and later in Tennessee.

The current study, published online in the Journal of Consulting and Clinical Psychology, included 425 freshman students (57% Black, 43% white) in a Louisville, Kentucky, high school serving primarily low-income students. Half of the students were in a control group while the other half participated in the 10-week LARS&LISA program.

The LARS&LISA program, which includes vignettes with two characters named Lars and Lisa, uses group sessions designed to build motivation through personal goal setting followed by aspects of cognitive behavioral therapy. Students are encouraged to recognize unhelpful thoughts and replace them with more helpful thoughts. In addition, they learn about the pros and cons of assertive, aggressive, passive-aggressive and withdrawing behaviors. They also practice the skills needed to form new social networks.

The students completed questionnaires about depressive symptoms before and after the LARS&LISA program and in a follow-up survey four months later. White youth who participated in the program reported significantly fewer depressive symptoms after completing the program and at the follow-up period. However, Black youth in the program didn't differ from the control group, with no significant benefits found after completing the program or at the follow-up period.

The study couldn't determine why the program was unsuccessful for Black youth so more research is needed, not only on that issue but to identify whether other depression treatment programs or models may experience the same shortcomings, Pössel said.

Psychological theories and treatment programs are largely developed based on white, middle-class, female American clients or college students in psychology courses. We need to take a step back and examine the consequences of these limitations. It's essential to be attentive to cultural and racial differences and not assume there's a one-size-fits-all approach."" Patrick Pössel, lead researcher

Other researchers found similar concerns with another youth depression prevention program that is based on cognitive behavioral therapy techniques. That study found the Penn Resiliency Program helped white and Latino youth but showed no significant effects on the depressive symptoms for Black youth. Other studies have found that Black youth's experiences with racism may put them at higher risk of depression, anxiety and suicide.

In the current study, the participants were from one high school in Louisville, Kentucky, who participated in the LARS&LISA program so the findings may not be generalizable across the United States or to other youth depression prevention programs. Only students who identified as white or Black were included in the analysis so there were no findings for other racial groups.",news-medical
https://news-medical.net,Lifelong weight patterns linked to kidney cancer risk,https://news-medical.net/news/20250324/Lifelong-weight-patterns-linked-to-kidney-cancer-risk.aspx,"Mon, 24 Mar 2025 00:00:00 GMT","Excess weight in mid-life is a known risk factor for kidney cancer, but new research indicates that weight patterns throughout life may also affect an individual's likelihood of developing this malignancy. The findings are published by Wiley online in CANCER, a peer-reviewed journal of the American Cancer Society.

To assess weight patterns and their associations with kidney cancer and its different subtypes, investigators analyzed information on 204,364 individuals from the NIH-AARP Diet and Health Study, including body mass index (BMI) data when participants entered the study (an average age of 61.6 years), and prior BMI recordings at 18, 35, and 50 years of age. The team noted that there were 1,425 cases of kidney cancer, or renal cell carcinoma (RCC), among the study's participants, with 583 having aggressive RCC and 339 having fatal RCC. The researchers also recorded the different subtypes of RCC, including clear cell RCC (541 patients), papillary RCC (146 patients), and chromophobe RCC (64 patients).

Higher BMI at any of the ages assessed was linked with higher risks of overall RCC and all subtypes (except chromophobe RCC), with a 10-40% higher risk for each 5-unit increase in BMI. Similar increased risks were linked to weight gain during adulthood that resulted in overweight or obesity, compared with maintaining normal BMI.

Also, long-term excess weight was associated with higher risks of overall RCC, aggressive RCC, fatal RCC, and clear cell RCC, but not papillary RCC and chromophobe RCC. Weight loss in which BMI was reduced by at least 10%, particularly later in life, was associated with a lower risk of RCC. Specifically, weight loss from age 18–35 years and after age 50 years was associated with 21% and 28% reductions in RCC incidence, respectively.

These findings emphasize that maintaining a healthy weight across one's lifetime is important for reducing RCC risk. More importantly, weight loss, even later in life, may offer protective benefits. We should support initiatives that promote healthy weight maintenance and weight loss strategies. Some of these include lifestyle interventions, weight-loss programs, and emerging medical treatments for obesity; however, individuals should consult with their healthcare providers prior to initiation of any plan."" Zhengyi Deng, PhD, lead author of Stanford University School of Medicine",news-medical
https://news-medical.net,Microdosing for Mental Health: Hype or Hope?,https://news-medical.net/health/Microdosing-for-Mental-Health-Hype-or-Hope.aspx,"Mon, 24 Mar 2025 05:15:00 GMT","Microdosing psychedelics, typically lysergic acid diethylamide (LSD) or psilocybin, has recently gathered attention for its potential to improve mental health. Although self-reported benefits include heightened creativity, mood enhancement, and reduced symptoms of depression, scientific evidence remains limited.

Nevertheless, anecdotal evidence strongly suggests low doses may support cognitive flexibility and mindfulness, thereby alleviating rumination. However, most findings come from small-scale or observational studies, with many confounding factors, such as expectancy effects, making it difficult to draw definitive conclusions.1

While early research on single low-dose LSD or psilocybin shows minimal adverse physiological effects, increases in anxiety and mood fluctuations have also been reported. Tolerance may develop quickly, suggesting that careful scheduling is crucial for sustained benefits. Crucially, large-scale, placebo-controlled trials are still needed to determine efficacy, safety, and overall long-term impact on depressive symptoms.1

This article explores the science behind microdosing psychedelics, its potential mental health benefits, risks, and the ongoing research to determine its therapeutic value.

Image Credit: Losangela/Shutterstock.com

Mechanism of action

Low doses of psychedelics like LSD and psilocybin primarily act through the brain’s serotonin system, notably by binding to 5-Hydroxytryptamine 2A (5-HT2A) receptors on neurons in key regions such as the prefrontal cortex and hippocampus.

As partial agonists, these substances subtly modulate both excitatory (glutamatergic) and inhibitory (GABAergic) neural signaling. In other words, they can nudge the balance of neuronal activity without triggering the pronounced perceptual alterations typical of higher doses.2

By engaging 5-HT2A receptors, low-dose psychedelics promote moderate changes in cellular signaling pathways, including those involving intracellular calcium and the release of neurotransmitters.

This can result in a mild increase in neuroplasticity, essentially making it easier for neurons to reorganize and form new connections. These small shifts in connectivity patterns are thought to facilitate flexible thinking, creativity, and stress resilience.2

Moreover, these compounds gently affect the default-mode network (DMN), a brain system active during self-reflective thought and mind-wandering. Under low-dose conditions, psychedelics may reduce the DMN’s rigid activity, loosening habitual rumination without causing the full “ego-dissolution” reported at higher doses.

Altogether, these mechanisms underlie the mood, cognition, and creativity benefits attributed to psychedelic microdosing while minimizing the more intense hallucinogenic effects.2

Psychedelic Medicine: Past, Present, and Future

Cognitive and emotional benefits

Cognitive and emotional benefits, including reported enhancements in creativity, focus, and emotional resilience, have been increasingly associated with interventions like psilocybin therapy.

Some participants who have undergone carefully guided psilocybin sessions describe heightened imaginative thinking, allowing for original and meaningful ideas and fresh perspectives. This mental flexibility can foster greater problem-solving abilities and stimulate personal or professional creativity.3

Additionally, a sense of sharpened focus is often noted during or after psilocybin experiences, as it may temporarily diminish habitual cognitive patterns that hinder concentration. By altering perception and promoting introspection, these experiences might also boost emotional resilience.

Over time, individuals can potentially develop improved stress management skills and maintain greater stability in emotionally challenging circumstances. 3

Researchers suggest that psilocybin’s effects on neural pathways, combined with the reflective nature of the experience, could explain outcomes. The subsequent “afterglow” period, marked by ongoing feelings of well-being, is believed to play a pivotal role in consolidating positive changes.

Although preliminary findings remain subject to further scientific inquiry, they underscore a growing interest in harnessing psilocybin’s potential to bolster creativity, refine focus, and build emotional fortitude. With the rise of rigorous clinical trials, these cognitive and emotional benefits continue to intrigue scientists and clinicians worldwide.3

Does Microdosing Actually Work? Play

Risks and ethical considerations

Microdose clinical trials, though designed as minimal-risk studies, present certain concerns. There is still some risk to participants, including unforeseen pharmacokinetic variations and radiation exposure from labeled compounds.

Additionally, there are financial and resource costs, and the predictability of therapeutic dose effects remains debated. There is also a risk of exploitation, where participants, particularly in vulnerable populations, may not fully understand the implications of their involvement.4

Placebo-controlled trials present certain risks and ethical concerns. These include the potential for participants to encounter unanticipated side effects, as placebos can lead to both beneficial and harmful responses, commonly referred to as placebo or nocebo effects.

Ethically, investigators must ensure participants are fully informed of known and possible risks, including the uncertainty regarding outcomes, which can complicate consent. The nocebo effect can intensify symptoms or produce adverse events when participants anticipate negative consequences, potentially undermining the principle of beneficence.4,5

In many jurisdictions, ethical guidelines and legal regulations require detailed disclosure of key aspects of study participation, ensuring individuals can make autonomous decisions about their involvement. Failure to address possible placebo effects may lead to suboptimal sample-size calculations or misinterpretation of results, potentially invalidating trial outcomes.

In cases where studies investigate subjective measures, such as pain, the influence of participants’ expectations can be significant, emphasizing the need for precise language and transparent protocols.4,5

Legally, researchers and sponsors must adhere to federal guidelines, institutional review board requirements, and any relevant international standards, emphasizing accurate disclosure and participant protection.

Ultimately, balancing scientific rigor with comprehensive patient understanding is essential to safeguard participant welfare while advancing knowledge in medical research and maintaining public trust.4,5

Download your PDF copy now!

Clinical trials and scientific evidence

Recent controlled studies on microdosing psychedelics, particularly LSD, have focused on understanding both acute and long-term effects. These trials, conducted under rigorous double-blind, placebo-controlled conditions, have primarily examined physiological, behavioral, and subjective effects in healthy adults.4,6

Low doses of LSD (5-20 mg) have shown acute effects on mood, neural connectivity, and pain perception. Some studies indicate potential therapeutic effects for depression, anxiety, and cognitive performance, but findings remain inconsistent. While short-term mood improvements have been observed, repeated doses did not lead to sustained cognitive or emotional benefits.4,6

No serious adverse events have been reported. Common side effects include increased blood pressure, mild anxiety, and occasional headaches. Anxiety-related withdrawal occurred in a subset of participants. Repeated dosing over six weeks did not produce harmful effects but also lacked evidence of cumulative therapeutic benefits.4,6

Future of psychedelic research

Recent regulatory shifts and expanding therapeutic evidence suggest that psychedelics are poised to play an increasingly significant role in mental health care. After decades of prohibition, the Food and Drug Administration (FDA) has granted Breakthrough Therapy Designation to substances such as 3,4-Methylenedioxymethamphetamine (MDMA) for Post-Traumatic Stress Disorder (PTSD) and psilocybin for treatment-resistant depression.

These approvals accelerate research and could prompt rescheduling from Schedule I to a classification more conducive to medical use. As large-scale phase 3 trials continue, scientists are focusing on safety, efficacy, and the mechanisms underlying these substances’ profound psychological effects.

Emerging data indicate that psychedelics, combined with structured psychotherapeutic support, can yield rapid and long-lasting symptom improvement, surpassing many conventional interventions.7

Simultaneously, alternative frameworks are taking shape, including state-level legalization efforts and group-based therapy models designed to reduce costs. Moving forward, rigorous studies must address practical challenges such as equitable access, clinical training, and insurance coverage.

Researchers are also increasingly investigating applications beyond depression and PTSD, including substance use disorders, existential distress in terminal illness, and eating disorders. As psychedelic interventions evolve, thoughtful collaboration among clinicians, scientists, policy-makers, and communities will be essential. In doing so, we can ensure safe, evidence-based integration of these once-maligned substances into modern therapeutic paradigms.7

The Truth About Mushroom Coffee: Benefits vs. Hype

Conclusion

Scientific Validity & Clinical Potential Microdosing psychedelics, such as LSD and psilocybin, is gaining attention for potential mental health benefits. Early studies suggest improvements in mood, creativity, and cognition, but evidence remains limited.

Most research relies on self-reports, with placebo-controlled trials showing mixed results. While neurobiological mechanisms indicate possible antidepressant effects, long-term safety and efficacy are unclear. Regulatory challenges and inconsistent dosing further complicate clinical adoption.

More rigorous, large-scale studies are needed to validate therapeutic claims. Until then, microdosing remains an intriguing yet unproven intervention, requiring cautious exploration within controlled settings.

References

Kuypers, K. P. (2020). The therapeutic potential of microdosing psychedelics in depression. Therapeutic advances in psychopharmacology, 10, 2045125320950567. Smausz, R., Neill, J., & Gigg, J. (2022). Neural mechanisms underlying psilocybin’s therapeutic potential–the need for preclinical in vivo electrophysiology. Journal of psychopharmacology, 36(7), 781-793. Meshkat, S., Tello‐Gerez, T. J., Gholaminezhad, F., Dunkley, B. T., Reichelt, A. C., Erritzoe, D., ... & Bhat, V. (2024). Impact of psilocybin on cognitive function: A systematic review. Psychiatry and Clinical Neurosciences, 78(12), 744-764. Kurihara, C. (2011). Ethical, legal, and social implications (ELSI) of microdose clinical trials. Advanced drug delivery reviews, 63(7), 503-510. https://doi.org/10.1016/j.addr.2011.01.002 Feldman, H. A., Feldman, J. A., Miller, C. C., Walsh, G., & Tyson, J. E. (2022). Informed Consent for Placebo‐Controlled Trials: Do Ethics and Science Conflict?. Ethics & human research, 44(5), 42-48. Murphy, R. J., Muthukumaraswamy, S., & de Wit, H. (2024). Microdosing psychedelics: current evidence from controlled studies. Biological Psychiatry: Cognitive Neuroscience and Neuroimaging. Barber, G. S., & Aaronson, S. T. (2022). The emerging field of psychedelic psychotherapy. Current psychiatry reports, 24(10), 583-590. https://doi.org/10.1007/s11920-022-01363-y

Further Reading",news-medical
