Input URL,Title,Link,Published,Description,Source
https://blockonomi.com,Pepe (PEPE) Price: 11% Surge Signals Potential for Additional 25% Growth,https://blockonomi.com/pepe-pepe-price-11-surge-signals-potential-for-additional-25-growth/,"Thu, 27 Mar 2025 10:49:32 GMT","Pepe, the world’s third-largest meme cryptocurrency, has seen an 11% price increase over the past 24 hours. The frog-themed token is showing strong signs of recovery after breaking through a key resistance level.

On March 26, PEPE recorded an 11% gain as the overall crypto market began to rebound. This price surge followed PEPE’s breakout from a descending trendline that had been in place since early February 2025.

At press time, PEPE is trading at approximately $0.0000087. The price jump comes despite a 10% drop in trading volume, which indicates lower participation from traders compared to the previous day.

Technical Analysis

Technical analysis suggests that PEPE remains in bullish territory as long as it stays above the $0.0000080 level. If this support holds, the token could see another 25% price increase in the near term.

The Relative Strength Index (RSI) for PEPE currently stands at 59. This reading signals a strong bullish trend while leaving room for additional upside potential.

PEPE’s recent performance marks a major turnaround from earlier in the month. The token experienced a 35% decline in the first half of March, bottoming out at $0.000057 on March 10.

Since mid-March, PEPE has erased all of these losses. The recovery appears to be gaining momentum as on-chain metrics show decreased selling pressure across the market.

Data from blockchain analytics firm Santiment reveals growing investor confidence in PEPE. There has been a marked increase in holders with balances between 100,000-1,000,000 and 1,000,000-10,000,000 tokens.

Social media sentiment around PEPE has also improved. The sentiment score has risen from -0.77 at the start of March to +0.387 currently, reflecting growing optimism among traders and investors online.

According to IntoTheBlock, PEPE’s holding time of transacted coins over the past two weeks has jumped to 2.67 trillion. This metric indicates that investors are holding onto their tokens rather than selling them.

The In/Out of Money Around Price (IOMAP) indicator shows strong support near the $0.0000080 level. Over 10,000 addresses hold approximately 26 trillion tokens at this price point.

This support level exceeds the unrealized loss volume between $0.0000090 and $0.000010, suggesting that PEPE is well-positioned to break above the $0.000010 mark in the short term.

From a technical standpoint, PEPE has broken above a prolonged downtrend on the daily chart. The Moving Average Convergence Divergence (MACD) reading has bounced into positive territory, further confirming the bullish outlook.

If current trends hold, analysts predict PEPE could climb to $0.000014 around the 0.618 Fibonacci level. Should market conditions continue to improve, the token might reach as high as $0.000020.

However, if PEPE fails to breach the $0.000010 resistance level, the price could fall back to $0.0000053.",blockonomi
https://blockonomi.com,"Ethereum (ETH) Price: Technical Analysis Shows Consolidation Between $1,980 and $2,100",https://blockonomi.com/ethereum-eth-price-technical-analysis-shows-consolidation-between-1980-and-2100/,"Thu, 27 Mar 2025 10:45:19 GMT","TLDR

Ethereum recently tested the $1,980 support level after failing to break above $2,100

ETH is trading below the 100-hourly Simple Moving Average with resistance at $2,050

Technical patterns show a potential bearish flag formation on the daily chart

Some analysts predict a possible breakout beyond $2,100 based on chart patterns

Long-term comparisons suggest similarities to the 2018-2020 pattern before ETH’s major rally

Ethereum has entered a consolidation phase following a recent price pullback. The second-largest cryptocurrency tested the $1,980 support level after failing to maintain momentum above $2,100. Currently trading around $2,064, ETH shows mixed signals as traders watch key technical levels.

The price recently bounced from a low of $1,982 and moved back above the $2,000 level. This recovery represents a 23.6% Fibonacci retracement of the decline from the $2,097 swing high.

ETH is now trading below the 100-hourly Simple Moving Average. Technical indicators show a bearish trend line forming with resistance at $2,050 on the hourly chart.

The cryptocurrency faces hurdles near the $2,040 level. This coincides with the 50% Fibonacci retracement level of the recent decline from the $2,097 high to the $1,982 low.

On the upside, ETH must clear several key resistance levels to gain upward momentum. The first major resistance sits at $2,050, followed by a stronger barrier at $2,100.

If Ethereum breaks above the $2,100 level, it could potentially target the $2,150 zone. Further strength could push the price toward $2,250 or even $2,320 in the coming sessions.

On the downside, ETH has key support at the $2,000 level. The first major support level is at $1,980, which recently prevented further decline.

If Ethereum breaks below $1,980, the next support levels are at $1,920 and $1,880. Beyond that, the $1,810 level would become an important zone to watch.

Looking at the broader picture, Ethereum’s weekly chart shows concerning patterns. ETH formed a triple-top pattern around the $4,000 level, with tests in March, May, and November of last year.

The cryptocurrency has broken below the neckline of this pattern at $2,138. It has also fallen below an ascending trendline that connected the lowest swings since July 2022.

Adding to the bearish signals, ETH has dropped below both the 50-week and 200-week moving averages. Some analysts suggest this could lead to a decline toward $1,140 based on technical projections.

The daily chart reveals that ETH has stabilized recently, moving from a low of $1,763 to a high of $2,130. However, it remains below the 50-day moving average, suggesting bears still have control.

A bearish flag pattern has formed on the daily chart. This continuation indicator often leads to a bearish breakdown when confirmed.

Market Analysis

Some market watchers also point to a rising wedge pattern with two ascending and converging trendlines. This formation typically precedes a downward move, with a potential target at $1,763.

Not all analysts share the bearish outlook. Some experts believe Ethereum could break beyond $2,100 soon based on chart patterns and price action.

Analyst Crypto Patel identified a setup suggesting upward momentum. He noted that ETH is bouncing off a key area around $2,064, which he calls a “mitigation block” showing strong buying interest.

#Ethereum Prints Bullish Displacement – Swing High Liquidity in Sight$ETH Price respecting bullish POI with clear displacement on tap. Currently testing mitigation block post-retest. Anticipating bounce to sweep swing high liquidity at $2128.12. ➡️ Entry: $2064.60

➡️TP:… pic.twitter.com/5Q2q5xrNpM — Crypto Patel (@CryptoPatel) March 25, 2025

Patel targets $2,128 as a swing high liquidity zone that could trigger a sharp move upward. His analysis includes a stop-loss at $2,027 to limit potential downside.

Another analyst, TimeFreedomROB, compared Ethereum’s current weekly pattern to what happened between 2018 and 2020. He suggests the current pattern resembles the setup before ETH’s massive rally from under $100 to nearly $4,800.

#ETH 1W Price is showing the Same type of Break below support as last Cycle 👀 Will Price Recover Rapidly Like Last Time? 📈 pic.twitter.com/uoIDTd5w8L — TimeFreedom ®️0️⃣🅱️ ⚡ (@TimeFreedomROB) March 25, 2025

For Ethereum to confirm a return to an upward trend on the weekly chart, it needs to climb back above the $2,200 to $2,400 range.

As of the latest data, Ethereum has gained 6% over the past week. Its market value stands at approximately $250 billion, with daily trading volume around $11.71 billion.",blockonomi
https://blockonomi.com,The Blockchain Group Adds 580 Bitcoin to Treasury Holdings,https://blockonomi.com/the-blockchain-group-adds-580-bitcoin-to-treasury-holdings/,"Thu, 27 Mar 2025 10:41:24 GMT","TLDR

The Blockchain Group has purchased 580 Bitcoin worth approximately $50 million

The company’s stock has jumped 226% since beginning its Bitcoin strategy in November

This is the largest of three Bitcoin purchases made by the organization

The Blockchain Group now holds 620 BTC total, valued at around $54 million

GameStop also announced plans to purchase Bitcoin on the same day, with shares jumping 12%

The Blockchain Group, a France-based company, has added 580 Bitcoin to its treasury. This purchase is worth about $50.64 million with Bitcoin trading at $87,311. This marks the largest Bitcoin purchase for the company since it began collecting the cryptocurrency.

The company started its Bitcoin strategy in November 2024. Since then, its stock price has risen 226%.

The Blockchain Group made its first Bitcoin purchase on November 5. This was the same day Donald Trump won the US presidential election. This timing put the company in position to benefit from Bitcoin’s rally to $100,000 in December.

The second purchase came on December 4. The company bought 25 Bitcoin when the price was around $96,000. Bitcoin reached six figures the next day.

Strategic Bitcoin Treasury Expansion Pays Off

The latest purchase of 580 Bitcoin brings their total holdings to 620 BTC. This is worth approximately $54 million at current prices.

The company funded this purchase through a convertible bond issue announced earlier in March. Swissquote Bank executed the transaction.

The Blockchain Group is listed on Euronext Paris. This is Europe’s second-largest stock exchange by market capitalization.

The company describes itself as a “global umbrella” of businesses. These focus on data intelligence, AI, and decentralized technology.

Since beginning its Bitcoin accumulation strategy, the company’s stock has risen to 0.48 euros ($0.52). This represents a 225% increase in share price.

The latest Bitcoin purchase announcement came after market close on March 26. This coincided with news from another company making similar moves.

GameStop announced plans to purchase Bitcoin on the same day. Following this news, GameStop shares jumped nearly 12%.

GameStop plans to finance its Bitcoin purchase through debt financing. After markets closed, the company announced a $1.3 billion convertible notes offering.

The Blockchain Group has introduced new key performance indicators. These include “BTC Yield,” “BTC Gain,” and “BTC € Gain.” These metrics track the company’s Bitcoin Treasury strategy performance.

Since the beginning of the year, the group reports a BTC Yield of approximately 710%. They also report a BTC Gain of 283.9 BTC.

The company’s strategy draws inspiration from Strategy. Strategy is currently the world’s largest Bitcoin treasury firm, holding over 506,137 Bitcoin. Strategy maintained a 12-week consecutive Bitcoin buying streak between November and January.

Alexandre Laizet serves as Deputy CEO and Director of Bitcoin Strategy at The Blockchain Group. In an interview, he described their approach: “The essence of our strategy is simple: accumulate Bitcoin, never sell it, and hold it indefinitely.”

The company aims to maximize Bitcoin per share over time. This involves accumulating Bitcoin through excess cash flow and capital raises.

Laizet believes Bitcoin offers a unique opportunity. He sees it as a way to engage in mergers and acquisitions every few months. The asset delivers approximately 60% annualized growth over four years without typical M&A execution risks.

The goal is to enhance long-term shareholder value through capital-raising activities. Laizet predicts institutional Bitcoin adoption will take 10-15 years to achieve widespread acceptance.

“The next phase is to establish necessary links between traditional finance and the emerging Bitcoin-driven financial ecosystem,” Laizet explained. This includes adding Bitcoin to corporate treasuries and enabling transactions through stablecoins and blockchain-based money market funds.

The Blockchain Group is backed by Adam Back. It was founded in 2008 and became the first European company to adopt a Bitcoin treasury strategy when it launched this initiative on November 5, 2024.",blockonomi
https://blockonomi.com,Cardano (ADA) Price: On-Chain Metrics Show Growing Bullish Sentiment,https://blockonomi.com/cardano-ada-price-on-chain-metrics-show-growing-bullish-sentiment/,"Thu, 27 Mar 2025 10:32:56 GMT","TLDR

Cardano (ADA) price currently hovers around $0.74 after recovering over 4% this week

Long-to-short ratio reached a monthly high of 1.15, indicating increased bullish sentiment

Stablecoin market cap on Cardano hit an all-time high of $30.77 million, showing growing DeFi adoption

Technical analysis suggests potential for 13% gains if ADA breaks above $0.77 resistance

Exchange outflows of $13.75 million worth of ADA in 24 hours suggest accumulation by whales

Cardano (ADA) is showing signs of bullish momentum this week as on-chain metrics point to growing trader confidence in the eighth-largest cryptocurrency by market capitalization.

The digital asset is currently trading at around $0.74, having recovered more than 4% so far this week. This recovery comes after weeks of consolidation in a tight range between $0.69 and $0.75.

Data from Coinglass shows that the long-to-short ratio for Cardano has reached 1.15, its highest level in over a month. A ratio above one means more traders are betting on price increases rather than decreases.

Another positive signal comes from Cardano’s stablecoin sector. According to DefiLlama, the total market capitalization of stablecoins on the Cardano network reached an all-time high of $30.77 million earlier this week.

This rise in stablecoin activity indicates growing utility and adoption of Decentralized Finance (DeFi) applications on the Cardano blockchain. More users are turning to Cardano-based financial tools, which could boost demand for the native ADA token.

Technical Analysis

From a technical perspective, Cardano is approaching a key resistance level. The cryptocurrency faced rejection around its 50-day Exponential Moving Average (EMA) of $0.77 on Wednesday, resulting in a 2.16% decline.

Chart analysts point to $0.77 as a crucial level to watch. If ADA breaks above this resistance and maintains a daily close above it, the price could rally by 13% to test the next resistance at $0.83.

The Relative Strength Index (RSI) on the daily chart reads 49 and is moving upward toward the neutral level of 50. This suggests fading bearish momentum in recent trading sessions.

Further supporting the bullish case, the Moving Average Convergence Divergence (MACD) indicator on the daily chart showed a bullish crossover on Tuesday. This technical signal often indicates the start of an upward trend.

On-chain data from Coinglass reveals that exchanges have witnessed an outflow of $13.75 million worth of ADA tokens in the past 24 hours. Such outflows typically indicate that investors are moving tokens to private wallets for long-term holding rather than selling.

These exchange outflows can reduce selling pressure in the market and potentially trigger upward price movement as supply available for immediate trading decreases.

However, traders should exercise caution despite these positive signals. Data from Santiment shows a spike in the Age Consumed metric, indicating movement from previously dormant wallets.

This activation of dormant tokens could lead to increased selling pressure if long-term holders decide to take profits at current price levels.

Looking at lower timeframes, some analysts have identified an ascending triangle pattern forming on the 4-hour chart. This pattern, bounded by horizontal resistance at $0.775 and a rising trendline below, often precedes breakout movements.

A successful breakout above the triangle pattern could accelerate buying pressure and push Cardano’s price up by 15% to challenge resistance at $0.90, with a potential further rise toward the $1 mark.

The Bollinger Bands indicator on the 12-hour timeframe appears to be squeezing, which typically signals an impending increase in volatility. This could result in a strong price move in either direction once the consolidation phase ends.

Trading volume for ADA has dropped by 18% in the past 24 hours, suggesting some hesitation among market participants ahead of a potential breakout. Lower volume during consolidation is common before major price movements.

For now, Cardano remains in a decisive phase, with technical indicators and on-chain metrics suggesting building momentum for a potential upward move if key resistance levels can be overcome.",blockonomi
https://blockonomi.com,Binance Coin (BNB) Price: Technical Analysis Shows Potential Breakout Above $630,https://blockonomi.com/binance-coin-bnb-price-technical-analysis-shows-potential-breakout-above-630/,"Thu, 27 Mar 2025 10:25:27 GMT","TLDR

BNB price is recovering above the $620 resistance zone after finding support at $600

Bitcoin’s rally to $88,000 appears to be driving a market-wide recovery

Technical indicators show BNB faces resistance at $630 with support at $622 and $615

BNB is up 13.4% in the 14-day charts despite a 0.3% daily dip

CoinCodex predicts BNB could reach $1,000 by April 10 and potentially hit $1,610 by May 11

BNB price is showing strong recovery signs after finding solid support around the $600 level. The cryptocurrency is now trading above the $620 resistance zone as the broader market enters what appears to be another bullish phase.

The price movement comes as Bitcoin has reclaimed the $88,000 price point. This follows BTC’s recent drop to levels below $79,000.

BNB is currently experiencing mixed performance across different timeframes. The asset shows a small daily decline of 0.3% and a 1% drop in monthly charts.

However, the bigger picture reveals more positive momentum. BNB has gained 2.5% in weekly charts and an impressive 13.4% over the 14-day period.

Since March 2024, BNB has increased by 6.4%. This recovery is part of a broader market trend that has pushed the global cryptocurrency market cap back to $3 trillion.

Technical Analysis

Technical analysis shows BNB broke above several key resistance levels including $618 and $610. The price even recovered above $625, following similar patterns seen with Ethereum and Bitcoin.

BNB managed to break above the 23.6% Fibonacci retracement level. This level is calculated from the recent downward move from the $645 swing high to the $615 low.

Currently, BNB trades below $630 and the 100-hourly simple moving average. The price faces resistance near the $628 level on the upside.

A bearish trend line is forming with resistance at $627 on the hourly chart. Additional resistance sits near the $630 level, which corresponds to the 50% Fibonacci retracement level.

If BNB can break clearly above the $630 zone, the price could move higher toward the $638 level. A successful close above $638 might set the stage for a larger move toward the $650 resistance.

Should BNB fail to clear the $630 resistance, another decline could begin. The first support on the downside is near $622, with major support at $615.

The main support remains at $600. A break below this level could take BNB toward $585 or potentially $565 in a larger decline.

Technical indicators provide additional insight into BNB’s current state. The MACD for BNB/USD is gaining momentum in the bullish zone, while the RSI remains above the 50 level.

BNB reached an all-time high of $788.84 in December last year. The current price represents a 20% drop from that peak.

According to predictions from CoinCodex, BNB may enter another bullish phase in the coming weeks. The platform anticipates continued rally for the foreseeable future.

CoinCodex forecasts BNB to breach the $1,000 mark by April 10. Their most bullish prediction suggests BNB could hit a new peak of $1,610.24 by May 11.

If realized, this would represent a 154.64% price increase from current levels. However, CoinCodex doesn’t expect BNB to maintain prices above $1,000 for long, predicting a correction shortly after reaching the peak.

The broader crypto market recovery appears linked to several factors. The SEC dropping its litigation against Ripple and announcing four more crypto roundtables may have improved sentiment.

Additionally, the US announcement about easing tariffs might have boosted overall investor confidence. These developments collectively appear to be driving the current market recovery.

For BNB, the immediate focus remains on whether it can clear the $630 resistance level. This will likely determine if the recovery continues toward higher targets or faces another pullback.",blockonomi
https://blockonomi.com,"Senate Votes to Repeal IRS DeFi Broker Rule, Awaits Trump’s Signature",https://blockonomi.com/senate-votes-to-repeal-irs-defi-broker-rule-awaits-trumps-signature/,"Thu, 27 Mar 2025 10:19:05 GMT","TLDR

The U.S. Senate voted 70-28 to repeal an IRS rule that would have required DeFi platforms to report taxpayer information

The resolution now heads to President Trump, who is expected to sign it

Critics argued the rule was “fundamentally unworkable” since DeFi platforms operate through automated code without human oversight

The White House’s AI and crypto czar David Sacks has expressed support for killing the rule

Industry groups like the Blockchain Association and DeFi Education Fund opposed the rule through lobbying and lawsuits

President Donald Trump is expected to sign a resolution that will repeal a Biden-era IRS rule requiring decentralized finance (DeFi) platforms to report taxpayer information. This comes after the U.S. Senate voted 70-28 on Wednesday to approve the measure, delivering a victory for crypto industry advocates.

The rule would have expanded the definition of “brokers” to include DeFi platforms. Under this definition, these platforms would need to collect and report information about users and their transactions to the IRS.

Critics of the rule argued it was impossible to implement. DeFi platforms operate through automated code on blockchains. They function without human intervention.

These platforms often have no way to identify their users. This makes compliance with traditional broker reporting requirements extremely difficult.

The resolution to overturn the rule passed with strong bipartisan support. Many Democrats joined Republicans in voting against the rule.

Industry Celebrates as Congressional Pushback Succeeds

The House of Representatives had earlier passed a similar resolution with a 292-132 vote. The measure needed to start in the House due to constitutional rules about budget matters.

There was some procedural delay in the process. The Senate initially passed a version of the resolution in early March.

However, the House cited constitutional concerns over how budget matters are handled. This led to a restart of the process with the House passing its own version.

Treasury Secretary Scott Bessent has indicated his office plans to work with the IRS and the Office of the Comptroller of the Currency. They aim to “rescind and amend” related crypto tax rules affecting digital asset firms.

The White House’s AI and crypto czar, David Sacks, has publicly supported the resolution. He stated that the Trump administration “strongly supports” the passage of the measure.

Industry groups have been fighting against the rule since it was introduced. The Blockchain Association, DeFi Education Fund, and Texas Blockchain Council filed a joint lawsuit in December.

These groups claimed the Treasury went beyond its authority by expanding the definition of “broker.” They argued that DeFi interfaces don’t control transactions or user funds.

Blockchain Association CEO Kristin Smith praised the Senate vote. She stated the group looked forward “to taking this harmful rule off the books for good.”

Not everyone supported repealing the rule. Democratic Representative Lloyd Doggett opposed the resolution. He argued it creates a “loophole that would be exploited by wealthy tax cheats, drug traffickers and terrorist financiers.”

Doggett called the repeal a “special interest exemption” from IRS disclosures. He claimed it would make tax evasion and money laundering easier.

The rule was part of the Biden administration’s effort to close tax gaps related to crypto transactions. It aimed to increase visibility into blockchain-based financial activity.

If President Trump signs the resolution as expected, the expanded definition of brokers will be formally removed from IRS enforcement policy. This would prevent DeFi platforms from having to implement traditional reporting requirements.

Industry experts believe this move aligns with the Trump administration’s more crypto-friendly approach. The administration has signaled its intention to support innovation in the blockchain space.",blockonomi
