Input URL,Title,Link,Published,Description,Source
https://coindesk.com,"Atkins chosen by Trump, a candidate for the post of head of the Securities and US Exchange Commission and Exchange, promises a new position in the crypto, but receives few questions",https://coindesk.com/ru/policy/2025/03/27/trump-s-pick-to-run-sec-paul-atkins-promises-new-crypto-stance-gets-few-questions,"Thu, 27 Mar 2025 00:00:00 GMT","Пол Аткинс, бывший член Комиссии по ценным бумагам и биржам США, которого президент Дональд Трамп назначил руководителем агентства, заверил, что агентство будет придерживаться иного направления в отношении Криптo , чем в последние четыре года, хотя в ходе встречи его T задавали общенациональных вопросов о цифровых активах. слушание по утверждению кандидатуры в четверг.

Продолжение Читайте Ниже Не пропустите другую историю. Подпишитесь на рассылку State of Crypto сегодня . Просмотреть все рассылки Подписаться Подписавшись, вы будете получать электронные письма о продуктах CoinDesk и соглашаетесь с нашим правила пользования и политика конфиденциальности .

Теперь, когда Трамп обеспечил себе эшелон кабинета министров в своем правительстве, Белый дом работает над тем, чтобы провести главных руководителей агентств через процесс утверждения в Сенате. Хотя многие заголовки о Криптo в эти дни исходят от администрации и Конгресса, те, кто руководит регулирующими агентствами, в конечном итоге будут теми, кто будет писать правила, которым должна будет соответствовать отрасль.

Аткинс стремится стать преемником бывшего председателя Гэри Генслера, чьи годы работы в агентстве сделали его самым видным врагом сектора цифровых активов. Но кандидат Трампа уже позиционирует себя как резкий контраст с Генслером, который критиковал историю отрасли с мошенниками и утверждал, что нынешнего закона о ценных бумагах достаточно, чтобы рассматривать большую часть пространства так, как будто оно активно нарушает требования регистрации.

«Главным приоритетом моего председательства будет работа с моими коллегами-комиссарами и Конгрессом над созданием прочной нормативной базы для цифровых активов посредством рационального, последовательного и принципиального подхода», — заявил Аткинс.его подготовленные показанияна четверг.

Сенатор Тим Скотт, республиканец из Южной Каролины, возглавляющий комитет, заявил, что Аткинс «внесет давно назревшую ясность в вопрос цифровых активов».

Но еще до начала слушаний Аткинс подвергся резкой критике со стороны сенатора Элизабет Уоррен, законодателя Массачусетса, которая является высокопоставленным демократом в комитете, которая выразила сомнения относительно егоспособность быть беспристрастнымв секторе цифровых активов он работал консультантом.

За столом слушаний рядом с Аткинсом Гулд изложил свои доводы в пользу захвата Управления контролера денежного обращения, регулятора национальных банков. Управление контролера денежного обращения было важным игроком в кампании сектора цифровых активов против банковского надзора США, который давил на банки, заставляя их KEEP отрасль на расстоянии вытянутой руки. Криптo компании и инсайдеры боролись за сохранение банковских отношений и утверждали, что регуляторы создали эту «дебанковскую» напряженность.

Первый вопрос, заданный Гулду, касался этой ситуации: Скотт спросил, готов ли он изменить свою предыдущую позицию, на что Гулд ответил: «Безусловно».

Для Криптo ответы Аткинса по вопросам Криптo потенциально более актуальны. Но его T спрашивали о его взглядах на следующие шаги по надзору Криптовалюта или о законодательных усилиях , направленных на переделку Криптo США.

СБФ

В какой-то момент сенатор-республиканец Джон Кеннеди из Луизианы поднял тему бывшего генерального директора FTX Сэма Бэнкмана-Фрида, который, по его словам, LOOKS на «четвертого финалиста в конкурсе двойников Джона Белуши», и спросил Аткинса, расследовала ли SEC надлежащим образом деятельность родителей SBF на предмет их причастности к его мошеннической деятельности.

«Я с нетерпением жду возможности обратиться в SEC, чтобы узнать, что произошло», — сказал Аткинс. «Как и вы, я обеспокоен этими сообщениями».

Однако Кеннеди пошел дальше, указав на отсутствие ответственности, что свидетельствует о «двух стандартах закона и наказания» в США.

«Я T думаю, что SEC сделала хоть что-то», — сказал Кеннеди. «Они мошенники!» — закричал он. «И я ожидаю, что SEC что-то с этим сделает».

Немногие другие сенаторы углубились в более широкие вопросы Криптo , а те, от кого можно было ожидать этого, например, сенатор Синтия Ламмис, T присутствовали. Слушание длилось всего два часа и включало четырех кандидатов на различные должности, заставив некоторых демократов сетовать, что времени было T , чтобы поговорить с каждым.

Самые трудные моменты Аткинса были связаны с его пребыванием на посту комиссара SEC в преддверии кризиса 2008 года и недостатками агентства в контроле за ипотечными ценными бумагами, которые способствовали этому кризису. Аткинс отклонил основную ответственность за кризис, сказав, что она лежит на ипотечных гигантах Fannie Mae и Freddie Mac.

Следующим шагом в процессе утверждения станет голосование комитета по кандидатурам и направление их для возможного одобрения всем Сенатом.



",coindesk
https://coindesk.com,"Ghibli Studio gets acquainted with crypto, as Openai fester a new excitement around Memecoin",https://coindesk.com/ru/markets/2025/03/27/studio-ghilbi-memecoins-raffle-on-ethereum-solana-as-openai-s-4o-unleashes-new-trend,"Thu, 27 Mar 2025 00:00:00 GMT","A strange turn of events associated with the technologies of artificial intelligence and nostalgia is that the enthusiasts of memmakes release, pumping up and dumping tokens dedicated to the films of the GHIBLI studio, since the new tendency in the art of artificial intelligence has become viral over the past 24 hours.

This happened after the OpenAi model has recently been launched - the most powerful image generation tool that creates artwork based on specific user instructions and style recommendations, simulating the characteristic atmosphere and style of artists and animators.

Continuation Read below, do not miss another story. Subscribe to Crypto Long & Short today. View all newsletters subscribe to sign, you will receive emails about Coindesk products and agree with our rules of use and confidentiality policy.

The Internet mania of Thursday is characteristic of images created with the help of artificial intelligence and stylized as a bizarre, hand-drawn charm of the films of the GHIBLI studio: fans filled the selfie network and landscapes with the terrible accuracy inherent in the films of the studio “My neighbor Totoro” and “Directed by Ghosts”.

Since then, the hashtag #Ghibliai has gained millions of views on X and Instagram. And now the crypto turns this trend into digital gold.

It's Been 24 Hours Sincy Openai UnexPechedly Shook The Ai Image World with 4O Image Generation.



Here Are the 14 Most Mindblowing Examples So Far (100% AI-Generated):



1. Studio Ghibli Style Memespic.twitter.com/e38MBNPNQH - Barsee 🐶 (@heybarsee) March 26, 2025

On the Ethereum and Solana blocks circulates a lot of cryptocurrencies on the GHIBLI theme, and Ghiblification (Ghibli) becomes the largest of One with a market capitalization of $ 21 million as a state in the morning in Asia.

Inspired memes often become viral and, as a rule, collect bets, because they use the love of Internet culture for humor, absurdity and community. Their low entry cost and sharp fluctuations in prices attract speculators chasing a Quick profit, increasing the hype.

In just 24 hours from the date of launch, he gained almost $ 70 million trading volumes, making a little more than 250,000 individual transactions. The token liquidity pool contains SOL Solana in the amount of a little more than $ 330,000 (this is the maximum for which the GHIBLI holder can exchange his assets, minus the price reduction).

(Dexscreener)

Smaller tokens, such as Ghilbi Doge, Doge, inspired by Studio Ghibli, and popular characters in Noface and Yutaro films, inspired their tokens. However, they did not get much attention among traders as of the Asian daytime hours.",coindesk
