Input URL,Title,Link,Published,Description,Source
https://coindesk.com,Why Is GameStop (GME) Share Price Is Falling After Bitcoin (BTC) Plans?,https://coindesk.com/markets/2025/03/27/gamestop-tumbles-25-following-bitcoin-convertible-bond-plan-what-s-happening,"Thu, 27 Mar 2025 00:00:00 GMT","Shares of GameStop (GME), the embattled video game retailer turned memestock darling, plunged 25% on Thursday, more than erasing all the gains since the company earlier this week announced it will add bitcoin (BTC) as a treasury reserve asset.

STORY CONTINUES BELOW Don't miss another story. Subscribe to the Crypto Long & Short Newsletter today . See all newsletters Sign me up By signing up, you will receive emails about CoinDesk products and you agree to our terms of use and privacy policy .

GME fell to just above $21 during the session, trading at its lowest price since October and down over 28% from its Wednesday peak of nearly $30.

The price action happened after the company unveiled plans late Wednesday for a $1.3 billion, 0% convertible note offering to raise money for its BTC acquisition plan. After an initial wave of euphoria among the crypto crowd, the hype died down on Thursday after investors took a closer look at the financing.

""Many existing shareholders dislike the move, so a switch is happening with large volume,"" Louis Liu, chief investment officer of Mimesis Capital, said in an X post.

The sharp sell-off may also have to do with the convertible bond pricing period, as prospective bond buyers might be selling or shorting the stock. James Van Straten, senior analyst at CoinDesk, noted that MicroStrategy (MSTR) and Semler Scientific (SMLR) shares also declined during pricing periods of their convertible note offerings.

""We suspect that GameStop's share price will drift lower prior to the issuance of the convert, particularly given that a convert investor will receive a zero coupon and will be required to have faith that the GameStop meme phenomenon will persist for another five years,"" said Wedbush analyst Michael Pachter, who has an underperform rating on GME.

Pachter argued that the company is following Strategy’s playbook, but MSTR trades at less than twice the value of its bitcoin, while GME trades at more than twice its cash holdings.

""We expect the offering to fall flat,"" Pachter continued. “We find it hard to understand why any investor would pay more than 2x cash value for the potential for GameStop to convert that cash into BTC, particularly since the same investors can invest in BTC or a BTC ETF themselves.”

GME is only the latest Wall Street firm to convert some of its cash into bitcoin. The trend started with Strategy, the company led by bitcoin proponent Michael Saylor, which years ago announced it would use its cash reserves to buy the cryptocurrency. MSTR’s success following the transition caused many other companies to follow, especially recently as U.S. President Donald Trump has promised to make the U.S. the center for digital asset development.

While Saylor has long vouched for more companies, especially those with large cash reserves, and even the U.S. as a country, to adopt bitcoin as a reserve strategy, not everybody agrees.

“Gambling on companies buying Bitcoin is not a good investment strategy,” said well-known bitcoin gadfly Peter Schiff in a post on X. “$GME has lost all of yesterday's Bitcoin-inspired 15% gain. Shares are now down 2% over the two days combined. Now that all the fools have already rushed in, smarter investors are selling as they realize that wasting cash buying Bitcoin is not a viable long-term business model.”",coindesk
https://coindesk.com,"CoreWeave Goes Public at $40 Per Share, Raises $1.5 Billion",https://coindesk.com/markets/2025/03/27/coreweave-goes-public-at-usd40-per-share-raises-usd1-5-billion,"Thu, 27 Mar 2025 00:00:00 GMT","Artificial intelligence-focused firm CoreWeave raised $1.5 billion for its initial public offering (IPO), valuing the company at roughly $23 billion, Bloomberg reported on Thursday night, confirming earlier reports that it had downsized its IPO.

The cloud provider sold 37.5 million shares at $40 each. It had initially planned to sell 49 million shares at $47 to $55 each, but a weaker-than-expected stock market posed difficulties for the company.

STORY CONTINUES BELOW Don't miss another story. Subscribe to the Crypto Long & Short Newsletter today . See all newsletters Sign me up By signing up, you will receive emails about CoinDesk products and you agree to our terms of use and privacy policy .

The company initially sought to raise $4 billion at a $35 billion valuation, reporting $1.9 billion in revenue last year but still seeing a net loss of nearly $900 million.

AI powerhouse Nvidia, an investor in CoreWeave, is anchoring the IPO with a $250 million order, Bloomberg reported, citing a person familiar with the matter.

CoreWeave is closely tied to bitcoin miner CoreScientific, which struck a multi-billion deal with the New Jersey-based firm to expand its artificial intelligence capabilities.

Nvidia's own stock price is down 12% since the beginning of the year, The Information reported late Thursday, reflecting broader weakness in AI-focused firms.

UPDATE (March 28, 2025, 00:20 UTC): Adds additional detail.",coindesk
https://coindesk.com,"BTC, XRP, DOGE News: Dogecoin Gains, XRP Slumps as Trump Warns of 'Far Larger' Tariffs",https://coindesk.com/markets/2025/03/27/dogecoin-gains-xrp-slumps-as-trump-warns-of-far-larger-tariffs,"Thu, 27 Mar 2025 00:00:00 GMT","Risk assets such as bitcoin (BTC), xrp (XRP), solana (SOL) are back in focus as President Donald Trump warned of even more reciprocal tariffs if other countries collude to do ""economic harm"" to the U.S.

""If the European Union works with Canada in order to do economic harm to the USA,"" he wrote in a Truth Social post in early Asian hours Thursday, ""large scale Tariffs, far larger than currently planned, will be placed on them both in order to protect the best friend that each of those two countries has ever had!""

STORY CONTINUES BELOW Don't miss another story. Subscribe to the Crypto for Advisors Newsletter today . See all newsletters Sign me up By signing up, you will receive emails about CoinDesk products and you agree to our terms of use and privacy policy .

""Liberation day in America is coming, soon,"" Trump wrote in a separate post. ""For years we have been ripped off by virtually every country in the world, both friend and foe. But those days are over — America first!!!""

The post comes days after reports that concerns of tariffs were overblown, and that overall impact would be more measured than expected.

Earlier this month, Trump had imposed 25% tariffs on imports from Canada and Mexico, alongside a 20% levy on Chinese goods, citing national security concerns over immigration and fentanyl trafficking. Now, with the EU and Canada in his crosshairs, markets could be bracing for another jolt.

Tariffs, by their nature, disrupt economic stability — increasing costs for imported goods, stoking inflation, and pressuring central banks like the Federal Reserve to tighten monetary policy.

Such moves could spell trouble for BTC and other tokens in the short term, as the crypto market often moves in tandem with equities, which tend to falter under trade uncertainty. A stronger U.S. dollar, bolstered by tariff-driven capital flows, might further depress BTC prices, as investors flee to safe havens like gold or cash.

Trump's post dampened a bullish mood in Asian hours, with majors showing a brief sell-off. XRP and SOL fell 2%, ether (ETH) and BNB Chain's BNB remained little-changed, while dogecoin (DOGE) retracted gains from a 3.5% move higher in the past 24 hours.

SUI shines, analysts remain bullish

Outside of the top ten tokens by market cap, Sui Network's SUI posted a 7% surge ahead of the Walrus Network, a data availability protocol built on Sui, going live on mainnet later Thursday.

Meanwhile, some say Asian developments could provide a catalyst for bitcoin prices amid U.S. focused headwinds.

""While US regulators begin to cut back on restrictive policies, institutions in Asia have been making waves by releasing new funds, products, and innovations that have been supported by pro-crypto regulations in key jurisdictions,"" Jupiter Zheng, partner at HashKey Capital, told CoinDesk in a Telegram message.

""The next leg of the bull market may find its footing in Asia as the center for growth in the industry,"" Zheng added.

BTSE's Jeff Mei had a more optimistic view as of Thursday morning.

""Bitcoin and other cryptocurrencies have recovered over the last few days, even as stock markets dropped in response to US President Trump's announcement of auto tariffs. This shows that the worst could be over for crypto markets this year, and that we could see an upward trajectory in prices as US inflation fears subside and as we move closer towards rate cuts,"" Mei said in a Telegram message.

Traders are eyeing the release of upcoming Personal Consumption Expenditure (PCE) data on March 28, which influences Fed interest rate decisions.",coindesk
https://coindesk.com,"Trump's Pick to Run U.S. SEC Atkins Promises New Crypto Stance, Gets Few Questions",https://coindesk.com/policy/2025/03/27/trump-s-pick-to-run-sec-paul-atkins-promises-new-crypto-stance-gets-few-questions,"Thu, 27 Mar 2025 00:00:00 GMT","Paul Atkins, the former member of the U.S. Securities and Exchange Commission that President Donald Trump has tapped to run the agency, assured a different direction for the agency on crypto from the last four years, though he wasn't pressed with big-picture digital assets questions during a Thursday confirmation hearing.

STORY CONTINUES BELOW Don't miss another story. Subscribe to the State of Crypto Newsletter today . See all newsletters Sign me up By signing up, you will receive emails about CoinDesk products and you agree to our terms of use and privacy policy .

Now that Trump has secured the cabinet-level echelon of his government, the White House is working on shepherding top agency chiefs through the Senate confirmation process. While many of the crypto headlines are coming from the administration and Congress these days, those running the regulatory agencies will ultimately be the ones writing the regulations the industry will have to conform with.

Atkins is seeking to be the successor of ex-Chair Gary Gensler, whose years at the agency established him as the digital assets sector's most prominent nemesis. But Trump's nominee is already positioning himself in stark contrast to Gensler, who criticized the industry's history with swindlers and contended that current securities law was sufficient to treat much of the space as if it were in active violation of registration requirements.

""A top priority of my chairmanship will be to work with my fellow commissioners and Congress to provide a firm regulatory foundation for digital assets through a rational, coherent, and principled approach,"" Atkins said in his prepared testimony for Thursday.

Senator Tim Scott, the South Carolina Republican who chairs the committee, said Atkins will ""provide long-overdue clarity for digital assets.""

But even before the hearing began, Atkins was being slammed by Senator Elizabether Warren, the Massachusetts lawmaker who is the committee's ranking Democrat, who registered doubt about his ability to be impartial to the digital assets sector he's served as an adviser.

At the hearing table beside Atkins, Gould made his case for taking over the Office of the Comptroller of the Currency, the regulator for national banks. The OCC has been a significant player in the digital assets sector's campaign against U.S. banking oversight that's pressured banks to keep the industry at an arm's length. Crypto firms and insiders have struggled to maintain banking relationships and have argued that the regulators authored that ""debanking"" strain.

The first question to Gould was on that situation, with Scott asking whether he'd commit to reversing that previous stance, to which Gould responded, ""absolutely.""

For the crypto industry, Atkins' responses on crypto matters are potentially more urgent. But he wasn't questioned on his views about next steps for cryptocurrency oversight, nor about the legislative efforts poised to remake U.S. crypto policy.

SBF

At one point, Republican Senator John Kennedy of Louisiana raised the topic of former FTX CEO Sam Bankman-Fried, who he said looks like a ""fourth runner-up in a John Belushi lookalike contest,"" and asked Atkins whether the SEC appropriately looked into SBF's parents for their involvement in his fraudulent activities.

""I look forward to getting to the SEC to find out what happened,"" Atkins said. ""Like you, I'm concerned about those reports.""

But Kennedy took it further, suggesting a lack of accountability that signals ""two standards for law and punishment"" in the U.S.

""I don't think the SEC has done a damn thing,"" Kennedy said. ""They're crooks!"" he shouted. ""And I expect the SEC to do something about it.""

Few other senators delved into wider crypto matters, and those that may have been expected to, such as Senator Cynthia Lummis, weren't present. The hearing only lasted two hours and included four nominees for various offices, causing some Democrats to lament that this wasn't enough time to speak with each person.

Atkins' most difficult moments revolved around his tenure as an SEC commissioner in the run-up to the 2008 meltdown and the agency's failings in policing the mortgage securities that contributed to that crisis. Atkins deflected the primary responsibility of the crisis as belonging to mortgage giants Fannie Mae and Freddie Mac.

The next step in the confirmation process is for the committee to vote on the nominees and forward them for potential approval by the overall Senate.



",coindesk
https://coindesk.com,Studio Ghibli Meets Crypto as OpenAI Fuels New Memecoin Frenzy,https://coindesk.com/markets/2025/03/27/studio-ghilbi-memecoins-raffle-on-ethereum-solana-as-openai-s-4o-unleashes-new-trend,"Thu, 27 Mar 2025 00:00:00 GMT","A bizarre twist of AI tech and nostalgia is seeing memecoin enthusiasts issue, pump, and dump tokens themed after Studio Ghibli movies as a new AI art trend went viral in the past 24 hours.

That’s coming after OpenAI’s newly released 4o model — its most powerful image generation tool that spits out artwork based on specific user instructions and style guidelines, mimicking the characteristic vibe and style of artists and animators.

STORY CONTINUES BELOW Don't miss another story. Subscribe to the Crypto Long & Short Newsletter today . See all newsletters Sign me up By signing up, you will receive emails about CoinDesk products and you agree to our terms of use and privacy policy .

Thursday’s internet craze is specific to AI-generated images styled after the whimsical, hand-drawn charm of Studio Ghibli films, with fans flooding the web with selfies and landscapes with an eerie precision of the studio’s My Neighbour Totoro and Spirited Away films.

The hashtag #GhibliAI has since racked up millions of hits on X and Instagram. And crypto traders are now turning the trend into digital gold.

It's been 24 hours since OpenAI unexpectedly shook the AI image world with 4o image generation.



Here are the 14 most mindblowing examples so far (100% AI-generated):



1. Studio ghibli style memespic.twitter.com/E38mBnPnQh — Barsee 🐶 (@heyBarsee) March 26, 2025

A flurry of Ghibli-themed cryptocurrencies are doing the rounds on Ethereum and Solana blockchains, with ""ghiblification"" (GHIBLI) emerging as the biggest one yet with a $21 million market cap as of Asian morning hours.

Inspired memecoins often go viral and tend to rack up bets because they tap into internet culture’s love for humor, absurdity, and community. Their low entry cost and wild price swings draw speculators chasing quick gains, amplifying buzz.

It has racked up nearly $70 million in trading volumes in just 24 hours of going live from a little over 250,000 individual trades. The token’s liquidity pool has just over $330,000 worth of Solana’s SOL (meaning the max a GHIBLI holder can exchange their holdings for, minus price declines).

(DEXScreener)

Smaller tokens such as Ghilbi Doge, a Studio Ghibli-inspired doge, and popular movie characters NoFace and Yutaro have inspired their tokens. However, these have not gained much traction among traders as of Asian afternoon hours.",coindesk
https://coindesk.com,Crypto Daybook Americas: Trump's New Tariff Threat Fails to Budge BTC Price,https://coindesk.com/daybook-us/2025/03/27/crypto-daybook-americas-trump-s-new-tariff-threat-fails-to-budge-bitcoin,"Thu, 27 Mar 2025 00:00:00 GMT","

By Francisco Rodrigues (All times ET unless indicated otherwise)

President Donald Trump ramped up the trade-war hyperbole, threatening to increase import tariffs levied on the EU and Canada if they keep on working to “do economic harm” to the U.S. after announcing a 25% tariff on vehicles and foreign-made auto parts.

STORY CONTINUES BELOW Don't miss another story. Subscribe to the Crypto Daybook Americas Newsletter today . See all newsletters Sign me up By signing up, you will receive emails about CoinDesk products and you agree to our terms of use and privacy policy .

Despite the threat, crypto markets remained stable, with bitcoin holding steady at about $87,500. Over 24 hours the largest cryptocurrency is down about 0.6% and the broader CoinDesk 20 Index some 2%.

The growing threats not only raise concerns about economic growth, but also widen the gap between the U.S. and Europe, whose leaders are meeting with Ukraine’s President Volodymyr Zelensky today to work on long-term security guarantees. The summit comes after the U.S. persuaded Ukraine and Russia to agree to a Black Sea ceasefire.

Cryptocurrency prices are being influenced not only by macroeconomic factors, but also by the forthcoming expiry of around $15 billion worth of BTC and ETH options contracts on Friday. The uncertainty has stalled BTC’s price rally, even after video-games retailer GameStop moved to raise $1.3 billion to accumulate the cryptocurrency.

Still, the U.S. House of Representatives has released a bill that’s set to help reduce systemic risks associated with stablecoin usage. Blockchain development is also progressing steadily, with Ethereum’s final Pectra test going live on the Hoodi network.

Looking ahead, the U.S. Senate Banking Committee will today hold a hearing on the nomination of Paul Atkins — who holds up to $6 million in crypto-related assets — as the Chair of the Securities and Exchange Commission. Stay alert!

What to Watch

Crypto: March 27: Walrus (WAL) mainnet goes live. April 1: Metaplanet (3350) 10-for-1 stock split becomes effective.

Macro March 27, 8:30 a.m.: The U.S. Bureau of Economic Analysis releases (Final) Q4 GDP data. GDP Growth Rate QoQ Est. 2.3% vs. Prev. 3.1% Core PCE Prices QoQ Est. 2.7% vs. Prev. 2.2% PCE Prices QoQ Est. 2.4% vs. Prev. 1.5% Real Consumer Spending QoQ Est. 4.2% vs. Prev. 3.7% March 27, 8:30 a.m.: The U.S. Department of Labor releases unemployment insurance data for the week ended March 22. Initial Jobless Claims Est. 225K vs. Prev. 223K March 27, 10:00 a.m.: The U.S. Senate Banking Committee will hold a hearing on the nomination of Paul Atkins to the chair of the Securities and Exchange Commission (SEC). Livesteam link. March 27, 3:00 p.m.: Mexico's central bank announces its interest rate decision. Target Rate Est. 9% vs. Prev. 9.5% March 28, 8:00 a.m.: The Brazilian Institute of Geography and Statistics (IBGE) releases February unemployment rate data. Unemployment Rate Est. 6.8% vs. Prev. 6.5% March 28, 8:00 a.m.: Mexico's National Institute of Statistics and Geography releases February unemployment rate data. Unemployment Rate Est. 2.6% vs. Prev. 2.7% March 28, 8:30 a.m.: Statistics Canada releases January GDP data. GDP MoM Est. 0.3% vs. Prev. 0.2% March 28, 8:30 a.m.: The U.S. Bureau of Economic Analysis releases February consumer income and expenditure data. Core PCE Price Index MoM Est. 0.3% vs. Prev. 0.3% Core PCE Price Index YoY Est. 2.7% vs. Prev. 2.6% PCE Price Index MoM Est. 0.3% vs. Prev. 0.3% PCE Price Index YoY Est. 2.5% vs. Prev. 2.5% Personal Income MoM Est. 0.4% vs. Prev. 0.9% Personal Spending MoM Est. 0.5% vs. Prev. -0.2% April 2, 12:01 a.m.: The Trump administration’s reciprocal tariffs plan, announced Feb. 13, takes effect alongside a 25% tariff on imported automobiles and certain parts announced March 26.

Earnings (Estimates based on FactSet data) March 27: KULR Technology Group (KULR), post-market, $-0.02 March 28: Galaxy Digital Holdings (GLXY), pre-market, C$0.38

(Estimates based on FactSet data)

Token Events

Conferences

Token Talk

By Shaurya Malwa

A viral AI art trend fueled by OpenAI’s new 4o model sparked a surge in Studio Ghibli-themed memecoins, blending nostalgia with cryptocurrency speculation as fans create Ghibli-style images and traders capitalize on the hype.

The ghiblification (GHIBLI) token, the largest, boasted a $21 million market cap and $70 million in trading volume within 24 hours driven by over 250,000 trades on the Ethereum and Solana blockchains.

The trend, marked by the #GhibliAI hashtag amassing millions of hits on X and Instagram, reflects internet culture’s love for humor and absurdity, attracting speculators with low-cost, high-volatility tokens.

Smaller Ghibli-inspired tokens like Ghilbi Doge, NoFace and Yutaro lag behind GHIBLI in trader interest, while the latter’s liquidity pool holds just over $330,000 in Solana’s SOL.

Derivatives Positioning

While BTC, ETH CME futures yields stopped falling early this month, there has been a noticeable lack of progress, particularly in the wake of continued corporate adoption of bitcoin. The divergence suggests sophisticated market players remain cautious.

BTC, ETH perpetual funding rates on offshore exchanges are barely positive, another sign of cautious sentiment.

TRX, XMR, TON and SUI are the only top 25 coins with positive net cumulative volume deltas for the past 24 hours. The positive value indicates net buying in the perpetual futures market.

BTC and ETH short-end options-based implied volatility indexes continue to drift lower, with investors still pricing bigger swings in ETH relative to bitcoin.

Deribit-listed options continue to show a bias for short duration puts in BTC, ETH, SOL and XRP.

Market Movements:

BTC is up 0.22% from 4 p.m. ET Wednesday at $87,494.70 (24hrs: -0.86%)

ETH is up 0.69% at $2,025.47 (24hrs: -1.90%)

CoinDesk 20 is up 0.48% at 2,757.13 (24hrs: -2.19%)

Ether CESR Composite Staking Rate is up 2 bps at 2.97%

BTC funding rate is at 0.0087% (3.1744% annualized) on Binance

DXY is unchanged at 104.47

Gold is up 0.82% at $3,045.80/oz

Silver is up 1% at $34.37/oz

Nikkei 225 closed -0.6% at 37,799.97

Hang Seng closed +0.41% at 23,578.80

FTSE is down 0.66% at 8,632.24

Euro Stoxx 50 is down 0.7% at 5,373.68

DJIA closed on Wednesday -0.31% at 42,454.79

S&P 500 closed -1.12% at 5,712.20

Nasdaq closed -2.04% at 17,899.02

S&P/TSX Composite Index closed -0.7% at 25,161.10

S&P 40 Latin America closed -0.83% at 2,460.26

U.S. 10-year Treasury rate is up 4 bps at 4.4%

E-mini S&P 500 futures are unchanged at 5,763.25

E-mini Nasdaq-100 futures are unchanged at 20,112.25

E-mini Dow Jones Industrial Average Index futures are up 0.16% at 42,815.00

Bitcoin Stats:

BTC Dominance: 61.69 (-0.14%)

Ethereum to bitcoin ratio: 0.02317 (0.17%)

Hashrate (seven-day moving average): 838 EH/s

Hashprice (spot): $49.19

Total Fees: 9.67 BTC / $846,444x

CME Futures Open Interest: 144,470 BTC

BTC priced in gold: 28.8 oz

BTC vs gold market cap: 8.17%

Technical Analysis

MSTR's daily chart. (TradingView/CoinDesk)

The share price of bitcoin-holder Strategy (MSTR) has risen past $320, confirming a bullish double bottom breakout.

The pattern suggests potential for a rally for the Nasdaq-listed shares to resistance at $410.

Crypto Equities

Strategy (MSTR): closed on Wednesday at $329.31 (-3.66%), up 0.48% at $330.89 in pre-market

Coinbase Global (COIN): closed at $193.95 (-5.03%), up 0.81% at $195.52

Galaxy Digital Holdings (GLXY): closed at C$18.08 (-3.06%)

MARA Holdings (MARA): closed at $13.79 (-3.23%), up 0.51% at $13.86

Riot Platforms (RIOT): closed at $7.9 (-7.17%), up 1.01% at $7.98

Core Scientific (CORZ): closed at $7.63 (-11.89%), up 1.97% at $7.78

CleanSpark (CLSK): closed at $8.12 (-6.99%), up 0.62% at $8.17

CoinShares Valkyrie Bitcoin Miners ETF (WGMI): closed at $14.32 (-8.5%)

Semler Scientific (SMLR): closed at $39.57 (-6.63%)

Exodus Movement (EXOD): closed at $50 (-10.78%), up 0.6% at $50.30

ETF Flows

Spot BTC ETFs:

Daily net flow: $89.6 million

Cumulative net flows: $36.33 billion

Total BTC holdings ~ 1,115 million.

Spot ETH ETFs

Daily net flow: -$5.9 million

Cumulative net flows: $2.43 billion

Total ETH holdings ~ 3.406 million.

Source: Farside Investors

Overnight Flows

Chart of the Day

Crypto market performance: sector-wise breakup. (Velo)

AI is the worst-performing crypto market sector of the past 24 hours.

The dire performance is consistent with losses in AI-related stocks on Wall Street supposedly triggered by Microsoft abandoning data center projects set to use 2 gigawatts of electricity in the U.S. and Europe.

While You Were Sleeping

In the Ether",coindesk
