Input URL,Title,Link,Published,Description,Source
https://cryptobriefing.com,Animoca Brands partners with Soneium by Sony Block Solutions Labs to develop Moca Network’s identity layer and launch San FranTokyo’s anime initiatives on Soneium,https://cryptobriefing.com/animoca-brands-partners-with-soneium-by-sony-block-solutions-labs-to-develop-moca-networks-identity-layer-and-launch-san-frantokyos-anime-initiatives-on-soneium/,"Thu, 27 Mar 2025 12:33:21 GMT","Share this article

Hong Kong, Hong Kong, March 27th, 2025, Chainwire

Animoca Brands today announced a strategic partnership with Soneium, an Ethereum Layer 2 open blockchain developed by Sony and powered by Optimism’s Superchain technology. Through this partnership Moca Network, Animoca Brands’ flagship digital identity infrastructure platform for the open internet, will create a premier identity layer on the Soneium blockchain starting with Anime ID, a decentralized identifier (DID) and reputation layer spearheaded by San FranTokyo, a core contributor to Anime Foundation, to enhance user engagement and enable partners on Soneium to issue and verify data credentials.

Moca Network’s Account, Identity, and Reputation SDK (AIR SDK) will be integrated into Soneium blockchain, enabling users to maintain embedded accounts, unique identities, and credentials as they explore various dApps on Soneium. San FranTokyo’s Anime ID will be the first decentralized identifier (DID) and reputation layer adopting the AIR SDK to integrate into the Soneium blockchain, enhancing user engagement on anime-related experiences on Soneium.

In collaboration with Animoca Brands, San FranTokyo will also launch anime-inspired cultural campaigns on Soneium with the goal to onboard anime fans to Sony’s blockchain and connect them to new anime themed experiences.

Soneium is developed by Sony Block Solutions Labs (SBSL), a joint initiative established by Sony Group Corporation and Startale Group, focused on transcending boundaries with the open internet. Sony Group has built a diverse range of businesses with the purpose of ‘filling the world with emotion through the power of creativity and technology’. The desire to share emotion and excitement and to stay connected with someone no matter where you are is a fundamental human aspiration.

Yat Siu, co-founder and executive chairman of Animoca Brands, said: “Our partnership with Soneium marks a significant step towards an interconnected Web3 future. By integrating Moca Network’s identity infrastructure, we’re not just enhancing entertainment experiences; we’re creating a seamless digital ecosystem. The partnership will empower Soneium users with unified digital identities, bridging anime, gaming, and blockchain technologies.

Jun Watanabe, chairman of Sony Block Solutions Labs of Soneium, commented: “Our partnership with Animoca Brands enables us to establish an identity and reputation layer on Soneium. As one of the largest entertainment industries, anime presents immense potential. By integrating Moca Network’s AIR SDK and Anime ID into Soneium and Animoca Brands launching anime-inspired cultural campaigns, we aim to onboard global anime fans to the blockchain, enabling them to collaborate, create, and infuse the world with emotion.”

David Taing, head of San FranTokyo, said: “We’re excited to launch Anime ID on Soneium as one of Anime ID’s first major ecosystem partners. Together with Moca Network and Soneium, San FranTokyo will work with our global and industry partners to connect, onboard, and empower anime fans to new anime inspired experiences across ecosystems.”

Users can follow Animoca Brands, Moca Network, Soneium, Anime ID, and San FranTokyo on X for the latest updates and developments.

About Soneium

Soneium is an Ethereum layer-2 developed by Sony Block Solutions Labs. This versatile chain is a general-purpose blockchain platform that aims to evoke emotion, empower creativity, and meet diverse needs to go mainstream. Soneium is simplifying blockchain experiences while empowering developers, creators, and communities. Built on accessibility, scalability, and efficiency, it aims to solve real-world problems across industries globally. Soneium is changing the way users interact with the internet, opening up a world of innovative applications and unlimited potential for users worldwide.

Website | X | Discord | Telegram

About Animoca Brands

Animoca Brands Corporation Limited (ACN: 122 921 813) is a Web3 leader that leverages tokenization and blockchain to deliver digital property rights to consumers, helping to establish the open metaverse and its associated network effects. It has received broad industry and market recognition including Fortune Crypto 40, Top 50 Blockchain Game Companies 2025, Financial Times’ High Growth Companies Asia-Pacific, and Deloitte Tech Fast.

Animoca Brands realizes its mission via three integrated business pillars: operating Web3 businesses to advance blockchain adoption with native projects such as Moca Network, Anichess, The Sandbox, Open Campus, NEOM Web3 initiatives, and a regulated stablecoin project in partnership with Standard Chartered and HKT; providing digital asset advisory services including tokenomics advisory, liquidity provisioning, and institutional research to help external Web3 projects grow; and investment management, with a portfolio of investments in over 540 companies including industry leaders Pudgy Penguins, Yuga Labs, Axie Infinity, Polygon, Consensys, Magic Eden, OpenSea, Dapper Labs, YGG, and many others.

For more information users can visit www.animocabrands.com or follow on X, YouTube, Instagram, LinkedIn, Facebook, and TikTok.

About Moca Network

Moca Network, one of Animoca Brands’ flagship projects, is building the chain-agnostic digital identity infrastructure for the open internet by providing one universal account for a user’s assets, identity, and reputation across multiple ecosystems. Moca Network is powered by MOCA Coin, which serves as the utility token for data generation, storage, verification for users, AI agents, and DAO governance. MOCA Coin is issued by the MOCA Foundation.

The primary product built by Moca Network is AIR Kit, a digital identity infrastructure that enables Web2 and Web3 projects to create a universal embedded account for users to own and use digital assets, identity, and reputation data, while gaining access to a suite of DeFi and consumer services provided by Moca Network’s partners. AIR Kit empowers large user base apps to create their own app ecosystem natively with embedded blockchain features, while ensuring these users can use the same account, identity, reputation across all consumer apps on any chains that have adopted AIR Kit.

Website: Moca.network

X: https://x.com/Moca_Network

Medium: https://medium.com/mocaverse

Discord: http://discord.gg/MocaverseNFT

Contact

Animoca Brands Corporation Communications

[email protected]

",cryptobriefing
https://cryptobriefing.com,MEXC DEX+ Add BSC chain support and facilitate multi-cadena asset trade,https://es.cryptobriefing.com/soporte-bsc-dex-plus-por-mexc/,"Thu, 27 Mar 2025 11:52:30 GMT","Key conclusions Dex+ now supports the BSC chain and the solana ecosystem.

Continuous improvement of the platform and expansion of the support to more blockchain networks.

Share this article

Victoria, Seychelles, March 27, 2025 - MEXC, a leading cryptocurrency exchange, has officially announced that its innovative product, Dex+, now supports Binance Smart Chain. This achievement advances Mexc's efforts to connect the centralized finance (CEFI) with the decentralized finance (DEFI) through multi-decay trade, offering users investment opportunities of low cost and high potential in the BSC ecosystem.

Dex+ now completely supports the Solana ecosystem, integrating with popular liquidity sources such as Pump.fun, Pumpswap and Raydium, and offering access to more than 10,000 assets in the chain. With the recent addition of BSC support, Dex+ also adds the main DEX as Pancakes, covering more than 5,000 popular tokens, including Defi and Meme Coins projects. Looking towards the future, Dex+ plans to integrate more leaders in BSC, continuously improving the depth of liquidity and evolving towards a multi-chain trade platform of unique window. This update allows a multi-decay experience with ""an account"", offering a CEX level performance without the complexity of creating or administering wallets. Users can now trade tens of thousands of assets through Solana and BSC ecosystems, early accessing promising chain investment opportunities.

BSC is known for its low transaction commissions and high transaction processing capacity, promoting the rise of leaders such as Pancakeswap. The recent wave of meme coins in BSC has significantly increased the volume of trade throughout the ecosystem, underlining the growth potential of alpha tokens in the initial stage. With its rapid integration of BSC, Dex+ Empuera to users to access these trend assets early and take advantage of high return investment opportunities. In addition, Dex+ has improved its ""smart money"" function, providing real -time visions on tokens with high volumes of trade, strong community traction and remarkable growth potential. This allows users to better identify undervalued assets and optimize their investment strategies.

Tracy Jin, Operations Director of Mexc, declared:

«Integrating BSC marks a significant milestone into the Multi-Cadena Strategy of Dex+. Our goal is to provide users with broader access to chain investment opportunities, support the continuous growth of the crypto ecosystem and boost the true convergence of Defi and CEFI. Through continuous cross -chain innovation, Dex+ Empuera to users to explore wealth opportunities in multiple blockchains - using only one account - ensuring a soft and without complications of CEFI to Defi. ""

Looking forward, Dex+ plans to extend the support to more leader blockchain networks including Ethereum, Arbitraum, Polygon, Avalanche and Zksync, further improving liquidity and expanding the coverage of assets to build a trade platform of the entire ecosystem, efficient and robust. As trade volumes in Defi continue to increase, the deep integration of CEFI and Defi is becoming a recognized trend in the industry. By taking advantage of its innovative liquidity solutions and technological strengths, Dex+ is at the forefront of this evolution - offering a simpler, efficient and safe trade experience, while it is based as a world leader in the cryptocurrency market.

About Mexc

Founded in 2018, Mexc is committed to being ""your easiest path to crypto."" Serving more than 34 million users in more than 170 countries and regions, MEXC is known for its wide selection of tendency tokens, frequent Airdrop Opportunities and low trade rates. Our easy -to -use platform is designed to support both new merchants and experienced investors, offering safe and efficient access to digital assets. MEXC prioritizes simplicity and innovation, making the most accessible and rewarding crypto trade.

For more information, visit: Mexc website ｜ Twitter ｜ Telegram ｜ How to register at Mexc

For media consultations, please contact the RRPP manager of Mexc Lucia Hu: [Email Protected]

Fountain",cryptobriefing
https://decrypt.co,"SEC Officially Drops Cases Against Kraken, ConsenSys, and Cumberland DRW",https://decrypt.co/312072/sec-drops-cases-kraken-consensys-cumberland-drw,"Fri, 28 Mar 2025 00:30:33 GMT","Create an account to save your articles.

Create an account to save your articles.

Decrypt’s Art, Fashion, and Entertainment Hub. Discover SCENE

The U.S. SEC on Thursday dismissed enforcement actions against three major crypto firms, filing joint stipulations to drop the cases with prejudice, making the decisions final and not subject to refile.

Kraken, ConsenSys, and Cumberland DRW LLC all saw their respective lawsuits terminated simultaneously, marking the latest reversal in the agency's regulatory approach toward digital assets.

The regulator has also officially closed its case against the exchange Crypto.com.

Disclaimer: ConsenSys is one of 22 investors in an editorially independent Decrypt.

The dismissals form part of a broader pivot in U.S. crypto regulation under the Trump administration, following similar ends to cases against Coinbase, Robinhood, Uniswap Labs, and OpenSea.

In a statement following the dismissal of civil enforcement action against Coinbase, acting SEC Chairman Mark T. Uyeda said these decisions were part of the agency's ""ongoing efforts"" to ""rectify its approach” and develop crypto policy in a “more transparent manner.""

Notably, the SEC emphasized that these dismissals do not ""necessarily reflect the Commission's position on any other case.""

The decision ends a ""wasteful, politically motivated campaign,"" Kraken said in a statement when the resolution for their case with the regulator arrived.

Kraken further characterized the SEC's move as something that lifted ""uncertainty"" over what could have ""stifled innovation and investment.""

The exchange provider later revealed its prospects of going public, potentially coming in as the second crypto firm to do so after Coinbase.

The resolution ends a tumultuous period for the industry. Each of the three companies had faced serious allegations under the prior Gensler regime.

Kraken was charged in November 2023 with operating an unregistered securities exchange, broker, dealer, and clearing agency.

ConsenSys faced accusations in June 2024 of unlawfully offering securities through its MetaMask Staking service.

Cumberland DRW, a Chicago-based trading firm, was sued in October 2024 for allegedly acting as an unregistered dealer handling over $2 billion in crypto assets.

Under acting Chairman Uyeda, the SEC has established a task force and actively engaged with the crypto industry, signaling a departure from the previous administration's enforcement-focused approach.

Edited by Sebastian Sinclair",decrypt
https://decrypt.co,How a Solo Bitcoin Miner Beat the Odds and Banked $266K,https://decrypt.co/312068/how-solo-bitcoin-miner-beat-odds,"Thu, 27 Mar 2025 22:19:38 GMT","Decrypt’s Art, Fashion, and Entertainment Hub. Discover SCENE

The solo miner of Bitcoin block 888,737—won last week with a $266,000 BTC reward—shared their story with Bitcoin mining hardware creator FutureBit, whose Apollo miners helped lead to the sizable score.

The anonymous miner, who took home more than 3.15 BTC or around $266,000 last week between the fixed reward and transaction fees, did so with a home setup composed of three FutureBit Apollo miners and one Bitmain SK19pro, according to the shared email posted to X.

“I usually have the Apollo miners set on efficiency mode,” the email reads. “During the colder months, I run the SK19Pro at 60TH during the day and 100 at night,” it continues, adding that other than some scheduled tasks that stop hashing during the peak electricity times, “everything else is the default settings.”

That setup was enough to get the ultimate reward for a solo miner. It’s also a highly unlikely win, given that large-scale publicly traded firms and mining pools dominate the industry.

“I scrolled through the Apollo website on my phone, still in the comfort of my bed,” the miner wrote. “I looked at the SOLO Mining User’s panel. What appeared next stopped me cold.”

Moments later, launching the BlueWallet app on their iPhone, the miner confirmed their suspicions that they had successfully “found a block.”

Block 888737 - A Short Story Our awesome anonymous customer who hit the last Apollo Solo Block reached out to our team and allowed us to share their epic story with the world! To many more! pic.twitter.com/SP50xHUT4l — FutureBit (@FutureBit) March 26, 2025

“‘We found a block! We found a block!’ I yelled, my voice echoing through the house,” wrote the anonymous miner. “I bolted from bed, racing downstairs to my computer… there, in bold, beautiful letters were the words: block accepted. A grin spread across my face—victory was mine, and it felt incredible.”

Despite multiple solo scores in recent months, the energy-intensive nature of mining typically leads to industrial-sized setups or mining pools taking home the vast majority of block rewards—the new Bitcoin supply that is created to reward those who verify and validate the network.

FutureBit offers various mining products on its website for individuals looking to pursue a home mining rig. Its cheapest product starts at $376 after a discount, with other miners ranging up to a price of $2,100.

The firm did not immediately respond to Decrypt’s request for comment.

Edited by Andrew Hayward",decrypt
https://decrypt.co,US Justice Department Seizes $201K in Crypto Earmarked for Hamas,https://decrypt.co/312045/u-s-justice-department-seizes-200000-hamas,"Thu, 27 Mar 2025 21:09:48 GMT","Decrypt’s Art, Fashion, and Entertainment Hub. Discover SCENE

The U.S. Department of Justice has seized $201,400 in cryptocurrencies earmarked for Palestinian militant group Hamas, the agency announced on Thursday.

Authorities took control of a cryptocurrency wallet holding $89,900, in addition to three accounts holding digital assets worth $111,500, the Justice Department said Thursday in a statement. The wallet addresses have been used to launder more than $1.5 million in digital currencies for Hamas since October 2024.

“These seizures show that this office will search high and low for every cent of money going to fund Hamas, wherever it is found, and in whatever form of currency,” U.S. Attorney Edward R. Martin Jr. for the District of Columbia said Thursday in the statement.

Since the early 2010s, cybercriminals and militant groups have used privacy-focused blockchain technologies and cryptocurrencies to launder their ill-gotten gains and finance their operations. But over the past few years, U.S. authorities have cracked down on the practice, frustrating bad actors’ attempts to operate undetected.

According to the DOJ, a group chat with alleged ties to Hamas enabled Hamas supporters to donate cryptocurrencies to at least 17 wallet addresses through an encrypted communications platform. Financiers and over-the-counter brokers laundered the funds through several crypto exchanges.

It is not immediately clear which crypto exchanges were used for the alleged money laundering.

The Justice Department did not immediately reply to Decrypt's request for comment on the matter.

The FBI Albuquerque field office assisted in the latest investigation.

“Disrupting funding mechanisms and seizing cryptocurrency from Hamas is one of the FBI’s many tools that we use in the fight against terrorism,” Assistant Director David J. Scott of the FBI Counterterrorism Division said.

The DOJ is not the only agency that has cracked down on campaigns to fund Hamas and other militant groups. Between 2021 and 2023, Israeli counter-terrorist authorities seized dozens of digital asset accounts with suspected ties to Hamas and two with alleged connections to Daesh, also known as ISIS, Reuters reported, citing people familiar with the matter.

Edited by James Rubin",decrypt
https://decrypt.co,"Tether Pours Capital Into Media, Agriculture Companies Amid Investment Spree",https://decrypt.co/312042/tether-pours-capital-into-companies-amid-investment-spree,"Thu, 27 Mar 2025 20:56:15 GMT","Decrypt’s Art, Fashion, and Entertainment Hub. Discover SCENE

Tether revealed Thursday it is investing in a pair of firms unrelated to the crypto industry, continuing an investment spree that has only intensified since the company reported record profits earlier this year.

The El Salvador-based company snapped up 49,596,510 shares of Latin American-focused agricultural firm Adecoagro, growing its stake in the business to 70%, according to an SEC filing published Thursday.

""Our investment aligns with Tether's broader strategy to back infrastructure, technology, and businesses that advance economic freedom and resilience, especially in regions where these values are most needed,"" Tether CEO Paolo Ardoino said in a statement.

Adecoagro is a sustainable production company with interests in Argentina, Brazil and Argentina.

Separately, Ardoino announced on X that his company would also be investing in Italian media company Be Water. By the end of March, Tether will hold a 30.4% stake in the company via a €10 million capital increase and equity acquisition.

“While often Media companies are bullied into kneeling to sponsored narratives simply to survive, Tether's investment in BeWater ensures that the group will continue to remain solid, visionary and especially independent,” Paolo wrote in the X post.

The private company's latest investments come a few months after it reported record-smashing profits for 2024. Tether said in January that its yearly net profits hit a new all-time high of more than $13 billion last year, citing an assurance opinion for the fourth quarter of 2024 issued by global accounting firm BDO. The stablecoin issuer also reported $7 billion in excess capital.

Tether has used its funds over the past few months to increase its stake in the Bitcoin mining company Bitdeer, in addition to upping its control of companies such as the video platform Rumble and Italian football club Juventus.

Last year, it also invested $19 million in XREX Group, a firm that also has backing from the Taiwanese Government National Development Fund. USDT is the third-largest cryptocurrency, and the largest stablecoin, in the world with a market capitalization of $144 billion, according to CoinGecko data.

Edited by James Rubin",decrypt
https://decrypt.co,TokenFi Removes TOKEN Buy/Sell Tax After Unanimous DAO Vote,https://decrypt.co/312034/tokenfi-removes-token-buy-sell-tax-after-unanimous-dao-vote,"Thu, 27 Mar 2025 20:13:43 GMT","Decrypt’s Art, Fashion, and Entertainment Hub. Discover SCENE

Miami, Florida, March 27th, 2025, Chainwire

TokenFi has officially eliminated the 0.3% buy/sell tax on its native token, TOKEN, following a unanimous vote from the Floki DAO.

“The Floki DAO proposal to remove the 0.3% buy/sell tax on $TOKEN received 100% support from the community,” the project team announced. “In line with the decision of the Floki DAO, the buy/sell transaction tax on $TOKEN has been removed.”

The vote signals a clear consensus within the Floki and TokenFi communities that lowering friction in trading is essential to increasing accessibility and unlocking broader utility for the token.

The tax removal is already live across both Ethereum and BNB Chain networks.

The original proposal, published via Snapshot, received full backing, making this one of the rare DAO votes with absolute alignment.

With the buy/sell tax now set to 0%, TokenFi aims to drive further adoption by reducing barriers for both new and existing holders. The move could also help boost TOKEN's liquidity across decentralized exchanges and improve market efficiency.

TokenFi, which is connected to the Floki ecosystem, is working to position TOKEN as a utility and governance asset across DeFi platforms. Removing transaction friction is one of several steps being taken to expand the token’s real-world use cases and trading appeal.

The change is effective immediately.

TokenFi is a no-code, all-in-one tokenization platform that allows users to create tokens and will allow users tokenize real-world assets (RWAs) in just a few clicks using a WYSIWYG interface — no coding required. Positioned to tap into the $16 trillion tokenization industry by 2030, TokenFi aims to simplify and accelerate the process of bringing assets on-chain.

Backed by the Floki ecosystem, TokenFi is governed by the Floki DAO and led by the same core team behind the globally recognized Floki token. The platform includes a suite of tools like TokenFi Launchpad, AI Smart Contract Auditor, RWA Module, and more — all powered by its utility token, TOKEN.

About Floki

Floki is the people’s cryptocurrency and utility token of the Floki Ecosystem. Floki aims to become the world’s most known and most used cryptocurrency and intends to achieve this ambitious goal through a focus on utility, philanthropy, community, and marketing. Floki currently has 530,000+ holders and a strong brand recognized by billions of people worldwide due to its strategic marketing partnerships.

Website: https://floki.com

Twitter: https://x.com/RealFlokiInu

About TokenFi

TokenFi is an innovative platform for crypto and asset tokenization, enabling users to launch or tokenize assets effortlessly. TokenFi is committed to revolutionizing the trillion-dollar tokenization industry by offering a user-friendly interface that requires no coding expertise.

Website: https://tokenfi.com

Twitter: https://twitter.com/tokenfi

Contact

Community Relations Officer

Pedro Vidal

Floki

marketing@floki.com



Disclaimer: Press release sponsored by our commercial partners.",decrypt
