Input URL,Title,Link,Published,Description,Source
https://vulture.com,What the One-Shot Effect Adds to Each ‘Adolescence’ Episode,https://www.vulture.com/article/how-adolescence-pulls-off-one-take-shots.html,"Tue, 18 Mar 2025 20:12:56 GMT","Photo: Netflix

What is the point of one shot? In film and television, cinematographers will often show off their prowess by using as few cuts as possible. These shots are undeniably impressive, with actors having to treat their on-camera work as though it were onstage, to say nothing of weaving in and around one another as sets, rooms, and circumstances change in an instant. All of which is to say the one-take can get a little one-note. Perhaps that’s why it’s so refreshing to see Netflix’s new crime drama Adolescence push the form beyond the rigorous stress and into emotional territory not often explored in one-shot takes.

The high stress of executing the “oner” needs to mirror the tone of the scenes — or the complete films and episodes — themselves, so the one-take formula is typically used to exaggerate tense circumstances. That’s not to say all are like that, but increasingly, this is the one formal trick that makes any scene more stressful than it ought to be, with the audience distracted and left wondering if the show can really pull it off. In Adolescence, the four-episode limited series created by His Dark Materials’s Jack Thorne and Stephen Graham (who also stars), 13-year-old Jamie (Owen Cooper) is accused of murdering one of his classmates, and each episode was filmed in a single take — a process explored in this Twitter thread — from a scene as straightforward as two characters speaking in a row to some complicated aerial drone magic. Graham, who plays Jamie’s father, was quite familiar with this format, having starred in Boiling Point, a feature-length one-shot film about a chef, as well as its spinoff TV series (made in a few shots but not many). While Boiling Point might have pushed the possibilities for just how manic a single take could be, Adolescence opts to use the technique for a greater range of emotional realities. Rather than each episode being filled with heart-pounding action, the series establishes itself with a frantic, stressful raid on Jamie’s house and his subsequent arrest, then dissolves into a crime show that’s much more meticulous and robust beyond the thrills at the top.

The second episode is set at Jamie’s high school, where the local detectives arrive to talk to the students in hopes of getting a lead on the murder weapon. The mystery of “Did Jamie do it?” appears at end of the first episode, but the second becomes more concerned with the environment that might have fostered such violence long before the crime was ever committed. The shot zooms in and around the school, popping into classrooms and bearing witness to the fraying social order and sanity within it. Rather than use a lone shot to compound time, Thorne and Graham, working with cinematographer Matthew Lewis, broaden the show’s scope to examine the ways young people communicate — or, as Thorne puts it, it’s “not a whodunit, but a why-dunit.”

Adolescence sinks into the tragedy of a young boy radicalized and a young girl killed and lets the one-take trick explore the depths of understanding and grief, especially in episode three, arguably the best of the series. Rather than move the audience from pillar to post, Thorne and Graham clear the stage for long, unbroken conversations between Jamie and psychologist Briony (Erin Doherty) ahead of his trial.

What remains so potent about the third and fourth episodes — about Jamie’s dad, Eddie, trying to celebrate his birthday as his son’s trial nears — is that they don’t follow a clear emotional line because grief and processing it aren’t necessarily linear. These episodes are less action driven and more homebound with characters crying and laughing and trying and failing to understand what happened. When Jamie and Briony discuss his feelings about men and women, the boy’s behavior moves wildly between embarrassment and aggression. His mood swings are frightening and inexplicable, revealing a central truth about Jamie that is difficult for both Briony and the audience to sit with. This is a very different boy from the one we saw only two episodes ago (albeit seven months earlier in the show’s timeline). The sensation of the one-shot doesn’t build tension during these last two episodes so much as it shows how life is often composed of contradictions. An hour can contain a multitude of sensations: You can go from laughing to fearing for your life as Briony briefly does during her chat with Jamie. While a number of one-takes are about either setting a stage or building stress, these wallow in Adolescence’s central questions about how and why someone so young could do something so awful. Sitting with that discomfort is a more intense experience than the trapeze act of most television one-take feats — these characters can’t walk away from their situation, and neither can the viewer. The compressed sense of time bonds what is real and what isn’t.

Part of what feels remarkable about Adolescence’s one-take trick is that, by the end of the show, the mastery of the technique doesn’t come through as a thing to be impressed by as much as one that simply sustains the energy of a singular episode. The choreography of the shots during a “normal day” in Jamie’s life is undoubtedly impressive, but Graham’s performance, alongside those of Christina Temarco and Amélie Pease, who play Eddie’s wife and daughter, sits in the dismay and confusion that often settle in the aftermath of an inexplicable event. They don’t understand how this happened to their son — and we don’t necessarily see the full extent of it either — but knowing is not the point. In a landscape where so many shows foreground reveals and plots, Adolescence centers an emotional reality, one that can’t be cut around or spliced to create something coherent or streamlined. Sometimes, one hour can feel miserable, boring, intense, bizarre, overwhelming, frightening, or some combination of those. Adolescence can show all of that without blinking.",vulture
https://vulture.com,Playboi Carti Gets Lost in the Music,https://www.vulture.com/article/playboi-carti-music-review.html,"Tue, 18 Mar 2025 15:04:41 GMT","Photo: Scott Dudelson/Getty Images

Playboi Carti wears his flows like he wears his clothes: Ensembles designed to wow and confound are tossed to the side with the same zest and vigor that brought them together. The 29-year-old Atlanta rapper’s shifting sound and persona were first cultivated as a member of the Awful Records crew and, later, Harlem’s A$AP Mob. Early works like 2017’s Playboi Carti and 2018’s Die Lit documented the birth of an increasingly bit-crushed mutation of southern hip-hop. Carti became the crown prince of rage rap, which swiped the forbiddingly DIY sonics, ominous iconography, and barely contained aggression from punk and metal. These ideas weren’t foreign to hip-hop — Geto Boys’ records touched most of the same points — but Carti’s eye was always further afield. His persona teetered on a razor’s edge: He must look magisterial but seem nonchalant. Rage, to the extent that the microgenre is distinguished from its fountainheads in trap and emo rap, is about ritual and release. The preening is the point. The screaming is the point. You’re paying for a portion of devil-may-care cool and a semblance of dominion over darkness. The aim is to carefully brandish chaos.

Music does nothing to reconcile any of its conundrums. But nobody showed up for earnestness.

The unpredictability fueling these triumphs is just as often a cause for concern. The tragic crowd-crush at Travis Scott’s Astroworld reinforced how badly a churning mosh pit needs the regulation and structure of the long-standing rock-show tradition. Allegations of violence surrounding high-profile artists — a 2022 domestic-abuse charge levied against Lil Uzi Vert met with a plea of no contest, and a 2023 felony-aggravated-assault charge against Carti was later reported as dismissed — imply that abrasive views on these records come from somewhere real and worrying. Iggy Azalea, mother of Carti’s son, saying “We haven’t heard from that man in … six months” lends disconcerting credibility to rhymes about not giving a shit about women. Scott and Kendrick Lamar, who both guest on Music, offer a thermostat reading for how much the industry even cares about these issues. But this isn’t what irks rage’s older detractors, who grew up loving Dr. Dre and knew the misogyny of 2001 was not the put-on some of the gun talk might’ve been. It’s a fear of debasement of rap’s perceived core values — painstaking originality, lyrical depth and dexterity, distinctive diction — bucking against a bumpy evolution. Purists see the rise of almost defiantly unlaborious music as proof that fast fashion floats, but this wave is kin to everything that came before it. Methodological quibbles aside, the story’s what it always was: Black 20-somethings knowingly strip-mining movements that ripped off and marginalized their grandparents. Music sees one of rage’s head scenesters crashing into orthodoxies and expectations of youth culture as time ticks on.

It’s been a fussy four years since the last Playboi Carti album, 2020’s goblin-infested Whole Lotta Red. Tentpole rage-rap releases like Uzi’s Luv Is Rage and Scott’s Rodeo will turn ten this year, and their authors are cruising into their 30s seeking to bottle and reproduce the old lightning. Uzi’s curt Eternal Atake 2 dragged, as did Scott’s “Hot 100” shooting star “4x4.” While Carti fans pestered him for a follow-up, the vocal theatrics and synth saturation he favors trickled into the topsoil, feeding mainstream rap. You can get pretty close to the signature listening to Ohio’s OsamaSon, Virginia’s Nettspend, New York’s Yung Fazo, Nottingham’s skaiwater, or any of the members of Carti’s own Opium imprint. (The label feels like a Galactus arrangement. Four Atlanta heralds — Destroy Lonely, Ken Carson, and the duo Homixide Gang — wield aspects of their benefactor’s power, priming the planet for conquest.) The shape of Music — 30 songs spanning 76 minutes — feels like an apology for years of false leads and starts to a hungry fandom.

The result is imperfect but instructive. It communicates why, in spite of anyone’s reservations, Carti is a rapper’s rapper. The big guns clearly study him, excitedly adopting the house style. He is a massive inspiration for pitched-up vocals and swarming ad-libs in mainstream hip-hop, though he gets the latter from Jeezy. Those qualities don’t necessarily dominate Music, which is more interested in reveling in the tonal breadth of the voice. Two exceedingly strange noises Playboi Carti makes on the new album are as follows: A long and guttural howl undergirding rousing choir vocals in the gospel-tinged “Crush,” like a demon exorcised in Pentecostal Sunday service. And later, in the deceptively saccharine “Fine Shit,” a crusty, percussive “The money gon’ talk!” interrupting soft crooning, like a lech yelling at the TV as the lead in a rom-com begins to trust a love interest. This is an artist obsessed with the marriage of high- and lowbrow.

Carti is, as oldheads assessed, somewhat enthralled by pissing on tradition. “Crush” takes after a Ye church banger, but the choir is whooping “Shorty gon’ let me crush,” like the Chappelle’s Show skit with the opera singer interpreting Dave’s raunchy thoughts. It’s almost entirely horny buildup, echoing grunts occupying spaces where a series of verses usually goes. (Actual Ye has been pitching a fit about not being featured anywhere, revealing how Carti, a lucrative collaborator on the Donda and Vultures albums, has stormed rap’s upper class to the extent that even the radioactive clout lord wants in on the action.) “Fine” weaponizes the sound and structure of a rap Song for the Ladies, mostly to flex on the riches and influence attracting women. The clean vocals are so slick, and the ad-libs so coarse, that rumors of Carti using an AI model of his own voice are circulating in the fandom. The query speaks to a dilemma: How do you reaffix a stamp on a sound that’s been aggressively copied?

Music regroups the way many works by artists a decade into their careers tend to nowadays: It reaffirms foundations. Sometimes this means cannibalizing aspects of older songs. The video-game-y topline of “Crush” brings to mind a similar sequence in Whole Lotta Red’s “Sky.” But the twist is that the artist’s point of nostalgia sits further back in time than fans looking for another hit of Die Lit. Not content to fully retreat into the self-parodic zoomer nostalgia routines Carti’s rage-elder peers have, Music engages in a jarringly convincing array of impressions. In addition to two songs in which Future appears, there are around a half-dozen Carti performances that sound like him. At first pass, the slurring trunk-rattler “Toxic” conjures the image of the DS2 star rhyming his way through anaphylaxis. “Walk” and “Dis 1 Got it” sell self-destructive chants like Future’s drug jams. But “Charge Dem Hoes a Fee” with actual Nayvadius makes the Carti deep voice all over Music feel small. At the same time, he salutes Lil Wayne on “Like Weezy” and approximates the squawk of mixtape-era Young Thug, while “K Pop” manifests the disinterested drawl of Lil Yachty. Music is saying that Carti can’t be pinned down.

But the familiarity grows oppressive. It hits more like a survey of what the rapper has been up to than a self-certain step forward. For Carti fans, appreciating his unusual gifts comes with an awareness of his foibles, of the erratic release schedules and legal woes that undermine his work. Audience and industry seem relatively nonplussed about this, more concerned with the questions of authenticity raised by tributary vocal delivery. The issue, then, is that Music is a lesser work in the catalogue. The instrument is astounding, but the guy can’t decide what to do with it. Restlessness sources both the most grating and the most intriguing performances. It is a distinguishing trait, impossible to pry off the music like the darkness threading in and out of rage and drill scenes. You couldn’t make Carti take himself as seriously as sticklers for bars desire and get anything half as loony as the crunchy, Ashanti-flipping “Cocaine Nose.” It is similarly unwise to bask in the airs of lawlessness in modern rap without stopping to ponder their real-world ramifications. Music does nothing to reconcile any of its conundrums. But nobody showed up for earnestness. Carti is here to facilitate people ramming into one another. In this objective, he gets his way.",vulture
