Input URL,Title,Link,Published,Description,Source
https://usmagazine.com,Southern Charm Reunion Trailer: Everyone Is Scared of Craig Conover,https://www.usmagazine.com/entertainment/news/southern-charm-reunion-trailer-everyone-is-scared-of-craig-conover/,"Tue, 18 Mar 2025 16:00:35 GMT","Craig Conover may need to use some of his Southern Charm during this not-so-friendly cast get-together.

In the season 10 reunion trailer obtained by Us Weekly on Tuesday, March 18, the newly single Bravo star is put in the hot seat by host Andy Cohen and his costars.

“I am terrified of Craig,” Austen Kroll says in the sneak peek. “I feel like I’m going to get backhanded for stepping out of line.”

When Cohen asks the cast if anyone else is scared of Craig, Leva Bonaparte doesn’t hesitate to say “yes” as Venita Aspen, Rodrigo Reyes and Jarrett “JT” Thomas raise their hands in agreement.

Related: Breaking Down Paige DeSorbo and Craig Conover‘s Split: What They‘ve Said Udo Salters/Getty Images For three years, Paige DeSorbo and Craig Conover captivated Bravo fans with their romantic relationship — and now, everything they say about their split has become just as enticing. The Summer House star, 32, announced in December 2024 that she and Conover, 36, had parted ways after sparking a romance in 2021. […]

In the two-part reunion special, Craig also appears to address his breakup with Summer House star Paige DeSorbo.

“All my stuff just showed up on my porch one day,” he says before Cohen asks, “Did she break up with you for the new guy?”

The couple announced in December 2024 that they had parted ways after sparking a romance in 2021. Paige later revealed that she broke up with the Southern Charm star in November 2024 over Thanksgiving weekend.

Since the split, Paige has denied she ever cheated on Craig and recently confirmed she is single.

Craig isn’t the only cast member put in the hot seat during the reunion. Things get dramatic between Venita and JT when they discuss the breakdown of their friendship. And yes, somebody has receipts on their phone.

In a twist fans may not have seen coming, Taylor Ann Green and Salley Carson also appear to be at odds when they confront some behind the scenes drama.

“You came in and leveraged my fractured relationship with the girls,” Taylor claims in a tense back and forth moment with Salley. “You were going around our friend group talking about me.”

What Is The Biggest Moment from Southern Charm?

Salley responds, “That’s crazy Taylor. You’re still running your mouth about me today. You have nothing better going on in your life.”

Related: Southern Charm‘s Madison LeCroy, Brett Randle‘s Relationship Timeline Madison LeCroy found something special with husband Brett Randle after her public ups and downs with ex Austen Kroll. LeCroy’s romance with Kroll was first introduced to Southern Charm viewers during season 6. The duo’s on and off relationship lasted for two years before Us Weekly exclusively confirmed that they called it quits in December […]

The reunion, which kicks off Thursday, March 27, wouldn’t be complete without some celebratory moments. Cameras roll as the cast discovers Madison LeCroy is pregnant and expecting a baby with husband Brett Randle.

In addition, Miss Patricia is expected to arrive in part two to celebrate a momentous 10 seasons of Southern Charm by looking back on how the show began.

Southern Charm airs on Bravo Thursdays at 8 p.m. ET. Stream old episodes anytime on Peacock.",usmagazine
https://usmagazine.com,"Kim Kardashian Might File for Full Custody of Her, Kanye West's Kids",https://www.usmagazine.com/celebrity-moms/news/kim-kardashian-might-file-for-full-custody-of-her-kanye-wests-kids/,"Tue, 18 Mar 2025 14:16:11 GMT","Amid Kanye West‘s controversial public and social media behavior, Kim Kardashian might take legal action to get full custody of their kids.

One month more before West’s recent social media posts, multiple sources told Us Weekly that Kardashian, 44, is “considering” filing for “full custody” of her and West’s kids: North, 11, Saint, 8, Chicago, 6, and Psalm, 5.

“She is in a very tough position when she really has to coparent with him,” an insider shared. “Right now he is very distracted and she does not want to say anything bad about him, but the safety of her kids is what is [motivating this consideration].”

A second source noted to Us that Kardashian “is worried” that West’s online behavior could “create problems” for their kids.

Related: Everything Kim Kardashian and Kanye West Have Said About Coparenting Kim Kardashian and Kanye West have spoken candidly about coparenting since their February 2021 split — but it hasn’t always gone smoothly. The reality star and the rapper, who tied the knot in 2014, share four children: North (born in June 2013), Saint (born in December 2015), Chicago (born in January 2018) and Psalm (born […]

West, 47, previously sparked concern when he posted antisemitic rants and now has continued to raise eyebrows by sharing a song with disgraced music mogul Sean “Diddy” Combs, which featured vocals from his and Kardashian’s eldest child, North. In addition to dropping “Lonely Roads Still Go to Sunshine” on Saturday, March 15, West shared an alleged text message exchange between him and his ex-wife, apparently revealing how Kardashian allegedly tried to stop the release of the song because of North’s trademarked name.

“I asked you at the time if I can trademark her name. You said yes. When she’s 18, it goes to her. So stop,” Kardashian reportedly wrote, according to screenshots shared via TMZ. “I sent paperwork over so she wouldn’t be in the Diddy song to protect her.”

West, meanwhile, allegedly replied: “And neither of us will recover from the public fallout. You’re going to have to kill me.”

Kardashian and West said “I do” in 2014 and were married for seven years before the reality star filed for divorce in February 2021. She previously opened up about the challenges of coparenting with her ex after their divorce was finalized in November 2022.

“I had the best dad. I don’t want to get emotional, but it’s just been a day for me. It is hard. Coparenting is really f—ing hard,” Kardashian shared on the “Angie Martinez IRL” podcast in December 2022. “I had the best dad and the best experiences, and that is all I want for my kids. As long as they can have that, that is what I want for them.”

Kardashian addressed the challenges of trying to prevent her children from seeing their father’s controversial and antisemitic social media posts, adding, “I definitely protected him, and I still will in the eyes of my kids. For my kids. So, in my home, my kids don’t know anything that goes on [in] the outside world. I am holding on by a thread. I know that I am so close to that not happening, but while it is still that way, I will protect that to the end of the Earth as long as I can. My kids don’t know anything.”

Related: What Kim Kardashian Has Said About Kanye West Since Their Divorce Kim Kardashian has had plenty to say about her ex-husband, Kanye West, since the couple divorced in 2022. Kardashian and West married in 2014 and share four kids — daughters North, 11, and Chicago, 7, as well as sons Saint, 9, and Psalm, 5. Coparenting means that Kardashian and West still see a lot of […]

She continued: “It is [a full-time job]. It is worth it because I think that of course I want to disassociate in specific thoughts and things being said because that is not me. But at the same time in my home I could be going through something, but if we are riding to school and they want to listen to their dad’s music — no matter what we are going through — I have to have that smile on my face and blast his music and sing along with my kids. [I can] act like nothing is wrong and as soon as I drop them off, I can have a good cry.”

West, who moved on with now-wife Bianca Censori, has also offered his perspective when it comes to raising his kids with Kardashian.

“Even to this day, I’ll still give Kim advice on things that could help because that’s going to go to the kids,” he said on the “Alo Mind Full” podcast in September 2022. “She’s still got them 80 percent of the time, [to] raise those children. So what people saw when I was going back and forth is that I still have to be able to throw my version of what people would throw into the curriculum.”

With reporting by Travis Cronin and Andrea Simpson",usmagazine
https://usmagazine.com,Tracy Morgan Provides Update After Violently Puking at Knicks Game,https://www.usmagazine.com/celebrity-news/news/tracy-morgan-provides-update-after-violently-puking-at-knicks-game/,"Tue, 18 Mar 2025 16:17:21 GMT","After Tracy Morgan triggered worry by puking all over the court at the New York Knicks game on Monday, March 17, he provided an update from his hospital bed.

“Thank you for all your concern!” Morgan posted via Instagram on Tuesday, March 18. “I’m doing ok now and doctors say it was food poisoning. Appreciate my MSG family for taking such good care of me and I need to shout out the crew that had to clean that up. Appreciate you!”

Morgan was sitting courtside at the game between the Knicks and Miami Heat on Monday when he began violently vomiting. He was taken off the court in a wheelchair while holding a towel to his face.

The actor and comedian managed to have a good sense of humor about the ordeal, which briefly delayed the third quarter of the game at New York City’s Madison Square Garden.

Related: Tracy Morgan Felt ‘Culturally Isolated‘ at ‘SNL’: ‘Whitest Show in America‘ Tracy Morgan didn’t hold back when discussing the downsides of his early days at Saturday Night Live. “I wanted to show them my world, how funny it was. But the first three years, I felt like I was being culturally isolated sometimes,” Morgan, 56, recalled on Peacock’s SNL50: Beyond Saturday Night docuseries. “I’m coming from […]

“More importantly, the Knicks are now 1-0 when I throw up on the court so maybe I’ll have to break it out again in the playoffs 😅 #goknicks,” Morgan wrote.

The Knicks defeated the Heat 116-95.

Supporters immediately flooded the comments section of Morgan’s post with well-wishes. “Wishing you speedy recovery 🙌,” one fan wrote.

Another even provided a potential clue as to what led to Morgan’s illness.

“If it was the garden food that [did] this I’m not surprised because the food we bought last night was stale and cold and the person at the food counter got upset because we took it back,” another person wrote. “MSG leadership needs to do better with food services.”

There is no proof that Morgan — who is a regular at Knicks games — got sick by eating the food at Madison Square Garden.

Regardless, when Morgan is ready to return to the “World’s Most Famous Arena,” the staff will be ready to welcome him with open arms.

Related: Tracy Morgan Gained 40 Lbs After Learning to ‘Out-Eat Ozempic‘ While some stars have successfully lost weight using Ozempic, Tracy Morgan had the opposite experience. During his Tuesday, March 19, appearance on The Tonight Show Starring Jimmy Fallon, Morgan, 55, was asked how he’s been “staying in shape” after Jimmy Fallon complimented his physique. “That’s Ozempic,” Morgan replied. “I’ve learned to out-eat Ozempic. I out-ate […]

“We hope Tracy feels better soon and look forward to seeing him back courtside,” a Madison Square Garden representative told People in a statement Monday.

After news of Morgan’s health scare broke, some of his famous friends expressed their concerns on social media.

“Sending good thoughts to Tracy Morgan 💙,” Knicks superfan Ben Stiller wrote via X.

Robert Griffin III, former NFL quarterback and ESPN analyst, posted via X, “Prayers up for Tracy Morgan 🙏🏾Threw up courtside watching the Knicks and Heat play and then was taken off in a wheel chair.”",usmagazine
https://usmagazine.com,Christine Quinn Breaks Silence on Christian Richard Divorce,https://www.usmagazine.com/celebrity-news/news/christine-quinn-breaks-silence-on-christian-richard-divorce/,"Tue, 18 Mar 2025 13:47:06 GMT","Selling Sunset alum Christine Quinn is ready to discuss what led to her messy divorce from Christian Richard.

“I haven’t talked about this with anyone,” she told People in an interview published on Tuesday, March 18. “Some people knew stuff was going on, but no one knew the extent of it in terms of how bad everything really was.”

Quinn, 36, recalled having “no choice but to leave” Los Angeles and start again in Texas, adding, “I really didn’t have a choice. I was granted an emergency protective order so my ex couldn’t come to the house. He violated that and would keep coming back.”

While reflecting on the end of her marriage, Quinn noted there are a lot of details that the public “really don’t know” about the situation.

Related: Selling Sunset‘s Christine Quinn and Husband Christian Richard‘s Timeline Selling Sunset alum Christine Quinn met husband Christian Richard through a matchmaking mutual friend and work. “[My friend was] like, ‘Also, he’s looking for a house.’ And I was like: double bonus,” Quinn recalled to Bustle in May 2020. “Him and I had an amazing steak dinner and got to know each other, and we […]

“I was hacked out of my entire life. I was stripped of my entire life overnight — I literally had nothing. And it was dehumanizing,” she revealed. “I was completely resourceless.”

Richard, 46, did not provide a statement in response to Quinn’s comments to the outlet. The former couple’s marital issues originally made headlines when he was arrested and booked in March 2024 for assault with a deadly weapon. A temporary restraining order was put in place following the incident. Richard was taken into custody for a second time after violating the order when he returned to their home.

Quinn and Richard filed for restraining orders against one another following the alleged domestic violence incident. The former reality TV star’s request was granted but Richard’s was denied one month later.

Richard subsequently filed for divorce from Quinn after two years of marriage, citing “irreconcilable differences” as the reason for their split. Richard also requested full legal and physical custody of their 3-year-old son, Christian, while allowing Quinn visitation.

Related: Hollywood‘s Messiest Custody Battles: Brangelina, Usher and Tameka and More When there are children involved, divorce can get messy and turn exes into enemies. “We don’t see eye-to-eye. The friend that I was to Tameka, I don’t know that I could ever be again, because I really felt like we were friends. She made us enemies in a way that I never understood,” Usher said […]

Court documents obtained by Us in April 2024 stated that Quinn was seeking sole legal and physical custody because Richard’s “actions and behavior have put our son’s health and wellbeing at risk.” She has since moved to Texas with her son, which has benefitted them both.

“Everyone sees the incident that occurred, but this is something that had been going on for a while,” she continued on Tuesday. “This is something that had been under the surface for a long time. It was extremely unhealthy, and I like to think that I’m extremely resilient — and I am.”

Quinn made the decision to cut ties with Richard after seeing how it affected their son, adding, “There are certain things that I could tolerate, and it got to a point where it was affecting my son, and that wasn’t okay. I was like, ‘OK, I can deal with this, I’m an adult.’ But bringing him into the chaos and everything that kind of ensued, I was like, ‘No, this is not OK.’”

During the rare interview, Quinn brought up an example of Richard’s alleged behavior.

Related: Inside Christine Quinn‘s Legal Battle With Her Ex-Husband: A Timeline Christine Quinn and estranged husband Christian Richard are experiencing continued legal drama following his initial March 2024 arrest. The Selling Sunset alum married Richard in 2019, and their untraditional wedding was showcased during the Netflix show’s third season. Quinn famously wore a black wedding dress while the pair exchanged vows. During Selling Sunset season 4, […]

“There were times where my husband, literally, where I had to go to work and he would lay himself under my car,” she claimed. “I would sit for an hour until I finally missed a meeting and gave up and would go back inside, or he would shut the gates down so I couldn’t leave. It was bad.”

Quinn continued: “It was really hard for me because I look at my parents. My parents are high school sweethearts. I made a vow, and I really didn’t want to break that. It took everything out of me, it really did, to realize that this is the right thing to do. And then it became a matter of safety. It was initially safety for me, and then it was safety for my son. And so I had to walk away.”

While Richard did not respond to Quinn’s recent claims, his lawyer Alexandra Kazarian previously released a statement.

“The depths of Ms. Quinn’s delusion are once again on display. Her wild and unsubstantiated allegations have not stopped and her lack of credibility is best understood when read in conjunction with the unprecedented public statement by LAPD that her claims of hotel room bugging and alleged surveillance by Christian were unfounded,” read a 2024 statement after Quinn filed for a restraining order. “The reality is that Ms. Quinn enjoyed complete financial and personal independence during the marriage while spending upwards of $30,000 a month of his money and is now facing a divorce without a prenup, and having to repay the community assets with the millions she made during the marriage.”",usmagazine
https://usmagazine.com,15 Can't Miss Deals Ahead of Amazon's Big Spring Sale,https://www.usmagazine.com/shop-with-us/news/amazon-big-spring-sale-best-early-deals/,"Tue, 18 Mar 2025 15:15:59 GMT","Us Weekly has affiliate partnerships. We receive compensation when you click on a link and make a purchase. Learn more!

This is not a drill! Amazon is hosting its Big Spring Sale again this year to help Us kick off the new season. And no, we don’t have to wait until it’s borderline summer. This sale is happening next week and includes everything you need for the best season yet — think dreamy dresses, travel essentials, grilling tools, fresh bedding and so much more.

The event runs from March 25 until March 31. Once it’s live, you’ll find everything from classy outfits and blowout brushes to outdoor furniture, Mother’s Day gifts and electronics. And if you want to shop some end-of-season scores, you’ll find plenty of those, too. But Amazon has a little secret in its back pocket . . . and we’re here to spill the beans.

Here it is: You don’t have to wait until March 25 for the best deals. There are endless bestsellers on secret sale right now! Amazon is rewarding early shoppers like you with exclusive savings that you won’t want to pass up. We’re loading our carts with both essentials and splurges because let’s face it, deals like this don’t come around often.

We found the best 15 deals that are bound to sell out this week, long before the Big Spring Sale, so don’t let anything linger in your cart for too long. Oh, and if you have Big Spring Sale questions, you’ll find everything you need to know below.

15 Best Early Amazon Big Spring Sale Deals

1. Dimore 4-Pack Workout Leggings — was $26, now $23!

2. Stanley Quencher H2.0 Tumbler — was $35, now $26!

3. Coop Home Goods Original Adjustable Pillow — was $79, now $63!

4. Revlon One-Step Hair Dryer and Styler — was $45, now $30!

5. Dream Pairs Closed Toe Summer Sandals — was $39, now $30!

6. Waterpik ION Professional Water Flosser — was $100, now $80!

7. Prettygarden Summer Bodycon Maxi Dress — was $51, now $38!

8. Xieerduo Three-Quarter Sleeve Blouse — was $20, now $10!

9. Levoit Air Purifier — was $300, now $250!

10. Trendy Queen Oversized T-Shirt — was $10, now $8!

11. Bedsure 100% Cotton Blanket Queen Size — was $50, now $35!

12. Baleaf Biker Shorts — was $27, now $15!

13. Ninja Four-Quart Air Fryer — was$90, now $80!

14. Ekouaer Soft Pajama Set — was $34, now $24!

15. Braun IPL at Home Laser Hair Removal — was $350, now $280!

Related: Emily Ratajkowski and I Can‘t Stop Wearing These ‘Iconic‘ $90 Sneakers As we inch into the warmer months, most of Us are trying to get our spring and summer wardrobes in check. Dresses are easy to find — after all, Amazon is packed with trendy bestsellers — as are swimsuits, but sneakers are a pain and a half. They have to be fashionable, of course, but […]

What Is Amazon’s Big Spring Sale?

Amazon’s Big Spring Sale is a six-day deal event that runs at the end of March. Sales run across every category and include showstopping deals on everything from year-round essentials, designer bags, bathroom mirrors, snazzy headphones and pretty much anything else you can dream up.

So whether you’ve been eyeing some new patio furniture, want to redecorate the living room or need to stock up on the basics, you’ll find must-have deals all week long. But you don’t have to wait until the actual Big Spring Sale to score. Some of our absolute favorite tech gadgets, outfit pieces, anti-aging skin creams, vacuums and kitchen appliances are on major sale right now.

When Is the Big Spring Sale?

The sale runs from March 25 to March 31, so you have plenty of time to shop your top picks. Amazon’s Big Spring Sale started in 2023 as a three-day event; in 2024, Amazon raised the bar by making it a five-day party. Now, we get nearly an entire week to shop. What a time to be alive!

What Deals Are Running Right Now?

So many! Beats Studio Pro headphones, bestselling Shark vacuums, Levoit air purifiers and Amazon Fire TVs are all marked down. And don’t forget about billowy blouses, Stanley tumblers, KitchenAid mixers and cozy throw blankets that are also on sale! These picks won’t be around long, so when you see a steal of deal, don’t delay on adding it to your cart.

Do I Need to Be a Prime Member to Shop?

While all Amazon customers can shop the sale, an Amazon Prime membership ensures you get the best discounts possible. Prime members can shop deals with an exclusive “Prime Spring Deal” badge, which indicates must-snag offers. If you haven’t made the leap into an Amazon Prime membership yet, let this be your sign!

Check our latest news in Google News Follow Us Check our latest news in Apple News Follow Us

Sign up for a free trial here, or commit to the Prime membership for just $14.99 per month here. If you’re a student or receiving government assistance, Prime offers discounted membership options that provide all the benefits at a slightly lower rate. How’s that for saving big this spring?",usmagazine
