Input URL,Title,Link,Published,Description,Source
https://vulture.com,"‘Happy Gilmore 2’ Trailer, Cast, and Everything We Know",https://www.vulture.com/article/happy-gilmore-2-everything-we-know.html,"Tue, 18 Mar 2025 10:03:00 GMT","Happy would love Top Golf. Photo: Scott Yamano/Netflix

Happier Gilmore? Happy Gilmost? We can keep workshopping the name, but the fact remains that a Happy Gilmore sequel is coming to Netflix. News of the film first broke (if you don’t count Shooter McGavin blabbin’ on the radio) at Netflix’s Upfront presentation in May 2024. Now, we have our first official trailer, featuring a Happy that’s happy to be back golfing, Julie Bowen, and no alligators in the sky (as of yet). Below, everything we know about the upcoming comedy, from trailer to cast.

Fore! A trailer!

Netflix dropped the Happy Gilmore 2 trailer on March 18, and the Boston Bruins should be ashamed that, the previous night, they lost to the Sabres. Sandler reps the New England team (amid their terrible, terrible season) by wearing a jersey throughout the trailer. Happy, who has not golfed in years, gets back on the green and swings at a ball so heard he burns a hole through a golf simulator. Plus, Ben Stiller takes a break from prestige TV to return as Hal. “Holy shhhhh …” Mr. Gilmore reacts for us all.

Who else will be in Happy Gilmore 2?

Hmmm… what are Lana Del Rey’s avails? On The Tonight Show, Sandler mentioned that many real golfers will be making cameos in the film. Christopher McDonald and Julie Bowen are both back. (Carl Weathers, who played Chubbs in the first film, died in February 2024.) New cast members include Margaret Qualley, Travis Kelce, and Bad Bunny. Does that mean Taylor Swift is going to attend the premiere?

Margaret Qualley lied on her résumé

Apparently The Tonight Show is getting all the Happy Gilmore 2 ’sclusies. Margaret Qualley went on the show September 24 to share how her husband lied to get her a spot in HG2. Apparently Adam Sandler has a texting relationship with Jack Antonoff. Sandman texted “Jacko. It’s Sandler. Does your wife golf at all?” To which Jacko replied “yeah she’s actually good!” Now, Qualley says she does, in fact, golf. And is not, in fact, good. But Antonoff’s little white lies secured a small part in the Happy Gilmore sequel for Qualley.

KillaTrav will meet the Sandman

First Grotesquerie and now this! Travis Kelce has successfully clawed his way into Happy Gilmore 2. After pleading his case on his New Heights podcast, Sandler decided to give the kid a shot. “Travis has… he mentioned it, so we have a nice something for Travis,” Sandler said on The Tonight Show. “He’s gonna come by. He’s a very nice guy. You guys would love him in real life. What a big, handsome guy. Funny and cool as hell. He’s a stud, and he’s so funny.” Sounds like Sandman has a crush. Between Qualley and Kelce, that’s 2 of 2 Happy Gilmore 2 casting announcements straight from Taylor Swift’s squad.

When is Happy Gilmore 2 coming to Netflix?

Happy Gilmore 2 premieres on Netflix on July 25.",vulture
https://vulture.com,Dakota Johnson Meets Her Match(es) in Materialists,https://www.vulture.com/article/materialists-movie.html,"Tue, 18 Mar 2025 09:09:03 GMT","Are Celine Song and her husband just gonna take turns dropping a love-triangle movie every other year? Because that works for us, honestly. Song, the mind behind 2023’s Past Lives who is married to Justin Kuritzkes, writer of the screenplay for 2024’s Challengers, has a new movie in theaters as the writer-director of A24’s Materialists. Dakota Johnson leads the cast as an ambitious New York City matchmaker who seems torn between (who could’ve guessed!) two potential matches for herself. Are you team Chris Evans or team Pedro Pascal? Maybe the new trailer will help you decide.

What happens in the trailer?

The trailer introduces an original Japanese Breakfast song … and Johnson as Lucy, a matchmaker who is willing to stop random guys on the street to see if they’re potential customers. Some of her clients have very specific criteria (“nothing over 20 BMI,” “more grown” but still young), while others are a little more open (“I’m trying to settle”). A friend and a celebratory cake inform us that Lucy is responsible for nine marriages — which is shy of Love Is Blind’s record but still pretty good. According to an official synopsis, she’s “torn between the perfect match and her imperfect ex.” It’s pretty easy to tell who’s who: Pascal’s character meets her at an event where Evans’s character is a waiter who already knows her drink order. One man sleeps with her in a $12 million apartment, while the other man lives with roommates but has a rich past with her. She’s entertaining both connections, but her overall stance on relationships seems to be getting more complicated. “I don’t think I’m very good at my job, anymore,” she says at one point, later musing that people get married “because they’re lonely, and because they’re hopeful.”

Who else is in the cast of Materialists?

Johnson, Evans, and Pascal have our main love triangle covered. Variety was the first to report that Zoë Winters, Dasha Nekrasova, Marin Ireland, and Louisa Jacobson would also join the trio in the cast.

When is Materialists coming out?

Save the date: Materialists is set to materialize in theaters on June 13, 2025.",vulture
https://vulture.com,The Movie That Led Charli XCX to Jeremy O. Harris & Pete Ohs,https://www.vulture.com/article/the-movie-that-led-charli-xcx-to-jeremy-o-harris-and-pete-ohs.html,"Tue, 18 Mar 2025 08:00:08 GMT","Photo: SXSW

Not long before they absconded to Poland to make a movie with Charli XCX at the height of Brat mania, Jeremy O. Harris and director Pete Ohs spent two weeks making a very different movie in the wilderness — upstate Massachusetts, that is. Alongside The Afterparty’s Zoë Chao, Callie Hernandez from The Flight Attendant and Alien: Covenant, and Harris’s Slave Play collaborator James Cusati-Moyer, the quintet co-wrote and shot an arch body-horror psychodrama using a loose premise and a look book heavy on Cries and Whispers imagery. “You’re not supposed to mix Bergman with Beyond Fest,” Ohs jokes.

The True Beauty of Being Bitten by a Tick premiered earlier this month at South by Southwest, ushering in what could be a big year for Ohs and Harris. Ohs had edited the documentary Slave Play. Not a Movie. A Play., and Harris was attracted to his fluid Mike Leigh–ish filmmaking process, which he’d also employed on the similarly microbudget indies Jethica and Everything Beautiful Is Far Away (the latter starring Julia Garner). So they decided to make one themselves. What resulted is a chamber piece about a dispirited urbanite named Yvonne (Chao) who retreats to a country house where her friend (Hernandez) is residing with a couple (Harris and Cusati-Moyer) who rattle off crunchy platitudes about mugwort, organic produce, and the restorative power of a sunrise.

The film runs a lean 80 minutes, dipping into Get Out and Rosemary’s Baby territory as Yvonne begins to doubt — and then reluctantly embrace — the eeriness of her roommates’ rustic nonchalance. When Yvonne discovers a tick bite on her upper back one morning, the others assure her it’s nothing a little clove oil or black walnut can’t fix. The hallmark of The True Beauty of Being Bitten by a Tick is the sense of dread that mounts while Yvonne grows more and more susceptible to a figment of utopia built on wellness pseudoscience. Any city dweller knows what it’s like to make a brief escape to greener pastures, but what happens when that exodus becomes an entire doxycycline-agnostic lifestyle?

Jeremy O. Harris (left) and Pete Ohs. Photo-Illustration: Vulture; Photos: Robby Klein/Getty Images

Ohs and his cast originally intended to make a sexier movie, but they were operating under SAG’s Micro-Budget Project Agreement, which prohibits nudity and simulated sex on productions costing less than $20,000. Around that time, Harris had been hanging out with wealthy fashion types who would casually reference their tick-induced Lyme disease — the same condition that Real Housewives of Beverly Hills alumna Yolanda Hadid once compared to HIV. Ohs created a loose outline satirizing the sometimes–galaxy-brained wellness industry that’s reportedly worth upwards of $6 billion. In the Berkshires, he and the cast used a shared Notes-app page to write dialogue as the shoot unfolded, working their way toward an 11th-hour twist. They went to Goodwill to pick out costumes and lived together in the rental house seen in Tick, cooking, cleaning, and checking one another for bites in ways that mirrored their characters’ behavior.

“It does match my own writing in some ways because I like to take a bold swing at the start and not know where I’m gonna end up,” Harris told Vulture at the W Austin hotel during SXSW. “I didn’t know what the third act was. What I did know was that I wanted to start off that first scene of Slave Play the way you see it. I wanted it to be like, Where the fuck are they? And then, at some point, you were going to realize they were in group therapy with this weird sex that we’re seeing.”

Harris and Ohs, having encountered Charli XCX around 3 a.m. at the Lower East Side bar Clandestino about a month before Brat came out, made Erupcja that way, too. It’s one of several forthcoming roles for Charli, a cinephile who, according to Harris, bumps Criterion titles left and right. (Her other future club classics include Gregg Araki’s first film in 11 years, a Faces of Death remake, and an A24 pop-star mockumentary that she originated.) But whereas Tick was made in isolation, Erupcja (which does not yet have a release date or distributor) roves through Warsaw, hence why news of the production leaked last August. People who enjoyed Charli’s hyperclubby Grammys performance in February (and pretty much everything she has done in the past year) might be surprised to learn that she wanted to play against type here. She’s portraying a shy tourist modeled off a famous indie-rock friend of hers.

“She met Pete, they talked about movies, and she was like, ‘I’ll do one,’” Harris says. “That’s literally how it happened. It wasn’t about calling managers and agents. She was like, ‘This feels like making an album.’ But, also, Pete gives you the platform to play something you’ve never played before. I came to Tick, and I was like, ‘I’m on Emily in Paris, and I’m always playing big and brash with the loudest costumes.’ The lowest-energy thing I can play is really funny for me. I think the experience for Charli was, I’ve been playing Charli XCX for so long now. What would it be like to play this new person?”",vulture
https://vulture.com,Is Netflix’s Adolescence Based on Real Adolescents?,https://www.vulture.com/article/is-netflix-adolescence-based-on-a-true-story.html,"Tue, 18 Mar 2025 02:27:47 GMT","Photo: Courtesy of Netflix

Adolescence opens with a dramatic arrest: 13-year-old Jamie (Owen Cooper) is accused of stabbing his classmate, Katie, to death. The four-part British series — which dropped on Netflix on March 13 and topped the streaming platform’s most-watched show list that weekend, according to the BBC — already has famous fans. Paul Feig praised the first episode as “one of the best hours of television” he’s ever seen, while Jeremy Clarkson joined viewers in expressing amazement and confusion over the show’s use of a drone in the second episode. (Every episode of Adolescence is shot in one continuous take.) But it’s not just the technology that the internet is curious about. Many people online are also wondering whether this crime drama is a work of true-crime. Andrew Tate is name-dropped, and he’s real whether we like it or not — but is the main murder plot of this series also based in reality? Below, what co-creator and star Stephen Graham has said about the inspiration behind Adolescence.

Does Jamie have a real-life counterpart?

Not directly. Jamie’s story itself is not based on a specific person or event, but per Birmingham Live, Graham noted that real reports of knife crime did give him the idea for what the series would be about. “I’d read an article in the paper about a young boy stabbing a young girl, and it made me feel a bit cold,” he said. “Then about three of four months later, there was a piece on the news about a young boy who’d stabbed a young girl.”

He told Tudum that learning about that first stabbing “shocked” him and made him wonder what was going on in society. “And then it happened again, and it happened again, and it happened again,” he recalled. “I really just wanted to shine a light on it, and ask, ‘Why is this happening today? What’s going on? How have we come to this?’ ”

So, youth knife attacks are a concern in the U.K.?

Yes, and increasingly so. Graham told The Hollywood Reporter that there is an “epidemic of knife crime amongst young, young lads … up and down the country.” According to the Office for National Statistics, the number of knife attacks in England and Wales has almost doubled in the past 10 years. Meanwhile, Ministry of Justice data for the year ending in March 2023 shows that 17.3% of the roughly 18,500 cautions and convictions made for possession of a knife or offensive weapon were offenders ages 10 to 17.

Adolescence’s release follows the January sentencing of an 18-year-old to at least 52 years in prison for killing three young girls last summer at a Taylor Swift-themed dance event in Southport when he was 17. The series was “conceived and written months before” that attack, according to Entertainment Weekly, but the subject material unfortunately continues to feel timely. The Official for National Statistics reported in February that 83% of teenage homicide victims in England and Wales were stabbed to death during the year ending in March 2024; according to the BBC, the data showed that teens were more likely to be killed with a sharp instrument over any other age group. As recently as last week, an 18-year-old was sentenced to at least 23 years in prison for fatally stabbing a 15-year-old girl in London when he was 17.

Do we know anything about the inspiration for Jamie’s parents?

Graham has not named any specific direct inspirations, but he has said that his own reaction to knife attacks shaped the way that Jamie’s parents, played by himself and Christine Tremarco, is portrayed in the series. He told The Hollywood Reporter that people “blame the mom and dad” when they hear this type of news involving kids from “council estates,” or British public housing. He admitted that he himself is sometimes “guilty” of falling into this line of thinking. However, he told Rolling Stone UK and Drama Quarterly that questioning that initial instinct made him decide to focus on what was happening with Jamie and not have the parents be violent or alcoholics. “I wanted the dad to be a hardworking man,” Graham noted, “the kind of man that I was brought up with, like my uncles and my dad, who used to go to work at, like, six in the morning and not get home till 8 o’clock at night, Monday to Friday.”

And was that an Andrew Tate reference?

Yup. Much to the displeasure of some of his fans, Adolescence name-drops self-proclaimed misogynist and far-right star Andrew Tate when a detective brings up the potential role of the involuntary celibacy subculture. In GQ, Graham credited co-writer and co-creator Jack Thorne for coming up with the “incel stuff” in the series and doing research about online radicalization.

Meanwhile, Graham first learned about Tate through his kids. “I was looking online at a workout thing that our [son] Alfie sent me, and it was a good workout,” he told Rolling Stone UK. “Three or four days later, the algorithm — which I don’t understand — showed me the same gentleman again, and he was telling me his misogynistic opinions and views.” In his GQ interview, Graham added that his daughter Grace was the one who then identified Tate and explained who he was. “And then I thought, Well, I’m a semi-put-together 51-year-old man who knows a little bit of who I am and what I’m about,” he said. “So what if I was a 13-year-old boy who didn’t have the greatest relationship with my father, didn’t really have that solid connection with a role model, and was finding my feet out there?”",vulture
https://vulture.com,Adolescence Recap: School Is Hell,https://www.vulture.com/article/adolescence-recap-episode-2-netflix.html,"Tue, 18 Mar 2025 16:40:40 GMT","Adolescence Episode 2 Season 1 Episode 2 Editor’s Rating 3 stars * * * « Previous Next « Previous Episode Next Episode » Photo: Courtesy of Netflix

No one wants to be a teen again. How could they? It’s an unnerving, seemingly never-ending time of immense social pressure, roller-coaster hormones, and incredible self-doubt. You feel simultaneously alone and under constant supervision, and the littlest slight or kindness can send you into a mental spiral.

And, God, to be in a school full of teens? No thanks. It seemed bad enough when I went in the late ’90s, when there were parties and cliques and whatever else. But today? With phones, social media, backbiting, and “Are you even my friend if you don’t comment on my Story” stuff? Unthinkable.

It’s not something that DIs Bascombe and Frank are thinking when they go to visit Jamie and Katie’s school, even though it also happens to be the school that Bascombe’s son, Adam, attends. As adults, they think they get how high school works, with bullying and teachers and whatever, but it becomes quickly apparent that they don’t get it at all. They might think they have Jamie dead to rights (and they do, in some sense), but as soon as they question Katie’s friend Jade and almost instantly provoke her into flying off the handle, you realize they’re in over their heads.

Thankfully, Adam’s there to help his dad, finding him to explain the intricate and hairy world of emoji codes. Bascombe and Frank asked Jamie if he and Katie were friends and got a sort of noncommittal affirmative in the previous episode, but people like Adam and Jade make it quickly known that, in fact, they were not. Katie thought Adam was an incel, a red-pilled member of the internet misogynist Andrew Tate’s manosphere. The cops take that to mean she was bullying him, and while that’s certainly possible — calling someone out on social media, via emoji or not, is pretty shitty — I get the feeling we haven’t truthfully discovered the whole story yet. What did Jamie do to make Katie think that about him?

And how were Jamie’s friends involved? At the very least, Ryan knew what was going on, given that he gave Jamie the knife. (Side note: Asking “Did you help him get the knife?” is a weird question considering it’s a kitchen knife. Who would have trouble getting one? I’ve got eight in my knife block right now.) Moreover, who else knew? Were the teachers complicit in their ignorance? Could they claim to be as overwhelmed as Mr. Malik? What role did bullies like Fredo and that shitty kid in the front row of 8G play, and did all that screaming and screen time just serve to exacerbate everything? Could the teachers have done more to protect Katie and all the girls? Or maybe they should have protected the boys and educated them about adult social relationships rather than leaving it to their parents, most of which have to be just as clueless as Bascombe and Frank.

It’s all truly just nightmare fuel. What goes on in our kids’ schools while we’re not watching? On their phones? Do we really know as much as we think we know, and are teenage secrets still okay? At the end of the episode, we see Bascombe trying to reestablish a relationship with his son, who he says barely talks to him. It seems to work … for today, at least, with the pair jetting off for some Chinese-restaurant chips. Adolescence wants us to think that these types of problems can be solved by really, openly talking to our kids. That may be true, but I’m pretty sure that, sadly, it will take more than just this show to get us parents up and moving in that direction.

Stray Observations

• Two things that I thought were well said in this episode. First, Bascombe tells Ryan, “It’s crazy what your brain tells you to do when you’re a kid.” Second was Frank’s assertion that kids just need one person — a teacher, a parent, a friend — to tell them that they’re normal and they’re supported. Ideally, they’ll have more, but it really is amazing and important to have that one person. (And that’s why I’m also incredibly worried about Jade now.)

• I love how Adam knows about red pills and blue pills but has no idea that they’re from The Matrix.

• While the British criminal-justice system seemed pretty all right in episode one, this school failed to make me jealous of the British educational system. However, the uniforms were cute. And they had a tennis court!",vulture
