Input URL,Title,Link,Published,Description,Source
https://indiewire.com,Gwyneth Paltrow Didn’t Know What an Intimacy Coordinator Was Until Filming ‘Marty Supreme’,https://www.indiewire.com/news/general-news/gwyneth-paltrow-intimacy-coordinators-1235104516/,"Tue, 18 Mar 2025 16:30:00 GMT","After decades in Hollywood, Gwyneth Paltrow had her first encounter with an intimacy coordinator during “Marty Supreme.”

Paltrow, who returns to acting with the Josh Safdie-helmed film after five years away from the screen, told Vanity Fair that she actually had no idea what an intimacy coordinator even was prior to working on the A24 film.

“There’s now something called an intimacy coordinator, which I did not know existed,” she said, adding that she told the coordinator at one point, “I was like, ‘Girl, I’m from the era where you get naked, you get in bed, the camera’s on.’”

As Paltrow teased, there were a slew of scenes that did warrant one, though. “I mean, we have a lot of sex in this movie,” Paltrow said, citing her onscreen time with “Marty Supreme” co-star Timothée Chalamet. “There’s a lot — a lot.”

Chalamet plays the “other man” to Paltrow’s character, who is wed to a ping pong kingpin (Chalamet is the titular fictional character who is a ping pong champion.)

Paltrow added that at times, though, she and Chalamet also asked the coordinator to “step a little bit back” for certain sequences. “We said, ‘I think we’re good. You can step a little bit back,’ ” Paltrow recalled. “I don’t know how it is for kids who are starting out, but…if someone is like, ‘OK, and then he’s going to put his hand here,’ I would feel, as an artist, very stifled by that.”

As VF included, Paltrow shrugged at simulating sex with Chalamet, and quipped, “I was like, ‘OK, great. I’m 109 years old. You’re 14.’”

Paltrow also couldn’t help but praise the talent of Chalamet, as well as his charismatic charms: She dubbed Oscar-nominated Chalamet a modern day icon. “He’s such a thinking man’s sex symbol,” Paltrow said. “He’s just a very polite, properly raised, I was going to say kid…He’s a man who takes his work really seriously and is a fun partner.”

Paltrow previously said during the “Drew Barrymore Show” that Chalamet was an ideal co-star that also helped ease her nerves about returning to the screen. “He is such a wonderful young man,” she said. “He’s very polite, very talented. Just so nice to be with. I’m really having a good time with him. I’m glad that I put myself, you know, out of…just sort of back into fear a little bit again.”",indiewire
https://indiewire.com,‘A Man and a Woman’ Restoration Trailer: Fall in Love Again with the Oft-Homaged 1966 French Romance,https://www.indiewire.com/news/trailers/a-man-and-a-woman-restoration-trailer-claude-lelouch-1235104524/,"Tue, 18 Mar 2025 16:00:00 GMT","You probably know the iconic “A Man and a Woman” main theme written by Francis Lai, but when was the last time you actually saw the movie? Claude Lelouch‘s 1966 Cannes Palme d’Or (and double) Oscar winner is led by French cinema icons Anouk Aimée (who died last year and strangely was not included in the Oscars’ 2025 In Memoriam segment) and Jean-Louis Trintignant (who died in 2022). The classic romance is now coming back to theaters, in a new restoration, courtesy of Rialto Pictures this April. IndieWire shares the exclusive trailer for the re-release below.

As IndieWire previously wrote in our ranking of all Cannes Palme d’Or winners: “From director Claude Lelouch comes this 1966 classic — a tender, visually stirring film of rejuvenating love between a widow and a widower: a race-car driver (Jean-Louis Trinignant) and a movie script girl (Anouk Aimee) share a candid romance while balancing the demands of career and parenthood. It’s a touching, realistic look at a burgeoning adult romance, with each participant encumbered by a past tragedy, causing them to proceed delicately. The film is also famous for Francis Lai’s gorgeous, swooning score. Winner of Oscars for Best Foreign Language Film and Best Original Screenplay, it’s quite possibly one of the sweetest love stories ever captured on screen.”

In the film, Trintignant plays a widower and racecar driver who is now single after his wife’s suicide. Meanwhile, Aimée’s character is herself a widow, whose husband was a stuntman who died in an accident during a production. They meet at their children’s boarding school in Deauville and form a nervous friendship that eventually turns into romance, all leading to an iconic finale in which Claude Lelouch’s camera (he did the cinematography himself) swirls around the lovers.

The film has been the subject of many homages in cinema and television for the past half century. Recently, Chanel’s black-and-white fall/winter 2024/205 ad featuring Penélope Cruz and Brad Pitt is a direct homage to “A Man and a Woman.”

The new restoration of “A Man and a Woman” opens April 4 at New York’s Film Forum and April 18 in Los Angeles at the Laemmle Royal. Lelouch will appear in person for Q&As in New York.",indiewire
https://indiewire.com,Music Comes Alive for Pedro Pascal in New Apple Air Pods Commercial from Spike Jonze,https://www.indiewire.com/news/general-news/pedro-pascal-spike-jonze-apple-commercial-1235104334/,"Tue, 18 Mar 2025 15:04:47 GMT","Rare is it that we get a new cinematic feast from Academy Award-winning writer/director Spike Jonze and while today’s offerings may not be a new feature film, his new Apple Air Pods 4 commercial starring Pedro Pascal is sure to satiate fans for the time being. Set along a lively city block, the advertisement sees Pascal whisked from the cold doldrums of his winter existence and dropped into a music-filled fantasia bursting with bright red and yellow flowers. Highlighting the power of these new Air Pods to help escape everyday life, Pascal is seen dancing through the streets and mouthing along to the lyrics, as if part of his own musical. Watch the new commercial below.

Though many are aware of Jonze’s films, including “Being John Malkovich,” “Adaptation,” and “Her,” for which he won the Oscar for Best Original Screenplay, even more people are likely to have seen his work on the small screen with advertisements that feature talent like Margaret Qualley (Kenzo World), Idris Elba (Squarepace), and FKA Twigs (Apple Homepod). Jonze also recently directed a short music video for Coldplay’s “All My Love” featuring Chris Martin singing alongside a dancing Dick Van Dyke.

Upon release of his 2018 commercial with Twigs, titled “Welcome Home,” Jonze also unveiled a behind-the-scenes look at the making of the short film in AdWeek. Jonze worked on the ad with famed cinematographer Hoyte van Hoytema, currently busy shooting Christopher Nolan’s latest project, “The Odyssey.” Dancer Ryan Heffington also took part, choreographing Twigs in “Welcome Home,” as well as Qualley in “Kenzo World.” Movement coach Theo Lowe was also involved in the former project too.

“Spike had a great insight to what he wanted in terms of when this movement would play into what was happening in the scene, so it was pretty much blocked out,” said Heffington during the “Welcome Home” behind-the-scenes video, “but we extended some sections, just so we can let the choreography settle a bit more and let the character within that choreography develop and settle and make sense within the story.”

Jonze is a member of the commercial production company MJZ, which also boasts work from directors Craig Gillespie, Harmony Korine, Mike Mills, and Halina Reijn. His new ad, “Someday,” promotes the release of Apple Air Pods 4, featuring active noise cancelling technology.

Watch the video for “Someday” below.",indiewire
https://indiewire.com,How ‘The Night of the Hunter’ Influenced ‘The Actor’,https://www.indiewire.com/features/craft/the-actor-cinematography-interview-joe-passarelli-1235103408/,"Tue, 18 Mar 2025 15:00:00 GMT","For cinematographer Joe Passarelli, it was a smooth transition going from the stop-motion “Anomalisa” (2015) to the live-action “The Actor” with director Duke Johnson. That’s because both films are formally bold, mind-bending tales about the search for identity.

“Anomalisa” explores Fregoli syndrome, where people appear as the same person in disguise, by marrying distinctive stop-motion designs with stylized action; “The Actor,” by contrast, tackles a variation of amnesia, where people appear as a troupe of actors playing multiple roles, with more dream-like theatricality.

Based on Donald E. Westlake’s surreal novel, “Memory,” Johnson’s newest film focuses on André Holland as a man who suffers from both long-term and short-term memory loss; he’s trying to get back to New York from a ’50s Midwestern town, but his only anchor in a shifting reality is the woman he befriends played by Gemma Chan. Holland’s continually refreshing blank slate is the story motivation for Passarelli and his team to wrap “The Actor” in a picturesque fog of soft but heightened imagery.

Of course, there is a clear reference point any cinephile might point to for ’50s, picturesque, heightened cinematography that blends all sense of reality and fantasy: Charles Laughton’s “The Night of the Hunter.”

“We really liked how the backgrounds were right up against the stage wall, and we stuck to that look,” Passarelli told IndieWire. “And it was really cool when we have the sky so close to the back wall on main street, and we were playing with forced perspective. Duke and I decided to use our knowledge and skill set from stop-motion and miniatures to fool the eye.”

‘The Actor’ Neon

Johnson and Passarelli looked at many other black-and-white films from the same period, too, in part because Johnson wanted to explore the things that make people feel like they’re in a period film. But all “The Actor’s” stylistic choices arose out of a desire to express the heightened importance and emotions that memories can take on.

“ It started with discussions of our memories in certain places and the further back they go, the more distant and heightened they become,” Passarelli said. “So just imagine if you forgot all those things, and then those memories must seem like the greatest memories ever. He’s almost living in a dream throughout the movie because he knows very little on a day-to-day, week-to-week basis. We didn’t ever want the audience to forget that fact as well.”

“The Actor” was filmed in Budapest, where Passarelli shot on the ALEXA SXT cameras with period anamorphic lenses for bending the images around the sides of the artificial-looking sets. With the aid of soft lighting, this constantly put Holland in the spotlight — like an actor. “The thing that kept it balanced and focused was the journey home, and then, all of a sudden, he’s back in rewind,” Passarelli added.

‘The Actor’ Neon

While there are obvious differences between the tannery town that Holland is stuck in and his bohemian Greenwich Village home, the director wanted everything to appear whimsical and detached from reality. The filmmakers achieved this by combining elements of the theater with a TV soap opera that Holland appears in.

For the latter, they gave the appearance of being backstage during the filming of a soap opera in which Holland plays “The Condemned Man,” where the camera follows him closely as he gets more and more disoriented, wandering from one set to another (one of them even turns out to be his New York apartment).

The sense of artifice is present throughout the film. “The Actor” opens in monochrome like a vintage TV show, from the main titles to the violent inciting incident that causes Holland’s amnesia. For the skyline, they even borrowed from “Anamalisa.”

‘The Actor’ Neon

“After we shot everything at Budapest, we went back to [the animated Starburns studio] for just a few pickup shots for the titles with these ‘Anomalisa’ buildings,” said Passarelli. “So I lit it up and had one of our skies from the stop-motion film out there and put little flashes of thunder and rain on the windows. It was fun to take them out of storage for one last hurrah.”

For the scene where Holland and Chan first exchange glances in a movie theater as the only patrons watching the Casper animated short, “Boo Moon” (1954), the director and cinematographer were inspired by Martin Scorsese’s remake of “Cape Fear.”

“We had watched a bunch of different people watching movies in theaters,” Passarelli said. “And we wanted to see their faces very clearly and get that balance of the screen. And, surprisingly, Robert DeNiro’s got this great scene where he’s laughing in a theater [watching ‘Problem Child’], and it’s so well lit. It’s a good beam of light, changing colors, but not too distracting. And we designed something to change colors, and we played our Casper, and it looked great. In just a couple of shots we get their emotions, but then we end on André waking up after he’s passed out. He’s the only one left in the theater and he doesn’t know where he’s at.”

“The Actor” is currently playing in theaters.",indiewire
https://indiewire.com,"The ‘Rust’ Tragedy Wasn’t an Accident, It Was a Warning — Opinion",https://www.indiewire.com/features/commentary/the-rust-tragedy-warning-opinion-on-set-safety-1235104416/,"Tue, 18 Mar 2025 14:00:00 GMT","Becky Morrison is the CEO of production company The Light. She is an advocate for change in the industry, with a focus on creating healthy on-set environments.

“Last Take: Rust and the Story of Halyna” is streaming now on Hulu. The death of Halyna Hutchins was a singular tragedy, but the conditions that led to it were anything but unique. Ignoring crew well-being, prioritizing budgets and schedules over safety, and pushing people past their limits happens every day.

As an industry, we have yet to fully acknowledge the pervasiveness of unsafe working conditions because we’ve normalized the idea that suffering is an essential part of filmmaking. Our “battle-tested” cameras have names like Rocket, Weapon, and Arsenal. We use terms like “run n’ gun,” “lock it up,” and “shoot.” Our toxic production culture frames suffering as “paying your dues.”

We don’t just accept self-sacrifice — we glorify it.

The data backs this up. In a 2024 survey by IPC, 79 percent of film workers reported being injured on the job, and 69 percent believed that creative vision was prioritized over safety. In a study by The UK Film and TV Charity, 77 percent of respondents said the film and TV industry is a mentally unhealthy place to work, and a shocking 30 percent having considered taking their own life in the past year.

These aren’t just statistics, they are people. Yet since most struggles don’t end in public tragedy, they rarely make headlines.

‘Last Take: Rust and the Story of Halyna Hutchins’ Hulu

But there is hope. A movement for change is growing. Documentaries like “Last Take: Rust and the Story of Halyna” and “Safe Sets: Dying to Work in the Film Industry” are sparking conversations and bringing long-overdue attention to the realities of working behind the scenes. More productions are actively prioritzing well-being, proving that a better way is possible.

The most effective way to create safe, sustainable sets is to build well-being into the production process rather than reacting when things go wrong. Here are some ways to start:

Mental Health Resources : Productions can establish dedicated well-being roles with trained professionals embedded on a project to support crew and proactively address mental health, burnout, and interpersonal challenges before they escalate.

: Reporting Mechanisms : Only 7 percent of industry workers feel safe reporting concerns without fear of retaliation. Anonymous reporting channels allow workers to speak up without risking their jobs.

: Industry-Wide Standards : Creating safer productions requires a unified approach. Producers, executives, and department heads need to align on best practices and define the roles that will make safety and well-being a priority across every set.

:

You may be asking, “How can we do more when budgets and timelines are already stretched to the limit?” Because the best work doesn’t come from exhaustion and fear. It comes from safe, creative environments where people feel free to bring their best ideas to the table.

When people experience a culture of trust at work, they report a 76 percent increase in engagement and a 50 percent boost in productivity. A study by Google found that high psychological safety in teams leads to 31 percent more innovation. Prioritizing safety doesn’t just protect people, it elevates the work itself.

Rachel Mason, director of “Last Take: Rust and the Story of Halyna,” has said, “Every single thing had to happen the way it did in order to have this outcome.” But what if the outcome had been different? What if the bullet had missed? Would anyone other than the crew have ever known about the poor working conditions on Rust? How many other productions have come close to tragedy without the public ever hearing about it?

This is about more than one feature film — it’s about the culture of production. A producer’s success can’t just be measured in accolades and bottom lines. It must also include the well-being of the people who bring these stories to life. If the cost of a project is that people get hurt, can it ever really be a success?

A true culture shift will require action from those in power who set the tone for how productions operate. By committing to sets that center humanity, where people feel energized, valued, and fulfilled, we do more than improve our individual productions. We raise the standard for how great work gets made.

Additional Resources:

UK Film + TV Charity | Whole Picture Toolkit

Safe Sets Resources

IPC Best Practice Guidelines",indiewire
https://indiewire.com,‘Materialists’ Trailer: Dakota Johnson Is a Matchmaker Caught in a Love Triangle with Chris Evans and Pedro Pascal,https://www.indiewire.com/news/trailers/materialists-trailer-dakota-johnson-1235068420/,"Tue, 18 Mar 2025 13:00:00 GMT","Celine Song is looking to the future after her Oscar-nominated love triangle drama “Past Lives” — and this time, it’s about yet another romantic trio.

Song writes and directs A24 film “Materialists,” starring Dakota Johnson as an ambitious New York City matchmaker who finds herself torn between the perfect match and her imperfect ex. Chris Evans and Pedro Pascal co-star as the two vying for Johnson’s heart. And all that love was also part of the film’s production.

“I really loved it so much,” Johnson said during the “Happy Sad Confused” podcast about filming the feature. “It’s one of those special moments, and I think in my work, every moment I felt so inspired and so connected to both of those dudes [Evans and Pascal] and everyone on that set. It was a wonderful experience.”

She also told IndieWire that Song is a “masterful filmmaker” and she was “very grateful” to be cast in “Materialists.” Zoe Winters, Marin Ireland, Dasha Nekrasova, and Louisa Jacobson co-star. The trailer also includes an original song by Japanese Breakfast.

Christine Vachon’s Killers Films produces the feature along with David Hinojosa, Pamela Koffler, and Song. Killers Films produced Song’s “Past Lives.”

Song was recently part of the Sundance 2025 jury alongside Daniel Kaluuya and Elijah Wood, and was honored at the Opening Night Gala with Kristen Stewart and Christopher Nolan. Oscar-nominated Song also joined the Academy in 2024 along with Lily Gladstone, Sandra Hüller, and Justine Triet.

In addition to “Materialists,” Johnson, Evans, and Pascal all have a full slate of projects. Johnson will lead the open marriage comedy “Splitsville” with “Hit Man” breakout Adria Arjona and Michael Covino, who also writes and directs. The Neon film will also be released in 2025. Evans is starring as a cult leader in Ethan Coen’s “Honey Don’t!” alongside Aubrey Plaza and Margaret Qualley. And, of course, Pascal will be making his MCU debut as Mr. Fantastic in “Fantastic Four: First Steps.” The actor appears in “Freaky Tales” and “The Uninvited,” as well as returns for “The Last of Us” Season 2.

“Materialists” premieres in theaters June 13. Check out the trailer below.",indiewire
https://indiewire.com,Rachel Zegler Says White Studio Execs ‘Kept Calling to Ask If I Was’ Actually Latina During ‘West Side Story’ Casting: ‘Want Me to Bring My Abuelita In?’,https://variety.com/2025/film/news/rachel-zegler-white-studio-execs-west-side-story-casting-1236340299/,"Tue, 18 Mar 2025 17:48:39 GMT","Rachel Zegler said in an interview with Allure magazine that white studio executives repeatedly questioned her during the casting process for Steven Spielberg’s “West Side Story,” which served as her acting breakthrough in Hollywood. Spielberg cast Zegler as the musical’s female lead, María, and it was of utmost importance to him that the film’s Latina protagonist be played by a Latina actor.

“There’s confusion because I don’t have a single ounce of Latin in my name,” Zegler told the magazine. “When I was in the running for María in ‘West Side Story,’ they kept calling to ask if I was legit. I remember thinking, ‘Do you want me to bring my abuelita in?’ I will. I’ll bring her into the studio if you want to meet her.”

Zegler added, “Having a bunch of white executives have you prove your identity to them…It’s an interesting experience being part of that diaspora in the current climate we live in. But I love being Colombian.”

Popular on Variety

Spielberg’s “West Side Story” earned critical acclaim and scored Zegler a win at the Golden Globes for best actress in a musical or comedy film. Her career had effectively taken off, but “West Side Story” was far from release when the call came in for her to audition for the lead role in Disney’s live-action “Snow White” remake. Zegler had filmed “West Side Story” but it was months from opening and no footage of her as María was public yet. Spielberg personally advocated for her casting to “Snow White” director Marc Webb. Cut to years later and Zegler is now headlining the Disney remake, opening in theaters March 21.

“The reality is, I was given a chance because I could sing,” Zegler told Allure magazine about why she was cast as Snow White even if the Disney princess is not Latina in the original animated film. “My only prayer for the future of diversity and inclusion is that we invest in and nurture talent no matter what they look like.”

“That’s why it’s so important for the next generation to see movies like ‘Snow White,’” Zegler added about the film. “To realize there’s nothing wrong with choosing to do what’s right and that it doesn’t have to be with anger or a clenched fist. Anger can be a powerful emotion, but it doesn’t bring the brightest future. Snow White chooses kindness and still makes change. Power takes many forms. I hope we’ll see a new dawn of kindness and acceptance in the next couple of years. And people don’t see the need to use hate to cause further division.”

Head over to Allure magazine’s website to read Zegler’s cover story in its entirety.",indiewire
