Input URL,Title,Link,Published,Description,Source
https://news-medical.net,The Rise of Postbiotics for Gut Health,https://news-medical.net/health/The-Rise-of-Postbiotics-for-Gut-Health.aspx,"Mon, 17 Mar 2025 08:16:00 GMT","How postbiotics work

Potential health benefits

Comparison with probiotics and prebiotics

Future of postbiotics

Postbiotics, defined as bioactive compounds produced by beneficial microbes such as lactic acid bacteria during the fermentation of prebiotic substrates, have recently gained significant attention in health sciences. Unlike probiotics, which contain live microorganisms, postbiotics include non-living microbial cells, cellular structures, and metabolites such as bacteriocins, exopolysaccharides, and peptidoglycan.1

Postbiotics' rising popularity stems from notable advantages over probiotics, including enhanced stability, safety, and longer shelf life. These advantages reduce the risks associated with live microbial consumption, such as potential pathogen transmission and antimicrobial resistance. Increasing research highlights postbiotics' beneficial mechanisms, primarily their ability to modulate protective actions against pathogens, fortify epithelial barriers, and regulate immune responses.

Due to these promising health effects, postbiotics are gaining traction across various sectors, especially in the food industry for bio-preservation and in the pharmaceutical and biomedical fields for treating gastrointestinal disorders and enhancing immune functions.

This growing interest aligns with the demand for safe and effective functional foods addressing sub-health conditions, promoting general well-being, and managing gastrointestinal issues such as diarrhea and bloating. As scientific understanding deepens, postbiotics stand poised to complement probiotics significantly, marking a transformative shift towards comprehensive, preventive healthcare strategies and innovative therapeutic applications.1

This article explores postbiotics, explaining what they are, how they differ from probiotics, and their potential benefits for gut health.

​​​​​​​Image Credit: ArtemisDiana/Shutterstock.com

How postbiotics work

Unlike probiotics, postbiotics do not contain live cells but consist of metabolites, including bacteriocins, short-chain fatty acids (SCFAs), and various organic acids. Their production involves controlled fermentation processes followed by techniques such as enzymatic hydrolysis, thermal treatment, and extraction, ensuring the isolation of the beneficial compounds while maintaining their biological efficacy.2,3

The primary mode of action of postbiotics involves modifying the gut environment, thereby enhancing the gut microbiota composition. They reduce intestinal pH, creating conditions that selectively favor beneficial microbes while suppressing pathogens such as Escherichia coli, Salmonella, and Clostridium perfringens.

Specifically, SCFAs produced as postbiotic metabolites act as energy substrates for intestinal cells, facilitating the growth of beneficial bacteria like Lactobacillus and Bifidobacterium. This results in improved intestinal barrier function, reduction in inflammation, and enhanced resistance to pathogenic colonization.2,3

In addition, postbiotics modulate the immune response by upregulating anti-inflammatory cytokines and downregulating pro-inflammatory signals. This balanced immune modulation reduces gut inflammation, enhancing overall gastrointestinal health and resilience.2

Research highlights postbiotics’ significant role in promoting growth performance, particularly in poultry. Dietary supplementation with postbiotics has been shown to improve nutrient absorption, optimize feed efficiency, and support better overall animal growth. For example, poultry-fed diets enriched with postbiotics demonstrate increased body weight gain, improved feed conversion rates, and healthier gut morphology compared to control groups.2,3

Moreover, postbiotics positively affect the quality of animal products. In poultry, the inclusion of postbiotics in diets leads to improvements in meat characteristics, including increased tenderness, reduced lipid peroxidation, enhanced color, and overall better sensory properties.2

Download your PDF copy now!

Potential health benefits

Postbiotics contain bioactive substances, including SCFAs, exopolysaccharides, bacteriocins, and various proteins. These compounds exhibit diverse functional properties that are beneficial for gut and overall health.

For instance, SCFAs such as acetate, propionate, and butyrate, produced from microbial fermentation, are notable for their capacity to strengthen the gut barrier by enhancing the integrity of tight junction proteins, thus preventing pathogen invasion and systemic inflammation.4

The anti-inflammatory properties of postbiotics significantly contribute to their health benefits. Studies have shown that these metabolites can modulate inflammatory responses by inhibiting pro-inflammatory cytokines like tumor necrosis factor-alpha (TNF-α) and interleukin-6 (IL-6).

For example, specific proteins derived from Lactobacillus species, such as surface-layer proteins (SLPs), demonstrated anti-inflammatory effects by reducing Nuclear Factor kappa-light-chain-enhancer of activated B (NF-κB) activation, a key pathway in inflammation.4

Postbiotics further support immune functions by influencing mucosal immunity. They promote the growth of beneficial gut microbiota, directly compete with pathogenic bacteria for adhesion sites, and enhance mucosal defense mechanisms through antimicrobial peptides. Research has shown that postbiotic administration increases beneficial microbes like Bifidobacteria while decreasing harmful pathogens such as Escherichia coli.4

Emerging evidence also suggests postbiotics can aid metabolic regulation, demonstrating potential anti-obesity and glucose homeostasis effects. Their stability, safety profile, and efficacy make them an attractive alternative or complement to probiotics, especially in immunocompromised individuals.

While extensive research continues to expand understanding of the mechanisms and specific health outcomes associated with postbiotics, current findings underscore their potential in clinical nutrition and therapy.4

Prebiotics and Probiotics: What’s the Difference?

Comparison with probiotics and prebiotics

Probiotics, prebiotics, and postbiotics are integral elements in gut microbiome management, each playing a unique yet interconnected role. Probiotics are live beneficial microorganisms, like Lactobacillus and Bifidobacterium, directly impacting gut microbial composition and health. Prebiotics, such as inulin and fructooligosaccharides (FOS), act as food for these beneficial bacteria, enhancing their proliferation and activity.5

Postbiotics, the latest addition to microbiome-focused interventions, represent non-living microbial cells or bioactive substances produced by probiotics during fermentation. Unlike probiotics, postbiotics are stable and less susceptible to environmental stressors such as heat or stomach acids, making them particularly advantageous in formulation and shelf stability.

They offer benefits like modulating immune responses, enhancing gut barrier integrity, and exerting anti-inflammatory effects without the risks associated with administering live microorganisms, especially in immunocompromised individuals.5

Several postbiotic products have entered the market, including heat-killed Lactobacillus plantarum preparations used to manage gastrointestinal discomfort and fermented formulas containing SCFAs to support gut health.5

However, postbiotic commercialization faces regulatory hurdles, primarily due to inconsistent definitions and the complex classification between dietary supplements and medicinal products. Regulatory bodies differ internationally, complicating standardized approvals.5

Integrating postbiotics into the broader microbiome conversation requires clearer regulatory frameworks and robust clinical evidence. Their continued development alongside probiotics and prebiotics promises to enrich microbiome management, offering safer and potentially more effective solutions for maintaining gut and overall health.5

Breaking down prebiotics, probiotics and postbiotics Play

Future of postbiotics

Emerging research indicates postbiotics offer superior stability, safety, and cost-effectiveness compared to traditional probiotics. Unlike probiotics, postbiotics withstand harsh gastrointestinal conditions, have extended shelf-life, and eliminate risks associated with live bacterial strains.5,6

Current market products include pasteurized Akkermansia muciniphila, utilized for obesity and insulin resistance management, and heat-inactivated Bifidobacterium bifidum (e.g., MIMBb75), effective against Irritable Bowel Syndrome (IBS). Additionally, bacterial lysate OM-85 (Broncho-Vaxom) is commercially available for respiratory immune support.6

Clinical trials and pre-clinical studies underline diverse medical applications. For instance, postbiotics like SCFAs, especially butyrate, demonstrate anti-inflammatory and immunomodulatory effects beneficial in conditions like rheumatoid arthritis, inflammatory bowel disease, and metabolic disorders.

In food industries, postbiotic applications include functional food ingredients enhancing nutritional profiles and shelf-life stability.6

Despite promising advances, regulatory challenges persist. Clear guidelines distinguishing postbiotics from probiotics remain underdeveloped, complicating product standardization, labeling, and market authorization. Current regulations primarily address viable probiotics, necessitating updated frameworks explicitly tailored for postbiotic substances.6

Ongoing clinical studies continue to evaluate the efficacy, safety profiles, and mechanistic actions of various postbiotic compounds, promising deeper insights and validation of therapeutic claims. Addressing existing knowledge gaps through rigorous clinical research will be crucial for the successful integration and acceptance of postbiotics within mainstream medicine and the food industry.

Dairy and Gut Health: The Good, the Bad, and the Controversial

References",news-medical
https://news-medical.net,The Role of Fiber in Preventing Chronic Disease,https://news-medical.net/health/The-Role-of-Fiber-in-Preventing-Chronic-Disease.aspx,"Mon, 17 Mar 2025 05:33:00 GMT","What is dietary fiber?

Mechanisms of action

Fiber and disease prevention

Sources of fiber

Industrial processing and fiber loss

Key takeaways

Chronic diseases such as heart disease, diabetes, and cancer claim millions of lives each year — but what if the solution to reducing these risks was as simple as adding more fiber to your diet? Despite being one of the most powerful tools for disease prevention, fiber remains the most overlooked nutrient in modern diets.

This article examines the role of dietary fiber in lowering the risk of chronic diseases. It explores the current knowledge on the best sources of dietary fiber and how to incorporate more fiber into the daily diet.

​​​​​​​Image Credit: Yulia Furman/Shutterstock.com

What is dietary fiber?

Dietary fiber is a crucial component of a healthy diet, known for its role in promoting digestive health and preventing chronic diseases. Fiber is categorized into two main types: soluble fiber, which dissolves in water and forms a gel-like substance, and insoluble fiber, which adds bulk to stool and facilitates bowel movements.1

Both types contribute to overall health, influencing digestion, modulating gut bacteria and metabolism, and controlling systemic inflammation.

Despite the well-documented health benefits of dietary fiber, many individuals fail to meet the recommended daily intake. This deficiency has significant public health implications, as low fiber consumption is linked to increased risks of metabolic disorders, gastrointestinal diseases, kidney disease, cancer, and cardiovascular conditions.2–4

Therefore, understanding the mechanisms by which fiber exerts its protective effects is essential for developing dietary guidelines and intervention strategies to reduce the burden of chronic disease.

Additionally, cultural and socioeconomic factors also influence fiber consumption, highlighting the need for targeted dietary interventions and public health policies to bridge the gap in fiber intake across populations.

Why More Young Adults Are Getting Colorectal Cancer

Mechanisms of action

Fiber exerts its health benefits through multiple physiological mechanisms, such as gastrointestinal function, metabolic regulation, and modulation of inflammation. Fiber enhances bowel motility, prevents constipation, and supports gut microbiota diversity, which plays a role in immune regulation and metabolic health.5

The fermentation of dietary fiber by gut microbiota also produces metabolites such as short-chain fatty acids (SCFAs), which strengthen the gut barrier and reduce systemic inflammation.2,6

Additionally, fiber improves stool consistency and water retention, promoting regular bowel movements and reducing the risk of conditions such as diverticulosis and irritable bowel syndrome.1

Soluble fiber also regulates the metabolism by slowing gastric emptying, leading to improved glycemic control and lipid metabolism. This helps prevent insulin resistance and type 2 diabetes.4,6

Moreover, fiber aids in weight management by promoting satiety and reducing overall caloric intake, further reducing the risk of obesity-related diseases. Dietary fiber also modulates gut hormone secretion, influencing appetite regulation and energy balance, which are critical for long-term metabolic health.2

The SCFAs, such as butyrate, produced during the fermentation of fibers also have anti-inflammatory effects and contribute to gut integrity. These fatty acids regulate immune function, modulating cytokine production and reducing markers of systemic inflammation.5

This process plays a crucial role in preventing chronic inflammatory conditions, including autoimmune diseases, non-alcoholic fatty liver disease, and neurodegenerative disorders.

Mayo Clinic Minute: How dietary fiber makes you healthier Play

Fiber and disease prevention

Cardiovascular disease

Numerous meta-analyses have established that fiber intake is inversely associated with cardiovascular disease (CVD) risk. Higher dietary fiber consumption is linked to lower total cholesterol and low-density lipoprotein (LDL) levels, improved blood pressure regulation, and reduced inflammation.2,3

One study also found that every 7 g/day increase in dietary fiber correlates with a 9% reduction in CVD risk.1 In addition, fiber reduces the risk of atherosclerosis by binding to bile acids, which facilitates their excretion and lowers cholesterol levels.2

Whole grains, in particular, contain high levels of beta-glucans, which have been shown to reduce blood pressure and improve endothelial function. High-fiber diets are also associated with improved arterial elasticity, which contributes to better circulation and reduced cardiovascular strain.7

Fiber intake has also been associated with lower C-reactive protein (CRP) levels, a key marker of systemic inflammation that plays a role in cardiovascular disease progression.5

Type 2 diabetes

Dietary fiber also improves insulin sensitivity and glycemic control by modulating digestion and glucose absorption. Epidemiological studies suggest that individuals with the highest fiber intake have a 20–30% reduced risk of developing type 2 diabetes.4,6 Cereal fibers, in particular, have shown significant protective effects.5

Additionally, soluble fiber slows carbohydrate absorption, reducing postprandial glucose spikes. This stabilizes blood sugar levels and lowers the demand for insulin, decreasing the likelihood of insulin resistance. Fiber also promotes a more diverse gut microbiota, which has been linked to improved metabolic health.8

High-fiber diets reduce systemic inflammation, a major factor in the pathogenesis of type 2 diabetes.

Furthermore, fiber enhances the production of gut-derived hormones such as glucagon-like peptide-1 (GLP-1), which plays a role in glucose metabolism and appetite regulation.4,5

Colorectal cancer

The consumption of dietary fiber, especially from whole grains, is strongly associated with a reduced risk of colorectal cancer.

Fiber enhances stool bulk and reduces gut transit time, minimizing exposure of colonic cells to carcinogens. Additionally, the fermentation of fiber generates SCFAs, which support colonic health and exhibit anti-cancer properties.1,7

Studies suggest that fiber alters the gut microbiota composition in a way that reduces the production of harmful metabolites and enhances detoxification pathways. Certain types of fiber, such as resistant starch, have been shown to increase the production of butyrate, which has protective effects on colonic epithelial cells and may prevent tumor formation.2

Furthermore, fiber intake is associated with a reduction in pro-inflammatory cytokines that contribute to cancer progression.1

Download your PDF copy now!

Sources of fiber

Research suggests that optimal fiber intake is best achieved through whole foods rather than supplements. Key dietary sources include whole grains such as brown rice, oats, and whole wheat bread, as well as legumes like lentils, chickpeas, and black beans.

Fruits and vegetables, especially broccoli, carrots, and leafy greens, as well as nuts and seeds like chia seeds, flaxseeds, and almonds, are also excellent sources of dietary fiber.7

Current dietary guidelines recommend fiber intakes of 25 g per day for women and 38g per day for men, yet most individuals consume significantly less.2 However, increasing fiber intake requires dietary changes, such as replacing refined grains with whole grains, consuming more plant-based foods, and choosing fiber-rich snacks.

Additionally, dietary education programs can help individuals better understand fiber sources and implement gradual changes to improve long-term adherence.

Industrial processing and fiber loss

Unfortunately, modern food processing significantly reduces fiber content in many staple foods. Refining grains removes the bran and germ, stripping away essential fiber and nutrients.

Processed foods often lack the fermentable fibers necessary for gut health.8 Encouraging whole-food consumption over refined options is essential for maximizing fiber intake.

Fiber-rich foods also undergo chemical and thermal processing that can alter their structure, reducing their fermentability and bioavailability.

The widespread consumption of processed and ultra-processed foods contributes significantly to the global fiber deficit. Implementing policies that promote whole grain consumption and educate consumers about fiber-rich diets can help counteract these effects.

Furthermore, reformulating processed foods to include functional fiber additives, such as inulin and resistant starch, could be an additional strategy to improve fiber intake in modern diets.

Key takeaways

Dietary fiber is a key factor in preventing chronic diseases, including cardiovascular disease, type 2 diabetes, and colorectal cancer. However, despite the clear health benefits, fiber intake remains insufficient in many populations.

Given its numerous health benefits, policymakers and healthcare professionals should advocate for fiber-rich diets as part of chronic disease prevention strategies.

Greater awareness and improved dietary habits can also significantly reduce the burden of preventable diseases and improve overall public health.

Moreover, future research should also focus on personalized nutrition strategies to optimize fiber intake based on individual health needs and genetic predispositions.

References

Gill, S. K., Rossi, M., Bajka, B., & Whelan, K. (2021). Dietary fibre in gastrointestinal health and disease. Nature Reviews. Gastroenterology & Hepatology, 18(2), 101–116. https://doi.org/10.1038/s41575-020-00375-4 Timm, D. A., & Slavin, J. L. (2008). Dietary Fiber and the Relationship to Chronic Diseases. American Journal of Lifestyle Medicine, 2(3), 233–240. https://doi.org/10.1177/1559827608314149 McRae M. P. (2017). Dietary Fiber Is Beneficial for the Prevention of Cardiovascular Disease: An Umbrella Review of Meta-analyses. Journal of Chiropractic Medicine, 16(4), 289–299. https://doi.org/10.1016/j.jcm.2017.05.005 McRae M. P. (2018). Dietary Fiber Intake and Type 2 Diabetes Mellitus: An Umbrella Review of Meta-analyses. Journal of Chiropractic Medicine, 17(1), 44–53. https://doi.org/10.1016/j.jcm.2017.11.002 Ma, W., Nguyen, L. H., Song, M., Wang, D. D., Franzosa, E. A., Cao, Y., Joshi, A., et al. (2021). Dietary fiber intake, the gut microbiome, and chronic systemic inflammation in a cohort of adult men. Genome Medicine, 13(1), 102. https://doi.org/10.1186/s13073-021-00921-y Weickert, M. O., & Pfeiffer, A. F. H. (2018). Impact of Dietary Fiber Consumption on Insulin Resistance and the Prevention of Type 2 Diabetes. The Journal of Nutrition, 148(1), 7–12. https://doi.org/10.1093/jn/nxx00 Mayo Clinic. (2022, December 10). Whole grains: Hearty options for a healthy diet. Available at https://www.mayoclinic.org/healthy-lifestyle/nutrition-and-healthy-eating/in-depth/whole-grains/art-20047826 [Accessed on March 13, 2025] Capuano E. (2017). The behavior of dietary fiber in the gastrointestinal tract determines its physiological effect. Critical Reviews in Food Science and Nutrition, 57(16), 3543–3564. https://doi.org/10.1080/10408398.2016.1180501

Further Reading",news-medical
