Input URL,Title,Link,Published,Description,Source
https://news-medical.net,Frequently asked questions about BioAFM,https://www.news-medical.net/news/20250317/Frequently-asked-questions-about-BioAFM.aspx,"Mon, 17 Mar 2025 00:00:00 GMT","BioAFM is seeing increasingly widespread use in biomedical and biological studies due to its extremely high resolution and its capacity to perform experiments with live cells in liquid and under physiologically relevant and ambient conditions.

BioAFM also offers nanometer-resolution surface mapping suitable for an array of electrical and mechanical properties, including stiffness, elasticity, conductivity, and surface potential.

Bruker BioAFM technology empowers life science researchers to explore how these properties influence key cellular functions, including communication, signaling, cell division, differentiation, tumor metastasis, and infection.



Image Credit: Sanjaya Viraj Bandara/Shutterstock.com

What is a BioAFM?

A BioAFM is a specialized atomic force microscope designed for studying soft matter and biological samples. These instruments are ideal for measuring fragile, soft, and complex samples under near-physiological conditions.

BioAFMs enable the analysis of single molecules, bacteria, living cells, nucleic acids, and tissues without compromising their structural integrity. Their versatility allows for non-invasive measurements of biological samples, including label-free imaging in liquid environments, making them a powerful tool for life science research.

How are BioAFMs adapted for use in biological studies?

BioAFMs feature specialized stages, sample and cantilever holders, and measurement modes, all of which have been specifically designed to accommodate life science samples and experiments.

Another unique feature of Bruker BioAFM instruments is their capacity to be configured with a wide range of optional accessories and advanced modes, expanding measurement capabilities and sample compatibility to accommodate even the most challenging biological and soft matter samples.

Distinct capabilities and features of Bruker BioAFM instruments include:

High-speed AFM capabilities of up to 50 frames per second facilitate the accurate visualization of molecular dynamics.

Damage of delicate biological samples is prevented thanks to precise force control.

Fully integrated correlated analysis is made possible via a comprehensive range of advanced optical techniques.

Specific data analysis methods are available for soft samples, including contact point imaging.

A large z range (>100 µm) enables cell adhesion experiments and the measurement of challenging biological samples featuring steep, highly corrugated surfaces.

Advanced automation features facilitate self-regulating measurement routines designed to maximize throughput and improve accuracy. These features include automated detector alignment, experimental workflow creation, and scanning parameter adjustment.

An Optical Tiling software feature is available for navigating around large samples.

Cantilever holders can be cleaned and autoclaved, allowing direct access to biohazards in biosafety laboratories while also enabling sample preparation, loading, experiments, and disposal steps to be performed within the BSL facility.

Various accessories can be used to investigate a wide range of biological and soft matter samples on different-sized substrates, shapes, and materials (for example, coverslips, Petri dishes, or biochips) and under different environmental conditions (for example, temperature, atmosphere, gas, or pH value).

The automated, large area, multiparametric characterization of densely packed cell layers and highly corrugated tissue samples can be achieved without the need for microtome cutting.

What are the benefits of using a BioAFM?

Atomic force microscopy delivers three-dimensional images of surface features and topography, and BioAFMs extend, enhance, and optimize this technique to accommodate the specific needs and challenges of biological research.

BioAFM offers a number of distinct advantages over other methods. These include:

The high spatiotemporal resolution allows users to investigate the morphology and surface structure at the sub-molecular resolution, highlighting interactions in the piconewton range.

Samples can be studied in liquid and under near-physiological conditions. These capabilities are unique to atomic force microscopy and are ideal for the investigation of living cells in a medium.

BioAFM’s capacity for the label-free and non-invasive investigation of living cells is ideally suited to use with delicate biological samples.

BioAFM can be used in conjunction with other advanced optical microscopy techniques, offering correlated measurements and complementary datasets that offer researchers a more comprehensive insight into complex biological processes.

What are the benefits of automated BioAFM measurements?

Bruker’s range of BioAFM instruments boasts specialized software functions and capabilities designed to support the high-performance AFM-based investigation of soft matter and biological samples.

Automated instrument procedures are available, including alignment, operation, and calibration, while automated measurement routines and advanced data analysis capabilities enable the straightforward and streamlined experimental setup and running while improving results’ accuracy and reproducibility.

Advanced automation features include:

Bruker BioAFM instruments incorporate advanced automation and remote control features to streamline complex experiments and enhance research efficiency:

ExperimentPlanner enables users to predefine settings and parameters, allowing for the automated execution of intricate experiments.

ExperimentControl, a browser-based tool, supports remote monitoring of long-term lab experiments from any device. When used alongside ExperimentPlanner, these tools enable self-regulating, long-term experiments that mimic real-life conditions. Researchers can oversee and control their studies remotely, reducing the need for hands-on involvement in lengthy, repetitive procedures.

SmartMapping provides the flexibility to define multiple two-dimensional force maps and preselect regions of interest (ROI) for automated examination. This feature facilitates the systematic study of large sample areas with precision.

Automated large-area, multi-region imaging is achieved through the integration of DirectTiling, DirectOverlay 2, and MultiScan software, extending the optical viewing field. Their seamless optical integration ensures an accurate correlation between AFM and optical data.

Leveraging these advanced features enhances and expands the capabilities of Bruker BioAFM systems to:

Increase productivity and throughput

Generate statistically relevant datasets

Highlight parameter correlation and cross-correlation by automated cycling through relevant parameters

Enable long-term, unattended, self-regulating experiment series

Allow the remote monitoring of long-term lab experiments

These types of automated features enable enhanced throughput, standardized batch analysis routines, and statistically relevant datasets—essential considerations in biological research, especially for researchers working in the nanomedical and clinical fields.

Why is it advisable to integrate a BioAFM with an optical/fluorescence microscope?

A significant benefit of Bruker’s BioAFM instrumentation is its ability to be easily combined with advanced optical microscopy techniques such as STED or fluorescence microscopy, enabling complementary datasets and correlated measurements.

Integrating Bruker’s BioAFMs with advanced optical imaging techniques is seamless, thanks to a specialized AFM stage designed for compatibility with most commercially available inverted and confocal optical microscopes.

The AFM head is positioned on the stage, and software such as Bruker’s DirectOverlay feature is then used to colocalize optical and AFM images. This allows for a direct correlation of acquired AFM and optical data.

There is no need to transfer the sample between setups, and the system supports a wide range of camera and detector types.

Easy optical image import, advanced calibration algorithms, and visualization routines enable precise navigation across the sample, allowing for multidimensional characterization within a single experiment.

Compatible techniques include epifluorescence, confocal, phase contrast, and super-resolution microscopy methods such as STED, TIRF, and STORM.

The capacity to acquire real-time, correlative data sets is especially key to the field of life science research. This is because:

It empowers researchers to study biological samples’ topography using AFM while simultaneously observing fluorescently labeled cellular components.

It allows the multiparametric observation of in situ dynamics, including protein folding, receptor-ligand interactions, single-molecule protein dynamics, and mechanosensitive signaling pathways.

Correlative AFM and Advanced Optical Microscopy in Life Science Research eBook

What sample preparation is needed for using BioAFM?

BioAFM is a label-free technique that allows measurements in both air and liquid, making it ideal for studying live cells under near-physiological conditions. Unlike other imaging methods, it does not require a vacuum, nor does it necessitate freezing, drying, coating, or microtome sectioning of samples before measurement.

For optimal results, the sample must adhere to a suitable surface substrate, such as a Petri dish, coverslip, or mica.

When measuring in liquid, the sample should be immersed in an appropriate buffer solution. To ensure high-quality imaging, it is recommended to thoroughly clean the substrate beforehand to eliminate contaminants or artifacts that could interfere with measurements.

Acknowledgments

Produced from materials originally authored by Bruker Nano GmbH.

About Bruker BioAFM

Bruker BioAFM, former JPK Instruments AG, is a lead­ing man­u­fac­tur­er of nano-an­a­lyt­i­cal in­stru­ments - par­tic­u­lar­ly based on atom­ic force mi­cro­scope (AFM) and op­ti­cal tweez­ers sys­tems - for life sci­ences and soft mat­ter ap­pli­ca­tions.

We combine the highest technical skills with visionary applications. Our work applies nanotechnology in ways to provide solutions to challenges facing researchers in life sciences and soft matter today. Driven by inspiration and ambition, it is our conviction that only the best tools are good enough for the research of life. We are listening with the ear of a scientist in detail to the current challenges of our customers and find individual solutions for individual problems. This is how we understand our business.

Primary Activity

Material Manufacturer

Scanning Probe Technology for Soft Matter and Life Sciences",news-medical
https://news-medical.net,Researchers discover MAFB and CEBPA’s role in hypospadias pathogenesis,https://news-medical.net/news/20250317/Researchers-discover-MAFB-and-CEBPAe28099s-role-in-hypospadias-pathogenesis.aspx,"Mon, 17 Mar 2025 00:00:00 GMT","Hypospadias is characterized by an ectopic urethral opening and abnormal penile curvature, affecting approximately 1 in 200 live male births. While its origins are believed to stem from a combination of genetic and environmental factors, androgen signaling pathways are thought to play a significant role in the condition's development. Despite progress in identifying the genetic components, the precise molecular mechanisms remain poorly understood. Previous studies have suggested that the Wnt/β-catenin signaling pathway is involved in urethral development, but the specific contributions of transcription factors such as MAFB and CCAAT/enhancer-binding protein alpha (CEBPA) have yet to be fully explored. This gap in understanding highlights the need for in-depth research to elucidate the pathways involved in hypospadias.



On September 13, 2024, a study (DOI: 10.1016/j.gendis.2024.101432) published in Genes & Diseases and led by researchers from the Children's Hospital of Chongqing Medical University in China identified MAFB and CEBPA as crucial regulators of urothelial cell growth. By influencing cell proliferation and apoptosis through the Wnt/β-catenin signaling pathway, MAFB and CEBPA play a significant role in the genetic mechanisms of hypospadias. This research lays a strong foundation for future studies aimed at developing targeted therapies for this prevalent congenital condition.



The study focused on the roles of MAFB and CEBPA in urothelial cell growth, utilizing human foreskin samples and mouse models. The researchers found that expression levels of MAFB and CEBPA were significantly reduced in the foreskin tissues of hypospadias patients. Using RNA sequencing and Western blot analysis, they discovered that MAFB knockdown led to suppressed CEBPA protein expression, inhibiting the Wnt/β-catenin pathway and causing cell cycle arrest and increased apoptosis in urothelial cells. Furthermore, MAFB overexpression promoted cell proliferation and activated the Wnt/β-catenin pathway, while CEBPA knockdown reversed these effects. These findings highlight the pivotal role of the MAFB-CEBPA axis in regulating urothelial cell growth and suggest that disruptions in this pathway may contribute to hypospadias development. The study also pinpointed potential therapeutic targets for future interventions.

Our findings provide a deeper understanding of the molecular mechanisms underlying hypospadias. By identifying the roles of MAFB and CEBPA in urothelial growth, we have uncovered potential targets for therapeutic intervention, which could lead to improved outcomes for patients with this condition."" Dr. Xing Liu, corresponding author of the study

The discovery of the MAFB-CEBPA regulatory pathway holds immense potential for advancing the treatment and prevention of hypospadias. By targeting this pathway, researchers could develop novel therapies to correct or prevent the malformation during early development. Additionally, the study opens exciting new avenues for exploring the genetic and molecular underpinnings of other congenital disorders related to urethral development. Future research may focus on identifying additional genetic factors and environmental influences that interact with the MAFB-CEBPA pathway, further advancing our understanding of hypospadias and related conditions.",news-medical
https://news-medical.net,Understanding how JAK inhibitors may increase blood clot risk,https://news-medical.net/news/20250317/Understanding-how-JAK-inhibitors-may-increase-blood-clot-risk.aspx,"Mon, 17 Mar 2025 00:00:00 GMT","Why do medications that are supposed to help patients with chronic inflammatory diseases sometimes lead to blood clots?

This is one of the questions that a team of researchers from Aarhus University has sought to answer in a study that has just been published in the journal Inflammopharmacology.

The study suggests that disturbances in the JAK-STAT signalling pathway, an important communication pathway in the body, may contribute to this side effect.

""In the study, we uncover the potential links between components of the JAK-STAK signalling pathway, blood markers in patients with blood clots, and the genetic factors that contribute to the risk of blood clots in patients. This helps improve our understanding of why we see an increased risk of blood clots when using JAK inhibitors,"" explains Stine Rabech Haysen, former medical student at the Department of Biomedicine at Aarhus University, who is the first author of the publication.

The potential of the study

In the study, researchers used publicly available data from a number of published studies about patients with blood clots and compared them with a healthy control group.

They found no direct genetic explanation, but they did find a statistically significant enrichment of genes that are subject to regulatory control of the JAK-STAT signalling pathway among genes whose expression is altered in patients with blood clots.

""Although we cannot draw definitive conclusions about the mechanistic link between the use of JAK inhibitors and the risk of blood clots, our study demonstrates the potential of using data mining to identify and shed light on possible mechanisms of drug side effects,"" says one of the study's senior authors, associate professor at the Department of Biomedicine Per Qvist.

What does this mean for patients?

Although JAK inhibitors rarely lead to blood clots, it's important to understand the mechanism behind them so that the risk can be reduced.

""For the average person, our study means that we're getting closer to understanding why some drugs can have dangerous side effects like blood clots. And going forward, our method could help identify and prevent serious side effects, potentially making drug treatment safer,"" explains the other senior author of the study, associate professor at the Department of Biomedicine Tue Wenzel Kragstrup.

The researchers will now test the method on other types of medication to see if it can be used to detect side effects more widely.",news-medical
https://news-medical.net,Study examines the mechanisms behind long-term consequences of childhood stress,https://news-medical.net/news/20250317/Study-examines-the-mechanisms-behind-long-term-consequences-of-childhood-stress.aspx,"Mon, 17 Mar 2025 00:00:00 GMT","Early-life adversity affects more than half of the world's children and is a significant risk factor for cognitive and mental health problems later in life. In an extensive and up-to-the-minute review of research in this domain, scholars from the University of California, Irvine illuminate the profound impacts of these adverse childhood experiences on brain development and introduce new paths for understanding and tackling them.

Their study, published in Neuron, examines the mechanisms behind the long-term consequences of childhood stress (adversity). Despite extensive research spanning over seven decades, the authors point out that significant questions remain unanswered. For example, how do adults – from parents to researchers – fully comprehend what is perceived as stressful by an infant or child? Such conceptual queries, as well as the use of cutting-edge research tools, can provide a road map, guiding experts toward developing innovative methods and providing solutions to this pressing mental health issue.

Our research suggests that the unpredictability of a child's early environment may be just as important as more traditionally recognized forms of adversity, such as abuse or neglect. Our review has important implications for how we approach early intervention and prevention strategies."" Dr. Tallie Z. Baram, lead author, Donald Bren Professor of Pediatrics and one of the world's leading researchers in this field

She and co-author Matthew Birnie, a UC Irvine postdoctoral scholar, identify several key areas for further investigation:

What does the developing brain perceive as stressful?

Which aspects of stress most significantly influence brain maturation?

Which developmental ages are most vulnerable to adversity?

What are the molecular mediators of stress effects on the brain?

How can transient stressful experiences lead to enduring dysfunction?

One notable discovery is a novel form of early-life stress: unpredictable sensory inputs from caregivers and the environment. This factor plays a substantial role in adverse neurodevelopmental outcomes, even after controlling for well-known adverse childhood experiences, which are collectively referred to as ACEs.

The review highlights the limitations of current ACE scoring systems in accurately predicting individual outcomes and underscores the complexity of early-life stress. Emerging factors, such as societal and anthropogenic characteristics like inequality and pollution, are gaining recognition as potential contributors.

Animal models have been instrumental in unraveling the mechanisms underlying brain development effects. Research has revealed that different types of stress can yield distinct outcomes, influenced by the nature and timing of stress, as well as species, strain and sex variations.

At the molecular level, early-life stress can substantially alter neuronal gene expression through epigenetic mechanisms. These changes may lead to long-term modifications in how the brain responds to subsequent experiences. At the circuit level, early stress can disrupt the maturation of brain networks by interfering with crucial developmental processes, including neuronal oscillations and synaptic pruning.

""We're gradually comprehending how early-life stress can 'reprogram' the brain at multiple levels, from individual molecules to entire neural circuits. This knowledge presents new avenues for targeted interventions,"" Baram said.

The review also identifies key molecular mediators of early-life stress effects, including glucocorticoids and neuropeptides like corticotropin-releasing hormones. Ongoing research is uncovering novel roles for these molecules in specific neural circuits affected by early stress.

In light of these findings, the researchers propose redefining early-life stress as ""early-life adversity"" to better encompass the diverse experiences that can impact brain development, even those not traditionally perceived as stressful.

""This review emphasizes the need for a more comprehensive understanding of early-life adversity,"" Baram said. ""By focusing on how the developing brain processes and responds to these experiences, we can develop more effective strategies to prevent and mitigate their long-term effects.""

The researchers suggest increased funding for and attention to this critical area of study, highlighting its potential to enhance mental health outcomes and reduce the societal burden of early-life adversity.

Baram is also the Danette Shepard Chair in Neurological Studies and director of UC Irvine's Conte Center, which is supported by a Silvio O. Conte Center grant from the National Institute of Mental Health. Conte Center grants are bestowed on the most promising multidisciplinary and often cross-species approaches to improving the diagnosis and treatment of mental health issues.

National Institutes of Health awards P50MH096889 and RO1 MH132680 as well as the Hewitt Foundation for Biomedical Research supported the work.",news-medical
