Input URL,Title,Link,Published,Description,Source
https://news-medical.net,IL-12 targeting could open pathways for new Alzheimer's treatments,https://news-medical.net/news/20250317/IL-12-targeting-could-open-pathways-for-new-Alzheimers-treatments.aspx,"Mon, 17 Mar 2025 00:00:00 GMT","Researchers from Charité – Universitätsmedizin Berlin and the Max Delbrück Center have detailed the precise mechanism through which the inflammatory signaling molecule IL-12 contributes to Alzheimer's disease. The study was published in in the journal ""Nature Aging.""

Microglia, the brain's immune cells, usually serve as diligent guardians. They eliminate intruders such as microbes and clear away cellular debris – including the plaques typical of Alzheimer's disease. However, as our brains age, microglia also change. While some continue to function effectively, others gradually lose their protective role and start secreting small amounts of inflammatory messengers.

One such messenger is interleukin-12 (IL-12). Through meticulous analyses, research teams led by Professor Frank Heppner, Director of the Department of Neuropathology at Charité – Universitätsmedizin Berlin, and Professor Nikolaus Rajewsky, Director of the Berlin Institute for Medical Systems Biology at the Max Delbrück Center (MDC-BIMSB), along with additional partners, have identified how IL-12 might trigger and accelerate Alzheimer's dementia. Their study, published in ""Nature Aging,"" could pave the way for new combination therapies.

For decades, Alzheimer's research focused almost exclusively on amyloid-beta and tau deposits, while inflammation was considered a side effect. Only recently have we begun to recognize that inflammatory processes may be a primary driver of disease progression."" Professor Frank Heppner, Director of the Department of Neuropathology at Charité – Universitätsmedizin Berlin

In 2012, Heppner's lab reported in Nature Medicine that blocking IL-12 and IL-23 significantly reduced Alzheimer's-related brain changes in mice. ""But we couldn't unravel the underlying mechanism with standard techniques,"" Heppner explains. He reasoned that single cell analyses might provide more decisive clues, so he asked Rajewsky to collaborate.

Sticky and tangled brain cells

Throughout life, cells refer to their genetic instructions to respond to external stimuli. Researchers use single-cell analyses to observe this process, reconstructing which genes are being read and translated into proteins in thousands of individual cells simultaneously. These analyses generate massive datasets, which can now be analyzed with the help of artificial intelligence and machine learning. However, a major challenge in using single cell sequencing technology is isolating individual cells from a tissue sample without damaging them or causing unintended changes. ""In aging mouse brains – especially those with Alzheimer's plaques – cells are so stuck together and tangled that separating them cleanly is nearly impossible,"" Rajewsky explains.

His team spent several years perfecting a workaround. Instead of isolating entire cells, they extract cell nuclei from brain tissue and analyze the RNA present in each cell. By cross-referencing with publicly available data, such as the Allen Brain Atlas, they can ensure that their method provides a representative snapshot of all cell populations. For the present study, they sequenced RNA from over 80,000 cell nuclei and developed specialized workflows to process the data. They also reconstructed communication between cells. ""Our teams repeatedly sat together to try to interpret this highly complex data,"" Rajewsky says. ""This painstaking early optimization was crucial – without it, we would not have been able to detect these connections.""

How IL-12 damages the Alzheimer's brain

IL-12, previously known primarily for its role in autoimmune diseases like Crohn's disease and rheumatoid arthritis, appears to play a pivotal role in Alzheimer's progression. It damages two key brain cell types: mature oligodendrocytes, which normally produce myelin ­– the fatty insulating layer around nerve fibers essential for rapid signal transmission; and interneurons, which are particularly important for cognition and memory. IL-12 binding to interneurons causes them to die. A vicious circle begins: As more microglia produce IL-12, more brain cells sustain damage. Meanwhile, remaining functional microglia become overburdened by the task of clearing the additional cellular debris, and thus fail to remove Alzheimer's plaques.

To verify this mechanism, researchers tested it in mice and in human tissue. When Heppner's team blocked IL-12 in cell cultures and mouse models, they could stem disease-related changes. Electron micrographs of mouse brain tissue taken at the Max Planck Institute for Multidisciplinary Sciences in Göttingen also showed how myelin structure and nerve fiber density changed depending on whether the IL-12 signaling pathway was present or absent. Mass spectrometric analyses (lipidomics) at the University of Zurich confirmed the altered composition of the fat-rich insulating layer. Study of autopsy tissue from Alzheimer's patients provided further confirmation of the results – the more advanced the disease, the more IL-12 was present in the tissue. Cell cultures with human oligodendrocytes were also extremely sensitive to IL-12.

Potential combination therapy

""We now have a highly detailed picture of this mechanism, with single-cell technologies serving as a crucial catalyst. The only remaining question is which cell type IL-12 impacts first – oligodendrocytes, interneurons, or both simultaneously,"" says Heppner, who is also Group Leader in Neuroimmunology at the Deutschen Zentrums für Neurodegenerative Erkrankungen (DZNE).

The study has immediate implications as there are already drugs on the market that block IL-12. The researchers hope that clinicians will build on their findings and initiate clinical trials. ""If these drugs prove effective, they would be a new arrow in the quiver. Alzheimer's doesn't just have one cause. One axis of the disease is also controlled by the immune system, at least in some patients. Slowing neurodegeneration will require combination therapy,"" Heppner emphasizes. Such an approach could start early in the disease process, as IL-12 can be measured in blood or cerebrospinal fluid, he adds.

Meanwhile, the teams at Charité and the Max Delbrück Center are exploring a new hypothesis: Could microplastic in the brain drive microglia to produce IL-12? ""Microglia may struggle to process microplastic, triggering inflammatory reactions,"" Rajewsky suggests. ""This could reveal a link between environmental factors and widespread diseases."" While unproven, both teams consider it a compelling and important research direction.",news-medical
https://news-medical.net,Researchers move closer to a functional cure for chronic hepatitis B,https://news-medical.net/news/20250317/Researchers-move-closer-to-a-functional-cure-for-chronic-hepatitis-B.aspx,"Mon, 17 Mar 2025 00:00:00 GMT","Hepatitis B virus infection remains one of the leading causes of liver disease, including cirrhosis and hepatocellular carcinoma. Despite widespread vaccination and antiviral treatments, millions of people still suffer from chronic hepatitis B virus (HBV) infection. The primary challenge in curing the disease lies in the persistence of covalently closed circular DNA (cccDNA), a stable viral DNA form that resides in the nucleus of infected liver cells. Current therapies, such as nucleos(t)ide analogues and interferons, fail to eliminate cccDNA, allowing the virus to rebound after treatment is stopped. These challenges underscore the need for novel therapeutic strategies that specifically target cccDNA to achieve a functional cure.



In a review (DOI: 10.1016/j.gendis.2024.101215) published in Genes & Diseases on February 3, 2024, a team of researchers from Chongqing Medical University, in collaboration with other institutions, delves into the epigenetic regulation of HBV cccDNA. The study examines the molecular mechanisms governing cccDNA activity and explores potential therapeutic approaches to silence its transcription. By focusing on chromatin-modifying enzymes, viral proteins, and noncoding RNAs, the researchers hope to uncover new pathways for a functional cure for chronic hepatitis B.



The review highlights the complex biology of cccDNA, which forms minichromosomes in the infected liver cell nucleus. These minichromosomes bind with histone and nonhistone proteins, becoming transcriptionally active and sustaining viral replication. Key epigenetic mechanisms—such as DNA methylation, histone modifications, and the involvement of noncoding RNAs—regulate cccDNA activity. For example, DNA methylation suppresses viral transcription, while histone modifications like acetylation and succinylation can either activate or silence cccDNA transcription, providing potential targets for intervention.



One of the most compelling findings is the role of the HBV protein HBx in maintaining cccDNA transcriptional activity. HBx interacts with host factors to alter the epigenetic landscape of cccDNA, promoting an open chromatin state that facilitates viral gene expression. The study also explores emerging therapeutic strategies, including targeting HBx, utilizing epigenetic modifiers, and employing gene-editing technologies like CRISPR/Cas9 to disrupt cccDNA. These innovative approaches offer the potential to permanently silence cccDNA, paving the way for a functional cure.



Dr. Juan Chen, the corresponding author of the study, emphasized the importance of epigenetic regulation in controlling cccDNA.

Our findings underscore the critical role of epigenetic mechanisms in HBV pathogenesis. By targeting these pathways, we can develop therapies that not only suppress viral replication but also offer a functional cure for chronic hepatitis B."" Dr. Juan Chen, corresponding author of the study

The implications of this review are far-reaching for the future of HBV therapies. Epigenetic modifiers, such as histone deacetylase inhibitors and DNA methyltransferase inhibitors, could be repurposed or newly designed to specifically target cccDNA. Furthermore, CRISPR/Cas9 technology offers a precise method for disrupting cccDNA, potentially leading to a permanent cure. By combining these strategies with current antiviral treatments, researchers could significantly enhance their effectiveness, bringing us closer to a functional cure for chronic hepatitis B. This research not only advances our understanding of HBV biology but also sets the stage for the next generation of therapeutic innovations in the fight against viral hepatitis.",news-medical
https://news-medical.net,New research reveals potential path forward for glioblastoma treatment,https://news-medical.net/news/20250317/New-research-reveals-potential-path-forward-for-glioblastoma-treatment.aspx,"Mon, 17 Mar 2025 00:00:00 GMT","Glioblastoma has remained one of the toughest cancers to treat, resisting even the latest advances in immunotherapy. But new research from Sylvester Comprehensive Cancer Center, part of the University of Miami Miller School of Medicine, suggests a way forward: suppressing a protein called ZNF638 triggers an antiviral immune response, making immune checkpoint inhibitors more effective. The discovery not only offers a potential new treatment strategy but also identifies ZNF638 as a biomarker that could help personalize immunotherapy for patients. The findings appear in the March 17 issue of the Journal of Clinical Investigation.

Glioblastoma is the most common type of brain tumor in adults, with about 12,000 cases in the United States each year. Despite the disease's prevalence, outcomes for patients with glioblastoma have barely improved in the last 20 years. With a strongly immunosuppressive microenvironment, highly variable presentations between patients, and physically challenging surgical conditions, glioblastoma remains exceptionally difficult to treat.

Brain tumors are one of the most formidable foes in medicine. Our current treatment options are simply insufficient."" Ashish H. Shah, M.D., senior author of the study, neurosurgeon and researcher at Sylvester

Immune checkpoint inhibition has been successfully used to treat more than a dozen diverse cancers, but because brain cancers are in such a strongly immune-suppressive environment, the treatment has largely failed in the case-by-case attempts to date. ""For many other cancers, immunotherapies have completely changed the field, but for brain tumors, we haven't seen that same improvement,"" Shah said. ""At least, not yet.""

Learning what could make immune checkpoint therapies more effective - or effective at all - for glioblastoma patients is critical for understanding how to treat patients best. According to Shah's new study, viral mimicry may be the answer.

Viral mimicry

Viral mimicry, a tool at the leading edge of cancer treatment, may be the key path forward in making immune checkpoint inhibition effective for treating glioblastoma.

The goal of viral mimicry is to trick the body into thinking the tumor has a viral infection, prompting an immune response. Over millions of years, the human genome has collected fragments of viruses called human endogenous retroviruses. Most of the time, our body silences these retroviral genes through various mechanisms, particularly the HUSH protein complex. In viral mimicry, clinicians trigger the patient's body to ""un-silence"" these inactive viral fragments. These ancient fragments are not strong enough to cause a real viral infection, but they still trigger an anti-viral immune response. That antiviral response can make tumors more susceptible to immunotherapies.

""We're using evolution to attack tumors,"" Shah said. Viral mimicry was first successfully used to make ovarian cancer more susceptible to ICI in 2015. It has since been used in at least four other cancers, and it's a rapidly developing area of research. But it had not been successfully applied to brain tumors until Shah's new work.

Un-silencing ancient viruses

The question for Shah and his team, then, was how they could use viral mimicry to make immune checkpoint inhibitors work for glioblastoma. For that, they turned to ZNF638, a key regulator of the group of proteins that keep retroviruses silent. By suppressing ZNF638 in the tumor, they might create a viral mimicry response, opening the doors to immune checkpoint inhibitors effectively treating glioblastoma at last.

The researchers first searched cancer databases, documenting associations between ZNF638 and immune-related factors such as immune cell infiltration. They analyzed glioblastoma patients' genetic data and found that patients who were more responsive to immune checkpoint inhibitor therapy naturally had lower expressions of ZNF638 and higher survival rates. Cell-based experiments and single-cell RNA sequencing revealed that tumors with low ZNF638 tended to have more immune cell infiltration, and the monitoring system for retroviruses was active. This ZNF638-antiviral connection was seen in published patient data, too. It was possible that targeting ZNF638 could create ""viral mimicry"" conditions in tumors.

Armed with these results, the researchers tested the impacts of suppressing ZNF638 in preclinical tests, targeting it only in the tumor cells and leaving healthy brain tissue untouched. Combining ZNF638 targeting with immune checkpoint inhibitor therapy improved the treatment's efficacy: ZNF638 suppression had decreased tumor growth, increased T-cell lymphocyte infiltration and improved survival times.

""The most surprising findings were in the clinical data, where patients with low ZNF638 expression had improved responses to immunotherapy,"" said Jay Chandar, a fourth-year medical student in Shah's lab and study co-author. ""That strongly supported our whole idea that knocking down ZNF638 would make tumors more susceptible to immunotherapy.""

""With previous trials using ICI to treat glioblastoma having largely failed, it's exciting to find a novel therapeutic target and see that viral mimicry could help,"" said Deepa Seetharam, Ph.D., a postdoctoral scholar in the Department of Neurosurgery and study co-author. ""I'm optimistic this could improve prognoses for glioblastoma patients.""

The future of immunotherapy for glioblastoma

The promising results point to the potential for ZNF638 to be a biomarker, shaping personalized treatment plans. Immune checkpoint inhibitors are not currently approved for treating glioblastoma, so previous patients have been on a case-by-case basis, Shah said. Using ZNF638 as a biomarker could help change that by predicting which patients would likely be responsive to ICI therapy.

While a novel biomarker is the most immediate outcome, the long-term goal remains developing a brain-penetrating drug to target ZNF638 in glioblastoma, allowing ICI to be used effectively to treat more patients.

""Then we'll really be changing the game,"" Shah said. ""A synergistic treatment like that is the future of immunotherapy in treating glioblastoma.""",news-medical
https://news-medical.net,Psychological prehabilitation can significantly enhance recovery after surgery,https://news-medical.net/news/20250317/Psychological-prehabilitation-can-significantly-enhance-recovery-after-surgery.aspx,"Mon, 17 Mar 2025 00:00:00 GMT","A new analysis led by surgeons at UCLA Health finds that psychological prehabilitation can significantly enhance recovery after surgery. The research, led by Anne E. Hall in the lab of Dr. Justine Lee analyzed data from 20 randomized controlled trials (RCTs) conducted between 2004 and 2024, involving a total of 2,376 patients. It is published in the Annals of Surgery

What is psychological prehabilitation? Prehabilitation is a proactive approach aimed at improving surgical outcomes through preventive measures. Traditionally, it has focused on physical function and patient education. However, mental health has recently gained attention due to its crucial role in postoperative recovery, including reducing persistent opioid use.

Study methods The researchers conducted a systematic review, meta-analysis, and meta-regression of RCTs retrieved from databases such as MEDLINE, EMBASE, CENTRAL, and Google Scholar. They included studies with more than 50 adult surgical patients and evaluated the effects of different preoperative psychotherapy-based interventions, including cognitive behavioral therapy (CBT), supportive psychotherapy, and acceptance and commitment therapy (ACT), on postoperative outcomes.

Key findings The study found that psychological prehabilitation significantly reduces the length of hospital stay, pain, anxiety, and depression after surgery. Specifically, the analysis showed:

A reduction in length of hospital stay (LOS) by an average of 1.62 days;

A decrease in pain by an average of 3.52 points;

Lower anxiety levels regardless of which validated anxiety scale was used;

Reduced depression levels regardless of which validated depression scale was used.

Interestingly, the type of psychotherapy and the kind of surgery did not significantly affect the outcomes, except for anxiety.

Implications for healthcare The findings suggest that incorporating psychological prehabilitation into pre-surgery routines could lead to better overall recovery for patients. This approach may also help reduce healthcare costs associated with prolonged hospital stays and postoperative complications.

Future research The study highlights the need for further research to compare different types, durations, and delivery methods of psychotherapy to determine the most effective strategies for specific postoperative outcomes.",news-medical
