Input URL,Title,Link,Published,Description,Source
https://news.google.com/rss/search?q=healthcare+news,Digital therapeutics are the 'ultimate equalizer',https://www.healthcarefinancenews.com/video/digital-therapeutics-are-ultimate-equalizer,"Tue, 23 Jul 2024 10:12:43 GMT",Digital therapeutics are the 'ultimate equalizer',"{'href': 'https://www.healthcarefinancenews.com', 'title': 'Healthcare Finance News'}"
https://news.google.com/rss/search?q=healthcare+news,Lee Health: The Complex Care Center helps bridge healthcare gaps,https://www.naplesnews.com/story/news/local/communities/the-banner/2024/07/23/lee-health-the-complex-care-center-helps-bridge-healthcare-gaps/74469796007/,"Tue, 23 Jul 2024 09:14:18 GMT",Lee Health: The Complex Care Center helps bridge healthcare gaps,"{'href': 'https://www.naplesnews.com', 'title': 'Naples Daily News'}"
https://news.google.com/rss/search?q=healthcare+news,Is There An Opportunity With GE HealthCare Technologies Inc.'s (NASDAQ:GEHC) 50% Undervaluation?,https://finance.yahoo.com/news/opportunity-ge-healthcare-technologies-inc-120032588.html,"Tue, 23 Jul 2024 12:00:32 GMT",Is There An Opportunity With GE HealthCare Technologies Inc.'s (NASDAQ:GEHC) 50% Undervaluation?,"{'href': 'https://finance.yahoo.com', 'title': 'Yahoo Finance'}"
https://news.google.com/rss/search?q=healthcare+news,Blue Zones and Healthly Partner to Focus Healthcare on the Business of Reversing Disease,https://www.prnewswire.com/news-releases/blue-zones-and-healthly-partner-to-focus-healthcare-on-the-business-of-reversing-disease-302203260.html,"Tue, 23 Jul 2024 13:00:00 GMT",Blue Zones and Healthly Partner to Focus Healthcare on the Business of Reversing Disease,"{'href': 'https://www.prnewswire.com', 'title': 'PR Newswire'}"
https://news.google.com/rss/search?q=healthcare+news,"Zacks.com featured highlights include Amazon.com, Halozyme Therapeutics, Tenet Healthcare and Atmos Energy",https://finance.yahoo.com/news/zacks-com-featured-highlights-amazon-125400181.html,"Tue, 23 Jul 2024 12:54:00 GMT","Zacks.com featured highlights include Amazon.com, Halozyme Therapeutics, Tenet Healthcare and Atmos Energy","{'href': 'https://finance.yahoo.com', 'title': 'Yahoo Finance'}"
https://news.google.com/rss/search?q=healthcare+news,Steward Health Care report: No staff or supply shortages at Saint Anne's Hospital,https://www.heraldnews.com/story/news/2024/07/23/report-finds-fall-river-saint-annes-hospital-has-no-shortages-steward-health-care-bankruptcy/74511916007/,"Tue, 23 Jul 2024 15:48:38 GMT",Steward Health Care report: No staff or supply shortages at Saint Anne's Hospital,"{'href': 'https://www.heraldnews.com', 'title': 'Fall River Herald News'}"
https://news.google.com/rss/search?q=healthcare+news,"Volta Medical, GE HealthCare Team Up For AI-Powered Electrophysiology",https://www.mpo-mag.com/contents/view_breaking-news/2024-07-23/volta-medical-ge-healthcare-team-up-for-ai-powered-electrophysiology/,"Tue, 23 Jul 2024 14:53:27 GMT","Volta Medical, GE HealthCare Team Up For AI-Powered Electrophysiology","{'href': 'https://www.mpo-mag.com', 'title': 'MPO-mag'}"
https://news.google.com/rss/search?q=healthcare+news,AI adept at answering medical questions,https://healthcare-in-europe.com/en/news/ai-medical-decision-making-fail-explanation.html,"Tue, 23 Jul 2024 11:03:53 GMT",AI adept at answering medical questions – but fails to explain how,"{'href': 'https://healthcare-in-europe.com', 'title': 'healthcare-in-europe.com'}"
https://news.google.com/rss/search?q=healthcare+news,HCA Healthcare stock gains after Q2 beat (NYSE:HCA),https://seekingalpha.com/news/4126732-hca-healthcare-stock-gains-q2-beat,"Tue, 23 Jul 2024 12:50:45 GMT",HCA Healthcare stock gains after Q2 beat (NYSE:HCA),"{'href': 'https://seekingalpha.com', 'title': 'Seeking Alpha'}"
https://news.google.com/rss/search?q=healthcare+news,One company's efforts to expand digital health access,https://www.healthcareitnews.com/video/one-companys-efforts-expand-digital-health-access,"Tue, 23 Jul 2024 10:00:00 GMT",One company's efforts to expand digital health access,"{'href': 'https://www.healthcareitnews.com', 'title': 'Healthcare IT News'}"
https://news.google.com/rss/search?q=healthcare+news,ViiV Healthcare's new data shows promising maternal and pregnancy outcomes for Apretude use,https://www.outsourcing-pharma.com/Article/2024/07/23/viiv-healthcare-reports-positive-data-on-apretude-use-during-pregnancy,"Tue, 23 Jul 2024 11:08:00 GMT",ViiV Healthcare's new data shows promising maternal and pregnancy outcomes for Apretude use,"{'href': 'https://www.outsourcing-pharma.com', 'title': 'OutSourcing-Pharma.com'}"
https://news.google.com/rss/search?q=healthcare+news,"Mental-health care access can be a challenge in Eastern Kentucky; on top of that, the subject still carrie ...",https://lexingtonky.news/2024/07/23/mental-health-care-access-can-be-a-challenge-in-eastern-kentucky-on-top-of-that-the-subject-still-carries-stigma-for-some/,"Tue, 23 Jul 2024 16:04:47 GMT","Mental-health care access can be a challenge in Eastern Kentucky; on top of that, the subject still carrie ...","{'href': 'https://lexingtonky.news', 'title': 'The Lexington Times'}"
https://news.google.com/rss/search?q=healthcare+news,Raleigh senior living facility with high rating lures buyer,https://www.bizjournals.com/triangle/news/2024/07/23/senior-living-facility-raleigh-focus-healthcare.html,"Tue, 23 Jul 2024 11:30:00 GMT",Raleigh senior living facility with high rating lures buyer,"{'href': 'https://www.bizjournals.com', 'title': 'Triangle Business Journal'}"
https://news.google.com/rss/search?q=healthcare+news,Real Chemistry’s Latest IRIS Report Reveals Higher Costs to Consumers of GLP-1 Agonist Treatments Obtained in “Gray Market” Vs. Through Traditional Healthcare Providers,https://www.businesswire.com/news/home/20240723550871/en/Real-Chemistry%E2%80%99s-Latest-IRIS-Report-Reveals-Higher-Costs-to-Consumers-of-GLP-1-Agonist-Treatments-Obtained-in-%E2%80%9CGray-Market%E2%80%9D-Vs.-Through-Traditional-Healthcare-Providers,"Tue, 23 Jul 2024 13:40:00 GMT",Real Chemistry’s Latest IRIS Report Reveals Higher Costs to Consumers of GLP-1 Agonist Treatments Obtained in “Gray Market” Vs. Through Traditional Healthcare Providers,"{'href': 'https://www.businesswire.com', 'title': 'Business Wire'}"
https://news.google.com/rss/search?q=healthcare+news,National conference helping bring more Indigenous medical professionals into healthcare,https://www.cbc.ca/news/canada/sudbury/indigenous-healthcare-conference-1.7272475,"Tue, 23 Jul 2024 17:55:17 GMT",National conference helping bring more Indigenous medical professionals into healthcare,"{'href': 'https://www.cbc.ca', 'title': 'CBC.ca'}"
https://news.google.com/rss/search?q=healthcare+news,Study finds Ohio women’s health care system ‘worse than average’ compared to nation,https://www.news5cleveland.com/news/state/study-finds-ohio-womens-health-care-system-worse-than-average-compared-to-nation,"Tue, 23 Jul 2024 12:04:56 GMT",Study finds Ohio women’s health care system ‘worse than average’ compared to nation,"{'href': 'https://www.news5cleveland.com', 'title': 'News 5 Cleveland WEWS'}"
https://news.google.com/rss/search?q=healthcare+news,Canadian patients' needs are increasingly complex. Health care should reflect that: CMA,https://www.cbc.ca/news/health/cma-private-care-1.7271800,"Tue, 23 Jul 2024 15:07:27 GMT",Canadian patients' needs are increasingly complex. Health care should reflect that: CMA,"{'href': 'https://www.cbc.ca', 'title': 'CBC News'}"
https://news.google.com/rss/search?q=healthcare+news,Conflixis Releases 2024 Open Payments Report Shedding Light on Risk in Financial Relationships Across Healthcare,https://www.businesswire.com/news/home/20240719587265/en/Conflixis-Releases-2024-Open-Payments-Report-Shedding-Light-on-Risk-in-Financial-Relationships-Across-Healthcare,"Tue, 23 Jul 2024 14:00:00 GMT",Conflixis Releases 2024 Open Payments Report Shedding Light on Risk in Financial Relationships Across Healthcare,"{'href': 'https://www.businesswire.com', 'title': 'Business Wire'}"
https://news.google.com/rss/search?q=entertainment+news,Ryan Reynolds reveals name of 4th child with Blake Lively,https://hometownnewsnow.com/entertainment-news/8b2bb430a36bfc5670b51f5864b1468a,"Tue, 23 Jul 2024 16:12:22 GMT",Ryan Reynolds reveals name of 4th child with Blake Lively,"{'href': 'https://hometownnewsnow.com', 'title': 'Hometown News Now'}"
https://news.google.com/rss/search?q=entertainment+news,Calendar of Events,https://www.beverlyreview.net/news/entertainment_news/article_3e183e08-4915-11ef-92fd-0701e8436bb8.html,"Tue, 23 Jul 2024 17:01:00 GMT",Calendar of Events,"{'href': 'https://www.beverlyreview.net', 'title': 'The Beverly Review'}"
https://news.google.com/rss/search?q=entertainment+news,"Lady Gaga In Paris, Sparking Olympic Opening Ceremony Rumors",https://www.swiowanewssource.com/lifestyles/entertainment/video_ecc28190-41c2-5c0d-bea2-3499f3eb9801.html,"Tue, 23 Jul 2024 16:26:53 GMT","Lady Gaga In Paris, Sparking Olympic Opening Ceremony Rumors","{'href': 'https://www.swiowanewssource.com', 'title': 'The Audubon County Advocate Journal'}"
https://news.google.com/rss/search?q=entertainment+news,BBC issues public apology after Strictly Come Dancing row,https://www.wionews.com/entertainment/bbc-issues-public-apology-after-strictly-come-dancing-row-743547,"Tue, 23 Jul 2024 15:09:18 GMT",BBC issues public apology after Strictly Come Dancing row,"{'href': 'https://www.wionews.com', 'title': 'WION'}"
https://news.google.com/rss/search?q=entertainment+news,Sam Smith Was Unable To Walk After Skiing Accident.,https://www.reformer.com/arts_and_culture/entertainment/sam-smith-was-unable-to-walk-after-skiing-accident/video_4d72df7e-bbfa-5f89-ba5a-6e457ff12afe.html,"Tue, 23 Jul 2024 15:03:42 GMT",Sam Smith Was Unable To Walk After Skiing Accident.,"{'href': 'https://www.reformer.com', 'title': 'Brattleboro Reformer'}"
https://news.google.com/rss/search?q=entertainment+news,Final surviving member of Four Tops dead aged 88,https://www.castanetkamloops.net/edition/news-story-498282-8-.htm,"Tue, 23 Jul 2024 18:24:49 GMT",Final surviving member of Four Tops dead aged 88,"{'href': 'https://www.castanetkamloops.net', 'title': 'Castanet Kamloops'}"
https://news.google.com/rss/search?q=entertainment+news,"'Joker' sequel, Pitt and Clooney's 'Wolfs', and more heading to Venice Film Fest",https://hometownnewsnow.com/entertainment-news/552c2f0bdd28e57f8c357aecf2ff1d8e,"Tue, 23 Jul 2024 15:02:17 GMT","'Joker' sequel, Pitt and Clooney's 'Wolfs', and more heading to Venice Film Fest","{'href': 'https://hometownnewsnow.com', 'title': 'Hometown News Now'}"
https://news.google.com/rss/search?q=entertainment+news,Gaelic Park earns grant to help Irish Fest activities,https://www.beverlyreview.net/news/entertainment_news/article_0693d76c-4915-11ef-b5eb-1f7761abf196.html,"Tue, 23 Jul 2024 17:00:00 GMT",Gaelic Park earns grant to help Irish Fest activities,"{'href': 'https://www.beverlyreview.net', 'title': 'The Beverly Review'}"
https://news.google.com/rss/search?q=entertainment+news,Chris Brown Sued For $50 Million Over Concertgoer Assault,https://www.wfmz.com/entertainment/chris-brown-sued-for-50-million-over-concertgoer-assault/video_2c44755a-50c2-506f-a9ba-bc75f62cd795.html,"Tue, 23 Jul 2024 09:56:26 GMT",Chris Brown Sued For $50 Million Over Concertgoer Assault,"{'href': 'https://www.wfmz.com', 'title': '69News WFMZ-TV'}"
https://news.google.com/rss/search?q=entertainment+news,"In Brief: Sharon Stone breaking bad in 'Nobody' sequel, and more",https://hometownnewsnow.com/entertainment-news/588fcf6ff9714ece3a1302885c02fe06,"Tue, 23 Jul 2024 12:41:41 GMT","In Brief: Sharon Stone breaking bad in 'Nobody' sequel, and more","{'href': 'https://hometownnewsnow.com', 'title': 'Hometown News Now'}"
https://news.google.com/rss/search?q=entertainment+news,Abdul `Duke` Fakir of The Four Tops dead at 88,https://www.wionews.com/entertainment/abdul-duke-fakir-of-the-four-tops-dead-at-88-743370,"Tue, 23 Jul 2024 07:01:39 GMT",Abdul `Duke` Fakir of The Four Tops dead at 88,"{'href': 'https://www.wionews.com', 'title': 'WION'}"
https://news.google.com/rss/search?q=entertainment+news,"Lady Gaga spotted in Paris, sparks Olympic opening ceremony rumours",https://www.wionews.com/entertainment/lady-gaga-in-paris-sparking-olympic-opening-ceremony-rumours-743541,"Tue, 23 Jul 2024 15:05:58 GMT","Lady Gaga spotted in Paris, sparks Olympic opening ceremony rumours","{'href': 'https://www.wionews.com', 'title': 'WION'}"
https://news.google.com/rss/search?q=entertainment+news,Ryan Reynolds Finally Reveals Name Of His 4th Child With Blake Lively,https://kiss108.iheart.com/content/2024-07-23-ryan-reynolds-finally-reveals-the-name-of-his-4th-child-with-blake-lively/,"Tue, 23 Jul 2024 14:36:00 GMT",Ryan Reynolds Finally Reveals Name Of His 4th Child With Blake Lively,"{'href': 'https://kiss108.iheart.com', 'title': 'iHeart'}"
https://news.google.com/rss/search?q=entertainment+news,"US Elections: Biden exits, Hollywood backs Kamala Harris; talks money",https://www.wionews.com/videos/us-elections-biden-exits-hollywood-backs-kamala-harris-talks-money-743413,"Tue, 23 Jul 2024 08:55:01 GMT","US Elections: Biden exits, Hollywood backs Kamala Harris; talks money","{'href': 'https://www.wionews.com', 'title': 'WION'}"
https://news.google.com/rss/search?q=entertainment+news,Venice film festival unveils star-studded line-up,https://www.wionews.com/entertainment/venice-film-festival-unveils-star-studded-line-up-743539,"Tue, 23 Jul 2024 14:57:29 GMT",Venice film festival unveils star-studded line-up,"{'href': 'https://www.wionews.com', 'title': 'WION'}"
https://news.google.com/rss/search?q=entertainment+news,Beyoncé permits Kamala Harris to use `Freedom` for US presidential campaign,https://www.wionews.com/entertainment/beyonce-permits-kamala-harris-to-use-freedom-for-us-presidential-campaign-743400,"Tue, 23 Jul 2024 07:49:03 GMT",Beyoncé permits Kamala Harris to use `Freedom` for US presidential campaign,"{'href': 'https://www.wionews.com', 'title': 'WION'}"
https://news.google.com/rss/search?q=entertainment+news,Pete Davidson Reveals The One Drug He 'Can't Quit': 'It's All I Have Left',https://y100.iheart.com/content/2024-07-23-pete-davidson-reveals-the-one-drug-he-cant-quit-its-all-i-have-left/,"Tue, 23 Jul 2024 15:48:00 GMT",Pete Davidson Reveals The One Drug He 'Can't Quit': 'It's All I Have Left',"{'href': 'https://y100.iheart.com', 'title': 'Y100'}"
https://news.google.com/rss/search?q=entertainment+news,Kakao's Founder Arrested For Allegedly Rigging SM Entertainment's Stock Amid Takeover Battle With BTS' Label HYBE,https://www.timesnownews.com/entertainment-news/korean/kakaos-founder-arrested-for-allegedly-rigging-sm-entertainments-stock-amid-takeover-battle-with-bts-label-hybe-article-111969002,"Tue, 23 Jul 2024 18:21:56 GMT",Kakao's Founder Arrested For Allegedly Rigging SM Entertainment's Stock Amid Takeover Battle With BTS' Label HYBE,"{'href': 'https://www.timesnownews.com', 'title': 'Times Now'}"
https://news.google.com/rss/search?q=entertainment+news,"Meet little Olin! Ryan Reynolds, Blake Lively reveal fourth child`s name at movie premiere",https://www.wionews.com/entertainment/meet-little-olin-ryan-reynolds-blake-lively-reveal-fourth-childs-name-at-movie-premiere-743443,"Tue, 23 Jul 2024 09:15:55 GMT","Meet little Olin! Ryan Reynolds, Blake Lively reveal fourth child`s name at movie premiere","{'href': 'https://www.wionews.com', 'title': 'WION'}"
https://news.google.com/rss/search?q=entertainment+news,Anurag Kashyap returns to children's film genre with Little Thomas,https://www.business-standard.com/entertainment/anurag-kashyap-returns-to-children-s-film-genre-with-little-thomas-124072300908_1.html,"Tue, 23 Jul 2024 10:52:22 GMT",Anurag Kashyap returns to children's film genre with Little Thomas,"{'href': 'https://www.business-standard.com', 'title': 'Business Standard'}"
https://news.google.com/rss/search?q=entertainment+news,NewJeans Plan To Take Legal Action Against HYBE For Leaking Their Pre-Debut Pics And Videos,https://www.timesnownews.com/entertainment-news/korean/newjeans-plan-to-take-legal-action-against-hybe-for-leaking-their-pre-debut-pics-and-videos-article-111966575,"Tue, 23 Jul 2024 15:51:29 GMT",NewJeans Plan To Take Legal Action Against HYBE For Leaking Their Pre-Debut Pics And Videos,"{'href': 'https://www.timesnownews.com', 'title': 'Times Now'}"
https://news.google.com/rss/search?q=entertainment+news,"Karan Johar’s Ae Dil Hai Mushkil, Ranbir Kapoor's Best Hands Down",https://www.timesnownews.com/entertainment-news/bollywood/karan-johars-ae-dil-hai-mushkil-ranbir-kapoors-best-hands-down-article-111968253,"Tue, 23 Jul 2024 17:12:25 GMT","Karan Johar’s Ae Dil Hai Mushkil, Ranbir Kapoor's Best Hands Down","{'href': 'https://www.timesnownews.com', 'title': 'Times Now'}"
https://news.google.com/rss/search?q=entertainment+news,Anurag Kashyap to produce children’s film Little Thomas,https://www.wionews.com/entertainment/anurag-kashyap-to-produce-childrens-film-little-thomas-743572,"Tue, 23 Jul 2024 16:12:07 GMT",Anurag Kashyap to produce children’s film Little Thomas,"{'href': 'https://www.wionews.com', 'title': 'WION'}"
https://news.google.com/rss/search?q=tennis+news,'Gods of Tennis' explores trailblazing legends of the sport and why we remember them,https://www.npr.org/2024/07/23/nx-s1-5036532/gods-of-tennis-documentary-pbs,"Tue, 23 Jul 2024 09:00:00 GMT",'Gods of Tennis' explores trailblazing legends of the sport and why we remember them,"{'href': 'https://www.npr.org', 'title': 'NPR'}"
https://news.google.com/rss/search?q=tennis+news,Former Women’s Tennis Head Coach Mark Wesselink Passes Away,https://richmondspiders.com/news/2024/7/23/womens-tennis-spider-athletics-mourns-the-loss-of-former-womens-tennis-head-coach-mark-wesselink.aspx,"Tue, 23 Jul 2024 17:07:32 GMT",Former Women’s Tennis Head Coach Mark Wesselink Passes Away,"{'href': 'https://richmondspiders.com', 'title': 'RIchmond Spiders Athletic'}"
https://news.google.com/rss/search?q=tennis+news,Presbyterian Men’s Tennis Garners ITA Academic Awards,https://gobluehose.com/news/2024/7/23/mens-tennis-presbyterian-mens-tennis-garners-ita-academic-awards.aspx,"Tue, 23 Jul 2024 17:36:00 GMT",Presbyterian Men’s Tennis Garners ITA Academic Awards,"{'href': 'https://gobluehose.com', 'title': 'Presbyterian College'}"
https://news.google.com/rss/search?q=tennis+news,Four RedHawks and Team Earn Academic ITA Honor,https://miamiredhawks.com/news/2024/7/23/womens-tennis-four-redhawks-and-team-earn-academic-ita-honor.aspx,"Tue, 23 Jul 2024 18:05:33 GMT",Four RedHawks and Team Earn Academic ITA Honor,"{'href': 'https://miamiredhawks.com', 'title': 'Miami University Athletics'}"
https://news.google.com/rss/search?q=tennis+news,Nicholls Tennis earns ITA All-Academic Honors,https://geauxcolonels.com/news/2024/7/23/mens-tennis-nicholls-tennis-earns-ita-all-academic-honors.aspx,"Tue, 23 Jul 2024 17:23:32 GMT",Nicholls Tennis earns ITA All-Academic Honors,"{'href': 'https://geauxcolonels.com', 'title': 'Nicholls State University Athletics'}"
https://news.google.com/rss/search?q=tennis+news,Men's Tennis Receives ITA Academic Accolades,https://goduquesne.com/news/2024/7/23/mens-tennis-receives-ita-academic-accolades.aspx,"Tue, 23 Jul 2024 18:25:33 GMT",Men's Tennis Receives ITA Academic Accolades,"{'href': 'https://goduquesne.com', 'title': 'Duquesne University - Official Athletic Site'}"
https://news.google.com/rss/search?q=tennis+news,"Men’s and Women’s Tennis Earn ITA Team Academic Award, Programs Combine for 15 Scholar-Athlete Honorees",https://gomocs.com/news/2024/7/23/general-mens-and-womens-tennis-earn-ita-team-academic-award-programs-combine-for-15-scholar-athlete-honorees.aspx,"Tue, 23 Jul 2024 16:15:53 GMT","Men’s and Women’s Tennis Earn ITA Team Academic Award, Programs Combine for 15 Scholar-Athlete Honorees","{'href': 'https://gomocs.com', 'title': 'GoMocs.com'}"
https://news.google.com/rss/search?q=tennis+news,ITA Releases Men’s and Women’s Tennis Academic Awards,https://pennathletics.com/news/2024/7/23/mens-tennis-ita-releases-mens-and-womens-tennis-academic-awards.aspx,"Tue, 23 Jul 2024 18:04:37 GMT",ITA Releases Men’s and Women’s Tennis Academic Awards,"{'href': 'https://pennathletics.com', 'title': 'Penn Athletics'}"
https://news.google.com/rss/search?q=tennis+news,GALLERY: 91st News Journal Tennis Tournament,https://www.mansfieldnewsjournal.com/picture-gallery/sports/high-school/2024/07/23/gallery-91st-news-journal-tennis-tournament-12u/74508722007/,"Tue, 23 Jul 2024 11:51:38 GMT",GALLERY: 91st News Journal Tennis Tournament - 12U,"{'href': 'https://www.mansfieldnewsjournal.com', 'title': 'Mansfield News Journal'}"
https://news.google.com/rss/search?q=tennis+news,Men's Tennis Recognized by ITA For Academic Success,https://wmubroncos.com/news/2024/7/23/mens-tennis-recognized-by-ita-for-academic-success.aspx,"Tue, 23 Jul 2024 14:58:55 GMT",Men's Tennis Recognized by ITA For Academic Success,"{'href': 'https://wmubroncos.com', 'title': 'WMUBroncos.com'}"
https://news.google.com/rss/search?q=tennis+news,Ellie Burger Selected to Lead Belmont Women’s Tennis,https://belmontbruins.com/news/2024/7/23/womens-tennis-ellie-burger-selected-to-lead-belmont-womens-tennis.aspx,"Tue, 23 Jul 2024 17:07:37 GMT",Ellie Burger Selected to Lead Belmont Women’s Tennis,"{'href': 'https://belmontbruins.com', 'title': 'Belmont Athletics'}"
https://news.google.com/rss/search?q=tennis+news,Men’s Tennis Named ITA All-American Team; Three Named Scholar Athletes,https://lsusports.net/news/2024/07/23/mens-tennis-named-ita-all-american-team-three-named-scholar-athletes/,"Tue, 23 Jul 2024 16:10:52 GMT",Men’s Tennis Named ITA All-American Team; Three Named Scholar Athletes,"{'href': 'https://lsusports.net', 'title': 'Louisiana State University Athletics'}"
https://news.google.com/rss/search?q=tennis+news,Women's tennis earns individual and team ITA honors,https://athletics.bellarmine.edu/news/2024/7/23/womens-tennis-womens-tennis-earns-individual-and-team-ita-honors.aspx,"Tue, 23 Jul 2024 16:34:15 GMT",Women's tennis earns individual and team ITA honors,"{'href': 'https://athletics.bellarmine.edu', 'title': 'BU Athletics'}"
https://news.google.com/rss/search?q=tennis+news,NCCU Tennis Programs Honored with ITA Academic Awards,https://nccueaglepride.com/news/2024/7/23/mens-tennis-nccu-tennis-programs-honored-with-ita-academic-awards.aspx,"Tue, 23 Jul 2024 13:37:22 GMT",NCCU Tennis Programs Honored with ITA Academic Awards,"{'href': 'https://nccueaglepride.com', 'title': 'North Carolina Central University Athletics'}"
https://news.google.com/rss/search?q=tennis+news,Valpo Tennis Continues Academic Excellence as ITA Announces Awards,https://www.valpoathletics.com/wtennis/news/2024-25/22985/valpo-tennis-continues-academic-excellence-as-ita-announces-awards/,"Tue, 23 Jul 2024 15:59:51 GMT",Valpo Tennis Continues Academic Excellence as ITA Announces Awards,"{'href': 'https://www.valpoathletics.com', 'title': 'Valpo Athletics'}"
https://news.google.com/rss/search?q=tennis+news,UNI tennis named ITA All-Academic Team for 2023-24,https://unipanthers.com/news/2024/7/23/womens-tennis-uni-tennis-named-ita-all-academic-team-for-2023-24,"Tue, 23 Jul 2024 14:43:51 GMT",UNI tennis named ITA All-Academic Team for 2023-24,"{'href': 'https://unipanthers.com', 'title': 'UNI Athletics'}"
https://news.google.com/rss/search?q=tennis+news,"""Arrived in Paris for my last ever tennis tournament,"" Murray wrote on Twitter/X.",https://www.skysports.com/tennis/news/12110/13183611/andy-murray-ready-for-last-ever-tennis-tournament-at-paris-olympics,"Tue, 23 Jul 2024 10:41:15 GMT","""Arrived in Paris for my last ever tennis tournament,"" Murray wrote on Twitter/X.","{'href': 'https://www.skysports.com', 'title': 'Sky Sports'}"
https://news.google.com/rss/search?q=tennis+news,Women's Tennis Earns ITA Academic Awards,https://goduquesne.com/news/2024/7/23/womens-tennis-earns-ita-academic-awards.aspx,"Tue, 23 Jul 2024 17:59:18 GMT",Women's Tennis Earns ITA Academic Awards,"{'href': 'https://goduquesne.com', 'title': 'Duquesne University - Official Athletic Site'}"
https://news.google.com/rss/search?q=tennis+news,Women's Tennis Recognized by ITA for Academic Success,https://wmubroncos.com/news/2024/7/23/womens-tennis-recognized-by-ita-for-academic-success.aspx,"Tue, 23 Jul 2024 16:04:01 GMT",Women's Tennis Recognized by ITA for Academic Success,"{'href': 'https://wmubroncos.com', 'title': 'WMUBroncos.com'}"
https://news.google.com/rss/search?q=tennis+news,"Women's Tennis Team, Six Individuals Garner ITA All-Academic Awards",https://gotigersgo.com/news/2024/7/22/womens-tennis-team-six-individuals-garner-ita-all-academic-awards,"Tue, 23 Jul 2024 07:40:15 GMT","Women's Tennis Team, Six Individuals Garner ITA All-Academic Awards","{'href': 'https://gotigersgo.com', 'title': 'Memphis Official Athletic Site'}"
https://news.google.com/rss/search?q=tennis+news,Husker Tennis Takes Home ITA Academic Awards,https://huskers.com/news/2024/07/23/husker-tennis-takes-home-ita-academic-awards,"Tue, 23 Jul 2024 17:21:23 GMT",Husker Tennis Takes Home ITA Academic Awards - University of Nebraska - Official Athletics Website,"{'href': 'https://huskers.com', 'title': 'huskers.com'}"
https://news.google.com/rss/search?q=tennis+news,"Tennis News: Paula Badosa, Marketa Vondrousova and Ons Jabeur",https://lobandsmash.com/posts/tennis-news-paula-badosa-marketa-vondrousova-ons-jabeur-01j3dnrak963,"Tue, 23 Jul 2024 13:00:01 GMT","Tennis News: Paula Badosa, Marketa Vondrousova and Ons Jabeur","{'href': 'https://lobandsmash.com', 'title': 'Lob and Smash'}"
