Input URL,Title,Link,Published,Description,Source
https://news.google.com/rss/search?q=world+news,Snoop Dogg will carry the Olympic torch on its final leg to Paris,https://www.nbcnews.com/news/world/snoop-dogg-will-carry-olympic-torch-final-leg-paris-rcna163234,"Tue, 23 Jul 2024 16:44:59 GMT",Snoop Dogg will carry the Olympic torch on its final leg to Paris,"{'href': 'https://www.nbcnews.com', 'title': 'NBC News'}"
https://news.google.com/rss/search?q=world+news,US congressional task force to investigate Trump shooting,https://indianexpress.com/article/world/us-congressional-task-force-to-investigate-trump-shooting-9471252/,"Tue, 23 Jul 2024 13:19:42 GMT",US congressional task force to investigate Trump shooting,"{'href': 'https://indianexpress.com', 'title': 'The Indian Express'}"
https://news.google.com/rss/search?q=world+news,Win a Limited Edition Art Print,https://worldathletics.org/news/news/win-a-limited-edition-art-print,"Tue, 23 Jul 2024 14:00:01 GMT",Win a Limited Edition Art Print,"{'href': 'https://worldathletics.org', 'title': 'World Athletics'}"
https://news.google.com/rss/search?q=world+news,US is investigating Delta’s flight cancellations and faltering response to global tech outage,https://apnews.com/article/technology-outage-delta-air-lines-delays-7361e641fe2c656d7fba06e4a0424c6a,"Tue, 23 Jul 2024 16:57:00 GMT",US is investigating Delta’s flight cancellations and faltering response to global tech outage,"{'href': 'https://apnews.com', 'title': 'The Associated Press'}"
https://news.google.com/rss/search?q=world+news,"""Hospice Care, Coup"": Joe Biden's Absence Sparks Bizarre Theories",https://www.ndtv.com/world-news/wheres-joe-hospice-care-coup-joe-biden-absence-sparks-bizarre-conspiracy-theories-6169799,"Tue, 23 Jul 2024 09:58:53 GMT","""Hospice Care, Coup"": Joe Biden's Absence Sparks Bizarre Theories","{'href': 'https://www.ndtv.com', 'title': 'NDTV'}"
https://news.google.com/rss/search?q=world+news,World's 'smallest heart pump' used for first time in Lincolnshire,https://www.bbc.com/news/articles/cg3j077ezy5o,"Tue, 23 Jul 2024 09:29:55 GMT",World's 'smallest heart pump' used for first time in Lincolnshire,"{'href': 'https://www.bbc.com', 'title': 'BBC.com'}"
https://news.google.com/rss/search?q=world+news,Sri Lanka apologises for ‘forcing’ cremations of Muslim Covid victims,https://www.hindustantimes.com/world-news/sri-lanka-apologises-for-forcing-cremations-of-muslim-covid-victims-101721758709424.html,"Tue, 23 Jul 2024 18:29:02 GMT",Sri Lanka apologises for ‘forcing’ cremations of Muslim Covid victims,"{'href': 'https://www.hindustantimes.com', 'title': 'Hindustan Times'}"
https://news.google.com/rss/search?q=world+news,Donald Trump Reveals What Joe Biden Told Him After Assassination Attempt,https://www.ndtv.com/world-news/donald-trump-reveals-what-joe-biden-told-him-after-assassination-attempt-6169417,"Tue, 23 Jul 2024 09:10:40 GMT",Donald Trump Reveals What Joe Biden Told Him After Assassination Attempt,"{'href': 'https://www.ndtv.com', 'title': 'NDTV'}"
https://news.google.com/rss/search?q=world+news,Andean condor in rehab highlights conservation challenges,https://www.hindustantimes.com/world-news/andean-condor-in-rehab-highlights-conservation-challenges-101721732571099.html,"Tue, 23 Jul 2024 11:02:50 GMT",Andean condor in rehab highlights conservation challenges,"{'href': 'https://www.hindustantimes.com', 'title': 'Hindustan Times'}"
https://news.google.com/rss/search?q=world+news,Insect wreaks havoc on Tunisia’s crucial prickly pear industry,https://www.hindustantimes.com/world-news/insect-wreaks-havoc-on-tunisia-s-crucial-prickly-pear-industry-101721734709397.html,"Tue, 23 Jul 2024 11:38:28 GMT",Insect wreaks havoc on Tunisia’s crucial prickly pear industry,"{'href': 'https://www.hindustantimes.com', 'title': 'Hindustan Times'}"
https://news.google.com/rss/search?q=world+news,Paris: Tom Daley shows us Olympic beds made of cardboard,https://news.sky.com/video/paris-tom-daley-shows-us-olympic-beds-made-of-cardboard-13183614,"Tue, 23 Jul 2024 07:44:49 GMT",Paris: Tom Daley shows us Olympic beds made of cardboard,"{'href': 'https://news.sky.com', 'title': 'Sky News'}"
https://news.google.com/rss/search?q=world+news,Malaysia evacuates 123 citizens from violence-hit Bangladesh,https://www.hindustantimes.com/world-news/malaysia-evacuates-123-citizens-from-violence-hit-bangladesh-101721733517496.html,"Tue, 23 Jul 2024 11:18:36 GMT",Malaysia evacuates 123 citizens from violence-hit Bangladesh,"{'href': 'https://www.hindustantimes.com', 'title': 'Hindustan Times'}"
https://news.google.com/rss/search?q=world+news,Sonya Massey death: Joe Biden breaks silence after Illinois deputy kills Black woman: ‘Unthinkable and senseless’,https://www.hindustantimes.com/world-news/us-news/sonya-massey-death-joe-biden-breaks-silence-after-illinois-deputy-kills-black-woman-unthinkable-and-senseless-101721722691182.html,"Tue, 23 Jul 2024 08:31:07 GMT",Sonya Massey death: Joe Biden breaks silence after Illinois deputy kills Black woman: ‘Unthinkable and senseless’,"{'href': 'https://www.hindustantimes.com', 'title': 'Hindustan Times'}"
https://news.google.com/rss/search?q=world+news,Tourist angers locals in Tenerife by jumping into public fountain,https://news.sky.com/video/tourist-angers-locals-in-tenerife-by-jumping-into-public-fountain-13183730,"Tue, 23 Jul 2024 11:52:58 GMT",Tourist angers locals in Tenerife by jumping into public fountain,"{'href': 'https://news.sky.com', 'title': 'Sky News'}"
https://news.google.com/rss/search?q=world+news,Flight carrying 123 Malaysians evacuated from Bangladesh arrives home,https://indianexpress.com/article/world/flight-carrying-malaysians-evacuated-from-bangladesh-arrives-home-9469361/,"Tue, 23 Jul 2024 11:06:25 GMT",Flight carrying 123 Malaysians evacuated from Bangladesh arrives home,"{'href': 'https://indianexpress.com', 'title': 'The Indian Express'}"
https://news.google.com/rss/search?q=world+news,George Clooney may not back Kamala Harris because of THIS ‘Obama’ reason,https://www.hindustantimes.com/world-news/us-news/george-clooney-will-not-back-kamala-harris-because-of-this-obama-reason-101721712904708.html,"Tue, 23 Jul 2024 07:29:58 GMT",George Clooney may not back Kamala Harris because of THIS ‘Obama’ reason,"{'href': 'https://www.hindustantimes.com', 'title': 'Hindustan Times'}"
https://news.google.com/rss/search?q=world+news,Zaluzhny says the West must “wake up” or risk World War 3,https://www.telegraph.co.uk/world-news/2024/07/23/ukraine-russia-zaluzhny-development-war/,"Tue, 23 Jul 2024 15:44:00 GMT","Zaluzhny says the West must “wake up” or risk World War 3 - Ukraine: The Latest, Podcast","{'href': 'https://www.telegraph.co.uk', 'title': 'The Telegraph'}"
https://news.google.com/rss/search?q=world+news,"Pentagon expresses concern at growing China, Russia cooperation in Arctic",https://www.business-standard.com/world-news/cooperation-growing-between-russia-and-china-in-arctic-says-pentagon-124072300559_1.html,"Tue, 23 Jul 2024 07:20:06 GMT","Pentagon expresses concern at growing China, Russia cooperation in Arctic","{'href': 'https://www.business-standard.com', 'title': 'Business Standard'}"
https://news.google.com/rss/search?q=world+news,"Biden passed the torch slowly, hanging on until the wheels finally came off",https://www.business-standard.com/world-news/biden-passed-the-torch-slowly-hanging-on-until-the-wheels-finally-came-off-124072300648_1.html,"Tue, 23 Jul 2024 08:27:50 GMT","Biden passed the torch slowly, hanging on until the wheels finally came off","{'href': 'https://www.business-standard.com', 'title': 'Business Standard'}"
https://news.google.com/rss/search?q=us+national+news,Secret Service Director Kimberly Cheatle steps down amid resignation calls after Trump assassination attempt,https://www.nbcnews.com/politics/national-security/secret-service-director-step-resignation-calls-trump-assassination-att-rcna163222,"Tue, 23 Jul 2024 15:28:16 GMT",Secret Service Director Kimberly Cheatle steps down amid resignation calls after Trump assassination attempt,"{'href': 'https://www.nbcnews.com', 'title': 'NBC News'}"
https://news.google.com/rss/search?q=us+national+news,National security experts warn against ‘chaos’ of US elections as Harris enters race,https://www.foxnews.com/world/national-security-experts-warn-against-chaos-us-elections-harris-enters-race,"Tue, 23 Jul 2024 08:00:00 GMT",National security experts warn against ‘chaos’ of US elections as Harris enters race,"{'href': 'https://www.foxnews.com', 'title': 'Fox News'}"
https://news.google.com/rss/search?q=us+national+news,Netanyahu is in Washington at a fraught time for Israel and the US. What to know about his visit,https://apnews.com/article/netanyahu-congress-biden-israel-hamas-gaza-6d8deabff2701273ea77bf634ba1949b,"Tue, 23 Jul 2024 17:16:00 GMT",Netanyahu is in Washington at a fraught time for Israel and the US. What to know about his visit,"{'href': 'https://apnews.com', 'title': 'The Associated Press'}"
https://news.google.com/rss/search?q=us+national+news,Kamala Harris Becomes De Facto Democratic Nominee,https://www.usnews.com/news/national-news/articles/2024-07-23/kamala-harris-becomes-de-facto-democratic-nominee,"Tue, 23 Jul 2024 15:37:50 GMT",Kamala Harris Becomes De Facto Democratic Nominee | National News | U.S. News,"{'href': 'https://www.usnews.com', 'title': 'U.S. News & World Report'}"
https://news.google.com/rss/search?q=us+national+news,Embattled Secret Service Director Kimberly Cheatle Resigns After Trump Assassination Attempt,https://www.usnews.com/news/national-news/articles/2024-07-23/embattled-secret-service-director-kimberly-cheatle-resigns-after-trump-assassination-attempt,"Tue, 23 Jul 2024 16:03:54 GMT",Embattled Secret Service Director Kimberly Cheatle Resigns After Trump Assassination Attempt,"{'href': 'https://www.usnews.com', 'title': 'U.S. News & World Report'}"
https://news.google.com/rss/search?q=us+national+news,U.S. Secret Service director resigns amid Trump shooting fallout,https://globalnews.ca/news/10638303/us-secret-service-director-resigns-kimberly-cheatle/,"Tue, 23 Jul 2024 14:41:32 GMT",U.S. Secret Service director resigns amid Trump shooting fallout,"{'href': 'https://globalnews.ca', 'title': 'Global News Toronto'}"
https://news.google.com/rss/search?q=us+national+news,Israel’s Netanyahu visiting U.S. amid political tensions. What to know,https://globalnews.ca/news/10638102/israel-netanyahu-us-visit-preview/,"Tue, 23 Jul 2024 12:02:16 GMT",Israel’s Netanyahu visiting U.S. amid political tensions. What to know,"{'href': 'https://globalnews.ca', 'title': 'Global News'}"
https://news.google.com/rss/search?q=us+national+news,"Three people from Laval, Que., killed in small plane crash in northeastern Ohio",https://montreal.ctvnews.ca/three-people-from-laval-que-killed-in-small-plane-crash-in-northeastern-ohio-1.6973918,"Tue, 23 Jul 2024 11:05:00 GMT","Three people from Laval, Que., killed in small plane crash in northeastern Ohio","{'href': 'https://montreal.ctvnews.ca', 'title': 'CTV News Montreal'}"
https://news.google.com/rss/search?q=business+news,Delta faces probe as CrowdStrike disruption lingers,https://www.bbc.com/news/articles/c3gdlm4079ro,"Tue, 23 Jul 2024 15:40:04 GMT",Delta faces probe as CrowdStrike disruption lingers,"{'href': 'https://www.bbc.com', 'title': 'BBC.com'}"
https://news.google.com/rss/search?q=business+news,Developer plans five-story pencil building for lot on St. Charles Avenue,https://www.nola.com/news/business/developer-plans-five-story-pencil-building-for-lot-on-st-charles-avenue/article_3a27f980-4877-11ef-a4f6-6ba945fbe273.html,"Tue, 23 Jul 2024 09:00:00 GMT",Developer plans five-story pencil building for lot on St. Charles Avenue,"{'href': 'https://www.nola.com', 'title': 'NOLA.com'}"
https://news.google.com/rss/search?q=business+news,Gerard R. Luckman,https://libn.com/2024/07/23/gerard-r-luckman-forchelli-deegan-terrana-llp-2/,"Tue, 23 Jul 2024 15:07:45 GMT",Gerard R. Luckman | Forchelli Deegan Terrana LLP,"{'href': 'https://libn.com', 'title': 'Long Island Business News'}"
https://news.google.com/rss/search?q=business+news,"TelevisaUnivision Sees “Great” H2 on Election, Streaming Turning Profitable, Posts Q2 U.S. Ad Gain",https://www.hollywoodreporter.com/business/business-news/televisaunivision-q2-earnings-2024-advertising-election-streaming-1235953921/,"Tue, 23 Jul 2024 15:22:30 GMT","TelevisaUnivision Sees “Great” H2 on Election, Streaming Turning Profitable, Posts Q2 U.S. Ad Gain","{'href': 'https://www.hollywoodreporter.com', 'title': 'Hollywood Reporter'}"
https://news.google.com/rss/search?q=business+news,Making whole grains more child-friendly,https://www.foodbusinessnews.net/articles/26469-making-whole-grains-more-child-friendly,"Tue, 23 Jul 2024 16:42:36 GMT",Making whole grains more child-friendly,"{'href': 'https://www.foodbusinessnews.net', 'title': 'Food Business News'}"
https://news.google.com/rss/search?q=business+news,"As Hurricane Season Begins, Here's How Small Businesses Can Prepare in Advance of a Storm",https://www.usnews.com/news/business/articles/2024-07-23/as-hurricane-season-begins-heres-how-small-businesses-can-prepare-in-advance-of-a-storm,"Tue, 23 Jul 2024 14:02:00 GMT","As Hurricane Season Begins, Here's How Small Businesses Can Prepare in Advance of a Storm","{'href': 'https://www.usnews.com', 'title': 'U.S. News & World Report'}"
https://news.google.com/rss/search?q=business+news,FIU Business hosts meeting of federal strike force and exporters,https://news.fiu.edu/2024/fiu-business-hosts-meeting-of-federal-strike-force-and-exporters,"Tue, 23 Jul 2024 17:10:05 GMT",FIU Business hosts meeting of federal strike force and exporters,"{'href': 'https://news.fiu.edu', 'title': 'FIU News'}"
https://news.google.com/rss/search?q=business+news,Bobbie opens infant formula manufacturing facility,https://www.foodbusinessnews.net/articles/26463-bobbie-opens-infant-formula-manufacturing-facility,"Tue, 23 Jul 2024 13:33:00 GMT",Bobbie opens infant formula manufacturing facility,"{'href': 'https://www.foodbusinessnews.net', 'title': 'Food Business News'}"
https://news.google.com/rss/search?q=business+news,Bernard Arnault Has Been Dubbed the Olympics' Godfather. Here's How He Built LVMH's Fortune,https://www.usnews.com/news/business/articles/2024-07-23/bernard-arnault-has-been-dubbed-the-olympics-godfather-heres-how-he-built-lvmhs-fortune,"Tue, 23 Jul 2024 13:25:00 GMT",Bernard Arnault Has Been Dubbed the Olympics' Godfather. Here's How He Built LVMH's Fortune,"{'href': 'https://www.usnews.com', 'title': 'U.S. News & World Report'}"
https://news.google.com/rss/search?q=business+news,Comcast President Touts NBA Rights: Will Put “Weight of Our Entire Company” Behind Deal,https://www.hollywoodreporter.com/business/business-news/nbc-nba-rights-details-official-1235955426/,"Tue, 23 Jul 2024 13:05:21 GMT",Comcast President Touts NBA Rights: Will Put “Weight of Our Entire Company” Behind Deal,"{'href': 'https://www.hollywoodreporter.com', 'title': 'Hollywood Reporter'}"
https://news.google.com/rss/search?q=business+news,Biotechnology company raises $18 million,https://www.foodbusinessnews.net/articles/26464-biotechnology-company-raises-18-million,"Tue, 23 Jul 2024 13:35:00 GMT",Biotechnology company raises $18 million,"{'href': 'https://www.foodbusinessnews.net', 'title': 'Food Business News'}"
https://news.google.com/rss/search?q=business+news,Spotify Beats Expectations for Paid Subscribers After Price Hikes to Hit 246M,https://www.hollywoodreporter.com/business/business-news/spotify-q2-paid-subscribers-price-hikes-1235955375/,"Tue, 23 Jul 2024 12:27:18 GMT",Spotify Beats Expectations for Paid Subscribers After Price Hikes to Hit 246M,"{'href': 'https://www.hollywoodreporter.com', 'title': 'Hollywood Reporter'}"
https://news.google.com/rss/search?q=business+news,‘Plant de Crème is crème brûlée meets ice cream’,https://www.foodbusinessnews.net/articles/26462-plant-de-creme-is-creme-brulee-meets-ice-cream,"Tue, 23 Jul 2024 13:30:00 GMT",‘Plant de Crème is crème brûlée meets ice cream’,"{'href': 'https://www.foodbusinessnews.net', 'title': 'Food Business News'}"
https://news.google.com/rss/search?q=business+news,"Broadway Box Office: ‘Oh, Mary!’ Breaks Record, Extends Run",https://www.hollywoodreporter.com/business/business-news/oh-mary-breaks-box-office-record-extends-run-1235955761/,"Tue, 23 Jul 2024 18:07:44 GMT","Broadway Box Office: ‘Oh, Mary!’ Breaks Record, Extends Run","{'href': 'https://www.hollywoodreporter.com', 'title': 'Hollywood Reporter'}"
https://news.google.com/rss/search?q=business+news,Summit Hill Foods names new CMO,https://www.foodbusinessnews.net/articles/26467-summit-hill-foods-names-new-cmo,"Tue, 23 Jul 2024 14:00:35 GMT",Summit Hill Foods names new CMO,"{'href': 'https://www.foodbusinessnews.net', 'title': 'Food Business News'}"
https://news.google.com/rss/search?q=business+news,Knorr introduces Asian-inspired liquid seasoning,https://www.foodbusinessnews.net/articles/26471-knorr-introduces-asian-inspired-liquid-seasoning,"Tue, 23 Jul 2024 17:18:41 GMT",Knorr introduces Asian-inspired liquid seasoning,"{'href': 'https://www.foodbusinessnews.net', 'title': 'Food Business News'}"
https://news.google.com/rss/search?q=business+news,"Harpak-Ulma elevates Kevin Roach to chairman, CEO",https://www.foodbusinessnews.net/articles/26468-harpak-ulma-elevates-kevin-roach-to-chairman-ceo,"Tue, 23 Jul 2024 14:00:45 GMT","Harpak-Ulma elevates Kevin Roach to chairman, CEO","{'href': 'https://www.foodbusinessnews.net', 'title': 'Food Business News'}"
https://news.google.com/rss/search?q=business+news,Sweet Loren’s launches rolled dough collection,https://www.foodbusinessnews.net/articles/26466-sweet-lorens-launches-rolled-dough-collection,"Tue, 23 Jul 2024 13:55:00 GMT",Sweet Loren’s launches rolled dough collection,"{'href': 'https://www.foodbusinessnews.net', 'title': 'Food Business News'}"
https://news.google.com/rss/search?q=business+news,Every Body Eat expands cracker line,https://www.foodbusinessnews.net/articles/26465-every-body-eat-expands-cracker-line,"Tue, 23 Jul 2024 13:45:00 GMT",Every Body Eat expands cracker line,"{'href': 'https://www.foodbusinessnews.net', 'title': 'Food Business News'}"
https://news.google.com/rss/search?q=business+news,Cracking the code to reignite consumer spending,https://www.foodbusinessnews.net/articles/26461-cracking-the-code-to-reignite-consumer-spending,"Tue, 23 Jul 2024 11:18:38 GMT",Cracking the code to reignite consumer spending,"{'href': 'https://www.foodbusinessnews.net', 'title': 'Food Business News'}"
https://news.google.com/rss/search?q=business+news,Wayne High grad selected to Nebraska Business Honors Academy,https://norfolkdailynews.com/news/wayne-high-grad-selected-to-nebraska-business-honors-academy/article_ab6aa2bc-4900-11ef-9b6b-3ff2361eb13f.html,"Tue, 23 Jul 2024 14:34:00 GMT",Wayne High grad selected to Nebraska Business Honors Academy,"{'href': 'https://norfolkdailynews.com', 'title': 'Norfolk Daily News'}"
https://news.google.com/rss/search?q=business+news,Johnson Controls to Sell Residential and Light Commercial HVAC Businesses,https://www.prnewswire.com/news-releases/johnson-controls-to-sell-residential-and-light-commercial-hvac-businesses-302203723.html,"Tue, 23 Jul 2024 08:03:00 GMT",Johnson Controls to Sell Residential and Light Commercial HVAC Businesses,"{'href': 'https://www.prnewswire.com', 'title': 'PR Newswire'}"
https://news.google.com/rss/search?q=business+news,Company news: Upstate Medical University promotes Sipho Mbuqe,https://www.syracuse.com/business/2024/07/company-news-upstate-medical-university-promotes-sipho-mbuqe.html,"Tue, 23 Jul 2024 15:47:00 GMT",Company news: Upstate Medical University promotes Sipho Mbuqe,"{'href': 'https://www.syracuse.com', 'title': 'syracuse.com'}"
https://news.google.com/rss/search?q=business+news,Company news: Casey Christopher hired by KeyBank,https://www.syracuse.com/business/2024/07/company-news-casey-christopher-hired-by-keybank.html,"Tue, 23 Jul 2024 10:33:00 GMT",Company news: Casey Christopher hired by KeyBank,"{'href': 'https://www.syracuse.com', 'title': 'syracuse.com'}"
https://news.google.com/rss/search?q=business+news,"Company news: Stephanie Grandjean, Katie Lemery-White promoted by Contact",https://www.syracuse.com/business/2024/07/company-news-stephanie-grandjean-katie-lemery-white-promoted-by-contact.html,"Tue, 23 Jul 2024 12:30:00 GMT","Company news: Stephanie Grandjean, Katie Lemery-White promoted by Contact","{'href': 'https://www.syracuse.com', 'title': 'syracuse.com'}"
https://news.google.com/rss/search?q=business+news,"Laika Appoints Alex Maggioni As Head Of TV, Zac Locke As Head Of Business Affairs Amid Expansion Into Live-Action",https://deadline.com/2024/07/laika-appoints-alex-maggioni-zac-locke-new-executive-roles-1236018094/,"Tue, 23 Jul 2024 15:00:00 GMT","Laika Appoints Alex Maggioni As Head Of TV, Zac Locke As Head Of Business Affairs Amid Expansion Into Live-Action","{'href': 'https://deadline.com', 'title': 'Deadline'}"
https://news.google.com/rss/search?q=business+news,Uzelac Industries’ plans move forward to Common Council,https://www.gmtoday.com/the_freeman/news/uzelac-industries-plans-move-forward-to-common-council/article_089cdd53-8518-57f2-acac-29de2cdce1a4.html,"Tue, 23 Jul 2024 11:20:00 GMT",Uzelac Industries’ plans move forward to Common Council,"{'href': 'https://www.gmtoday.com', 'title': 'Greater Milwaukee Today | GMToday.com'}"
https://news.google.com/rss/search?q=business+news,Bitwise founders plead guilty to $115M fraud scheme,https://www.bizjournals.com/buffalo/inno/stories/news/2024/07/23/bitwise-founders-plead-guilty-to-115m-fraud-scheme.html,"Tue, 23 Jul 2024 14:25:00 GMT",Bitwise founders plead guilty to $115M fraud scheme,"{'href': 'https://www.bizjournals.com', 'title': 'The Business Journals'}"
https://news.google.com/rss/search?q=business+news,Spotify shares surge 15% after profitability hits record high,https://www.theguardian.com/business/live/2024/jul/23/elon-musk-tesla-humanoid-robots-google-23bn-wiz-tech-markets-business-live,"Tue, 23 Jul 2024 07:02:00 GMT",Spotify shares surge 15% after profitability hits record high – as it happened,"{'href': 'https://www.theguardian.com', 'title': 'The Guardian'}"
https://news.google.com/rss/search?q=business+news,"Everbridge Acquires Infinite Blue, a Leader in Enterprise Business Continuity Solutions",https://finance.yahoo.com/news/everbridge-acquires-infinite-blue-leader-113000606.html,"Tue, 23 Jul 2024 11:30:00 GMT","Everbridge Acquires Infinite Blue, a Leader in Enterprise Business Continuity Solutions","{'href': 'https://finance.yahoo.com', 'title': 'Yahoo Finance'}"
https://news.google.com/rss/search?q=science+news,Some melanoma cancer cells may punch their way through the body,https://www.sciencenews.org/article/cancer-cells-tunnel-through-body,"Tue, 23 Jul 2024 13:00:00 GMT",Some melanoma cancer cells may punch their way through the body,"{'href': 'https://www.sciencenews.org', 'title': 'Science News Magazine'}"
https://news.google.com/rss/search?q=science+news,2024 Alfred Noble Prize winners (IMAGE),https://www.eurekalert.org/multimedia/1035423,"Tue, 23 Jul 2024 15:20:23 GMT",2024 Alfred Noble Prize winners (IMAGE),"{'href': 'https://www.eurekalert.org', 'title': 'EurekAlert'}"
https://news.google.com/rss/search?q=science+news,JMIR XR and Spatial Computing [IMAGE],https://www.eurekalert.org/multimedia/1035474,"Tue, 23 Jul 2024 14:11:50 GMT",JMIR XR and Spatial Computing [IMAGE],"{'href': 'https://www.eurekalert.org', 'title': 'EurekAlert'}"
https://news.google.com/rss/search?q=science+news,Compressor for generating ultrahigh-intensity laser pulses for coherent gamma ray research (IMAGE),https://www.eurekalert.org/multimedia/1035502,"Tue, 23 Jul 2024 14:11:50 GMT",Compressor for generating ultrahigh-intensity laser pulses for coherent gamma ray research (IMAGE),"{'href': 'https://www.eurekalert.org', 'title': 'EurekAlert'}"
https://news.google.com/rss/search?q=science+news,Efficacy of DIF-1(+3) against drug-resistant malaria pathogen (IMAGE),https://www.eurekalert.org/multimedia/1035161,"Tue, 23 Jul 2024 10:54:44 GMT",Efficacy of DIF-1(+3) against drug-resistant malaria pathogen (IMAGE),"{'href': 'https://www.eurekalert.org', 'title': 'EurekAlert'}"
https://news.google.com/rss/search?q=science+news,'Cocaine Sharks' discovered: Scientists expect 'erratic behaviour' as marine animals taste narcotic substances,https://www.livemint.com/science/news/cocaine-sharks-discovered-scientists-expect-erratic-behaviour-as-marine-animals-taste-narcotic-substances-11721730116152.html,"Tue, 23 Jul 2024 11:19:45 GMT",'Cocaine Sharks' discovered: Scientists expect 'erratic behaviour' as marine animals taste narcotic substances | Mint,"{'href': 'https://www.livemint.com', 'title': 'Mint'}"
https://news.google.com/rss/search?q=science+news,"‘Dark’ oxygen found in deep ocean 13,000 feet below sea level, may provide insights into origin of life",https://www.livemint.com/science/news/dark-oxygen-found-in-deep-ocean-13-000-feet-below-sea-level-may-provide-insights-into-origin-of-life-11721722516550.html,"Tue, 23 Jul 2024 08:29:31 GMT","‘Dark’ oxygen found in deep ocean 13,000 feet below sea level, may provide insights into origin of life | Mint","{'href': 'https://www.livemint.com', 'title': 'Mint'}"
https://news.google.com/rss/search?q=technology+news,Wiz: Cybersecurity firm rejects Google's $23bn takeover offer,https://www.bbc.com/news/articles/c3gdlng47k7o,"Tue, 23 Jul 2024 16:40:03 GMT",Wiz: Cybersecurity firm rejects Google's $23bn takeover offer,"{'href': 'https://www.bbc.com', 'title': 'BBC.com'}"
