Input URL,Title,Link,Published,Description,Source
https://news.google.com/rss/search?q=sports+news,Pickleball to become a varsity sport at all Montgomery Co. high schools,https://wtop.com/montgomery-county/2024/07/pickleball-to-become-a-varsity-sport-at-all-montgomery-co-high-schools/,"Tue, 23 Jul 2024 15:28:20 GMT",Pickleball to become a varsity sport at all Montgomery Co. high schools,"{'href': 'https://wtop.com', 'title': 'WTOP'}"
https://news.google.com/rss/search?q=sports+news,Manuel Ugarte to Man Utd? N'Golo Kante-like ball-winner could help shore up Erik ten Hag's midfield,https://www.skysports.com/football/news/11667/13183322/manuel-ugarte-to-man-utd-ngolo-kante-like-ball-winner-could-help-shore-up-erik-ten-hags-midfield,"Tue, 23 Jul 2024 07:01:25 GMT",Manuel Ugarte to Man Utd? N'Golo Kante-like ball-winner could help shore up Erik ten Hag's midfield,"{'href': 'https://www.skysports.com', 'title': 'Sky Sports'}"
https://news.google.com/rss/search?q=sports+news,Pro Football Talk,https://www.nbcsports.com/nfl/profootballtalk,"Tue, 23 Jul 2024 18:36:39 GMT",Pro Football Talk,"{'href': 'https://www.nbcsports.com', 'title': 'NBC Sports'}"
https://news.google.com/rss/search?q=sports+news,Wembanyama Returns Home for Olympics. the Basketball Star Will Be One of Paris' Biggest Attractions,https://www.usnews.com/news/sports/articles/2024-07-23/wembanyama-returns-home-for-olympics-the-basketball-star-will-be-one-of-paris-biggest-attractions,"Tue, 23 Jul 2024 10:28:00 GMT",Wembanyama Returns Home for Olympics. the Basketball Star Will Be One of Paris' Biggest Attractions,"{'href': 'https://www.usnews.com', 'title': 'U.S. News & World Report'}"
https://news.google.com/rss/search?q=sports+news,"Lincoln County sports facilities broken into, vandalized",https://www.wowktv.com/news/west-virginia/lincoln-county-wv/lincoln-county-sports-facilities-broken-into-vandalized/,"Tue, 23 Jul 2024 14:42:36 GMT","Lincoln County sports facilities broken into, vandalized","{'href': 'https://www.wowktv.com', 'title': 'WOWK 13 News'}"
https://news.google.com/rss/search?q=sports+news,HBCU Football Champions Ranked in Popular Lindy’s Sports Poll,https://www.newsobserver.com/sports/college/article290340344.html,"Tue, 23 Jul 2024 16:01:00 GMT",HBCU Football Champions Ranked in Popular Lindy’s Sports Poll,"{'href': 'https://www.newsobserver.com', 'title': 'Raleigh News & Observer'}"
https://news.google.com/rss/search?q=sports+news,DETROIT SPORTS COMMISSION AND GENYOUth RALLY FOR GOOD TO BRING FLAG FOOTBALL TO DETROIT-AREA MIDDLE SCHOOLS,https://www.prnewswire.com/news-releases/detroit-sports-commission-and-genyouth-rally-for-good-to-bring-flag-football-to-detroit-area-middle-schools-302204081.html,"Tue, 23 Jul 2024 14:11:00 GMT",DETROIT SPORTS COMMISSION AND GENYOUth RALLY FOR GOOD TO BRING FLAG FOOTBALL TO DETROIT-AREA MIDDLE SCHOOLS,"{'href': 'https://www.prnewswire.com', 'title': 'PR Newswire'}"
https://news.google.com/rss/search?q=sports+news,Man City consider £68m move for Crystal Palace's Eberechi Eze,https://www.skysports.com/football/transfer-paper-talk,"Tue, 23 Jul 2024 18:43:40 GMT",Man City consider £68m move for Crystal Palace's Eberechi Eze - Paper Talk,"{'href': 'https://www.skysports.com', 'title': 'Sky Sports'}"
https://news.google.com/rss/search?q=sports+news,Garylee has sports with cardinal update,https://www.ozarkradionews.com/sports/garylee-has-sports-with-cardinal-update-8,"Tue, 23 Jul 2024 15:48:17 GMT",Garylee has sports with cardinal update,"{'href': 'https://www.ozarkradionews.com', 'title': 'Ozark Radio News'}"
https://news.google.com/rss/search?q=sports+news,Simone Biles and others spoke up about mental health. Has anything changed for the Paris Olympics?,https://www.boston.com/sports/sports-news/2024/07/23/biles-osaka-phelps-mental-health-paris-olympics/,"Tue, 23 Jul 2024 12:49:00 GMT",Simone Biles and others spoke up about mental health. Has anything changed for the Paris Olympics?,"{'href': 'https://www.boston.com', 'title': 'Boston.com'}"
https://news.google.com/rss/search?q=sports+news,Fisher grad Palmer eager to coach his alma mater,https://www.news-gazette.com/sports/fisher-grad-palmer-eager-to-coach-his-alma-mater/article_8be12854-4864-11ef-9a6e-ff788abcf3f4.html,"Tue, 23 Jul 2024 10:00:00 GMT",Fisher grad Palmer eager to coach his alma mater,"{'href': 'https://www.news-gazette.com', 'title': 'The News-Gazette'}"
https://news.google.com/rss/search?q=sports+news,How college sports video games became the entry point to dismantle the NCAA's amateurism rules,https://apnews.com/article/obannon-ncaa-ea-sports-video-game-e447b339ddf363ec7c93207cf7eac719,"Tue, 23 Jul 2024 17:28:00 GMT",How college sports video games became the entry point to dismantle the NCAA's amateurism rules,"{'href': 'https://apnews.com', 'title': 'The Associated Press'}"
https://news.google.com/rss/search?q=sports+news,Snyder's Soapbox: On the illness that is baseball fandom and why we put up with the lows to earn the highs,https://www.cbssports.com/mlb/news/snyders-soapbox-on-the-illness-that-is-baseball-fandom-and-why-we-put-up-with-the-lows-to-earn-the-highs/,"Tue, 23 Jul 2024 15:47:01 GMT",Snyder's Soapbox: On the illness that is baseball fandom and why we put up with the lows to earn the highs,"{'href': 'https://www.cbssports.com', 'title': 'CBS Sports'}"
https://news.google.com/rss/search?q=sports+news,British Equestrian Great Dujardin Out of Olympics After Coaching Video Shows 'Error of Judgment',https://www.usnews.com/news/sports/articles/2024-07-23/british-equestrian-great-dujardin-out-of-olympics-after-coaching-video-shows-error-of-judgment,"Tue, 23 Jul 2024 16:02:00 GMT",British Equestrian Great Dujardin Out of Olympics After Coaching Video Shows 'Error of Judgment',"{'href': 'https://www.usnews.com', 'title': 'U.S. News & World Report'}"
https://news.google.com/rss/search?q=sports+news,2025 Ryder Cup: Keegan Bradley names Webb Simpson his first vice captain for U.S. team at Bethpage Black,https://www.cbssports.com/golf/news/2025-ryder-cup-keegan-bradley-names-webb-simpson-his-first-vice-captain-for-u-s-team-at-bethpage-black/,"Tue, 23 Jul 2024 16:57:52 GMT",2025 Ryder Cup: Keegan Bradley names Webb Simpson his first vice captain for U.S. team at Bethpage Black,"{'href': 'https://www.cbssports.com', 'title': 'CBS Sports'}"
https://news.google.com/rss/search?q=sports+news,Olympic Drug-Fighting Failures Make Enhanced Games 'Not So Radical' Says Former Anti-Doping Advocate,https://www.usnews.com/news/sports/articles/2024-07-23/olympic-drug-fighting-failures-make-enhanced-games-not-so-radical-says-former-anti-doping-advocate,"Tue, 23 Jul 2024 10:04:37 GMT",Olympic Drug-Fighting Failures Make Enhanced Games 'Not So Radical' Says Former Anti-Doping Advocate,"{'href': 'https://www.usnews.com', 'title': 'U.S. News & World Report'}"
https://news.google.com/rss/search?q=sports+news,"They already sold out the ACC for a bag of nickels. Why not sell the name, too?",https://www.newsobserver.com/sports/spt-columns-blogs/luke-decock/article290303084.html,"Tue, 23 Jul 2024 10:00:00 GMT","They already sold out the ACC for a bag of nickels. Why not sell the name, too?","{'href': 'https://www.newsobserver.com', 'title': 'Raleigh News & Observer'}"
https://news.google.com/rss/search?q=sports+news,"USWNT vs Zambia: How to watch live, stream link, team news, prediction for Olympic opener",https://www.nbcsports.com/soccer/news/uswnt-vs-zambia-how-to-watch-live-stream-link-team-news-prediction-for-olympic-opener,"Tue, 23 Jul 2024 12:21:11 GMT","USWNT vs Zambia: How to watch live, stream link, team news, prediction for Olympic opener","{'href': 'https://www.nbcsports.com', 'title': 'NBC Sports'}"
https://news.google.com/rss/search?q=sports+news,Does Paul Skenes' dominance change the Pirates' trade deadline plans? Why Pittsburgh should be in win-now mode,https://www.cbssports.com/mlb/news/does-paul-skenes-dominance-change-the-pirates-trade-deadline-plans-why-pittsburgh-should-be-in-win-now-mode/,"Tue, 23 Jul 2024 15:15:04 GMT",Does Paul Skenes' dominance change the Pirates' trade deadline plans? Why Pittsburgh should be in win-now mode,"{'href': 'https://www.cbssports.com', 'title': 'CBS Sports'}"
https://news.google.com/rss/search?q=sports+news,Where every sport is being held at the Paris Olympics,https://www.wishtv.com/sports/where-every-sport-is-being-held-at-the-paris-olympics/,"Tue, 23 Jul 2024 10:30:52 GMT",Where every sport is being held at the Paris Olympics,"{'href': 'https://www.wishtv.com', 'title': 'WISH TV Indianapolis, IN'}"
https://news.google.com/rss/search?q=sports+news,Banana ball and 20 new sports debuting: ESPN8 ‘The Ocho’ returns to Rock Hill,https://www.heraldonline.com/news/local/article290302939.html,"Tue, 23 Jul 2024 11:00:00 GMT",Banana ball and 20 new sports debuting: ESPN8 ‘The Ocho’ returns to Rock Hill,"{'href': 'https://www.heraldonline.com', 'title': 'Rock Hill Herald'}"
https://news.google.com/rss/search?q=sports+news,Big Ten football championship staying in Indianapolis through 2028,https://www.wishtv.com/sports/big-ten-football-championship-staying-in-indianapolis-through-2028/,"Tue, 23 Jul 2024 15:52:49 GMT",Big Ten football championship staying in Indianapolis through 2028,"{'href': 'https://www.wishtv.com', 'title': 'WISH TV Indianapolis, IN'}"
https://news.google.com/rss/search?q=sports+news,Rodney K. Morgans,https://www.sungazette.com/obituaries/2024/07/rodney-k-morgans/,"Tue, 23 Jul 2024 07:30:57 GMT",Rodney K. Morgans,"{'href': 'https://www.sungazette.com', 'title': 'Williamsport Sun-Gazette'}"
https://news.google.com/rss/search?q=sports+news,Golf: `It`s been...`,https://www.wionews.com/sports/golf-its-been-xander-schauffele-reacts-after-winning-british-open-743463,"Tue, 23 Jul 2024 10:42:09 GMT",Golf: `It`s been...` - Xander Schauffele reacts after winning British Open,"{'href': 'https://www.wionews.com', 'title': 'WION'}"
https://news.google.com/rss/search?q=sports+news,"Backdrop, debuts, comebacks and legacies make Paris Olympics essential viewing",https://www.upi.com/Sports_News/2024/07/23/france-Paris-Olympics-preview-comeback/2401721655289/,"Tue, 23 Jul 2024 09:00:07 GMT","Backdrop, debuts, comebacks and legacies make Paris Olympics essential viewing","{'href': 'https://www.upi.com', 'title': 'UPI News'}"
https://news.google.com/rss/search?q=sports+news,"""Arrived in Paris for my last ever tennis tournament,"" Murray wrote on Twitter/X.",https://www.skysports.com/tennis/news/12110/13183611/andy-murray-ready-for-last-ever-tennis-tournament-at-paris-olympics,"Tue, 23 Jul 2024 10:41:15 GMT","""Arrived in Paris for my last ever tennis tournament,"" Murray wrote on Twitter/X.","{'href': 'https://www.skysports.com', 'title': 'Sky Sports'}"
https://news.google.com/rss/search?q=sports+news,"2024 Blue Jays trade deadline preview: Greatest needs, possible targets as Toronto tries to stave off teardown",https://www.cbssports.com/mlb/news/2024-blue-jays-trade-deadline-preview-greatest-needs-possible-targets-as-toronto-tries-to-stave-off-teardown/,"Tue, 23 Jul 2024 13:15:00 GMT","2024 Blue Jays trade deadline preview: Greatest needs, possible targets as Toronto tries to stave off teardown","{'href': 'https://www.cbssports.com', 'title': 'CBS Sports'}"
https://news.google.com/rss/search?q=sports+news,Mikel Arteta gives Arsenal transfer update,https://www.nbcsports.com/soccer/news/mikel-arteta-gives-arsenal-transfer-update,"Tue, 23 Jul 2024 15:07:37 GMT",Mikel Arteta gives Arsenal transfer update,"{'href': 'https://www.nbcsports.com', 'title': 'NBC Sports'}"
https://news.google.com/rss/search?q=sports+news,Who is Patrick Vieira? U.S. men's soccer managerial target would bring legendary history and strong resume,https://www.cbssports.com/soccer/news/who-is-patrick-vieira-u-s-mens-soccer-managerial-target-would-bring-legendary-history-and-strong-resume/,"Tue, 23 Jul 2024 16:13:34 GMT",Who is Patrick Vieira? U.S. men's soccer managerial target would bring legendary history and strong resume,"{'href': 'https://www.cbssports.com', 'title': 'CBS Sports'}"
https://news.google.com/rss/search?q=healthcare+news,Molina Healthcare to Acquire ConnectiCare,https://www.businesswire.com/news/home/20240722169986/en/Molina-Healthcare-to-Acquire-ConnectiCare,"Tue, 23 Jul 2024 13:00:00 GMT",Molina Healthcare to Acquire ConnectiCare,"{'href': 'https://www.businesswire.com', 'title': 'Business Wire'}"
https://news.google.com/rss/search?q=healthcare+news,"HCA Healthcare Jumps Back Into Buy Zone On Earnings, Guidance; Rivals Also Up",https://www.investors.com/news/hca-healthcare-stock-earnings-beat/,"Tue, 23 Jul 2024 13:42:00 GMT","HCA Healthcare Jumps Back Into Buy Zone On Earnings, Guidance; Rivals Also Up","{'href': 'https://www.investors.com', 'title': ""Investor's Business Daily""}"
https://news.google.com/rss/search?q=healthcare+news,HCA Healthcare Stock Jumps After Hospital Chain Beats Expectations,https://www.wsj.com/livecoverage/stock-market-today-earnings-dow-sp500-nasdaq-07-23-2024/card/hca-healthcare-shares-jump-after-hospital-chain-beats-expectations-07S1Yx4cB5ReUUH7ML4S?mod=lctimeline_finance,"Tue, 23 Jul 2024 16:17:00 GMT",HCA Healthcare Stock Jumps After Hospital Chain Beats Expectations,"{'href': 'https://www.wsj.com', 'title': 'The Wall Street Journal'}"
https://news.google.com/rss/search?q=healthcare+news,Steward Health Care to provide update on bankruptcy and sale process,https://www.turnto10.com/news/local/steward-health-care-to-provide-update-on-bankruptcy-and-sale-process,"Tue, 23 Jul 2024 12:19:51 GMT",Steward Health Care to provide update on bankruptcy and sale process,"{'href': 'https://www.turnto10.com', 'title': 'Turn to 10'}"
https://news.google.com/rss/search?q=healthcare+news,4 Habits of Highly Reliable Health Care Organizations,https://www.aha.org/aha-center-health-innovation-market-scan/2024-07-23-4-habits-highly-reliable-health-care-organizations,"Tue, 23 Jul 2024 12:19:56 GMT",4 Habits of Highly Reliable Health Care Organizations,"{'href': 'https://www.aha.org', 'title': 'American Hospital Association'}"
https://news.google.com/rss/search?q=healthcare+news,4 ways to rebrand AI in healthcare,https://www.fastcompany.com/91158955/4-ways-to-rebrand-ai-in-healthcare,"Tue, 23 Jul 2024 09:22:20 GMT",4 ways to rebrand AI in healthcare,"{'href': 'https://www.fastcompany.com', 'title': 'Fast Company'}"
https://news.google.com/rss/search?q=healthcare+news,"Pharmacy group, providers sue Change Healthcare after cyberattack",https://www.healthcaredive.com/news/change-cyberattack-lawsuit-national-community-pharmacists-association/722121/,"Tue, 23 Jul 2024 15:33:41 GMT","Pharmacy group, providers sue Change Healthcare after cyberattack","{'href': 'https://www.healthcaredive.com', 'title': 'Healthcare Dive'}"
https://news.google.com/rss/search?q=healthcare+news,Healthcare stakeholders are mostly optimistic about HTI-2,https://www.healthcareitnews.com/news/healthcare-stakeholders-are-mostly-optimistic-about-hti-2,"Tue, 23 Jul 2024 14:01:48 GMT",Healthcare stakeholders are mostly optimistic about HTI-2,"{'href': 'https://www.healthcareitnews.com', 'title': 'Healthcare IT News'}"
https://news.google.com/rss/search?q=healthcare+news,GE Healthcare nabs AI ultrasound company for $51 million,https://www.healthcarefinancenews.com/news/ge-healthcare-nabs-ai-ultrasound-company-51-million,"Tue, 23 Jul 2024 13:52:13 GMT",GE Healthcare nabs AI ultrasound company for $51 million,"{'href': 'https://www.healthcarefinancenews.com', 'title': 'Healthcare Finance News'}"
https://news.google.com/rss/search?q=healthcare+news,DOL Nabs $35.8 Million for Healthcare Workers Cheated of Wages,https://news.bloomberglaw.com/daily-labor-report/dol-nabs-35-8-million-for-healthcare-workers-cheated-of-wages,"Tue, 23 Jul 2024 17:41:00 GMT",DOL Nabs $35.8 Million for Healthcare Workers Cheated of Wages,"{'href': 'https://news.bloomberglaw.com', 'title': 'Bloomberg Law'}"
https://news.google.com/rss/search?q=healthcare+news,"AMFM Healthcare, Leading Provider in Behavioral Health Services Announces Stephen Ebbett As New Chief Marketing Officer",https://www.prnewswire.com/news-releases/amfm-healthcare-leading-provider-in-behavioral-health-services-announces-stephen-ebbett-as-new-chief-marketing-officer-302204040.html,"Tue, 23 Jul 2024 14:15:00 GMT","AMFM Healthcare, Leading Provider in Behavioral Health Services Announces Stephen Ebbett As New Chief Marketing Officer","{'href': 'https://www.prnewswire.com', 'title': 'PR Newswire'}"
https://news.google.com/rss/search?q=healthcare+news,Digital apps effective stopgap for mental healthcare access challenges,https://mhealthintelligence.com/news/digital-apps-effective-stopgap-for-mental-healthcare-access-challenges,"Tue, 23 Jul 2024 13:00:00 GMT",Digital apps effective stopgap for mental healthcare access challenges,"{'href': 'https://mhealthintelligence.com', 'title': 'mHealthIntelligence.com'}"
https://news.google.com/rss/search?q=healthcare+news,Healthcare cybersecurity risk ‘higher than ever’ due to pandemic,https://www.medicaldevice-network.com/news/healthcare-cybersecurity-risk-higher-than-ever-due-to-pandemic/,"Tue, 23 Jul 2024 14:53:10 GMT",Healthcare cybersecurity risk ‘higher than ever’ due to pandemic,"{'href': 'https://www.medicaldevice-network.com', 'title': 'Medical Device Network'}"
https://news.google.com/rss/search?q=healthcare+news,The imperative of cybersecurity in healthcare: an evolving challenge,https://finance.yahoo.com/news/imperative-cybersecurity-healthcare-evolving-challenge-141341403.html,"Tue, 23 Jul 2024 14:13:41 GMT",The imperative of cybersecurity in healthcare: an evolving challenge,"{'href': 'https://finance.yahoo.com', 'title': 'Yahoo Finance'}"
https://news.google.com/rss/search?q=healthcare+news,Is bankruptcy affecting healthcare at these Miami-area hospitals? Tell us what it’s like,https://www.miamiherald.com/news/health-care/article290203704.html,"Tue, 23 Jul 2024 09:00:00 GMT",Is bankruptcy affecting healthcare at these Miami-area hospitals? Tell us what it’s like,"{'href': 'https://www.miamiherald.com', 'title': 'Miami Herald'}"
https://news.google.com/rss/search?q=healthcare+news,CMS restricts broker access to Healthcare.gov,https://www.healthcarefinancenews.com/news/cms-restricts-broker-access-healthcaregov,"Tue, 23 Jul 2024 15:02:51 GMT",CMS restricts broker access to Healthcare.gov,"{'href': 'https://www.healthcarefinancenews.com', 'title': 'Healthcare Finance News'}"
https://news.google.com/rss/search?q=healthcare+news,What does your CEO need to know about cybersecurity?,https://www.healthcaredive.com/news/ceo-cyber-security-strategy-CISO/721620/,"Tue, 23 Jul 2024 15:25:22 GMT",What does your CEO need to know about cybersecurity?,"{'href': 'https://www.healthcaredive.com', 'title': 'Healthcare Dive'}"
https://news.google.com/rss/search?q=healthcare+news,Providence developing AI tools designed to reduce clinician burnout,https://www.healthcareitnews.com/news/providence-developing-ai-tools-designed-reduce-clinician-burnout,"Tue, 23 Jul 2024 17:14:56 GMT",Providence developing AI tools designed to reduce clinician burnout,"{'href': 'https://www.healthcareitnews.com', 'title': 'Healthcare IT News'}"
https://news.google.com/rss/search?q=healthcare+news,39 healthcare providers sue UnitedHealth Group over Change cyberattack,https://www.healthcarefinancenews.com/news/39-healthcare-providers-sue-unitedhealth-group-over-change-cyberattack,"Tue, 23 Jul 2024 15:52:13 GMT",39 healthcare providers sue UnitedHealth Group over Change cyberattack,"{'href': 'https://www.healthcarefinancenews.com', 'title': 'Healthcare Finance News'}"
https://news.google.com/rss/search?q=healthcare+news,'Wellness West' connecting Chicago communities to aid positive health care,https://abc7chicago.com/post/wellness-west-connecting-chicago-communities-aid-positive-health/15085101/,"Tue, 23 Jul 2024 13:55:19 GMT",'Wellness West' connecting Chicago communities to aid positive health care,"{'href': 'https://abc7chicago.com', 'title': 'WLS-TV'}"
https://news.google.com/rss/search?q=healthcare+news,HCA Healthcare (HCA) Surpasses Q2 Earnings and Revenue Estimates,https://finance.yahoo.com/news/hca-healthcare-hca-surpasses-q2-124004001.html,"Tue, 23 Jul 2024 12:40:04 GMT",HCA Healthcare (HCA) Surpasses Q2 Earnings and Revenue Estimates,"{'href': 'https://finance.yahoo.com', 'title': 'Yahoo Finance'}"
https://news.google.com/rss/search?q=healthcare+news,Knowtion Health Survey: Healthcare Leaders Have Low Confidence in Denials Efforts,https://www.prnewswire.com/news-releases/knowtion-health-survey-healthcare-leaders-have-low-confidence-in-denials-efforts-302203829.html,"Tue, 23 Jul 2024 12:53:00 GMT",Knowtion Health Survey: Healthcare Leaders Have Low Confidence in Denials Efforts,"{'href': 'https://www.prnewswire.com', 'title': 'PR Newswire'}"
https://news.google.com/rss/search?q=healthcare+news,DaVita paying $34 million over kickback allegations,https://www.healthcarefinancenews.com/news/davita-paying-34-million-over-kickback-allegations,"Tue, 23 Jul 2024 14:12:13 GMT",DaVita paying $34 million over kickback allegations,"{'href': 'https://www.healthcarefinancenews.com', 'title': 'Healthcare Finance News'}"
https://news.google.com/rss/search?q=healthcare+news,"Cross Country Healthcare, Inc.'s (NASDAQ:CCRN) Fundamentals Look Pretty Strong: Could The Market Be Wrong About The Stock?",https://finance.yahoo.com/news/cross-country-healthcare-inc-nasdaq-153523458.html,"Tue, 23 Jul 2024 15:35:23 GMT","Cross Country Healthcare, Inc.'s (NASDAQ:CCRN) Fundamentals Look Pretty Strong: Could The Market Be Wrong About The Stock?","{'href': 'https://finance.yahoo.com', 'title': 'Yahoo Finance'}"
https://news.google.com/rss/search?q=healthcare+news,Tealium for Healthcare enables enterprises to establish digital trust with patients and physicians,https://finance.yahoo.com/news/tealium-healthcare-enables-enterprises-establish-130000965.html,"Tue, 23 Jul 2024 13:00:00 GMT",Tealium for Healthcare enables enterprises to establish digital trust with patients and physicians,"{'href': 'https://finance.yahoo.com', 'title': 'Yahoo Finance'}"
https://news.google.com/rss/search?q=healthcare+news,"Innovative Health, MC Healthcare Enter Agreement to Promote Reprocessing and the Environment",https://www.mpo-mag.com/contents/view_breaking-news/2024-07-23/innovative-health-and-mc-healthcare-enters-agreement-to-promote-reprocessing-and-the-environment/,"Tue, 23 Jul 2024 15:36:52 GMT","Innovative Health, MC Healthcare Enter Agreement to Promote Reprocessing and the Environment","{'href': 'https://www.mpo-mag.com', 'title': 'MPO-mag'}"
https://news.google.com/rss/search?q=healthcare+news,"Owens & Minor, Inc. Signs Definitive Agreement to Acquire Rotech Healthcare Holdings, Inc. for $1.36 Billion in Cash",https://www.businesswire.com/news/home/20240723005812/en/Owens-Minor-Inc.-Signs-Definitive-Agreement-to-Acquire-Rotech-Healthcare-Holdings-Inc.-for-1.36-Billion-in-Cash,"Tue, 23 Jul 2024 10:30:00 GMT","Owens & Minor, Inc. Signs Definitive Agreement to Acquire Rotech Healthcare Holdings, Inc. for $1.36 Billion in Cash","{'href': 'https://www.businesswire.com', 'title': 'Business Wire'}"
https://news.google.com/rss/search?q=healthcare+news,"Abridge partners with Epic, Mayo Clinic to create a genAI nurse workflow tool",https://www.mobihealthnews.com/news/abridge-partners-epic-mayo-clinic-create-genai-nurse-workflow-tool,"Tue, 23 Jul 2024 17:15:01 GMT","Abridge partners with Epic, Mayo Clinic to create a genAI nurse workflow tool","{'href': 'https://www.mobihealthnews.com', 'title': 'Mobihealth News'}"
https://news.google.com/rss/search?q=healthcare+news,What Is the Best Temperature to Sleep In?,https://hartfordhealthcare.org/about-us/news-press/news-detail?articleid=57490&publicId=395,"Tue, 23 Jul 2024 16:01:46 GMT",What Is the Best Temperature to Sleep In?,"{'href': 'https://hartfordhealthcare.org', 'title': 'Hartford HealthCare'}"
https://news.google.com/rss/search?q=healthcare+news,HealthStream Announces Second Quarter 2024 Results,https://southfloridahospitalnews.com/healthstream-announces-second-quarter-2024-results/,"Tue, 23 Jul 2024 13:00:00 GMT",HealthStream Announces Second Quarter 2024 Results,"{'href': 'https://southfloridahospitalnews.com', 'title': 'South Florida Hospital News'}"
https://news.google.com/rss/search?q=healthcare+news,"More Vermont towns are turning to community nurses, offering free health care",https://www.vermontpublic.org/local-news/2024-07-23/more-vermont-towns-are-turning-to-community-nurses-offering-free-health-care,"Tue, 23 Jul 2024 09:00:00 GMT","More Vermont towns are turning to community nurses, offering free health care","{'href': 'https://www.vermontpublic.org', 'title': 'Vermont Public'}"
https://news.google.com/rss/search?q=healthcare+news,Watchdog warns of nursing gap at Good Sam as Brockton Hospital reopens. Impact on patients,https://www.enterprisenews.com/story/news/healthcare/2024/07/23/brockton-good-samaritan-medical-center-hospital-steward-health-care-bankruptcy-safety/74509740007/,"Tue, 23 Jul 2024 16:20:25 GMT",Watchdog warns of nursing gap at Good Sam as Brockton Hospital reopens. Impact on patients,"{'href': 'https://www.enterprisenews.com', 'title': 'Enterprise News'}"
https://news.google.com/rss/search?q=healthcare+news,Cigna targeting disparities with health equity impact fund,https://www.healthcarefinancenews.com/news/cigna-targeting-disparities-health-equity-impact-fund,"Tue, 23 Jul 2024 15:07:13 GMT",Cigna targeting disparities with health equity impact fund,"{'href': 'https://www.healthcarefinancenews.com', 'title': 'Healthcare Finance News'}"
