Input URL,Title,Link,Published,Description,Source
https://news.google.com/rss/search?q=world+news,World leaders react to Biden’s decision not to run for re-election,https://www.nbcnews.com/now/video/world-leaders-react-to-biden-s-decision-not-to-run-for-re-election-215370821717,"Mon, 22 Jul 2024 12:29:08 GMT",World leaders react to Biden’s decision not to run for re-election,"{'href': 'https://www.nbcnews.com', 'title': 'NBC News'}"
https://news.google.com/rss/search?q=world+news,"Harris candidacy: The possible benefits, the potential risks",https://www.hindustantimes.com/world-news/harris-candidacy-the-possible-benefits-the-potential-risks-101721664976485.html,"Mon, 22 Jul 2024 16:16:16 GMT","Harris candidacy: The possible benefits, the potential risks","{'href': 'https://www.hindustantimes.com', 'title': 'Hindustan Times'}"
https://news.google.com/rss/search?q=world+news,Harris calls Biden's record 'unmatched' as she launches her presidential campaign,https://www.reuters.com/world/us/backed-by-biden-harris-scrambles-lock-up-white-house-bid-2024-07-22/,"Mon, 22 Jul 2024 17:02:00 GMT",Harris calls Biden's record 'unmatched' as she launches her presidential campaign,"{'href': 'https://www.reuters.com', 'title': 'Reuters'}"
https://news.google.com/rss/search?q=world+news,Ukraine says struck preliminary deal to restructure $20 bn debt,https://www.hindustantimes.com/world-news/ukraine-says-struck-preliminary-deal-to-restructure-20-bn-debt-101721673151241.html,"Mon, 22 Jul 2024 18:32:30 GMT",Ukraine says struck preliminary deal to restructure $20 bn debt,"{'href': 'https://www.hindustantimes.com', 'title': 'Hindustan Times'}"
https://news.google.com/rss/search?q=world+news,Internet is still down in Bangladesh despite apparent calm following deadly protests,https://apnews.com/article/bangladesh-campus-violence-quota-hasina-3f9a3903487e89f1a0bc0d596d91b89b,"Mon, 22 Jul 2024 12:17:00 GMT",Internet is still down in Bangladesh despite apparent calm following deadly protests,"{'href': 'https://apnews.com', 'title': 'The Associated Press'}"
https://news.google.com/rss/search?q=world+news,Richest athletes in the world 2024,https://timesofindia.indiatimes.com/world/richest-athletes-in-the-world-2024/articleshow/111930809.cms,"Mon, 22 Jul 2024 12:05:00 GMT",Richest athletes in the world 2024,"{'href': 'https://timesofindia.indiatimes.com', 'title': 'The Times of India'}"
https://news.google.com/rss/search?q=world+news,Teenager dies after being hit by lightning on Zugspitze mountain,https://metro.co.uk/2024/07/22/teenager-dies-hit-lightning-zugspitze-mountain-21272246/,"Mon, 22 Jul 2024 11:16:00 GMT",Teenager dies after being hit by lightning on Zugspitze mountain,"{'href': 'https://metro.co.uk', 'title': 'Metro.co.uk'}"
https://news.google.com/rss/search?q=world+news,"Diver turns up £100,000 treasure while exploring ancient sunken shipwreck",https://www.mirror.co.uk/news/world-news/diver-turns-up-100000-treasure-33294029,"Mon, 22 Jul 2024 08:23:00 GMT","Diver turns up £100,000 treasure while exploring ancient sunken shipwreck","{'href': 'https://www.mirror.co.uk', 'title': 'The Mirror'}"
https://news.google.com/rss/search?q=world+news,HIV and AIDS,https://www.who.int/news-room/fact-sheets/detail/hiv-aids,"Mon, 22 Jul 2024 16:31:55 GMT",HIV and AIDS,"{'href': 'https://www.who.int', 'title': 'World Health Organization (WHO)'}"
https://news.google.com/rss/search?q=world+news,Middle East and north Africa,https://www.theguardian.com/world/middleeast,"Mon, 22 Jul 2024 17:42:47 GMT",Middle East and north Africa,"{'href': 'https://www.theguardian.com', 'title': 'The Guardian'}"
https://news.google.com/rss/search?q=world+news,Global leaders react to Biden's historic decision to drop his re-election bid,https://www.nbcnews.com/news/world/joe-biden-drop-out-presidential-race-world-leaders-rcna162993,"Mon, 22 Jul 2024 13:15:03 GMT",Global leaders react to Biden's historic decision to drop his re-election bid,"{'href': 'https://www.nbcnews.com', 'title': 'NBC News'}"
https://news.google.com/rss/search?q=world+news,Man Dies After Being Struck by Lightning on Germany's Highest Peak,https://www.usnews.com/news/world/articles/2024-07-22/man-dies-after-being-struck-by-lightning-on-germanys-highest-peak,"Mon, 22 Jul 2024 09:19:50 GMT",Man Dies After Being Struck by Lightning on Germany's Highest Peak,"{'href': 'https://www.usnews.com', 'title': 'U.S. News & World Report'}"
https://news.google.com/rss/search?q=world+news,IndyCar: Multi-car crash sends vehicles flying through the air,https://news.sky.com/video/indycar-multi-car-crash-sends-vehicles-flying-through-the-air-13183261,"Mon, 22 Jul 2024 11:33:18 GMT",IndyCar: Multi-car crash sends vehicles flying through the air,"{'href': 'https://news.sky.com', 'title': 'Sky News'}"
https://news.google.com/rss/search?q=world+news,Hezbollah is prepared for a war,https://news.sky.com/story/uptick-in-tit-for-tat-attacks-on-israel-lebanon-border-and-theyre-becoming-more-deadly-13181934,"Mon, 22 Jul 2024 18:10:02 GMT",Hezbollah is prepared for a war - and is changing its tactics against Israel amid global alarm,"{'href': 'https://news.sky.com', 'title': 'Sky News'}"
https://news.google.com/rss/search?q=world+news,Teenager killed by lightning strike on Germany's highest mountain,https://news.sky.com/story/teenager-killed-by-lightning-strike-on-germanys-highest-mountain-13183329,"Mon, 22 Jul 2024 14:48:33 GMT",Teenager killed by lightning strike on Germany's highest mountain,"{'href': 'https://news.sky.com', 'title': 'Sky News'}"
https://news.google.com/rss/search?q=world+news,Exiled pro-democracy Hong Kong activists blocked from accessing pensions,https://www.theguardian.com/world/article/2024/jul/22/exiled-pro-democracy-hong-kong-activists-blocked-from-accessing-pensions,"Mon, 22 Jul 2024 16:00:00 GMT",Exiled pro-democracy Hong Kong activists blocked from accessing pensions,"{'href': 'https://www.theguardian.com', 'title': 'The Guardian'}"
https://news.google.com/rss/search?q=world+news,Aviation trade show opens as firms face production woes,https://www.hindustantimes.com/world-news/aviation-trade-show-opens-as-firms-face-production-woes-101721642602986.html,"Mon, 22 Jul 2024 10:03:22 GMT",Aviation trade show opens as firms face production woes,"{'href': 'https://www.hindustantimes.com', 'title': 'Hindustan Times'}"
https://news.google.com/rss/search?q=world+news,"Updates: Kamala Harris Praises Biden's ""Selfless"" Act In Dropping Re-Election Bid",https://www.ndtv.com/world-news/live-updates-joe-biden-withdraws-from-us-presidential-race-6156785,"Mon, 22 Jul 2024 07:37:53 GMT","Updates: Kamala Harris Praises Biden's ""Selfless"" Act In Dropping Re-Election Bid","{'href': 'https://www.ndtv.com', 'title': 'NDTV'}"
https://news.google.com/rss/search?q=world+news,Harris vs Trump: First poll after Biden's exit shows majority agree with his decision to step down,https://www.hindustantimes.com/world-news/us-news/harris-vs-trump-first-poll-after-bidens-exit-shows-majority-agree-with-his-decision-to-step-down-101721664447937.html,"Mon, 22 Jul 2024 16:55:05 GMT",Harris vs Trump: First poll after Biden's exit shows majority agree with his decision to step down,"{'href': 'https://www.hindustantimes.com', 'title': 'Hindustan Times'}"
https://news.google.com/rss/search?q=world+news,Afghanistan has massive opium stockpiles despite Taliban ban: UN report,https://www.hindustantimes.com/world-news/afghanistan-has-massive-opium-stockpiles-despite-taliban-ban-un-report-101721642014685.html,"Mon, 22 Jul 2024 09:53:34 GMT",Afghanistan has massive opium stockpiles despite Taliban ban: UN report,"{'href': 'https://www.hindustantimes.com', 'title': 'Hindustan Times'}"
https://news.google.com/rss/search?q=world+news,Bangladesh protests pause after top court scraps job quotas,https://www.hindustantimes.com/world-news/bangladesh-students-to-keep-up-protests-despite-scrapping-of-most-quotas-101721637068148.html,"Mon, 22 Jul 2024 11:36:19 GMT",Bangladesh protests pause after top court scraps job quotas,"{'href': 'https://www.hindustantimes.com', 'title': 'Hindustan Times'}"
https://news.google.com/rss/search?q=world+news,"In Sudan, Women Forced To Line Up For Sex With Soldiers For Food: Report",https://www.ndtv.com/world-news/in-sudan-women-forced-to-line-up-for-sex-with-soldiers-for-food-report-6159929,"Mon, 22 Jul 2024 07:20:18 GMT","In Sudan, Women Forced To Line Up For Sex With Soldiers For Food: Report","{'href': 'https://www.ndtv.com', 'title': 'NDTV'}"
https://news.google.com/rss/search?q=world+news,57 Bangladeshis Jailed For Protesting In UAE: Report,https://www.ndtv.com/world-news/57-bangladeshis-jailed-for-protesting-in-uae-report-6163138,"Mon, 22 Jul 2024 14:04:59 GMT",57 Bangladeshis Jailed For Protesting In UAE: Report,"{'href': 'https://www.ndtv.com', 'title': 'NDTV'}"
https://news.google.com/rss/search?q=world+news,Chinese social media embraces Trump after Kamala Harris steps into race,https://www.business-standard.com/world-news/chinese-social-media-embraces-trump-after-kamala-harris-steps-into-race-124072200453_1.html,"Mon, 22 Jul 2024 07:11:48 GMT",Chinese social media embraces Trump after Kamala Harris steps into race,"{'href': 'https://www.business-standard.com', 'title': 'Business Standard'}"
https://news.google.com/rss/search?q=us+national+news,"Democrats promise an 'orderly process' to replace Biden. Harris is favored, but questions remain",https://apnews.com/article/biden-harris-dnc-next-steps-2024-election-13bbcca73ca682f16284cf8874011dfa,"Mon, 22 Jul 2024 15:02:00 GMT","Democrats promise an 'orderly process' to replace Biden. Harris is favored, but questions remain","{'href': 'https://apnews.com', 'title': 'The Associated Press'}"
https://news.google.com/rss/search?q=us+national+news,Who could replace Joe Biden as the 2024 Democratic nominee?,https://www.cbsnews.com/news/who-could-replace-joe-biden/,"Mon, 22 Jul 2024 15:43:12 GMT",Who could replace Joe Biden as the 2024 Democratic nominee?,"{'href': 'https://www.cbsnews.com', 'title': 'CBS News'}"
https://news.google.com/rss/search?q=us+national+news,When is the DNC? Here's what to know about 2024 convention after Biden drops out of race,https://www.usatoday.com/story/news/politics/elections/2024/07/21/when-is-dnc-convention-chicago-2024/74491378007/,"Mon, 22 Jul 2024 13:07:30 GMT",When is the DNC? Here's what to know about 2024 convention after Biden drops out of race,"{'href': 'https://www.usatoday.com', 'title': 'USA TODAY'}"
https://news.google.com/rss/search?q=us+national+news,US ambassador visits Haiti to meet new leaders and Kenyan police helping to curb gang violence,https://abcnews.go.com/US/wireStory/us-ambassador-visits-haiti-meet-new-leaders-kenyan-112164248,"Mon, 22 Jul 2024 15:15:38 GMT",US ambassador visits Haiti to meet new leaders and Kenyan police helping to curb gang violence,"{'href': 'https://abcnews.go.com', 'title': 'ABC News'}"
https://news.google.com/rss/search?q=us+national+news,Harris calls Biden's record 'unmatched' as she launches her presidential campaign,https://www.reuters.com/world/us/backed-by-biden-harris-scrambles-lock-up-white-house-bid-2024-07-22/,"Mon, 22 Jul 2024 17:02:00 GMT",Harris calls Biden's record 'unmatched' as she launches her presidential campaign,"{'href': 'https://www.reuters.com', 'title': 'Reuters'}"
https://news.google.com/rss/search?q=us+national+news,The Democrats who could be Kamala Harris' running mate,https://www.nbcnews.com/politics/2024-election/kamala-harris-running-mates-democratic-presidential-ticket-rcna162848,"Mon, 22 Jul 2024 18:40:00 GMT",The Democrats who could be Kamala Harris' running mate,"{'href': 'https://www.nbcnews.com', 'title': 'NBC News'}"
https://news.google.com/rss/search?q=us+national+news,Most airlines except one are recovering from the CrowdStrike tech outage. The feds have noticed,https://abcnews.go.com/US/wireStory/air-travel-delays-continue-airlines-recovered-global-tech-112160245,"Mon, 22 Jul 2024 15:56:15 GMT",Most airlines except one are recovering from the CrowdStrike tech outage. The feds have noticed,"{'href': 'https://abcnews.go.com', 'title': 'ABC News'}"
https://news.google.com/rss/search?q=us+national+news,Russia sentences U.S. dual national journalist Alsu Kurmasheva to prison for reporting amid Ukraine war,https://www.cbsnews.com/news/russia-us-journalist-alsu-kurmasheva-prison-sentence-ukraine-war/,"Mon, 22 Jul 2024 14:49:40 GMT",Russia sentences U.S. dual national journalist Alsu Kurmasheva to prison for reporting amid Ukraine war,"{'href': 'https://www.cbsnews.com', 'title': 'CBS News'}"
https://news.google.com/rss/search?q=us+national+news,J.D. Vance’s Anti-Women Policies Take on New Significance if Harris Tops the Ticket,https://www.usnews.com/news/national-news/articles/2024-07-22/j-d-vances-anti-women-policies-take-on-new-significance-if-harris-tops-the-ticket,"Mon, 22 Jul 2024 15:16:51 GMT",J.D. Vance’s Anti-Women Policies Take on New Significance if Harris Tops the Ticket | National News | U.S. News,"{'href': 'https://www.usnews.com', 'title': 'U.S. News & World Report'}"
https://news.google.com/rss/search?q=us+national+news,"Kamala Harris, Once Biden’s Voice on Abortion, Would Take an Outspoken Approach to Health",https://www.usnews.com/news/national-news/articles/2024-07-22/kamala-harris-once-bidens-voice-on-abortion-would-take-an-outspoken-approach-to-health,"Mon, 22 Jul 2024 15:06:17 GMT","Kamala Harris, Once Biden’s Voice on Abortion, Would Take an Outspoken Approach to Health","{'href': 'https://www.usnews.com', 'title': 'U.S. News & World Report'}"
https://news.google.com/rss/search?q=us+national+news,"Team USA's loss to Team WNBA sparks 'déjà vu,' but Olympic team isn't panicking",https://www.usatoday.com/story/sports/olympics/2024/07/21/team-usa-lose-team-wnba-all-star-weekend/74487504007/,"Mon, 22 Jul 2024 18:16:28 GMT","Team USA's loss to Team WNBA sparks 'déjà vu,' but Olympic team isn't panicking","{'href': 'https://www.usatoday.com', 'title': 'USA TODAY'}"
https://news.google.com/rss/search?q=us+national+news,Will Kamala Harris win 2024 US election? Poll predictor Allan Lichtman assesses the race,https://www.thenationalnews.com/future/technology/2024/07/22/will-kamala-harris-win-2024-us-election-poll-predictor-allan-lichtman-assesses-the-race/,"Mon, 22 Jul 2024 07:55:24 GMT",Will Kamala Harris win 2024 US election? Poll predictor Allan Lichtman assesses the race,"{'href': 'https://www.thenationalnews.com', 'title': 'The National'}"
https://news.google.com/rss/search?q=business+news,There's finally an opening date for new Costco in Covington. Here's what to know.,https://www.nola.com/news/business/costcos-covington-store-set-to-open-aug-28/article_dc9c5674-4850-11ef-9087-8b0e9dd2b356.html,"Mon, 22 Jul 2024 18:09:00 GMT",There's finally an opening date for new Costco in Covington. Here's what to know.,"{'href': 'https://www.nola.com', 'title': 'NOLA.com'}"
https://news.google.com/rss/search?q=business+news,McDonald’s to extend $5 value meal in most U.S. markets as diners return to restaurants,https://www.cnbc.com/2024/07/22/mcdonalds-to-extend-5-value-meal-in-most-markets.html,"Mon, 22 Jul 2024 14:44:37 GMT",McDonald’s to extend $5 value meal in most U.S. markets as diners return to restaurants,"{'href': 'https://www.cnbc.com', 'title': 'CNBC'}"
https://news.google.com/rss/search?q=business+news,"Exclusive: Buyout firm L Catterton approaches Mattel with acquisition offer, sources say",https://www.reuters.com/markets/deals/buyout-firm-l-catterton-approaches-mattel-with-acquisition-offer-sources-say-2024-07-22/,"Mon, 22 Jul 2024 17:53:00 GMT","Exclusive: Buyout firm L Catterton approaches Mattel with acquisition offer, sources say","{'href': 'https://www.reuters.com', 'title': 'Reuters'}"
https://news.google.com/rss/search?q=business+news,"A tale of 2 malls, music venue could be denied and more Jackson County business news",https://www.mlive.com/news/jackson/2024/07/a-tale-of-2-malls-music-venue-could-be-denied-and-more-jackson-county-business-news.html,"Mon, 22 Jul 2024 14:33:00 GMT","A tale of 2 malls, music venue could be denied and more Jackson County business news","{'href': 'https://www.mlive.com', 'title': 'MLive.com'}"
https://news.google.com/rss/search?q=business+news,Brewing Up a Business,https://www.theintermountain.com/news/local-news/2024/07/brewing-up-a-business/,"Mon, 22 Jul 2024 07:30:40 GMT",Brewing Up a Business,"{'href': 'https://www.theintermountain.com', 'title': 'The Inter-Mountain'}"
https://news.google.com/rss/search?q=business+news,Why Delta is still canceling flights as other airlines return to normal,https://www.cnn.com/2024/07/22/business/delta-canceled-flights-computer-problems/index.html,"Mon, 22 Jul 2024 16:36:18 GMT",Why Delta is still canceling flights as other airlines return to normal,"{'href': 'https://www.cnn.com', 'title': 'CNN'}"
https://news.google.com/rss/search?q=business+news,Kraft Heinz taps PepsiCo exec as CMO,https://www.foodbusinessnews.net/articles/26456-kraft-heinz-taps-pepsico-exec-as-cmo,"Mon, 22 Jul 2024 13:50:15 GMT",Kraft Heinz taps PepsiCo exec as CMO,"{'href': 'https://www.foodbusinessnews.net', 'title': 'Food Business News'}"
https://news.google.com/rss/search?q=business+news,Investment advisor with Melville office launches trust company,https://libn.com/2024/07/22/investment-advisor-with-melville-office-launches-trust-company/,"Mon, 22 Jul 2024 14:46:50 GMT",Investment advisor with Melville office launches trust company,"{'href': 'https://libn.com', 'title': 'Long Island Business News'}"
https://news.google.com/rss/search?q=business+news,Amazon Buys ‘The Rings of Power’ Studio Bray Near London as U.K. “Creative Home”,https://www.hollywoodreporter.com/business/business-news/amazon-mgm-studios-bray-the-rings-of-power-1235945982/,"Mon, 22 Jul 2024 13:27:49 GMT",Amazon Buys ‘The Rings of Power’ Studio Bray Near London as U.K. “Creative Home”,"{'href': 'https://www.hollywoodreporter.com', 'title': 'Hollywood Reporter'}"
https://news.google.com/rss/search?q=business+news,"Hoosier business group, companies continue DEI work as efforts elsewhere falter",https://www.wthitv.com/news/hoosier-business-group-companies-continue-dei-work-as-efforts-elsewhere-falter/article_1105f22e-483a-11ef-8e7d-7793e1f15d73.html,"Mon, 22 Jul 2024 14:52:00 GMT","Hoosier business group, companies continue DEI work as efforts elsewhere falter","{'href': 'https://www.wthitv.com', 'title': 'WTHITV.com'}"
https://news.google.com/rss/search?q=business+news,Hollywood’s Paramount rule,https://www.livemint.com/companies/hollywoods-paramount-rule-11721650318137.html,"Mon, 22 Jul 2024 12:19:25 GMT",Hollywood’s Paramount rule | Company Business News,"{'href': 'https://www.livemint.com', 'title': 'Mint'}"
https://news.google.com/rss/search?q=business+news,Give ‘Em the Business,https://www.newsradioklbj.com/business-news/give-em-the-business-7-19-texas-employment-rate-increase-and-ut-secures-grant/,"Mon, 22 Jul 2024 14:39:44 GMT",Give ‘Em the Business | 7-19 Texas Employment Rate Increase And UT Secures Grant,"{'href': 'https://www.newsradioklbj.com', 'title': 'newsradioklbj.com'}"
https://news.google.com/rss/search?q=business+news,Rich Products to shutter manufacturing facility,https://www.foodbusinessnews.net/articles/26458-rich-products-to-shutter-manufacturing-facility,"Mon, 22 Jul 2024 15:04:36 GMT",Rich Products to shutter manufacturing facility,"{'href': 'https://www.foodbusinessnews.net', 'title': 'Food Business News'}"
https://news.google.com/rss/search?q=business+news,Vivendi Eyes Canal+ Stock Market Listing in London as Part of Split Into Four Companies,https://www.hollywoodreporter.com/business/business-news/vivendi-split-canal-plus-london-stock-listing-1235954228/,"Mon, 22 Jul 2024 07:26:36 GMT",Vivendi Eyes Canal+ Stock Market Listing in London as Part of Split Into Four Companies,"{'href': 'https://www.hollywoodreporter.com', 'title': 'Hollywood Reporter'}"
https://news.google.com/rss/search?q=business+news,Insomnia Cookies acquired by private equity partnership,https://www.foodbusinessnews.net/articles/26452-insomnia-cookies-acquired-by-private-equity-partnership,"Mon, 22 Jul 2024 11:18:07 GMT",Insomnia Cookies acquired by private equity partnership,"{'href': 'https://www.foodbusinessnews.net', 'title': 'Food Business News'}"
https://news.google.com/rss/search?q=business+news,"Domino’s reports rise in net income, revenues",https://www.foodbusinessnews.net/articles/26453-dominos-reports-rise-in-net-income-revenues,"Mon, 22 Jul 2024 11:22:13 GMT","Domino’s reports rise in net income, revenues","{'href': 'https://www.foodbusinessnews.net', 'title': 'Food Business News'}"
https://news.google.com/rss/search?q=business+news,Chicken chain Zaxbys debuts retail sauce line,https://www.foodbusinessnews.net/articles/26454-chicken-chain-zaxbys-debuts-retail-sauce-line,"Mon, 22 Jul 2024 13:32:02 GMT",Chicken chain Zaxbys debuts retail sauce line,"{'href': 'https://www.foodbusinessnews.net', 'title': 'Food Business News'}"
https://news.google.com/rss/search?q=business+news,Company news: Dr. Zerah Z. Ali joins Syracuse Orthopedic Specialists,https://www.syracuse.com/business/2024/07/company-news-dr-zerah-z-ali-joins-syracuse-orthopedic-specialists.html,"Mon, 22 Jul 2024 09:41:00 GMT",Company news: Dr. Zerah Z. Ali joins Syracuse Orthopedic Specialists,"{'href': 'https://www.syracuse.com', 'title': 'syracuse.com'}"
https://news.google.com/rss/search?q=business+news,UConn student starts mobile car detailing business,https://www.thechronicle.com/news/uconn-student-starts-mobile-car-detailing-business/article_f617f2ee-4633-11ef-aad7-2bc8e399067e.html,"Mon, 22 Jul 2024 10:00:00 GMT",UConn student starts mobile car detailing business,"{'href': 'https://www.thechronicle.com', 'title': 'thechronicle.com'}"
https://news.google.com/rss/search?q=business+news,BT fined millions for failing to connect 999 calls,https://www.bbc.com/news/articles/cjr4zkq1kkwo,"Mon, 22 Jul 2024 09:20:25 GMT",BT fined millions for failing to connect 999 calls,"{'href': 'https://www.bbc.com', 'title': 'BBC.com'}"
https://news.google.com/rss/search?q=business+news,Pharmaceutical Industry Chief Kåre Schultz Joins Hims & Hers Board,https://www.businesswire.com/news/home/20240722754740/en/Pharmaceutical-Industry-Chief-K%C3%A5re-Schultz-Joins-Hims-Hers-Board,"Mon, 22 Jul 2024 09:00:00 GMT",Pharmaceutical Industry Chief Kåre Schultz Joins Hims & Hers Board,"{'href': 'https://www.businesswire.com', 'title': 'Business Wire'}"
https://news.google.com/rss/search?q=science+news,A planet needs to start with a lot of water to become like Earth,https://www.sciencenews.org/article/earthlike-planets-need-lot-water,"Mon, 22 Jul 2024 13:00:00 GMT",A planet needs to start with a lot of water to become like Earth,"{'href': 'https://www.sciencenews.org', 'title': 'Science News Magazine'}"
https://news.google.com/rss/search?q=science+news,"In a seafloor surprise, metal-rich chunks may generate deep-sea oxygen",https://www.sciencenews.org/article/seafloor-metal-nodules-deep-sea-oxygen,"Mon, 22 Jul 2024 15:00:00 GMT","In a seafloor surprise, metal-rich chunks may generate deep-sea oxygen","{'href': 'https://www.sciencenews.org', 'title': 'Science News Magazine'}"
https://news.google.com/rss/search?q=science+news,See the Perseid Meteor Shower and Watch Tornado Hunters on the Big Screen,https://www.scientificamerican.com/podcast/episode/windows-down-twisters-on-the-big-screen-and-covids-summer-surge/,"Mon, 22 Jul 2024 10:02:56 GMT",See the Perseid Meteor Shower and Watch Tornado Hunters on the Big Screen,"{'href': 'https://www.scientificamerican.com', 'title': 'Scientific American'}"
https://news.google.com/rss/search?q=science+news,The remarkable science-backed ways to get fit as fast as possible,https://www.newscientist.com/article/2440422-the-remarkable-science-backed-ways-to-get-fit-as-fast-as-possible/,"Mon, 22 Jul 2024 15:00:14 GMT",The remarkable science-backed ways to get fit as fast as possible,"{'href': 'https://www.newscientist.com', 'title': 'New Scientist'}"
https://news.google.com/rss/search?q=science+news,LGBTQIA+ Representation in Science Video,https://www.technologynetworks.com/tn/videos/lgbtqia-representation-in-science-388911,"Mon, 22 Jul 2024 07:00:00 GMT",LGBTQIA+ Representation in Science Video,"{'href': 'https://www.technologynetworks.com', 'title': 'Technology Networks'}"
https://news.google.com/rss/search?q=science+news,NASA News: Curiosity makes ‘strangest’ and ‘most unexpected’ discovery on Planet Mars; scientists call it ‘mind-blowing’,https://www.livemint.com/science/news/nasa-news-curiosity-makes-strangest-and-most-unexpected-discovery-on-planet-mars-scientists-call-it-mindblowing-11721632838322.html,"Mon, 22 Jul 2024 07:29:12 GMT",NASA News: Curiosity makes ‘strangest’ and ‘most unexpected’ discovery on Planet Mars; scientists call it ‘mind-blowing’ | Mint,"{'href': 'https://www.livemint.com', 'title': 'Mint'}"
https://news.google.com/rss/search?q=science+news,Joe Biden deepfake shared after US election withdrawal,https://nz.news.yahoo.com/joe-biden-deepfake-shared-us-142346977.html,"Mon, 22 Jul 2024 08:35:24 GMT",Joe Biden deepfake shared after US election withdrawal - Tech & Science Daily podcast,"{'href': 'https://nz.news.yahoo.com', 'title': 'Yahoo New Zealand News'}"
https://news.google.com/rss/search?q=technology+news,Most airlines except one are recovering from the CrowdStrike tech outage. The feds have noticed,https://abcnews.go.com/US/wireStory/air-travel-delays-continue-airlines-recovered-global-tech-112160245,"Mon, 22 Jul 2024 15:56:15 GMT",Most airlines except one are recovering from the CrowdStrike tech outage. The feds have noticed,"{'href': 'https://abcnews.go.com', 'title': 'ABC News'}"
