Input URL,Title,Link,Published,Description,Source
https://news.google.com/rss/search?q=sports+news,Monumental Sports & Entertainment Presents Inaugural Capital Hockey Classic at Capital One Arena,https://www.nhl.com/capitals/news/monumental-sports-entertainment-presents-inaugural-capital-hockey-classic-at-capital-one-arena,"Mon, 22 Jul 2024 14:55:16 GMT",Monumental Sports & Entertainment Presents Inaugural Capital Hockey Classic at Capital One Arena,"{'href': 'https://www.nhl.com', 'title': 'NHL.com'}"
https://news.google.com/rss/search?q=sports+news,1 Fantasy football footnote for every NFL South team,https://sports.yahoo.com/1-fantasy-football-footnote-for-every-nfl-south-team-162636664.html,"Mon, 22 Jul 2024 16:26:36 GMT",1 Fantasy football footnote for every NFL South team,"{'href': 'https://sports.yahoo.com', 'title': 'Yahoo Sports'}"
https://news.google.com/rss/search?q=sports+news,EA Sports College Football 25: Simulation of the 2024 season,https://www.dallasnews.com/sports/texas-longhorns/2024/07/22/ea-sports-ncaa-college-football-25-simulation-2024-season/,"Mon, 22 Jul 2024 14:01:05 GMT",EA Sports College Football 25: Simulation of the 2024 season,"{'href': 'https://www.dallasnews.com', 'title': 'The Dallas Morning News'}"
https://news.google.com/rss/search?q=sports+news,US women’s Olympic basketball knows it has work to do after loss to WNBA team,https://www.boston.com/sports/sports-news/2024/07/22/us-womens-olympic-basketball-loss-wnba/,"Mon, 22 Jul 2024 14:00:00 GMT",US women’s Olympic basketball knows it has work to do after loss to WNBA team,"{'href': 'https://www.boston.com', 'title': 'Boston.com'}"
https://news.google.com/rss/search?q=sports+news,NASCAR's Restart Rules Questioned After Larson Takes Advantage of Unusual Brickyard 400 Finish,https://www.usnews.com/news/sports/articles/2024-07-22/nascars-restart-rules-questioned-after-larson-takes-advantage-of-unusual-brickyard-400-finish,"Mon, 22 Jul 2024 16:46:31 GMT",NASCAR's Restart Rules Questioned After Larson Takes Advantage of Unusual Brickyard 400 Finish,"{'href': 'https://www.usnews.com', 'title': 'U.S. News & World Report'}"
https://news.google.com/rss/search?q=sports+news,U.S. Olympic team athletes make their debut on Roblox gaming platform,https://www.cbsnews.com/news/2024-olympics-roblox-paris-emotes/,"Mon, 22 Jul 2024 16:10:03 GMT",U.S. Olympic team athletes make their debut on Roblox gaming platform,"{'href': 'https://www.cbsnews.com', 'title': 'CBS News'}"
https://news.google.com/rss/search?q=sports+news,"Braves Recall Nacho Alvarez Jr., Sign Veteran Whit Merrifield Following Albies' Wrist Injury",https://www.usnews.com/news/sports/articles/2024-07-22/braves-recall-nacho-alvarez-jr-sign-veteran-whit-merrifield-following-albies-wrist-injury,"Mon, 22 Jul 2024 16:46:31 GMT","Braves Recall Nacho Alvarez Jr., Sign Veteran Whit Merrifield Following Albies' Wrist Injury","{'href': 'https://www.usnews.com', 'title': 'U.S. News & World Report'}"
https://news.google.com/rss/search?q=sports+news,Unity's Knudsen transfers to ISU: 'I'm very excited',https://www.news-gazette.com/sports/unitys-knudsen-transfers-to-isu-im-very-excited/article_6755e64c-477d-11ef-80d3-cf2d3865396b.html,"Mon, 22 Jul 2024 10:00:00 GMT",Unity's Knudsen transfers to ISU: 'I'm very excited',"{'href': 'https://www.news-gazette.com', 'title': 'The News-Gazette'}"
https://news.google.com/rss/search?q=sports+news,"Back-to-school sports physicals: Importance for students, other screenings to consider",https://www.fox26houston.com/news/sports-physicals-students-heart-screening,"Mon, 22 Jul 2024 15:51:03 GMT","Back-to-school sports physicals: Importance for students, other screenings to consider","{'href': 'https://www.fox26houston.com', 'title': 'FOX 26 Houston'}"
https://news.google.com/rss/search?q=sports+news,Aston Villa to target Atletico Madrid forward Joao Felix as Moussa Diaby replacement,https://www.skysports.com/football/transfer-paper-talk,"Mon, 22 Jul 2024 18:37:34 GMT",Aston Villa to target Atletico Madrid forward Joao Felix as Moussa Diaby replacement - Paper Talk,"{'href': 'https://www.skysports.com', 'title': 'Sky Sports'}"
https://news.google.com/rss/search?q=sports+news,NMU hockey names alumnus Fox as ass’t coach,https://www.miningjournal.net/sports/local-sports/2024/07/nmu-hockey-names-alumnus-fox-as-asst-coach/,"Mon, 22 Jul 2024 07:02:02 GMT",NMU hockey names alumnus Fox as ass’t coach,"{'href': 'https://www.miningjournal.net', 'title': 'Marquette Mining Journal'}"
https://news.google.com/rss/search?q=sports+news,EA Sports College Football 25 hits the market,https://www.magnoliabannernews.com/news/2024/jul/22/ea-sports-college-football-25-hits-the-market/,"Mon, 22 Jul 2024 09:00:00 GMT",EA Sports College Football 25 hits the market,"{'href': 'https://www.magnoliabannernews.com', 'title': 'Magnolia Banner News'}"
https://news.google.com/rss/search?q=sports+news,Double major for Xander,https://sports.yahoo.com/yahoo-sports-am-double-major-for-xander-113816742.html,"Mon, 22 Jul 2024 11:38:16 GMT",Double major for Xander,"{'href': 'https://sports.yahoo.com', 'title': 'Yahoo Sports'}"
https://news.google.com/rss/search?q=sports+news,Centennial Yards and Cosm to Bring Immersive Sports and Entertainment Venue to Downtown Atlanta,https://www.news-journal.com/centennial-yards-and-cosm-to-bring-immersive-sports-and-entertainment-venue-to-downtown-atlanta/article_8592b9ef-2ce5-525c-8c27-fdfd5f3b0293.html,"Mon, 22 Jul 2024 13:15:00 GMT",Centennial Yards and Cosm to Bring Immersive Sports and Entertainment Venue to Downtown Atlanta,"{'href': 'https://www.news-journal.com', 'title': 'Longview News-Journal'}"
https://news.google.com/rss/search?q=sports+news,Garylee has sports with Connor Lair heading back to MSU,https://www.ozarkradionews.com/sports/garylee-has-sports-with-connor-lair-heading-back-to-msu,"Mon, 22 Jul 2024 15:07:53 GMT",Garylee has sports with Connor Lair heading back to MSU,"{'href': 'https://www.ozarkradionews.com', 'title': 'Ozark Radio News'}"
https://news.google.com/rss/search?q=sports+news,"2024 Dodgers trade deadline preview: Greatest needs, possible targets as with all eyes on playoffs",https://www.cbssports.com/mlb/news/2024-dodgers-trade-deadline-preview-greatest-needs-possible-targets-as-with-all-eyes-on-playoffs/,"Mon, 22 Jul 2024 15:45:20 GMT","2024 Dodgers trade deadline preview: Greatest needs, possible targets as with all eyes on playoffs","{'href': 'https://www.cbssports.com', 'title': 'CBS Sports'}"
https://news.google.com/rss/search?q=sports+news,Olympics 2024 live: Latest Team GB news and build-up to Paris with tickets still available to opening ceremony,https://sports.yahoo.com/olympics-2024-live-latest-team-095818464.html,"Mon, 22 Jul 2024 14:15:34 GMT",Olympics 2024 live: Latest Team GB news and build-up to Paris with tickets still available to opening ceremony,"{'href': 'https://sports.yahoo.com', 'title': 'Yahoo Sports'}"
https://news.google.com/rss/search?q=sports+news,Sports betting roundup: Xander Schauffele goes from third favorite to first place at British Open,https://apnews.com/article/sports-betting-0a934f6de0691d8fe53afd8fa581ae10,"Mon, 22 Jul 2024 15:11:00 GMT",Sports betting roundup: Xander Schauffele goes from third favorite to first place at British Open,"{'href': 'https://apnews.com', 'title': 'The Associated Press'}"
https://news.google.com/rss/search?q=sports+news,What’s next for Mariners after surprising Ty France news?,https://sports.mynorthwest.com/1778990/seattle-mariners-france-ty-whats-next/,"Mon, 22 Jul 2024 17:48:30 GMT",What’s next for Mariners after surprising Ty France news?,"{'href': 'https://sports.mynorthwest.com', 'title': 'Seattle Sports'}"
https://news.google.com/rss/search?q=sports+news,Tarik Skubal landing spots: Ranking all 30 teams by likelihood of acquiring Tigers ace at MLB trade deadline,https://www.cbssports.com/mlb/news/tarik-skubal-landing-spots-ranking-all-30-teams-by-likelihood-of-acquiring-tigers-ace-at-mlb-trade-deadline/,"Mon, 22 Jul 2024 15:00:04 GMT",Tarik Skubal landing spots: Ranking all 30 teams by likelihood of acquiring Tigers ace at MLB trade deadline,"{'href': 'https://www.cbssports.com', 'title': 'CBS Sports'}"
https://news.google.com/rss/search?q=sports+news,University of Hawaii Swimming Alums Set for Olympics,https://www.mauinews.com/sports/local-sports/2024/07/university-of-hawaii-swimming-alums-set-for-olympics/,"Mon, 22 Jul 2024 13:52:27 GMT",University of Hawaii Swimming Alums Set for Olympics,"{'href': 'https://www.mauinews.com', 'title': 'Maui News'}"
https://news.google.com/rss/search?q=sports+news,Where every sport is being held at the Paris Olympic Games,https://keyt.com/sports/national-sports/cnn-sports/2024/07/22/where-every-sport-is-being-held-at-the-paris-olympic-games/,"Mon, 22 Jul 2024 09:15:21 GMT",Where every sport is being held at the Paris Olympic Games,"{'href': 'https://keyt.com', 'title': 'KEYT'}"
https://news.google.com/rss/search?q=sports+news,UNTOLD Returns with More Epic Stories from the Wild World of Sports,https://www.netflix.com/tudum/articles/untold-steve-mcnair-connor-stalions-hope-solo-release-date-trailer-news,"Mon, 22 Jul 2024 16:31:54 GMT",UNTOLD Returns with More Epic Stories from the Wild World of Sports,"{'href': 'https://www.netflix.com', 'title': 'Netflix Tudum'}"
https://news.google.com/rss/search?q=sports+news,Raiders facing multiple training camp restrictions after Rams and Chargers decide to enforce obscure NFL rule,https://www.cbssports.com/nfl/news/raiders-facing-multiple-training-camp-restrictions-after-rams-and-chargers-decide-to-enforce-obscure-nfl-rule/,"Mon, 22 Jul 2024 12:11:00 GMT",Raiders facing multiple training camp restrictions after Rams and Chargers decide to enforce obscure NFL rule,"{'href': 'https://www.cbssports.com', 'title': 'CBS Sports'}"
https://news.google.com/rss/search?q=sports+news,LeBron James named Team USA men's flag bearer for Paris Olympics opening ceremonies,https://www.foxnews.com/sports/lebron-james-named-team-usa-mens-flag-bearer-paris-olympics-opening-ceremonies,"Mon, 22 Jul 2024 12:19:00 GMT",LeBron James named Team USA men's flag bearer for Paris Olympics opening ceremonies,"{'href': 'https://www.foxnews.com', 'title': 'Fox News'}"
https://news.google.com/rss/search?q=sports+news,"Chiefs' Chris Jones sees possible three-peat as 'huge accomplishment' for team, NFL",https://www.foxnews.com/sports/chiefs-chris-jones-sees-possible-three-peat-huge-accomplishment-team-nfl,"Mon, 22 Jul 2024 13:20:00 GMT","Chiefs' Chris Jones sees possible three-peat as 'huge accomplishment' for team, NFL","{'href': 'https://www.foxnews.com', 'title': 'Fox News'}"
https://news.google.com/rss/search?q=sports+news,Reddit strikes deals with sports leagues to attract more ad dollars,https://finance.yahoo.com/news/reddit-partners-nfl-nba-boost-133420504.html,"Mon, 22 Jul 2024 15:48:42 GMT",Reddit strikes deals with sports leagues to attract more ad dollars,"{'href': 'https://finance.yahoo.com', 'title': 'Yahoo Finance'}"
https://news.google.com/rss/search?q=sports+news,Riccardo Calafiori transfer news: Arsenal finalising deal for Bologna defender,https://www.skysports.com/football/news/11095/13181783/riccardo-calafiori-transfer-news-arsenal-finalising-deal-for-bologna-defender,"Mon, 22 Jul 2024 16:38:19 GMT",Riccardo Calafiori transfer news: Arsenal finalising deal for Bologna defender,"{'href': 'https://www.skysports.com', 'title': 'Sky Sports'}"
https://news.google.com/rss/search?q=sports+news,"2024 Yankees trade deadline preview: Greatest needs, possible targets as New York hunts for AL East title",https://www.cbssports.com/mlb/news/2024-yankees-trade-deadline-preview-greatest-needs-possible-targets-as-new-york-hunts-for-al-east-title/,"Mon, 22 Jul 2024 14:00:00 GMT","2024 Yankees trade deadline preview: Greatest needs, possible targets as New York hunts for AL East title","{'href': 'https://www.cbssports.com', 'title': 'CBS Sports'}"
https://news.google.com/rss/search?q=healthcare+news,Biden's fragile legacy on health care,https://www.axios.com/2024/07/22/bidens-health-legacy-fragile,"Mon, 22 Jul 2024 09:33:39 GMT",Biden's fragile legacy on health care,"{'href': 'https://www.axios.com', 'title': 'Axios'}"
https://news.google.com/rss/search?q=healthcare+news,Genetic testing should be included in health insurance reform,https://chicago.suntimes.com/other-views/2024/07/22/genetic-testing-health-insurance-coverage-reform-illinois-law-sara-cherny-op-ed,"Mon, 22 Jul 2024 11:00:00 GMT",Genetic testing should be included in health insurance reform,"{'href': 'https://chicago.suntimes.com', 'title': 'Chicago Sun-Times'}"
https://news.google.com/rss/search?q=healthcare+news,Healthcare recovering from CrowdStrike outage,https://www.healthcareitnews.com/news/healthcare-recovering-crowdstrike-outage,"Mon, 22 Jul 2024 15:23:35 GMT",Healthcare recovering from CrowdStrike outage,"{'href': 'https://www.healthcareitnews.com', 'title': 'Healthcare IT News'}"
https://news.google.com/rss/search?q=healthcare+news,Bankrupt Steward Health Finds Buyers For Two Hospitals Amid Senate Probe,https://www.bloomberg.com/news/articles/2024-07-22/bankrupt-steward-health-finds-buyers-for-two-hospitals-amid-senate-probe,"Mon, 22 Jul 2024 15:58:22 GMT",Bankrupt Steward Health Finds Buyers For Two Hospitals Amid Senate Probe,"{'href': 'https://www.bloomberg.com', 'title': 'Bloomberg'}"
https://news.google.com/rss/search?q=healthcare+news,Republicans are quietly pushing to defund transgender healthcare even for adults,https://www.independent.co.uk/news/world/americas/us-politics/transgender-healthcare-funding-republicans-b2583938.html,"Mon, 22 Jul 2024 16:34:43 GMT",Republicans are quietly pushing to defund transgender healthcare even for adults,"{'href': 'https://www.independent.co.uk', 'title': 'The Independent'}"
https://news.google.com/rss/search?q=healthcare+news,Health Care Roundup: Market Talk,https://www.wsj.com/economy/central-banking/health-care-roundup-market-talk-6325ffb8,"Mon, 22 Jul 2024 12:07:00 GMT",Health Care Roundup: Market Talk,"{'href': 'https://www.wsj.com', 'title': 'The Wall Street Journal'}"
https://news.google.com/rss/search?q=healthcare+news,"Desert Healthcare, Tenet update non-compete language; still has Eisenhower restrictions",https://www.desertsun.com/story/news/health/2024/07/22/desert-healthcare-tenet-update-non-compete-clause-in-hospital-lease/74478968007/,"Mon, 22 Jul 2024 15:31:16 GMT","Desert Healthcare, Tenet update non-compete language; still has Eisenhower restrictions","{'href': 'https://www.desertsun.com', 'title': 'Desert Sun'}"
https://news.google.com/rss/search?q=healthcare+news,"Pharmacy closures multiply, threatening to create health care deserts",https://ohiocapitaljournal.com/2024/07/22/pharmacy-closures-multiply-threatening-to-create-health-care-deserts/,"Mon, 22 Jul 2024 09:02:13 GMT","Pharmacy closures multiply, threatening to create health care deserts","{'href': 'https://ohiocapitaljournal.com', 'title': 'Ohio Capital Journal'}"
https://news.google.com/rss/search?q=healthcare+news,Steward fails to spark competitive auction during first round of hospital sales,https://www.healthcaredive.com/news/steward-health-care-cancels-hospital-auctions-first-round/721982/,"Mon, 22 Jul 2024 16:27:35 GMT",Steward fails to spark competitive auction during first round of hospital sales,"{'href': 'https://www.healthcaredive.com', 'title': 'Healthcare Dive'}"
https://news.google.com/rss/search?q=healthcare+news,N.H. governor signs bills restricting trans health care and sports participation,https://www.nbcnews.com/nbc-out/out-politics-and-policy/new-hampshire-transgender-sports-healthcare-laws-rcna163028,"Mon, 22 Jul 2024 17:57:00 GMT",N.H. governor signs bills restricting trans health care and sports participation,"{'href': 'https://www.nbcnews.com', 'title': 'NBC News'}"
https://news.google.com/rss/search?q=healthcare+news,Digital literacy a key to success in healthcare,https://www.healthcarefinancenews.com/video/digital-literacy-key-success-healthcare,"Mon, 22 Jul 2024 10:36:35 GMT",Digital literacy a key to success in healthcare,"{'href': 'https://www.healthcarefinancenews.com', 'title': 'Healthcare Finance News'}"
https://news.google.com/rss/search?q=healthcare+news,Missed Out on Eli Lilly? These 2 Healthcare Stocks Have Big Catalysts on the Horizon.,https://finance.yahoo.com/news/missed-eli-lilly-2-healthcare-132000454.html,"Mon, 22 Jul 2024 13:20:00 GMT",Missed Out on Eli Lilly? These 2 Healthcare Stocks Have Big Catalysts on the Horizon.,"{'href': 'https://finance.yahoo.com', 'title': 'Yahoo Finance'}"
https://news.google.com/rss/search?q=healthcare+news,The Aspen Institute Releases 2024 Strategy to Integrate Food is Medicine into U.S. Healthcare System,https://foodtank.com/news/2024/07/the-aspen-institute-releases-2024-strategy-to-integrate-food-is-medicine-into-u-s-healthcare-system/,"Mon, 22 Jul 2024 13:58:41 GMT",The Aspen Institute Releases 2024 Strategy to Integrate Food is Medicine into U.S. Healthcare System,"{'href': 'https://foodtank.com', 'title': 'Food Tank'}"
https://news.google.com/rss/search?q=healthcare+news,"Florida awards additional Medicaid contracts to CVS, UnitedHealth, Molina",https://www.healthcaredive.com/news/florida-medicaid-managed-care-unitedhealth-cvs-molina/721929/,"Mon, 22 Jul 2024 15:09:08 GMT","Florida awards additional Medicaid contracts to CVS, UnitedHealth, Molina","{'href': 'https://www.healthcaredive.com', 'title': 'Healthcare Dive'}"
https://news.google.com/rss/search?q=healthcare+news,GE HealthCare to scoop up clinical AI assets from Intelligent Ultrasound,https://www.healthcareitnews.com/news/ge-healthcare-scoop-clinical-ai-assets-intelligent-ultrasound,"Mon, 22 Jul 2024 14:50:23 GMT",GE HealthCare to scoop up clinical AI assets from Intelligent Ultrasound,"{'href': 'https://www.healthcareitnews.com', 'title': 'Healthcare IT News'}"
https://news.google.com/rss/search?q=healthcare+news,Where Kamala Harris stands on health care,https://www.axios.com/pro/health-care-policy/2024/07/21/kamala-harris-on-health-care,"Mon, 22 Jul 2024 12:43:51 GMT",Where Kamala Harris stands on health care,"{'href': 'https://www.axios.com', 'title': 'Axios'}"
https://news.google.com/rss/search?q=healthcare+news,Commure to acquire AI scribe Augmedix in $139M deal,https://www.healthcaredive.com/news/commure-acquire-augmedix-ai-documentation/721978/,"Mon, 22 Jul 2024 16:11:51 GMT",Commure to acquire AI scribe Augmedix in $139M deal,"{'href': 'https://www.healthcaredive.com', 'title': 'Healthcare Dive'}"
https://news.google.com/rss/search?q=healthcare+news,CMS cracks down on ACA brokers to prevent plan switching,https://www.healthcaredive.com/news/cms-affordable-care-act-plan-switching-broker-agent-requirements/721947/,"Mon, 22 Jul 2024 14:57:34 GMT",CMS cracks down on ACA brokers to prevent plan switching,"{'href': 'https://www.healthcaredive.com', 'title': 'Healthcare Dive'}"
https://news.google.com/rss/search?q=healthcare+news,Healthcare innovators to convene for Healthcare Conference 2024,https://www.medicalplasticsnews.com/news/latest-medical-plastics-news/healthcare-innovators-to-convene-for-healthcare-conference-2/,"Mon, 22 Jul 2024 12:23:15 GMT",Healthcare innovators to convene for Healthcare Conference 2024,"{'href': 'https://www.medicalplasticsnews.com', 'title': 'Medical Plastics News'}"
https://news.google.com/rss/search?q=healthcare+news,AdventHealth virtual MRI program reduces inpatient transfers by 94%,https://www.healthcareitnews.com/news/adventhealth-virtual-mri-program-reduces-inpatient-transfers-94,"Mon, 22 Jul 2024 16:21:01 GMT",AdventHealth virtual MRI program reduces inpatient transfers by 94%,"{'href': 'https://www.healthcareitnews.com', 'title': 'Healthcare IT News'}"
https://news.google.com/rss/search?q=healthcare+news,Healthcare Surfaces Institute Merges With ISSA,https://cmmonline.com/news/healthcare-surfaces-institute-merges-with-issa,"Mon, 22 Jul 2024 09:31:41 GMT",Healthcare Surfaces Institute Merges With ISSA,"{'href': 'https://cmmonline.com', 'title': 'CMM'}"
https://news.google.com/rss/search?q=healthcare+news,"Voices: AJ Leahy, Founder & CEO, POM Safe",https://homehealthcarenews.com/2024/07/voices-aj-leahy-founder-ceo-pom-safe/,"Mon, 22 Jul 2024 16:46:38 GMT","Voices: AJ Leahy, Founder & CEO, POM Safe","{'href': 'https://homehealthcarenews.com', 'title': 'Home Health Care News'}"
https://news.google.com/rss/search?q=healthcare+news,Administration launching multi-state licensure compact,https://www.healthcarefinancenews.com/news/administration-launching-multi-state-licensure-compact-0,"Mon, 22 Jul 2024 13:52:04 GMT",Administration launching multi-state licensure compact,"{'href': 'https://www.healthcarefinancenews.com', 'title': 'Healthcare Finance News'}"
https://news.google.com/rss/search?q=healthcare+news,Why Tenet Healthcare (THC) is a Top Growth Stock for the Long-Term,https://finance.yahoo.com/news/why-tenet-healthcare-thc-top-134512777.html,"Mon, 22 Jul 2024 13:45:12 GMT",Why Tenet Healthcare (THC) is a Top Growth Stock for the Long-Term,"{'href': 'https://finance.yahoo.com', 'title': 'Yahoo Finance'}"
https://news.google.com/rss/search?q=healthcare+news,Global healthcare systems face disruptions caused by Microsoft outage,https://finance.yahoo.com/news/global-healthcare-systems-face-disruptions-101603031.html,"Mon, 22 Jul 2024 10:16:03 GMT",Global healthcare systems face disruptions caused by Microsoft outage,"{'href': 'https://finance.yahoo.com', 'title': 'Yahoo Finance'}"
https://news.google.com/rss/search?q=healthcare+news,Understanding Consumer-Consented Data to Optimize Digital Health Programs,https://www.news-medical.net/news/20240722/Understanding-Consumer-Consented-Data-to-Optimize-Digital-Health-Programs.aspx,"Mon, 22 Jul 2024 15:35:00 GMT",Understanding Consumer-Consented Data to Optimize Digital Health Programs,"{'href': 'https://www.news-medical.net', 'title': 'News-Medical.Net'}"
https://news.google.com/rss/search?q=healthcare+news,Mandatory organ transplant model draws ire from AHA,https://www.healthcarefinancenews.com/news/mandatory-organ-transplant-model-draws-ire-aha,"Mon, 22 Jul 2024 13:07:04 GMT",Mandatory organ transplant model draws ire from AHA,"{'href': 'https://www.healthcarefinancenews.com', 'title': 'Healthcare Finance News'}"
https://news.google.com/rss/search?q=healthcare+news,MASH students learns ins and outs of healthcare,https://www.mohavedailynews.com/news/mash-students-learns-ins-and-outs-of-healthcare/article_42b2509c-46cd-11ef-9ca0-330fcbdca623.html,"Mon, 22 Jul 2024 11:00:00 GMT",MASH students learns ins and outs of healthcare,"{'href': 'https://www.mohavedailynews.com', 'title': 'Mohave Valley News'}"
https://news.google.com/rss/search?q=healthcare+news,"Saint Joseph Health System, UnitedHealthcare reach agreement to in-network access",https://www.wsbt.com/news/local/saint-joseph-health-system-unitedhealthcare-reach-agreement-network-access-insurance-doctors-hospitals-bills-out-health-care-indiana,"Mon, 22 Jul 2024 17:12:39 GMT","Saint Joseph Health System, UnitedHealthcare reach agreement to in-network access","{'href': 'https://www.wsbt.com', 'title': 'WSBT-TV'}"
https://news.google.com/rss/search?q=healthcare+news,Massachusetts bill would establish health insurance bureau,https://www.insurancebusinessmag.com/us/news/life-insurance/massachusetts-bill-would-establish-health-insurance-bureau-498160.aspx,"Mon, 22 Jul 2024 15:55:59 GMT",Massachusetts bill would establish health insurance bureau,"{'href': 'https://www.insurancebusinessmag.com', 'title': 'Insurance Business'}"
https://news.google.com/rss/search?q=healthcare+news,Hospital IT Teams Still Working to Resolve CrowdStrike-Related Outage Issues,https://www.hcinnovationgroup.com/cybersecurity/privacy-security/news/55127510/hospital-it-teams-still-working-to-resolve-crowdstrike-related-outage-issues,"Mon, 22 Jul 2024 15:07:50 GMT",Hospital IT Teams Still Working to Resolve CrowdStrike-Related Outage Issues,"{'href': 'https://www.hcinnovationgroup.com', 'title': 'Healthcare Innovation'}"
https://news.google.com/rss/search?q=healthcare+news,Digital health literacy helps boost cardiology care,https://www.healthcareitnews.com/video/digital-health-literacy-helps-boost-cardiology-care,"Mon, 22 Jul 2024 10:00:00 GMT",Digital health literacy helps boost cardiology care,"{'href': 'https://www.healthcareitnews.com', 'title': 'Healthcare IT News'}"
https://news.google.com/rss/search?q=healthcare+news,Where to go for health care in times of urgent need,https://www.nyuhs.org/news-search/where-go-health-care-times-urgent-need,"Mon, 22 Jul 2024 12:21:47 GMT",Where to go for health care in times of urgent need,"{'href': 'https://www.nyuhs.org', 'title': 'United Health Services'}"
https://news.google.com/rss/search?q=healthcare+news,How a potential Harris presidency could influence US healthcare,https://www.pharmaceutical-technology.com/news/how-a-potential-harris-presidency-could-influence-us-healthcare/,"Mon, 22 Jul 2024 17:03:21 GMT",How a potential Harris presidency could influence US healthcare,"{'href': 'https://www.pharmaceutical-technology.com', 'title': 'Pharmaceutical Technology'}"
https://news.google.com/rss/search?q=healthcare+news,"NextGen Healthcare Tapped by Advanced Heart Group to Enhance Patient Experience, Boost Operational Efficiency",https://www.businesswire.com/news/home/20240722447739/en/NextGen-Healthcare-Tapped-by-Advanced-Heart-Group-to-Enhance-Patient-Experience-Boost-Operational-Efficiency,"Mon, 22 Jul 2024 13:15:00 GMT","NextGen Healthcare Tapped by Advanced Heart Group to Enhance Patient Experience, Boost Operational Efficiency","{'href': 'https://www.businesswire.com', 'title': 'Business Wire'}"
