Input URL,Title,Link,Published,Description,Source
https://news.google.com/rss/search?q=technology+news,Here’s how technology’s tumble cooled California’s growth,https://www.dailynews.com/2024/07/22/heres-how-technologys-tumble-cooled-californias-growth/,"Mon, 22 Jul 2024 14:24:58 GMT",Here’s how technology’s tumble cooled California’s growth,"{'href': 'https://www.dailynews.com', 'title': 'LA Daily News'}"
https://news.google.com/rss/search?q=technology+news,Inkfish Acquires Arctic Rays,https://www.marinetechnologynews.com/news/inkfish-acquires-arctic-638431,"Mon, 22 Jul 2024 18:42:48 GMT",Inkfish Acquires Arctic Rays,"{'href': 'https://www.marinetechnologynews.com', 'title': 'Marine Technology News'}"
https://news.google.com/rss/search?q=technology+news,GKN Delivers Wings for Supernal eVTOL Demonstrator,https://www.ainonline.com/aviation-news/futureflight/2024-07-22/gkn-delivers-wings-supernal-evtol-demonstrator,"Mon, 22 Jul 2024 10:19:35 GMT",GKN Delivers Wings for Supernal eVTOL Demonstrator,"{'href': 'https://www.ainonline.com', 'title': 'Aviation International News'}"
https://news.google.com/rss/search?q=technology+news,Artificial intelligence (AI),https://www.theguardian.com/technology/artificialintelligenceai,"Mon, 22 Jul 2024 07:49:41 GMT",Artificial intelligence (AI),"{'href': 'https://www.theguardian.com', 'title': 'The Guardian'}"
https://news.google.com/rss/search?q=technology+news,Trickle down of clothing technology,https://www.sailingscuttlebutt.com/2024/07/22/trickle-down-of-clothing-technology/,"Mon, 22 Jul 2024 14:46:45 GMT",Trickle down of clothing technology,"{'href': 'https://www.sailingscuttlebutt.com', 'title': 'Scuttlebutt Sailing News'}"
https://news.google.com/rss/search?q=technology+news,Kontron AG expands Management Board,https://telecomreseller.com/2024/07/22/kontron-ag-expands-management-board/,"Mon, 22 Jul 2024 15:44:01 GMT",Kontron AG expands Management Board,"{'href': 'https://telecomreseller.com', 'title': 'Telecom Reseller'}"
https://news.google.com/rss/search?q=technology+news,ABS and the US Coast Guard R&D Center Team Up for Maritime Tech Development,https://www.marinetechnologynews.com/news/coast-guard-center-maritime-638416,"Mon, 22 Jul 2024 12:21:48 GMT",ABS and the US Coast Guard R&D Center Team Up for Maritime Tech Development,"{'href': 'https://www.marinetechnologynews.com', 'title': 'Marine Technology News'}"
https://news.google.com/rss/search?q=technology+news,"PC gaming, custom configurations on the rise in India: CyberPowerPC",https://www.financialexpress.com/life/technology-pc-gaming-custom-configurations-on-the-rise-in-india-cyberpowerpc-3561054/,"Mon, 22 Jul 2024 13:08:34 GMT","PC gaming, custom configurations on the rise in India: CyberPowerPC","{'href': 'https://www.financialexpress.com', 'title': 'The Financial Express'}"
https://news.google.com/rss/search?q=technology+news,Microsoft outage: Why your Windows PC didn’t go down,https://timesofindia.indiatimes.com/technology/tech-news/microsoft-outage-why-your-windows-pc-didnt-go-down/articleshow/111928930.cms,"Mon, 22 Jul 2024 10:54:00 GMT",Microsoft outage: Why your Windows PC didn’t go down,"{'href': 'https://timesofindia.indiatimes.com', 'title': 'The Times of India'}"
https://news.google.com/rss/search?q=technology+news,Google has a new way to tackle low-quality apps on Play Store: What are they and how they affect users,https://timesofindia.indiatimes.com/technology/tech-news/google-has-a-new-way-to-tackle-low-quality-apps-on-play-store-what-are-they/articleshow/111935055.cms,"Mon, 22 Jul 2024 15:39:00 GMT",Google has a new way to tackle low-quality apps on Play Store: What are they and how they affect users,"{'href': 'https://timesofindia.indiatimes.com', 'title': 'The Times of India'}"
https://news.google.com/rss/search?q=technology+news,"Musk's AI fashion show: World leaders, tech titans strut the runway. WATCH",https://www.business-standard.com/technology/tech-news/musk-s-ai-fashion-show-world-leaders-tech-titans-strut-the-runway-watch-124072200516_1.html,"Mon, 22 Jul 2024 07:58:21 GMT","Musk's AI fashion show: World leaders, tech titans strut the runway. WATCH","{'href': 'https://www.business-standard.com', 'title': 'Business Standard'}"
https://news.google.com/rss/search?q=technology+news,"Telecom technology needs capital, govt to allocate 5% of USOF for R&D",https://www.business-standard.com/budget/news/telecom-technology-needs-capital-govt-to-allocate-5-of-usof-for-r-d-124072200567_1.html,"Mon, 22 Jul 2024 10:59:55 GMT","Telecom technology needs capital, govt to allocate 5% of USOF for R&D","{'href': 'https://www.business-standard.com', 'title': 'Business Standard'}"
https://news.google.com/rss/search?q=technology+news,Microsoft outage: NSE and BSE have 'good news' for investors,https://timesofindia.indiatimes.com/technology/tech-news/microsoft-outage-nse-and-bse-have-good-news-for-investors/articleshow/111891711.cms,"Mon, 22 Jul 2024 08:03:00 GMT",Microsoft outage: NSE and BSE have 'good news' for investors,"{'href': 'https://timesofindia.indiatimes.com', 'title': 'The Times of India'}"
https://news.google.com/rss/search?q=technology+news,"Microsoft says CrowdStrike update impacted 8.5 million PCs, was less than 1 per cent of all Windows machines",https://www.indiatoday.in/technology/news/story/microsoft-says-crowdstrike-update-impacted-85-million-pcs-was-less-than-1-per-cent-of-all-windows-machines-2570167-2024-07-22,"Mon, 22 Jul 2024 10:25:34 GMT","Microsoft says CrowdStrike update impacted 8.5 million PCs, was less than 1 per cent of all Windows machines","{'href': 'https://www.indiatoday.in', 'title': 'India Today'}"
https://news.google.com/rss/search?q=technology+news,Khaled bin Mohamed bin Zayed chairs Advanced Technology Research Council board meeting,https://www.mediaoffice.abudhabi/en/crown-prince-news/khaled-bin-mohamed-bin-zayed-chairs-advanced-technology-research-council-board-meeting-july-2024/,"Mon, 22 Jul 2024 11:39:37 GMT",Khaled bin Mohamed bin Zayed chairs Advanced Technology Research Council board meeting,"{'href': 'https://www.mediaoffice.abudhabi', 'title': 'Abu Dhabi Media Office'}"
https://news.google.com/rss/search?q=technology+news,BiologIC Technologies wins share of £65m fund for space medicine,https://www.bbc.co.uk/news/articles/cp9vdxwjddeo,"Mon, 22 Jul 2024 12:31:06 GMT",BiologIC Technologies wins share of £65m fund for space medicine,"{'href': 'https://www.bbc.co.uk', 'title': 'BBC'}"
https://news.google.com/rss/search?q=technology+news,"AI technology to shape future economies, India emerges as a leader: Economic survey",https://www.indiatvnews.com/technology/news/ai-technology-to-shape-future-economies-india-emerges-as-a-leader-economic-survey-2024-07-22-943091,"Mon, 22 Jul 2024 12:03:49 GMT","AI technology to shape future economies, India emerges as a leader: Economic survey","{'href': 'https://www.indiatvnews.com', 'title': 'India TV News'}"
https://news.google.com/rss/search?q=technology+news,Budget 2024: Expectations of the Automotive and Technology Industry,https://www.financialexpress.com/budget/budget-2024-expectations-of-the-automotive-and-technology-industry-3561005/,"Mon, 22 Jul 2024 16:30:00 GMT",Budget 2024: Expectations of the Automotive and Technology Industry,"{'href': 'https://www.financialexpress.com', 'title': 'The Financial Express'}"
https://news.google.com/rss/search?q=technology+news,"Paytm founder Vijay Shekhar Sharma's response to CrowdStrike CEO's apology letter: ...And sadly, Satya ..",https://timesofindia.indiatimes.com/technology/tech-news/paytm-founder-vijay-shekhar-sharmas-response-to-crowdstrikes-ceos-apology-letter-and-sadly-satya-/articleshow/111922463.cms,"Mon, 22 Jul 2024 07:59:00 GMT","Paytm founder Vijay Shekhar Sharma's response to CrowdStrike CEO's apology letter: ...And sadly, Satya ..","{'href': 'https://timesofindia.indiatimes.com', 'title': 'The Times of India'}"
https://news.google.com/rss/search?q=technology+news,Coffee Badging: How Amazon is tracking corporate employees working hours,https://timesofindia.indiatimes.com/technology/tech-news/coffee-badging-2024-amazon-begins-with-tracking-corporate-employees-working-hours/articleshow/111929383.cms,"Mon, 22 Jul 2024 11:17:00 GMT",Coffee Badging: How Amazon is tracking corporate employees working hours,"{'href': 'https://timesofindia.indiatimes.com', 'title': 'The Times of India'}"
https://news.google.com/rss/search?q=cryptocurrency+news,"Swan Bitcoin Drops IPO Plan, Cuts Staff and Will Shut Managed Mining Unit",https://www.coindesk.com/business/2024/07/22/swan-bitcoin-drops-ipo-plan-cuts-staff-and-will-shut-managed-mining-unit/,"Mon, 22 Jul 2024 17:29:00 GMT","Swan Bitcoin Drops IPO Plan, Cuts Staff and Will Shut Managed Mining Unit","{'href': 'https://www.coindesk.com', 'title': 'CoinDesk'}"
https://news.google.com/rss/search?q=cryptocurrency+news,Hong Kong to launch Asia’s first inverse Bitcoin ETF,https://cointelegraph.com/news/hong-kong-launches-asia-first-inverse-bitcoin-etf,"Mon, 22 Jul 2024 12:47:38 GMT",Hong Kong to launch Asia’s first inverse Bitcoin ETF,"{'href': 'https://cointelegraph.com', 'title': 'Cointelegraph'}"
https://news.google.com/rss/search?q=cryptocurrency+news,CSOP to Launch Asia’s First Inverse Bitcoin ETF in Hong Kong,https://www.bloomberg.com/news/articles/2024-07-22/csop-launches-asia-s-first-inverse-bitcoin-btc-etf-in-hong-kong,"Mon, 22 Jul 2024 07:55:44 GMT",CSOP to Launch Asia’s First Inverse Bitcoin ETF in Hong Kong,"{'href': 'https://www.bloomberg.com', 'title': 'Bloomberg'}"
https://news.google.com/rss/search?q=cryptocurrency+news,Ethereum Technical Analysis: ETH Eyes Bullish Rebound Amidst Consolidation,https://news.bitcoin.com/ethereum-technical-analysis-eth-eyes-bullish-rebound-amidst-consolidation/,"Mon, 22 Jul 2024 13:40:28 GMT",Ethereum Technical Analysis: ETH Eyes Bullish Rebound Amidst Consolidation,"{'href': 'https://news.bitcoin.com', 'title': 'Bitcoin.com News'}"
https://news.google.com/rss/search?q=cryptocurrency+news,Real Bedford FC boosts Bitcoin stash with $4.5M acquisition,https://cointelegraph.com/news/real-bedford-fc-bitcoin-expansion,"Mon, 22 Jul 2024 13:08:28 GMT",Real Bedford FC boosts Bitcoin stash with $4.5M acquisition,"{'href': 'https://cointelegraph.com', 'title': 'Cointelegraph'}"
https://news.google.com/rss/search?q=cryptocurrency+news,Bitcoin Technical Analysis: BTC Balances Short-Term Corrections and Long-Term Bullish Momentum,https://news.bitcoin.com/bitcoin-technical-analysis-btc-balances-short-term-corrections-and-long-term-bullish-momentum/,"Mon, 22 Jul 2024 11:54:24 GMT",Bitcoin Technical Analysis: BTC Balances Short-Term Corrections and Long-Term Bullish Momentum,"{'href': 'https://news.bitcoin.com', 'title': 'Bitcoin.com News'}"
https://news.google.com/rss/search?q=cryptocurrency+news,First Mover Americas: Bitcoin Settles Above $67K After Biden Drops Out,https://www.coindesk.com/markets/2024/07/22/first-mover-americas-bitcoin-settles-above-67k-after-biden-drops-out/,"Mon, 22 Jul 2024 12:07:00 GMT",First Mover Americas: Bitcoin Settles Above $67K After Biden Drops Out,"{'href': 'https://www.coindesk.com', 'title': 'CoinDesk'}"
https://news.google.com/rss/search?q=cryptocurrency+news,Global crypto investment products' inflow streak tops $3 billion as Ethereum overtakes Solana YTD: CoinShares,https://www.theblock.co/post/306625/crypto-investment-products-ethereum-overtakes-solana,"Mon, 22 Jul 2024 11:27:47 GMT",Global crypto investment products' inflow streak tops $3 billion as Ethereum overtakes Solana YTD: CoinShares,"{'href': 'https://www.theblock.co', 'title': 'The Block'}"
https://news.google.com/rss/search?q=cryptocurrency+news,OKX launches bitcoin price guessing game 'OKX Racer' as Telegram mini-app craze continues,https://www.theblock.co/post/306601/bitcoin-price-game-okx-racer-telegram-mini-apps,"Mon, 22 Jul 2024 10:39:07 GMT",OKX launches bitcoin price guessing game 'OKX Racer' as Telegram mini-app craze continues,"{'href': 'https://www.theblock.co', 'title': 'The Block'}"
https://news.google.com/rss/search?q=cryptocurrency+news,Bitcoin Miner Bitdeer Technologies Could be a Potential Takeover Target: Benchmark,https://www.coindesk.com/markets/2024/07/22/bitcoin-miner-bitdeer-technologies-could-be-a-potential-takeover-target-benchmark/,"Mon, 22 Jul 2024 12:27:00 GMT",Bitcoin Miner Bitdeer Technologies Could be a Potential Takeover Target: Benchmark,"{'href': 'https://www.coindesk.com', 'title': 'CoinDesk'}"
https://news.google.com/rss/search?q=cryptocurrency+news,HNT Token Beats Bitcoin With 40% Surge as Helium Mobile's Subscriber Count Tops 100K,https://www.coindesk.com/markets/2024/07/22/hnt-token-beats-bitcoin-with-40-surge-as-heliums-mobile-subscriber-count-tops-100k/,"Mon, 22 Jul 2024 10:17:00 GMT",HNT Token Beats Bitcoin With 40% Surge as Helium Mobile's Subscriber Count Tops 100K,"{'href': 'https://www.coindesk.com', 'title': 'CoinDesk'}"
https://news.google.com/rss/search?q=cryptocurrency+news,"Bitcoin Price Retraces To $66,736: Can Bulls Stage A Recovery?",https://www.newsbtc.com/news/bitcoin/bitcoin-price-retraces-to-66736-can-bulls-stage-a-recovery/,"Mon, 22 Jul 2024 15:33:24 GMT","Bitcoin Price Retraces To $66,736: Can Bulls Stage A Recovery?","{'href': 'https://www.newsbtc.com', 'title': 'NewsBTC'}"
https://news.google.com/rss/search?q=cryptocurrency+news,Bitcoin’s ‘Moon’ Phase Has Triggered Perfect Storm For Altcoins; Watch Out For Solana-based Coins,https://coinpedia.org/news/bitcoins-moon-phase-has-triggered-perfect-storm-for-altcoins-watch-out-for-solana-based-coins/,"Mon, 22 Jul 2024 11:51:46 GMT",Bitcoin’s ‘Moon’ Phase Has Triggered Perfect Storm For Altcoins; Watch Out For Solana-based Coins,"{'href': 'https://coinpedia.org', 'title': 'Coinpedia Fintech News'}"
https://news.google.com/rss/search?q=cryptocurrency+news,Ethereum Price Analysis: Will Spot ETH ETF Be A Sell The News Event?,https://coingape.com/markets/ethereum-price-analysis-are-whales-ready-to-sell-post-eth-etf-launch/,"Mon, 22 Jul 2024 17:03:45 GMT",Ethereum Price Analysis: Will Spot ETH ETF Be A Sell The News Event?,"{'href': 'https://coingape.com', 'title': 'CoinGape'}"
https://news.google.com/rss/search?q=cryptocurrency+news,"Mt. Gox prepares for repayments on Bitstamp, executes test transactions",https://cointelegraph.com/news/mt-gox-bitcoin-repayments-bitstamp-test-transactions,"Mon, 22 Jul 2024 13:33:27 GMT","Mt. Gox prepares for repayments on Bitstamp, executes test transactions","{'href': 'https://cointelegraph.com', 'title': 'Cointelegraph'}"
https://news.google.com/rss/search?q=cryptocurrency+news,Is Trump’s crypto love genuine or just a voter grab? DC insider weighs in,https://crypto.news/is-trumps-crypto-love-genuine-or-just-a-voter-grab-dc-insider-weighs-in/,"Mon, 22 Jul 2024 10:15:26 GMT",Is Trump’s crypto love genuine or just a voter grab? DC insider weighs in,"{'href': 'https://crypto.news', 'title': 'crypto.news'}"
https://news.google.com/rss/search?q=cryptocurrency+news,"Hong Kong’s Boyaa Interactive Announces Strategic Bitcoin Ecosystem Cooperation, Plans to Purchase $100 Million in BTC",https://news.bitcoin.com/hong-kongs-boyaa-interactive-announces-strategic-bitcoin-ecosystem-cooperation-plans-to-purchase-100-million-in-btc/,"Mon, 22 Jul 2024 09:30:18 GMT","Hong Kong’s Boyaa Interactive Announces Strategic Bitcoin Ecosystem Cooperation, Plans to Purchase $100 Million in BTC","{'href': 'https://news.bitcoin.com', 'title': 'Bitcoin.com News'}"
https://news.google.com/rss/search?q=cryptocurrency+news,The SEC's war against Ethereum and Consensys isn’t over,https://cointelegraph.com/news/sec-war-against-ethereum-consensys-isnt-over,"Mon, 22 Jul 2024 15:29:39 GMT",The SEC's war against Ethereum and Consensys isn’t over,"{'href': 'https://cointelegraph.com', 'title': 'Cointelegraph'}"
https://news.google.com/rss/search?q=cryptocurrency+news,Infinity Hash: Innovating Passive Income With Bitcoin Mining,https://news.bitcoin.com/infinity-hash-innovating-passive-income-with-bitcoin-mining/,"Mon, 22 Jul 2024 13:00:52 GMT",Infinity Hash: Innovating Passive Income With Bitcoin Mining,"{'href': 'https://news.bitcoin.com', 'title': 'Bitcoin.com News'}"
https://news.google.com/rss/search?q=cryptocurrency+news,U.S. Presidential Elections: Is Kamala Harris Pro-Crypto? Here’s the Truth,https://coinpedia.org/news/kamala-harriss-crypto-stance-is-she-a-pro-crypto-us-presidential-candidate/,"Mon, 22 Jul 2024 13:04:37 GMT",U.S. Presidential Elections: Is Kamala Harris Pro-Crypto? Here’s the Truth,"{'href': 'https://coinpedia.org', 'title': 'Coinpedia Fintech News'}"
https://news.google.com/rss/search?q=cryptocurrency+news,Bitcoin Price Regains $68K: Can Bulls Push to $70K Next?,https://www.newsbtc.com/analysis/btc/bitcoin-price-regains-68k/,"Mon, 22 Jul 2024 14:06:05 GMT",Bitcoin Price Regains $68K: Can Bulls Push to $70K Next?,"{'href': 'https://www.newsbtc.com', 'title': 'NewsBTC'}"
https://news.google.com/rss/search?q=cryptocurrency+news,Polymarket: Trump announcing a strategic Bitcoin reserve unlikely,https://crypto.news/trump-strategic-bitcoin-reserve-unlikely/,"Mon, 22 Jul 2024 16:37:26 GMT",Polymarket: Trump announcing a strategic Bitcoin reserve unlikely,"{'href': 'https://crypto.news', 'title': 'crypto.news'}"
https://news.google.com/rss/search?q=cryptocurrency+news,Elon Musk Laser Eyes Profile Picture Sparks Speculation,https://news.bitcoin.com/elon-musk-laser-eyes-profile-picture-sparks-speculation/,"Mon, 22 Jul 2024 08:30:52 GMT",Elon Musk Laser Eyes Profile Picture Sparks Speculation,"{'href': 'https://news.bitcoin.com', 'title': 'Bitcoin.com News'}"
https://news.google.com/rss/search?q=cryptocurrency+news,"Bitcoin Price Hits $68,000 After China Unexpectedly Cuts Interest Rates",https://decrypt.co/240819/bitcoin-hits-68000-after-china-unexpectedly-cuts-interest-rates,"Mon, 22 Jul 2024 09:17:30 GMT","Bitcoin Price Hits $68,000 After China Unexpectedly Cuts Interest Rates","{'href': 'https://decrypt.co', 'title': 'Decrypt'}"
https://news.google.com/rss/search?q=cryptocurrency+news,Mt. Gox $6 Billion Bitcoin Stack on Move Again: Selling Incoming? By U.Today,https://www.investing.com/news/cryptocurrency-news/mt-gox-6-billion-bitcoin-stack-on-move-again-selling-incoming-3528683,"Mon, 22 Jul 2024 11:34:52 GMT",Mt. Gox $6 Billion Bitcoin Stack on Move Again: Selling Incoming? By U.Today,"{'href': 'https://www.investing.com', 'title': 'Investing.com'}"
https://news.google.com/rss/search?q=cryptocurrency+news,"Michael Saylor Issues Crucial Bitcoin Statement as BTC Soars to $68,000",https://u.today/michael-saylor-issues-crucial-bitcoin-statement-as-btc-soars-to-68000,"Mon, 22 Jul 2024 15:12:46 GMT","Michael Saylor Issues Crucial Bitcoin Statement as BTC Soars to $68,000","{'href': 'https://u.today', 'title': 'U.Today'}"
https://news.google.com/rss/search?q=cryptocurrency+news,Top Altcoins To Stack As the Ethereum ETF Launch Approaches!,https://coinpedia.org/price-analysis/top-altcoins-to-stack-as-the-ethereum-etf-launch-approaches/,"Mon, 22 Jul 2024 10:26:46 GMT",Top Altcoins To Stack As the Ethereum ETF Launch Approaches!,"{'href': 'https://coinpedia.org', 'title': 'Coinpedia Fintech News'}"
https://news.google.com/rss/search?q=cryptocurrency+news,$235M WazirX exchange hack has implications for India’s crypto industry,https://cointelegraph.com/news/235m-wazirx-crypto-exchange-hack-india,"Mon, 22 Jul 2024 13:34:35 GMT",$235M WazirX exchange hack has implications for India’s crypto industry,"{'href': 'https://cointelegraph.com', 'title': 'Cointelegraph'}"
https://news.google.com/rss/search?q=cryptocurrency+news,Hong Kong gets inverse financial product to bet against Bitcoin,https://crypto.news/hong-kong-gets-inverse-financial-product-to-bet-against-bitcoin/,"Mon, 22 Jul 2024 11:22:03 GMT",Hong Kong gets inverse financial product to bet against Bitcoin,"{'href': 'https://crypto.news', 'title': 'crypto.news'}"
https://news.google.com/rss/search?q=cryptocurrency+news,Vitalik Buterin Applauds Polymarket’s Predictive Power and Influence,https://news.bitcoin.com/vitalik-buterin-applauds-polymarkets-predictive-power-and-influence/,"Mon, 22 Jul 2024 10:30:18 GMT",Vitalik Buterin Applauds Polymarket’s Predictive Power and Influence,"{'href': 'https://news.bitcoin.com', 'title': 'Bitcoin.com News'}"
https://news.google.com/rss/search?q=cryptocurrency+news,"Ethereum Price Climbs: Will It Challenge the $3,700 Mark Again?",https://www.newsbtc.com/analysis/eth/ethereum-price-climbs-3700/,"Mon, 22 Jul 2024 08:31:46 GMT","Ethereum Price Climbs: Will It Challenge the $3,700 Mark Again?","{'href': 'https://www.newsbtc.com', 'title': 'NewsBTC'}"
https://news.google.com/rss/search?q=cryptocurrency+news,Bitcoin Technical Analysis,https://www.forexlive.com/technical-analysis/bitcoin-technical-analysis-the-bullish-bias-remains-intact-20240722/,"Mon, 22 Jul 2024 10:06:00 GMT",Bitcoin Technical Analysis – The bullish bias remains intact,"{'href': 'https://www.forexlive.com', 'title': 'ForexLive'}"
https://news.google.com/rss/search?q=cryptocurrency+news,Any Near-Term Rebound in Crypto Market Likely to Be Temporary: JPMorgan,https://www.coindesk.com/markets/2024/07/22/any-near-term-rebound-in-crypto-market-likely-to-be-temporary-jpmorgan/,"Mon, 22 Jul 2024 09:44:00 GMT",Any Near-Term Rebound in Crypto Market Likely to Be Temporary: JPMorgan,"{'href': 'https://www.coindesk.com', 'title': 'CoinDesk'}"
https://news.google.com/rss/search?q=sports+news,"Golf influencer Paige Spiranac explains decision to join Passes, reveals what subscribers can expect",https://www.foxnews.com/sports/golf-influencer-paige-spiranac-explains-decision-join-passes-reveals-what-subscribers-can-expect,"Mon, 22 Jul 2024 13:03:00 GMT","Golf influencer Paige Spiranac explains decision to join Passes, reveals what subscribers can expect","{'href': 'https://www.foxnews.com', 'title': 'Fox News'}"
https://news.google.com/rss/search?q=sports+news,"MLB Power Rankings: Astros surge as Mariners blow AL West lead, plus who fell apart out of All-Star break?",https://www.cbssports.com/mlb/news/mlb-power-rankings-astros-surge-as-mariners-blow-al-west-lead-plus-who-fell-apart-out-of-all-star-break/,"Mon, 22 Jul 2024 12:31:00 GMT","MLB Power Rankings: Astros surge as Mariners blow AL West lead, plus who fell apart out of All-Star break?","{'href': 'https://www.cbssports.com', 'title': 'CBS Sports'}"
https://news.google.com/rss/search?q=sports+news,Red Sox players send clear message as MLB trade deadline nears,https://sports.yahoo.com/red-sox-players-send-clear-162019520.html,"Mon, 22 Jul 2024 16:23:10 GMT",Red Sox players send clear message as MLB trade deadline nears,"{'href': 'https://sports.yahoo.com', 'title': 'Yahoo Sports'}"
https://news.google.com/rss/search?q=sports+news,The Hundred: NFL owners contacted by ECB over team sales,https://www.bbc.com/sport/cricket/articles/cjr4z7wyknqo,"Mon, 22 Jul 2024 12:36:54 GMT",The Hundred: NFL owners contacted by ECB over team sales,"{'href': 'https://www.bbc.com', 'title': 'BBC.com'}"
https://news.google.com/rss/search?q=sports+news,Sue Bird and Megan Rapinoe talk women's sports in podcast,https://www.axios.com/local/seattle/2024/07/22/women-sports-podcast-rapinoe-bird,"Mon, 22 Jul 2024 10:07:10 GMT",Sue Bird and Megan Rapinoe talk women's sports in podcast,"{'href': 'https://www.axios.com', 'title': 'Axios'}"
https://news.google.com/rss/search?q=sports+news,‘Out of the Box’ with Dallas Huston: Sports Writers,https://www.brownwoodnews.com/2024/07/22/out-of-the-box-with-dallas-huston-sports-writers/,"Mon, 22 Jul 2024 10:52:35 GMT",‘Out of the Box’ with Dallas Huston: Sports Writers,"{'href': 'https://www.brownwoodnews.com', 'title': 'Brownwood News'}"
https://news.google.com/rss/search?q=sports+news,It's time to get your student athletes ready for fall sports,https://www.wxow.com/news/its-time-to-get-your-student-athletes-ready-for-fall-sports/article_401af590-4827-11ef-bd7e-4b6b82409ebf.html,"Mon, 22 Jul 2024 12:38:00 GMT",It's time to get your student athletes ready for fall sports,"{'href': 'https://www.wxow.com', 'title': 'WXOW.com'}"
https://news.google.com/rss/search?q=sports+news,Red-hot TimberHogs sweep Marshals,https://www.news-journal.com/sports/red-hot-timberhogs-sweep-marshals/article_5b531268-4785-11ef-8513-337118d242f7.html,"Mon, 22 Jul 2024 15:05:00 GMT",Red-hot TimberHogs sweep Marshals,"{'href': 'https://www.news-journal.com', 'title': 'Longview News-Journal'}"
https://news.google.com/rss/search?q=sports+news,QB Jordan Love Won't Be Practicing With Packers With Contract Situation Unsettled,https://www.usnews.com/news/sports/articles/2024-07-22/qb-jordan-love-wont-be-practicing-with-packers-with-contract-situation-unsettled,"Mon, 22 Jul 2024 15:40:21 GMT",QB Jordan Love Won't Be Practicing With Packers With Contract Situation Unsettled,"{'href': 'https://www.usnews.com', 'title': 'U.S. News & World Report'}"
https://news.google.com/rss/search?q=sports+news,Connoisseur Puts High School Sports In The Spotlight With Purchase Of The Ruden Report.,https://www.insideradio.com/free/connoisseur-puts-high-school-sports-in-the-spotlight-with-purchase-of-the-ruden-report/article_6e75666a-4830-11ef-ae6b-6b6fcfb47b59.html,"Mon, 22 Jul 2024 13:43:00 GMT",Connoisseur Puts High School Sports In The Spotlight With Purchase Of The Ruden Report.,"{'href': 'https://www.insideradio.com', 'title': 'Insideradio.com'}"
https://news.google.com/rss/search?q=sports+news,Lutz 8U all-star softball team represents Florida at Babe Ruth World Series,https://www.abcactionnews.com/sports/lutz-8u-all-star-softball-team-represents-florida-at-babe-ruth-world-series,"Mon, 22 Jul 2024 15:01:43 GMT",Lutz 8U all-star softball team represents Florida at Babe Ruth World Series,"{'href': 'https://www.abcactionnews.com', 'title': 'ABC Action News Tampa Bay'}"
