Input URL,Title,Link,Published,Description,Source
https://news.google.com/rss/search?q=healthcare+news,"AMN Healthcare Services, Inc.'s (NYSE:AMN) Price Is Right But Growth Is Lacking",https://simplywall.st/stocks/us/healthcare/nyse-amn/amn-healthcare-services/news/amn-healthcare-services-incs-nyseamn-price-is-right-but-grow,"Mon, 22 Jul 2024 14:42:39 GMT","AMN Healthcare Services, Inc.'s (NYSE:AMN) Price Is Right But Growth Is Lacking","{'href': 'https://simplywall.st', 'title': 'Simply Wall St'}"
https://news.google.com/rss/search?q=healthcare+news,Dunkin’ and Children’s Healthcare bring proms to teen campers,https://www.mdjonline.com/neighbor_newspapers/fulton/news/dunkin-and-children-s-healthcare-bring-proms-to-teen-campers/collection_6849f1d4-4538-11ef-bc0e-970ea54ae821.html,"Mon, 22 Jul 2024 10:45:00 GMT",Dunkin’ and Children’s Healthcare bring proms to teen campers,"{'href': 'https://www.mdjonline.com', 'title': 'MDJOnline.com'}"
https://news.google.com/rss/search?q=healthcare+news,What Kamala Harris’ candidacy would mean for health care,https://www.politicopro.com/pro-news/what-kamala-harris-candidacy-would-mean-for-health-care/,"Mon, 22 Jul 2024 15:15:01 GMT",What Kamala Harris’ candidacy would mean for health care,"{'href': 'https://www.politicopro.com', 'title': 'POLITICO Pro'}"
https://news.google.com/rss/search?q=healthcare+news,"Healthful News: UF Health North expands, Ascension Southside performs innovative surgery",https://www.jacksonville.com/story/news/healthcare/2024/07/22/uf-health-jacksonville-ascension-st-vincents-hca-florida-in-the-news/74237601007/,"Mon, 22 Jul 2024 09:14:48 GMT","Healthful News: UF Health North expands, Ascension Southside performs innovative surgery","{'href': 'https://www.jacksonville.com', 'title': 'The Florida Times-Union'}"
https://news.google.com/rss/search?q=healthcare+news,"Catalyst Healthcare, Heitman Launch $300M JV",https://www.commercialsearch.com/news/catalyst-healthcare-heitman-launch-300m-jv/,"Mon, 22 Jul 2024 12:35:50 GMT","Catalyst Healthcare, Heitman Launch $300M JV","{'href': 'https://www.commercialsearch.com', 'title': 'Commercial Property Executive'}"
https://news.google.com/rss/search?q=healthcare+news,NGS Group Q2 losses worsen amid waning healthcare staffing market,https://www.staffingindustry.com/news/global-daily-news/ngs-group-q2-losses-worsen-amid-waning-healthcare-staffing-market,"Mon, 22 Jul 2024 11:52:08 GMT",NGS Group Q2 losses worsen amid waning healthcare staffing market,"{'href': 'https://www.staffingindustry.com', 'title': 'Staffing Industry Analysts'}"
https://news.google.com/rss/search?q=healthcare+news,Navigating the data dilemma in healthcare: A path to digital evolution,https://www.med-technews.com/medtech-insights/digital-in-healthcare-insights/navigating-the-data-dilemma-in-healthcare-a-path-to-digital-evolution/,"Mon, 22 Jul 2024 10:42:23 GMT",Navigating the data dilemma in healthcare: A path to digital evolution,"{'href': 'https://www.med-technews.com', 'title': 'Med-Tech Innovation'}"
https://news.google.com/rss/search?q=healthcare+news,Strikes resuming in Northamptonshire health worker pay row,https://www.bbc.com/news/articles/cn4vgqgmzqpo,"Mon, 22 Jul 2024 11:40:04 GMT",Strikes resuming in Northamptonshire health worker pay row,"{'href': 'https://www.bbc.com', 'title': 'BBC.com'}"
https://news.google.com/rss/search?q=healthcare+news,Steward Health has not received ‘qualified bids’ for sale of local hospitals,https://www.wkbn.com/news/local-news/steward-health-has-not-received-qualified-bids-for-sale-of-local-hospitals/,"Mon, 22 Jul 2024 12:09:33 GMT",Steward Health has not received ‘qualified bids’ for sale of local hospitals,"{'href': 'https://www.wkbn.com', 'title': 'WKBN.com'}"
https://news.google.com/rss/search?q=healthcare+news,Medicare and Medicaid struggles foreshadow a rocky health insurer earnings season,https://www.statnews.com/2024/07/22/medicare-and-medicaid-struggles-foreshadow-a-rocky-health-insurer-earnings-season/,"Mon, 22 Jul 2024 16:46:12 GMT",Medicare and Medicaid struggles foreshadow a rocky health insurer earnings season,"{'href': 'https://www.statnews.com', 'title': 'STAT'}"
https://news.google.com/rss/search?q=healthcare+news,"The effects of inadequate food, housing, and health care on student attrition",https://phys.org/news/2024-07-effects-inadequate-food-housing-health.html,"Mon, 22 Jul 2024 15:01:03 GMT","The effects of inadequate food, housing, and health care on student attrition","{'href': 'https://phys.org', 'title': 'Phys.org'}"
https://news.google.com/rss/search?q=healthcare+news,Use of AI is on the rise in health care,https://www.kjzz.org/kjzz-news/2024-07-22/use-of-ai-is-on-the-rise-in-health-care,"Mon, 22 Jul 2024 17:45:00 GMT",Use of AI is on the rise in health care,"{'href': 'https://www.kjzz.org', 'title': 'KJZZ'}"
https://news.google.com/rss/search?q=healthcare+news,"California health care pioneer goes national, girds for partisan skirmishes",https://medicalxpress.com/news/2024-07-california-health-national-girds-partisan.html,"Mon, 22 Jul 2024 16:40:01 GMT","California health care pioneer goes national, girds for partisan skirmishes","{'href': 'https://medicalxpress.com', 'title': 'Medical Xpress'}"
https://news.google.com/rss/search?q=healthcare+news,Why Home Health Providers Should Expect To See A ‘Less Draconian’ Final Payment Rule,https://homehealthcarenews.com/2024/07/why-home-health-providers-should-expect-to-see-a-less-draconian-final-payment-rule/,"Mon, 22 Jul 2024 18:32:45 GMT",Why Home Health Providers Should Expect To See A ‘Less Draconian’ Final Payment Rule,"{'href': 'https://homehealthcarenews.com', 'title': 'Home Health Care News'}"
https://news.google.com/rss/search?q=healthcare+news,"Generative AI Investment Soars Amid Healthcare Startup Funding Decline, Finds GlobalData",https://mondovisione.com/media-and-resources/news/generative-ai-investment-soars-amid-healthcare-startup-funding-decline-finds-gl/,"Mon, 22 Jul 2024 08:44:37 GMT","Generative AI Investment Soars Amid Healthcare Startup Funding Decline, Finds GlobalData","{'href': 'https://mondovisione.com', 'title': 'Exchange News Direct'}"
https://news.google.com/rss/search?q=entertainment+news,Entertainment news with the Flew Here Grew Here Podcast,https://www.fox5atlanta.com/video/1489048,"Mon, 22 Jul 2024 14:58:00 GMT",Entertainment news with the Flew Here Grew Here Podcast,"{'href': 'https://www.fox5atlanta.com', 'title': 'FOX 5 Atlanta'}"
https://news.google.com/rss/search?q=entertainment+news,Ryan Reynolds Jokes Babysitter Taylor Swift Is Costing Him a Fortune,https://www.eonline.com/news/1405229/ryan-reynolds-jokes-babysitter-taylor-swift-is-costing-him-a-fortune,"Mon, 22 Jul 2024 12:32:00 GMT",Ryan Reynolds Jokes Babysitter Taylor Swift Is Costing Him a Fortune,"{'href': 'https://www.eonline.com', 'title': 'E! NEWS'}"
https://news.google.com/rss/search?q=entertainment+news,Why Dave Bautista Sneaks His Signature WWE Move “Into Every Film”,https://www.ttownmedia.com/lifestyles/entertainment/why-dave-bautista-sneaks-his-signature-wwe-move-into-every-film/video_7844de20-434c-5422-a741-809f5ef6321d.html,"Mon, 22 Jul 2024 17:07:54 GMT",Why Dave Bautista Sneaks His Signature WWE Move “Into Every Film”,"{'href': 'https://www.ttownmedia.com', 'title': 'ttownmedia.com'}"
https://news.google.com/rss/search?q=entertainment+news,"'Twisters', not kissers: Daisy Edgar-Jones and Glen Powell on why Spielberg snipped their smooch",https://hometownnewsnow.com/entertainment-news/6e142ff3f40a369adf18effe96e8884c,"Mon, 22 Jul 2024 16:32:09 GMT","'Twisters', not kissers: Daisy Edgar-Jones and Glen Powell on why Spielberg snipped their smooch","{'href': 'https://hometownnewsnow.com', 'title': 'Hometown News Now'}"
https://news.google.com/rss/search?q=entertainment+news,"Esta TerBlanche, 'All My Children' actress, dead at 51",https://www.foxnews.com/entertainment/esta-terblanche-all-my-children-actress-dead-51,"Mon, 22 Jul 2024 13:07:00 GMT","Esta TerBlanche, 'All My Children' actress, dead at 51","{'href': 'https://www.foxnews.com', 'title': 'Fox News'}"
https://news.google.com/rss/search?q=entertainment+news,"The Simpsons Does It Again, Predicts Kamala Harris As President",https://www.dailygazette.com/life_and_arts/entertainment/the-simpsons-does-it-again-predicts-kamala-harris-as-president/video_0ef5d544-eaf7-58db-b3ec-62100774fc3a.html,"Mon, 22 Jul 2024 16:04:58 GMT","The Simpsons Does It Again, Predicts Kamala Harris As President","{'href': 'https://www.dailygazette.com', 'title': 'The Daily Gazette'}"
https://news.google.com/rss/search?q=entertainment+news,Reaction To Kid Rock's Performance At The Republican National Convention,https://www.cbs19news.com/entertainment/reaction-to-kid-rocks-performance-at-the-republican-national-convention/video_2fb540c8-e625-52cd-a586-75fafee77a0a.html,"Mon, 22 Jul 2024 11:02:21 GMT",Reaction To Kid Rock's Performance At The Republican National Convention,"{'href': 'https://www.cbs19news.com', 'title': 'CBS19 News'}"
https://news.google.com/rss/search?q=entertainment+news,"Dave Coulier and John Stamos ""still processing the loss"" of 'Full House' ""brother"" Bob Saget",https://hometownnewsnow.com/entertainment-news/e85f0a864894a7325e3c6536d069b10a,"Mon, 22 Jul 2024 17:42:15 GMT","Dave Coulier and John Stamos ""still processing the loss"" of 'Full House' ""brother"" Bob Saget","{'href': 'https://hometownnewsnow.com', 'title': 'Hometown News Now'}"
https://news.google.com/rss/search?q=entertainment+news,"In Brief: CBS to air tribute to Bob Newhart, and more",https://hometownnewsnow.com/entertainment-news/afdc46c090f9d6b2b72f2978168c2239,"Mon, 22 Jul 2024 12:41:29 GMT","In Brief: CBS to air tribute to Bob Newhart, and more","{'href': 'https://hometownnewsnow.com', 'title': 'Hometown News Now'}"
https://news.google.com/rss/search?q=entertainment+news,'Twisters'﻿ spins up $80.5 million debut with #1 opening weekend,https://hometownnewsnow.com/entertainment-news/3ae81ed99e1f9bd47ca02f26505fa188,"Mon, 22 Jul 2024 11:21:21 GMT",'Twisters'﻿ spins up $80.5 million debut with #1 opening weekend,"{'href': 'https://hometownnewsnow.com', 'title': 'Hometown News Now'}"
https://news.google.com/rss/search?q=entertainment+news,Best Twitter Reactions To The Stranger Things 4 Trailer,https://www.wfmz.com/entertainment/best-twitter-reactions-to-the-stranger-things-4-trailer/video_d66f583d-91d5-570f-b337-86d95a6a2e32.html,"Mon, 22 Jul 2024 16:03:20 GMT",Best Twitter Reactions To The Stranger Things 4 Trailer,"{'href': 'https://www.wfmz.com', 'title': '69News WFMZ-TV'}"
https://news.google.com/rss/search?q=entertainment+news,Hunter Biden drops lawsuit against Fox News over explicit images featured in streaming series,https://thehill.com/homenews/ap/ap-entertainment/ap-hunter-biden-drops-lawsuit-against-fox-news-over-explicit-images-featured-in-streaming-series/,"Mon, 22 Jul 2024 14:26:00 GMT",Hunter Biden drops lawsuit against Fox News over explicit images featured in streaming series,"{'href': 'https://thehill.com', 'title': 'The Hill'}"
https://news.google.com/rss/search?q=entertainment+news,The Duffer Brothers Tease Potential ‘Stranger Things’ Spinoff Series,https://www.wfmz.com/entertainment/the-duffer-brothers-tease-potential-stranger-things-spinoff-series/video_c0ba031b-44b5-55c5-973e-5ac81a07bd3c.html,"Mon, 22 Jul 2024 17:06:57 GMT",The Duffer Brothers Tease Potential ‘Stranger Things’ Spinoff Series,"{'href': 'https://www.wfmz.com', 'title': '69News WFMZ-TV'}"
https://news.google.com/rss/search?q=entertainment+news,The Stranger Things spin-offs we need to see,https://www.wfmz.com/entertainment/the-stranger-things-spin-offs-we-need-to-see/video_64b5c3d3-cbc2-53f7-9e30-007154793fd0.html,"Mon, 22 Jul 2024 12:08:38 GMT",The Stranger Things spin-offs we need to see,"{'href': 'https://www.wfmz.com', 'title': '69News WFMZ-TV'}"
https://news.google.com/rss/search?q=entertainment+news,The One Episode of Breaking Bad BETTER Than Ozymandias,https://www.wfmz.com/entertainment/the-one-episode-of-breaking-bad-better-than-ozymandias/video_c5d26e89-72bf-5a78-96c7-2be80b03933e.html,"Mon, 22 Jul 2024 09:04:59 GMT",The One Episode of Breaking Bad BETTER Than Ozymandias,"{'href': 'https://www.wfmz.com', 'title': '69News WFMZ-TV'}"
https://news.google.com/rss/search?q=entertainment+news,Breaking down why we love a good underdog story,https://www.wionews.com/entertainment/bollywood/news-breaking-down-why-indians-are-obsessed-with-underdogs-and-their-stories-in-cinema-743070,"Mon, 22 Jul 2024 10:10:59 GMT",Breaking down why we love a good underdog story,"{'href': 'https://www.wionews.com', 'title': 'WION'}"
https://news.google.com/rss/search?q=entertainment+news,"Nick Jonas, Priyanka Chopra Mark Special Occasion With Heartwarming Photo",https://sunny99.iheart.com/content/2024-07-22-nick-jonas-priyanka-chopra-mark-special-occasion-with-heartwarming-photo/,"Mon, 22 Jul 2024 16:05:00 GMT","Nick Jonas, Priyanka Chopra Mark Special Occasion With Heartwarming Photo","{'href': 'https://sunny99.iheart.com', 'title': 'iHeart'}"
https://news.google.com/rss/search?q=entertainment+news,"Rahat Fateh Ali Khan denies arrest rumours in Dubai, Abhishek Bachchan addresses questions about Aishwary",https://timesofindia.indiatimes.com/entertainment/hindi/bollywood/news/rahat-fateh-ali-khan-denies-arrest-rumours-in-dubai-abhishek-bachchan-addresses-questions-about-aishwarya-rai-bachchan-celebs-pay-their-last-respects-to-tishaa-kumar-top-5-entertainment-news-of-the-day/articleshow/111936435.cms,"Mon, 22 Jul 2024 17:26:00 GMT","Rahat Fateh Ali Khan denies arrest rumours in Dubai, Abhishek Bachchan addresses questions about Aishwary","{'href': 'https://timesofindia.indiatimes.com', 'title': 'TOI Etimes'}"
https://news.google.com/rss/search?q=entertainment+news,"After Kamala Harris Announces Presidential Bid, THIS Clip From Julia Louis-Dreyfus Series Veep Is Going Viral.",https://www.timesnownews.com/entertainment-news/web-series/after-kamala-harris-announces-presidential-bid-this-clip-from-julia-louis-dreyfus-series-veep-is-going-viral-watch-article-111934895,"Mon, 22 Jul 2024 15:25:35 GMT","After Kamala Harris Announces Presidential Bid, THIS Clip From Julia Louis-Dreyfus Series Veep Is Going Viral.","{'href': 'https://www.timesnownews.com', 'title': 'Times Now'}"
https://news.google.com/rss/search?q=entertainment+news,Prabhas`s next film to feature this Pakistani actress?,https://www.wionews.com/entertainment/prabhass-next-film-to-feature-this-pakistani-actress-743091,"Mon, 22 Jul 2024 11:05:42 GMT",Prabhas`s next film to feature this Pakistani actress?,"{'href': 'https://www.wionews.com', 'title': 'WION'}"
https://news.google.com/rss/search?q=entertainment+news,Priyanka Chopra Enjoys Whale Watching Adventure With Mom Madhu Chopra And Daughter Malti Marie,https://www.timesnownews.com/entertainment-news/bollywood/priyanka-chopra-enjoys-whale-watching-adventure-with-mom-madhu-chopra-and-daughter-malti-marie-watch-article-111935420,"Mon, 22 Jul 2024 17:26:18 GMT",Priyanka Chopra Enjoys Whale Watching Adventure With Mom Madhu Chopra And Daughter Malti Marie | Watch,"{'href': 'https://www.timesnownews.com', 'title': 'Times Now'}"
https://news.google.com/rss/search?q=entertainment+news,"Tishaa Kumar death: Krishan, Tanya break down at daughter's funeral",https://www.business-standard.com/entertainment/tishaa-kumar-funeral-krishan-tanya-break-down-at-daughter-s-funeral-124072200922_1.html,"Mon, 22 Jul 2024 11:56:06 GMT","Tishaa Kumar death: Krishan, Tanya break down at daughter's funeral","{'href': 'https://www.business-standard.com', 'title': 'Business Standard'}"
https://news.google.com/rss/search?q=tennis+news,Olympic silver medalist Marketa Vondrousova and Hubert Hurkacz withdraw from tennis in Paris,https://abcnews.go.com/Sports/wireStory/marketa-vondrousova-withdraws-olympics-won-silver-medal-tennis-112162441,"Mon, 22 Jul 2024 15:00:00 GMT",Olympic silver medalist Marketa Vondrousova and Hubert Hurkacz withdraw from tennis in Paris,"{'href': 'https://abcnews.go.com', 'title': 'ABC News'}"
https://news.google.com/rss/search?q=tennis+news,Tokyo Tennis Silver Medalist Markéta Vondroušová Out of Paris Olympics With Injury,https://www.si.com/olympics/marketa-vondrousova-out-of-paris-olympics-with-injury,"Mon, 22 Jul 2024 15:36:25 GMT",Tokyo Tennis Silver Medalist Markéta Vondroušová Out of Paris Olympics With Injury,"{'href': 'https://www.si.com', 'title': 'Sports Illustrated'}"
https://news.google.com/rss/search?q=tennis+news,Nick Kyrgios starts unlikely ‘fame’ feud with ‘Hawk Tuah’ girl,https://nypost.com/2024/07/22/sports/nick-kyrgios-starts-unlikely-fame-feud-with-hawk-tuah-girl/,"Mon, 22 Jul 2024 14:33:00 GMT",Nick Kyrgios starts unlikely ‘fame’ feud with ‘Hawk Tuah’ girl,"{'href': 'https://nypost.com', 'title': 'New York Post'}"
https://news.google.com/rss/search?q=tennis+news,Newly-minted 'media dude' John Isner joins Andy Roddick on Served podcast,https://www.tennis.com/news/articles/newly-minted-media-dude-john-isner-joins-andy-roddick-on-served-podcast,"Mon, 22 Jul 2024 13:49:55 GMT",Newly-minted 'media dude' John Isner joins Andy Roddick on Served podcast,"{'href': 'https://www.tennis.com', 'title': 'Tennis Magazine'}"
https://news.google.com/rss/search?q=tennis+news,"Fils breaks the Top 20, Mover of Week",https://www.atptour.com/en/news/fils-pif-atp-rankings-22-july-2024,"Mon, 22 Jul 2024 13:28:57 GMT","Fils breaks the Top 20, Mover of Week","{'href': 'https://www.atptour.com', 'title': 'ATP Tour'}"
https://news.google.com/rss/search?q=tennis+news,Men's and Women's Tennis Earn ITA All-Academic Team and Scholar-Athlete Awards,https://goutrgv.com/news/2024/7/22/mens-tennis-mens-and-womens-tennis-earn-ita-all-academic-team-and-scholar-athlete-awards.aspx,"Mon, 22 Jul 2024 17:37:59 GMT",Men's and Women's Tennis Earn ITA All-Academic Team and Scholar-Athlete Awards,"{'href': 'https://goutrgv.com', 'title': 'UTRGV Athletics'}"
https://news.google.com/rss/search?q=tennis+news,Former Blue Hose Men’s Tennis Standout Max Benson Captures Professional Doubles Title,https://gobluehose.com/news/2024/7/22/mens-tennis-former-blue-hose-mens-tennis-standout-max-benson-captures-professional-doubles-title.aspx,"Mon, 22 Jul 2024 15:47:03 GMT",Former Blue Hose Men’s Tennis Standout Max Benson Captures Professional Doubles Title,"{'href': 'https://gobluehose.com', 'title': 'Presbyterian College'}"
https://news.google.com/rss/search?q=tennis+news,"Men’s Tennis Claims ITA All-Academic Team Award, Honors Seven Individuals",https://gocreighton.com/news/2024/7/22/mens-tennis-mens-tennis-claims-ita-all-academic-team-award-honors-seven-individuals.aspx,"Mon, 22 Jul 2024 18:12:26 GMT","Men’s Tennis Claims ITA All-Academic Team Award, Honors Seven Individuals","{'href': 'https://gocreighton.com', 'title': 'GoCreighton.com'}"
https://news.google.com/rss/search?q=tennis+news,Tarleton Tennis captures ITA All-Academic Team honors for sixth straight season,https://tarletonsports.com/news/2024/7/22/womens-tennis-tarleton-tennis-captures-ita-all-academic-team-honors-for-sixth-straight-season.aspx,"Mon, 22 Jul 2024 18:26:43 GMT",Tarleton Tennis captures ITA All-Academic Team honors for sixth straight season,"{'href': 'https://tarletonsports.com', 'title': 'Tarleton State University Athletics'}"
https://news.google.com/rss/search?q=tennis+news,"Four Wildcats Named ITA Scholar Athletes, Men’s Tennis Named ITA All-Academic Team",https://ukathletics.com/news/2024/07/22/four-wildcats-named-ita-scholar-athletes-mens-tennis-named-ita-all-academic-team/,"Mon, 22 Jul 2024 17:00:10 GMT","Four Wildcats Named ITA Scholar Athletes, Men’s Tennis Named ITA All-Academic Team","{'href': 'https://ukathletics.com', 'title': 'UKAthletics'}"
https://news.google.com/rss/search?q=tennis+news,"Women's Tennis Team, Three Individuals Garner ITA All-Academic Awards",https://pepperdinewaves.com/news/2024/7/22/womens-tennis-team-three-individuals-garner-ita-all-academic-awards.aspx,"Mon, 22 Jul 2024 17:01:32 GMT","Women's Tennis Team, Three Individuals Garner ITA All-Academic Awards","{'href': 'https://pepperdinewaves.com', 'title': 'Pepperdine University Athletics'}"
https://news.google.com/rss/search?q=tennis+news,Timothy Koch '02 named men's and women's tennis head coach,https://www.rider.edu/about/news/timothy-koch-02-named-mens-and-womens-tennis-head-coach,"Mon, 22 Jul 2024 14:18:06 GMT",Timothy Koch '02 named men's and women's tennis head coach,"{'href': 'https://www.rider.edu', 'title': 'News at Rider'}"
https://news.google.com/rss/search?q=tennis+news,Women’s Tennis Named an ITA All-Academic Team; Five Tigers Named Scholar Athletes,https://lsusports.net/news/2024/07/22/womens-tennis-named-an-ita-all-academic-team-five-tigers-named-scholar-athletes/,"Mon, 22 Jul 2024 17:01:53 GMT",Women’s Tennis Named an ITA All-Academic Team; Five Tigers Named Scholar Athletes,"{'href': 'https://lsusports.net', 'title': 'Louisiana State University Athletics'}"
https://news.google.com/rss/search?q=tennis+news,"USC Women’s Tennis Boasts Nine Scholar-Athletes, ITA All-Academic Team Honors",https://usctrojans.com/news/2024/7/22/womens-tennis-usc-womens-tennis-boasts-nine-scholar-athletes-ita-all-academic-team-honors.aspx,"Mon, 22 Jul 2024 17:37:01 GMT","USC Women’s Tennis Boasts Nine Scholar-Athletes, ITA All-Academic Team Honors","{'href': 'https://usctrojans.com', 'title': 'University of Southern California Official Athletic Site'}"
https://news.google.com/rss/search?q=tennis+news,Florida Tennis Earns All-Academic Team Honor and Six Individual Awards,https://floridagators.com/news/2024/7/22/womens-tennis-florida-tennis-earns-all-academic-team-honor-and-six-scholar-athlete-awards.aspx,"Mon, 22 Jul 2024 17:55:50 GMT",Florida Tennis Earns All-Academic Team Honor and Six Individual Awards,"{'href': 'https://floridagators.com', 'title': 'Florida Gators'}"
https://news.google.com/rss/search?q=tennis+news,Five Frogs Honored as ITA Scholar-Athletes,https://gofrogs.com/news/2024/7/22/mens-tennis-five-frogs-honored-as-ita-scholar-athletes.aspx,"Mon, 22 Jul 2024 17:51:35 GMT",Five Frogs Honored as ITA Scholar-Athletes,"{'href': 'https://gofrogs.com', 'title': 'TCU Athletics'}"
https://news.google.com/rss/search?q=tennis+news,"Tennis News: Carlos Alcaraz, Holger Rune and Steffi Graf",https://lobandsmash.com/posts/tennis-news-carlos-alcaraz-holger-rune-steffi-graf-01j3av68947k,"Mon, 22 Jul 2024 13:00:03 GMT","Tennis News: Carlos Alcaraz, Holger Rune and Steffi Graf","{'href': 'https://lobandsmash.com', 'title': 'Lob and Smash'}"
https://news.google.com/rss/search?q=tennis+news,Pickleball and tennis courts open at Mercer Park in Iowa City,https://cbs2iowa.com/news/local/pickleball-and-tennis-courts-open-at-mercer-park-in-iowa-city,"Mon, 22 Jul 2024 14:33:52 GMT",Pickleball and tennis courts open at Mercer Park in Iowa City,"{'href': 'https://cbs2iowa.com', 'title': 'KGAN TV'}"
https://news.google.com/rss/search?q=tennis+news,League-Best Nine Tritons Capture ITA Academic Honors,https://ucsdtritons.com/news/2024/7/22/womens-tennis-league-best-nine-tritons-capture-ita-academic-honors.aspx,"Mon, 22 Jul 2024 17:49:47 GMT",League-Best Nine Tritons Capture ITA Academic Honors,"{'href': 'https://ucsdtritons.com', 'title': 'UC San Diego Athletics'}"
https://news.google.com/rss/search?q=tennis+news,"WVU tennis named ITA All-Academic team, 7 Mountaineers named scholar-athletes",https://www.wboy.com/goldandbluenation/wvu-tennis-named-ita-all-academic-team-7-mountaineers-named-scholar-athletes/,"Mon, 22 Jul 2024 18:19:00 GMT","WVU tennis named ITA All-Academic team, 7 Mountaineers named scholar-athletes","{'href': 'https://www.wboy.com', 'title': 'WBOY.com'}"
https://news.google.com/rss/search?q=tennis+news,Men’s Tennis Named ITA All-Academic Team for 13th Consecutive Season,https://gamecocksonline.com/news/2024/07/22/mens-tennis-named-ita-all-academic-team-for-13th-consecutive-season/,"Mon, 22 Jul 2024 17:21:37 GMT",Men’s Tennis Named ITA All-Academic Team for 13th Consecutive Season,"{'href': 'https://gamecocksonline.com', 'title': 'South Carolina Gamecocks'}"
https://news.google.com/rss/search?q=tennis+news,"Women’s Tennis Named ITA All-Academic Team, Three Named Scholar-Athletes",https://gamecocksonline.com/news/2024/07/22/womens-tennis-named-ita-all-academic-team-three-named-scholar-athletes/,"Mon, 22 Jul 2024 17:08:38 GMT","Women’s Tennis Named ITA All-Academic Team, Three Named Scholar-Athletes","{'href': 'https://gamecocksonline.com', 'title': 'South Carolina Gamecocks'}"
https://news.google.com/rss/search?q=tennis+news,Cyclone Tennis An ITA All-Academic Team,https://cyclones.com/news/2024/7/22/cyclone-tennis-an-ita-all-academic-team.aspx,"Mon, 22 Jul 2024 17:28:54 GMT",Cyclone Tennis An ITA All-Academic Team,"{'href': 'https://cyclones.com', 'title': 'Iowa State University Athletics'}"
https://news.google.com/rss/search?q=tennis+news,Cowgirls Receive ITA Team Academic Award,http://gowyo.com/news/2024/7/22/womens-tennis-cowgirls-receive-ita-team-academic-award.aspx,"Mon, 22 Jul 2024 17:20:48 GMT",Cowgirls Receive ITA Team Academic Award,"{'href': 'http://gowyo.com', 'title': 'Wyoming Athletics'}"
https://news.google.com/rss/search?q=tennis+news,Letter: More tennis courts won't benefit majority of Palm Coast residents,https://www.observerlocalnews.com/news/2024/jul/22/letter-more-tennis-courts-wont-benefit-large-number-of-residents/,"Mon, 22 Jul 2024 12:15:00 GMT",Letter: More tennis courts won't benefit majority of Palm Coast residents,"{'href': 'https://www.observerlocalnews.com', 'title': 'Palm Coast Observer and Ormond Beach Observer'}"
