"Input URL","Title","Link","Published","Description","Source","Category"
"https://news.google.com/rss/search?q=site:cnbc.com","‘Vibe revenue': AI companies admit they're worried about a bubble","https://www.cnbc.com/2025/11/14/vibe-revenue-ai-companies-admit-theyre-worried-about-a-bubble.html","Fri, 14 Nov 2025 06:13:36 GMT","



LISBON, Portugal — Top tech executives told CNBC they're concerned about a bubble forming in the artificial intelligence sector, underscoring growing unease within the industry over soaring valuation.

In recent weeks, markets have been reckoning with the notion that too much capital is pouring into the AI boom, clouding the outlook on revenue and actual profit and putting high valuations into question.

Up to now, warnings around overstretched valuations have mostly come from investors and leaders in the world of finance. Goldman Sachs' David Solomon and Morgan Stanley's Ted Pick have warned of potential corrections as valuations of some major tech firms reached historic highs.

The concerns have been crystallized by famed 'Big Short' investor Michael Burry, who this week accused major AI infrastructure and cloud providers, or 'hyperscalers' of understating depreciation expenses on chips. Burry warned that profits at the likes of Oracle and Meta may be vastly overstated. He recently disclosed put options that bet against Nvidia and Palantir.

However, CEOs of companies who are themselves developing AI, expressed their concerns this week during interviews with CNBC at the Web Summit tech conference in Lisbon.

""I think the evaluations are pretty exaggerated here and there, and I think there is signs of a bubble on the horizon,"" Jarek Kutylowski, CEO of German AI firm DeepL, told CNBC on Tuesday.

The sentiment was echoed by Picsart CEO Hovhannes Avoyan.

""We see lots of AI companies raising ... tremendous valuations ... without any revenue,"" Avoyan told CNBC on Tuesday, adding that it is a ""concern.""

The market values smaller startups with ""just some noise and vibe revenue,"" he said, referring to companies being backed even though they have minimal sales.

Vibe revenue is a play on ""vibe coding,"" a term that refers to using AI to code without needing deep technical expertise.

Even with concerns over valuations, the technology industry remains bullish on the long term potential of AI.

Lyft CEO David Risher said there are reasons to be optimistic given the potential impact of AI but acknowledged the risks.

""Let's be clear, we are absolutely in a financial bubble. There is no question, right? Because this is incredible, transformational technology. No one wants to be left behind.""

Risher went on to argue that there is a difference between the financial bubble and the industrial outlook.

""The data centers and all the model creation, all of that is going to have a long, long life, because it's transformational. It makes people's lives easier. It makes people's lives better… On the other hand, you know, the financial side, it's a little risky right now.""

The tech CEOs also addressed their outlook on AI demand for 2026 from businesses, as investors look for any clues as to what this will look like.

""I think there's a lot of demand, and there's a lot of interest. I think everybody understands that AI can do magical things to businesses, and... we can all operate on another level when it comes to efficiency,"" Kutylowski said.

Still, businesses are ""strugging in adopting"" AI. ""We're going to get further, but I don't think we're that we're going to be in a place where we can say, like every enterprise, every organization, has it figured out totally,"" Kutylowski said.

DeepL's core product is an AI translation tool but it recently launched a more general purpose ""agent"" designed to be able to carry out tasks on behalf of employees.

Francois Chadwick, the chief financial officer of Cohere, a company that is also focused on enterprise AI, told CNBC on Tuesday that ""demand is definitely there.""

Despite the concerns over overstretched valuations and huge capex spend, the investment into artificial intelligence doesn't appear to be slowing down. A report from venture capital group Accel released this week showed that the buildout of new AI data center capacity is forecast to reach 117 gigawatts by 2030 which translates into about $4 trillion worth of capital expenditure over the next 5 years.

About $3.1 trillion worth of revenue is required to pay back that capex, according to the Accel report.

Already this year, there have been a slew of deals worth billions announced by the likes of Nvidia and OpenAI as they look to develop data center capacity around the world in a bid to keep up with demand.

Philippe Botteri, a partner at Accel, said that three major factors will drive that revenue — more powerful AI models that require capacity to be trained, the use of new AI services and the ""agentic revolution in the enterprise.""

""Agentic"" is often a term used to describe a type of AI tool that can automatically carry out tasks on behalf of users.

But not everyone believes that the large amount of spending is necessary.

Ben Harburg, managing partner at Novo Capital says the figures being discussed by large tech firms for future investment may be overblown.

""We hear these crazy headline numbers about how much energy is going to be needed, how many chips are going to be needed, although, again, I think that there is probably more of a bubble brewing there than on kind of the front end, the actual product front,"" Harburg told CNBC on Tuesday.

""I think we're starting to realize that there's been probably over exuberance around data centers. Even Sam [Altman], I think, would privately admit that they need fewer chips than they originally set out, they need less capital than they originally set out. They need less energy than they originally set out.""

Got a confidential news tip? We want to hear from you.

Sign up for free newsletters and get more CNBC delivered to your inbox

Get this delivered to your inbox, and more info about our products and services.

© 2025 CNBC LLC. All Rights Reserved. A Division of NBCUniversal


      Data is a real-time snapshot *Data is delayed at least 15 minutes.
      Global Business and Financial News, Stock Quotes, and Market Data
      and Analysis.
    

Data also provided by","{'href': 'https://www.cnbc.com', 'title': 'CNBC'}","business"
"https://news.google.com/rss/search?q=site:cnbc.com","UK borrowing costs spike on report government to scrap plans to raise income tax","https://www.cnbc.com/2025/11/14/uk-borrowing-costs-spike-on-report-government-to-scrap-plans-to-raise-income-tax.html","Fri, 14 Nov 2025 08:24:45 GMT","



British government bond yields rose sharply on Friday following reports Finance Minister Rachel Reeves is no longer planning to raise income tax rates in the Autumn Budget later this month.

The yield on the benchmark 10-year gilt rose around 12 basis points in early trade, before paring gains to trade at 4.498%. Yields and prices move inversely to one another.

The moves came as investors reacted to a report from the Financial Times of an income tax U-turn. The Treasury was not immediately available to comment when contacted by CNBC on Friday morning.

U.K. stocks were also lower. The FTSE 100 index shed over 1% at 8:54 a.m. in London (3:54 a.m. ET), with Lloyds, Natwest, and Barclays banks occupying the bottom of the index, each losing more than 2.8%.

Reeves had spent the past week apparently laying the groundwork for a manifesto-breaking rise in income tax, which split Labour party lawmakers and led to further turmoil in the already embattled party, whose leader Prime Minister Keir Starmer has dismal approval ratings. 

A proposed 2p national income increase was to be offset by a 2p reduction in national insurance. There are now expectations, however, that the £30 billion ($39.5 billion) hole in the government's budget will be filled by a patchwork of smaller rises.  

It could be a ""fiscal reckoning"" as a patchwork approach will put pressure on the gilt market, Wren Sterling's investment chief Rory McPherson told CNBC's ""Squawk Box Europe"" on Friday.  

""Within the U.K., if we have more of the smaller taxes being targeted as part of the programme from Rachel Reeves, I think that's going to put more pressure on the government, more pressure on them to go back to the bond markets and ask for more money, which in turn puts more pressure up on yields,"" McPherson said.

He added that there has been a ""big march down"" in yields but now ""we're pulling away that that."" 

Volatility this year has left long-term borrowing costs hovering at their highest level since the late 1990s, with U.K. debt having the heftiest price tag in the G7. 

McPherson said that the Bank of England will still be able to make an interest rate cut after the budget, if it wants to. Other investors appear to have curbed their optimism, with bets on cuts shedding six basis points compared with Thursday, according to data compiled by LSEG.

The Autumn Budget is expected on Nov. 26.

Got a confidential news tip? We want to hear from you.

Sign up for free newsletters and get more CNBC delivered to your inbox

Get this delivered to your inbox, and more info about our products and services.

© 2025 CNBC LLC. All Rights Reserved. A Division of NBCUniversal


      Data is a real-time snapshot *Data is delayed at least 15 minutes.
      Global Business and Financial News, Stock Quotes, and Market Data
      and Analysis.
    

Data also provided by","{'href': 'https://www.cnbc.com', 'title': 'CNBC'}","business"
"https://news.google.com/rss/search?q=site:cnbc.com","European stocks poised to lose ground as AI valuations shake confidence","https://www.cnbc.com/2025/11/14/europe-markets-14-nov-stoxx-600-fed-cut-ai-bubble-china-economy.html","Fri, 14 Nov 2025 07:12:54 GMT","



European stocks were lower on Friday as worries about an artificial intelligence bubble and the global economy shake investor confidence.

The pan-European Stoxx 600 was 0.8% lower an hour into the session, with all major bourses in negative territory.

China's economic slowdown ramped up in October, with data showing fixed asset investment – which includes the country's closely watched real estate sector – contracted in the first 10 months of the year. Retail sales softened, meanwhile, and industrial output growth also slowed.

Investors are also reeling from big losses on Wall Street on Thursday, as concerns about AI valuations and the U.S. interest rate trajectory mounted. Big Tech stocks were hit particularly hard, with the tech-heavy Nasdaq Composite shedding 2.3% by the closing bell.

Comments from Federal Reserve officials in recent weeks have prompted money markets to reconsider the likelihood of a December rate cut from the central bank. By Friday morning, markets were pricing in a 52.1% chance of the Fed cutting by 25 basis points at its next meeting. A month ago, the market had assigned a 95% probability to an end of year cut.

Back in Europe, yields on U.K. government bonds — known as gilts — spiked on Friday, amid reports that the Labour government was U-turning on an income tax raid that had been planned as part of the looming Autumn Budget.

Bond prices and yields move in opposite directions, meaning a spike in yields represents a sell off of the assets.

By 9 a.m. in London (4 a.m. ET), the yield on the benchmark 10-year gilt had risen by 7 basis points to 4.5%, climbing down from an earlier spike that saw yields rise by as much as 13 basis points at the longer end of the maturity curve. Yields on the long term 20- and 30-year gilts rose by 8 and 9 basis points, respectively.

Meanwhile, the British pound fell as markets reacted to the reports. Sterling was last seen trading 0.2% lower against both the U.S. dollar and the euro.

Corporate earnings also continue to hold the spotlight in Europe, with German insurer Allianz among the companies reporting on Friday.

Allianz said it had achieved record results in the first nine months of the year, bolstered by double-digit growth in operating profit in the third quarter. Operating profit for the three months to September jumped 12.6% to 4.4 billion euros ($5.1 billion), largely driven by the firm's Property-Casualty division.

The company said it expects to achieve an operating profit of at least 17 billion euros this year, which sits in the upper end of its full-year guidance range.  

Allianz shares were last seen trading around 1% higher.

Across the Atlantic, U.S. stock futures were little changed on Friday morning following Wall Street's Thursday sell off.

Overnight in Asia, stocks fell as investors monitored Wall Street moves and reacted to the Chinese data.

Got a confidential news tip? We want to hear from you.

Sign up for free newsletters and get more CNBC delivered to your inbox

Get this delivered to your inbox, and more info about our products and services.

© 2025 CNBC LLC. All Rights Reserved. A Division of NBCUniversal


      Data is a real-time snapshot *Data is delayed at least 15 minutes.
      Global Business and Financial News, Stock Quotes, and Market Data
      and Analysis.
    

Data also provided by","{'href': 'https://www.cnbc.com', 'title': 'CNBC'}","business"
"https://news.google.com/rss/search?q=bitcoin","Bitcoin Spot ETFs See $869M Outflow, Second-Largest on Record","https://www.coindesk.com/markets/2025/11/14/bitcoin-spot-etfs-see-usd869m-outflow-second-largest-on-record","Fri, 14 Nov 2025 06:04:46 GMT","

The 11 U.S.-listed spot bitcoin exchange-traded funds (ETFs) collectively bled $869.86 million Thursday, registering their second-highest outflow on record, according to data source SoSoValue. 

Investors have pulled out $2.64 billion over three weeks, signaling growing caution and shifting sentiment in the market. 

Thursday's outflow coincided with Bitcoin's fall below the key $100,000 support level and heightened risk aversion on Wall Street. Ether ETFs also registered an outflow of $259.72 million, the highest since Oct. 13. 

As of writing, bitcoin traded near $97,500, down over 5% in 24 hours and 11% on a month-to-date basis, according to data source CoinDesk. 



More For You

OwlTing: Stablecoin Infrastructure for the Future

Stablecoin payment volumes have grown to $19.4B year-to-date in 2025. OwlTing aims to capture this market by developing payment infrastructure that processes transactions in seconds for fractions of a cent.

More For You

3 Key Charts to Track as Ether Strengthens Against Bitcoin

Ether strengthens against bitcoin, raising hopes of a bullish breakout. 

What to know: 

Disclosure & Polices: CoinDesk is an award-winning media outlet that covers the cryptocurrency industry. Its journalists abide by a strict set of editorial policies. CoinDesk has adopted a set of principles aimed at ensuring the integrity, editorial independence and freedom from bias of its publications. CoinDesk is part of Bullish (NYSE:BLSH), an institutionally focused global digital asset platform that provides market infrastructure and information services. Bullish owns and invests in digital asset businesses and digital assets and CoinDesk employees, including journalists, may receive Bullish equity-based compensation.","{'href': 'https://www.coindesk.com', 'title': 'CoinDesk'}","cryptocurrency"
"https://news.google.com/rss/search?q=bitcoin","Bitcoin Death Cross in 48 Hours — Is This the Real Bottom or a Drop to $70K?","https://finance.yahoo.com/news/bitcoin-death-cross-48-hours-072849391.html","Fri, 14 Nov 2025 07:28:00 GMT","

Oops, something went wrong

Bitcoin (BTC) fell below $100,000. It is now approaching a Bitcoin death cross, a technical event where the 50-day SMA crosses below the 200-day SMA.

Historically, this pattern has often appeared near market bottoms. However, the macro environment and the market structure of 2025 are no longer the same as in previous cycles. This raises a critical question: Is this the actual bottom, or merely one step in a more extended capitulation phase?

Several analysts have been watching the approaching Bitcoin death cross. The 50-day SMA is expected to cross below the 200-day SMA within the next few days.

According to analyst Colin, the upcoming Bitcoin death cross is expected around mid-November, which means it is only 1–2 days away. Before it happens, Colin expects BTC to decline further, with altcoins potentially dropping even more. This aligns with BTC's recent retracement below $100,000.

“The projected Bitcoin ‘Death Cross' (50 day crossing below 200 day SMA) is a timing element for when the bottom might be in.” Colin commented.

Multiple observations also support the idea that BTC typically forms a bottom around such events, although timing may vary. Another analyst on X detailed the pattern's occurrence over the past 7 years.

Between 2018 and April 2025, Bitcoin has experienced at least eight death cross events. Each time, BTC formed a local bottom within 5–9 days and rallied at least 45% from the lows. If we consider the recent dip below $100,000 as a local bottom, projections suggest BTC could rise to at least $145,000 afterward.

Supporting this view, analyst Ash Crypto noted that in the last three death crosses, Bitcoin bottomed within a week before rallying strongly to new all-time highs.

However, some analysts present a more cautious scenario. Another X user points out that while the Bitcoin death cross is indeed about to form, the average maximum loss following the cross is typically over 30% within 12 months. Historically, BTC takes an average of 141 days to reach a peak after a cross.

If the death cross occurs in mid-November with BTC hovering around $100,000, this model suggests a potential retracement toward the $70,000 region. A new upward cycle may then resume.

If the Bitcoin death cross aligns with a final capitulation flush, history suggests a sharp rebound in the weeks that follow. Conversely, if macro conditions worsen, the death cross could instead signal a deeper correction, consistent with the historical average drawdown of roughly 30% within a year.

It is also essential to note that a death cross is primarily a timing indicator, not a guarantee of a bottom or a top. Traders should consider factors like trading volume, RSI/MACD divergences, on-chain activity, and stablecoin liquidity. These help assess the probability more accurately.

At the current moment, the higher-probability scenario is a short-term capitulation, followed by the formation of the Bitcoin death cross, and then a strong rebound. Still, short-term traders should manage risk carefully: set appropriate stop-loss levels and wait for recovery confirmation, such as a daily close above the SMA50 with rising volume, before allocating heavily.

Read original story Bitcoin Death Cross in 48 Hours — Is This the Real Bottom or a Drop to $70K? by Linh Bùi at beincrypto.com","{'href': 'https://finance.yahoo.com', 'title': 'Yahoo Finance'}","cryptocurrency"
"https://news.google.com/rss/search?q=bitcoin","Why Bitcoin (BTC), XRP (XRP), Ether (ETH) Tank While Gold, Silver Shine Bright?","https://www.coindesk.com/markets/2025/11/14/why-bitcoin-xrp-sol-and-eth-slide-as-gold-and-silver-soar","Fri, 14 Nov 2025 02:59:44 GMT","

Major cryptocurrencies are facing persistent pressure this month, even as gold and silver rally.

These diverging trends reflect risks unique to digital assets, as mounting concerns over government stability propel precious metals higher, highlighting a strengthening investor confidence in traditional safe havens.

This month, bitcoin BTC$97,290.40, the largest cryptocurrency by market value, has slipped over 9%, falling below the critical on-chain support level of $100,000, CoinDesk data show. This weakness has spread across the broader crypto market, pulling down major tokens like Ethereum's ether ETH$3,195.32, solana SOL$143.28, and DOGE$0.1633 by 11% to 20%. Payments-focused XRP has shown relative resilience, declining just over 7%.

The weak tone comes despite the dollar index (DXY) rally losing momentum after encountering resistance above 100 earlier this month. Typically, a fading DXY – which measures the U.S. dollar against a basket of global currencies – bodes well for bitcoin and the broader crypto market, as well as for precious metals.

However, while bitcoin remains subdued, precious metals have found strength; gold and silver have climbed 4% and 9%, respectively, this month. Less-tracked precious metals, such as palladium and platinum, have also seen gains exceeding 1%.

So, what's holding bitcoin back? According to Greg Magadini, director of derivatives at Amberdata, much of the bullish news has already been priced in, leaving BTC vulnerable to bearish developments.

""Post government shutdown, risk assets are selling off as all the 'good news' catalysts are being used. Fed easing via FOMC, China/U.S. trade cooperation, and a now resolved government shutdown,"" Magadini told CoinDesk.

""Bitcoin traders have been bullishly positioned given a strong fundamental backdrop for an EOY rally, but positioning is likely being flushed as the market was overly positioned long with no one to buy next,"" he added.

Beyond positioning, fears of a deeper system risk are also weighing on cryptocurrencies, Magadini explained, highlighting a potential credit freeze as a major risk to digital asset treasuries (DATs).

These entities have been a significant source of bullish pressure for cryptocurrencies over the past year, relying heavily on credit markets to fund their crypto purchases, often through convertible bonds and debt issuance. However, DATs are not alone in this competition for capital; they face increasing pressure as sovereign governments and AI-related ventures vie for the same constrained pools of credit.

With the recent surge in DAT formation, demand for credit has increased substantially, Magadini noted, adding that should credit markets tighten or freeze, these companies could struggle to refinance their obligations, forcing them to sell their coin holdings to meet debt payments. This forced selling could trigger a cascade, as subsequent DATs might also be pressured to liquidate their assets.

""As crypto is sold, the next tranche of DATs could be forced to sell as well (so on and so forth). Although this risk is less pronounced with quality assets (such as BTC), the downward-spiral risk increases for DATs who recently purchased volatile altcoins at peak valuation,"" Magadini said.

""Today the market is likely thinking about this type of credit risk,"" he noted. (DATs are already facing the heat in the far east.)

Precious metals have gained ground mainly due to mounting concerns about the fiscal health of major economies, including the U.S.

Fiscal strain is evident in the soaring government debt-to-GDP ratios of many advanced economies. For instance, Japan's ratio exceeds 220%, while the United States stands above 120%. France and Italy also carry substantial debt burdens, exceeding 110%. While China's government debt-to-GDP is below 100%, its total non-financial debt exceeds 300% of GDP, making it one of the most indebted countries in the world.

The problem is particularly acute in the Eurozone, according to Robin Brooks, senior fellow in the Global Economy and Development program at the Brookings Institution.

""The precious metals rally isn't about a flight out of USD. It's a symptom of profoundly broken fiscal policy, which is true globally, especially in the Eurozone, where high-debt countries control the ECB,"" Brooks said on X.

Interestingly, gold has a history of leading BTC price movements. Analysis by market experts indicates that BTC tends to lag behind gold by approximately 80 days, suggesting that once the yellow metal's rally eventually stalls, the cryptocurrency may receive a strong bid.

Whether this pattern holds in the current macroeconomic environment remains to be seen.

More For You

OwlTing: Stablecoin Infrastructure for the Future

Stablecoin payment volumes have grown to $19.4B year-to-date in 2025. OwlTing aims to capture this market by developing payment infrastructure that processes transactions in seconds for fractions of a cent.

More For You

3 Key Charts to Track as Ether Strengthens Against Bitcoin

Ether strengthens against bitcoin, raising hopes of a bullish breakout. 

What to know: 

Disclosure & Polices: CoinDesk is an award-winning media outlet that covers the cryptocurrency industry. Its journalists abide by a strict set of editorial policies. CoinDesk has adopted a set of principles aimed at ensuring the integrity, editorial independence and freedom from bias of its publications. CoinDesk is part of Bullish (NYSE:BLSH), an institutionally focused global digital asset platform that provides market infrastructure and information services. Bullish owns and invests in digital asset businesses and digital assets and CoinDesk employees, including journalists, may receive Bullish equity-based compensation.","{'href': 'https://www.coindesk.com', 'title': 'CoinDesk'}","cryptocurrency"
