"Input URL","Title","Link","Published","Description","Source","Category"
"https://news.google.com/rss/search?q=site:news-medical.net","New symposium empowers early career scientists in stem cell and developmental biology","https://www.news-medical.net/news/20251113/New-symposium-empowers-early-career-scientists-in-stem-cell-and-developmental-biology.aspx","Fri, 14 Nov 2025 01:06:00 GMT","

For the first time, the International Society for Stem Cell Research (ISSCR), the Society for Developmental Biology (SDB), and the Allen Institute are collaborating to present a three-day scientific symposium led by early-career scientists. The Stem Cell & Developmental Biology Early Career Symposium is designed to nurture the next generation of researchers and provide a platform for professional growth while fostering collaboration at the intersection of developmental biology and stem cell science.

The organizing committee comprises:

Alessandro Bertero, University of Torino, Italy
Ken Cho, University of California, Irvine, USA
Gideon Dunster, Allen Institute, USA
Whitney Edwards, University of North Carolina, USA
Evan Graham, BioLamina, USA
Valentina Greco, Yale School of Medicine, USA
Leigh Harris, Allen Institute, USA
Serge Parent, Allen Institute, USA
Helen Willsey, University of California, San Francisco, USA

The committee is developing an engaging program that promotes cross-disciplinary exchange and amplifies the voices of emerging leaders in the field. Confirmed topics and speakers include:

Data Analysis Across Scales
Christina Theodoris, Gladstone Institute, San Francisco, USA
Sadao Ota, University of Tokyo, Japan
Bruno Vellutini, University Federal de Minas Gerais, Brazil
Leslie Sepaniac, University of Wisconsin, USA

Model Systems and the Organism
Aguilera Castrejon, Howard Hughes Medical Institute, Janelia Research Campus, USA
Akane Kawaguchi, National Institute of Genetics, Japan
Yangfei Xiangling, Shanghai Tech, China
Marta Shahbazi, MRC Laboratory of Molecular Biology, Cambridge, UK

Spatial Awareness
Can Aztekin, Max Planck, Germany
Gianluca Amadei, University of Padua, Italy
Lynn Yap, Nanyang Technological University, Singapore
Claudia Vásquez, University of Washington, USA

Cell Fates and Trials
Ariel Waisman, FLENI, Argentina
Crystal Rogers, University of California, Davis, USA
Nika Shakiba, University of British Columbia, Canada
Alyssa Miller, Conception, USA

More information about the program will be available in the coming months. Mark your calendar for 23-25 September 2026 in Seattle, USA.

International Society for Stem Cell Research

Posted in: Molecular & Structural Biology | Cell Biology

Cancel reply to comment

Sheela Muley and Sushmita Sudarshan

Explore how smart automation enables precise, reproducible workflows in anaerobic microbiome research, improving accuracy and experimental control.

Dr Rahul Goyal

Discover how generative AI is reshaping clinical care with real-world examples, challenges, and expert advice for AI adoption in healthcare

Dan Schieffer

DeNovix discusses how customer demand inspired the development of specialized CellDrop applications for hepatocytes and organoids.



                                                  
                                                        News-Medical.Net provides this medical information service in accordance
                                                        with these terms and conditions.
                                                        Please note that medical information found
                                                        on this website is designed to support, not to replace the relationship
                                                        between patient and physician/doctor and the medical advice they may provide.
                                                  
                                                  

                                            

Last Updated: Friday 14 Nov 2025



News-Medical.net - An AZoNetwork Site

Owned and operated by AZoNetwork, © 2000-2025


                Your AI Powered Scientific Assistant
            

Hi, I'm Azthena, you can trust me to find commercial scientific answers from News-Medical.net.

To start a conversation, please log into your AZoProfile account first, or create a new account.

Registered members can chat with Azthena, request quotations, download pdf's, brochures and subscribe to our related newsletter content.

A few things you need to know before we start. Please read and accept to continue.

Please check the box above to proceed.

Great. Ask your question.


                Azthena may occasionally provide inaccurate responses.
Read the full terms.
            

Terms


            While we only use edited and approved content for Azthena
            answers, it may on occasions provide incorrect responses.
            Please confirm any data provided with the related suppliers or
            authors. We do not provide medical advice, if you search for
            medical information you must always consult a medical
            professional before acting on any information provided.
        


            Your questions, but not your email details will be shared with
            OpenAI and retained for 30 days in accordance with their
            privacy principles.
        


            Please do not ask questions that use sensitive or confidential
            information.
        

Read the full Terms & Conditions.

Provide Feedback","{'href': 'https://www.news-medical.net', 'title': 'News-Medical'}","health"
"https://news.google.com/rss/search?q=site:news-medical.net","UCSF study explores sentiment analysis for hepatorenal syndrome","https://www.news-medical.net/news/20251114/UCSF-study-explores-sentiment-analysis-for-hepatorenal-syndrome.aspx","Fri, 14 Nov 2025 06:09:00 GMT","

Taking a page from market research tactics, UC San Francisco experts are studying whether artificial intelligence (AI) can improve diagnosis of a complex liver condition by using the clinical notes of multiple providers. 

Their recent study, published in Gastro Hep Advances, focused on hepatorenal syndrome (HRS), a complex condition associated with liver disease that is often difficult to diagnose during hospitalization. The researchers sought to learn if large language models could analyze the clinical notes of multiple physicians and other providers to improve diagnostic accuracy and streamline patient care. 

""The concept is inspired by sentiment analysis technology commonly used with reviews in online shopping platforms, where AI summarizes collective opinions,"" said Jin Ge, MD, MBA, UCSF assistant professor of medicine and gastroenterologist, who led the study.

We utilized this approach to determine if collective sentiment could predict an HRS diagnosis.""

Jin Ge, MD, MBA, Assistant Professor, University of California - San Francisco

The study compared traditional diagnostic methods based on clinical variables, such as lab results, with an AI-enhanced model that incorporated sentiment analysis derived from clinical notes. Incorporating AI-generated sentiment scores significantly improved predictive accuracy for HRS diagnosis upon patient discharge. 

The technology offers clarity in situations where conflicting recommendations among health care professionals may arise, providing a unified summary of the care team's consensus for clinicians and patients alike. While still in the research phase, this application has the potential to transform decision-making in hospitals and enhance patient outcomes. 

""Using the 'wisdom of the crowd' doesn't just predict outcomes, it offers a directional insight into what the clinical care team collectively thinks about a patient's condition,"" said Ge. ""For cases with mixed opinions or uncertainty, AI-generated summaries could help align care decisions and expedite treatment plans."" 

The study has not yet been implemented in clinical practice but could pave the way for future trials. The researchers aim to evaluate how this information might influence real-world decision-making and patient care.

University of California - San Francisco

Lai, M., et al. (2025). Clinical Sentiment Analysis by Large Language Models Enhances Prediction of Hepatorenal Syndrome. Gastro Hep Advances. DOI:10.1016/j.gastha.2025.100797. https://www.sciencedirect.com/science/article/pii/S2772572325001840.

Posted in: Device / Technology News | Medical Science News | Medical Research News | Medical Condition News

Cancel reply to comment

Sheela Muley and Sushmita Sudarshan

Explore how smart automation enables precise, reproducible workflows in anaerobic microbiome research, improving accuracy and experimental control.

Dr Rahul Goyal

Discover how generative AI is reshaping clinical care with real-world examples, challenges, and expert advice for AI adoption in healthcare

Dan Schieffer

DeNovix discusses how customer demand inspired the development of specialized CellDrop applications for hepatocytes and organoids.



                                                  
                                                        News-Medical.Net provides this medical information service in accordance
                                                        with these terms and conditions.
                                                        Please note that medical information found
                                                        on this website is designed to support, not to replace the relationship
                                                        between patient and physician/doctor and the medical advice they may provide.
                                                  
                                                  

                                            

Last Updated: Friday 14 Nov 2025



News-Medical.net - An AZoNetwork Site

Owned and operated by AZoNetwork, © 2000-2025


                Your AI Powered Scientific Assistant
            

Hi, I'm Azthena, you can trust me to find commercial scientific answers from News-Medical.net.

To start a conversation, please log into your AZoProfile account first, or create a new account.

Registered members can chat with Azthena, request quotations, download pdf's, brochures and subscribe to our related newsletter content.

A few things you need to know before we start. Please read and accept to continue.

Please check the box above to proceed.

Great. Ask your question.


                Azthena may occasionally provide inaccurate responses.
Read the full terms.
            

Terms


            While we only use edited and approved content for Azthena
            answers, it may on occasions provide incorrect responses.
            Please confirm any data provided with the related suppliers or
            authors. We do not provide medical advice, if you search for
            medical information you must always consult a medical
            professional before acting on any information provided.
        


            Your questions, but not your email details will be shared with
            OpenAI and retained for 30 days in accordance with their
            privacy principles.
        


            Please do not ask questions that use sensitive or confidential
            information.
        

Read the full Terms & Conditions.

Provide Feedback","{'href': 'https://www.news-medical.net', 'title': 'News-Medical'}","health"
"https://news.google.com/rss/search?q=site:news-medical.net","Cardiologists recommend reassessing need for additional stents later","https://www.news-medical.net/news/20251114/Cardiologists-recommend-reassessing-need-for-additional-stents-later.aspx","Fri, 14 Nov 2025 05:55:00 GMT","

A blocked coronary artery causing an acute heart attack must be opened immediately with a stent procedure. However, if other coronary arteries also appear to be narrowed, it is safe to wait and treat those later. This approach cuts the number of stent procedures in half, according to cardiologists from Radboud university medical center, writing in The New England Journal of Medicine.

Each year, 33,600 people are admitted to the hospital with a heart attack. In those cases, doctors must quickly open the blocked artery with angioplasty to prevent part of the heart muscle from dying. Yet during the procedure, it often becomes clear that other coronary arteries are also narrowed. Researchers from 41 hospitals, led by Radboudumc, investigated whether it is necessary to treat those narrowed vessels immediately, or if it can be done safely later, under calmer circumstances.

Their study, involving 1,146 participants, shows that waiting is safe. Only patients with an acute heart attack were included. This means that a coronary artery is completely blocked, for example by a blood clot. Half of the patients received full treatment immediately, while for the other half, additional stenting was done up to six weeks later. The researchers followed the patients for three years. Robin Nijveldt, Professor of Cardiovascular Imaging at Radboudumc, explains.

We saw no difference between the two groups in terms of death, new heart attacks, or hospital admissions due to heart failure.""

Robin Nijveldt, Professor, Cardiovascular Imaging, Radboud University Medical Center

One striking finding: in the later, calmer phase, cardiologists treated only half as many narrowed arteries as in the acute phase. 'That's because of how we determine whether stenting is necessary', says Professor of Cardiology Niels van Royen. 'In the acute phase, we use a catheter to measure pressure inside the blood vessel. Later, we can perform an MRI scan to map the heart's overall blood flow. If that shows the heart is getting enough oxygen, then stenting a single narrowed artery isn't required.'

Still, the cardiologists don't advise delaying additional treatment deliberately. 'For patients, it's usually more convenient to have everything done in one procedure', Van Royen explains. 'But sometimes that's not possible - for example, if the patient is in pain and exhausted, or if another person with an acute heart attack arrives and takes priority. Now we know it's safe to stop at that point. There's no need to force things, because faster is not better.'

It's also now clear that cardiologists can reassure patients a few weeks later with an MRI scan showing that no further stenting is needed. 'But patients do need to come back for the MRI', Van Royen notes. 'Some choose to skip the follow-up, even though additional treatment might still be wise.'

The cardiologists expect that current guidelines - which recommend immediate treatment of all narrowed arteries during the acute phase - will soon be revised. 'These guidelines were based on two major studies that showed a small short-term benefit to immediate treatment, but not in the long term', Nijveldt says. 'Our study provides more clarity: that benefit doesn't actually exist.'

Radboud University Medical Center

Nijveldt, R., et al. (2025). Immediate or Deferred Nonculprit-Lesion PCI in Myocardial Infarction. New England Journal of Medicine. DOI:10.1056/nejmoa2512918. https://www.nejm.org/doi/full/10.1056/NEJMoa2512918?utm_source=conf&utm_medium=qr&utm_campaign=TCT2025.

Posted in: Medical Science News | Medical Research News

Cancel reply to comment

Sheela Muley and Sushmita Sudarshan

Explore how smart automation enables precise, reproducible workflows in anaerobic microbiome research, improving accuracy and experimental control.

Dr Rahul Goyal

Discover how generative AI is reshaping clinical care with real-world examples, challenges, and expert advice for AI adoption in healthcare

Dan Schieffer

DeNovix discusses how customer demand inspired the development of specialized CellDrop applications for hepatocytes and organoids.



                                                  
                                                        News-Medical.Net provides this medical information service in accordance
                                                        with these terms and conditions.
                                                        Please note that medical information found
                                                        on this website is designed to support, not to replace the relationship
                                                        between patient and physician/doctor and the medical advice they may provide.
                                                  
                                                  

                                            

Last Updated: Friday 14 Nov 2025



News-Medical.net - An AZoNetwork Site

Owned and operated by AZoNetwork, © 2000-2025


                Your AI Powered Scientific Assistant
            

Hi, I'm Azthena, you can trust me to find commercial scientific answers from News-Medical.net.

To start a conversation, please log into your AZoProfile account first, or create a new account.

Registered members can chat with Azthena, request quotations, download pdf's, brochures and subscribe to our related newsletter content.

A few things you need to know before we start. Please read and accept to continue.

Please check the box above to proceed.

Great. Ask your question.


                Azthena may occasionally provide inaccurate responses.
Read the full terms.
            

Terms


            While we only use edited and approved content for Azthena
            answers, it may on occasions provide incorrect responses.
            Please confirm any data provided with the related suppliers or
            authors. We do not provide medical advice, if you search for
            medical information you must always consult a medical
            professional before acting on any information provided.
        


            Your questions, but not your email details will be shared with
            OpenAI and retained for 30 days in accordance with their
            privacy principles.
        


            Please do not ask questions that use sensitive or confidential
            information.
        

Read the full Terms & Conditions.

Provide Feedback","{'href': 'https://www.news-medical.net', 'title': 'News-Medical'}","health"
"https://news.google.com/rss/search?q=women's+us+soccer","FAME FOR THREE: O'Reilly, Heath, Wondolowski elected to National Soccer Hall of Fame","https://www.frontrowsoccer.com/2025/11/13/fame-for-three-oreilly-heath-wondolowski-elected-to-national-soccer-hall-of-fame/","Fri, 14 Nov 2025 00:47:54 GMT","

Front Row Soccer


					www.frontrowsoccer.com				

Three former players who performed domestically and internationally for U.S. national teams, have been elected to the National Soccer Hall of Fame, the organization revealed on its website on Thursday.

Heather O'Reilly had an illustrious career with the USWNT.  (Andy Mead/YCJ Photo)

Three former players who performed domestically and internationally for U.S. national teams, have been elected to the National Soccer Hall of Fame, the organization revealed on its website on Thursday.

The trio was U.S. women's national team standouts Heather O'Reilly and Tobin Heath and Major League Soccer all-time scoring leader Chris Wondolowski.

All three were voted in on the Players' Ballot.

O'Reilly played 231 full internationals between 2002 and 2016. She was a member of the 2015 Women's World Cup championship side, and Olympic gold medals in 2004, 2008 and 2012.

Heath made 181 appearances for the USWNT. She performed three Women's World Cups, lifting the trophy in 2015 and 2019. She also competed in four Olympic soccer tournaments, winning gold in 2008 and 2012 and bronze in 2021.

A forward who retired as the leading goal scorer in Major League Soccer history, Wondolowski played 17 seasons in the league between 2005-21.

They will be inducted into the NSHOF in Frisco, Texas on May 1, 2026.

There likely will be more inductees soon.

For more information, visit https://www.nationalsoccerhof.com/



Front Row Soccer editor Michael Lewis has covered 13 World Cups (eight men, five women), seven Olympics and 28 MLS Cups. He has written about New York City FC, New York Cosmos, the New York Red Bulls and both U.S. national teams and has penned a soccer history column for the Guardian.com. Lewis, who has been honored by the Press Club of Long Island and National Soccer Coaches Association of America, is the former editor of BigAppleSoccer.com. He has written seven books about the beautiful game and has published ALIVE AND KICKING The incredible but true story of the Rochester Lancers. It is available at Amazon.com.","{'href': 'https://www.frontrowsoccer.com', 'title': 'Front Row Soccer'}","soccer"
"https://news.google.com/rss/search?q=women's+us+soccer","Heath, O'Reilly, Sanneh, Wondolowski among inductees to US Soccer Hall of Fame","https://sportstar.thehindu.com/football/us-national-soccer-hall-of-fame-induction-six-players-heath-o-reilly-usa-world-cup-olympic-gold-news/article70278400.ece","Fri, 14 Nov 2025 04:37:47 GMT","

Subscribers Only Have you subscribed yet?

Buy Print

Updated : Nov 14, 2025 10:04 IST , FRISCO  - 2  MINS  READ 


                Comments
            

Follow Us

SHARE

READ LATER

FILE PHOTO: Heather O'Reilly, a three-time Olympic gold medallist, was part of the USA's 2015 FIFA Women's World Cup-winning squad.
                                                   | Photo Credit: AP
                                          

Women's World Cup champions and Olympic gold medallists Tobin Heath and Heather O'Reilly were elected Thursday to the U.S. National Soccer Hall of Fame along with men's players Tony Sanneh and Chris Wondolowski.

Referee Kari Seitz also was elected along with Kevin Crow, known primarily for his time in indoor football.

They will be inducted on May 1 at the hall in Frisco, Texas.

O'Reilly, 40, was a forward and winger who scored 47 goals in 231 international appearances, helping the U.S. win the 2015 World Cup and Olympic gold medals in 2004, 2008 and 2012. 

She won league titles with Sky Blue in 2009 in Women's Professional Soccer and with Kansas City in 2015 and North Carolina in 2019 in the National Women's Soccer League.

Heath, 37, was a midfielder and forward who had 36 goals in 181 appearances, winning World Cup titles with the U.S. in 2015 and 2019 and Olympic gold medals in 2008 and 2012.

Wondolowski, 42, is Major League Soccer's career scoring leader with 171 regular-season goals and two in the playoffs, playing for San Jose (2005, 2009-21) and Houston (2006-09). He scored 11 goals in 35 international appearances, playing in two games at the 2014 World Cup.

A post shared by National Soccer Hall Of Fame (@soccerhof)

Sanneh, 54, was a defender who scored three goals in 43 international appearances, starting all five games for the U.S. at the 2002 World Cup as the Americans reached the quarterfinals in their farthest advancement since 1930. 

O'Reilly, Heath and Wondolowski were picked from the player ballot, while Sanneh and Crow were chosen from the veteran ballot.

Seitz, 55, refereed nine games at the Women's World Cup in 1999, 2003, 2007 and 2011 and six at the Olympics in 2004, 2008 and 2012. She became the U.S. Soccer Federation's vice president of referees in 2024.

Seitz was on the builder ballot, which this year included only referees. The top voter-getter is picked if receiving at least 50 per cent.


                Comments
            

Published on Nov 14, 2025


                    Tobin Heath
                
                        /                      
                    


                    USA
                
                        /                      
                    


                    US Soccer
                
                        /                      
                    


                    Major League Soccer
                

BACK TO TOP

Terms & conditions  |  Institutional Subscriber

Comments have to be in English, and in full sentences. They cannot be abusive or personal. Please abide to our community guidelines for posting your comment","{'href': 'https://sportstar.thehindu.com', 'title': 'Sportstar'}","soccer"
