"Input URL","Title","Link","Published","Description","Source","Category"
"https://news.google.com/rss/search?q=world+news+site:cnn.com","Chinese astronauts head home after suspected debris strike delays return to Earth","https://www.cnn.com/2025/11/13/china/shenzhou-20-crew-return-earth-intl-hnk","Fri, 14 Nov 2025 03:22:00 GMT","


            Three Chinese astronauts landed back on Earth on Friday, according to state media, more than a week later than their scheduled landing, capping an extended stay in space after a suspected debris hit left their spaceship with a cracked window.
    


            After the capsule hatch opened medical teams found that the astronauts were in good physical condition, Chinese state media outlet CCTV reported.
    


            The crew of the Shenzhou-20 spaceflight had been due to finish their mission at China's Tiangong space station last Wednesday; they'd even handed the keys to the space station to a new crew who had just arrived for their own six-month mission.
    


            But instead, their journey home was postponed “due to a suspected impact from tiny space debris” to their ship, according to state-run news agency Xinhua.
    


            After a nine-day wait, they finally headed home on the Shenzhou-21 spacecraft that transported the incoming crew, according to the China Manned Space Agency (CMSA).
    


            The damaged Shenzhou-20 ship had “a slight crack” in the window of its return capsule, likely caused by debris impact, making it unsafe for the crew to return in, according to the CMSA. The ship will stay in orbit to carry out experiments instead, the agency said.
    


            During their extra week in space, the crew continued working and living alongside the newly arrived Shenzhou-21 astronauts, as the space station has enough capacity to support two crews in orbit, according to Xinhua.
    


            The Tiangong station is only one of two operating space stations, alongside the International Space Station. Since it was completed in 2022, the biannual launches of China's Shenzhou program have been a source of national pride.
    


            Recent advances have seen China break an American-held record for the longest spacewalk, with a nine-hour sortie, and it's about to open the doors of the Tiangong to foreigners for the first time, with plans to welcome an astronaut from Pakistan next year.
    


            The new crew on board the Shenzhou-21 – who are now without a spaceship to return in – include China's youngest astronaut to be sent to space, 32-year-old Wu Fei.
    


            The Shenzhou-22, due to launch sometime next year, will include one astronaut who stays more than a year for a “long-duration residency experiment,” Xinhua reported.
    


            China's rapid development in space exploration has raised alarm bells in Washington, which is racing to put an astronaut on the moon again. The Trump administration placed bans on Chinese citizens with US visas participating in NASA programs.
    


            The US space agency is familiar with the difficulties of retrieving astronauts stuck in space. What was meant to be a short stay on the International Space Station stretched into a more than nine-month mission for two American astronauts earlier this year after their spacecraft malfunctioned. They eventually returned home in March.
    


            Both countries are also competing in nascent institution-building efforts, with the US-led Artemis Accords on lunar exploration matched up against the Chinese- and Russian-led International Lunar Research Station.
    


  CNN's Chris Lau and Hassan Tayir contributed reporting.


© 2025 Cable News Network. A Warner Bros. Discovery Company. All Rights Reserved.  CNN Sans ™ & © 2016 Cable News Network.","{'href': 'https://www.cnn.com', 'title': 'CNN'}","world"
"https://news.google.com/rss/search?q=world+news+site:cnn.com","South Korea bans flights as 500,000 take crucial university admission test","https://www.cnn.com/2025/11/13/asia/south-korea-exam-flights-intl-hnk","Fri, 14 Nov 2025 02:10:00 GMT","


            More than half a million people in South Korea sat for the country's grueling university entrance exam on Thursday as police mobilized to ensure they made it to the test sites on time and all flights were halted for half an hour.
    


            The number sitting the test, essential to secure a place at the country's top universities, was the highest in seven years. Most of the candidates were born in 2007 when there was a surge in births because it was considered an auspicious time to have a baby.
    


            Flights at all airports, including Incheon International Airport, were banned from landing or takeoff between 1:05 p.m. and 1:40 p.m. to ensure there was no disturbance while the students sat for the listening comprehension section of the English test.
    


            The decision affected 140 flights, including 65 international arrivals and departures. Flight trackers showed aircraft circling near airports as the Transport Ministry restricted aircraft from altitudes below 3,000 meters (9843 ft).
    


            Financial markets and offices opened an hour later than usual to ensure test candidates arrived on time for the nine-hour exam that is seen as crucial for success in the hyper-competitive society.
    


            “This exam has been a goal for nearly 20 years and also a new beginning,” said Yeseon Kim, who was waiting outside a test site where her daughter was sitting the exam.
    


            A total of 554,174 people registered this year, up 6% from last year and the highest since 2019. Some 496,000 babies were born in 2007 in a jump that paused a steady decline since the mid-1990s.
    


            South Korea is one of the world's fastest-aging societies, although its birthrate rose to 0.75 in 2024.
    

© 2025 Cable News Network. A Warner Bros. Discovery Company. All Rights Reserved.  CNN Sans ™ & © 2016 Cable News Network.","{'href': 'https://www.cnn.com', 'title': 'CNN'}","world"
"https://news.google.com/rss/search?q=world+news+site:cnn.com","Israel identifies deceased hostage returned by Hamas as Manny Godard","https://www.cnn.com/2025/11/13/middleeast/deceased-israeli-hostage-identified-latam-intl","Fri, 14 Nov 2025 00:01:00 GMT","


            The Israeli government identified the deceased hostage whose remains were handed over by Hamas on Thursday as Manny Godard, 73, an Israeli resident of a kibbutz near the Gaza Strip.
    


            Godard and his wife Ayelet were killed during the October 7, 2023, Hamas attack on Israeli communities near the Strip. His body was then taken to Gaza.
    


            During the attack, Godard and his wife hid in the safe room of their home in Be'eri Kibbutz. They later fled after their house was set on fire, and the attackers “ambushed them outside,” the Hostages and Missing Families Forum said in a statement Thursday. After the father of four was killed, “Ayelet hid in the bushes for several hours before she was also murdered,” the forum added.
    


            Godard spent his childhood on Israeli beaches alongside his father, who was a lifeguard, the forum said. Later, Godard also became a lifeguard, the group said.
    


            Israel's National Center of Forensic Medicine confirmed his identity after his remains were released by Hamas to the International Committee of the Red Cross and then turned over to Israeli authorities. The handover leaves three remaining deceased hostages in the Gaza Strip.
    


            Israel is “determined, committed and tirelessly working to bring back all of our fallen hostages for a proper burial in their homeland,” the prime minister's office said in a statement announcing the identification of Godard.
    


            In a transfer that was part of a US-brokered ceasefire agreement, Israel earlier said it received a coffin containing the remains via the Red Cross in Gaza and transported them to Israel's national forensics laboratory for identification. Hamas did not identify which of the last few deceased hostages it was handing over.
    


            Hamas' military wing said earlier Thursday that it would hand over the body of an Israeli found near Khan Younis in southern Gaza.
    


            This release of remains comes after a series of such transfers last week, including that of the longest-held deceased hostage in Gaza. On Sunday, Hamas handed over the remains of Lt. Hadar Goldin, who was killed in the final days of a 2014 conflict between Israel and Hamas. The transfer of Goldin's remains was the fifth such occurrence in little more than a week, bringing Hamas down to the final few deceased hostages still in Gaza.
    


Israeli intelligence has assessed that Hamas may not be able to find and return all the remaining dead hostages in Gaza. But Hamas has continued to search for remains in different parts of Gaza.
    


            The Hostages and Missing Families Forum has continued to organize rallies in Tel Aviv and elsewhere across Israel calling for the release of the remaining deceased hostages.
    


            Eitan Horn, who was recently freed after 738 days in captivity, said in Hostages Square last weekend: “I cannot begin my journey of healing and recovery as long as I know there are families who are not with me on this journey. We have no future without the return of all the hostages.”
    


            Other freed hostages have expressed the same sentiment, saying they cannot begin to heal until all of the hostages – living and deceased – have returned home.
    


  Mohammed Tawfeeq in Atlanta contributed to this report.


© 2025 Cable News Network. A Warner Bros. Discovery Company. All Rights Reserved.  CNN Sans ™ & © 2016 Cable News Network.","{'href': 'https://www.cnn.com', 'title': 'CNN'}","world"
"https://news.google.com/rss/search?q=world+news+site:rt.com","Colombian leader labels Trump ‘barbarian' over Caribbean strikes","https://www.rt.com/news/627772-petro-calls-trump-barbarian/","Fri, 14 Nov 2025 02:51:00 GMT","

Colombian President Gustavo Petro has denounced the US strikes on alleged cartel vessels in the Caribbean Sea as the Pentagon announced a new operation to fight drug traffickers.

Colombia has historically cooperated with the US on security matters, particularly in dealing with Venezuelan President Nicolas Maduro's government and fighting drug trafficking, although their policy alignment has recently shifted under Petro, a former M-19 Marxist guerrilla. 

In an interview with NBC News, Petro did not mince words when criticizing US President Donald Trump. “He's a barbarian,” Petro said in excerpts aired Thursday. “He wants to frighten us,” he added.

The Colombian president did not rule out that some of the vessels hit by the strikes were linked to cartels. “Maybe or maybe not. We do not know,” he said, adding that, “According to due process, the civilized treatment of people, they should be seized and detained.”

Petro described the victims as “poor boatmen” hired by cartels. “Then when one of those missiles arrives [it] kills that boatman. It doesn't kill the drug trafficker,” he said. He previously said that at least some of the victims were ordinary fishermen not involved with organized crime.

The US imposed sanctions on Petro last month after Trump labeled him “a drug leader.” Colombia restricted intelligence-sharing with the US this week, although Interior Minister Armando Benedetti later clarified that Bogota would continue cooperating with US federal agencies, including the Drug Enforcement Administration and the FBI.

The US has hit at least 20 boats since September, killing an estimated 80 people. US Secretary of War Pete Hegseth announced Thursday the launch of Operation Southern Spear against “narcoterrorists” in the region.

CNN reported that as part of the operation, Trump had been briefed on target options in Venezuela; he has accused Maduro of helping cartels smuggle drugs into the US.

RT News App

© Autonomous Nonprofit Organization “TV-Novosti”, 2005–2025. All rights reserved.

This website uses cookies. Read RT Privacy policy to find out more.","{'href': 'https://www.rt.com', 'title': 'rt.com'}","world"
"https://news.google.com/rss/search?q=world+news+site:tass.com","Britain stops sharing intelligence with US on recommendation of attorney general — Times","https://tass.com/world/2043555","Fri, 14 Nov 2025 00:09:16 GMT","

LONDON, November 14. /TASS/. The British intelligence services and the military have stopped providing the United States with intelligence on the movement of ships in the Caribbean on recommendation of Attorney General for England and Wales Richard Hermer, The Times reported citing sources.

According to them, Hermer fears an international lawsuit against the UK over its involvement in the US strikes on ships in the Caribbean. Earlier, the British shared with the Americans the coordinates of the boats, on which drugs were allegedly transported, as well as data on the number of people on board. CNN was the first to report on November 12 that the United Kingdom had stopped providing the intelligence.

According to the newspaper, the recommendations indicated that the UK had signed up to stricter rules of conduct in international waters than the United States, and could be considered complicit in what the UN called ""extrajudicial executions.""

The government declined to comment saying only that the United States remains Britain's closest partner in defense, security and intelligence matters.

Washington accuses Venezuela of not actively fighting drug smuggling. The US Navy has deployed eight ships, one nuclear submarine, and more than 10,000 troops in the Caribbean Sea and is destroying high-speed boats in international waters, allegedly involved in drug smuggling from Venezuela.

According to The New York Times, US President Donald Trump has authorized the CIA to conduct covert operations in Venezuela. The American media has repeatedly reported that the United States may soon begin attacking drug cartel facilities in Venezuela. However, on October 31, Trump said he was not considering attacks on Venezuelan territory.","{'href': 'https://tass.com', 'title': 'tass.com'}","world"
"https://news.google.com/rss/search?q=world+news+site:tass.com","Swedish SVT, like BBC, edited Trump's speech — newspaper","https://tass.com/world/2043587","Fri, 14 Nov 2025 03:19:57 GMT","

STOCKHOLM, November 14. /TASS/. Swedish TV channel SVT, like the British broadcasting corporation BBC, edited Donald Trump's speech of January 6, 2021 to create the impression that he was calling for riots, Kvartal newspaper reported.

According to the newspaper, last year SVT used an excerpt from Trump's speech, which spliced several parts in one of the reports in such a way that it appeared to the audience that Trump was in favor of storming the Capitol. Like in the BBC version, a fragment where he calls on his supporters to peacefully and patriotically express their opinions was dropped.

In the first response to Kvartal's request for comment on how the speech was edited, SVT responded that the TV channel's owners were ""confident in SVT's publications dedicated to the storming of the Capitol."" But later SVT changed the text and the clip, where black frames with pauses between different parts of the performance were added. Executive producer Karin Ekman said that SVT has updated the text of the clip ""to make it clearer to the audience in what context it was published."" She does not believe that the scandal with the BBC will affect SVT's credibility.

Norwegian TV channel NRK has also changed the story about Capitol storming previously presented similarly, explains SVT.

The BBC was at the center of a scandal over a Panorama program, which the broadcasting corporation aired last October. In it, Trump's speech was doctored in a way that it can be concluded that he is calling for the seizure of the Congress building. The scandal forced CEO Tim Davey and head of news Deborah Turness to resign. Trump demanded that the BBC remove the program by November 14, apologize and pay compensation, threatening to sue for $1 billion. The corporation apologized, but refused to pay compensation.","{'href': 'https://tass.com', 'title': 'tass.com'}","world"
"https://news.google.com/rss/search?q=world+news+site:tass.com","North Korean foreign minister calls G7 appeal for denuclearization hostile machinations","https://tass.com/world/2043567","Fri, 14 Nov 2025 01:12:10 GMT","

SEOUL, November 14. /TASS/. North Korean Foreign Minister Choe Son Hui has denounced the appeal of the foreign ministers of the Group of Seven (G7) states to denuclearize calling it hostile machinations, according to the Central Telegraphic Agency of Korea (KCNA).

""I express my complete dissatisfaction and regret over the outright hostile machinations of the G7 foreign ministers, which are a direct encroachment on the constitution of our state,"" she said, referring to a joint G7 foreign ministers' statement issued after their meeting in Canada.

North Korean nuclear status is specified in its constitution.

She called the G7's desire for denuclearization a manifestation of ""inertia of thought"" because the international community ""understands its impossibility.""

""No one has the right to force us to violate the constitution, and no one can try to change it,"" Choe Son Hui said.

""The current status of the DPRK will not change under the influence of external rhetoric and insistence, in today's harsh geopolitical environment, the possession of nuclear weapons is the most accurate choice to deter the most dangerous states.""

Choe Son Hui called on the international community to pay attention to the threat to peace and security from the Group of Seven, which she called a ""nuclear alliance."" She reiterated that North Korea will possess nuclear weapons until ""the nuclear threat from external forces is put an end to, as long as there are forces that consider nuclear weapons to be a means of their tyranny.""","{'href': 'https://tass.com', 'title': 'tass.com'}","world"
